Campeonato:,Campeonato Brasileiro - Série C/2019,,Rodada:,11
Jogo:,Luverdense / MT X São José / RS,,,
Data:,06/07/2019 Horário: 18:00 Estádio:,Passo das Emas / Lucas do Rio Verde,,
"",,Arbitragem
Arbitro:,Luiz Claudio Sobral (CD / PE),
Arbitro Assistente 1:,Clovis Amaral da Silva (AB / PE),
Arbitro Assistente 2:,Karla Renata Cavalcanti de Santana (CD / PE),
Quarto Arbitro:,Leonardo Willers Lorenzatto (INT / MT),
Analista de Campo:,Edilson Ramos da Mata (CBF / MT),
"",,,Cronologia,,,
"",1o Tempo,,2o Tempo,,,
Entrada do mandante:,17:50Atraso:,,Não Houve Entrada do mandante: 19:00,,Atraso:,Não Houve
Entrada do visitante:,17:50Atraso:,,Não Houve Entrada do visitante: 19:00,,Atraso:,Não Houve
Início 1o Tempo:,18:01Atraso:,,1 min Início do 2o Tempo: 19:02,,Atraso:,Não Houve
Término do 1o Tempo:,18:47Acréscimo:,,1 min Término do 2o Tempo: 20:10,Acréscimo:,,4 min
Resultado do 1o Tempo: 0 X 0,,,Resultado Final: 0 X 0,,,
"",,,,,Relação de Jogadores,,,,
"",,Luverdense / MT,,,,São José / RS,,,
No,Apelido,Nome Completo T/R,,P/A,CBF No Apelido,Nome Completo T/R,,P/A,CBF
1,Edson,Edson Oliveira Barreto T(g),,P,334836 1 Fábio,Fabio Jose Rampi T(g),,P,181804
2,Pedro,Pedro Henrique Vieir ... T,,P,401976 2 Marcio,Marcio Lima da Silva T,,P,182323
3,Luiz Eduardo,Luiz Eduardo Felix d ... T,,P,314464 3 Rafael,Rafael Mattos dos Santos T,,P,304280
4,Lucas,Lucas Gama Moreira T,,P,389903 4 Lucas,Lucas Jaques Varone Maia T,,P,360603
5,Lorran,Lorran Rosendo Range ... T,,P,310725 5 Tiago,Tiago de Souza Nascimento T,,P,184800
6,Jerfferson,Jerfferson de Kassio ... T,,P,383914 6 Eduardo,Eduardo Mandai Rodrigues T,,P,348432
7,Gabriel,Gabriel Honorio Ramos T,,P,448286 7 Matheus,Matheus da Silva Fortes T,,P,432101
8,Fabio,Fabio Kaue Pires T,,P,408115 8 Karl,Karl Cachoeira Della ... T,,P,350223
9,Tozim,Welliton de Moraes C ... T,,P,162890 9 Luiz Eduardo,Luiz Eduardo Azevedo ... T,,P,162692
10,Juninho Ta ...,Jose Tadeu Martins Junior T,,P,178966 10 Rafa,Rafael Aparecido de  ... T,,P,177093
11,Anderson L ...,Anderson Rodrigues da Luz T,,P,356564 11 Claudio,Claudio Oliveira de Souza T,,P,347321
12,Rafael Rob ...,Rafael Roballo Maciel R(g),,P,187908 12 Igor,Igor Jose Bohn R(g),,P,297646
13,Kaique,Kaique Rizzi Keller R,,P,414945 13 Josue,Josue Nicholas de Ol ... R,,P,442103
14,Raphael,Raphael Rodrigues Borges R,,P,542573 14 Everton,Everton Paulo Strieder R,,P,302881
15,Evandro,Evandro Rodrigues Fl ... R,,P,331411 15 Wagner,Wagner Luiz Fogolari R,,P,184775
16,Talvanes,Talvanes Marcelino d ... R,,P,539611 16 Machado,Luiz Filipe da Rosa  ... R,,P,383537
17,Igor,Igor Leandro Goulart ... R,,P,411295 17 Carrilho,Rafael Carrilho Delvaux R,,P,347208
18,Samuel,Samuel de Carvalho A ... R,,P,168529 18 Everton Ju ...,Everton Luiz Ferrao  ... R,,P,335478
19,Douglas,Douglas Felisbino de ... R,,P,305718 19 Tiago,Tiago de Araujo da Silva R,,P,519630
"",,Comissão Técnica,
"",Luverdense / MT,,São José / RS
Técnico:,Dilceu Rocha Junior,Técnico:,Rafael Jaques
Auxiliar Técnico:,Maico Gregori Farias,Auxiliar Técnico:,Everton De Paula Vanoni
Médico:,Paulo Roberto Marques Junior,Médico:,Jose Gomes De Oliveira
Treinador De Goleiros:,Luciano Donizeti Nunes Alexandre,Preparador Físico:,Martinho Do Prado Inacio
Preparador Físico:,Rafael Fabiano Rossetto Oliveira,Fisioterapeuta:,Vasyl Custodio Saciura
Massagista:,Antonio Francisco Da Silva,,
"",,,,Cartões Vermelhos
Tempo 1T/2T,No,,Nome do Jogador,
26:00 2T,5,,Lorran Rosendo Rangel Soares - Luverdense/MT,
2o Cartão Amarelo,,,"Motivo: V2.8.  Outro motivo (detalhar no campo expulsões) - Expulsei aos 26 minutos do segundo tempo, pelo segundo cartão",
"",,,"amarelo, o sr. lorran rosendo rangel soares no 5 da equipe do luverdense esporte clube, por calçar seu adversário, sr. tiago de souza",
"",,,"nascimento no 5, de maneira temerária atingindo-o nas pernas, na disputa da bola. informo que o atleta atingido não necessitou de",
"",,,"atendimento médico e permaneceu normalmente na partida, o atleta expulso deixou o campo sem causar problemas e já havia sido",
"",,,advertido anteriormente por calçar seu adversário de maneira temerária na disputa da bola.,
"",,,Substituições,
Tempo,1T/2T,Equipe,Entrou,Saiu
11:00,2T,Luverdense/MT,14 - Raphael Rodrigues Borges,3 - Luiz Eduardo Felix da Costa
26:00,2T,Luverdense/MT,17 - Igor Leandro Goularte do Nas...,11 - Anderson Rodrigues da Luz
28:00,2T,Luverdense/MT,15 - Evandro Rodrigues Florencio,10 - Jose Tadeu Martins Junior
30:00,2T,São José/RS,16 - Luiz Filipe da Rosa Machado,5 - Tiago de Souza Nascimento
39:00,2T,São José/RS,18 - Everton Luiz Ferrao de Olive...,11 - Claudio Oliveira de Souza
40:00,2T,São José/RS,17 - Rafael Carrilho Delvaux,10 - Rafael Aparecido de Paulo Ta...
