"",Arbitragem
Arbitro:,José Reinaldo Figueiredo da Silva Filho (CBF-2 / AL)
Arbitro Assistente 1:,Rodrigo Guimarães Pereira (CBF-2 / SE)
Arbitro Assistente 2:,Wendel Augusto Lino de Jesus Melo (CBF-2 / SE)
Quarto Arbitro:,Cosme Iran Sabino Araujo (CBF-2 / BA)
Assessor:,Belmiro da Silva (ASS / BA)
"",,,Cronologia,,,
"",1o Tempo,,2o Tempo,,,
Entrada do mandante:,15:46Atraso:,,Não Houve Entrada do mandante: 16:57,Atraso:,,Não Houve
Entrada do visitante:,15:47Atraso:,,Não Houve Entrada do visitante: 16:58,Atraso:,,Não Houve
Início 1o Tempo:,16:00 Atraso:,,Não Houve Início do 2o Tempo: 17:00,Atraso:,,Não Houve
Término do 1o Tempo:,16:45 Acréscimo:,,Não Houve Término do 2o Tempo: 17:48,Acréscimo:,,3 min
Resultado do 1o Tempo: 0 X 2,,,Resultado Final: 0 X 2,,,
"",,,,Relação de Jogadores,,,
"",,Vitória da Conquista / BA,,,Globo / RN,,
No,Apelido,Nome Completo T/R P/A,,CBF No Apelido,Nome Completo,T/R P/A,CBF
12,Jose,Jose Moreira Rocha Neto T,P,163928 1 Mecinho,Jamerson Michel da Costa,T P,333168
2,Adriano,Adriano da Silva de  ... T,P,346928 2 Geovane,Geovane da Silva Bez...,T P,365792
3,Mota,Jeusival Ferreira do ... T,P,315623 3 Mercinho,Emerson de Sousa Silva,T P,151885
4,Silvio,Silvio da Silva Almeida T,P,149612 4 Robson,Robson Freitas da Silva,T P,126203
5,Joao,Joao Alvaro Lacerda  ... T,P,364461 5 Ramon,Ramon Gabriel Santos...,T P,184882
6,William,William Fernandes Santos T,P,340752 6 Nininho,Jose de Arimateia Si...,T P,291689
7,Edimar,Edimar Farias Santos T,P,181838 7 Joziclrey,Jozicley Souza Filgueira,T P,151607
8,Maicon,Maicon Santos Costa T,P,371820 8 Miller,Miller Rodrigues Barbosa,T P,292000
9,Erick,Erick Romao dos Sant ... T,P,401860 9 Vagner,Vagner Paulo da Silva,T P,169376
10,Rafa,Rafael Menezes da Cruz T,P,175828 10 Ricardo,Ricardo Lopes Pereira,T P,301030
11,Gabriel,Gabriel Maia Lima T,P,371802 11 Renato,Renato Cesar Barbosa...,T P,155843
1,Niltom,Niltom Santos dos Reis R,P,371817 12 Frank,Madson Franklin Ferr...,R P,347620
13,Tulio,Tulio Augusto Souza  ... R,A,411972 13 Glaubert,Glaubert Lopes da Cruz,R P,318433
14,Caio,Caio Breno Santana Sousa R,P,371043 14 Anselmo,Anselmo Honorato de ...,R P,186594
15,Tales,Tales Emanuel Merces ... R,A,393864 15 Leomir,Leomir Lucena da Silva,R P,188135
16,Dionisio,Dionisio Pereira de  ... R,P,350705 16 Alemão,Emerson Goncalves do...,R P,292969
17,Lucas,Lucas Chaves Silva R,A,372186 17 Odaildo,Odaildo Souza de Oli...,R P,314310
18,Marcos,Marcos Aguiar Silva R,P,372183 18 Romário,José Romário Silva d...,R P,413857
19,Rafael Dia ...,Rafael Dias Bomfim R,A,460140,,,
"",,Comissão Técnica,
"",Vitória da Conquista / BA,,Globo / RN
Tecnico:,Guilhermino Lima Dos Santos - 384934382,Tecnico:,Higor Cesar Trajano De Araujo - 1678208SSP-RN
Auxiliar Tecnico:,Ausente - 00,Auxiliar Tecnico:,Jean Robson Barros - 1201-CREF RN
Medico:,Aloisio Alan Costa Fernandes - 14284-,Medico:,Gabriela Brandão - 25553-BA
Preparador Fisico:,Gênesis Oliveira Rocha - 7779-G/BA,Preparador Fisico:,Adriano Galdino De Souza - 2717-CREF RN
Massagista:,Pedro Aguiar De Oliveira - 1469952017,Massagista:,Daniel Lopes Da Silva - 1658821SSP-PI
"",,,,,Gols,
Tempo,1T/2T,No,Tipo,Nome do Jogador,,Equipe
11:00,1T,10,NR,Ricardo Lopes Pereira,,Globo/RN
15:00,1T,9,NR,Vagner Paulo da Silva,,Globo/RN
"",,,Substituições,
Tempo,1T/2T,Equipe,Entrou,Saiu
45:00,INT,Vitória da Conquista/BA,16 - Dionisio Pereira de Souza ...,5 - Joao Alvaro Lacerda Ferra ...
45:00,INT,Vitória da Conquista/BA,18 - Marcos Aguiar Silva,9 - Erick Romao dos Santos Vi ...
17:00,2T,Globo/RN,14 - Anselmo Honorato de Sousa ...,6 - Jose de Arimateia Silva d ...
30:00,2T,Globo/RN,17 - Odaildo Souza de Oliveira ...,9 - Vagner Paulo da Silva
36:00,2T,Globo/RN,16 - Emerson Goncalves dos San ...,11 - Renato Cesar Barbosa Cout ...
