"",,Arbitragem
Arbitro:,Joao Lupato (CBF-1 / MS),
Arbitro Assistente 1:,Edmilson da Silva Rodrigues (CBF-2 / MS),
Arbitro Assistente 2:,Sérgio Alexandre da Silva (CBF-2 / MS),
Quarto Arbitro:,Bruno Rezende Silva (CBF-2 / GO),
Delegado  Especial:,Júlio César Mota Fernandes (000 / GO),
"",,,Cronologia,,,
"",1o Tempo,,2o Tempo,,,
Entrada do mandante:,15:50Atraso:,,Não Houve Entrada do mandante: 17:03,Atraso:,,Não Houve
Entrada do visitante:,15:50Atraso:,,Não Houve Entrada do visitante: 17:01,Atraso:,,Não Houve
Início 1o Tempo:,16:00 Atraso:,,Não Houve Início do 2o Tempo: 17:04,Atraso:,,Não Houve
Término do 1o Tempo:,16:49 Acréscimo:,,4 min Término do 2o Tempo: 17:53,Acréscimo:,,4 min
Resultado do 1o Tempo: 0 X 1,,,Resultado Final: 1 X 1,,,
"",,,,Relação de Jogadores,,,
"",,Goianesia / GO,,,Luziania / DF,,
No,Apelido,Nome Completo,T/R P/A,CBF No Apelido,Nome Completo T/R P/A,,CBF
1,Leandro,Leandro Silva Nascimento,T P,186245 1 Edmar,Edmar da Silva Oliveira T,P,187833
2,Samuel,Samuel Henrique Alves,T P,311943 3 Carlos Alb ...,Carlos Alberto Ferre... T,P,139769
3,Roni,Roni Flavio Mantovam,T P,139342 4 Perivaldo,Erivaldo Rocha dos Anjos T,P,155227
4,Wilson,Wilson Roberto Roman ...,T P,328933 5 Natanael,Natanael Gomes do Na... T,P,301847
5,Guilherme,Guilherme Favoni,T P,301381 6 Rafinha,Francisco Rafael Alv... T,P,166755
6,Maycon,Maycon Valeriano de  ...,T P,322209 7 Thompson,Thompson Jose de Car... T,P,170227
7,Elias,Elias Augusto de Souza,T P,431764 9 Chefe,Ewerton Emmanuel Mir... T,P,162347
8,Rafael,Rafael Barbosa dos S ...,T P,338775 10 Alan,Allan Rodrigues Nunes T,P,292005
9,Nonato,Raimundo Nonato de L ...,T P,129927 11 Wagner,Wagner Luiz da Silva T,P,140795
10,Tarcisio,Tarcisio Rezende Abadia,T P,302089 15 David,David Euripedes Marq... T,P,184419
11,Fernando,Fernando Luiz de Sa  ...,T P,182369 19 Didão,Adriano Barbosa de O... T,P,151746
12,Walisson,Walisson Aparecido d ...,R P,131173 2 Lucas,Lucas Garcia de Souza R,P,334201
13,Mateus,Mateus dos Santos No ...,R P,315052 8 Walmer,Walmer Rodrigues Mendes R,P,171787
14,Elismar,Elismar Dorneles Silva,R P,302533 12 Jean,Jean Carlos Silva R,P,346047
15,Dodô,Douglas Maradona Cam ...,R P,300201 13 Ewerton,Ewerton Nogueira Ávila R,P,309941
16,Cassio,Cassio Luiz Viana da ...,R P,353042 14 Luis Adauto,Luis Adauto Amorim G... R,P,345360
17,Pedro,Pedro Jose Dorneles  ...,R P,322999 16 Danillo,Danillo Ribeiro Cardoso R,P,303003
18,Tassio,Tassio Batista Silva,R P,386961 17 Romario Au ...,Romario Augusto da S... R,P,382737
19,Robson,Robson Silva de Assis,R P,182844 18 Eder,Eder Ferreira Pinheiro R,P,159621
20,Vinicius,Vinicius Muniz Ribeiro,R P,302301,,,
"",,Comissão Técnica,
"",Goianesia / GO,,Luziania / DF
Tecnico:,Honorato Jorge Saran - 144020671,Tecnico:,Ricardo Antonio De Souza Silva - M 1701570
Auxiliar Tecnico:,Admar Gregorio Ferreira - 1077658567,Auxiliar Tecnico:,Carlos Roerto Da Costa - 960004
Medico:,. - .,Medico:,Inacio Haroldo D ?abadia - 6000
Preparador Fisico:,Osvaldo Da Silva Filho - 04120,Preparador Fisico:,Gabriel Das Chagas Moizes - 006633-G/MG
Massagista:,Anderson Jose Da Silva Leme - 297705295,Massagista:,Manoel Augusto Miranda - MG 17005643
"",,,,,Gols,
Tempo,1T/2T,No,Tipo,Nome do Jogador,,Equipe
10:00,1T,5,NR,Natanael Gomes do Nascimento,,Luziania/DF
26:00,2T,9,NR,Raimundo Nonato de Lima Ribeiro,,Goianesia/GO
"",,,Substituições,
Tempo,1T/2T,Equipe,Entrou,Saiu
45:00,INT,Goianesia/GO,19 - Robson Silva de Assis,11 - Fernando Luiz de Sa Junio ...
45:00,INT,Goianesia/GO,15 - Douglas Maradona Campos D ...,6 - Maycon Valeriano de Olive ...
10:00,2T,Luziania/DF,2 - Lucas Garcia de Souza,5 - Natanael Gomes do Nascime ...
18:00,2T,Luziania/DF,17 - Romario Augusto da Silva  ...,10 - Allan Rodrigues Nunes
27:00,2T,Luziania/DF,18 - Eder Ferreira Pinheiro,9 - Ewerton Emmanuel Miranda  ...
29:00,2T,Goianesia/GO,13 - Mateus dos Santos Nogueir ...,9 - Raimundo Nonato de Lima R ...
