Campeonato:,Campeonato Brasileiro - Série D/2020,Rodada:,Volta
Jogo:,Real Noroeste F. C. / ES X Aquidauanense / MS,,
Data:,06/09/2020 Horário: 15:00 Estádio: José Olimpio da Rocha / Aguia Branca,,
"",Arbitragem
Arbitro:,Emerson de Almeida Ferreira (AB / MG)
Arbitro Assistente 1:,Pablo Almeida da Costa (AB / MG)
Arbitro Assistente 2:,Leonardo Henrique Pereira (AB / MG)
Quarto Arbitro:,Rudimar Goltara (CD / ES)
Delegado Local:,Raphael Martins Penitente (CBF / ES)
Analista de Campo:,Carlos Eduardo do Rosário Depizzol (CBF / ES)
"",,,Cronologia,,,
"",1o Tempo,,2o Tempo,,,
Entrada do mandante:,14:49Atraso:,,Não Houve Entrada do mandante: 16:02,,Atraso:,Não Houve
Entrada do visitante:,14:50Atraso:,,Não Houve Entrada do visitante: 16:02,,Atraso:,Não Houve
Início 1o Tempo:,15:00Atraso:,,Não Houve Início do 2o Tempo: 16:03,,Atraso:,Não Houve
Término do 1o Tempo:,15:48Acréscimo:,,3 min Término do 2o Tempo: 16:51,Acréscimo:,,3 min
Resultado do 1o Tempo: 1 X 1,,,Resultado Final: 3 X 1,,,
"",,,,,Relação de Jogadores,,,,
"",,Real Noroeste F. C. / ES,,,Aquidauanense / MS,,,,
No,Apelido,Nome Completo T/R,,P/A,CBF No Apelido Nome Completo,T/R,,P/A,CBF
1,Marcelo,Marcelo Pereira Sousa T(g),,P,424802 1 Paulo Paulo Henrique de So ...,T(g),,P,544533
2,Geronimo,Geronimo dos Santos  ... T,,P,175741 2 HUDSON Hudson Maxsandro Bas ...,T,,P,606117
3,Matheus,Matheus Anunciacao C ... T,,P,606014 3 Rodrigo Rodrigo Santana Wada ...,T,,P,564656
4,Alyson,Jose Alyson dos Sant ... T,,P,346384 4 ILLGNER FE ... Illgner Bispo Ferraz,T,,P,619294
5,Leo,Leandro Assis de Santana T,,P,306864 5 Douglas Fi ... Douglas Firmino da Silva,T,,P,609245
6,Wendel,Wendel Conceiçao dos ... T,,P,412130 6 Gabriel Gabriel Henrique Sil ...,T,,P,504592
7,MAEL,Mael Lima Neves Silva T,,P,308846 7 Matheus Matheus Luciano Barbosa,T,,P,586494
8,Gabriel Jo ...,Gabriel Jordan Santos T,,P,456594 8 Kaio Cesar Kaio Cesar Arvelino  ...,T,,P,612939
9,Jussimar,Jussimar Lima T,,P,343575 9 Castelhano João Pedro Campos Ag ...,T,,P,582670
10,Igor,Igor Oliveira Santos T,,P,328527 10 BRUNO CHAVEBSruno Chaves de Jesus,T,,P,608819
11,SANTI,Santiago Ariel Lopez ... T,,P,693197 11 Endrick Endrick Paz da Silva,T,,P,528913
12,Jose,Jose Augusto Pereira ... R(g),,P,305950 12 BRENO Breno Mohamed de Sou ... R(g),,,P,605879
13,Matheus,Matheus da Silva Barbosa R,,P,405612 13 WISLEY Wisleyan Evangelista ...,R,,P,608340
14,Bruno,Bruno Jose dos Santos R,,P,348235 14 Mateus Mateus Schneider dos ...,R,,P,501058
15,Jhonatan,Jhonatan Tomaz dos S ... R,,P,567158 15 JOAO Joao Guilherme Ramir ...,R,,P,589544
16,Patrick,Patrick dos Santos Silva R,,P,389106 16 LUCIANO LA ...Luciano Louveira Lar ...,R,,P,608815
17,Aloisio,Aloisio Pereira Magnago R,,P,169861 17 Kerman Men ... Kerman Mendes Pereir ...,R,,P,509629
18,Peixoto,João Peixoto de Carv ... R,,P,299896 18 gabriel Gabriel Oliveira Cam ...,R,,P,599771
19,Jacson,Jacson da Paixao Nep ... R,,P,188619,,,,
20,SER,Sergio Fernando Alle ... R,,P,692822,,,,
21,JEFERSON,Jeferson David Palac ... R,,P,686293,,,,
22,Warlison,Warlison Coutinho Vasques R,,P,528704,,,,
23,Wesley,Wesley Manoel dos Santos R,,P,595610,,,,
"",,Comissão Técnica,
"",Real Noroeste F. C. / ES,,Aquidauanense / MS
Técnico:,Ednaldo Oliveira Dos Reis,Técnico:,Mauro Marino De Oliveira
Auxiliar Técnico:,Fabio Junior Vieira,Auxiliar Técnico:,Eriberto De Freitas
Médico:,Jose Cipriano Da Fonseca,Médico:,Frederico Louveira Ayres
Treinador De Goleiros:,Danilo De Jesus Dos Santos,Treinador De Goleiros:,José Luis Cardoso
Massagista:,Domingos Souza Barcelos,Preparador Físico:,Victor Jose Maia Lellis
"",,,,,Gols,
Tempo,1T/2T,No,Tipo,Nome do Jogador,,Equipe
25:00,1T,8,NR,Kaio Cesar Arvelino Barros,,Aquidauanense/MS
30:00,1T,11,CT,Endrick Paz da Silva,,Aquidauanense/MS
25:00,2T,3,CT,Rodrigo Santana Wadamori Boeira,,Aquidauanense/MS
32:00,2T,18,NR,João Peixoto de Carvalho Neto,,Real Noroeste F. C./ES
"",,,Substituições,
Tempo,1T/2T,Equipe,Entrou,Saiu
30:00,1T,Real Noroeste F. C./ES,17 - Aloisio Pereira Magnago,11 - Santiago Ariel Lopez Stockel
06:00,2T,Aquidauanense/MS,17 - Kerman Mendes Pereira Junior,11 - Endrick Paz da Silva
15:00,2T,Aquidauanense/MS,15 - Joao Guilherme Ramires de Av...,7 - Matheus Luciano Barbosa
15:00,2T,Real Noroeste F. C./ES,18 - João Peixoto de Carvalho Neto,5 - Leandro Assis de Santana
15:00,2T,Real Noroeste F. C./ES,19 - Jacson da Paixao Neponuceno,7 - Mael Lima Neves Silva
34:00,2T,Aquidauanense/MS,13 - Wisleyan Evangelista Silva d...,5 - Douglas Firmino da Silva
