"",Arbitragem
Arbitro:,Joelson Nazareno Ferreira Cardoso (CBF-2 / PA)
Arbitro Assistente 1:,Celso Luiz da Silva (CBF-1 / MG)
Arbitro Assistente 2:,Luiz Antonio Barbosa (CBF-2 / MG)
Quarto Arbitro:,Philip Georg Bennett (CBF-2 / RJ)
Assessor:,Edilson Soares da Silva (ASS / RJ)
Delegado Local:,Marcelo Carlos Nascimento Viana (000 / )
"",,,Cronologia,,,
"",1o Tempo,,2o Tempo,,,
Entrada do mandante:,21:35Atraso:,,Não Houve Entrada do mandante: 22:47,Atraso:,,Não Houve
Entrada do visitante:,21:35Atraso:,,Não Houve Entrada do visitante: 22:46,Atraso:,,Não Houve
Início 1o Tempo:,21:45 Atraso:,,Não Houve Início do 2o Tempo: 22:49,Atraso:,,Não Houve
Término do 1o Tempo:,22:34 Acréscimo:,,4 min Término do 2o Tempo: 23:39,Acréscimo:,,5 min
Resultado do 1o Tempo: 0 X 1,,,Resultado Final: 1 X 1,,,
"",,,,Relação de Jogadores,,,
"",,Vasco da Gama / RJ,,,Santa Cruz / PE,,
No,Apelido,Nome Completo T/R P/A,,CBF No Apelido,Nome Completo T/R P/A,,CBF
1,Martin And ...,Martin Andres Silva  ... T,P,459582 1 Tiago Card ...,Tiago Cardoso dos Santos T,P,160028
2,Madson,Madson Ferreira dos  ... T,P,321829 2 Vitor,Cicero Vitor dos San... T,P,156325
3,Rodrigo,Rodrigo Baldasso da  ... T,P,137340 3 Hueglo,Hueglo dos Santos Neris T,P,333318
4,Luan Garcia,Luan Garcia Teixeira T,P,307406 4 Wellington,Wellington da Silva ... T,P,299676
5,Marcelo Ma ...,Marcelo de Mattos Terra T,P,154766 5 Wellington,Wellington Cezar Alv... T,P,370555
6,Julio Cesar,Julio Cesar Coelho d ... T,P,155605 6 Costa,Tiago da Costa Silva T,P,188960
7,Andrezinho,Andre Luiz Tavares T,P,144360 7 Leandro Lima,George Leandro Abreu... T,P,335303
8,Henrique,Henrique Silva Milagres T,P,308965 8 Derley,Wanderley de Jesus Sousa T,P,166491
9,Leandrao,Leandro Costa Miranda T,P,144035 9 Bruno,Bruno Eduardo de Moraes T,P,185297
10,Nene,Anderson Luis de Car ... T,P,150986 10 Lele,Wesley de Jesus Correia T,P,191513
11,Jorge Henr ...,Jorge Henrique de Souza T,P,153189 11 Marcilio,Jose Marcilio Martin... T,P,411845
12,Jordi,Jordi Martins Almeida R,P,320196 12 Edson,Edson Kõlln R,P,311099
13,Yago,Glaybson Yago Souza  ... R,P,364829 13 Walter,Walter Marques Guima... R,P,430184
14,Jomar,Jomar Herculano Lourenco R,P,307645 14 Roberto,Roberto Heuchayer Sa... R,P,188110
15,Rodrigo Ol ...,Rodrigo Oliveira de  ... R,P,147224 15 Uillian,Uillian Correia Gran... R,P,180789
16,Willian,Willian Oliveira dos ... R,P,430883 16 Joao Paulo,Joao Paulo Mior R,P,185012
17,Caio,Caio Monteiro Costa R,P,404815 17 Renato Lima,Renato Gonçalves de Lima R,P,341132
18,Julio dos  ...,Julio Daniel dos San ... R,P,292789 18 Arthur,Arthur Caike do Nasc... R,P,292833
19,Thalles,Thalles Lima da Conc ... R,P,308877 19 Marcos,Marcos da Silva Franca R,P,375634
20,Evander,Evander da Silva Fer ... R,P,362659 20 Marion,Marion Silva Fernandes R,P,299878
21,Lucas,Lucas Barboza Rodrigues R,P,372717 21 Marcio,Marcio Jose de Oliveira R,P,158711
22,Mateus,Mateus da Silva Vita ... R,P,405246 22 Wallyson,Wallyson Ricardo Mac... R,P,174194
"",,,,23 Willams da ...,Willams da Luz R,P,456117
"",,Comissão Técnica
"",Vasco da Gama / RJ,Santa Cruz / PE
Médico:,Antonio Albino Pinto - 47363088772,Técnico: Milton Mendes - 1213193
Auxiliar Técnico:,Crizan Cesar De Oliveira Filho - 99328542715,Auxiliar Técnico: Adriano Felix Teixeira - 153511488
Auxiliar Técnico:,Fabio Muchinel Tepedino - 5179461650,Médico: Rodrigo Medeiros Barbosa Arruda - 23515
Preparador Físico:,Joelton Francisco Urtiga - 1826226737,Preparador Físico: Flavio Jose Trevisan - 005210
Técnico:,Jorge De Amorim Campos - 81276362749,Massagista: Fernando Jose Mendes - 2881691
Massagista:,Marcio Alexandre Silva Jaco - 1411191790,Preparador De GoleiroE:d enilson Da Conceição Silva - 006006
"",,,,,Gols,
Tempo,1T/2T,No,Tipo,Nome do Jogador,,Equipe
02:00,1T,9,NR,Bruno Eduardo de Moraes,,Santa Cruz/PE
43:00,2T,4,NR,Luan Garcia Teixeira,,Vasco da Gama/RJ
"",,,Substituições,
Tempo,1T/2T,Equipe,Entrou,Saiu
45:00,INT,Vasco da Gama/RJ,17 - Caio Monteiro Costa,8 - Henrique Silva Milagres
45:00,INT,Vasco da Gama/RJ,13 - Glaybson Yago Souza Lisbô ...,2 - Madson Ferreira dos Santo ...
11:00,2T,Santa Cruz/PE,19 - Marcos da Silva Franca,7 - George Leandro Abreu de L ...
11:00,2T,Santa Cruz/PE,16 - Joao Paulo Mior,10 - Wesley de Jesus Correia
18:00,2T,Vasco da Gama/RJ,19 - Thalles Lima da Conceição ...,9 - Leandro Costa Miranda
31:00,2T,Santa Cruz/PE,15 - Uillian Correia Granemann ...,5 - Wellington Cezar Alves de ...
