"",Arbitragem
Arbitro:,Paulo H Schleich Vollkopf (CBF-1 / MS)
Arbitro Assistente 1:,Leandro dos Santos Ruberdo (ASP-FIFA / MS)
Arbitro Assistente 2:,Sérgio Alexandre da Silva (CBF-1 / MS)
Quarto Arbitro:,Gleidson Santos Oliveira (CBF-2 / BA)
Assessor:,Kleber Moradillo da Silva (000 / BA)
"",,,Cronologia,,,
"",1o Tempo,,2o Tempo,,,
Entrada do mandante:,21:35Atraso:,,Não Houve Entrada do mandante: 22:44,Atraso:,,Não Houve
Entrada do visitante:,21:35Atraso:,,Não Houve Entrada do visitante: 22:44,Atraso:,,Não Houve
Início 1o Tempo:,21:45 Atraso:,,Não Houve Início do 2o Tempo: 22:47,Atraso:,,Não Houve
Término do 1o Tempo:,22:32 Acréscimo:,,2 min Término do 2o Tempo: 23:36,Acréscimo:,,4 min
Resultado do 1o Tempo: 1 X 1,,,Resultado Final: 1 X 2,,,
"",,,,Relação de Jogadores,,,
"",,Vitória / BA,,,Cruzeiro / MG,,
No,Apelido,Nome Completo T/R P/A,,CBF No Apelido,Nome Completo,T/R P/A,CBF
23,Caique,Caique Luiz Santos d ... T,P,383559 1 Fabio,Fabio Deivson Lopes ...,T P,129292
3,Victor Ramos,Victor Ramos Ferreira T,P,177152 4 Bruno Rodr ...,Bruno Rodrigo Fenelo...,T P,166647
4,Ramon,Ramon Menezes Roma T,P,402095 5 Ariel Cabral,Alejandro Ariel Cabral,T P,535421
5,Mauricio,Mauricio Azevedo Alves T,P,189046 9 Willian,Willian Gomes de Siq...,T P,166061
7,Marinho,Mario Sergio Santos  ... T,P,184307 11 Alisson,Alisson Euler de Fre...,T P,317751
8,Willian,Willian Roberto de F ... T,P,180083 19 Robinho,Robson Michael Signorini,T P,172189
9,Kieza,Welker Marcal Almeida T,P,185126 21 Lucas,Lucas Rios Marques,T P,178827
16,Elosman,Elosman Euller Silva ... T,P,369136 33 Bruno Rami ...,Bruno Edgar Silva Al...,T P,335379
17,Vander,Vander Luiz Silva Souza T,P,293180 35 Allano,Allano Brendon de So...,T P,370695
25,Kanu,Antonio Eduardo Pere ... T,P,165775 36 Bruno Viana,Bruno Viana Willemen...,T P,306786
26,Diego,Diego Renan de Lima  ... T,P,184273 38 Alex Sandro,Alex Sandro dos Sant...,T P,377434
11,Tiago Real,Tiago Real do Prado R,P,176512 3 Leo,Leonardo Renan Simoe...,R P,174360
14,Welison,José Welison da Silva R,P,313780 10 de Arrasca ...,Giorgian Daniel de A...,R P,521990
15,Flavio Med ...,Flavio Medeiros da Silva R,P,337826 12 Rafael,Rafael Pires Monteiro,R P,180213
20,Alipio,Alipio Duarte Brandao R,P,387313 14 Douglas,Douglas Coutinho Gom...,R P,303545
21,Josue,Josue de Oliveira Al ... R,P,345227 25 Bruno Naza ...,Bruno dos Santos Nazario,R P,314287
27,David,David Correia da Fonseca R,P,430588 27 Manoel,Manoel Messias Silva...,R P,182423
28,Nickson,Nickson Gabriel Reis ... R,P,371257 32 Matias Pis ...,Matias Pisano,R P,540981
29,Marcelo,Marcelo Machado dos  ... R,P,355752 34 Fabricio B ...,Fabricio Bruno Soare...,R P,389228
34,Wallace,Wallace Ribeiro Barato R,P,352220 37 Lucas França,Lucas Oliveira de França,R P,357971
35,Yan,Yan Matheus Santos Souza R,P,436451 41 Victor Luiz,Victor Luiz Prestes ...,R P,400386
"",,,,44 Joanderson,Joanderson de Jesus ...,R P,344833
"",,Comissão Técnica
"",Vitória / BA,Cruzeiro / MG
Técnico:,Vagner Carmo Mancini - 16554885ssp-sp,Fisioterapeuta: Andre Marley Da Silva Rocha - 7242079616
Auxiliar Técnico:,Regis Angeli - 107379272ssp-sp,Técnico: Paulo Jorge Gomes Bento - 70270883630
Médico:,Marcelo Barbosa Cortes - 14965-ba,Preparador Físico: Pedro Antonio Das Neves Pereira - 11746737
Preparador Físico:,Angelo Alves De Oliveira - 002396g-ba,Auxiliar Técnico: Ricardo Martins Peres - 70270869646
Massagista:,Clício Alves Do Nascimento - 0416398987ssp-b,Treinador De GoleirosR: oberto Barbosa Dos Santos - 3382574705
Preparador De GoleiroW: ashington Luiz Duarte Rufino - 1162627450ssp-b,,Médico: Walace Espada Da Silva - 3739799676
"",,Massagista: Andre Marley Da Silva Rocha - 126882
"",,Preparador De GoleiroR:o berto Barbosa Dos Santos - 03382574705
"",,,,,Gols,
Tempo,1T/2T,No,Tipo,Nome do Jogador,,Equipe
07:00,1T,9,NR,Willian Gomes de Siqueira,,Cruzeiro/MG
14:00,1T,26,PN,Diego Renan de Lima Ferreira,,Vitória/BA
26:00,2T,9,NR,Willian Gomes de Siqueira,,Cruzeiro/MG
"",,,,Substituições,
Tempo,1T/2T,,Equipe,Entrou,Saiu
45:00,INT,Vitória/BA,,11 - Tiago Real do Prado,3 - Victor Ramos Ferreira
45:00,INT,Cruzeiro/MG,,25 - Bruno dos Santos Nazario,11 - Alisson Euler de Freitas  ...
32:00,1T,Cruzeiro/MG,,10 - Giorgian Daniel de Arrasc ...,38 - Alex Sandro dos Santos Ap ...
18:00,2T,Vitória/BA,,20 - Alipio Duarte Brandao,5 - Mauricio Azevedo Alves
27:00,2T,Cruzeiro/MG,,40 - federico gino acevedo fag ...,19 - Robson Michael Signorini
34:00,2T,Vitória/BA,,28 - Nickson Gabriel Reis Silv ...,16 - Elosman Euller Silva Cava ...
