"",Arbitragem
Arbitro:,Ronan Marques da Rosa (CBF-2 / SC)
Arbitro Assistente 1:,Miguel Cataneo Ribeiro da Costa (CBF-1 / SP)
Arbitro Assistente 2:,Fabio Rogerio Baesteiro (CBF-1 / SP)
Quarto Arbitro:,Leonardo Sígari Zanon (CBF-2 / PR)
Assessor:,Faustino Vicente Lopes (ASS / PR)
"",,,Cronologia,,,
"",1o Tempo,,2o Tempo,,,
Entrada do mandante:,19:20Atraso:,,Não Houve Entrada do mandante: 20:33,Atraso:,,Não Houve
Entrada do visitante:,19:26Atraso:,,3 min Entrada do visitante: 20:33,Atraso:,,Não Houve
Início 1o Tempo:,19:33 Atraso:,,3 min Início do 2o Tempo: 20:34,Atraso:,,Não Houve
Término do 1o Tempo:,20:19 Acréscimo:,,1 min Término do 2o Tempo: 21:19,Acréscimo:,,Não Houve
Resultado do 1o Tempo: 2 X 0,,,Resultado Final: 6 X 0,,,
"",,,,Relação de Jogadores,,,
"",,Londrina / PR,,,Parauapebas / PA,,
No,Apelido,Nome Completo T/R P/A,,CBF No Apelido,Nome Completo T/R P/A,,CBF
1,Vitor,Carlos Vitor da Cost ... T,P,157272 1 Maycki,Maycki Douglas Olive...,T P,178960
2,Rai,Rai dos Reis Ramos T,P,331532 2 Joaozinho,Joao Rodrigo Donato,T P,164961
3,Matheus,Matheus Borges Domingues T,P,301741 3 Airton,Airton Constantino d...,T P,329434
4,Silvio,Silvio Henderson San ... T,P,171894 4 Yuri,Iury Nunes Borges,T P,187589
5,Elias,Elias Nascimento Felicio T,P,308624 5 Paulo de T ...,Paulo de Tarcio Dias...,T P,175342
6,Paulinho,Paulo Oliveira de So ... T,P,184316 6 Eder,Eder Sales Guerreiro,T P,306397
7,Wellisson,Wellisson Almeida Nunes T,P,525810 7 Bruno,Carpegianni Bruno Vi...,T P,165234
8,Julio,Julio Guilherme Jero ... T,P,357300 8 Matheus,Matheus Moreno de Sousa,T P,454825
9,Keirrison,Keirrison de Souza C ... T,P,171998 9 Souza,Heldeson Souza da Cunha,T P,152199
10,Netinho,Artur Pereira Neto T,P,155995 10 Fininho,Joelson Amorim Guedes,T P,156761
11,Rafael Gava,Rafael Gustavo Meneg ... T,P,313001 11 Magno,Magno dos Santos Ribeiro,T P,456234
12,Alan,Alan Jose Bernardon R,P,326968 12 Jorge,Jorge Miguel Lopes,R P,166044
13,Marcondes,Marcondes de Jesus S ... R,P,311339 13 Geto,Getulio Silva Souza,R P,370367
14,Jadi,Jardiel Sousa Pereira R,P,344899 14 Wellington,Wellinghton Diego An...,R P,370092
15,Germano,Germano Borovicz Car ... R,P,155026 15 Leo,Leonardo Azevedo dos...,R P,427275
16,Diogo,Diogo Roberto Roque R,P,169115 16 Jefferson,Jefferson Zacarias Alves,R P,427533
17,Romulo,Romulo da Silva Machado R,P,379397 17 Joao Alves,Joao Alves Rodrigues...,R P,164211
18,Itamar,Itamar Batista da Silva R,P,139015 18 Anderson,Anderson de Oliveira,R P,167947
19,Luizao,Walter Luiz Silva de ... R,P,301156,,,
20,Jose,Jose Rafael Vivian R,P,330886,,,
21,Bruno Batata,Bruno Fressato Cardoso R,P,162152,,,
22,Paulo,Paulo Roberto Moccelin R,P,360467,,,
23,Marcelo,Marcelo Rangel Rosa R,P,186722,,,
"",,Comissão Técnica,
"",Londrina / PR,,Parauapebas / PA
Técnico:,Claudio Aparecido Tencati  - CRE4240G-PR,Técnico:,Sinomar Dias Naves - CREF002388G-PA
Auxiliar Técnico:,Alessio Da Costa Antunes - CREF008558-P-PR,Auxiliar Técnico:,Sinomar Dias Naves Junior - 3347745-SSP-PA
Médico:,Jean Alexandre Furtado - 12026-PR,Médico:,Julio Cesar Rebelo Junior - 10776-PA
Preparador Físico:,Joao Carlos Martins Ruiz - CREF 000945-PR,Preparador Físico:,Carlos Henrique Rocca - 015293-9G-RS
Massagista:,Fabio Dos Santos  - 5829296-6- PR,Massagista:,Jose R. Brito Dos Santos - 1414656SSP-PA
"",,,,,Gols,
Tempo,1T/2T,No,Tipo,Nome do Jogador,,Equipe
09:00,1T,9,NR,Keirrison de Souza Carneiro,,Londrina/PR
17:00,1T,10,PN,Artur Pereira Neto,,Londrina/PR
05:00,2T,11,NR,Rafael Gustavo Meneghel Gava,,Londrina/PR
14:00,2T,8,NR,Julio Guilherme Jeronimo dos Santos,,Londrina/PR
34:00,2T,18,NR,Itamar Batista da Silva,,Londrina/PR
36:00,2T,18,NR,Itamar Batista da Silva,,Londrina/PR
"",,,Substituições,
Tempo,1T/2T,Equipe,Entrou,Saiu
18:00,1T,Parauapebas/PA,14 - Wellinghton Diego Andrade ...,8 - Matheus Moreno de Sousa
18:00,2T,Parauapebas/PA,17 - Joao Alves Rodrigues Neto ...,9 - Heldeson Souza da Cunha
18:00,2T,Londrina/PR,18 - Itamar Batista da Silva,9 - Keirrison de Souza Carnei ...
28:00,2T,Londrina/PR,14 - Jardiel Sousa Pereira,6 - Paulo Oliveira de Souza J ...
28:00,2T,Londrina/PR,22 - Paulo Roberto Moccelin,10 - Artur Pereira Neto
31:00,2T,Parauapebas/PA,15 - Leonardo Azevedo dos Sant ...,6 - Eder Sales Guerreiro
