"",,Arbitragem
Arbitro:,Marcos Mateus Pereira (AB / MS),
Arbitro Assistente 1:,Cicero Alessandro de Souza (AB / MS),
Arbitro Assistente 2:,Daiane Caroline Muniz dos Santos (CBF / MS),
Quarto Arbitro:,Joelson Nazareno Ferreira Cardoso (CD / PA),
Delegado Local:,Paulo C da Rocha Romano (CBF / PA),
Analista de Campo:,Diorgenes Menezes Serrão (CBF / PA),
"",,,Cronologia,,,
"",1o Tempo,,2o Tempo,,,
Entrada do mandante:,20:20Atraso:,,Não Houve Entrada do mandante: 21:31,Atraso:,,Não Houve
Entrada do visitante:,20:20Atraso:,,Não Houve Entrada do visitante: 21:31,Atraso:,,Não Houve
Início 1o Tempo:,20:30 Atraso:,,Não Houve Início do 2o Tempo: 21:32,Atraso:,,Não Houve
Término do 1o Tempo:,21:17 Acréscimo:,,2 min Término do 2o Tempo: 22:21,Acréscimo:,,4 min
Resultado do 1o Tempo: 0 X 0,,,Resultado Final: 0 X 0,,,
"",,,,Relação de Jogadores,,,
"",,Paysandu / PA,,,Boa / MG,,
No,Apelido,Nome Completo,T/R P/A,CBF No Apelido,Nome Completo T/R P/A,,CBF
1,Emerson,Emerson Jose da Conc ...,T(g) P,145650 1 Daniel,Daniel Luiz Flumignan T(g),P,128723
3,Fernando,Fernando Lombardi,T P,140899 2 Ruan,Ruan Gregorio Teixeira T,P,320017
5,Ricardo,Ricardo da Silva Guerra,T P,178569 3 Leonardo,Leonardo Lima dos Santos T,P,330362
9,Daniel,Daniel Amorim Dias d ...,T P,325581 4 Antonio,Julio Cesar dos Santos T,P,138323
10,Diogo,Diogo Ribeiro de Oli ...,T P,160174 5 Geandro,Geandro Augusto de Paula T,P,176739
11,Welinton,Welinton Junior Ferr ...,T P,321011 6 Paulo Victor,Paulo Victor da Silva T,P,351920
13,Lucas,Lucas Taylor Maia Reis,T P,351207 7 Reis,Isnairo Reis Silva M... T,P,370113
15,Wesley,Wesley Dias Claudino,T P,322930 8 Diones,Diones Coelho da Costa T,P,172714
18,Jhonnatan,Jhonnatan Guimaraes  ...,T P,295956 9 Wesley,Wesley Pacheco Gomes T,P,189920
26,Perema,Auricélio Soares dos ...,T P,389790 10 Fellipe,Fellipe Mateus de Se... T,P,321780
38,Alessandro,Alessandro Silva de  ...,T P,182630 11 Rodolfo,Rodolfo Jose da Silv... T,P,423003
12,Marcos,Marcos Vinicius Frag ...,R(g) P,172262 12 Fabricio,Fabricio Barros Santana R(g),P,178321
2,Ayrton,Ayrton Luiz Ganino,R P,169529 14 Jheckson,Jheckson Silva Oliveira R,P,306314
4,Gilvan,Gilvan Souza Correa,R P,188660 15 Jonata,Jonata Escobar R,P,188207
25,Tiago,Tiago Ronald de Alme ...,R P,351823 16 Leonardo,Leonardo Bartholo Prando R,P,175026
30,Bergson,Bergson Gustavo Silv ...,R P,191433 17 Gilberto,Gilberto Elias Santiago R,P,303859
34,Marcao,Marcos Assis de Santana,R P,185680 18 Ramon,Ramon Rodrigo de Freitas R,P,152825
39,Renato,Renato Augusto Santo ...,R P,334195 19 Eduardo,Eduardo Flores Gomes R,P,161385
40,Hayner,Hayner Willian Monja ...,R P,402405 20 Alyson,Alyson Santos Silva R,P,432166
"",,,,21 Guilherme  ...,Guilherme de Oliveir... R,P,332451
"",,Comissão Técnica
"",Paysandu / PA,Boa / MG
Técnico:,Rogerio Suares Gameleira - 2789899-SSP-PA,Massagista: Antonio Marcos De Paula - 43127878672
Auxiliar Técnico:,Xxxxxxxxxxxxxxxxxxxxxxxxxxxx - XXXXXXXXX,Treinador De GoleirosC: arlos Cesar Felix Barbosa - 72600098615
Médico:,Wilson Alves Fiel - 3930-PA,Auxiliar Técnico: Valdonedo Da Silva Xavier - 23322063968
Preparador Físico:,Ronny Reinaldo Da Silva - 2832-G/SC,Médico: Jayme Afonso Duarte Bastos - 4955-PA
Massagista:,Washington Vilhena Brasão - 1619905-SSP/PA,Preparador Físico: Wanderley Brilhante Junior - 055812-G/SP
Preparador De GoleiroE:d son Roque Girardi - 1035848124-SSP/,,Técnico: Xxxxxxxxxxxxxxxxxxxxxxxx - XXXXX
"",,Preparador De GoleiroC:a rlos Cesar Felix Barbosa - 726000986-15
"",,,,Substituições,
Tempo,1T/2T,,Equipe,Entrou,Saiu
+1:00,2T,Boa/MG,,17 - Gilberto Elias Santiago,7 - Isnairo Reis Silva Morais ...
45:00,INT,Paysandu/PA,,30 - Bergson Gustavo Silveira  ...,11 - Welinton Junior Ferreira  ...
13:00,2T,Paysandu/PA,,34 - Marcos Assis de Santana,9 - Daniel Amorim Dias da Sil ...
16:00,2T,Boa/MG,,18 - Ramon Rodrigo de Freitas,9 - Wesley Pacheco Gomes
28:00,2T,Paysandu/PA,,25 - Tiago Ronald de Almeida P ...,10 - Diogo Ribeiro de Oliveira ...
35:00,2T,Boa/MG,,15 - Jonata Escobar,5 - Geandro Augusto de Paula
