"",,Arbitragem
Arbitro:,Felipe Duarte Varejao (CD / ES),
Arbitro Assistente 1:,Fabio Faustino dos Santos (CD / ES),
Arbitro Assistente 2:,Katiuscia M Berger Mendonça (AB / ES),
Quarto Arbitro:,José Reinaldo Figueiredo da Silva Filho (CD / AL),
Delegado Local:,David de Holanda Fonseca (CBF / ),
Analista de Campo:,Hercules Martins da Silva (CBF / AL),
"",,,Cronologia,,,
"",1o Tempo,,2o Tempo,,,
Entrada do mandante:,21:20Atraso:,,Não Houve Entrada do mandante: 22:30,Atraso:,,Não Houve
Entrada do visitante:,21:20Atraso:,,Não Houve Entrada do visitante: 22:31,Atraso:,,Não Houve
Início 1o Tempo:,21:30 Atraso:,,Não Houve Início do 2o Tempo: 22:33,Atraso:,,Não Houve
Término do 1o Tempo:,22:18 Acréscimo:,,3 min Término do 2o Tempo: 23:28,Acréscimo:,,10 min
Resultado do 1o Tempo: 2 X 0,,,Resultado Final: 2 X 1,,,
"",,,,Relação de Jogadores,,,
"",,Crb / AL,,,América / MG,,
No,Apelido,Nome Completo T/R P/A,,CBF No Apelido,Nome Completo,T/R P/A,CBF
1,Edson,Edson Kõlln T(g),P,311099 1 João Ricardo,Joao Ricardo Riedi,T(g) P,298660
2,Marcos,Marcos Martins dos Anjos T,P,184247 2 Adilson,Adilson dos Anjos Ol...,T P,337261
3,Audálio,Jose Audalio Silva S ... T,P,172203 3 Rafael,Rafael Ramos de Lima,T P,160686
4,Adalberto,Adalberto Hilario Fe ... T,P,165391 4 Messias,Messias Rodrigues da...,T P,381149
5,Rodrigo,Rodrigo de Souza Fonseca T,P,293529 6 Giovanni,Giovanni Palmieri do...,T P,175878
6,Pedro Bote ...,Pedro Roberto Silva  ... T,P,183902 8 Ze Ricardo,Jose Ricardo Barbosa...,T P,358808
7,Edson Rati ...,Edson Ramos da Silva T,P,167070 9 Bil,Rosimar Amancio,T P,159343
8,Danilo,Danilo Pires Costa T,P,302560 10 Matheusinho,Matheus Leonardo Sal...,T P,398805
9,Neto Baiano,Euvaldo Jose de Agui ... T,P,160251 11 Mike,Mike dos Santos Nena...,T P,311439
10,Chico,Francisco Hyun Sol Kim T,P,326622 17 Gerson,Gerson Alencar de Li...,T P,147495
11,Elvis,Elvis Vieira Araujo T,P,183975 19 Ernandes,Ernandes Dias Luz,T P,177802
12,Juliano,Juliano Aparecido do ... R(g),P,184393 12 Fernando L ...,Fernando Leal Fonseca,R(g) P,151033
13,Gabriel,Gabriel de Paulo Limeira R,P,141931 5 David França,David Franca Oliveir...,R P,150731
14,Diego,Diego Pereira Correa R,P,161603 7 Felipe Amo ...,Felipe da Silva Amorim,R P,340891
15,Ze Carlos,Jose Carlos Ferreira ... R,P,148961 14 Lima,Willian Lanes de Lima,R P,160789
16,João Paulo,Joao Paulo de Assis  ... R,P,363827 15 Willian,Willian Osmar de Oli...,R P,334881
17,Cleberson,Cleberson Jose Pereira R,P,177481 16 Neto,Antonio Francisco Mo...,R P,383527
18,Jorge,Jorge Nascimento Capela R,P,369596 18 Hugo,Hugo Guimaraes Silva...,R P,162026
19,Erick,Erick Lender Salles R,P,322960 20 Para,Anderson Ferreira da...,R P,393868
20,Tony,Antonio de Moura Car ... R,P,176981 22 Hugo,Hugo da Silva Cabral,R P,189739
21,Emaxwell,Emaxwell Souza de Lima R,P,427774,,,
22,Rodolfo,Rodolfo de Almeida G ... R,P,308733,,,
23,Bruno,Bruno Pianissolla R,P,174237,,,
"",,Comissão Técnica
"",Crb / AL,América / MG
Massagista:,Francisco De Assis Rodrigues Miranda - 200200119558,Técnico: Enderson Alves Moreira - MG487873
Fisiologista:,Frederico Petean Pozzebon - 31194277802,Auxiliar Técnico: Luiz Fernando Rosa Flores - 13282344
Treinador De GoleirosL:u ciano Dias Fragoso - 86088939400,,Médico: Afonso Rangel De Souza - 9618
Técnico:,Luiz Eduardo Barros Cavalcanti - 1064901417,Preparador Físico: Edy Carlos Toporowicz - 007447-G PR
Médico:,Marcos Antonio De Medeiros Rocha - 2335,Massagista: Silvio Junio Nunes Da Silva - MG4761735
Auxiliar Técnico:,Wilton Bezerra Da Silva Neto - 5449759,Preparador De GoleiroS:i lvio Siqueira Jardim - M3153303
Preparador Físico:,Frederico Pettean Pozzebon - 31194277802,
Preparador De GoleiroL:u ciano Dias Fragoso - 86089939400,,Gols
Tempo,1T/2T No Tipo,Nome do Jogador Equipe
36:00,1T 10 NR,Francisco Hyun Sol Kim Crb/AL
38:00,1T 10 NR,Francisco Hyun Sol Kim Crb/AL
04:00,2T 19 NR,Ernandes Dias Luz América/MG
"",,,,Substituições,
Tempo,1T/2T,,Equipe,Entrou,Saiu
+3:00,2T,Crb/AL,,18 - Jorge Nascimento Capela,7 - Edson Ramos da Silva
45:00,INT,América/MG,,5 - David Franca Oliveira E S ...,11 - Mike dos Santos Nenatarvi ...
20:00,2T,Crb/AL,,15 - Jose Carlos Ferreira Filh ...,9 - Euvaldo Jose de Aguiar Ne ...
21:00,2T,América/MG,,22 - Hugo da Silva Cabral,17 - Gerson Alencar de Lima Ju ...
30:00,2T,Crb/AL,,20 - Antonio de Moura Carvalho ...,11 - Elvis Vieira Araujo
38:00,2T,América/MG,,18 - Hugo Guimaraes Silva Sant ...,6 - Giovanni Palmieri dos San ...
