"",,Arbitragem
Arbitro:,Nielson Nogueira Dias (AB / PE),
Arbitro Assistente 1:,Francisco Chaves Bezerra Junior (CD / PE),
Arbitro Assistente 2:,Ricardo Bezerra Chianca (CD / PE),
Quarto Arbitro:,Adriano de Assis Miranda (CD / SP),
Delegado Local:,Mario Sergio Baldini Caulada (AB / ),
Analista de Campo:,Jose Henrique de Carvalho ( / SP),
"",,,Cronologia,,,
"",1o Tempo,,2o Tempo,,,
Entrada do mandante:,18:52Atraso:,,Não Houve Entrada do mandante: 20:01,Atraso:,,Não Houve
Entrada do visitante:,18:52Atraso:,,Não Houve Entrada do visitante: 20:01,Atraso:,,Não Houve
Início 1o Tempo:,19:00 Atraso:,,Não Houve Início do 2o Tempo: 20:03,Atraso:,,Não Houve
Término do 1o Tempo:,19:48 Acréscimo:,,3 min Término do 2o Tempo: 20:52,Acréscimo:,,4 min
Resultado do 1o Tempo: 0 X 2,,,Resultado Final: 1 X 3,,,
"",,,,Relação de Jogadores,,,
"",,Oeste / SP,,,Paysandu / PA,,
No,Apelido,Nome Completo T/R P/A,,CBF No Apelido,Nome Completo,T/R P/A,CBF
1,Rodolfo,Rodolfo Alves de Melo T(g),P,181632 1 Emerson,Emerson Jose da Conc... T(g),P,145650
2,Rodrigo,Rodrigo Eduardo da Silva T,P,419498 3 Fernando,Fernando Lombardi,T P,140899
3,Joilson,Joilson de Jesus Dem ... T,P,326727 8 Augusto Re ...,Augusto Oliveira da ...,T P,146969
4,Leandro,Leandro Amaro dos Sa ... T,P,168608 13 Lucas,Lucas Taylor Maia Reis,T P,351207
5,Lidio,Lidio Ferreira Carmo ... T,P,346815 14 Nando Cara ...,Fernando Gasparini C...,T P,298709
6,Guilherme,Guilherme Kennedy Romao T,P,419442 19 Gualberto,Gualberto Luiz da Si...,T P,184894
7,Gabriel Mo ...,Gabriel Monteiro Vas ... T,P,317271 27 Rodrigo,Rodrigo Andrade da Silva,T P,184095
8,Velicka,Leandro Nunes Velicka T,P,164453 30 Bergson,Bergson Gustavo Silv...,T P,191433
9,Robert,Robert de Pinho de Souza T,P,140778 34 Marcao,Marcos Assis de Santana,T P,185680
10,Mazinho,Anderson Soares da Silva T,P,181254 38 Alessandro,Alessandro Silva de ...,T P,182630
11,Daniel,Daniel Sampaio Simoes T,P,308495 39 Renato,Renato Augusto Santo...,T P,334195
12,Felipe,Felipe Alves Raymundo R(g),P,177931 12 Marcos,Marcos Vinicius Frag... R(g),P,172262
13,Daniel Bor ...,Daniel Fortunato Borges R,P,322852 4 Diego Ivo,Diego Ivo Pires,R P,295845
14,Vinicius,Andre Vinicius Lima  ... R,P,189004 9 Anselmo,Anselmo Tadeu Silva ...,R P,143708
15,Memi,Guilherme Gomes Garutti R,P,317730 10 Diogo,Diogo Ribeiro de Oli...,R P,160174
16,Ricardinho,Ricardo Alexandre Ri ... R,P,421809 11 Welinton,Welinton Junior Ferr...,R P,321011
17,Wilson Mat ...,Wilson Tiago Matias R,P,148183 17 Jean Carlos,Jean Carlos de Brito,R P,394025
18,Alexandro,Alexandro da Silva B ... R,P,172513 20 Fabio,Fabio Carvalho Matos,R P,455010
19,Gabriel,Gabriel Ultramari Mendes R,P,309428 31 Magno,Magno dos Santos Ribeiro,R P,456234
20,Indio,Raphael Luz Pessoa R,P,181334 32 Jose Rodri ...,Jose Rodrigo Andrade...,R P,429655
21,Daniel,Daniel Carvalho da Silva R,P,155651,,,
22,Andre,Andre Dias Campos R,P,180642,,,
25,Cosmo,Cosmo Henrique Fonse ... R,P,430582,,,
"",,Comissão Técnica
"",Oeste / SP,Paysandu / PA
Técnico:,Roberto Fernando Schneiger - 3324441,Técnico: Marcos Vinicius Santos Goncalves - 20170810814
Auxiliar Técnico:,Renan Roberto De Freitas - 43693245,Auxiliar Técnico: Edilson Luiz Ferreira Borges - 37577189
Médico:,Daniel Floriano Dos Santos - 46642 D,Médico: Jose Silverio Nunes Fonseca - 4775 PA
Preparador Físico:,Wiliam Cesar Hauptmam - 4244-G/SP,Preparador Físico: Ronny Reinaldo Da Silva - 2832-G/SC
Massagista:,Marcelo Jose Da Silva - 26713464,Massagista: Elton De Sousa Gomes - 5152802
Preparador De GoleiroC:l everson Fernando Lopes - 66005160,,Preparador De GoleiroE:d son Roque Girardi - 1035848124
"",,,,,Gols,
Tempo,1T/2T,No,Tipo,Nome do Jogador,,Equipe
12:00,1T,2,CT,Rodrigo Eduardo da Silva,,Oeste/SP
30:00,1T,30,NR,Bergson Gustavo Silveira da Silva,,Paysandu/PA
17:00,2T,9,NR,Robert de Pinho de Souza,,Oeste/SP
24:00,2T,31,NR,Magno dos Santos Ribeiro,,Paysandu/PA
"",,,Substituições,
Tempo,1T/2T,Equipe,Entrou,Saiu
45:00,INT,Paysandu/PA,32 - Jose Rodrigo Andrade Ramo ...,8 - Augusto Oliveira da Silva ...
45:00,INT,Oeste/SP,25 - Cosmo Henrique Fonseca da ...,2 - Rodrigo Eduardo da Silva
39:00,1T,Oeste/SP,18 - Alexandro da Silva Batist ...,8 - Leandro Nunes Velicka
23:00,2T,Paysandu/PA,31 - Magno dos Santos Ribeiro,27 - Rodrigo Andrade da Silva
33:00,2T,Paysandu/PA,4 - Diego Ivo Pires,30 - Bergson Gustavo Silveira  ...
35:00,2T,Oeste/SP,20 - Raphael Luz Pessoa,6 - Guilherme Kennedy Romao
