"",,Arbitragem
Arbitro:,José Woshington da Silva (CD / PE),
Arbitro Assistente 1:,Marcelino Castro de Nazare (AB / PE),
Arbitro Assistente 2:,Ricardo Bezerra Chianca (CD / PE),
Quarto Arbitro:,Leonardo Sígari Zanon (CD / PR),
Delegado Local:,Ernaldo Melek Junior (CBF / ),
Analista de Campo:,Anderson Carlos Gonçalves (CBF / PR),
"",,,Cronologia,,,
"",1o Tempo,,2o Tempo,,,
Entrada do mandante:,20:20Atraso:,,Não Houve Entrada do mandante: 21:30,Atraso:,,Não Houve
Entrada do visitante:,20:20Atraso:,,Não Houve Entrada do visitante: 21:31,Atraso:,,Não Houve
Início 1o Tempo:,20:30 Atraso:,,Não Houve Início do 2o Tempo: 21:33,Atraso:,,Não Houve
Término do 1o Tempo:,21:18 Acréscimo:,,3 min Término do 2o Tempo: 22:23,Acréscimo:,,5 min
Resultado do 1o Tempo: 0 X 0,,,Resultado Final: 2 X 0,,,
"",,,,Relação de Jogadores,,,
"",,Paraná / PR,,,Juventude / RS,,
No,Apelido,Nome Completo,T/R P/A,CBF No Apelido,Nome Completo T/R P/A,,CBF
1,Richard,Richard de Oliveira  ... T(g),P,291617 1 Matheus,Matheus Fernando Cav... T(g),P,168926
2,Cristovam,Cristovam Roberto Ri ...,T P,188472 2 Vidal,Cristiano da Silva Vidal T,P,329349
3,Iago,Iago Justen Maidana  ...,T P,412852 3 Domingues,Luiz Gustavo Domingues T,P,304293
4,Brock,Eduardo Schroeder Brock,T P,291997 4 Ruan,Ruan Renato Bonifaci... T,P,326569
5,Leandro,Leandro Vilela Sales ...,T P,315023 5 Vacaria,Roberto Zulian Junior T,P,296468
6,Igor,Igor Aquino da Silva,T P,421778 6 Bruno,Bruno Bairros Collaco T,P,177998
7,Robson,Robson dos Santos Fe ...,T P,302768 7 Diego Felipe,Diego Felipe Coutinho T,P,188803
8,Gabriel,Gabriel Dias de Oliveira,T P,317697 8 Leilson,Leilson Carlos de Ol... T,P,293515
9,Alemao,Jose Carlos Tofolo J ...,T P,175747 9 Tiago Marq ...,Tiago Marques Rezende T,P,184899
10,Renato,Renato Vieira Rodrigues,T P,301503 10 Juninho,Cicero Jose da Silva... T,P,163793
11,Joao Pedro,Joao Pedro Heinen Silva,T P,380762 11 Caprini,Mauricio Caprini Pinto T,P,371231
12,Marcao,Sebastiao Marcos Bar ... R(g),P,126468 12 Raul,Raul Jonas Steffens R(g),P,385958
13,Rayan,Rayan Poltronieri Pe ...,R P,184819 13 Micael,Micael Jordane Modinger R,P,177261
14,Junior,Ozealisson Santos Gomes,R P,419569 14 Wesley Nat ...,Wesley Nata Wachholz R,P,292672
15,Assis,Francisco de Assis C ...,R P,174220 15 Sananduva,Arthur Jose Gregio R,P,374446
16,Jhony,Jhony Douglas Santiago,R P,374851 16 Mauricio,Mauricio da Silva Di... R,P,333809
17,Otavio,Luiz Otavio Alves Ma ...,R P,374917 17 Bruno,Bruno Felipe Lima Te... R,P,318691
18,Murilo,Murilo Rangel Barbosa,R P,190032 18 Yago,Yago Cesar da Silva R,P,413841
19,Guilherme,Guilherme de Melo Silva,R P,398260 19 Ramon,Ramon Machado de MacedoR,P,295017
20,Vinicius,Vinicius Kiss Silva  ...,R P,185860,,,
21,Italo,Italo Barbosa de Andrade,R P,518717,,,
22,Vitor,Vitor Correia da Silva,R P,431945,,,
23,Felipe,Felipe Augusto Ferre ...,R P,323819,,,
"",,Comissão Técnica
"",Paraná / PR,Juventude / RS
Técnico:,Luiz Carlos Cirne Lima De Lorenzi - 10.27274784/RS,Técnico: Gilmar Dal Pozzo - 9044247981/RS
Auxiliar Técnico:,Matheus Silva Ferreira Da Costa - 70735769/PR,Auxiliar Técnico: Luciano Cardozo Borges - 3046693994/RS
Médico:,Marcel Sangeroti  - 29372/PR,Médico: Paulo Andre Alain Milcent - 29491/PR
Preparador Físico:,Rodrigo Filoco De Rezende - 6415G/PR,Preparador Físico: Anselmo Pereira Sbragia - 7218G/SP
Massagista:,Elizaldo Vieira De Souza Junior - 55706640/PR,Massagista: Elton Vieira De Vargas - 1039581473/RS
Preparador De GoleiroF:e lipe Rosa Jorge - CREF:076483/SP,,Preparador De GoleiroM:a rcio Angonese  - 5038406301
"",,,,,Gols,
Tempo,1T/2T,No,Tipo,Nome do Jogador,,Equipe
13:00,2T,9,NR,Jose Carlos Tofolo Junior,,Paraná/PR
+4,2T,22,NR,Vitor Correia da Silva,,Paraná/PR
"",,,Substituições,
Tempo,1T/2T,Equipe,Entrou,Saiu
45:00,INT,Juventude/RS,19 - Ramon Machado de Macedo,10 - Cicero Jose da Silva Juni ...
14:00,2T,Juventude/RS,18 - Yago Cesar da Silva,11 - Mauricio Caprini Pinto
23:00,2T,Paraná/PR,19 - Guilherme de Melo Silva,11 - Joao Pedro Heinen Silva
32:00,2T,Paraná/PR,20 - Vinicius Kiss Silva Tobia ...,9 - Jose Carlos Tofolo Junior ...
38:00,2T,Juventude/RS,14 - Wesley Nata Wachholz,5 - Roberto Zulian Junior
42:00,2T,Paraná/PR,22 - Vitor Correia da Silva,7 - Robson dos Santos Fernand ...
