"",,Arbitragem
Arbitro:,Flavio Rodrigues de Souza (AB / SP),
Arbitro Assistente 1:,Alberto Poletto Masseira (AB / SP),
Arbitro Assistente 2:,Evandro de Melo Lima (CD / SP),
Quarto Arbitro:,José Woshington da Silva (CD / PE),
Analista de Campo:,Ubirajara Ferraz Jota (CBF / PE),
"",,,Cronologia,,,
"",1o Tempo,,2o Tempo,,,
Entrada do mandante:,18:50Atraso:,,Não Houve Entrada do mandante: 20:00,Atraso:,,2 min
Entrada do visitante:,18:50Atraso:,,Não Houve Entrada do visitante: 20:01,Atraso:,,1 min
Início 1o Tempo:,19:00 Atraso:,,Não Houve Início do 2o Tempo: 20:03,Atraso:,,2 min
Término do 1o Tempo:,19:46 Acréscimo:,,1 min Término do 2o Tempo: 20:52,Acréscimo:,,4 min
Resultado do 1o Tempo: 0 X 0,,,Resultado Final: 0 X 1,,,
"",,,,Relação de Jogadores,,,
"",,Santa Cruz / PE,,,América / MG,,
No,Apelido,Nome Completo T/R P/A,,CBF No Apelido,Nome Completo,T/R P/A,CBF
1,Julio Cesar,Julio Cesar de Souza ... T(g),P,150963 1 João Ricardo,Joao Ricardo Riedi,T(g) P,298660
4,Anderson,Anderson Aparecido S ... T,P,178500 2 Neto,Norberto Pereira Mar...,T P,186564
8,Derley,Wanderley de Jesus Sousa T,P,166491 3 Rafael,Rafael Ramos de Lima,T P,160686
14,Wellington,Wellington Cezar Alv ... T,P,370555 4 Messias,Messias Rodrigues da...,T P,381149
17,Yuri,Yuri Antonio Costa d ... T,P,317384 6 Para,Anderson Ferreira da...,T P,393868
21,Guilherme,Guilherme Cruz de Mattis T,P,291534 8 Adilson,Adilson dos Anjos Ol...,T P,337261
23,Grafite,Edinaldo Batista Libanio T,P,147010 9 Bil,Rosimar Amancio,T P,159343
28,Paulo,Joao Paulo da Silva  ... T,P,371170 10 Matheusinho,Matheus Leonardo Sal...,T P,398805
75,Nininho,Salatiel Bartolomeu  ... T,P,313712 11 Luan,Luan Michel Louza,T P,183381
93,Thiago,Thiago de Almeida Primão T,P,308568 19 Ernandes,Ernandes Dias Luz,T P,177802
97,Andre Luis,Andre Luis da Costa  ... T,P,321636 21 Ruy,Ruy Franco de Almeid...,T P,178472
72,Lucas Jose,Lucas Jose da Silva R(g),P,516237 12 Fernando L ...,Fernando Leal Fonseca,R(g) P,151033
3,Bruno,Bruno da Silva Barbosa R,P,183724 5 Ze Ricardo,Jose Ricardo Barbosa...,R P,358808
7,Joao,Joao Ananias Jordao  ... R,P,337194 14 Lima,Willian Lanes de Lima,R P,160789
9,Halef,Halef Silva Melo R,P,428817 16 Neto,Antonio Francisco Mo...,R P,383527
10,Natan,Natan Carneiro de Lima R,P,300075 17 Gerson,Gerson Alencar de Li...,R P,147495
11,Wiliam Bar ...,Wiliam Silva Gomes B ... R,P,307680 18 Edno,Edno Roberto Cunha,R P,151005
13,Jeremias,Jeremias Everton de  ... R,P,426135 20 Ceara,Marcos Venancio de A...,R P,138932
15,Walber,Walber da Silva Sous ... R,P,173921 22 Mike,Mike dos Santos Nena...,R P,311439
20,Willams da ...,Willams da Luz R,P,456117 23 Renan,Renan Henrique Olive...,R P,178684
33,Julio,Julio Cesar do Nasci ... R,P,140655,,,
36,Bruno,Bruno Paulo Machado  ... R,P,185095,,,
99,Ricardo Bu ...,Ricardo Bueno da Silva R,P,179974,,,
"",,Comissão Técnica
"",Santa Cruz / PE,América / MG
Técnico:,Marcelo Martelotte - 92023,Técnico: Ederson Alves Moreira - 487873
Auxiliar Técnico:,Antonio Carlos Ribeiro Junior - 13751135855,Auxiliar Técnico: Luiz Fernando Rosa Flores - 13282344
Médico:,Wilton Bezerra  Da Silva Filho  - 4601,Médico: Leonidas Moreira Dias Neto - 62545
Preparador Físico:,Jailton Cintra Peixoto De Vasconcelos  - 974,Preparador Físico: Edy Carlos Toporowicz - 7447
Massagista:,Fernando Jose Mendes  - 2873821,Massagista: Silvio Junio Nunes  Da Silva - 4761735
Preparador De GoleiroJo: ão Paulo Gomes Lacerda - 9162953,,Preparador De GoleiroS:i lvio Siqueira Jardim  - 3153303
"",,,,,Gols,
Tempo,1T/2T,No,Tipo,Nome do Jogador,,Equipe
33:00,2T,10,NR,Matheus Leonardo Sales Cardoso,,América/MG
"",,,Substituições,
Tempo,1T/2T,Equipe,Entrou,Saiu
32:00,1T,Santa Cruz/PE,10 - Natan Carneiro de Lima,14 - Wellington Cezar Alves de ...
13:00,2T,Santa Cruz/PE,36 - Bruno Paulo Machado Barbo ...,97 - Andre Luis da Costa Alfre ...
14:00,2T,Santa Cruz/PE,99 - Ricardo Bueno da Silva,23 - Edinaldo Batista Libanio
23:00,2T,América/MG,23 - Renan Henrique Oliveira V ...,21 - Ruy Franco de Almeida Jun ...
34:00,2T,América/MG,20 - Marcos Venancio de Albuqu ...,2 - Norberto Pereira Marinho  ...
40:00,2T,América/MG,5 - Jose Ricardo Barbosa Ribe ...,10 - Matheus Leonardo Sales Ca ...
