"",Arbitragem
Arbitro:,Wanderson Alves de Sousa (AB / MG)
Arbitro Assistente 1:,Sidmar dos Santos Meurer (AB / MG)
Arbitro Assistente 2:,Magno Arantes Lira (CD / MG)
Quarto Arbitro:,José Ricardo Vasconcellos Laranjeira (AB / AL)
Delegado Local:,David de Holanda Fonseca (CBF / )
Analista de Campo:,Hercules Martins da Silva (CBF / AL)
"",,,Cronologia,,,
"",1o Tempo,,2o Tempo,,,
Entrada do mandante:,21:20Atraso:,,Não Houve Entrada do mandante: 22:32,Atraso:,,Não Houve
Entrada do visitante:,21:20Atraso:,,Não Houve Entrada do visitante: 22:32,Atraso:,,Não Houve
Início 1o Tempo:,21:30 Atraso:,,Não Houve Início do 2o Tempo: 22:34,Atraso:,,Não Houve
Término do 1o Tempo:,22:19 Acréscimo:,,4 min Término do 2o Tempo: 23:23,Acréscimo:,,4 min
Resultado do 1o Tempo: 1 X 1,,,Resultado Final: 2 X 2,,,
"",,,,Relação de Jogadores,,,
"",,Crb / AL,,,Náutico / PE,,
No,Apelido,Nome Completo T/R P/A,,CBF No Apelido,Nome Completo,T/R P/A,CBF
1,Edson,Edson Kõlln T(g),P,311099 1 Jefferson,Jefferson Adelino da...,T(g) P,324879
2,Edson Rati ...,Edson Ramos da Silva T,P,167070 2 Sueliton,Sueliton Pereira de ...,T P,171745
3,Flavio Boa ...,Flavio de Souza Boav ... T,P,180253 3 Rafael,Rafael Ribeiro Alves,T P,402646
4,Adalberto,Adalberto Hilario Fe ... T,P,165391 4 Aislan,Aislan Paulo Lotici Back,T P,180866
5,Olivio,Olivio Aparecido Costa T,P,178674 5 Amaral,Anderson Omar Lima d...,T P,292274
6,Diego,Diego Pereira Correa T,P,161603 6 Manoel,Manoel Ferreira Lima...,T P,448273
7,Yuri,Yuri Naves Roberto T,P,177357 7 Cal,Carlos Alberto Matos...,T P,418036
8,Danilo,Danilo Pires Costa T,P,302560 8 Renan,Renan Paulino de Souza,T P,351174
9,Ze Carlos,Jose Carlos Ferreira ... T,P,148961 9 Bruno,Bruno da Mota Miranda,T P,296811
10,Elvis,Elvis Vieira Araujo T,P,183975 10 Giovanni,Giovanni Piccolomo,T P,318493
11,João Paulo,Joao Paulo de Assis  ... T,P,363827 11 Rafinha,Rafael Allan Mollercke,T P,350792
12,Bruno,Bruno Pianissolla R(g),P,174237 12 Gustavo,Gustavo Busatto,R(g) P,186958
13,Marcos,Marcos Martins dos Anjos R,P,184247 13 Leo,Carlos Leonardo Gonc...,R P,303714
14,Gabriel,Gabriel de Paulo Limeira R,P,141931 14 Jobson Souza,Jobson Souza Santos,R P,529172
15,Audálio,Jose Audalio Silva S ... R,P,172203 15 Joazi,Joazi Oliveira da Silva,R P,392907
16,Pedro Bote ...,Pedro Roberto Silva  ... R,P,183902 16 David,David Junio Manoel d...,R P,404381
17,Adriano,Adriano Bispo dos Santos R,P,175513 17 Geronimo,Geronimo da Silva Lopes,R P,411528
18,Rodrigo,Rodrigo de Souza Fonseca R,P,293529 18 Leilson,Leilson Dantas de Ol...,R P,421785
19,Tinga,Luiz Otavio Santos d ... R,P,175754 25 Bruno,Bruno Ferreira Ventu...,R P,325261
20,Neto Baiano,Euvaldo Jose de Agui ... R,P,160251,,,
21,Rodolfo,Rodolfo de Almeida G ... R,P,308733,,,
22,Pablo,Pablo Diogo Lopes de ... R,P,312907,,,
23,Erick,Erick Lender Salles R,P,322960,,,
"",,Comissão Técnica
"",Crb / AL,Náutico / PE
Técnico:,Uiles Geraldo Gonçalves Freitas Junior - CREF 037092 SPPreparador Físico:,Aaron Jose De Barros De Alencar Carvalho - 6936-G/PE
Auxiliar Técnico:,Marcelo Henrique Dias Silva - 23.422.307-8 SP,Supervisor: Bruno Ricardo Vieira De Melo - 1302062450
Médico:,Orlando Baia - 2461-AL,Fisiologista: Gustavo Adolfo Rezende Gomes Leal - 3806422478
Preparador Físico:,Adriano De Oliveira Gomes - 001148-AL,Técnico: Jose Roberto Fernandes Barros - 3701706 SSP-PE
Massagista:,Francisco De Assis Rodrigues Miranda - 2002001196558ALAuxiliar Técnico:,Levi Marcelino Gomes - 631987-2 SSP-PB
Preparador De GoleiroL:u ciano Dias Fragoso - 1.167.765 AL,,Médico: Renato Camerino Carneiro Leal Paes Barreto - 18121/PE
"",,Treinador De GoleirosW: ashington Paulino De Araujo - 22471588468
"",,Massagista: Gustavo Adolfo Rezende G. Leal - 6046155 SSP-PE
"",,Preparador De GoleiroW: ashington Paulino De Araujo - 1927664 SSP-PE
"",,,,,Gols,
Tempo,1T/2T,No,Tipo,Nome do Jogador,,Equipe
28:00,1T,2,NR,Sueliton Pereira de Aguiar,,Náutico/PE
+2,1T,11,NR,Joao Paulo de Assis Penha,,Crb/AL
37:00,2T,9,NR,Bruno da Mota Miranda,,Náutico/PE
39:00,2T,20,NR,Euvaldo Jose de Aguiar Neto,,Crb/AL
"",,,,Substituições,
Tempo,1T/2T,,Equipe,Entrou,Saiu
15:00,2T,Náutico/PE,,17 - Geronimo da Silva Lopes,7 - Carlos Alberto Matos Rodr ...
18:00,2T,Náutico/PE,,18 - Leilson Dantas de Oliveir ...,11 - Rafael Allan Mollercke
23:00,2T,Crb/AL,,23 - Erick Lender Salles,10 - Elvis Vieira Araujo
23:00,2T,Crb/AL,,20 - Euvaldo Jose de Aguiar Ne ...,9 - Jose Carlos Ferreira Filh ...
26:00,2T,Náutico/PE,,16 - David Junio Manoel dos Sa ...,2 - Sueliton Pereira de Aguia ...
33:00,2T,Crb/AL,,16 - Pedro Roberto Silva Botel ...,7 - Yuri Naves Roberto
