"",,Arbitragem
Arbitro:,Leonardo Garcia Cavaleiro (AB / RJ),
Arbitro Assistente 1:,Joao Luiz Coelho de Albuquerque (AB / RJ),
Arbitro Assistente 2:,Carlos Henrique Alves de Lima Filho (AB / RJ),
Quarto Arbitro:,Gleydson Ferreira Leite (CD / PE),
Analista de Campo:,Erich Bandeira (CBF / PE),
"",,,Cronologia,,,
"",1o Tempo,,2o Tempo,,,
Entrada do mandante:,19:10Atraso:,,Não Houve Entrada do mandante: 20:15,Atraso:,,Não Houve
Entrada do visitante:,19:10Atraso:,,Não Houve Entrada do visitante: 20:14,Atraso:,,Não Houve
Início 1o Tempo:,19:15 Atraso:,,Não Houve Início do 2o Tempo: 20:17,Atraso:,,Não Houve
Término do 1o Tempo:,20:02 Acréscimo:,,2 min Término do 2o Tempo: 21:08,Acréscimo:,,6 min
Resultado do 1o Tempo: 0 X 0,,,Resultado Final: 0 X 0,,,
"",,,,Relação de Jogadores,,,
"",,Santa Cruz / PE,,,Ceará / CE,,
No,Apelido,Nome Completo T/R P/A,,CBF No Apelido,Nome Completo,T/R P/A,CBF
1,Julio Cesar,Julio Cesar de Souza ... T(g),P,150963 1 Everson,Everson Felipe Marqu...,T(g) P,188398
4,Anderson,Anderson Aparecido S ... T,P,178500 2 Cametá,Tiago Coelho Andrade,T P,392058
8,Derley,Wanderley de Jesus Sousa T,P,166491 6 Romario,Romario Guilherme do...,T P,305959
14,Wellington,Wellington Cezar Alv ... T,P,370555 8 Ricardinho,Ricardo Dias Acosta,T P,169114
23,Grafite,Edinaldo Batista Libanio T,P,147010 13 Luiz,Luiz Otavio Anacleto...,T P,291651
28,Paulo,Joao Paulo da Silva  ... T,P,371170 26 Richardson,Richardson Fernandes...,T P,328312
75,Nininho,Salatiel Bartolomeu  ... T,P,313712 33 Rafael,Rafael Pereira dos S...,T P,170563
83,Sandro,Sandro Silva de Souza T,P,172036 36 Leandro,Leandro Carvalho da ...,T P,417861
88,Costa,Tiago da Costa Silva T,P,188960 45 Vinicius,Vinicius Moreira de Lima,T P,403112
93,Thiago,Thiago de Almeida Primão T,P,308568 88 Pedro Ken,Pedro Ken Marimoto M...,T P,170095
97,Andre Luis,Andre Luis da Costa  ... T,P,321636 99 Elton,Elton Rodrigues Brandao,T P,162905
12,Jacsson,Jacsson Antonio Wich ... R(g),P,323887 3 Tiago,Tiago dos Santos Alves,R(g) P,167723
7,Joao,Joao Ananias Jordao  ... R,P,337194 10 Felipe,Felipe Menezes Jacomo,R P,179098
9,Halef,Halef Silva Melo R,P,428817 12 Diego,Diego Franco Teixeir...,R P,404831
10,Natan,Natan Carneiro de Lima R,P,300075 17 Raul,Raul Lo Goncalves,R P,446399
11,Wiliam Bar ...,Wiliam Silva Gomes B ... R,P,307680 30 Pio,Francisco Hercules d...,R P,169274
15,Walber,Walber da Silva Sous ... R,P,173921 35 Rafael Car ...,Rafael Bruno Cajueir...,R P,321847
17,Yuri,Yuri Antonio Costa d ... R,P,317384 40 Arthur,Arthur Mendonça Cabral,R P,518820
21,Guilherme,Guilherme Cruz de Mattis R,P,291534 77 Maikon,Maikon Fernando Souz...,R P,184685
22,Lucas,Lucas Gomes Vieira R,P,382358 90 Lele,Wesley de Jesus Correia,R P,191513
33,Julio,Julio Cesar do Nasci ... R,P,140655,,,
36,Bruno,Bruno Paulo Machado  ... R,P,185095,,,
99,Ricardo Bu ...,Ricardo Bueno da Silva R,P,179974,,,
"",,Comissão Técnica
"",Santa Cruz / PE,Ceará / CE
Técnico:,Marcelo Martelotte - 92023,Auxiliar Técnico: Carlos Andre Goncalves Cunha - 45654174487
Auxiliar Técnico:,Antonio Carlos Ribeiro Junior - 137511358-55,Supervisor: Cristiano Bruno Ibiapina De Sousa - 2489239350
Médico:,João Paulo Lins De Albuquerque Lafayette Araujo - 17461,Médico: Daniel Gomes Costa - 64098621304
Preparador Físico:,Jailton Cintra Peixoto De Vasconcelos - 974-G/PE,Treinador De GoleirosE:v eraldo Goncalves Santana - 94772495487
Massagista:,Paulo Fernando De Araújo Melo - 2881691,Técnico: Marcelo Augusto Oliveira Chamusca - 41427602549
Preparador De GoleiroJo: ão Paulo Gomes Larcerda - 9162953,,Preparador Físico: Roger Gouveia E Silva - 93077521334
"",,Fisioterapeuta: Wellington Lima De Alencar - 84842199334
"",,Massagista: Wellington Lima De Alencar - 57281-F
"",,Preparador De GoleiroE:v eraldo Gonçalves Santana - 947724954-87
"",,,,Substituições,
Tempo,1T/2T,,Equipe,Entrou,Saiu
45:00,INT,Ceará/CE,,30 - Francisco Hercules de Ara ...,2 - Tiago Coelho Andrade
12:00,2T,Santa Cruz/PE,,36 - Bruno Paulo Machado Barbo ...,97 - Andre Luis da Costa Alfre ...
20:00,2T,Santa Cruz/PE,,11 - Wiliam Silva Gomes Barbio ...,93 - Thiago de Almeida Primão
25:00,2T,Ceará/CE,,40 - Arthur Mendonça Cabral,99 - Elton Rodrigues Brandao
29:00,2T,Santa Cruz/PE,,99 - Ricardo Bueno da Silva,23 - Edinaldo Batista Libanio
32:00,2T,Ceará/CE,,10 - Felipe Menezes Jacomo,8 - Ricardo Dias Acosta
