"",,Arbitragem
Arbitro:,Leonardo Garcia Cavaleiro (AB / RJ),
Arbitro Assistente 1:,Michael Correia (AB / RJ),
Arbitro Assistente 2:,Silbert Faria Sisquim (CD / RJ),
Quarto Arbitro:,Rodrigo Gomes Paes Domingues (CD / SP),
Delegado Local:,Joel Teixeira Caires (CBF / SP),
Analista de Campo:,Silvio Cesar Silva de Lima (CBF / SP),
"",,,Cronologia,,,
"",1o Tempo,,2o Tempo,,,
Entrada do mandante:,20:20Atraso:,,Não Houve Entrada do mandante: 21:24,Atraso:,,Não Houve
Entrada do visitante:,20:20Atraso:,,Não Houve Entrada do visitante: 21:23,Atraso:,,Não Houve
Início 1o Tempo:,20:30 Atraso:,,Não Houve Início do 2o Tempo: 21:30,Atraso:,,Não Houve
Término do 1o Tempo:,21:15 Acréscimo:,,Não Houve Término do 2o Tempo: 22:31,Acréscimo:,,5 min
Resultado do 1o Tempo: 0 X 0,,,Resultado Final: 1 X 0,,,
"",,,,Relação de Jogadores,,,
"",,Oeste / SP,,,Brasil / RS,,
No,Apelido,Nome Completo T/R P/A,,CBF No Apelido,Nome Completo,T/R P/A,CBF
1,Rodolfo,Rodolfo Alves de Melo T(g),P,181632 1 Marcelo Pi ...,Marcelo Pitol,T(g) P,143611
2,Daniel Bor ...,Daniel Fortunato Borges T,P,322852 2 Eder,Eder Sciola Santana,T P,175135
3,Joilson,Joilson de Jesus Dem ... T,P,326727 3 Leandro Ca ...,Leandro Camilo de Al...,T P,172296
4,Leandro,Leandro Amaro dos Sa ... T,P,168608 4 Nirley,Nirley da Silva Fonseca,T P,295587
5,Wilson Mat ...,Wilson Tiago Matias T,P,148183 5 Leandro,Leandro Leite Mateus,T P,146430
6,Guilherme,Guilherme Kennedy Romao T,P,419442 6 Marlon,Marlon Farias Castel...,T P,183840
7,Indio,Raphael Luz Pessoa T,P,181334 7 Cassiano,Cassiano Dias Moreira,T P,181681
8,Lidio,Lidio Ferreira Carmo ... T,P,346815 8 Itaqui,Odacir Pereira da Silva,T P,166053
9,Gabriel Mo ...,Gabriel Monteiro Vas ... T,P,317271 9 Juninho,Olavio Vieira dos Sa...,T P,389611
10,Mazinho,Anderson Soares da Silva T,P,181254 10 Rafinha,Rafael Diniz Alves e...,T P,321556
11,Daniel,Daniel Sampaio Simoes T,P,308495 11 Marcio,Marcio Augusto da Si...,T P,440927
12,Felipe,Felipe Alves Raymundo R(g),P,177931 12 Carlos,Carlos Eduardo Soare...,R(g) P,309585
13,William,William Cordeiro Melo R,P,350365 13 Cirilo,Jeferson Cirilo Mesq...,R P,140044
14,Daniel,Daniel Carvalho da Silva R,P,155651 14 Ednei,Ednei Ferreira de Ol...,R P,171685
15,Vinicius,Andre Vinicius Lima  ... R,P,189004 15 Wender,Wender Almeida Silva,R P,142654
16,Ricardinho,Ricardo Alexandre Ri ... R,P,421809 16 Aloisio,Aloisio Pereira Magnago,R P,169861
17,Velicka,Leandro Nunes Velicka R,P,164453 17 Misael,Misael Silva Jansen,R P,169800
18,Robert,Robert de Pinho de Souza R,P,140778 18 Lincon,Orlando Francisco Pi...,R P,166124
19,Jheimy,Jheimy da Silva Carvalho R,P,187746 19 Elias,Elias dos Santos Bueno,R P,362991
20,Fabricio,Fabricio Silva Costa R,P,457301,,,
21,Fabio,Fabio Roberto Gomes  ... R,P,432298,,,
23,Kallyl,Kleber Kallyl dos Sa ... R,P,329430,,,
25,Cosmo,Cosmo Henrique Fonse ... R,P,430582,,,
"",,Comissão Técnica
"",Oeste / SP,Brasil / RS
Médico:,Aluisio Azevedo Abrantes - 61885,Técnico: Clemer Melo Da Silva - 9098976534
Técnico:,Roberto Fernando Schneiger - 3324441,Auxiliar Técnico: Rubens Vanderlei Tavares Cardoso - 23617458-6
Auxiliar Técnico:,Renan Roberto Freitas - 43693245,Médico: Jose Antonio Ustra Zaquia Alam - 98709
Preparador Físico:,Wiliam Cesar Hauptmam - 4244-G/SP,Preparador Físico: João Roberto Ramos Goulart - 4422-G/RS
Massagista:,Marcelo Jose Da Silva - 26713464,Massagista: Paulo Sergio Gonçalves Teixeira - 241166652
Preparador De GoleiroC:l everson Fernando Lopes - 6600516-0,,Preparador De GoleiroA:l ex Lessa Afonso - 6066791374
"",,,,,Gols,
Tempo,1T/2T,No,Tipo,Nome do Jogador,,Equipe
08:00,2T,18,NR,Robert de Pinho de Souza,,Oeste/SP
"",,,,Substituições,
Tempo,1T/2T,,Equipe,Entrou,Saiu
45:00,INT,Oeste/SP,,25 - Cosmo Henrique Fonseca da ...,11 - Daniel Sampaio Simoes
45:00,INT,Oeste/SP,,18 - Robert de Pinho de Souza,9 - Gabriel Monteiro Vasconce ...
17:00,2T,Brasil/RS,,17 - Misael Silva Jansen,7 - Cassiano Dias Moreira
22:00,2T,Oeste/SP,,15 - Andre Vinicius Lima de Ol ...,3 - Joilson de Jesus Demetrio ...
31:00,2T,Brasil/RS,,18 - Orlando Francisco Pires J ...,9 - Olavio Vieira dos Santos  ...
44:00,2T,Brasil/RS,,19 - Elias dos Santos Bueno,11 - Marcio Augusto da Silva B ...
