"",Arbitragem
Arbitro:,Vinicius Goncalves Dias Araujo (AB / SP)
Arbitro Assistente 1:,Rogerio Pablos Zanardo (AB / SP)
Arbitro Assistente 2:,Herman Brumel Vani (AB / SP)
Quarto Arbitro:,Roberto Giovanny Oliveira Silva (CD / GO)
Delegado Local:,Adalberto Grecco (CBF / )
Analista de Campo:,Júlio César Mota Fernandes (CBF / GO)
"",,,Cronologia,,,
"",1o Tempo,,2o Tempo,,,
Entrada do mandante:,20:20Atraso:,,Não Houve Entrada do mandante: 21:27,Atraso:,,Não Houve
Entrada do visitante:,20:20Atraso:,,Não Houve Entrada do visitante: 21:27,Atraso:,,Não Houve
Início 1o Tempo:,20:30 Atraso:,,Não Houve Início do 2o Tempo: 21:30,Atraso:,,Não Houve
Término do 1o Tempo:,21:15 Acréscimo:,,Não Houve Término do 2o Tempo: 22:20,Acréscimo:,,5 min
Resultado do 1o Tempo: 0 X 0,,,Resultado Final: 0 X 1,,,
"",,,,Relação de Jogadores,,,
"",,Goiás / GO,,,Londrina / PR,,
No,Apelido,Nome Completo,T/R P/A,CBF No Apelido,Nome Completo T/R P/A,,CBF
1,Marcelo,Marcelo Rangel Rosa,T(g) P,186722 1 Cesar,Cesar Augusto Soares... T(g),P,409084
2,Matheus Fe ...,Matheus Ferraz Pereira,T P,175475 2 Reginaldo,Reginaldo Lopes de Jesus T,P,353336
4,Alex,Alex Alves Cardoso,T P,300744 3 Gustavo,Gustavo Silva Conceicao T,P,175138
11,Tiago Luis,Tiago Luis Martins,T P,175323 4 Matheus,Matheus Borges Domingues T,P,301741
13,Carlinho,Carlos Emiliano Pereira,T P,186140 5 Romulo,Romulo da Silva Machado T,P,379397
19,Michael,Michael Richard Delg ...,T P,534667 6 Ayrton,Ayrton Lucas Dantas ... T,P,432491
20,Tony,Tony Ewerton Ramos d ...,T P,295880 7 Alisson,Alisson Pelegrini Safira T,P,351040
21,Toro,Rafael Toro Ferreira ...,T P,157287 8 Jardel,Jardel Lauermann T,P,167975
23,Pedrinho,Pedro Gonzaga,T P,298432 9 Jonatas,Jonatas Elias Belusso T,P,180181
33,Andrezinho,Andre Luiz Tavares,T P,144360 10 Artur,Artur Victor Guimaraes T,P,419646
99,Gustavo,Gustavo Henrique da  ...,T P,453172 11 Rafael Gava,Rafael Gustavo Meneg... T,P,313001
7,Carlos,Carlos Eduardo Ferre ...,R P,408134 12 Alan,Alan Jose Bernardon R(g),P,326968
10,Jean,Jean Carlos Vicente,R P,292976 13 Marcondes,Marcondes de Jesus S... R,P,311339
12,Matheus,Matheus Alves da Sil ...,R P,381586 14 Lucas Ramon,Lucas Ramon Batista ... R,P,376828
14,Everton Sena,Antonio Everton Sena ...,R P,310724 15 Igor,Igor dos Santos Miranda R,P,445199
15,Ramires,Ramires dos Anjos Alves,R P,186557 16 Elias,Elias Nascimento Felicio R,P,308624
16,Helder,Helder Maurilio da S ...,R P,179928 17 Marcio,Marcio Barbosa Vieir... R,P,441035
17,Jarlan,Jarlan Pinheiro da Silva,R P,407956 18 Wellisson,Wellisson Almeida Nunes R,P,525810
18,Aylon,Aylon Darwin Tavella,R P,355362 19 Fabinho,Fabio Souza dos Santos R,P,161253
22,Marcio,Marcio Luiz Silva Lo ...,R P,129274 20 Carlos,Carlos Henrique Alve... R,P,348899
25,Thalles,Thalles Gabriel Mora ...,R P,428831,,,
"",,Comissão Técnica
"",Goiás / GO,Londrina / PR
Técnico:,Silvio Nicoladelli - 767.654.669-91,Auxiliar Técnico: Alessio Da Costa Antunes - 73089370972
Auxiliar Técnico:,José Carlos Garcia Leal - 924.483.721-87,Técnico: Claudio Aparecido Tencati - 88360520968
Médico:,Mauro Pereira Machado - 5303,Treinador De GoleirosE:d son Luiz Da Silva - 80516483900
Preparador Físico:,Danny Sergio Guissoni - 1414-G-GO,Preparador Físico: Joao Carlos Martins Ruiz - 945-g/sp
Massagista:,José Carlos Da Silva Buri - 418.917.671-00,Fisioterapeuta: Joilson Amorim Ferreira - 6846789855
Preparador De GoleiroM:a rlos Gomes Santos - 624.759.161-68,,Supervisor: Mauricio Liston Trombetta - 7361497918
"",,Médico: Pablo Erick Alves Villa - 10868
"",,Massagista: Joilson Amorim Ferreira - 23814
"",,Preparador De GoleiroE:d son Luiz Da Silva - 80516483900
"",,,,,Gols,
Tempo,1T/2T,No,Tipo,Nome do Jogador,,Equipe
37:00,2T,20,NR,Carlos Henrique Alves Pereira,,Londrina/PR
"",,,,Substituições,
Tempo,1T/2T,,Equipe,Entrou,Saiu
+1:00,2T,Londrina/PR,,15 - Igor dos Santos Miranda,11 - Rafael Gustavo Meneghel G ...
16:00,2T,Londrina/PR,,20 - Carlos Henrique Alves Per ...,7 - Alisson Pelegrini Safira
17:00,2T,Goiás/GO,,10 - Jean Carlos Vicente,21 - Rafael Toro Ferreira Fran ...
29:00,2T,Goiás/GO,,18 - Aylon Darwin Tavella,11 - Tiago Luis Martins
29:00,2T,Londrina/PR,,16 - Elias Nascimento Felicio,5 - Romulo da Silva Machado
29:00,2T,Goiás/GO,,7 - Carlos Eduardo Ferreira d ...,19 - Michael Richard Delgado d ...
