"",,Arbitragem
Arbitro:,Bruno Arleu de Araujo (AB / RJ),
Arbitro Assistente 1:,Eduardo de Souza Couto (AB / RJ),
Arbitro Assistente 2:,Gabriel Conti Viana (AB / RJ),
Quarto Arbitro:,Thiago Luiz Scarascati (CD / SP),
Delegado Local:,Abel Barrozo Sobrinho (CBF / ),
Analista de Campo:,Carlos Donizeti Pianosqui (CBF / SP),
"",,,Cronologia,,,
"",1o Tempo,,2o Tempo,,,
Entrada do mandante:,16:20Atraso:,,Não Houve Entrada do mandante: 17:31,Atraso:,,Não Houve
Entrada do visitante:,16:20Atraso:,,Não Houve Entrada do visitante: 17:30,Atraso:,,Não Houve
Início 1o Tempo:,16:30 Atraso:,,Não Houve Início do 2o Tempo: 17:33,Atraso:,,Não Houve
Término do 1o Tempo:,17:18 Acréscimo:,,3 min Término do 2o Tempo: 18:21,Acréscimo:,,3 min
Resultado do 1o Tempo: 3 X 1,,,Resultado Final: 4 X 1,,,
"",,,,Relação de Jogadores,,,
"",,Oeste / SP,,,Boa / MG,,
No,Apelido,Nome Completo T/R P/A,,CBF No Apelido,Nome Completo T/R P/A,,CBF
1,Rodolfo,Rodolfo Alves de Melo T(g),P,181632 1 Fabricio,Fabricio Barros Santana T(g),P,178321
2,Daniel Bor ...,Daniel Fortunato Borges T,P,322852 2 Ruan,Ruan Gregorio Teixeira,T P,320017
3,Joilson,Joilson de Jesus Dem ... T,P,326727 3 Caique,Caique Aredes de Oli...,T P,313534
4,Leandro,Leandro Amaro dos Sa ... T,P,168608 4 Antonio,Julio Cesar dos Santos,T P,138323
5,Lidio,Lidio Ferreira Carmo ... T,P,346815 5 Radames,Radames Martins Rodr...,T P,161201
6,Guilherme,Guilherme Kennedy Romao T,P,419442 6 Paulo Victor,Paulo Victor da Silva,T P,351920
7,Indio,Raphael Luz Pessoa T,P,181334 7 Reis,Isnairo Reis Silva M...,T P,370113
8,Joao Roberto,Joao Roberto Custodio T,P,294996 8 Diones,Diones Coelho da Costa,T P,172714
9,Gabriel Mo ...,Gabriel Monteiro Vas ... T,P,317271 9 Anselmo,Anselmo Arruda da Silva,T P,309315
10,Mazinho,Anderson Soares da Silva T,P,181254 10 Thaciano,Thaciano Mickael da ...,T P,391953
11,Daniel,Daniel Sampaio Simoes T,P,308495 11 Rodolfo,Rodolfo Jose da Silv...,T P,423003
12,Felipe,Felipe Alves Raymundo R(g),P,177931 12 Daniel,Daniel Luiz Flumignan R(g),P,128723
13,Daniel,Daniel Carvalho da Silva R,P,155651 14 Laercio,Laercio Solda,R P,361960
14,Rodrigo,Rodrigo Eduardo da Silva R,P,419498 15 Leonardo,Leonardo Lima dos Santos,R P,330362
15,Vinicius,Andre Vinicius Lima  ... R,P,189004 16 Douglas,Douglas Assis de Oli...,R P,174616
16,Ricardinho,Ricardo Alexandre Ri ... R,P,421809 17 Elivelton,Elivelton Lima Despl...,R P,451817
17,Wilson Mat ...,Wilson Tiago Matias R,P,148183 18 Ramon,Ramon Rodrigo de Freitas,R P,152825
18,Robert,Robert de Pinho de Souza R,P,140778 19 Wesley,Wesley Pacheco Gomes,R P,189920
19,Alexandro,Alexandro da Silva B ... R,P,172513 20 Leonardo,Leonardo Bartholo Prando,R P,175026
20,Pedro,Pedro Gabriel Pereir ... R,P,542491 21 Alyson,Alyson Santos Silva,R P,432166
21,Memi,Guilherme Gomes Garutti R,P,317730,,,
23,Kallyl,Kleber Kallyl dos Sa ... R,P,329430,,,
25,Cosmo,Cosmo Henrique Fonse ... R,P,430582,,,
"",,Comissão Técnica
"",Oeste / SP,Boa / MG
Técnico:,Roberto Fernando Schneiger - 558313629-49,Técnico: Valdonedo Da Silva Xavier - 233220639-68
Auxiliar Técnico:,Renan Roberto De Freitas - 331950118-67,Auxiliar Técnico: Carlos Cesar Felix Barbosa - 726000986-15
Médico:,Daniel Floriano Dos Santos - 46642,Médico: Francisco Carvalho Seda - 140284
Preparador Físico:,Wiliam Cesar Hauptmam - 004244-G/SP,Preparador Físico: Robert Yoshio Santos Hori - 006652-G/SP
Massagista:,Marcelo Jose Da Silva - 266922138-60,Massagista: Antonio Marcos De Paula - 431278786-72
Preparador De GoleiroC:l everson Fernando Lopes - 023482459-06,,Preparador De GoleiroJu: lio Jose Cardoso Da Silva - 015858417-14
"",,,,,Gols,
Tempo,1T/2T,No,Tipo,Nome do Jogador,,Equipe
05:00,1T,7,PN,Raphael Luz Pessoa,,Oeste/SP
12:00,1T,5,NR,Lidio Ferreira Carmo Filho,,Oeste/SP
24:00,1T,7,NR,Raphael Luz Pessoa,,Oeste/SP
37:00,1T,10,NR,Thaciano Mickael da Silva,,Boa/MG
41:00,2T,10,PN,Anderson Soares da Silva,,Oeste/SP
"",,,,Substituições,
Tempo,1T/2T,,Equipe,Entrou,Saiu
45:00,INT,Boa/MG,,20 - Leonardo Bartholo Prando,5 - Radames Martins Rodrigues ...
45:00,INT,Oeste/SP,,15 - Andre Vinicius Lima de Ol ...,6 - Guilherme Kennedy Romao
13:00,2T,Boa/MG,,18 - Ramon Rodrigo de Freitas,7 - Isnairo Reis Silva Morais ...
28:00,2T,Boa/MG,,15 - Leonardo Lima dos Santos,9 - Anselmo Arruda da Silva
31:00,2T,Oeste/SP,,25 - Cosmo Henrique Fonseca da ...,7 - Raphael Luz Pessoa
38:00,2T,Oeste/SP,,18 - Robert de Pinho de Souza,9 - Gabriel Monteiro Vasconce ...
