"",Arbitragem
Arbitro:,Arilson Bispo da Anunciacao (CD / BA)
Arbitro Assistente 1:,Gustavo Rodrigues de Oliveira (AB / SP)
Arbitro Assistente 2:,Evandro de Melo Lima (CD / SP)
Quarto Arbitro:,Adriano de Assis Miranda (CD / SP)
Assessor:,Carlos Donizeti Pianosqui (CBF / SP)
Delegado Local:,MARIO SERGIO BALDINI CAULADA ( / )
"",,,Cronologia,,,
"",1o Tempo,,2o Tempo,,,
Entrada do mandante:,18:50Atraso:,,Não Houve Entrada do mandante: 19:58,Atraso:,,Não Houve
Entrada do visitante:,18:50Atraso:,,Não Houve Entrada do visitante: 19:58,Atraso:,,Não Houve
Início 1o Tempo:,19:00 Atraso:,,Não Houve Início do 2o Tempo: 20:00,Atraso:,,Não Houve
Término do 1o Tempo:,19:45 Acréscimo:,,Não Houve Término do 2o Tempo: 20:48,Acréscimo:,,3 min
Resultado do 1o Tempo: 1 X 0,,,Resultado Final: 1 X 0,,,
"",,,,Relação de Jogadores,,,
"",,Portuguesa / SP,,,Desportiva / ES,,
No,Apelido,Nome Completo,T/R P/A,CBF No Apelido,Nome Completo T/R P/A,,CBF
1,Ricardo,Ricardo Ferreira Berna,T(g) P,135462 1 Felipe Higo,Felipe Higo Guedes Bento T(g),P,167413
2,Amaral,Antonio Cleilson da  ...,T P,174615 2 Silva,Wanderson Fontes da ... T,P,184326
3,Gabriel,Gabriel dos Santos N ...,T P,142460 3 Rafael,Rafael Olioza T,P,307505
4,Vinicius,Vinicius Ciganha Mar ...,T P,183895 4 Lacraia,Rodrigo de Paula Oli... T,P,182614
5,Dinho,Osvaldo Rabelo de Souza,T P,168419 5 Caetano,Bruno Caetano de Sousa T,P,167722
6,Thiago Fel ...,Thiago Henrique Feltri,T P,168132 6 Erick,Erick Fernando Brand... T,P,341489
7,Luiz Henri ...,Luiz Henrique Alves  ...,T P,356113 7 Thiago,Thiago Ramos da Silva T,P,369703
8,Tarik,Tarik Michel Kedes B ...,T P,294486 8 Damiao,Damiao Martins dos Reis T,P,320537
9,Adilson,Adilson dos Santos Souza,T P,163706 9 Weldon,Weldon Santos de Andrade T,P,142887
10,Leandro,Leandro Domingues Ba ...,T P,146539 10 Zizu,Iresanio Antonio da ... T,P,298776
11,Marcelinho ...,Marcelo dos Santos,T P,118442 11 Marquinhos,Marco Antonio Morgon... T,P,291282
12,Douglas,Douglas Lima da Cruz,R P,355162 12 Edgar,Edgar Sales Goncalves R,P,175037
13,Cleison,Cleison Oliveira Cos ...,R P,383553 13 Diogo,Diogo Ferreira R,P,178086
14,Bruno,Bruno de Oliveira Souza,R P,426272 14 Marcos,Marcos Vinicius Souz... R,P,319975
15,Jonatas,Jonatas Barbosa Rodr ...,R P,349845 15 Madison,Madison Leppaus do N... R,P,343581
16,Paulinho,Paulo Henrique Le Pe ...,R P,181457 16 Teldiano,Teldiano Guimaraes F... R,P,430532
17,Bruno Duarte,Bruno Duarte da Silva,R P,374084 17 Joao Vitor,Joao Vitor Ribeiro e... R,P,523187
18,Fernando,Fernando Nathan Padi ...,R P,338498 18 Paulo Vito ...,Paulo Vitor Amorim R,P,460541
"",,Comissão Técnica
"",Portuguesa / SP,Desportiva / ES
Técnico:,Estevam Eduardo Lemos Soares - 65118303,Técnico: Rafael Barcelos Soriano - 211300249
Auxiliar Técnico:,Gerson Jose Sodre - 361133376,Auxiliar Técnico: Fabiano Adriano Rossato - 1132271
Médico:,Dr Paulo Donizeti Forte - 75.130,Médico: . - .
Preparador Físico:,Jose Roberto Portella Carneiro - 5979-G/SP,Preparador Físico: Luiz Felipe Lacerda De Oliveira - 8345-G/ES
Massagista:,Joao Batista Ribeiro - 93704343,Massagista: Elder Pereira Campista - 2036777
Preparador De GoleiroS:e rgio Gomes De Miranda - 17813996,,Preparador De GoleiroR:e inaldo Saltori Louzada - 131053662
"",,,,,Gols,
Tempo,1T/2T,No,Tipo,Nome do Jogador,,Equipe
02:00,1T,3,NR,Gabriel dos Santos Nascimento,,Portuguesa/SP
"",,,Substituições,
Tempo,1T/2T,Equipe,Entrou,Saiu
21:00,2T,Portuguesa/SP,18 - Fernando Nathan Padilha d ...,9 - Adilson dos Santos Souza
22:00,2T,Desportiva/ES,16 - Teldiano Guimaraes Franca ...,11 - Marco Antonio Morgon Filh ...
30:00,2T,Desportiva/ES,15 - Madison Leppaus do Nascim ...,8 - Damiao Martins dos Reis
35:00,2T,Portuguesa/SP,17 - Bruno Duarte da Silva,11 - Marcelo dos Santos
39:00,2T,Portuguesa/SP,15 - Jonatas Barbosa Rodrigues ...,2 - Antonio Cleilson da Silva ...
42:00,2T,Desportiva/ES,18 - Paulo Vitor Amorim,10 - Iresanio Antonio da Silva ...
