"",,Arbitragem
Arbitro:,Daniel Victor Costa Silva (CD / RJ),
Arbitro Assistente 1:,Antonio Fernando de Sousa Santos (CD / MA),
Arbitro Assistente 2:,Djavan Costa da Silva (CD / MA),
Quarto Arbitro:,Paulo Sergio Santos Moreira (CD / MA),
Delegado Local:,Emanuel de Jesus dos Santos Sousa (CBF / ),
Analista de Campo:,Marcelo Bispo Nunes Filho (CBF / MA),
"",,,Cronologia,,,
"",1o Tempo,,2o Tempo,,,
Entrada do mandante:,15:50Atraso:,,Não Houve Entrada do mandante: 17:00,Atraso:,,Não Houve
Entrada do visitante:,15:50Atraso:,,Não Houve Entrada do visitante: 16:59,Atraso:,,Não Houve
Início 1o Tempo:,16:00 Atraso:,,Não Houve Início do 2o Tempo: 17:02,Atraso:,,Não Houve
Término do 1o Tempo:,16:47 Acréscimo:,,2 min Término do 2o Tempo: 17:53,Acréscimo:,,6 min
Resultado do 1o Tempo: 2 X 1,,,Resultado Final: 2 X 1,,,
"",,,,Relação de Jogadores,,,
"",,Cordino / MA,,,Altos / PI,,
No,Apelido,Nome Completo T/R P/A,,CBF No Apelido,Nome Completo,T/R P/A,CBF
1,Eduardo Al ...,Eduardo Fernandes Alves T(g),P,169526 1 Dida,Jose Virginio da Sil...,T(g) P,168927
2,Matheus da ...,Matheus da Silva Mon ... T,P,449550 2 dos Santos,Leonardo Santos do Vale,T P,189941
3,D Silva,Jaldo dos Prazeres Silva T,P,180245 3 Leone,Leone Barros Costa J...,T P,303516
4,Emerson,Emerson dos Anjos Cosmo T,P,442424 4 Marcelo,Marcelo do Amaral Mo...,T P,346376
5,Junior Negao,Fabio Costa Conceicao T,P,156319 5 Felipe,Felipe de Souza Macena,T P,348355
6,Bruno,Bruno Alves Gadelha T,P,304173 6 Jefferson,Jefferson Ferreira d...,T P,431127
7,Regis Pit  ...,Regino Tavares Viana T,P,292310 8 Vagner,Vagner Alves Tavares,T P,401122
8,Alison,Alison Pereira Reis T,P,379862 9 Manoel Cri ...,Manoel Cristiano Rib...,T P,187984
9,Anselmo,Anselmo Arruda da Silva T,P,309315 10 Esquerdinha,Sanaido Pereira da Silva,T P,337959
10,Ulisses,Ullisses Alves Viana T,P,185520 11 Alexsandro ...,Alexsandro Pimenta Vera,T P,517121
11,Rogerio,Rogerio Alves Nunes T,P,167243 19 Joelson,Joelson Franca Dias,T P,171747
12,Douglas,Douglas Mayer R(g),P,163746 7 Jeremias,Jeremias Everton de ...,R(g) P,426135
13,Pareira,Felipe Fereira de Araujo R,P,297405 12 Rodrigo,Rodrigo Carvalho,R P,159664
14,Bruno,Bruno Erlan Araujo R,P,293824 13 Vitor,Vitor Vericimo Salvador,R P,394716
15,Carlinhos,Carlos Sousa dos Santos R,P,369118 14 Chiquinho,Francisco Lopes dos ...,R P,188507
16,Lucas,Lucas Oliveira Costa R,P,501086 15 Neto,Pedro de Sousa Marti...,R P,369767
17,Jocivan,Jocivan Ferreira da  ... R,P,380115 16 Lima,Raimundo Nonato Lima...,R P,359001
18,Ronald,Ronald Leite Diniz R,P,180006 17 Leandro,Leandro Trajano de Lima,R P,350031
19,Jairo,Jairo da Silva Cunha R,P,590691 18 Joeliton,Joeliton Carvalho de...,R P,430412
21,Lucas Barb ...,Lucas Barbosa Damasceno R,P,455273 20 Patrick,Patrick dos Santos Silva,R P,363869
"",,Comissão Técnica
"",Cordino / MA,Altos / PI
Técnico:,Marlon Francisco Cutrim Rosa - 1033390MA,Técnico: Paulo Ricardo Kobayashi - 17738806SP
Auxiliar Técnico:,Xxxxxxxxxxxxxxxxxx - XXXXXXXXXX,Auxiliar Técnico: Marcelo De Almeida Copertino - 233184004SP
Médico:,Antonio Pereira Goveia Filho - 7256MA,Médico: Xxxxxxxxxxxxxxxxx - XXXXXXXXX
Preparador Físico:,Marcelo Da Silva Nunes - 2556MA,Preparador Físico: Gabriel Sousa  Junior - 739555979MA
Massagista:,Francisco Marcos Martins Lima - 43375290117MA,Massagista: Anfrisio Silva Araujo - 1651074PI
Preparador De GoleiroK:e zio Jovita - 100993999MA,,Preparador De GoleiroX:x xxxxxxxxxxx - XXXXXXXXX
"",,,,,Gols,
Tempo,1T/2T,No,Tipo,Nome do Jogador,,Equipe
16:00,1T,9,NR,Manoel Cristiano Ribeiro Lemes,,Altos/PI
24:00,1T,4,NR,Emerson dos Anjos Cosmo,,Cordino/MA
+1,1T,9,NR,Anselmo Arruda da Silva,,Cordino/MA
"",,,,Substituições,
Tempo,1T/2T,,Equipe,Entrou,Saiu
13:00,2T,Altos/PI,,20 - Patrick dos Santos Silva,6 - Jefferson Ferreira de Abr ...
15:00,2T,Cordino/MA,,13 - Felipe Fereira de Araujo,11 - Rogerio Alves Nunes
19:00,2T,Altos/PI,,18 - Joeliton Carvalho de Souz ...,5 - Felipe de Souza Macena
21:00,2T,Altos/PI,,7 - Jeremias Everton de Almei ...,11 - Alexsandro Pimenta Vera
38:00,2T,Cordino/MA,,18 - Ronald Leite Diniz,9 - Anselmo Arruda da Silva
