"",,Arbitragem
Arbitro:,Alisson Sidnei Furtado (AB / TO),
Arbitro Assistente 1:,Silbert Faria Sisquim (CD / RJ),
Arbitro Assistente 2:,Thiago Rosa de Oliveira (AB / RJ),
Quarto Arbitro:,Rejane Caetano da Silva (FIFA / RJ),
Analista de Campo:,Hilton Moutinho Rodrigues (CBF / BRA),
"",,,Cronologia,,,
"",1o Tempo,,2o Tempo,,,
Entrada do mandante:,17:50Atraso:,,Não Houve Entrada do mandante: 18:59,Atraso:,,Não Houve
Entrada do visitante:,17:50Atraso:,,Não Houve Entrada do visitante: 18:59,Atraso:,,Não Houve
Início 1o Tempo:,18:00 Atraso:,,Não Houve Início do 2o Tempo: 19:01,Atraso:,,Não Houve
Término do 1o Tempo:,18:46 Acréscimo:,,1 min Término do 2o Tempo: 19:51,Acréscimo:,,5 min
Resultado do 1o Tempo: 0 X 1,,,Resultado Final: 1 X 1,,,
"",,,,Relação de Jogadores,,,
"",,Bangu / RJ,,,Villa Nova A.c. / MG,,
No,Apelido,Nome Completo,T/R P/A,CBF No Apelido,Nome Completo T/R P/A,,CBF
1,Jefferson,Jefferson Jose Moreira,T(g) P,174390 1 Renan,Renan Rinaldi Ferreira T(g),P,311550
2,Magno,Magno Nunes Rodrigues,T P,337174 2 Nequinha,Anderson Junior da S... T,P,153744
3,Cleidson,Cleidson Andrade de  ...,T P,388312 3 Otavio,Otavio Henrique Silva T,P,292139
4,Anderson,Anderson Penna Ferna ...,T P,348457 4 Rafael Vit ...,Rafael Vitor Santos ... T,P,317569
5,Willian,Willian Oliveira dos ...,T P,430883 5 Elias,Francisco Elias Eufr... T,P,403155
6,Guilherme,Guilherme dos Santos ...,T P,324767 6 Marcelo,Marcelo Augusto Bern... T,P,295059
8,Hygor,Hygor Guimaraes Gonç ...,T P,334205 7 Carrara,Gilberto Carrara Mar... T,P,414418
9,Daniel Mar ...,Daniel Mariano Bueno,T P,144455 8 Paulo Vitor,Paulo Vitor Catreus ... T,P,291723
11,Leo Bahia,Francisco Eliomar Ro ...,T P,359353 9 Douglas,Douglas de Oliveira T,P,168995
16,Rogério,Rogério Jose da Silva,T P,382379 10 Bruno,Bruno Oliveira Moreno T,P,184444
19,Rafael,Raphael Augusto Sant ...,T P,186573 11 Jhonathan  ...,Jhonathan Megson Cab... T,P,308228
12,Andre,Andre Regly e Silva  ...,R(g) P,319826 12 Ismael,Ismael Basso R,P,293220
10,Almir,Almir Lopes de Luna,R P,143885 13 Gustavo,Gustavo Moreno de Franca R,P,392691
13,Rafael,Rafael Santos Henriq ...,R P,341231 14 Marcelo Ro ...,Marcelo Rodrigues Br... R,P,329277
14,Magno,Magno Ribeiro Ferreira,R P,404878 15 Luis Mario,Luis Mario da Silva R,P,173288
15,Vitinho,Joao Victor Shimith  ...,R P,307483 16 Assis,Lourival Rodrigues A... R,P,159778
17,Luciano,Luciano Francisco Pa ...,R P,359865 17 Felipinho,Luiz Felipe Machado ... R,A,541231
18,Bruno Luiz,Bruno Luiz de Almeid ...,R P,159628 18 Michael,Michael Thuique Dias... R,P,322809
20,Hudson,Hudson Fernando Tobi ...,R P,169792,,,
21,Daniel,Daniel Tiago Duarte,R P,185705,,,
22,Marlon,Marlon dos Santos Pr ...,R P,318109,,,
23,Mauro,Mauro Silva do Nasci ...,R P,430451,,,
"",,Comissão Técnica
"",Bangu / RJ,Villa Nova A.c. / MG
Técnico:,Jose Roberto Fernandes Barros  - 1513,Técnico: Adilson Roque - 8133898870
Auxiliar Técnico:,Carlos Renan Bloise Serra - 109869495,Treinador De GoleirosA:l an France Leoncio Froes - 5082006606
Médico:,Paulo Cesar Hamdan - 52426817/RJ,Coordenador TécnicoC: aio Cardoso Luz - 29965653801
Preparador Físico:,Rogerio Juidecce De Souza - 4306G/SP,Auxiliar Técnico: Valteir Gomes Franco - 659217716
Massagista:,Gabriel Peres O. Da Silva - 120039F/RJ,Médico: Gustavo Alberdaria De Magalhães - 38944
Preparador De GoleiroR:o naldo Silva Dos Santos  - 109386896,,Preparador Físico: Caio Cardoso Luz - 29965653801
"",,Massagista: Cristovão Jose De Oliviera Silva - 03836331683
"",,Preparador De GoleiroA:l an France Leoncio Froes - 05082006606
"",,,,,Gols,
Tempo,1T/2T,No,Tipo,Nome do Jogador,,Equipe
12:00,1T,4,NR,Rafael Vitor Santos de Freitas,,Villa Nova A.c./MG
20:00,2T,22,NR,Marlon dos Santos Prazeres,,Bangu/RJ
"",,,Substituições,
Tempo,1T/2T,Equipe,Entrou,Saiu
+3:00,2T,Villa Nova A.c./MG,15 - Luis Mario da Silva,7 - Gilberto Carrara Martins  ...
45:00,INT,Bangu/RJ,22 - Marlon dos Santos Prazere ...,11 - Francisco Eliomar Rodrigu ...
29:00,1T,Bangu/RJ,17 - Luciano Francisco Paulino ...,8 - Hygor Guimaraes Gonçalves ...
20:00,2T,Bangu/RJ,10 - Almir Lopes de Luna,16 - Rogério Jose da Silva
32:00,2T,Villa Nova A.c./MG,17 - Luiz Felipe Machado de Ol ...,11 - Jhonathan Megson Cabral S ...
