"",Arbitragem
Arbitro:,Deborah Cecilia C Correia (FIFA / PE)
Arbitro Assistente 1:,Ivanildo Gonçalves da Silva (CD / MA)
Arbitro Assistente 2:,Djavan Costa da Silva (CD / MA)
Quarto Arbitro:,Jose Henrique de Azevedo Junior (CD / MA)
Delegado Local:,Emanuel de Jesus dos Santos Sousa ( / )
Analista de Campo:,Marcelo Bispo Nunes Filho (CBF / MA)
"",,,Cronologia,,,
"",1o Tempo,,2o Tempo,,,
Entrada do mandante:,15:50Atraso:,,Não Houve Entrada do mandante: 16:58,Atraso:,,Não Houve
Entrada do visitante:,15:50Atraso:,,Não Houve Entrada do visitante: 16:58,Atraso:,,Não Houve
Início 1o Tempo:,16:00 Atraso:,,Não Houve Início do 2o Tempo: 17:01,Atraso:,,Não Houve
Término do 1o Tempo:,16:46 Acréscimo:,,1 min Término do 2o Tempo: 17:49,Acréscimo:,,3 min
Resultado do 1o Tempo: 0 X 0,,,Resultado Final: 3 X 0,,,
"",,,,Relação de Jogadores,,,
"",,Maranhão / MA,,,Ríver / PI,,
No,Apelido,Nome Completo T/R P/A,,CBF No Apelido,Nome Completo T/R P/A,,CBF
1,Rodrigo Ra ...,Rodrigo Ramos MassensiniT (g),P,135603 1 Leandro,Leandro Silva Nascimento T(g),P,186245
2,Michael,Michel Silva de Andrade T,P,368198 2 Everaldo,Everaldo Gomes da Silva T,P,313927
3,Ramon,Ramon Rafael do Nasc ... T,P,368183 3 Willian,Willian Filemon Alve... T,P,298916
4,Yuri,Yuri Silva de Sousa T,P,427268 4 Gabriel,Claudio Gabriel Reim... T,P,392068
5,Sandro,Sandro Sousa Falcao T,P,159252 5 Italo,Italo Anderson Duart... T,P,178201
6,Anderson,Anderson Braz de Sousa T,P,188881 6 Tiago,Tiago do Nascimento ... T,P,307954
7,Romulo Fer ...,Romulo Ferreira Santos T,P,509685 7 Neto,Jose Neto Costa Reis T,P,160876
8,Eloir,Eloir Silva Moreira T,P,184656 8 Amarildo,Marcelo Amarildo de ... T,P,147306
9,Naoh,Naoh Silva Pestana T,P,325470 9 Viola,Luis Gustavo Silva T,P,144392
10,Emerson,Emerson Julio Sousa  ... T,P,561183 10 Humberto,Humberto Marques Saraiva T,P,178915
11,Wanderson,Wanderson Ronha Ferr ... T,P,459881 11 Edmar,Edmar dos Santos Oli... T,P,174444
12,Romulo,Romulo Alexandre Sil ... R(g),P,401881 12 Robson,Robson Silva Araujo R(g),P,160794
13,Lucas,Lucas Marcio Oliveir ... R,P,177874 13 Oscar,Oscar Alberto Brizuela R,P,418451
14,Alenilson,Alenilson Dantas de  ... R,P,296145 14 Wesley,Wesley Raizeman da S... R,P,355536
15,Igor,Igor Brendo Marques  ... R,P,396350 15 Amorim,Amorim do Nascimento... R,P,335262
16,Vinicius M ...,Vinicius Maranhão Flor R,P,551821 16 Ivan,Ivanaldo Silva de Moraes R,P,367962
17,Jonas Alve ...,Jonas Alves Ribeiro R,P,450126 17 Negueba,Amauri Jose de Souza... R,P,296887
18,Marciano,Marciano da Costa Lopes R,P,380559 18 Tety,Marcos Vinicius Silv... R,P,173397
19,David,David Santos Silva R,P,316375,,,
20,Marcelo Go ...,Marcelo Gomes Serra R,A,553820,,,
"",,Comissão Técnica
"",Maranhão / MA,Ríver / PI
Técnico:,Ruy Santos Scarpino - 039435PSP,Técnico: Celso Luiz Teixeira  - 142820933SSPSP
Auxiliar Técnico:,Hilton Soares Lima - 896061SSPTO,Auxiliar Técnico: Lucas Orides De Andrade - 3330137SSPGO
Médico:,Daniel Nery De Oliveira - 6244,Médico: Miguel Angelo Costa Lago - 732PI
Preparador Físico:,Ticiano Filintos Morais Da Silva - 002874GPB,Preparador Físico: Gabriel Amadio Teixeira - 132306GSP
Massagista:,Rodrigo Soares Loureiro - 217651F,Massagista: Luiz Amancio Do Nascimento Neto - 357649SSPPI
Preparador De GoleiroX:x xxxxxxxxxxxxxxxxx - XXXXXXXXXXXXXXX,,Preparador De GoleiroJo: rge Barbosa Ferreira - 055345879SSPRJ
"",,,,,Gols,
Tempo,1T/2T,No,Tipo,Nome do Jogador,,Equipe
16:00,2T,9,NR,Naoh Silva Pestana,,Maranhão/MA
40:00,2T,17,NR,Jonas Alves Ribeiro,,Maranhão/MA
+2,2T,17,NR,Jonas Alves Ribeiro,,Maranhão/MA
"",,,Substituições,
Tempo,1T/2T,Equipe,Entrou,Saiu
45:00,INT,Maranhão/MA,15 - Igor Brendo Marques Cutri ...,6 - Anderson Braz de Sousa
16:00,2T,Ríver/PI,16 - Ivanaldo Silva de Moraes,4 - Claudio Gabriel Reimão Go ...
21:00,2T,Maranhão/MA,17 - Jonas Alves Ribeiro,10 - Emerson Julio Sousa Silva ...
24:00,2T,Ríver/PI,18 - Marcos Vinicius Silva Gui ...,9 - Luis Gustavo Silva
29:00,2T,Ríver/PI,17 - Amauri Jose de Souza Juni ...,6 - Tiago do Nascimento Silva ...
41:00,2T,Maranhão/MA,13 - Lucas Marcio Oliveira Cos ...,8 - Eloir Silva Moreira
