"",Arbitragem
Arbitro:,Dewson Fernando Freitas da Silva (FIFA / PA)
Arbitro Assistente 1:,Sidmar dos Santos Meurer (CBF-2 / PR)
Arbitro Assistente 2:,Victor Hugo Imazu dos Santos (CBF-2 / PR)
Quarto Arbitro:,Rodrigo D Alonso Ferreira (CBF-1 / SC)
Delegado  Especial:,Marcio Verri Brandao (ASS / SP)
"",,,Cronologia,,,
"",1o Tempo,,2o Tempo,,,
Entrada do mandante:,15:53Atraso:,,Não Houve Entrada do mandante: 17:00,Atraso:,,Não Houve
Entrada do visitante:,15:53Atraso:,,Não Houve Entrada do visitante: 17:01,Atraso:,,Não Houve
Início 1o Tempo:,16:00 Atraso:,,Não Houve Início do 2o Tempo: 17:03,Atraso:,,Não Houve
Término do 1o Tempo:,16:48 Acréscimo:,,3 min Término do 2o Tempo: 17:52,Acréscimo:,,4 min
Resultado do 1o Tempo: 1 X 1,,,Resultado Final: 2 X 2,,,
"",,,,Relação de Jogadores,,,
"",,Atletico / PR,,,Coritiba / PR,,
No,Apelido,Nome Completo,T/R P/A,CBF No Apelido,Nome Completo T/R P/A,,CBF
12,Weverton,Weverton Pereira da  ...,T P,169050 29 Bruno,Bruno Brigido de Oli... T,P,305735
2,Eduardo,Carlos Eduardo Santo ...,T P,170077 3 Luccas Claro,Luccas Claro dos Santos T,P,291708
3,Gustavo,Gustavo Franchin Sch ...,T P,141209 6 Luis,Luis Enrique Caceres... T,P,431054
4,Kadu,Ricardo Martins de A ...,T P,167600 15 Leandro,Leandro Paulino da Silva T,P,175588
6,Natanael,Natanael Batista Pimenta,T P,303063 22 Wellington ...,Wellington Pereira d... T,P,152788
7,Otavio,Otavio Henrique Pass ...,T P,320930 26 Ruy,Ruy Franco de Almeid... T,P,178472
8,Hernani,Hernani Azevedo Junior,T P,310312 31 Joao Paulo,Joao Paulo da Silva T,P,174223
9,Douglas,Douglas Coutinho Gom ...,T P,303545 40 Neto,Norberto Pereira Mar... T,P,186564
10,Felipe,Felipe de Oliveira Silva,T P,189538 65 Esquerdinha,Rubens Raimundo da Silva T,P,298531
11,Ytalo,Ytalo Jose Oliveira  ...,T P,169945 66 Henrique,Henrique Gelain Custodio T,P,343787
18,Walter,Walter Henrique da Silva,T P,179832 80 Marcos Aur ...,Marcos Aurelio de Ol... T,P,166253
1,Aderbar,Aderbar Melo dos San ...,R P,293428 1 Vanailson,Vanailson Luciano de... R,P,190231
5,Jadson,Jadson Alves dos Santos,R P,302192 4 Welinton,Welinton Souza Silva R,P,183876
13,Ricardo,Ricardo Cesar Dantas ...,R P,327667 7 Guilherme,Guilherme Ferreira Pinto R,P,307277
14,Matheus,Matheus Antunes Ribeiro,R P,324513 8 Lucio Flavio,Lucio Flavio dos Santos R,P,130978
15,Paulinho D ...,Paulo Henrique Dias  ...,R P,173290 11 Givanildo,Givanildo Pulgas da ... R,P,327945
16,Giovanni,Giovanni Piccolomo,R P,318493 13 Ivan,Ivan Aparecido Martins R,P,317006
17,Bady,Renato Escobar Baruffi,R P,186547 20 Rodolfo,Rodolfo de Almeida G... R,P,308733
19,Cleo,Cleverson Gabriel Co ...,R P,160606 23 Helder,Helder de Paula Santos R,P,162897
20,Guilherme,Guilherme Augusto Al ...,R P,311122 70 Fabricio,Fabricio Santos de Jesus R,P,431983
21,Edigar,Edigar Junio Teixeir ...,R P,296349 88 Rosinei,Rosinei Adolfo R,P,147062
"",,,,99 Rafhael,Rafhael Lucas Olivei... R,P,309723
"",,Comissão Técnica,
"",Atletico / PR,,Coritiba / PR
Tecnico:,Milton Mendes - 1213193,Tecnico:,Ney Franco Da Silveira Junior - M 4052041
Auxiliar Tecnico:,Ednelson Da Conceição Silva - 44042436,Auxiliar Tecnico:,Marcelo Augusto Serrano - MG 5018207
Medico:,Murilo Marcondes Ribas - 13124,Medico:,Milton Massahide Nagai - 13014
Preparador Fisico:,Marcio Henriques  - 002415 G-PR,Preparador Fisico:,Alexandre Lopes - 103086 G-SP
Massagista:,Pedro Henrique Bueno Ribeiro - 68949548,Massagista:,Marcelo Clemides De Araujo - 289513431
"",,,,,Gols,
Tempo,1T/2T,No,Tipo,Nome do Jogador,,Equipe
18:00,1T,22,NR,Wellington Pereira do Nascimento,,Coritiba/PR
24:00,1T,18,NR,Walter Henrique da Silva,,Atletico/PR
31:00,2T,26,NR,Ruy Franco de Almeida Junior,,Coritiba/PR
36:00,2T,21,NR,Edigar Junio Teixeira Lima,,Atletico/PR
"",,,,Substituições,
Tempo,1T/2T,,Equipe,Entrou,Saiu
04:00,2T,Coritiba/PR,,23 - Helder de Paula Santos,6 - Luis Enrique Caceres Cent ...
07:00,2T,Atletico/PR,,16 - Giovanni Piccolomo,10 - Felipe de Oliveira Silva
12:00,2T,Atletico/PR,,21 - Edigar Junio Teixeira Lim ...,11 - Ytalo Jose Oliveira dos S ...
26:00,2T,Atletico/PR,,20 - Guilherme Augusto Alves D ...,9 - Douglas Coutinho Gomes de ...
36:00,2T,Coritiba/PR,,99 - Rafhael Lucas Oliveira da ...,65 - Rubens Raimundo da Silva
41:00,2T,Coritiba/PR,,8 - Lucio Flavio dos Santos,26 - Ruy Franco de Almeida Jun ...
