"",Arbitragem
Arbitro:,Márcio Chagas da Silva (ASP-FIFA / RS)
Arbitro Assistente 1:,Altemir Hausmann (FIFA / RS)
Arbitro Assistente 2:,Daniel Luis Marques (CBF-2 / SP)
Quarto Arbitro:,Cleber Vaz da Silva (CBF-1 / GO)
Arbitro Assist Adic 1:,Marcelo Aparecido R de Souza (CBF-1 / SP)
Arbitro Assist Adic 2:,Rodrigo Batista Raposo (CBF-1 / DF)
Assessor:,Vicente P da Silva Moraes (  / )
"",,,Cronologia,,,
"",1o Tempo,,2o Tempo,,,
Entrada do mandante:,18:22Atraso:,,Não Houve Entrada do mandante: 19:30,Atraso:,,Não Houve
Entrada do visitante:,18:20Atraso:,,Não Houve Entrada do visitante: 19:29,Atraso:,,Não Houve
Início 1o Tempo:,18:30 Atraso:,,Não Houve Início do 2o Tempo: 19:31,Atraso:,,Não Houve
Término do 1o Tempo:,19:16 Acréscimo:,,1 min Término do 2o Tempo: 20:20,Acréscimo:,,4 min
Resultado do 1o Tempo: 1 X 0,,,Resultado do 2o Tempo: 1 X 2,,,
"",,,,Relação de Jogadores,,,
"",,Goiás / GO,,,Fluminense / RJ,,
No,Apelido,Nome Completo,T/R P/A,CBF No Apelido,Nome Completo T/R P/A,,CBF
1,Renan,Renan Brito Soares,T P,155703 12 Diego,Diego Cavalieri T,P,137990
2,Yuri,Yuri Naves Roberto,T P,177357 2 Bruno,Bruno Vieira do Nasc... T,P,172996
3,Rodrigo,Rodrigo Baldasso da  ...,T P,137340 3 Welington,Welington Pereira Ro... T,P,167958
4,Valmir,Valmir Lucas de Oliveira,T P,179103 4 Leandro,Leandro da Fonseca E... T,P,141840
5,Amaral,William Jose de Souza,T P,169939 5 Edinho,Edimo Ferreira Campos T,P,143977
6,William,William Matheus da Silva,T P,291317 6 Carlinhos,Carlos Andrade Souza T,P,173760
7,Ronei,Ronei Gleison Rodrig ...,T P,326613 7 Jean,Jean Raphael Vanderl... T,P,173180
8,David França,David Franca Oliveir ...,T P,150731 8 Rodrigo Ol ...,Rodrigo Oliveira de ... T,P,147224
10,Ramon,Ramon Rodrigo de Freitas,T P,152825 22 Rhayner,Rhayner Santos Nasci... T,P,299208
11,Dudu Ceare ...,Alexandro Silva de Sousa,T P,139094 23 Rafael Sobis,Rafael Augusto Sobis T,P,150549
18,Walter,Walter Henrique da Silva,T P,179832 29 Diego,Diego Santos Gama Camilo T,P,308149
9,Vicosa,Luiz Severo Junior,R P,293172 14 Elivelton,Elivelton Viana dos ... R,P,317763
12,Calaça,Rodrigo Pereira Calaca,R P,142552 15 Anderson,Anderson Grasiane de... R,P,144802
13,Pedro,Pedro Henrique Perei ...,R P,338777 16 Felipe,Felipe Jorge Loureiro R,P,129598
14,Thiago Men ...,Thiago Henrique Mend ...,R P,353262 21 Marcos Junio,Marcos Junio Lima do... R,P,339900
15,Paulo,Paulo Henrique Olive ...,R P,302667 31 Samuel,Samuel Rosa Goncalves R,P,292175
16,Erik,Erik Nascimento de Lima,R P,302795 32 Fabio,Fabio Farroco Braga R,P,294598
17,Araujo,Clemerson de Araujo  ...,R P,131482 33 Klever,Klever Rodrigo Gomes... R,P,178962
19,Eduardo,Eduardo Colcenti Antunes,R P,295792 34 Wellington,Wellington Carvalho ... R,P,307674
20,Renan,Renan Henrique Olive ...,R P,178684 35 Igor,Igor de Carvalho Juliao R,P,307616
"",,,,36 Ronan,Ronan Queiroz de Pau... R,P,307574
"",,,,38 Eduardo,Eduardo Antonio Mach... R,P,350148
"",,,,43 Willian,Willian Osmar de Oli... R,P,334881
"",,Comissão Técnica,
"",Goiás / GO,,Fluminense / RJ
Tecnico:,Edenson Alves Moreira - CREF 6236GMG,Tecnico:,Vanderlei Luxemburgo Da Silva - 28202694-0
Auxiliar Tecnico:,Luiz Fernando Rosa Flores - MG13282344,Auxiliar Tecnico:,Antonio Lopes Do Santos Junior - 04007007-0
Medico:,Dalton Siqueira Filho - 8794,Medico:,Douglas Rodrigues Dos Santos - 52560269
Preparador Fisico:,Robson Luiz Martins Gomes - 9613GPR,Preparador Fisico:,Antonio Carlos Da Silva Mello - 4656
Massagista:,Jose Carlos Da Silva Bury - 1962035,Massagista:,Alex Soares Dos Santos - 0201870565
"",,,,,Gols,
Tempo,1T/2T,No,Tipo,Nome do Jogador,,Equipe
36:00,1T,6,NR,William Matheus da Silva,,Goiás/GO
06:00,2T,7,NR,Jean Raphael Vanderlei Moreira,,Fluminense/RJ
39:00,2T,23,NR,Rafael Augusto Sobis,,Fluminense/RJ
"",,,Substituições,
Tempo,1T/2T,Equipe,Entrou,Saiu
45:00,INT,Fluminense/RJ,38 - Eduardo Antonio Machado T ...,8 - Rodrigo Oliveira de Bitte ...
45:00,INT,Fluminense/RJ,35 - Igor de Carvalho Juliao,2 - Bruno Vieira do Nasciment ...
15:00,1T,Goiás/GO,20 - Renan Henrique Oliveira V ...,11 - Alexandro Silva de Sousa
09:00,2T,Goiás/GO,14 - Thiago Henrique Mendes Ri ...,2 - Yuri Naves Roberto
20:00,2T,Fluminense/RJ,16 - Felipe Jorge Loureiro,22 - Rhayner Santos Nascimento ...
27:00,2T,Goiás/GO,19 - Eduardo Colcenti Antunes,6 - William Matheus da Silva
