"",,Arbitragem
Arbitro:,Heber Roberto Lopes (FIFA / PR),
Arbitro Assistente 1:,Carlos Berkenbrock (ESP / SC),
Arbitro Assistente 2:,Rosnei Hoffmann Scherer (CBF-1 / SC),
Quarto Arbitro:,Manoel Nunes Lopo Garrido (CBF-1 / BA),
Arbitro Assist Adic 1:,Charles Hebert Cavalcante Ferreira (CBF-1 / AL),
Arbitro Assist Adic 2:,Jose R Albuquerque Soares (CBF-2 / PB),
Assessor:,Kleber Moradillo da Silva (  / ),
"",,,Cronologia,,,
"",1o Tempo,,2o Tempo,,,
Entrada do mandante:,21:35Atraso:,,Não Houve Entrada do mandante: 22:50,Atraso:,,Não Houve
Entrada do visitante:,21:35Atraso:,,Não Houve Entrada do visitante: 22:50,Atraso:,,Não Houve
Início 1o Tempo:,21:50 Atraso:,,Não Houve Início do 2o Tempo: 22:51,Atraso:,,Não Houve
Término do 1o Tempo:,22:36 Acréscimo:,,1 min Término do 2o Tempo: 23:40,Acréscimo:,,4 min
Resultado do 1o Tempo: 2 X 0,,,Resultado do 2o Tempo: 3 X 0,,,
"",,,,Relação de Jogadores,,,
"",,Bahia / BA,,,Flamengo / RJ,,
No,Apelido,Nome Completo T/R P/A,,CBF No Apelido,Nome Completo,T/R P/A,CBF
1,Marcelo,Marcelo Lomba do Nas ... T,P,157264 1 Felipe,Luiz Felipe Ventura ...,T P,141698
2,Madson,Madson Ferreira dos  ... T,P,321829 2 Leo Moura,Leonardo da Silva Moura,T P,137644
3,Rafael,Rafael Ferreira Donato T,P,190431 4 Marcos,Marcos Andres Gonzal...,T P,402537
4,Christian,Christian Chagas Tarouco T,P,170255 8 Elias,Elias Mendes Trindade,T P,159607
5,Rafael,Rafael Miranda da Co ... T,P,160379 14 Wallace,Wallace Reis Silva,T P,166649
6,Raul,Raul Diogo Souza Rocha T,P,173948 15 Luiz Antonio,Luiz Antonio de Souz...,T P,291540
7,Leandro,Leandro Fahel Matos T,P,153030 16 Joao Paulo,Joao Paulo Gomes da ...,T P,155855
8,Helder,Helder de Paula Santos T,P,162897 17 Adryan,Adryan Oliveira Tavares,T P,307097
9,Fernando,Jose Fernando Viana  ... T,P,188453 19 Marcelo,Marcelo Moreno Martins,T P,172142
10,Marquinhos,Marcos Gabriel do Na ... T,P,190389 20 Carlos Edu ...,Carlos Eduardo Marques,T P,166274
11,Wallyson,Wallyson Ricardo Mac ... T,P,174194 26 Paulo,Paulo Luiz Beraldo S...,T P,185974
12,Omar,Omar Constante Reis  ... R,P,292443 9 Hernane,Hernane Vidal de Souza,R P,186467
13,Lucas,Lucas Silva Fonseca R,P,309265 10 Gabriel,Gabriel Santana Pinto,R P,335611
14,Demerson,Demerson Bruno Costa R,P,171815 28 Bruno,Bruno Cardoso Gonçal...,R P,305973
15,Jussandro,Jussandro Pimenta Matos R,P,363566 29 Nixson,Nixson Darlanio Reis...,R P,330660
16,Fabricio,Fabricio Lusa R,P,297336 30 Val,Lucivaldo Lazaro de ...,R P,166989
17,Talisca,Anderson Souza Conceição R,P,344704 31 Ramon,Ramon de Moraes Motta,R P,172361
18,Souza,Rodrigo de Souza Cardoso R,P,136730 32 Fernando,Fernando Henrique da...,R P,332277
19,Obina,Manuel de Brito Filho R,P,155743 33 Samir,Samir Caetano de Sou...,R P,317827
20,Diones,Diones Coelho da Costa R,P,172714 34 Rodrigo,Rodrigo Longo Freitas,R P,307767
"",,,,35 Diego,Diego Francolino da ...,R P,293501
"",,,,37 Cesar,Cesar Bernardo Dutra,R P,307296
"",,,,48 Paulo Victor,Paulo Victor Mileo V...,R P,175411
"",,Comissão Técnica,
"",Bahia / BA,,Flamengo / RJ
Tecnico:,Cristovao Borges Do Santos - 1051758661,Tecnico:,Luiz Antonio Venker Menezes - 3017715453
Auxiliar Tecnico:,Cassiano De Jesus Costa Santos - 083829366,Auxiliar Tecnico:,Sidnei De Espirito - 20054690-9
Medico:,Marcio Roberto Rocha Santana - 19234,Medico:,Marcio A. Tannure - 5777379-4
Preparador Fisico:,Rodrigo Poletto - 4125G/RS,Preparador Fisico:,Eduardo Luiz Da Silva - 19226642-1
Massagista:,Sergio Sales Dos Santos - 0599883049,Massagista:,Mario Galdi Peixoto - 3-83865-F
"",,,,,Gols,
Tempo,1T/2T,No,Tipo,Nome do Jogador,,Equipe
29:00,1T,9,NR,Jose Fernando Viana de Santana,,Bahia
+1,1T,11,NR,Wallyson Ricardo Maciel Monteiro,,Bahia
33:00,2T,10,NR,Marcos Gabriel do Nascimento,,Bahia
"",,,,Substituições,
Tempo,1T/2T,,Equipe,Entrou,Saiu
45:00,INT,Flamengo,,32 - Fernando Henrique da Conc ...,20 - Carlos Eduardo Marques
45:00,INT,Flamengo,,10 - Gabriel Santana Pinto,26 - Paulo Luiz Beraldo Santos ...
25:00,2T,Bahia,,17 - Anderson Souza Conceição,11 - Wallyson Ricardo Maciel M ...
25:00,2T,Flamengo,,28 - Bruno Cardoso Gonçalves S ...,17 - Adryan Oliveira Tavares
34:00,2T,Bahia,,18 - Rodrigo de Souza Cardoso,9 - Jose Fernando Viana de Sa ...
43:00,2T,Bahia,,20 - Diones Coelho da Costa,7 - Leandro Fahel Matos
