"",Arbitragem
Arbitro:,Paulo H Godoy Bezerra (CBF-1 / SC)
Arbitro Assistente 1:,Katiuscia M Berger Mendonça (FIFA / ES)
Arbitro Assistente 2:,Angelo Rudimar Bechi (CBF-1 / SC)
Quarto Arbitro:,Gleidson Santos Oliveira (CBF-1 / BA)
Arbitro Assist Adic 1:,Rogerio Lima da Rocha (CBF-2 / SE)
Arbitro Assist Adic 2:,Claudionor dos Santos Junior (CBF-2 / SE)
Assessor:,Raimundo Carneiro de Oliveira (  / BA)
"",,,Cronologia,,,
"",1o Tempo,,2o Tempo,,,
Entrada do mandante:,18:25Atraso:,,Não Houve Entrada do mandante: 19:32,Atraso:,,3 min
Entrada do visitante:,18:25Atraso:,,Não Houve Entrada do visitante: 19:29,Atraso:,,Não Houve
Início 1o Tempo:,18:30 Atraso:,,Não Houve Início do 2o Tempo: 19:33,Atraso:,,3 min
Término do 1o Tempo:,19:15 Acréscimo:,,Não Houve Término do 2o Tempo: 20:22,Acréscimo:,,04 min
Resultado do 1o Tempo: 2 X 1,,,Resultado do 2o Tempo: 2 X 1,,,
"",,,,Relação de Jogadores,,,
"",,Bahia / BA,,,Goiás / GO,,
No,Apelido,Nome Completo T/R P/A,,CBF No Apelido,Nome Completo,T/R P/A,CBF
1,Marcelo,Marcelo Lomba do Nas ... T,P,157264 1 Renan,Renan Brito Soares,T P,155703
2,Madson,Madson Ferreira dos  ... T,P,321829 2 Clayton,Clayton Sales Paulino,T P,341055
3,Rafael,Rafael Ferreira Donato T,P,190431 3 Rodrigo,Rodrigo Baldasso da ...,T P,137340
4,Christian,Christian Chagas Tarouco T,P,170255 4 Ernando,Ernando Rodrigues Lopes,T P,178875
5,Feijao,Antonio Filipe Gonza ... T,P,352645 5 Amaral,William Jose de Souza,T P,169939
6,Raul,Raul Diogo Souza Rocha T,P,173948 6 William,William Matheus da Silva,T P,291317
7,Helder,Helder de Paula Santos T,P,162897 7 Araujo,Clemerson de Araujo ...,T P,131482
8,Talisca,Anderson Souza Conceição T,P,344704 8 Thiago Men ...,Thiago Henrique Mend...,T P,353262
9,Fernando,Jose Fernando Viana  ... T,P,188453 10 Ramon,Ramon Rodrigo de Freitas,T P,152825
10,Marquinhos,Marcos Gabriel do Na ... T,P,190389 11 Renan,Renan Henrique Olive...,T P,178684
11,Wallyson,Wallyson Ricardo Mac ... T,P,174194 18 Walter,Walter Henrique da Silva,T P,179832
12,Omar,Omar Constante Reis  ... R,P,292443 9 Neto Baiano,Euvaldo Jose de Agui...,R P,160251
13,Demerson,Demerson Bruno Costa R,P,171815 12 Harlei,Harlei de Menezes Silva,R P,115259
14,Jussandro,Jussandro Pimenta Matos R,P,363566 13 Valmir,Valmir Lucas de Oliveira,R P,179103
15,Rafael,Rafael Miranda da Co ... R,P,160379 14 Dudu Ceare ...,Alexandro Silva de Sousa,R P,139094
16,Fabricio,Fabricio Lusa R,P,297336 15 David França,David Franca Oliveir...,R P,150731
17,Leandro,Leandro Fahel Matos R,P,153030 16 Tarta,Vinicius Silva Soares,R P,176417
18,Souza,Rodrigo de Souza Cardoso R,P,136730 17 Vicosa,Luiz Severo Junior,R P,293172
19,Obina,Manuel de Brito Filho R,P,155743 19 Caio,Antonio Caio Silva Sousa,R P,144165
20,Diones,Diones Coelho da Costa R,P,172714 20 Pedro,Pedro Henrique Perei...,R P,338777
"",,Comissão Técnica,
"",Bahia / BA,,Goiás / GO
Tecnico:,Cristovão Borges Dos Santos - 1051758661,Tecnico:,Enderson Alves Moreira - cref 006236-mg
Auxiliar Tecnico:,Cassiano De Jesus Costa Santos - 083829366,Auxiliar Tecnico:,Luiz Fernando Rosa Flores - 13.282.344
Medico:,Luiz Henrique Sapucaia Rehem - 11887,Medico:,Bruno Rafael Silva Favaron - 15.731
Preparador Fisico:,Rodrigo Poletto - 4125-G/RS,Preparador Fisico:,Robson Luiz Martins Gomes - 00963-g-pr
Massagista:,Fabio Lima Fontes - 0855718145sspba,Massagista:,Leonardo Oliveira De Morais - 7.117.300
"",,,,,Gols,
Tempo,1T/2T,No,Tipo,Nome do Jogador,,Equipe
02:00,1T,10,NR,Marcos Gabriel do Nascimento,,Bahia
32:00,1T,10,NR,Marcos Gabriel do Nascimento,,Bahia
33:00,1T,8,NR,Thiago Henrique Mendes Ribeiro,,Goiás
"",,,,Substituições,
Tempo,1T/2T,,Equipe,Entrou,Saiu
45:00,INT,Bahia,,15 - Rafael Miranda da Conceic ...,8 - Anderson Souza Conceição
30:00,1T,Bahia,,19 - Manuel de Brito Filho,9 - Jose Fernando Viana de Sa ...
14:00,2T,Goiás,,14 - Alexandro Silva de Sousa,2 - Clayton Sales Paulino
21:00,2T,Goiás,,9 - Euvaldo Jose de Aguiar Ne ...,7 - Clemerson de Araujo Soare ...
26:00,2T,Goiás,,16 - Vinicius Silva Soares,10 - Ramon Rodrigo de Freitas
32:00,2T,Bahia,,17 - Leandro Fahel Matos,10 - Marcos Gabriel do Nascime ...
