"",Arbitragem
Arbitro:,Luiz Flavio de Oliveira (ASP-FIFA / SP)
Arbitro Assistente 1:,Katiuscia M Berger Mendonça (FIFA / ES)
Arbitro Assistente 2:,Bruno Salgado Rizo (CBF-1 / SP)
Quarto Arbitro:,José Leandro da Silva Nazaré (CBF-2 / )
Arbitro Assist Adic 1:,Avelar Rodrigo da Silva (CBF-1 / CE)
Arbitro Assist Adic 2:,Jose Cleuton Souza Lima (CBF-2 / CE)
Assessor:,Kleber Moradillo da Silva (  / )
"",,,Cronologia,,,
"",1o Tempo,,2o Tempo,,,
Entrada do mandante:,20:50Atraso:,,Não Houve Entrada do mandante: 22:00,Atraso:,,Não Houve
Entrada do visitante:,20:50Atraso:,,Não Houve Entrada do visitante: 22:00,Atraso:,,Não Houve
Início 1o Tempo:,21:00 Atraso:,,Não Houve Início do 2o Tempo: 22:01,Atraso:,,Não Houve
Término do 1o Tempo:,21:46 Acréscimo:,,1 min Término do 2o Tempo: 22:50,Acréscimo:,,4 min
Resultado do 1o Tempo: 0 X 2,,,Resultado do 2o Tempo: 2 X 2,,,
"",,,,Relação de Jogadores,,,
"",,Bahia / BA,,,Criciuma / SC,,
No,Apelido,Nome Completo T/R P/A,,CBF No Apelido,Nome Completo T/R P/A,,CBF
1,Marcelo,Marcelo Lomba do Nas ... T,P,157264 1 Galatto,Rodrigo Jose Galatto T,P,153784
3,Christian,Christian Chagas Tarouco T,P,170255 2 Sueliton,Sueliton Pereira de ... T,P,171745
4,Lucas,Lucas Silva Fonseca T,P,309265 3 Matheus,Matheus Ferraz Pereira T,P,175475
8,Talisca,Anderson Souza Conceição T,P,344704 4 Leonardo M ...,Leonardo Jose Aparec... T,P,165264
15,Feijao,Antonio Filipe Gonza ... T,P,352645 5 Ewerton,Ewerton Ribeiro Pascoa T,P,182550
16,Raul,Raul Diogo Souza Rocha T,P,173948 6 Marlon,Marlon Farias Castel... T,P,183840
19,Ângulo,Juan Camilo Ângulo V ... T,P,446260 7 Lins,Lins Lima de Brito T,P,176375
20,Fernando,Jose Fernando Viana  ... T,P,188453 8 Elton,Elton Junior Melo Ataide T,P,181803
30,Helder,Helder de Paula Santos T,P,162897 9 Marcel,Marcel Augusto Ortolan T,P,139659
32,Fabricio,Fabricio Lusa T,P,297336 10 Joao Vitor,Joao Vitor Lima Gomes T,P,164019
37,Wallyson,Wallyson Ricardo Mac ... T,P,174194 11 Morais,Manoel Morais Amorim T,P,156048
6,Jussandro,Jussandro Pimenta Matos R,P,363566 12 Bruno,Bruno Brigido de Oli... R,P,305735
7,Leandro,Leandro Fahel Matos R,P,153030 13 Tony,Tony Ewerton Ramos d... R,P,295880
12,Omar,Omar Constante Reis  ... R,P,292443 14 Bruno,Bruno Renan Trombelli R,P,186144
17,Diones,Diones Coelho da Costa R,P,172714 15 Amaral,Carlos Rafael do Amaral R,P,157797
18,Potita,Alexander Asloquer R,P,181281 16 Gilson,Gilson Gomes do Nasc... R,P,167201
27,Obina,Manuel de Brito Filho R,P,155743 17 Leandro,Leandro de Medeiros ... R,P,166249
29,Demerson,Demerson Bruno Costa R,P,171815 18 Weldon,Weldon Santos de Andrade R,P,142887
38,Wiliam,Wiliam Silva Gomes B ... R,P,307680 19 Douglas,Douglas de Oliveira R,P,168995
"",,,,20 Andre Gava,Andre Luiz Gava de Borba R,P,316686
"",,,,21 Bruno,Bruno Henrique Lopes R,P,310101
"",,Comissão Técnica,
"",Bahia / BA,,Criciuma / SC
Tecnico:,Cristovao Borges Dos Santos - 1051758661,Tecnico:,Silvio Nicoladelli - 2217942
Auxiliar Tecnico:,Cassiano De Jesus Costa Santos - 083829366,Auxiliar Tecnico:,Ubiraquitan Vieira De Melo - 633342-6
Medico:,Daniel Jose De Araujo Silva - 14095,Medico:,Manoel Robson Damin Monteiro - 14279
Preparador Fisico:,Rodrigo Polleto - 4125,Preparador Fisico:,Cleber Medeiros - 7428-G
Massagista:,Fabio Lima Pontes - 0855718145,Massagista:,Cesare Daniel Olivier - 1931439-6
"",,,,,Gols,
Tempo,1T/2T,No,Tipo,Nome do Jogador,,Equipe
08:00,1T,15,CT,Antonio Filipe Gonzaga de Aquino,,Bahia
35:00,1T,7,NR,Lins Lima de Brito,,Criciuma
26:00,2T,20,PN,Jose Fernando Viana de Santana,,Bahia
40:00,2T,27,NR,Manuel de Brito Filho,,Bahia
"",,,,Substituições,
Tempo,1T/2T,,Equipe,Entrou,Saiu
45:00,INT,Bahia,,38 - Wiliam Silva Gomes Barbio ...,8 - Anderson Souza Conceição
45:00,INT,Bahia,,27 - Manuel de Brito Filho,19 - Juan Camilo Ângulo Villeg ...
03:00,2T,Criciuma,,16 - Gilson Gomes do Nasciment ...,6 - Marlon Farias Castelo Bra ...
28:00,2T,Criciuma,,19 - Douglas de Oliveira,9 - Marcel Augusto Ortolan
34:00,2T,Bahia,,6 - Jussandro Pimenta Matos,16 - Raul Diogo Souza Rocha
43:00,2T,Criciuma,,18 - Weldon Santos de Andrade,7 - Lins Lima de Brito
