"",Arbitragem
Arbitro:,Jean Pierre Goncalves Lima (CBF-1 / RS)
Arbitro Assistente 1:,Luiz Claudio Regazone (CBF-1 / RJ)
Arbitro Assistente 2:,Rafael da Silva Alves (CBF-1 / RS)
Quarto Arbitro:,Roberto Giovanny Oliveira Silva (CBF-2 / GO)
Arbitro Assist Adic 1:,Janio Pires Gonçalves (CBF-1 / TO)
Arbitro Assist Adic 2:,Luciano Oliveira dos Santos (CBF-2 / TO)
Assessor:,Urias C Alves Junior (  / )
"",,,Cronologia,,,
"",1o Tempo,,2o Tempo,,,
Entrada do mandante:,21:43Atraso:,,Não Houve Entrada do mandante: 22:50,Atraso:,,Não Houve
Entrada do visitante:,21:45Atraso:,,Não Houve Entrada do visitante: 22:51,Atraso:,,Não Houve
Início 1o Tempo:,21:50 Atraso:,,Não Houve Início do 2o Tempo: 22:52,Atraso:,,Não Houve
Término do 1o Tempo:,22:37 Acréscimo:,,2 min Término do 2o Tempo: 23:40,Acréscimo:,,3 min
Resultado do 1o Tempo: 1 X 1,,,Resultado do 2o Tempo: 2 X 1,,,
"",,,,Relação de Jogadores,,,
"",,Goiás / GO,,,Náutico / PE,,
No,Apelido,Nome Completo,T/R P/A,CBF No Apelido,Nome Completo T/R P/A,,CBF
1,Renan,Renan Brito Soares,T P,155703 1 Ricardo,Ricardo Ferreira Berna T,P,135462
2,Vitor,Cicero Vitor dos San ...,T P,156325 2 Auremir,Auremir Evangelista ... T,P,341763
3,Rodrigo,Rodrigo Baldasso da  ...,T P,137340 3 Jean,Jean de Oliveira da Rolt T,P,146818
4,Ernando,Ernando Rodrigues Lopes,T P,178875 4 Willian,William Augusto Alve... T,P,173742
6,William,William Matheus da Silva,T P,291317 5 Edicarlos,Elicarlos Souza Santos T,P,169835
7,Tarta,Vinicius Silva Soares,T P,176417 6 Luiz Eduardo,Luiz Eduardo Felix d... T,P,314464
8,David França,David Franca Oliveir ...,T P,150731 7 Maikon,Maikon Fernando Souz... T,P,184685
10,Paulo,Paulo Henrique Olive ...,T P,302667 8 Derley,Wanderley de Jesus Sousa T,P,166491
11,Renan,Renan Henrique Olive ...,T P,178684 9 Rogerio,Jose Rogerio de Oliv... T,P,291780
18,Walter,Walter Henrique da Silva,T P,179832 10 Louis Ange ...,Louis Angelo Pena Pu... T,P,446763
300,Amaral,William Jose de Souza,T P,169939 11 Tiago Real,Tiago Real do Prado T,P,176512
9,Neto Baiano,Euvaldo Jose de Agui ...,R P,160251 12 Gideao,Gideao Lima de Castro R,P,190306
12,Harlei,Harlei de Menezes Silva,R P,115259 13 Leandro,Leandro Amaro dos Sa... R,P,168608
13,Valmir,Valmir Lucas de Oliveira,R P,179103 14 Joao Filipe,Joao Filipe Rabelo d... R,P,293359
14,Juliano,Juliano Real Pacheco,R P,177094 15 Rodrigo So ...,Rodrigo Ribeiro Souto R,P,146475
15,Welinton,Welinton Junior Ferr ...,R P,321011 16 Admilson,Admilson da Anunciac... R,P,156511
16,Eron,Eron Santos Lourenco,R P,292162 17 Robinho Ba ...,Marcos Vinicius de J... R,P,370756
17,Araujo,Clemerson de Araujo  ...,R P,131482 18 Jones,Jones da Silva Lopes R,P,189999
19,Erik,Erik Nascimento de Lima,R P,302795 19 Lopez,Juan Manuel Olivera ... R,P,445822
20,Ramon,Ramon Rodrigo de Freitas,R P,152825 20 Herlison,Herlison Caion de So... R,P,292500
"",,Comissão Técnica,
"",Goiás / GO,,Náutico / PE
Tecnico:,Enderson Alves Moreira - 006236 G/MG,Tecnico:,José Teodoro Bonfim Queiroz - 1046316
Auxiliar Tecnico:,Luiz Fernando Rosa Flores - MG 13282344,Auxiliar Tecnico:,Silvio Luiz Borba Da Silva - 6052438808
Medico:,Bruno Rafael Silva Faron - 15731,Medico:,Marcos Pablo A. C. Cavalcante - 16647 PE
Preparador Fisico:,Robson Luiz Martins Gomes - 009613 G/PR,Preparador Fisico:,Ricardo H. Seguins De Lima - 02423 G/PE
Massagista:,Bruno De Souza Baldo - MG 6750996,Massagista:,Irapuan José Paes Barreto - 791528
"",,,,,Gols,
Tempo,1T/2T,No,Tipo,Nome do Jogador,,Equipe
26:00,1T,18,NR,Walter Henrique da Silva,,Goiás
34:00,1T,2,NR,Auremir Evangelista dos Santos,,Náutico
07:00,2T,18,NR,Walter Henrique da Silva,,Goiás
"",,,,Substituições,
Tempo,1T/2T,,Equipe,Entrou,Saiu
43:00,1T,Náutico,,16 - Admilson da Anunciacao Ba ...,6 - Luiz Eduardo Felix da Cos ...
22:00,2T,Náutico,,19 - Juan Manuel Olivera Lopez ...,10 - Louis Angelo Pena Puentes ...
22:00,2T,Goiás,,20 - Ramon Rodrigo de Freitas,11 - Renan Henrique Oliveira V ...
22:00,2T,Náutico,,17 - Marcos Vinicius de Jesus  ...,9 - Jose Rogerio de Oliveira  ...
27:00,2T,Goiás,,17 - Clemerson de Araujo Soare ...,10 - Paulo Henrique Oliveira d ...
36:00,2T,Goiás,,9 - Euvaldo Jose de Aguiar Ne ...,18 - Walter Henrique da Silva
