Campeonato:,Copa do Brasil - Profissional/2019,,,Rodada:,Volta
Jogo:,Grêmio / RS X Bahia / BA,,,,
Data:,10/07/2019 Horário: 19:15,Estádio:,Arena do Grêmio / Porto Alegre,,
"",Arbitragem
Arbitro:,Marcelo de Lima Henrique (MTR / RJ)
Arbitro Assistente 1:,Rodrigo Figueiredo Henrique Correa (FIFA / RJ)
Arbitro Assistente 2:,Luiz Claudio Regazone (AB / RJ)
Quarto Arbitro:,Pathrice Wallace Corrêa Maia (AB / RJ)
Inspetor:,Marrubson Melo Freitas (CBF / DF)
Delegado Local:,Marcos Roberto Caduri de Almeida (CBF / )
VAR:,Rodrigo Nunes de Sa (AB / RJ)
AVAR1:,Carlos Eduardo Nunes Braga (AB / RJ)
AVAR2:,Diogo Carvalho Silva (AB / RJ)
"",,,Cronologia,,,
"",1o Tempo,,2o Tempo,,,
Entrada do mandante:,19:05Atraso:,,Não Houve Entrada do mandante: 20:16,,Atraso:,Não Houve
Entrada do visitante:,19:05Atraso:,,Não Houve Entrada do visitante: 20:16,,Atraso:,Não Houve
Início 1o Tempo:,19:15Atraso:,,Não Houve Início do 2o Tempo: 20:19,,Atraso:,Não Houve
Término do 1o Tempo:,20:04Acréscimo:,,4 min Término do 2o Tempo: 21:08,Acréscimo:,,4 min
Resultado do 1o Tempo: 1 X 0,,,Resultado Final: 1 X 1,,,
"",,,,,Relação de Jogadores,,,,
"",,Grêmio / RS,,,Bahia / BA,,,,
No,Apelido,Nome Completo T/R,,P/A,CBF No Apelido Nome Completo,,T/R,P/A,CBF
1,Paulo Victor,Paulo Victor Mileo V ... T(g),,P,175411 1 Douglas Douglas Alan Schuck  ...,,T(g),P,182717
3,Geromel,Pedro Tonon Geromel T,,P,165322 2 Nino Paraiba Severino do Ramo Cle ...,,T,P,183977
4,Kannemann,Walter Kannemann T,,P,554626 6 Moises Moises Roberto Barbosa,,T,P,318481
6,Leonardo,Leonardo Gomes da Co ... T,,P,303436 7 Elber Jose Elber Pimentel  ...,,T,P,298642
8,Maicon,Maicon Thiago Pereir ... T,,P,166603 9 Gilberto Gilberto Oliveira So ...,,T,P,185444
11,Everton,Everton Sousa Soares T,,P,379065 10 Ramires Eric dos Santos Rodrigues,,T,P,521939
12,Cortez,Bruno Cortes Barbosa T,,P,180546 17 Elton Elton Junior Melo Ataide,,T,P,181803
14,M. Henrique,Matheus Henrique de SouzaT,,P,407776 26 Gregore Gregore de Magalhaes ...,,T,P,314357
21,Jean Pyerre,Jean Pyerre Casagran ... T,,P,422351 28 Lucas Fonseca Lucas Silva Fonseca,,T,P,309265
23,Alisson,Alisson Euler de Fre ... T,,P,317751 40 Juninho Jose Carlos Ferreira ...,,T,P,378851
90,Andre,Andre Felipe Ribeiro ... T,,P,292942 98 Artur Artur Victor Guimaraes,,T,P,419646
22,Julio Cesar,Julio Cesar Jacobi R(g),,P,169978 33 Anderson Anderson Pedro da Si ...,,R(g),P,155955
2,Leo Moura,Leonardo da Silva Moura R,,P,137644 4 Jackson Jackson de Souza,,R,P,299142
7,Luan,Luan Guilherme de Je ... R,,P,409960 5 Flavio Flavio Medeiros da Silva,,R,P,337826
10,Felipe Vizeu,Felipe dos Reis Pere ... R,,P,399284 12 Clayton Clayton da Silveira  ...,,R,P,380745
13,Romulo,Romulo Borges Monteiro R,,P,183094 18 Guerra Alejandro Abraham Gu ...,,R,P,565572
16,Thaciano,Thaciano Mickael da Silva R,,P,391953 20 Fernandao Jose Fernando Viana  ...,,R,P,188453
25,Pepe,Eduardo Gabriel Aqui ... R,,P,428672 27 Shaylon Shaylon Kallyson Cardozo,,R,P,421138
29,J. Capixaba,Luis Antonio da Roch ... R,,P,402681 30 Marco Antonio Marco Antonio Rosa F ...,,R,P,518590
30,Patrick,Patrick Machado Ferreira R,,P,423224 44 Xandao Alexandre Rodrigues  ...,,R,P,333824
33,David Braz,David Braz Oliveira Filho R,,P,168008 77 Arthur Arthur Caike do Nasc ...,,R,P,292833
38,Rodrigues,Antonio Josenildo Ro ... R,,P,434738,,,,
42,Galhardo,Rafael Galhardo de Souza R,,P,291542,,,,
No,Apelido,Nome Completo T/R,,P/A,CBF,No,Apelido Nome Completo,,T/R,P/A,CBF
1,Paulo Victor,Paulo Victor Mileo V ... T(g),,P,175411,1,Douglas Douglas Alan Schuck  ...,,T(g),P,182717
3,Geromel,Pedro Tonon Geromel T,,P,165322,2,Nino Paraiba Severino do Ramo Cle ...,,T,P,183977
4,Kannemann,Walter Kannemann T,,P,554626,6,Moises Moises Roberto Barbosa,,T,P,318481
6,Leonardo,Leonardo Gomes da Co ... T,,P,303436,7,Elber Jose Elber Pimentel  ...,,T,P,298642
8,Maicon,Maicon Thiago Pereir ... T,,P,166603,9,Gilberto Gilberto Oliveira So ...,,T,P,185444
11,Everton,Everton Sousa Soares T,,P,379065,10,Ramires Eric dos Santos Rodrigues,,T,P,521939
12,Cortez,Bruno Cortes Barbosa T,,P,180546,17,Elton Elton Junior Melo Ataide,,T,P,181803
14,M. Henrique,Matheus Henrique de SouzaT,,P,407776,26,Gregore Gregore de Magalhaes ...,,T,P,314357
21,Jean Pyerre,Jean Pyerre Casagran ... T,,P,422351,28,Lucas Fonseca Lucas Silva Fonseca,,T,P,309265
23,Alisson,Alisson Euler de Fre ... T,,P,317751,40,Juninho Jose Carlos Ferreira ...,,T,P,378851
90,Andre,Andre Felipe Ribeiro ... T,,P,292942,98,Artur Artur Victor Guimaraes,,T,P,419646
22,Julio Cesar,Julio Cesar Jacobi R(g),,P,169978,33,Anderson Anderson Pedro da Si ...,,R(g),P,155955
2,Leo Moura,Leonardo da Silva Moura R,,P,137644,4,Jackson Jackson de Souza,,R,P,299142
7,Luan,Luan Guilherme de Je ... R,,P,409960,5,Flavio Flavio Medeiros da Silva,,R,P,337826
10,Felipe Vizeu,Felipe dos Reis Pere ... R,,P,399284,12,Clayton Clayton da Silveira  ...,,R,P,380745
13,Romulo,Romulo Borges Monteiro R,,P,183094,18,Guerra Alejandro Abraham Gu ...,,R,P,565572
16,Thaciano,Thaciano Mickael da Silva R,,P,391953,20,Fernandao Jose Fernando Viana  ...,,R,P,188453
25,Pepe,Eduardo Gabriel Aqui ... R,,P,428672,27,Shaylon Shaylon Kallyson Cardozo,,R,P,421138
29,J. Capixaba,Luis Antonio da Roch ... R,,P,402681,30,Marco Antonio Marco Antonio Rosa F ...,,R,P,518590
30,Patrick,Patrick Machado Ferreira R,,P,423224,44,Xandao Alexandre Rodrigues  ...,,R,P,333824
33,David Braz,David Braz Oliveira Filho R,,P,168008,77,Arthur Arthur Caike do Nasc ...,,R,P,292833
38,Rodrigues,Antonio Josenildo Ro ... R,,P,434738,,,,,,
42,Galhardo,Rafael Galhardo de Souza R,,P,291542,,,,,,
"",,Comissão Técnica,
"",Grêmio / RS,,Bahia / BA
Técnico:,Renato Portaluppi,Técnico:,Roger Machado Marques
Auxiliar Técnico:,Alexandre Pereira Mendes,Auxiliar Técnico:,Roberto Lampert Ribas
Médico:,Paulo Augusto Da Silva Rabaldo,Médico:,Luiz Henrique Sapucaia Rehem
Treinador De Goleiros:,Rogerio Augusto Godoy Da Silva,Treinador De Goleiros:,Rogerio Alves De Lima
Preparador Físico:,Rogerio Dias Luiz,Preparador Físico:,Paulo Cesar Paixao De Araujo
Massagista:,Anderson Machado Meurer,Massagista:,Fabio Lima Fontes
"",,,,,Gols,
Tempo,1T/2T,No,Tipo,Nome do Jogador,,Equipe
+2,1T,11,PN,Everton Sousa Soares,,Grêmio/RS
03:00,2T,9,NR,Gilberto Oliveira Souza Junior,,Bahia/BA
"",,,,Cartões Amarelos
Tempo,1T/2T,No,Nome do Jogador,Equipe
40:00,2T,28,Lucas Silva Fonseca,Bahia/BA
"",,,Motivo: A1.2.  Dar ou tentar dar uma rasteira ou um calço em um adversário de maneira temerária na disputa da bola  - Calçar seu,
"",,,adversário numa disputa de bola,
"",,,,Substituições,
Tempo,1T/2T,,Equipe,Entrou,Saiu
22:00,1T,Bahia/BA,,5 - Flavio Medeiros da Silva,2 - Severino do Ramo Clementino ...
20:00,2T,Grêmio/RS,,7 - Luan Guilherme de Jesus Vieira,21 - Jean Pyerre Casagrande Silve...
27:00,2T,Bahia/BA,,18 - Alejandro Abraham Guerra Mor...,10 - Eric dos Santos Rodrigues
28:00,2T,Grêmio/RS,,25 - Eduardo Gabriel Aquino Cossa,23 - Alisson Euler de Freitas Cas...
34:00,2T,Grêmio/RS,,10 - Felipe dos Reis Pereira Vize...,90 - Andre Felipe Ribeiro de Souza
39:00,2T,Bahia/BA,,20 - Jose Fernando Viana de Santana,9 - Gilberto Oliveira Souza Junior
