Campeonato:,Copa do Brasil - Profissional/2019,,,Rodada:,Volta
Jogo:,Brasiliense / DF X Crb / AL,,,,
Data:,13/02/2019 Horário: 16:30,Estádio:,Elmo Serejo Farias / Brasilia,,
"",Arbitragem
Arbitro:,Jean Pierre Goncalves Lima (AB / RS)
Arbitro Assistente 1:,Andre da Silva Bitencourt (AB / RS)
Arbitro Assistente 2:,Fabricio Lima Baseggio (CD / RS)
Quarto Arbitro:,Maguielson Lima Barbosa (CD / DF)
Delegado Local:,Geufran Almeida de Oliveira (CBF / )
Analista de Campo:,Marrubson Melo Freitas (CBF / DF)
"",,,Cronologia,,,
"",1o Tempo,,2o Tempo,,,
Entrada do mandante:,16:20Atraso:,,Não Houve Entrada do mandante: 17:30,,Atraso:,Não Houve
Entrada do visitante:,16:20Atraso:,,Não Houve Entrada do visitante: 17:31,,Atraso:,Não Houve
Início 1o Tempo:,16:30Atraso:,,Não Houve Início do 2o Tempo: 17:35,,Atraso:,Não Houve
Término do 1o Tempo:,17:20Acréscimo:,,5 min Término do 2o Tempo: 18:26,Acréscimo:,,6 min
Resultado do 1o Tempo: 0 X 0,,,Resultado Final: 0 X 0,,,
"",,,,,Relação de Jogadores,,,,
"",,Brasiliense / DF,,,,Crb / AL,,,
No,Apelido,Nome Completo T/R,,P/A,CBF No Apelido,Nome Completo T/R,,P/A,CBF
1,Edmar,Edmar da Silva Oliveira T(g),,P,187833 1 Edson,Edson Mardden Alves ... T(g),,P,296573
2,Alex,Alex Miranda dos Santos T,,P,291901 2 Junior,Ozealisson Santos Gomes T,,P,419569
3,Lucio,Lucimar da Silva Ferreira T,,P,128373 3 Wellington,Wellington Carvalho ... T,,P,307674
4,Luiz,Luiz Carlos da Silva ... T,,P,186427 4 Edson,Edson Henrique da Silva T,,P,175314
5,Geovane,Geovane do Rosario B ... T,,P,330978 5 Claudinei,Claudinei Junio de Souza T,,P,306822
6,Romano,Romano Rodrigues T,,P,184824 6 Guilherme,Guilherme dos Santos... T,,P,324767
7,Davia,David Lustosa de Oliveira T,,P,370739 7 Wiliam Barbio,Wiliam Silva Gomes Barbio T,,P,307680
8,Emerson,Emerson Martins da Silva T,,P,292221 8 Mateus,Mateus da Silva T,,P,299288
9,Reinaldo,Reinaldo da Cruz Oliveira T,,P,132336 9 Ze Carlos,Jose Carlos Ferreira... T,,P,148961
10,Almir,Almir Lopes de Luna T,,P,143885 10 Ferrugem,Weverton Almeida San... T,,P,181437
20,Romarinho,Francisco Romario da ... T,,P,371158 11 Hugo,Hugo Sanches Nogueir... T,,P,324490
12,Nikael,Nikael Junior Fernan ... R(g),,P,362103 12 Vinicius,Vinicius Silvestre d... R(g),,P,308661
11,Santos,Afonso da Silva Santos R,,P,178442 13 Guilherme  ...,Guilherme Cruz de Mattis R,,P,291534
13,Gabriel,Gabriel Arantes de Souza R,,P,392668 15 Joao,Joao Paulo Purcino d... R,,P,184524
14,Welton,Welton Felipe Marque ... R,,P,161770 16 Danilinho,Danilo Veron Bairros R,,P,163814
15,Radames,Radames Martins Rodr ... R,,P,161201 17 Felipe,Felipe Menezes Jacomo R,,P,179098
16,Aldo,Aldo Rodrigues de Sousa R,,P,164747 18 Victor Rangel,Victor Neves Rangel R,,P,359362
17,Glenisson,Glenisson Bezerra Pacheco R,,P,361037 19 Mailson,Mailson Francisco de... R,,P,293092
18,Erick,Erick Flores Bonfim R,,P,177076,,,,
19,Lucas,Lucas Vinicius Ferre ... R,,P,296582,,,,
"",,Comissão Técnica,
"",Brasiliense / DF,,Crb / AL
Técnico:,ADELSON DE ALMEIDA,Técnico:,JOSE ROBERTO FERNANDES BARROS
Auxiliar Técnico:,Cassius Loquingen Lima Santos,Auxiliar Técnico:,Leandro Ribeiro Sena
Médico:,JORGE LUIZ FERNANDES OLIVA JUNIOR,Médico:,FABIO MONTE CARNAUBA
Treinador De Goleiros:,JOSUEL DA CRUZ FILHO,Treinador De Goleiros:,LUCIANO DIAS FRAGOSO
Preparador Físico:,ROGERIO JUIDECCE DE SOUZA,Preparador Físico:,GIAN PEDRO DE OLIVEIRA VIEIRA
Massagista:,DIVINO ETERNO DE MORAES,Massagista:,FRANCISCO DE ASSIS RODRIGUES MIRANDA
"",,,Substituições,
Tempo,1T/2T,Equipe,Entrou,Saiu
16:00,2T,Brasiliense/DF,18 - Erick Flores Bonfim,10 - Almir Lopes de Luna
19:00,2T,Crb/AL,16 - Danilo Veron Bairros,7 - Wiliam Silva Gomes Barbio
23:00,2T,Crb/AL,17 - Felipe Menezes Jacomo,11 - Hugo Sanches Nogueira Ribeir...
24:00,2T,Brasiliense/DF,11 - Afonso da Silva Santos,9 - Reinaldo da Cruz Oliveira
30:00,2T,Brasiliense/DF,19 - Lucas Vinicius Ferreira da S...,5 - Geovane do Rosario Barroso
34:00,2T,Crb/AL,18 - Victor Neves Rangel,9 - Jose Carlos Ferreira Filho
