Campeonato:,Campeonato Brasileiro - Série C/2018,,Rodada:,6
Jogo:,Santa Cruz / PE X Botafogo / PB,,,
Data:,19/05/2018 Horário: 19:00 Estádio:,José do Rego Maciel / Recife,,
"",,Arbitragem
Arbitro:,Jose Claudio Rocha Filho (CD / SP),
Arbitro Assistente 1:,Rogerio Pablos Zanardo (AB / SP),
Arbitro Assistente 2:,Miguel Cataneo Ribeiro da Costa (AB / SP),
Quarto Arbitro:,Luiz Claudio Sobral (AB / PE),
Analista de Campo:,Francisco Domingos da Silva (CBF / PE),
"",,,Cronologia,,,
"",1o Tempo,,2o Tempo,,,
Entrada do mandante:,18:50Atraso:,,Não Houve Entrada do mandante: 20:01,,Atraso:,1 min
Entrada do visitante:,18:50Atraso:,,Não Houve Entrada do visitante: 20:01,,Atraso:,1 min
Início 1o Tempo:,19:00Atraso:,,Não Houve Início do 2o Tempo: 20:03,,Atraso:,1 min
Término do 1o Tempo:,19:47Acréscimo:,,2 min Término do 2o Tempo: 20:52,Acréscimo:,,4 min
Resultado do 1o Tempo: 1 X 1,,,Resultado Final: 2 X 3,,,
"",,,,,Relação de Jogadores,,,,
"",,Santa Cruz / PE,,,,Botafogo / PB,,,
No,Apelido,Nome Completo,T/R,P/A,CBF No Apelido,Nome Completo T/R,,P/A,CBF
1,Tiago,Tiago Machowski,T(g),P,296640 1 Saulo,Saulo Squarsone Rodr... T(g),,P,169020
2,Vitor,Cicero Vitor dos San ...,T,P,156325 2 Felipe,Felipe Cordeiro de Araujo T,,P,299823
3,Sandoval,Sandoval Araujo Lima,T,P,183096 8 Dias,Allan Monteiro Dias T,,P,174353
4,Augusto,Augusto de Souza Silva,T,P,339225 10 Marcos Aur ...,Marcos Aurelio de Ol... T,,P,166253
5,Charles,Charles Raphael de A ...,T,P,308871 14 Lula,Carlos Henrique dos ... T,,P,328778
6,Henrique,Henrique Pedrozo,T,P,305873 17 Osmar,Osmar dos Santos Filho T,,P,295085
7,Geovani,Geovani Cortes Gomes,T,P,400288 19 Carlos Renato,Carlos Renato Laurin... T,,P,307111
9,Robert,Robert de Pinho de Souza,T,P,140778 20 Jose,Jose Walber de Mota ... T,,P,386746
10,Arthur,Arthur Rodrigues Rezende,T,P,305393 23 Jobinho,Jocenando Rocha RodriguesT,,P,174397
11,Robinho,Francisco Wellington ...,T,P,403850 33 Rogerio,Rogerio Antonio Siqu... T,,P,177456
12,Carlinhos,Carlos Pereira Berto ...,T,P,154374 34 Mario Sergio,Mario Sergio Pereira... T,,P,430175
25,Ricardo,Ricardo Ernesto Ahlf,R(g),P,174338 12 Remerson,Remerson Cesar dos SantoRs(g),,P,178876
8,Maicon,Maicon Assis de Brito,R,P,178297 5 Hiroshi,Josemar Guimaraes da... R,,P,169859
13,Eduardo,José Eduardo de Bri ...,R,P,412230 7 Djavan,Djavan Aulim Candido... R,,P,358911
14,Genilson,Genilson Ventura Men ...,R,P,190137 9 Nando,Luis Fernando Batista R,,P,177626
15,Allan,Allan Vieira Reis,R,P,308525 11 Acrizio,Acrizio Militao de Castro R,,P,293090
16,Leandro Sa ...,Leandro Salino do Carmo,R,P,159371 16 Humberto,Humberto Marques Saraiva R,,P,178915
17,Johnny,Johnny da Silva,R,P,311025 21 Junior Lopes,Lourival Junior de A... R,,P,168670
18,Herclis,Hericlis Lander de S ...,R,P,427720 28 Alex,Alex dos Santos Goncalves R,,P,185531
20,Jeremias,Jeremias Everton de  ...,R,P,426135,,,,
21,Halef,Halef Silva Melo,R,P,428817,,,,
22,Augusto,Augusto da Silva Oliveira,R,P,338611,,,,
"",,Comissão Técnica,
"",Santa Cruz / PE,,Botafogo / PB
Técnico:,Adriano Felix Teixeira,Técnico:,LESTON IZAIAS DO NASCIMENTO JUNIOR
Auxiliar Técnico:,ATAIDE MACEDO,Auxiliar Técnico:,ANTONIO FERNANDO ALVES FILHO
Médico:,JOAO PAULO LINS DE ALBUQUERQUE LAFAYETTEM AéRdAicUoJ:O,,FABIO FARIAS DE LIMA
Treinador De Goleiros:,JOAO PAULO GOMES LACERDA,Treinador De Goleiros:,SILVANO DE MORAIS SILVA
Preparador Físico:,JAILTON CINTRA PEIXOTO DE VASCONCELOS,Preparador Físico:,GUSTAVO MENDES SHIROMA
Massagista:,FERNANDO JOSE MENDES,Massagista:,ERMIRIO DE SOUZA LIMA FILHO
"",,,,,Gols,
Tempo,1T/2T,No,Tipo,Nome do Jogador,,Equipe
34:00,1T,17,NR,Osmar dos Santos Filho,,Botafogo/PB
+1,1T,12,FT,Carlos Pereira Berto Junior,,Santa Cruz/PE
12:00,2T,11,NR,Francisco Wellington Barbosa de Lisboa,,Santa Cruz/PE
28:00,2T,11,NR,Acrizio Militao de Castro,,Botafogo/PB
37:00,2T,9,NR,Luis Fernando Batista,,Botafogo/PB
"",,,,Substituições,
Tempo,1T/2T,,Equipe,Entrou,Saiu
11:00,2T,Botafogo/PB,,11 - Acrizio Militao de Castro,23 - Jocenando Rocha Rodrigues
11:00,2T,Botafogo/PB,,9 - Luis Fernando Batista,34 - Mario Sergio Pereira Junior
20:00,2T,Santa Cruz/PE,,21 - Halef Silva Melo,9 - Robert de Pinho de Souza
33:00,2T,Santa Cruz/PE,,8 - Maicon Assis de Brito,10 - Arthur Rodrigues Rezende
35:00,2T,Botafogo/PB,,16 - Humberto Marques Saraiva,17 - Osmar dos Santos Filho
39:00,2T,Santa Cruz/PE,,22 - Augusto da Silva Oliveira,7 - Geovani Cortes Gomes
