"",Arbitragem
Arbitro:,Dewson Fernando Freitas da Silva (FIFA / PA)
Arbitro Assistente 1:,Helcio Araujo Neves (CBF / PA)
Arbitro Assistente 2:,Heronildo S Freitas da Silva (CBF / PA)
Quarto Arbitro:,Johnn Herbert Alves Bispo (CBF / BA)
Assessor:,Carlos Alberto Souza Vila Nova (CBF / BA)
"",,,Cronologia,,,
"",1o Tempo,,2o Tempo,,,
Entrada do mandante:,19:20Atraso:,,Não Houve Entrada do mandante: 20:30,Atraso:,,Não Houve
Entrada do visitante:,19:20Atraso:,,Não Houve Entrada do visitante: 20:30,Atraso:,,Não Houve
Início 1o Tempo:,19:30 Atraso:,,Não Houve Início do 2o Tempo: 20:31,Atraso:,,Não Houve
Término do 1o Tempo:,20:16 Acréscimo:,,1 min Término do 2o Tempo: 21:20,Acréscimo:,,4 min
Resultado do 1o Tempo: 0 X 0,,,Resultado Final: 1 X 0,,,
"",,,,Relação de Jogadores,,,
"",,Vitória / BA,,,Vasco da Gama / RJ,,
No,Apelido,Nome Completo T/R P/A,,CBF No Apelido,Nome Completo T/R P/A,,CBF
1,Fernando M ...,Fernando Miguel KaufmannT (g),P,159684 1 Martin And ...,Martin Andres Silva ... T(g),P,459582
4,Alan Costa,Alan Henrique Costa T,P,188990 2 Gilberto,Gilberto Moraes Junior T,P,307134
5,Willian,Willian Roberto de F ... T,P,180083 3 Rodrigo,Rodrigo Baldasso da ... T,P,137340
6,Geferson,Geferson Cerqueira Teles T,P,350453 4 Rafael Mar ...,Rafael Marques Pinto T,P,150943
9,Kieza,Welker Marcal Almeida T,P,185126 5 Jean,Jean Carlos de Souza... T,P,378268
11,Cleiton Xa ...,Cleiton Ribeiro Xavier T,P,154144 6 Henrique,Henrique Silva Milagres T,P,308965
14,Welison,José Welison da Silva T,P,313780 7 Douglas Luiz,Douglas Luiz Soares ... T,P,440261
18,Gabriel Xa ...,Gabriel Augusto Xavier T,P,316689 8 Guilherme,Guilherme Costa Mach... T,P,308880
25,Kanu,Antonio Eduardo Pere ... T,P,165775 9 Luis Fabiano,Luis Fabiano Clemente T,P,135687
27,David,David Correia da Fonseca T,P,430588 10 Nene,Anderson Luis de Car... T,P,150986
29,Patric,Patric Cabral Lalau T,P,178620 11 Escudero,Damian Ariel Escudero T,P,371689
7,Uillian,Uillian Correia Gran ... R,P,180789 12 Jordi,Jordi Martins Almeida R,P,320196
8,Cardenas,Sherman Andres Carde ... R,P,522234 13 Yago,Glaybson Yago Souza ... R,P,364829
13,Luis,Luis Vinicius da Sil ... R,P,394327 14 Jomar,Jomar Herculano Lourenco R,P,307645
19,Pineda,Jean Paul Jesus Pine ... R,P,565374 15 Julio dos  ...,Julio Daniel dos San... R,P,292789
22,Neto,Norberto Pereira Mar ... R,P,186564 16 Evander,Evander da Silva Fer... R,P,362659
23,Caique,Caique Luiz Santos d ... R,P,383559 17 Andrezinho,Andre Luiz Tavares R,P,144360
26,Paulinho,Paulo Luiz Beraldo S ... R,P,185974 18 Thalles,Thalles Lima da Conc... R,P,308877
33,Bruno Rami ...,Bruno Edgar Silva Al ... R,P,335379 19 Kelvin,Kelvin Mateus de Oli... R,P,300791
99,Andre Lima,Andre Luiz Barretto  ... R,P,154497 20 Muriqui,Luiz Guilherme da Co... R,P,164621
"",,,,21 Gallo,Bruno Vieira Gallo d... R,P,175300
"",,Comissão Técnica
"",Vitória / BA,Vasco da Gama / RJ
Técnico:,Argélico Fucks - 36550266 RS,Massagista: Andre Luis Nascimento Gomes - 4135575706
Auxiliar Técnico:,Glebson Robson Barroso Lira - 1563188 PB,Médico: Antonio Albino Pinto - 47363088772
Médico:,Luis Felipe Daneu Fernades - 15152 BA,Auxiliar Técnico: Cassiano De Jesus Costa Santos - 3555381725
Preparador Físico:,Reverson Bastos Pimentel - 034749 SP,Técnico: Cristovao Borges Dos Santos - 69757658715
Massagista:,Clício Alves Do Nascimento - 0416398987 BA,Preparador Físico: Fabio Ganime Bastos - 97091995791
Preparador De GoleiroW: ashington Luiz Duarte Rufino - 1162627450,,Treinador De GoleirosF:a bio Muchinel Tepedino - 5179461650
"",,Preparador De GoleiroF:a bio Muchenel Tepedino - 05179461650
"",,,,,Gols,
Tempo,1T/2T,No,Tipo,Nome do Jogador,,Equipe
14:00,2T,4,NR,Alan Henrique Costa,,Vitória/BA
"",,,Substituições,
Tempo,1T/2T,Equipe,Entrou,Saiu
05:00,1T,Vasco da Gama/RJ,14 - Jomar Herculano Lourenco,3 - Rodrigo Baldasso da Costa ...
18:00,2T,Vasco da Gama/RJ,19 - Kelvin Mateus de Oliveira ...,11 - Damian Ariel Escudero
21:00,2T,Vitória/BA,26 - Paulo Luiz Beraldo Santos ...,11 - Cleiton Ribeiro Xavier
26:00,2T,Vitória/BA,99 - Andre Luiz Barretto Silva ...,9 - Welker Marcal Almeida
33:00,2T,Vasco da Gama/RJ,18 - Thalles Lima da Conceição ...,5 - Jean Carlos de Souza Irme ...
35:00,2T,Vitória/BA,8 - Sherman Andres Cardenas E ...,18 - Gabriel Augusto Xavier
