"",,Arbitragem
Arbitro:,Jailson Macedo Freitas (AB / BA),
Arbitro Assistente 1:,Alessandro A. Rocha de Matos (FIFA / BA),
Arbitro Assistente 2:,Elicarlos Franco de Oliveira (AB / BA),
Quarto Arbitro:,Marcelo Aparecido R de Souza (AB / SP),
Inspetor:,Antonio Pereira da Silva (CBF / GO),
Delegado Local:,Emidio Marques de Mesquita (CBF / ),
"",,,Cronologia,,,
"",1o Tempo,,2o Tempo,,,
Entrada do mandante:,21:35Atraso:,,Não Houve Entrada do mandante: 22:44,Atraso:,,Não Houve
Entrada do visitante:,21:35Atraso:,,Não Houve Entrada do visitante: 22:45,Atraso:,,Não Houve
Início 1o Tempo:,21:45 Atraso:,,Não Houve Início do 2o Tempo: 22:47,Atraso:,,Não Houve
Término do 1o Tempo:,22:32 Acréscimo:,,2 min Término do 2o Tempo: 23:36,Acréscimo:,,4 min
Resultado do 1o Tempo: 0 X 3,,,Resultado Final: 3 X 3,,,
"",,,,Relação de Jogadores,,,
"",,Palmeiras / SP,,,Cruzeiro / MG,,
No,Apelido,Nome Completo,T/R P/A,CBF No Apelido,Nome Completo T/R P/A,,CBF
1,Fernando P ...,Fernando Buttenbende ... T(g),P,137377 1 Fabio,Fabio Deivson Lopes ... T(g),P,129292
3,Edu Dracena,Eduardo Luis Abonizi ...,T P,136752 2 Ezequiel,Ezequiel Jacinto de ... T,P,302436
7,Dudu,Eduardo Pereira Rodr ...,T P,291738 3 Leo,Leonardo Renan Simoe... T,P,174360
8,Tche Tche,Danilo Das Neves Pin ...,T P,308348 4 K.caicedo,Luis Alberto Caicedo... T,P,565329
11,Ze Roberto,Jose Roberto da Silv ...,T P,120815 5 Ariel Cabral,Alejandro Ariel Cabral T,P,535421
18,Guerra,Alejandro Abraham Gu ...,T P,565572 6 Diogo,Diogo Barbosa Mendanha T,P,339876
21,Thiago San ...,Thiago dos Santos,T P,293712 7 Rafael Sobis,Rafael Augusto Sobis T,P,150549
22,Fabiano,Fabiano Leismann,T P,352647 11 Alisson,Alisson Euler de Fre... T,P,317751
23,Roger Guedes,Roger Krug Guedes,T P,389307 19 Robinho,Robson Michael Signorini T,P,172189
26,Yerri Mina,Yerry Fernando Mina  ...,T P,550753 29 Lucas Romero,Lucas Daniel Romero T,P,541523
29,Willian,Willian Gomes de Siq ...,T P,166061 30 Thiago Neves,Thiago Neves Augusto T,P,169888
14,Jailson,Jailson Marcelino do ... R(g),P,153229 12 Rafael,Rafael Pires Monteiro R(g),P,180213
6,Egidio,Egidio de Araujo Per ...,R P,157280 8 Henrique,Henrique Pacheco de Lima R,P,170812
9,Borja,Miguel Angel Borja H ...,R P,566895 9 Ábila,Ramon Dario Ábila R,P,553784
17,Erik,Erik Nascimento de Lima,R P,302795 16 Lucas Silva,Lucas Silva Borges R,P,320111
20,Raphael,Raphael Cavalcante Veiga,R P,308405 17 Bryan,Bryan Silva Garcia R,P,319512
25,Antonio Ca ...,Antonio Carlos Cunha ...,R P,307273 21 Jonh Lennon,Jonh Lennon Silva Santos R,P,304285
27,Keno,Marcos da Silva Franca,R P,375634 23 Elber,Jose Elber Pimentel ... R,P,298642
28,Hyoran,Hyoran Kaue Dalmoro,R P,304434 25 Hudson,Hudson Rodrigues dos... R,P,176729
37,Vitinho,Victor Hugo Santana  ...,R P,409125 33 Fabricio,Fabricio dos Santos ... R,P,172408
42,Vinicius,Vinicius Silvestre d ...,R P,308661 35 Murilo,Murilo Cerqueira Paim R,P,392224
45,Gabriel Ol ...,Gabriel Vinicius de  ...,R P,466733 37 Lucas França,Lucas Oliveira de França R,P,357971
"",,,,70 Rafinha,Rafael da Silva Fran... R,P,151708
"",,Comissão Técnica
"",Palmeiras / SP,Cruzeiro / MG
Técnico:,Alexi Stival - 3662038-2,Fisioterapeuta: Andre Marley Da Silva Rocha - 7242079616
Auxiliar Técnico:,Claudio Mendes Prates - 111644608,Preparador Físico: Eduardo Luis Da Silva - 005833G/RS
Médico:,Gustavo Damasio Magliocca - 124959,Técnico: Luiz Antonio Venker Menezes - CPF32080077015
Preparador Físico:,Jose Omar Alves Feitosa - 001179 G/PR,Treinador De GoleirosR: oberto Barbosa Dos Santos - 3382574705
Massagista:,Jomar Jorge Ottoni - MG 8605396,Auxiliar Técnico: Sidnei De Espirito - CPF15403107878
Preparador De Goleiro. :- .,,Médico: Walace Espada Da Silva - 43960 MG
"",,Massagista: Andre Marley Da Silva Rocha - CREFITO126882
"",,Preparador De GoleiroR:o berto Barbosa Dos Santos - CPF033825747-05
"",,,,,Gols,
Tempo,1T/2T,No,Tipo,Nome do Jogador,,Equipe
06:00,1T,30,NR,Thiago Neves Augusto,,Cruzeiro/MG
19:00,1T,19,NR,Robson Michael Signorini,,Cruzeiro/MG
30:00,1T,11,NR,Alisson Euler de Freitas Castro,,Cruzeiro/MG
07:00,2T,7,NR,Eduardo Pereira Rodrigues,,Palmeiras/SP
17:00,2T,7,NR,Eduardo Pereira Rodrigues,,Palmeiras/SP
20:00,2T,29,NR,Willian Gomes de Siqueira,,Palmeiras/SP
"",,,,Substituições,
Tempo,1T/2T,,Equipe,Entrou,Saiu
45:00,INT,Cruzeiro/MG,,25 - Hudson Rodrigues dos Sant ...,29 - Lucas Daniel Romero
45:00,INT,Palmeiras/SP,,9 - Miguel Angel Borja Hernan ...,18 - Alejandro Abraham Guerra  ...
13:00,2T,Cruzeiro/MG,,9 - Ramon Dario Ábila,19 - Robson Michael Signorini
24:00,2T,Cruzeiro/MG,,8 - Henrique Pacheco de Lima,5 - Alejandro Ariel Cabral
33:00,2T,Palmeiras/SP,,6 - Egidio de Araujo Pereira  ...,22 - Fabiano Leismann
33:00,2T,Palmeiras/SP,,27 - Marcos da Silva Franca,23 - Roger Krug Guedes
