"",Arbitragem
Arbitro:,Jean Pierre Goncalves Lima (CBF / RS)
Arbitro Assistente 1:,Jose Eduardo Calza (CBF / RS)
Arbitro Assistente 2:,Lucio Beiersdorf Flor (CBF / RS)
Quarto Arbitro:,Rodrigo Nunes de Sa (CBF / RJ)
Assessor:,Sergio de Oliveira Santos (CBF / RJ)
Delegado Local:,Marcelo Carlos Nascimento Viana (CBF / )
"",,,Cronologia,,,
"",1o Tempo,,2o Tempo,,,
Entrada do mandante:,19:22Atraso:,,Não Houve Entrada do mandante: 20:30,Atraso:,,Não Houve
Entrada do visitante:,19:22Atraso:,,Não Houve Entrada do visitante: 20:30,Atraso:,,Não Houve
Início 1o Tempo:,19:30 Atraso:,,Não Houve Início do 2o Tempo: 20:32,Atraso:,,Não Houve
Término do 1o Tempo:,20:17 Acréscimo:,,2 min Término do 2o Tempo: 21:22,Acréscimo:,,5 min
Resultado do 1o Tempo: 0 X 0,,,Resultado Final: 0 X 0,,,
"",,,,Relação de Jogadores,,,
"",,Flamengo / RJ,,,Atlético / GO,,
No,Apelido,Nome Completo T/R P/A,,CBF No Apelido,Nome Completo,T/R P/A,CBF
38,Alex Muralha,Alex Roberto Santana ... T(g),P,177010 1 Klever,Klever Rodrigo Gomes...,T(g) P,178962
2,Rodinei,Rodinei Marcelo de A ... T,P,353568 2 Bruno Pach ...,Bruno de Jesus Pacheco,T P,333975
4,Juan,Juan Silveira dos Santos T,P,123816 3 Ricardo Si ...,Ricardo Cesar Dantas...,T P,327667
6,Rene,Rene Rodrigues Martins T,P,346636 4 Roger,Roger de Carvalho,T P,184174
17,Gabriel,Gabriel Santana Pinto T,P,335611 5 Marcos,Marcos Antonio Almei...,T P,345210
18,Leandro Da ...,Leandro Damião da Si ... T,P,291866 6 Eduardo,Eduardo Jose Diniz Costa,T P,176196
26,Cuellar,Gustavo Leonardo Cue ... T,P,541232 7 Walterson,Walterson Silva,T P,374427
33,Rafael Vaz,Rafael Vaz dos Santos T,P,171406 8 Igor,Igor Henrique Martin...,T P,305811
39,Lucas Paqu ...,Lucas Tolentino Coel ... T,P,319635 10 Jorge,Jorge de Moura Xavier,T P,330015
41,Ronaldo,Ronaldo da Silva Souza T,P,405698 11 Everaldo,Everaldo Stum,T P,306852
42,Matheus Sa ...,Matheus Gonçalves Savio T,P,395014 17 Vicosa,Luiz Severo Junior,T P,293172
8,Marcio Ara ...,Marcio Rodrigues Araujo R,P,162907 9 Joao,Joao Pedro Ribeiro d...,R P,408133
10,Eder,Ederson Honorato Campos R,P,156351 12 Felipe,Felipe Garcia dos Pr...,R P,172028
21,Pará,Marcos Rogerio Ricci ... R,P,165065 13 Rafael Bon ...,Rafael de Jesus Bonfim,R P,312847
36,Otacilio,Otacilio Brito Alves-a R,P,307702 14 Adniellyson,Adniellyson da Silva...,R P,340240
37,Adryan,Adryan Oliveira Tavares R,P,307097 15 Guilherme,Guilherme Borges Neves,R P,445255
43,Leonardo,Leonardo Campos Duar ... R,P,355960 16 Betinho,Roberto Pimenta Vina...,R P,321453
44,Thiaguinho,Thiago Rodrigues da  ... R,P,307774 18 Joao,Joao Vitor Pereira d...,R P,339385
47,Felipe Vizeu,Felipe dos Reis Pere ... R,P,399284,,,
"",,Comissão Técnica
"",Flamengo / RJ,Atlético / GO
Técnico:,Jose Ricardo Mannarino - 078128949 IFPRJ,Médico: Avimar Teodoro De Oliveira Junior - 12245
Auxiliar Técnico:,Cleber Dos Santos Almeida Junior - 106024854 IFPRJ,Massagista: Joao Rodrigues Dos Santos Neto - 2564036198
Médico:,Marcio A. Tannure - 52773794,Fisiologista: Jorge Alberto Pinto Soter - 77550226768
Preparador Físico:,Daniel Soares Gonçalves - 009952 G RJ,Técnico: Marcelo Ribeiro Cabo - 92442870720
Massagista:,Mario Galdi Peixoto - 383865 F,Treinador De GoleirosM: arcos Roberto De Medeiros - 6725440835
Preparador De GoleiroV:i ctor Hugo Marinho Signorelli - 5605 G RJ,,Auxiliar Técnico: Rodolfo Andrade De Oliveira - 5375755700
"",,Preparador Físico: Jorge Alberto Pinto Soter - 77550226768
"",,Preparador De GoleiroM:a rcos Roberto De Medeiros - 06725440835
"",,,,Substituições,
Tempo,1T/2T,,Equipe,Entrou,Saiu
+2:00,2T,Atlético/GO,,13 - Rafael de Jesus Bonfim,17 - Luiz Severo Junior
+4:00,2T,Atlético/GO,,16 - Roberto Pimenta Vinagre F ...,11 - Everaldo Stum
+4:00,2T,Atlético/GO,,14 - Adniellyson da Silva Oliv ...,7 - Walterson Silva
45:00,INT,Flamengo/RJ,,21 - Marcos Rogerio Ricci Lope ...,17 - Gabriel Santana Pinto
23:00,2T,Flamengo/RJ,,10 - Ederson Honorato Campos,42 - Matheus Gonçalves Savio
29:00,2T,Flamengo/RJ,,47 - Felipe dos Reis Pereira V ...,18 - Leandro Damião da Silva d ...
