"",Arbitragem
Arbitro:,Ricardo Marques Ribeiro (FIFA / MG)
Arbitro Assistente 1:,Guilherme Dias Camilo (FIFA / MG)
Arbitro Assistente 2:,Pablo Almeida da Costa (CBF / MG)
Quarto Arbitro:,Paulo Roberto Alves Junior (CBF / PR)
Assessor:,Anderson Carlos Goncalves (CBF / PR)
Delegado Local:,Joao da Silva (CBF / )
"",,,Cronologia,,,
"",1o Tempo,,2o Tempo,,,
Entrada do mandante:,19:20Atraso:,,Não Houve Entrada do mandante: 20:30,Atraso:,,Não Houve
Entrada do visitante:,19:20Atraso:,,Não Houve Entrada do visitante: 20:30,Atraso:,,Não Houve
Início 1o Tempo:,19:30 Atraso:,,Não Houve Início do 2o Tempo: 20:32,Atraso:,,Não Houve
Término do 1o Tempo:,20:17 Acréscimo:,,2 min Término do 2o Tempo: 21:21,Acréscimo:,,4 min
Resultado do 1o Tempo: 0 X 0,,,Resultado Final: 0 X 0,,,
"",,,,Relação de Jogadores,,,
"",,Paraná / PR,,,Vitória / BA,,
No,Apelido,Nome Completo,T/R P/A,CBF No Apelido,Nome Completo T/R P/A,,CBF
1,Leonardo,Leonardo da Silva Vieira T(g),P,177092 1 Fernando M ...,Fernando Miguel KaufmannT (g),P,159684
2,Junior,Ozealisson Santos Gomes,T P,419569 5 Willian,Willian Roberto de F... T,P,180083
3,Airton,Airton Tirabassi,T P,306156 6 Geferson,Geferson Cerqueira Teles T,P,350453
4,Brock,Eduardo Schroeder Brock,T P,291997 11 Cleiton Xa ...,Cleiton Ribeiro Xavier T,P,154144
5,Jhony,Jhony Douglas Santiago,T P,374851 16 Euller,Elosman Euller Silva... T,P,369136
6,Rayan,Rayan Poltronieri Pe ...,T P,184819 25 Kanu,Antonio Eduardo Pere... T,P,165775
7,Robson,Robson dos Santos Fe ...,T P,302768 27 David,David Correia da Fonseca T,P,430588
8,Alex,Alex Paulo Menezes S ...,T P,354387 28 Fred,Frederico Burgel Xavier T,P,172404
9,Italo,Italo Barbosa de Andrade,T P,518717 29 Patric,Patric Cabral Lalau T,P,178620
10,Renato,Renato Vieira Rodrigues,T P,301503 33 Bruno Rami ...,Bruno Edgar Silva Al... T,P,335379
11,Nathan,Nathan Athaydes Camp ...,T P,296334 99 Andre Lima,Andre Luiz Barretto ... T,P,154497
12,Marcao,Sebastiao Marcos Bar ...,R P,126468 4 Alan Costa,Alan Henrique Costa R,P,188990
13,Diego,Diego Barbosa Tavares,R P,331248 7 Uillian,Uillian Correia Gran... R,P,180789
14,Maycon,Maycon Lucas Nogueir ...,R P,291597 8 Cardenas,Sherman Andres Carde... R,P,522234
15,Zezinho,Jose Luis dos Santos ...,R P,294712 17 Jhemerson,Jhemerson Guimaraes ... R,P,379565
16,Kaike,Kaike Silva Mendes,R P,379282 19 Pineda,Jean Paul Jesus Pine... R,P,565374
17,Diego,Diego Machado Canuto,R P,374937 20 Fael,Rafaelson Bezerra Fe... R,P,439179
18,Guilherme  ...,Guilherme Bitencourt ...,R P,348895 22 Neto,Norberto Pereira Mar... R,P,186564
19,Pedro,Pedro Gomes Bortoluzo,R P,374319 23 Caique,Caique Luiz Santos d... R,P,383559
20,Pessalli,Jonas Henrique Pessalli,R P,188141 37 Bruno,Bruno Bispo dos Anjos R,P,367372
"",,Comissão Técnica
"",Paraná / PR,Vitória / BA
Técnico:,Wagner Augusto Lopes - CREF 047824 SP,Técnico: Argelico Fucks - 365502662 RS
Auxiliar Técnico:,Sandro Chaves De Assis - 21615845 SP,Auxiliar Técnico: Glebson Robson Barroso Lira - 1563188 PB
Médico:,Bruno Francisco Ribas  - 28349 PR,Médico: Rodrigo Vasco Da Gama Neto - 5624 RJ
Preparador Físico:,Rodrigo Filoco De Rezende - 006415 PR,Preparador Físico: Reverson Bastos Pimentel  - 034749 SP
Massagista:,Oilson Leopoldino Sutil - COREN 522844,Massagista: Michel Aguiar Dos Santos - CREF 136606 F
Preparador De GoleiroF:e lipe Rosa Jorge - CREF 076483 SP,,Preparador De GoleiroW: ashington Luiz Duarte Rufino  - 1162627450 BA
"",,,,Substituições,
Tempo,1T/2T,,Equipe,Entrou,Saiu
14:00,2T,Paraná/PR,,18 - Guilherme Bitencourt da S ...,9 - Italo Barbosa de Andrade
27:00,2T,Vitória/BA,,19 - Jean Paul Jesus Pineda Co ...,33 - Bruno Edgar Silva Almeida ...
28:00,2T,Paraná/PR,,13 - Diego Barbosa Tavares,10 - Renato Vieira Rodrigues
36:00,2T,Vitória/BA,,17 - Jhemerson Guimaraes Gaigh ...,16 - Elosman Euller Silva Cava ...
40:00,2T,Vitória/BA,,7 - Uillian Correia Granemann ...,5 - Willian Roberto de Farias ...
41:00,2T,Paraná/PR,,20 - Jonas Henrique Pessalli,7 - Robson dos Santos Fernand ...
