"",,Arbitragem
Arbitro:,Anderson Daronco (FIFA / RS),
Arbitro Assistente 1:,Jose Javel Silveira (ESP-2 / RS),
Arbitro Assistente 2:,Elio Nepomuceno de Andrade Junior (CBF-2 / RS),
Quarto Arbitro:,Lucio Jose Silva Araujo (CBF-2 / BA),
Delegado  Especial:,Kleber Moradillo da Silva (000 / BA),
"",,,Cronologia,,,
"",1o Tempo,,2o Tempo,,,
Entrada do mandante:,17:20Atraso:,,Não Houve Entrada do mandante: 18:33,Atraso:,,Não Houve
Entrada do visitante:,17:20Atraso:,,Não Houve Entrada do visitante: 18:32,Atraso:,,Não Houve
Início 1o Tempo:,17:30 Atraso:,,Não Houve Início do 2o Tempo: 18:34,Atraso:,,Não Houve
Término do 1o Tempo:,18:19 Acréscimo:,,4 min Término do 2o Tempo: 19:23,Acréscimo:,,4 min
Resultado do 1o Tempo: 1 X 0,,,Resultado Final: 1 X 0,,,
"",,,,Relação de Jogadores,,,
"",,Vitória / BA,,,Ceará / CE,,
No,Apelido,Nome Completo T/R P/A,,CBF No Apelido,Nome Completo T/R P/A,,CBF
1,Roberto To ...,Roberto Junior Ferna ... T,P,511533 1 Everson,Everson Felipe Marqu... T,P,188398
2,Diego,Diego Renan de Lima  ... T,P,184273 2 Cametá,Tiago Coelho Andrade T,P,392058
3,Kanu,Antonio Eduardo Pere ... T,P,165775 3 Sandro,Sandro Silva de Souza T,P,172036
5,Mauricio,Mauricio Azevedo Alves T,P,189046 4 Charles,Charles Luis Reiter T,P,300886
6,Elosman,Elosman Euller Silva ... T,P,369136 5 Andres,Andres Fernandes Gon... T,P,180842
7,Marcelo,Marcelo Machado dos  ... T,P,355752 6 Victor,Victor Luis Chuab Za... T,P,309431
8,Pedro Ken,Pedro Ken Marimoto M ... T,P,170095 7 Joao Marcos,Joao Marcos Alves Fe... T,P,155201
9,Elton,Elton Rodrigues Brandao T,P,162905 8 Ricardinho,Ricardo Dias Acosta T,P,169114
10,Vander,Vander Luiz Silva Souza T,P,293180 9 Rafael Costa,Rafael Costa dos Santos T,P,180284
11,Escudero,Damian Ariel Escudero T,P,371689 10 Wescley,Wescley Gomes dos Santos T,P,297441
14,Guilherme,Guilherme Cruz de Mattis T,P,291534 11 Alex,Alex Broch Amado T,P,293164
12,Kaufmann,Fernando Miguel Kaufmann R,P,159684 12 Douglas,Douglas Borges R,P,184332
13,Luis,Luis Vinicius da Sil ... R,P,394327 13 Everton,Everton Claiton da Silva R,P,314174
15,Marcelo Ma ...,Marcelo de Mattos Terra R,P,154766 14 Gilvan,Gilvan Souza Correa R,P,188660
16,Luiz,Luiz Gustavo Tavares ... R,P,300856 15 Carlos,Carlos Antonio Ferre... R,P,291796
17,Flavio Med ...,Flavio Medeiros da Silva R,P,337826 17 Fabinho,Fabio Souza dos Santos R,P,161253
18,Jorge Wagn ...,Jorge Wagner Goes Co ... R,P,137073 18 Julio Cesar,Julio Cesar da Silva... R,P,139091
19,Pereira,Edson Luiz Martins d ... R,P,184176 19 Siloe,Siloe Maciel Pereira R,P,291773
20,Gabriel,Gabriel Pereira da Silva R,P,352160 20 Fernandinho,Fernando Alves Santa... R,P,138800
21,Fael,Rafaelson Bezerra Fe ... R,P,439179,,,
22,David,David Correia da Fonseca R,P,430588,,,
23,Yan,Yan Matheus Santos Souza R,P,436451,,,
"",,Comissão Técnica,
"",Vitória / BA,,Ceará / CE
Técnico:,Vagner Carmo Mancini  - 16554885,Técnico:,Luis Carlos Cirne Lima Lorenzi - 10227284
Auxiliar Técnico:,Regis Angeli  - 107379272,Auxiliar Técnico:,Ademir Ferreira Dos Santos  - 284351817
Médico:,Luis Felipe Daneu Fernandes  - 15152,Médico:,Joaquim Sampaio Garcia Filho - 11323
Preparador Físico:,Angelo Alves De Oliveira  - 002396,Preparador Físico:,Felipe Garcia Celia  - 005989
Massagista:,Clicio Alves Do Nascimento  - 0416398987,Massagista:,Anacleto Pires De Sousa - 510181
"",,,,,Gols,
Tempo,1T/2T,No,Tipo,Nome do Jogador,,Equipe
20:00,1T,3,NR,Antonio Eduardo Pereira dos Santos,,Vitória/BA
"",,,,Substituições,
Tempo,1T/2T,,Equipe,Entrou,Saiu
39:00,1T,Vitória/BA,,18 - Jorge Wagner Goes Conceic ...,6 - Elosman Euller Silva Cava ...
10:00,2T,Ceará/CE,,19 - Siloe Maciel Pereira,11 - Alex Broch Amado
18:00,2T,Ceará/CE,,18 - Julio Cesar da Silva E So ...,7 - Joao Marcos Alves Ferreir ...
23:00,2T,Vitória/BA,,16 - Luiz Gustavo Tavares Cond ...,7 - Marcelo Machado dos Santo ...
38:00,2T,Vitória/BA,,17 - Flavio Medeiros da Silva,8 - Pedro Ken Marimoto Moreir ...
42:00,2T,Ceará/CE,,17 - Fabio Souza dos Santos,10 - Wescley Gomes dos Santos
