"",,Arbitragem
Arbitro:,Jailson Macedo Freitas (ESP-2 / BA),
Arbitro Assistente 1:,Jose Raimundo Dias da Hora (CBF-2 / BA),
Arbitro Assistente 2:,Marcos Welb Rocha de Amorim (CBF-1 / BA),
Quarto Arbitro:,Jose Claudio Rocha Filho (CBF-2 / SP),
Assessor:,Almir Alves de Mello (000 / SP),
"",,,Cronologia,,,
"",1o Tempo,,2o Tempo,,,
Entrada do mandante:,16:19Atraso:,,Não Houve Entrada do mandante: 17:29,Atraso:,,Não Houve
Entrada do visitante:,16:20Atraso:,,Não Houve Entrada do visitante: 17:30,Atraso:,,Não Houve
Início 1o Tempo:,16:30 Atraso:,,Não Houve Início do 2o Tempo: 17:32,Atraso:,,Não Houve
Término do 1o Tempo:,17:17 Acréscimo:,,2 min Término do 2o Tempo: 18:21,Acréscimo:,,4 min
Resultado do 1o Tempo: 0 X 0,,,Resultado Final: 1 X 0,,,
"",,,,Relação de Jogadores,,,
"",,Oeste / SP,,,Santa Cruz / PE,,
No,Apelido,Nome Completo T/R P/A,,CBF No Apelido,Nome Completo T/R P/A,,CBF
1,Jeferson,Jeferson Romario San ... T,P,352377 1 Tiago Card ...,Tiago Cardoso dos Santos T,P,160028
2,Welder,Welder da Silva Marcal T,P,293010 2 Josileudo,Josileudo Rodrigues ... T,P,176416
3,Halisson,Halisson Bruno Melo  ... T,P,154584 3 Hueglo,Hueglo dos Santos Neris T,P,333318
4,Ligger,Ligger Moreira Malaquias T,P,291797 4 Danny,Danny Bittencourt Morais T,P,159190
5,Leandro,Leandro Domingos de Melo T,P,163929 5 Wellington,Wellington Cezar Alv... T,P,370555
6,Fernandinho,Fernando Galhardo Borges T,P,163429 6 Marlon,Marlon Bruno Mariano... T,P,308919
7,Renatinho,Renato Xavier Sena T,P,171710 7 Moradei,Daniel Moradei de Al... T,P,169519
8,Patrick,Patrik Camilo Cornel ... T,P,178818 8 Luis,Luis Gustavo Melere ... T,P,309982
9,Junior Negao,Gleidionor Figueired ... T,P,174846 9 Anderson A ...,Anderson Angus Aquino T,P,161518
10,Mazinho,Anderson Soares da Silva T,P,181254 10 Joao Paulo,Joao Paulo Mior T,P,185012
11,Wangler,Wangler da Silva T,P,364493 11 Lele,Wesley de Jesus Correia T,P,191513
12,Leandro,Leandro Moreira dos  ... R,P,158945 12 Bruno,Bruno Cortez Cardoso R,P,154437
13,Paulo Henr ...,Paulo Henrique Marti ... R,P,181617 13 Vitor,Cicero Vitor dos San... R,P,156325
14,Camargo,Luiz Henrique Camargo R,P,173179 14 Alemao,Rafael Berger R,P,186128
15,Gabriel,Gabriel Ultramari Mendes R,P,309428 15 Pedro Henr ...,Pedro Henrique de Ca... R,P,297781
16,Rodolfo,Rodolfo Freitas da Silva R,P,354273 16 Lucio,Lucio Carlos Cajueir... R,P,137582
17,Rafael,Rafael Martins da Silva R,P,161736 17 Nathan,Nathan Athaydes Camp... R,P,296334
18,Rodrigo,Rodrigo Batista da Cruz R,P,158622 18 Renato Lima,Renato Gonçalves de Lima R,P,341132
"",,,,19 Daniel,Maikel Daniel Costa R,P,175913
"",,,,20 Bruno,Bruno Eduardo de Moraes R,P,185297
"",,Comissão Técnica,
"",Oeste / SP,,Santa Cruz / PE
Técnico:,Roberto Fernando Scheneiger - 3324441,Técnico:,Marcelo Martelotte - 13407709
Auxiliar Técnico:,Renan Roberto De Freitas - 436932453,Auxiliar Técnico:,Antonio Carlos Ribeiro Junior - 172423778
Médico:,Pedro Henrique Perez Da Costa - 152137,Médico:,Gilson De Resende - 4294
Preparador Físico:,Willian Cesar Hauptmam - 4244 GSP,Preparador Físico:,Jailton Cintra Peixoto De Vasconcelos - 974-GPE
Massagista:,Jose Aparecido De Oliveira - 19261720,Massagista:,Fernando Jose Mendes - 2881691
"",,,,,Gols,
Tempo,1T/2T,No,Tipo,Nome do Jogador,,Equipe
36:00,2T,17,NR,Rafael Martins da Silva,,Oeste/SP
"",,,,Substituições,
Tempo,1T/2T,,Equipe,Entrou,Saiu
45:00,INT,Oeste/SP,,17 - Rafael Martins da Silva,11 - Wangler da Silva
45:00,INT,Santa Cruz/PE,,13 - Cicero Vitor dos Santos J ...,5 - Wellington Cezar Alves de ...
19:00,2T,Santa Cruz/PE,,20 - Bruno Eduardo de Moraes,9 - Anderson Angus Aquino
21:00,2T,Oeste/SP,,18 - Rodrigo Batista da Cruz,9 - Gleidionor Figueiredo Pin ...
36:00,2T,Santa Cruz/PE,,18 - Renato Gonçalves de Lima,11 - Wesley de Jesus Correia
37:00,2T,Oeste/SP,,13 - Paulo Henrique Martins Co ...,8 - Patrik Camilo Cornelio da ...
