"",Arbitragem
Arbitro:,Andre Luiz de Freitas Castro (ESP-2 / GO)
Arbitro Assistente 1:,Jesmar Benedito Miranda de Paula (CBF-1 / GO)
Arbitro Assistente 2:,Flavio Gomes Barroca (CBF-1 / RN)
Quarto Arbitro:,Jose Cleuton de Souza Lima (CBF-2 / CE)
Delegado  Especial:,José Nilman de Lima (000 / RN)
"",,,Cronologia,,,
"",1o Tempo,,2o Tempo,,,
Entrada do mandante:,16:23Atraso:,,Não Houve Entrada do mandante: 17:31,Atraso:,,Não Houve
Entrada do visitante:,16:23Atraso:,,Não Houve Entrada do visitante: 17:33,Atraso:,,Não Houve
Início 1o Tempo:,16:32 Atraso:,,2 min Início do 2o Tempo: 17:35,Atraso:,,Não Houve
Término do 1o Tempo:,17:20 Acréscimo:,,3 min Término do 2o Tempo: 18:24,Acréscimo:,,4 min
Resultado do 1o Tempo: 0 X 2,,,Resultado Final: 1 X 2,,,
"",,,,Relação de Jogadores,,,
"",,Ceará / CE,,,Vitória / BA,,
No,Apelido,Nome Completo T/R P/A,,CBF No Apelido,Nome Completo T/R P/A,,CBF
1,Tiago,Tiago Antonio Campagnaro T,P,136672 1 Kaufmann,Fernando Miguel Kaufmann T,P,159684
2,Alan,Walter Alan Nogueira ... T,P,302912 2 Diogo,Diogo Mateus de Alme... T,P,315945
3,Sandro,Sandro Silva de Souza T,P,172036 3 Guilherme,Guilherme Cruz de Mattis T,P,291534
4,Charles,Charles Luis Reiter T,P,300886 4 Ramon,Ramon Menezes Roma T,P,402095
5,Andres,Andres Fernandes Gon ... T,P,180842 5 Marcelo Ma ...,Marcelo de Mattos Terra T,P,154766
6,Victor,Victor Luis Chuab Za ... T,P,309431 6 Diego,Diego Renan de Lima ... T,P,184273
7,Uillian,Uillian Correia Gran ... T,P,180789 7 Rhayner,Rhayner Santos Nasci... T,P,299208
8,Ricardinho,Ricardo Dias Acosta T,P,169114 8 Pedro Ken,Pedro Ken Marimoto M... T,P,170095
9,Rafael,Rafael dos Santos da ... T,P,393762 9 Elton,Elton Rodrigues Brandao T,P,162905
10,Bernardo,Bernardo Vieira de Souza T,P,175729 10 Rogerio,Jose Rogerio de Oliv... T,P,291780
11,Fernandinho,Fernando Alves Santa ... T,P,138800 11 Escudero,Damian Ariel Escudero T,P,371689
12,Everson,Everson Felipe Marqu ... R,P,188398 12 Roberto To ...,Roberto Junior Ferna... R,P,511533
13,Guilherme,Guilherme Andrade Silva R,P,180790 13 Kanu,Antonio Eduardo Pere... R,P,165775
14,Gilvan,Gilvan Souza Correa R,P,188660 14 Elosman,Elosman Euller Silva... R,P,369136
15,Joao Marcos,Joao Marcos Alves Fe ... R,P,155201 15 Mauricio,Mauricio Azevedo Alves R,P,189046
16,Everton,Everton Claiton da Silva R,P,314174 16 Jorge Wagn ...,Jorge Wagner Goes Co... R,P,137073
17,Mazola,Marcelino Junior Lop ... R,P,178965 17 Pereira,Edson Luiz Martins d... R,P,184176
18,Julio Cesar,Julio Cesar da Silva ... R,P,139091 18 Flavio Med ...,Flavio Medeiros da Silva R,P,337826
19,Fabinho,Fabio Souza dos Santos R,P,161253 19 Robert,Robert de Pinho de Souza R,P,140778
20,Wellington,Wellington Carvalho  ... R,P,307674 20 David,David Correia da Fonseca R,P,430588
"",,,,21 Vander,Vander Luiz Silva Souza R,P,293180
"",,Comissão Técnica,
"",Ceará / CE,,Vitória / BA
Técnico:,Marcelo Ribeiro Cabo - 07061646-1,Técnico:,Vagner Carmo Mancini - 16554885-SP
Auxiliar Técnico:,Rodolfo Andrade De Oliveira - 036463G-G/RJ,Auxiliar Técnico:,Regis Angeli - 107379272-SP
Médico:,Henrique Jose Bastos Pinheiro - 5821-CE,Médico:,Marcelo Barbosa Cortes  - 14965-BA
Preparador Físico:,Luiz Gustavo De Araújo - 5028-RJ,Preparador Físico:,Angelo Alves Oliveira - 2396G-BA
Massagista:,Anacleto Pires De Sousa - 510181-CE,Massagista:,Clício Alves Do Nascimento - 4163989-BA
"",,,,,Gols,
Tempo,1T/2T,No,Tipo,Nome do Jogador,,Equipe
15:00,1T,11,NR,Damian Ariel Escudero,,Vitória/BA
17:00,1T,10,NR,Jose Rogerio de Oliveira Melo,,Vitória/BA
33:00,2T,18,FT,Julio Cesar da Silva E Souza,,Ceará/CE
"",,,,Substituições,
Tempo,1T/2T,,Equipe,Entrou,Saiu
12:00,1T,Vitória/BA,,12 - Roberto Junior Fernandez  ...,1 - Fernando Miguel Kaufmann
26:00,1T,Ceará/CE,,18 - Julio Cesar da Silva E So ...,6 - Victor Luis Chuab Zamblau ...
39:00,1T,Ceará/CE,,17 - Marcelino Junior Lopes Ar ...,8 - Ricardo Dias Acosta
29:00,2T,Ceará/CE,,19 - Fabio Souza dos Santos,10 - Bernardo Vieira de Souza
29:00,2T,Vitória/BA,,21 - Vander Luiz Silva Souza,10 - Jose Rogerio de Oliveira  ...
29:00,2T,Vitória/BA,,15 - Mauricio Azevedo Alves,7 - Rhayner Santos Nascimento ...
