"",,Arbitragem
Arbitro:,Devarly Lira do Rosario (CBF-1 / ES),
Arbitro Assistente 1:,Fabio Faustino dos Santos (CBF-1 / ES),
Arbitro Assistente 2:,Leonardo Mendonca (CBF-1 / ES),
Quarto Arbitro:,Leandro Bizzio Marinho (CBF-1 / SP),
Assessor:,Carlos Donizeti Pianosqui (000 / SP),
"",,,Cronologia,,,
"",1o Tempo,,2o Tempo,,,
Entrada do mandante:,20:50Atraso:,,Não Houve Entrada do mandante: 22:00,Atraso:,,Não Houve
Entrada do visitante:,20:50Atraso:,,Não Houve Entrada do visitante: 22:00,Atraso:,,Não Houve
Início 1o Tempo:,21:00 Atraso:,,Não Houve Início do 2o Tempo: 22:02,Atraso:,,Não Houve
Término do 1o Tempo:,21:47 Acréscimo:,,2 min Término do 2o Tempo: 22:51,Acréscimo:,,4 min
Resultado do 1o Tempo: 0 X 0,,,Resultado Final: 2 X 0,,,
"",,,,Relação de Jogadores,,,
"",,Oeste / SP,,,Ceará / CE,,
No,Apelido,Nome Completo T/R P/A,,CBF No Apelido,Nome Completo T/R P/A,,CBF
1,Leandro,Leandro Moreira dos  ... T,P,158945 1 Luis,Luis Carlos Dallastella T,P,168281
2,Welder,Welder da Silva Marcal T,P,293010 2 Buiu,Marcos Ytalo Benicio... T,P,366093
3,Halisson,Halisson Bruno Melo  ... T,P,154584 3 Gilvan,Gilvan Souza Correa T,P,188660
4,Ligger,Ligger Moreira Malaquias T,P,291797 4 Charles,Charles Luis Reiter T,P,300886
5,Leandro,Leandro Domingos de Melo T,P,163929 5 Andres,Andres Fernandes Gon... T,P,180842
6,Daniel,Daniel Carvalho da Silva T,P,155651 6 Fernandinho,Fernando Alves Santa... T,P,138800
7,Rafael,Rafael Martins da Silva T,P,161736 7 Uillian,Uillian Correia Gran... T,P,180789
8,Fernandinho,Fernando Galhardo Borges T,P,163429 8 Ricardinho,Ricardo Dias Acosta T,P,169114
9,Junior Negao,Gleidionor Figueired ... T,P,174846 9 Vinicius,Vinicius Santos Silva T,P,312048
10,Mazinho,Anderson Soares da Silva T,P,181254 10 Fabinho,Fabio Souza dos Santos T,P,161253
11,Waguininho,Wagner da Silva Souza T,P,300229 11 Roger,Roger Roberto dos Santos T,P,172933
12,Jeferson,Jeferson Romario San ... R,P,352377 12 Gustavo,Gustavo Costa Silvei... R,P,350273
13,Leonardo,Leonardo Alves Sao P ... R,P,415484 13 Victor,Victor Luis Chuab Za... R,P,309431
14,Elson,Elson Jose Dias Junior R,P,348256 14 Sandro,Sandro Silva de Souza R,P,172036
15,Gabriel,Gabriel Ultramari Mendes R,P,309428 15 Ricardo Co ...,Ricardo Renato de Co... R,P,162278
16,Renatinho,Renato Xavier Sena R,P,171710 16 Sandro,Sandro Manoel dos Santos R,P,172314
17,Branquinho,Wellington Clayton G ... R,P,179229 17 Wescley,Wescley Gomes dos Santos R,P,297441
18,Rodrigo,Rodrigo Batista da Cruz R,P,158622 18 Rodrigo,Rodrigo Silva R,P,163063
"",,,,19 Siloe,Siloe Maciel Pereira R,P,291773
"",,Comissão Técnica,
"",Oeste / SP,,Ceará / CE
Tecnico:,Roberto Fernado Sheneiger - 3324441-SSP/SP,Tecnico:,Paulo Antonio Do Prado Pereira - 06447-P/SP
Auxiliar Tecnico:,Renan Roberto De Freitas - 43693245-3,Auxiliar Tecnico:,Fernando Seabra - 26559937-4
Medico:,Pedro Henrique Perez Da Costa  - 152137,Medico:,Joaquim Sampaio Garcia Filho - 11323-CE
Preparador Fisico:,Willian Cesar Hauptmam - 4244-G/SSP,Preparador Fisico:,Alexandre Irineu Carvalho - 003861-G-GO
Massagista:,Jose Aparecido De Oliveira - 19261720,Massagista:,Anacleto Pires De Souza - 510181-CE
"",,,,,Gols,
Tempo,1T/2T,No,Tipo,Nome do Jogador,,Equipe
26:00,2T,6,NR,Daniel Carvalho da Silva,,Oeste/SP
35:00,2T,18,NR,Rodrigo Batista da Cruz,,Oeste/SP
"",,,,Substituições,
Tempo,1T/2T,,Equipe,Entrou,Saiu
+3:00,2T,Oeste/SP,,16 - Renato Xavier Sena,10 - Anderson Soares da Silva
23:00,1T,Oeste/SP,,18 - Rodrigo Batista da Cruz,7 - Rafael Martins da Silva
18:00,2T,Ceará/CE,,19 - Siloe Maciel Pereira,10 - Fabio Souza dos Santos
29:00,2T,Ceará/CE,,18 - Rodrigo Silva,9 - Vinicius Santos Silva
32:00,2T,Ceará/CE,,17 - Wescley Gomes dos Santos,5 - Andres Fernandes Goncalve ...
44:00,2T,Oeste/SP,,17 - Wellington Clayton Goncal ...,18 - Rodrigo Batista da Cruz
