"",Arbitragem
Arbitro:,Cleisson Veloso Pereira (CBF-1 / MG)
Arbitro Assistente 1:,Pablo Almeida da Costa (ASP-FIFA / MG)
Arbitro Assistente 2:,Wesley Moreira de Carvalho (CBF-2 / MG)
Quarto Arbitro:,Eduardo Tomaz de Aquino Valadao (CBF-1 / GO)
Assessor:,Cleiber Elias Leite (ASS / GO)
"",,,Cronologia,,,
"",1o Tempo,,2o Tempo,,,
Entrada do mandante:,19:20Atraso:,,Não Houve Entrada do mandante: 20:29,Atraso:,,Não Houve
Entrada do visitante:,19:20Atraso:,,Não Houve Entrada do visitante: 20:29,Atraso:,,Não Houve
Início 1o Tempo:,19:30 Atraso:,,Não Houve Início do 2o Tempo: 20:31,Atraso:,,Não Houve
Término do 1o Tempo:,20:16 Acréscimo:,,1 min Término do 2o Tempo: 21:20,Acréscimo:,,4 min
Resultado do 1o Tempo: 0 X 0,,,Resultado Final: 1 X 1,,,
"",,,,Relação de Jogadores,,,
"",,Atlético / GO,,,Mogi Mirim / SP,,
No,Apelido,Nome Completo,T/R P/A,CBF No Apelido,Nome Completo T/R P/A,,CBF
1,Marcio,Marcio Luiz Silva Lo ...,T P,129274 1 Daniel,Daniel Martins Guimaraes T,P,174365
2,Eduardo,Eduardo Felipe Lacer ...,T P,404648 2 Edson,Edson Ramos da Silva T,P,167070
3,Marllon,Marllon Goncalves Je ...,T P,299840 3 Fabio,Fabio Pizarro Sanches T,P,186135
4,Lino,Leandro Lino de Freitas,T P,163660 4 Paulao,Paulo Rogerio Rodrig... T,P,163197
5,Anderson,Anderson Carvalho Tr ...,T P,160150 5 Magal,Sidnei da Silva T,P,146581
6,Samuel,Samuel Firmino de Jesus,T P,168009 6 Luan,Luan Cesar Messias T,P,351539
7,Pedrinho,Pedro Gonzaga,T P,298432 7 Henrique,Henrique Marcelino Motta T,P,187333
8,Anderson,Anderson Leite Morais,T P,323184 8 Leonardo,Leonardo Bartholo Prando T,P,175026
9,Arthur,Arthur Caike do Nasc ...,T P,292833 9 Matheus,Matheus Cardoso de Souza T,P,333800
10,Ailton,Ailton do Nascimento ...,T P,151291 10 Gustavo,Gustavo Nascimento d... T,P,371956
11,Geraldo,Hermenegildo da Cost ...,T P,327121 11 Sergio Hen ...,Sergio Henrique Fran... T,P,169767
12,Weverton V ...,Weverton Vilela Nasc ...,R P,172131 12 Mauro,Mauro Jose Mestriner R,P,132950
13,Eder,Eder Sciola Santana,R P,175135 13 Franco de  ...,Franco de Paula Ferreira R,P,312406
14,Denilson,Denilson de Araujo S ...,R A,434915 14 Leonardo,Leonardo de Jesus Ge... R,P,162332
15,Joao Junior,Joao Denoni Junior,R P,318773 15 Romario,Jonathan de Almeida ... R,P,329589
16,Thiago,Thiago de Almeida Primão,R P,308568 16 Dunguinha,Cleysson Vinicius Ol... R,P,311118
17,Luiz Ferna ...,Luiz Fernando Moraes ...,R P,451607 17 Elvis,Elvis Jose de Lima R,P,172045
18,Rodrigo,Rodrigo Meneses Quin ...,R P,350866 18 Juninho,Rivaldo Vitor Borba ... R,P,353792
19,Juninho,Junior Cesar Moreira ...,R P,182385 19 Junior,Jose Josenildo Marqu... R,P,295958
20,Ayrton,Ayrton de Melo Carneiro,R P,406454,,,
"",,Comissão Técnica,
"",Atlético / GO,,Mogi Mirim / SP
Tecnico:,Jorge Luiz Da Silva - 13242604-3,Tecnico:,Ivanilton Sergio Guedes - 12526388
Auxiliar Tecnico:,Anderson Lima Veiga - 18863681,Auxiliar Tecnico:,Jose Everaldo T. Pierrotti - 20085760697
Medico:,Avimar Teodoro De Oliveira Junior - 12245,Medico:,Alexandre V. V. Carvalhal - 128984
Preparador Fisico:,Jorge Alberto Pinto Soter - 005113-G/RJ,Preparador Fisico:,Mateus Simoso Caetano - 92924-G/SP
Massagista:,Pablo Bueno Da Rocha - 164046-F/GO,Massagista:,Marcos V. B. Do E. Santos - 37790714-5
"",,,,,Gols,
Tempo,1T/2T,No,Tipo,Nome do Jogador,,Equipe
05:00,2T,9,NR,Arthur Caike do Nascimento Cruz,,Atlético/GO
32:00,2T,18,NR,Rivaldo Vitor Borba Ferreira Junior,,Mogi Mirim/SP
"",,,,Substituições,
Tempo,1T/2T,,Equipe,Entrou,Saiu
45:00,INT,Atlético/GO,,18 - Rodrigo Meneses Quintanil ...,5 - Anderson Carvalho Trindad ...
45:00,INT,Atlético/GO,,19 - Junior Cesar Moreira da C ...,11 - Hermenegildo da Costa Pau ...
08:00,2T,Mogi Mirim/SP,,17 - Elvis Jose de Lima,10 - Gustavo Nascimento da Cos ...
17:00,2T,Mogi Mirim/SP,,18 - Rivaldo Vitor Borba Ferre ...,7 - Henrique Marcelino Motta
25:00,2T,Mogi Mirim/SP,,19 - Jose Josenildo Marques de ...,9 - Matheus Cardoso de Souza
26:00,2T,Atlético/GO,,15 - Joao Denoni Junior,8 - Anderson Leite Morais
