"",,Arbitragem
Arbitro:,Vinicius Furlan (CBF-1 / SP),
Arbitro Assistente 1:,Daniel Paulo Ziolli (ASP-FIFA / SP),
Arbitro Assistente 2:,Fabio Rogerio Baesteiro (CBF-1 / SP),
Quarto Arbitro:,Gleydson Ferreira Leite (CBF-2 / PE),
Assessor:,Ubirajara Ferraz Jota (ASS / PE),
"",,,Cronologia,,,
"",1o Tempo,,2o Tempo,,,
Entrada do mandante:,20:20Atraso:,,Não Houve Entrada do mandante: 21:31,Atraso:,,Não Houve
Entrada do visitante:,20:20Atraso:,,Não Houve Entrada do visitante: 21:31,Atraso:,,Não Houve
Início 1o Tempo:,20:30 Atraso:,,Não Houve Início do 2o Tempo: 21:32,Atraso:,,Não Houve
Término do 1o Tempo:,21:17 Acréscimo:,,2 min Término do 2o Tempo: 22:21,Acréscimo:,,4 min
Resultado do 1o Tempo: 1 X 0,,,Resultado Final: 2 X 1,,,
"",,,,Relação de Jogadores,,,
"",,Santa Cruz / PE,,,América / MG,,
No,Apelido,Nome Completo T/R P/A,,CBF No Apelido,Nome Completo T/R P/A,,CBF
1,Tiago Card ...,Tiago Cardoso dos Santos T,P,160028 1 Joao,Joao Ricardo Riedi T,P,298660
2,Vitor,Cicero Vitor dos San ... T,P,156325 2 Roberto,Roberto Santos da Si... T,P,191476
3,Alemao,Rafael Berger T,P,186128 3 Wesley,Wesley Ladeira Matos T,P,306551
4,Hueglo,Hueglo dos Santos Neris T,P,333318 4 Anderson,Anderson Conceicao B... T,P,170178
5,Wellington,Wellington Cezar Alv ... T,P,370555 5 Rodrigo,Rodrigo de Souza Fonseca T,P,293529
6,Marlon,Marlon Bruno Mariano ... T,P,308919 6 Raul,Raul Diogo Souza Rocha T,P,173948
7,Moradei,Daniel Moradei de Al ... T,P,169519 8 Leandro,Leandro Luchese Guer... T,P,137403
8,Luis,Luis Gustavo Melere  ... T,P,309982 9 Richarlison,Richarlison de Andrade T,P,459496
9,Bruno,Bruno Eduardo de Moraes T,P,185297 10 Mancini,Alessandro Faioli Am... T,P,134046
10,Joao Paulo,Joao Paulo Mior T,P,185012 11 Marcelo Mi ...,Marcelo Aparecido To... T,P,169747
11,Lele,Wesley de Jesus Correia T,P,191513 20 Tony,Antonio de Moura Car... T,P,176981
12,Bruno,Bruno Cortez Cardoso R,P,154437 7 Felipe Amo ...,Felipe da Silva Amorim R,P,340891
13,Joao Carlos,Joao Carlos dos Sant ... R,P,299683 12 Glaycon,Glaycon Rian de Oliveira R,P,292137
14,Danny,Danny Bittencourt Morais R,P,159190 13 Walber,Walber da Silva Sous... R,P,173921
15,Diego,Diego Alessandro Apa ... R,P,162757 14 Andrezinho,Andre Ricardo de Oli... R,P,306140
16,Lucio,Lucio Carlos Cajueir ... R,P,137582 15 Diego,Diego Fernando Lorensi R,P,183626
17,Marcilio,Jose Marcilio Martin ... R,P,411845 16 Guilherme,Guilherme Xavier de ... R,P,312572
18,Bruno,Bruno Felipe Lima Te ... R,P,318691 17 Cristiano,Cristiano da Silva S... R,P,174380
19,Daniel,Maikel Daniel Costa R,P,175913 18 Henrique,Henrique Campos Santos R,P,186104
20,Renato Lima,Renato Gonçalves de Lima R,P,341132,,,
21,Nathan,Nathan Athaydes Camp ... R,P,296334,,,
22,Diogo,Diogo Campos Gomes R,P,301369,,,
"",,Comissão Técnica,
"",Santa Cruz / PE,,América / MG
Técnico:,Marcelo Martelotte - 13497709,Técnico:,Givanildo José De Oliveira - 931503
Auxiliar Técnico:,Antonio Carlos Ribeiro Junior - 17242377,Auxiliar Técnico:,Cláudio Mendes Prates - 003389
Médico:,Gabriel Campos Bezerra Junior - 15110,Médico:,Afonso Rangel De Souza - 9618
Preparador Físico:,Jailton Cintra Peixoto De Vasconcelos - 974-G/PE,Preparador Físico:,Wellington José Vero - 00768
Massagista:,Paulo Fernando De Araujo Melo - 2881691,Massagista:,Silvio Junio Nunes Da Silva - 4761735
"",,,,,Gols,
Tempo,1T/2T,No,Tipo,Nome do Jogador,,Equipe
24:00,1T,8,NR,Luis Gustavo Melere da Silva,,Santa Cruz/PE
20:00,2T,20,NR,Antonio de Moura Carvalho,,América/MG
28:00,2T,9,NR,Bruno Eduardo de Moraes,,Santa Cruz/PE
"",,,Substituições,
Tempo,1T/2T,Equipe,Entrou,Saiu
45:00,INT,Santa Cruz/PE,19 - Maikel Daniel Costa,10 - Joao Paulo Mior
18:00,2T,América/MG,7 - Felipe da Silva Amorim,9 - Richarlison de Andrade
19:00,2T,Santa Cruz/PE,20 - Renato Gonçalves de Lima,11 - Wesley de Jesus Correia
33:00,2T,América/MG,17 - Cristiano da Silva Santos ...,10 - Alessandro Faioli Amantin ...
38:00,2T,América/MG,16 - Guilherme Xavier de Olive ...,6 - Raul Diogo Souza Rocha
41:00,2T,Santa Cruz/PE,15 - Diego Alessandro Aparecid ...,6 - Marlon Bruno Mariano de S ...
