"",,Arbitragem
Arbitro:,Janio Pires Gonçalves (CBF-2 / TO),
Arbitro Assistente 1:,Ygor Monteiro de Miranda (CBF-2 / GO),
Arbitro Assistente 2:,Hugo Savio Xavier Correa (CBF-3 / GO),
Quarto Arbitro:,Cleber Vaz da Silva (CBF-2 / GO),
Assessor:,Júlio César Mota Fernandes (000 / GO),
"",,,Cronologia,,,
"",1o Tempo,,2o Tempo,,,
Entrada do mandante:,15:50Atraso:,,Não Houve Entrada do mandante: 17:01,Atraso:,,Não Houve
Entrada do visitante:,15:50Atraso:,,Não Houve Entrada do visitante: 17:00,Atraso:,,Não Houve
Início 1o Tempo:,16:00 Atraso:,,Não Houve Início do 2o Tempo: 17:03,Atraso:,,Não Houve
Término do 1o Tempo:,16:48 Acréscimo:,,3 min Término do 2o Tempo: 17:53,Acréscimo:,,5 min
Resultado do 1o Tempo: 0 X 0,,,Resultado Final: 1 X 0,,,
"",,,,Relação de Jogadores,,,
"",,Anápolis / GO,,,7 de Setembro / MS,,
No,Apelido,Nome Completo,T/R P/A,CBF No Apelido,Nome Completo T/R P/A,,CBF
1,João Vitor,João Vitor Rapatão,T P,305849 1 Fernando,Fernando Celso Lafra... T,P,166703
2,Marcelo,Marcelo Henrique Fer ...,T P,341126 2 Renato,Renato Saraiva Barros T,P,185276
3,Welton,Welton Felipe Marque ...,T P,161770 3 Jaime,Jaime Cardoso Pinto ... T,P,167737
4,Renato,Renato Antonio Justi,T P,172389 4 Bruno Ever ...,Bruno Everton Ferrei... T,P,170037
5,Joao Neto,Joao de Oliveira Cav ...,T P,184416 5 Eduardo Ar ...,Eduardo Rosa dos Santos T,P,135304
6,Bruno,Bruno Barros Di Pietro,T P,145545 6 da Silva,Renildo Martins da Silva T,P,291523
7,Neilson,Neilson dos Santos V ...,T P,298023 7 Peu,Julio Cezar Ferreira... T,P,187400
8,Leandro,Leandro Pare Bulhoes,T P,304444 8 Marinho,Mario Lucio da Silva... T,P,184205
9,Michel,Michel Platini Ferre ...,T P,160144 9 Juninho,Regilson Saboya Mont... T,P,137581
10,Deyvison,Deyvison Fernandes d ...,T P,336959 10 Diouzer,Diouzer da Cruz dos ... T,P,174402
11,Guto,Clayton Augusto Bald ...,T P,347102 11 Otacilio N ...,Otacilio Mariano Neto T,P,158105
12,Vitor,Vitor Ferreira de Paiva,R P,294280 12 Carlos,Carlos Filipe Pereira R,P,295179
13,Caique,Caique Paulo Santos  ...,R P,365590 13 Montoia,Rodrigo Muttoni R,P,169816
14,André,André Luiz Guimarães ...,R P,423695 14 Fabricio,Fabricio Rodrigues d... R,P,168951
15,Marcos Paulo,Marcos Paulo Ramos d ...,R P,291295 15 Alex,Alex Faria Trancoso R,P,179346
16,Mario,Mario Donizete Olive ...,R P,138518 16 Ray,Raimundo Jacome de Lima R,P,179256
17,Brendon,Brendon Lucas da Sil ...,R P,397579 17 Lucas Lore ...,Lucas Lorenco R,P,506778
18,Gabriel,Gabriel Luiz Cintra,R A,434347 18 Maranhao,Antonio Pereira da S... R,P,173731
19,Rafael,Rafael da Cruz Rodrigues,R P,341087,,,
20,Pedro,Pedro Henrique Alves ...,R P,434393,,,
"",,Comissão Técnica
"",Anápolis / GO,7 de Setembro / MS
Técnico:,Waldemar Lemos De Oliveira - 30775274,Técnico: Francisco Eleazar Lima Ramos - 1747-2011/RJ
Auxiliar Técnico:,Ricardo Valério Leão - M4230721,Auxiliar Técnico: Virgílio Mário Ferreira Neto - 37034/RJ
Médico:,Gleber Fernandes De Oliveira - 5874/GO,Médico: Xxxxx - xx
Preparador Físico:,Angelo Luiz De Souza - 2169-G/GO,Preparador Físico: Bruno Oliveira Grosso - 71179-G/SP
Massagista:,Rafael Vinícius Freitas - 4270067,Massagista: Rogério Dias Nogueira - 9088369691/RS
Preparador De GoleiroW: andomar Dionizio Da Costa - 409243,,Preparador De GoleiroN:e lson Barreto - 8439683/RJ
"",,,,,Gols,
Tempo,1T/2T,No,Tipo,Nome do Jogador,,Equipe
36:00,2T,20,NR,Pedro Henrique Alves de Almeida,,Anápolis/GO
"",,,,Substituições,
Tempo,1T/2T,,Equipe,Entrou,Saiu
45:00,INT,Anápolis/GO,,16 - Mario Donizete Oliveira F ...,10 - Deyvison Fernandes de Oli ...
45:00,INT,Anápolis/GO,,20 - Pedro Henrique Alves de A ...,11 - Clayton Augusto Baldisser ...
20:00,2T,Anápolis/GO,,19 - Rafael da Cruz Rodrigues,9 - Michel Platini Ferreira M ...
24:00,2T,7 de Setembro/MS,,18 - Antonio Pereira da Silva  ...,9 - Regilson Saboya Monteiro  ...
35:00,2T,7 de Setembro/MS,,15 - Alex Faria Trancoso,10 - Diouzer da Cruz dos Santo ...
42:00,2T,7 de Setembro/MS,,17 - Lucas Lorenco,7 - Julio Cezar Ferreira do N ...
