"",,Arbitragem
Arbitro:,Salim Fende Chavez (CBF-3 / SP),
Arbitro Assistente 1:,Diego Grubba Schitkovski (CBF-1 / PR),
Arbitro Assistente 2:,Weber Felipe Silva (CBF-3 / PR),
Quarto Arbitro:,Lucas Paulo Torezin (CBF-3 / PR),
Assessor:,Luiz Alberto Alves de Abreu (ASS / PR),
Delegado Local:,Ernaldo Melek Junior (000 / ),
"",,,Cronologia,,,
"",1o Tempo,,2o Tempo,,,
Entrada do mandante:,15:50Atraso:,,Não Houve Entrada do mandante: 17:00,Atraso:,,Não Houve
Entrada do visitante:,15:50Atraso:,,Não Houve Entrada do visitante: 16:58,Atraso:,,Não Houve
Início 1o Tempo:,16:00 Atraso:,,Não Houve Início do 2o Tempo: 17:01,Atraso:,,Não Houve
Término do 1o Tempo:,16:46 Acréscimo:,,1 min Término do 2o Tempo: 17:49,Acréscimo:,,3 min
Resultado do 1o Tempo: 1 X 0,,,Resultado Final: 2 X 0,,,
"",,,,Relação de Jogadores,,,
"",,J. Malucelli / PR,,,Madureira / RJ,,
No,Apelido,Nome Completo,T/R P/A,CBF No Apelido,Nome Completo T/R P/A,,CBF
1,Fabricio,Fabricio Barros Santana,T P,178321 1 Jonathan,Jonathan Ribeiro Louredo T,P,299473
2,Cristovam,Cristovam Roberto Ri ...,T P,188472 2 Luiz Eduardo,Luiz Eduardo Fernand... T,P,310759
3,Alex Fraga,Alex Jose de Oliveir ...,T P,169288 3 Alex,Alex Augusto Martins... T,P,402945
4,Valdomiro  ...,Valdomiro Duarte de  ...,T P,134212 4 Yago,Yago Lopes Silvestre T,P,318079
5,Wellington,Wellington Rodrigues ...,T P,325913 5 Ramon,Ramon dos Santos Pereira T,P,297093
6,Diego,Diego Prates Carlos,T P,319577 7 Ryan,Ryan do Nascimento RamosT,P,306693
7,Getterson,Getterson Alves dos  ...,T P,299686 8 Julio Cesa ...,Julio Cesar de Rezen... T,P,315696
8,Paulo Vitor,Paulo Vitor Catreus  ...,T P,291723 9 Jonhy,Joao Luz da Silva Neto T,P,343817
9,Rafael,Rafael Santiago Maria,T P,168964 10 Luciano,Luciano Francisco Pa... T,P,359865
10,Robson,Robson Ferreira de A ...,T P,379134 11 Jorda,Jorda Costa Luiz T,P,402832
11,Eltinho,Elton Divino Celio,T P,171945 14 Pedro,Pedro Henrique Vieir... T,P,401976
12,Fabricio,Fabricio Rapchan dos ...,R P,188102 6 Paulo Clau ...,Paulo Claudino Teodo... R,P,329762
13,Leandro,Leandro Bernardi Silva,R P,149749 12 Yan,Yan Rodrigues da Silva R,P,330812
14,Neto,Wellington de Farias ...,R P,304405 13 Raphael,Raphael Costa Cavalcanti R,P,184988
15,Jose,Jose Lucas Machado d ...,R P,388928 15 Gabriel,Gabriel Galhardo do ... R,P,321444
16,Marcos,Marcos Glaybson Mart ...,R P,184257 16 Michael,Michael Sillas de Al... R,P,373399
17,Carlos Jat ...,Carlos Eduardo Bacil ...,R P,300738 17 Abner,Abner de Souza Santos R,P,389422
18,Luis,Luis Fernando Guimar ...,R P,448689 18 Ygor,Ygor de Oliveira Fer... R,P,537477
19,Diego,Diego de Souza Quirino,R P,311813,,,
20,Jenison,Jenison de Jesus Bri ...,R P,305521,,,
"",,Comissão Técnica
"",J. Malucelli / PR,Madureira / RJ
Técnico:,Luciano Gusso Pinto - 39153081-PR,Técnico: Cleimar Carvalho Rocha - 4487264-6
Auxiliar Técnico:,Milton R. Harassen Do Ó - 44691728-PR,Auxiliar Técnico: Marcelo Braz Mariano - 6013162-0
Médico:,Vitor G. De Paiva Corotti - 30290,Médico: Andre Luiz Abrantes De Menezes - 52-67792-2
Preparador Físico:,Vanderlei Pereira De Carvalho - 00853/G-PR,Preparador Físico: Leandro Nascimento Dos Santos - 12989355-8
Massagista:,Elizaldo Vieira De Souza Jr - 56706640-PR,Massagista: Paulo Adriano Da Silva - 6252043-2
Preparador De GoleiroC:l audirlei Ribeiro Blam - 10695/G-PR,,Preparador De GoleiroA:l ex De Almeida Brandão - 9261734-9
"",,,,,Gols,
Tempo,1T/2T,No,Tipo,Nome do Jogador,,Equipe
07:00,1T,11,NR,Elton Divino Celio,,J. Malucelli/PR
30:00,2T,11,NR,Elton Divino Celio,,J. Malucelli/PR
"",,,,Substituições,
Tempo,1T/2T,,Equipe,Entrou,Saiu
12:00,2T,Madureira/RJ,,17 - Abner de Souza Santos,11 - Jorda Costa Luiz
27:00,2T,Madureira/RJ,,18 - Ygor de Oliveira Ferreira ...,10 - Luciano Francisco Paulino ...
28:00,2T,J. Malucelli/PR,,19 - Diego de Souza Quirino,7 - Getterson Alves dos Santo ...
37:00,2T,J. Malucelli/PR,,16 - Marcos Glaybson Martins S ...,10 - Robson Ferreira de Azeved ...
37:00,2T,Madureira/RJ,,15 - Gabriel Galhardo do Nasci ...,14 - Pedro Henrique Vieira Cos ...
39:00,2T,J. Malucelli/PR,,17 - Carlos Eduardo Bacila Jat ...,8 - Paulo Vitor Catreus de Fr ...
