"",,Arbitragem
Arbitro:,Emerson Luiz Sobral (CBF-1 / PE),
Arbitro Assistente 1:,Gilberto Freire de Farias (CBF-3 / PE),
Arbitro Assistente 2:,Marlon Rafael Gomes de Oliveira (CBF-2 / PE),
Quarto Arbitro:,Joedson de Jesus Oliveira (CBF-3 / BA),
Assessor:,Carlos Alberto Souza Vila Nova (000 / BA),
Delegado Local:,ROBERTO ALMEIDA DE ARAUJO (000 / ),
"",,,Cronologia,,,
"",1o Tempo,,2o Tempo,,,
Entrada do mandante:,15:50Atraso:,,Não Houve Entrada do mandante: 17:00,Atraso:,,Não Houve
Entrada do visitante:,15:50Atraso:,,Não Houve Entrada do visitante: 17:00,Atraso:,,Não Houve
Início 1o Tempo:,16:00 Atraso:,,Não Houve Início do 2o Tempo: 17:02,Atraso:,,Não Houve
Término do 1o Tempo:,16:47 Acréscimo:,,2 min Término do 2o Tempo: 17:51,Acréscimo:,,4 min
Resultado do 1o Tempo: 2 X 0,,,Resultado Final: 2 X 1,,,
"",,,,Relação de Jogadores,,,
"",,Juazeirense / BA,,,São Raimundo / PA,,
No,Apelido,Nome Completo,T/R P/A,CBF No Apelido,Nome Completo T/R P/A,,CBF
1,Tigrao,Vanderson Luiz Rodri ...,T P,168000 1 Evandro,Evandro Cardoso de Sousa T,P,166923
3,Alessandro,Alessandro Lopes Pereira,T P,163773 2 Marcos Vin ...,Marcos Vinicius Barb... T,P,158960
4,Jeferson,Jefferson Freitas Lobo,T P,309072 3 Wanderlan,Wanderlan Wallacy Da... T,P,291329
5,Capone,Leandro Xavier da Silva,T P,176420 5 Kiko,Alessandro Augusto P... T,P,165953
6,Marcos,Marcos Andre da Silv ...,T P,371021 6 Luis Henri ...,Luis Henrique Silva ... T,P,453741
7,Diego,Diego Sousa Teles,T P,177785 7 Amaral,Kleber de Jesus Quar... T,P,369681
8,Everlan,Everlan da Silva Fer ...,T P,291776 8 Wendel,Wendell Guimarães de... T,P,458878
10,Toniel,Toniel de Araujo Mota,T P,399252 9 Toniel,Toniel Correia Dias T,P,180903
11,Liardo,Jiliardo Alves dos S ...,T P,311270 14 Joãozinho,Igor João Alves T,P,321457
18,Diego,Diego Alves Vieira,T P,371355 19 Bilau,Everson da Silva Santana T,P,291387
21,Genilson,Jose Genilson de Mel ...,T P,342077 20 Tony,Martony Carlos Ferre... T,P,174546
2,Geamerson,Geamerson Waslley Hi ...,R P,404241 10 Geciano,Geciano Rosa Xavier R,P,300680
9,Jean,Jean Carlos de Almei ...,R P,371028 11 Tiago,Tiago de Araújo da Silva R,P,519630
12,Tiago,Tiago Teixeira,R P,291960 12 Jardel,Jardel Henrique Fagu... R,P,538657
13,Lucas,Lucas Santos Cardoso,R P,355755 13 Matheus,Matheus Ricardo Oliv... R,P,422782
14,Caique,Caique Fernando Barr ...,R P,377967 15 Dudu,Eduardo Henrique Sou... R,P,172851
15,Patrick Ka ...,Patrick Kaway Dias P ...,R P,430836 17 Jayme,Jayme Juan Alves da ... R,P,369409
16,Berg,Lindhberg de Sa Carvalho,R P,302364 18 Jair Gomes ...,Jair Gomes Tolentino R,P,516524
17,Clodoaldo,Francisco Clodoaldo  ...,R P,129936,,,
19,Francisco,Francisco Itamar de  ...,R P,546551,,,
20,Jose Freire,Jose Freire de Carva ...,R P,518003,,,
22,Vaguinho,Wagner Henrique dos  ...,R P,166860,,,
24,Diego,Diego da Silva Amaro,R P,376298,,,
"",,Comissão Técnica
"",Juazeirense / BA,São Raimundo / PA
Técnico:,Quintino Barbosa De Novaes Neto - 3306810,Técnico: Everton Antunes Benevides - 1359176
Auxiliar Técnico:,Michel Pinheiro Santos - 801682800,Auxiliar Técnico: Sergio Lobato Dantas - 1831787
Médico:,Francisco Marcos Marçal - 7248 - BA,Médico: Alberto Mariano Gusmão Tolentino - 6196
Preparador Físico:,Railson Sobral Da Silva - 002855,Preparador Físico: Estelenilson Salinos De Sousa - 004381
Massagista:,Jose Milton Silva De Sousa - 0399346597,Massagista: Manuel Miramar Brito Pedroso - 5669675
Preparador De GoleiroX:x xxxxxxxx - xxxxxxxxxx,,Preparador De GoleiroX:x xxxxxxxx - XXXXXXXXXX
"",,,,,Gols,
Tempo,1T/2T,No,Tipo,Nome do Jogador,,Equipe
24:00,1T,10,NR,Toniel de Araujo Mota,,Juazeirense/BA
37:00,1T,6,NR,Marcos Andre da Silva Figueiredo,,Juazeirense/BA
09:00,2T,8,NR,Wendell Guimarães de Oliveira,,São Raimundo/PA
"",,,Substituições,
Tempo,1T/2T,Equipe,Entrou,Saiu
45:00,INT,São Raimundo/PA,11 - Tiago de Araújo da Silva,5 - Alessandro Augusto Paixao ...
18:00,2T,Juazeirense/BA,16 - Lindhberg de Sa Carvalho,8 - Everlan da Silva Ferreira ...
18:00,2T,Juazeirense/BA,17 - Francisco Clodoaldo Chaga ...,18 - Diego Alves Vieira
26:00,2T,Juazeirense/BA,15 - Patrick Kaway Dias Pereir ...,21 - Jose Genilson de Melo Sil ...
