Campeonato:,Campeonato Brasileiro - Série B/2019,,Rodada:,26
Jogo:,America Fc / MG X Crb / AL,,,
Data:,03/10/2019 Horário: 19:15 Estádio:,Raimundo Sampaio / Belo Horizonte,,
"",Arbitragem
Arbitro:,Alexandre Vargas Tavares de Jesus (AB / RJ)
Arbitro Assistente 1:,Gabriel Conti Viana (AB / RJ)
Arbitro Assistente 2:,Thiago Gomes Magalhães (CD / RJ)
Quarto Arbitro:,Marco Aurelio Augusto Fazekas Ferreira (AB / MG)
Delegado Local:,Daniel Mendes de Las Casas (CBF / )
Analista de Campo:,Joel Tolentino da Mata Junior (CBF / MG)
"",,,Cronologia,,,
"",1o Tempo,,2o Tempo,,,
Entrada do mandante:,19:05Atraso:,,Não Houve Entrada do mandante: 20:16,,Atraso:,Não Houve
Entrada do visitante:,19:05Atraso:,,Não Houve Entrada do visitante: 20:15,,Atraso:,Não Houve
Início 1o Tempo:,19:15Atraso:,,Não Houve Início do 2o Tempo: 20:18,,Atraso:,Não Houve
Término do 1o Tempo:,20:03Acréscimo:,,3 min Término do 2o Tempo: 21:07,Acréscimo:,,4 min
Resultado do 1o Tempo: 1 X 0,,,Resultado Final: 1 X 0,,,
"",,,,,Relação de Jogadores,,,,
"",,America Fc / MG,,,,Crb / AL,,,
No,Apelido,Nome Completo T/R,,P/A,CBF No Apelido,Nome Completo T/R,,P/A,CBF
12,Airton,Airton Moraes Michellon T(g),,P,332840 1 Vinicius,Vinicius Silvestre d ... T(g),,P,308661
2,Leandro Silva,Leandro da Silva T,,P,178723 2 Daniel Borges,Daniel Fortunato Borges T,,P,322852
3,Lucas,Lucas Kal Schenfeld  ... T,,P,337242 3 Edson,Edson Henrique da Silva T,,P,175314
6,Joao Paulo,Joao Paulo Gomes da CostaT,,P,155855 4 Wellington,Wellington Carvalho  ... T,,P,307674
8,Juninho,Adilson dos Anjos Ol ... T,,P,337261 5 Claudinei,Claudinei Junio de Souza T,,P,306822
10,Matheusinho,Matheus Leonardo Sal ... T,,P,398805 6 Igor,Igor Aquino da Silva T,,P,421778
29,Diego,Diego Ferreira Matheus T,,P,318082 7 Ferrugem,Weverton Almeida San ... T,,P,181437
33,Junior Vicosa,Luiz Severo Junior T,,P,293172 8 Lucas,Dirceu Lucas de Abre ... T,,P,293720
35,Flavio,Luiz Flavio Silverio ... T,,P,533422 9 Leonardo,Leonardo de Sousa Pereira T,,P,367343
45,Ricardo Silva,Ricardo Cesar Dantas ... T,,P,327667 11 Alisson Fa ...,Alisson Alves Farias T,,P,345876
88,Willian,Willian Marlon Ferre ... T,,P,421180 77 Elton Arabia,Elton Jose Xavier Gomes T,,P,150392
27,Thiaguinho,Thiago Rodrigues da Silva R(g),,P,307774 12 Fernando,Fernando Henrique do ... R(g),,P,156439
5,Ze Ricardo,Jose Ricardo Barbosa ... R,,P,358808 13 Israel Nev ...,Israel Neves de Souza R,,P,453326
7,Marcelo Mi ...,Marcelo Aparecido Toscano R,,P,169747 14 Ewerton,Ewerton Ribeiro Pascoa R,,P,182550
11,Felipe Aze ...,Felipe Azevedo dos Santos R,,P,175557 15 Bryan,Bryan Silva Garcia R,,P,319512
14,Franca,Carlos Henrique Fran ... R,,P,388070 16 Wesley,Wesley Dias Claudino R,,P,322930
16,Savio,Savio Antonio Alves R,,P,376801 17 Lucas Siqu ...,Lucas Santos Siqueira R,,P,188170
18,Luisão,Luis Henrique Lima F ... R,,P,511508 18 Willians,Willians dos Santos  ... R,,P,176738
20,Boselli,Juan Manuel Boselli Graf R,,P,676659 19 Hugo,Hugo Sanches Nogueir ... R,,P,324490
21,Vitor Alberto,Vitor Alberto Alves  ... R,,P,517639 20 Iago,Iago Antonio Silva Santos R,,P,316561
23,Morelli,Everton Morelli Casimiro R,,P,433565 21 Edson Carius,Jose Edson Barros da ... R,,P,298941
95,Ademir,Ademir da Silva Sant ... R,,P,438212,,,,
98,Geovane,Geovane Nascimento Silva R,,P,393447,,,,
"",,Comissão Técnica,
"",America Fc / MG,,Crb / AL
Técnico:,Felipe De Oliveira Conceicao,Técnico:,Marcelo Augusto Oliveira Chamusca
Auxiliar Técnico:,Cauan Felipe De Almeida,Auxiliar Técnico:,Ademir Ferreira Dos Santos
Médico:,Cimar Eustaquio Marques Da Silva,Médico:,Luiz Henrique Goncalves Godinho
Treinador De Goleiros:,Silvio Siqueira Jardim,Treinador De Goleiros:,Luciano Dias Fragoso
Preparador Físico:,Gerson Oliveira Rocha,Preparador Físico:,Roger Gouveia E Silva
Massagista:,Silvio Junio Nunes Da Silva,Massagista:,Bruno Tadeu De Souza Almeida
"",,,,,Gols,
Tempo,1T/2T,No,Tipo,Nome do Jogador,,Equipe
19:00,1T,45,NR,Ricardo Cesar Dantas da Silva,,America Fc/MG
"",,,,Cartões Amarelos
Tempo,1T/2T,No,Nome do Jogador,Equipe
15:00,2T,3,Edson Henrique da Silva,Crb/AL
"",,,Motivo: A1.2.  Dar ou tentar dar uma rasteira ou um calço em um adversário de maneira temerária na disputa da bola  - Calçar eu,
"",,,adversário de maneira temerária.,
"",,,,Substituições,
Tempo,1T/2T,,Equipe,Entrou,Saiu
45:00,INT,Crb/AL,,18 - Willians dos Santos Santana,7 - Weverton Almeida Santos Evar...
45:00,INT,America Fc/MG,,5 - Jose Ricardo Barbosa Ribeiro...,35 - Luiz Flavio Silverio Silva
11:00,2T,Crb/AL,,20 - Iago Antonio Silva Santos,8 - Dirceu Lucas de Abreu Santos
25:00,2T,Crb/AL,,17 - Lucas Santos Siqueira,77 - Elton Jose Xavier Gomes
32:00,2T,America Fc/MG,,11 - Felipe Azevedo dos Santos,29 - Diego Ferreira Matheus
39:00,2T,America Fc/MG,,98 - Geovane Nascimento Silva,10 - Matheus Leonardo Sales Cardoso
