Campeonato:,Campeonato Brasileiro - Série B/2019,,Rodada:,3
Jogo:,Coritiba / PR X Londrina / PR,,,
Data:,09/05/2019 Horário: 21:30 Estádio:,Major Antônio Couto Pereira / Curitiba,,
"",,Arbitragem
Arbitro:,Thiago Duarte Peixoto (AB / SP),
Arbitro Assistente 1:,Herman Brumel Vani (AB / SP),
Arbitro Assistente 2:,Evandro de Melo Lima (AB / SP),
Quarto Arbitro:,Luiz Alexandre Fernandes (CD / PR),
Analista de Campo:,Anderson Carlos Gonçalves (CBF / PR),
"",,,Cronologia,,,
"",1o Tempo,,2o Tempo,,,
Entrada do mandante:,21:20Atraso:,,Não Houve Entrada do mandante: 22:30,,Atraso:,Não Houve
Entrada do visitante:,21:20Atraso:,,Não Houve Entrada do visitante: 22:30,,Atraso:,Não Houve
Início 1o Tempo:,21:30Atraso:,,Não Houve Início do 2o Tempo: 22:32,,Atraso:,Não Houve
Término do 1o Tempo:,22:17Acréscimo:,,2 min Término do 2o Tempo: 23:21,Acréscimo:,,4 min
Resultado do 1o Tempo: 0 X 0,,,Resultado Final: 0 X 0,,,
"",,,,,Relação de Jogadores,,,,
"",,Coritiba / PR,,,,Londrina / PR,,,
No,Apelido,Nome Completo T/R,,P/A,CBF No Apelido,Nome Completo T/R,,P/A,CBF
1,Wilson,Wilson Rodrigues de  ... T(g),,P,155508 1 Matheus Al ...,Matheus Albino Carneiro T(g),,P,310382
3,Alan Costa,Alan Henrique Costa T,,P,188990 2 Rai,Rai dos Reis Ramos T,,P,331532
4,Romercio,Romercio Pereira da  ... T,,P,425933 3 Augusto,Augusto de Souza Silva T,,P,339225
5,Carvalho,Vitor Carvalho Vieira T,,P,392746 4 Silvio,Silvio Henderson San ... T,,P,171894
9,Rodrigao,Rodrigo Gomes dos Santos T,,P,398368 5 Romulo,Romulo da Silva Machado T,,P,379397
10,Giovanni,Giovanni Piccolomo T,,P,318493 6 Felipe,Felipe Vieira Augusto T,,P,533292
15,Patrick Brey,Patrick de Carvalho Brey T,,P,395968 7 Anderson,Anderson de Oliveira ... T,,P,521065
18,Welinton,Welinton Junior Ferr ... T,,P,321011 8 Germano,Germano Borovicz Car ... T,,P,155026
20,Fabiano,Fabiano da Silva Souza T,,P,304325 9 Alisson,Alisson Pelegrini Safira T,,P,351040
22,Diogo,Diogo Mateus de Alme ... T,,P,315945 10 Higor Leite,Higor Rodrigues Barb ... T,,P,296566
28,Luiz Schlo ...,Luiz Henrique August ... T,,P,317037 11 Marcelo,Marcelo Antonio de O ... T,,P,508210
23,Alex Muralha,Alex Roberto Santana ... R(g),,P,177010 12 Emerson,Emerson Jose da ConceicaRo(g),,P,145650
2,Savio,Savio Alves Marchiote R,,P,359819 13 Marcondes,Marcondes de Jesus S ... R,,P,311339
6,W. Matheus,William Matheus da Silva R,,P,291317 14 Helder,Helder Maurilio da S ... R,,P,179928
7,Joao Vitor,Joao Vitor Lima Gomes R,,P,164019 15 Bertotto,Matheus Hanauer Bertotto R,,P,346588
19,Igor Jesus,Igor Jesus Maciel da Cruz R,,P,526627 16 Bruno Paul ...,Bruno Jacinto da Silva R,,P,323843
21,W. Maia,Walisson Moreira Far ... R,,P,298361 17 Paulo,Paulo Roberto Moccelin R,,P,360467
29,Juan Alano,Juan Matheus Alano N ... R,,P,374077 18 Diego,Diego Goncalves R,,P,376405
36,Matheus Sales,Matheus de Sales Cabral R,,P,338849 19 Uelber,Uelber Silva Gomes Filho R,,P,520072
37,Lucas Toca ...,Lucas Costa da Silva R,,P,430405 20 Arthur,Arthur Alves Neves R,,P,309861
38,Arancibia,Francisco Andres Ara ... R,,P,526538,,,,
43,Rafael Lima,Rafael Ramos de Lima R,,P,160686,,,,
"",,Comissão Técnica,
"",Coritiba / PR,,Londrina / PR
Técnico:,Umberto Lourenco Louzer Filho,Técnico:,Cidimar Aparecido Ernegas
Auxiliar Técnico:,Alessandro Telles De Silva,Auxiliar Técnico:,Rodrigo Tadeu Pozzi Rodrigues
Médico:,Milton Massahide Nagai,Médico:,Jean Alexandre Furtado Correa Francisco
Treinador De Goleiros:,Thiago Costa Mehl,Treinador De Goleiros:,Edson Luiz Da Silva
Preparador Físico:,Juvenilson Poyer Nogueira Souza,Preparador Físico:,Joao Carlos Martins Ruiz
Massagista:,Marcelo Clemines De Araujo,Fisioterapeuta:,Joilson Amorim Ferreira
"",,,,Cartões Amarelos
Tempo,1T/2T,No,Nome do Jogador,Equipe
16:00,2T,5,Vitor Carvalho Vieira,Coritiba/PR
"",,,Motivo: A1.3.  Cometer uma falta tática para impedir um ataque promissor - ...................................,
"",,,,Substituições,
Tempo,1T/2T,,Equipe,Entrou,Saiu
39:00,1T,Londrina/PR,,19 - Uelber Silva Gomes Filho,9 - Alisson Pelegrini Safira
18:00,2T,Londrina/PR,,17 - Paulo Roberto Moccelin,11 - Marcelo Antonio de Oliveira
29:00,2T,Coritiba/PR,,38 - Francisco Andres Arancibia S...,18 - Welinton Junior Ferreira dos...
31:00,2T,Coritiba/PR,,37 - Lucas Costa da Silva,20 - Fabiano da Silva Souza
40:00,2T,Londrina/PR,,13 - Marcondes de Jesus Santos Ju...,4 - Silvio Henderson Santos de F...
44:00,2T,Coritiba/PR,,29 - Juan Matheus Alano Nascimento,28 - Luiz Henrique Augustin Schlo...
