"",Arbitragem
Arbitro:,Marcelo Aparecido R de Souza (CBF-1 / SP)
Arbitro Assistente 1:,Bruno Salgado Rizo (CBF-1 / SP)
Arbitro Assistente 2:,Jesmar Benedito Miranda de Paula (CBF-1 / GO)
Quarto Arbitro:,Gleysto Gonçalves da Silva (CBF-2 / CE)
Delegado:,Milton Otaviano dos Santos (  / )
"",,,Cronologia,,,
"",1o Tempo,,2o Tempo,,,
Entrada do mandante:,21:42Atraso:,,Não Houve Entrada do mandante: 22:49,Atraso:,,Não Houve
Entrada do visitante:,21:45Atraso:,,Não Houve Entrada do visitante: 22:48,Atraso:,,Não Houve
Início 1o Tempo:,21:50 Atraso:,,Não Houve Início do 2o Tempo: 22:51,Atraso:,,Não Houve
Término do 1o Tempo:,22:36 Acréscimo:,,1 min Término do 2o Tempo: 23:41,Acréscimo:,,5 min
Resultado do 1o Tempo: 1 X 0,,,Resultado Final: 2 X 1,,,
"",,,,Relação de Jogadores,,,
"",,Ceará /,,,Avaí /,,
No,Apelido,Nome Completo,T/R P/A,CBF No Apelido,Nome Completo T/R P/A,,CBF
1,Fernando,Fernando Henrique do ...,T P,156439 1 Diego,Diego Salgado Costa ... T,P,145958
2,Marcos,Marcos Martins dos Anjos,T P,184247 2 Juliano,Juliano Andre Pereir... T,P,304266
3,Gustavo,Gustavo Silva Conceicao,T P,175138 3 Alex,Alex Tenorio Rodrigu... T,P,184224
4,Diego Ivo,Diego Ivo Pires,T P,295845 4 Bruno,Bruno Goncalves Maia... T,P,183732
5,Joao Marcos,Joao Marcos Alves Fe ...,T P,155201 5 Eduardo Co ...,Eduardo Nascimento Costa T,P,137798
6,Wellington,Wellington da Silva  ...,T P,151689 6 Aelson,Aelson Rodrigues Nas... T,P,172712
7,Lulinha,Luiz Marcelo Morais  ...,T P,175721 7 Marcio Diogo,Marcio Diogo Lobato ... T,P,161597
8,Ricardinho,Ricardo Dias Acosta,T P,169114 8 Rodrigo,Rodrigo Thiesen T,P,175676
9,Mota,Joao Soares da Mota Neto,T P,135893 10 Marcos,Marcos Vicente dos S... T,P,156079
10,Rogerinho,Rogerio Miranda Silva,T P,158760 11 Luciano,Luciano da Rocha Neves T,P,346745
11,Magno,Magno Alves de Araujo,T P,120743 88 Cleber San ...,Cleber Santana Loureiro T,P,140653
12,Jailson,Jailson Marcelino do ...,R P,153229 13 Leandro,Leandro Bernardi Silva R,P,149749
13,Helder,Helder Maurilio da S ...,R P,179928 14 Ricardo,Ricardo Ribeiro de Lima R,P,179100
14,Douglas,Douglas Augusto Mend ...,R P,183227 15 Paulo Clau ...,Paulo Claudino Teodo... R,P,329762
15,Diogo,Diogo Orlando de Oli ...,R P,156137 16 Ale,Alexandre Luiz Fernandes R,P,159223
16,Thiago,Thiago Humberto Gomes,R P,159768 17 Diego,Diego Jardel Koester R,P,296863
17,Dinelson,Dinelson dos Santos Lima,R P,161636 18 Taua,Taua Ferreira dos Santos R,P,353985
18,Leonardo,Leonardo Gamalho de  ...,R P,168982 19 Roberson,Roberson de Arruda Alves R,P,179880
19,Rafinha,Rafael Gomes de Oliveira,R P,291619 20 Beto,Alberto Antonio de Paula R,P,168343
20,Roberio,Roberio do Nasciment ...,R P,403083 22 Vitor,Vitor Prada Macaneiro R,P,334087
21,Clennyson,Clennyson Silva do N ...,R P,162398,,,
22,Anderson,Anderson Marques de  ...,R P,154089,,,
23,Eusebio,Jose Jefferson Rodri ...,R P,172013,,,
"",,Comissão Técnica,
"",Ceará /,,Avaí /
Tecnico:,Sérgio Soares Da Silva - 16407560,Tecnico:,Hermeson José Maria - 005042
Auxiliar Tecnico:,Denys Luctke Facincani - 1066443678,Auxiliar Tecnico:,Emerson Pereira Nunes - 6070589
Medico:,Henrique José Bastos Pinheiro - 5821,Medico:,Pedro De Almeida Araujo - 2642
Preparador Fisico:,Réverson Bastos Pimentel - 034749,Preparador Fisico:,Alexandre Rodrigues De Souza - 010000
Massagista:,Anacleto Pires De Sousa - 510181,Massagista:,Delmar Da Rosa Pereira - 2501208
"",,,,Substituições,
Tempo,1T/2T,,Equipe,Entrou,Saiu
16:00,2T,Avaí/SC,,20 - Alberto Antonio de Paula,8 - Rodrigo Thiesen
27:00,2T,Avaí/SC,,18 - Taua Ferreira dos Santos,11 - Luciano da Rocha Neves
27:00,2T,Avaí/SC,,14 - Ricardo Ribeiro de Lima,10 - Marcos Vicente dos Santos ...
27:00,2T,Ceará/CE,,16 - Thiago Humberto Gomes,10 - Rogerio Miranda Silva
27:00,2T,Ceará/CE,,15 - Diogo Orlando de Oliveira ...,8 - Ricardo Dias Acosta
31:00,2T,Ceará/CE,,18 - Leonardo Gamalho de Souza ...,9 - Joao Soares da Mota Neto
"",,,,,Gols,
Tempo,1T/2T,No,Tipo,Nome do Jogador,,Equipe
10:00,1T,9,NR,Joao Soares da Mota Neto,,Ceará/CE
03:00,2T,11,NR,Magno Alves de Araujo,,Ceará/CE
31:00,2T,20,NR,Alberto Antonio de Paula,,Avaí/SC
"",,,,Cartões Amarelos,
Tempo,1T/2T,No,Nome do Jogador,,Equipe
35:00,1T,3,Alex Tenorio Rodrigues de Lima,,Avaí/SC
"",,,Motivo: Por dar um tranco no adversário,,
02:00,2T,2,Juliano Andre Pereira da Silva,,Avaí/SC
"",,,Motivo: Por calçar o adversário,,
05:00,2T,8,Ricardo Dias Acosta,,Ceará/CE
"",,,Motivo: Por impedir um ataque promissor.,,
40:00,2T,15,Diogo Orlando de Oliveira,,Ceará/CE
"",,,Motivo: Por calçar o adversário,,
44:00,2T,16,Alexandre Luiz Fernandes,,Avaí/SC
"",,,Motivo: Por reclamação à arbitragem,,
45:00,2T,1,Fernando Henrique dos Anjos,,Ceará/CE
"",,,Motivo: Por retardar o reinício de jogo,,
"",,,,Cartões Vermelhos,
Tempo,1T/2T,No,Nome do Jogador,,
+3:00,2T,1,Fernando Henrique dos Anjos - Ceará/CE,,
