"",Arbitragem
Arbitro:,Caio Max Augusto Vieira (CBF-1 / RN)
Arbitro Assistente 1:,Lorival Candido das Flores (CBF-2 / RN)
Arbitro Assistente 2:,Lucas Costa Modesto (CBF-2 / DF)
Quarto Arbitro:,Osimar Moreira da Silva Junior (CBF-2 / GO)
Assessor:,Cleiber Elias Leite (ASS / GO)
Delegado Local:,Adalberto Grecco (000 / )
"",,,Cronologia,,,
"",1o Tempo,,2o Tempo,,,
Entrada do mandante:,19:05Atraso:,,Não Houve Entrada do mandante: 20:15,Atraso:,,Não Houve
Entrada do visitante:,19:05Atraso:,,Não Houve Entrada do visitante: 20:15,Atraso:,,Não Houve
Início 1o Tempo:,19:15 Atraso:,,Não Houve Início do 2o Tempo: 20:17,Atraso:,,Não Houve
Término do 1o Tempo:,20:02 Acréscimo:,,2 min Término do 2o Tempo: 21:06,Acréscimo:,,4 min
Resultado do 1o Tempo: 0 X 0,,,Resultado Final: 1 X 0,,,
"",,,,Relação de Jogadores,,,
"",,Atlético / GO,,,Brasil / RS,,
No,Apelido,Nome Completo T/R P/A,,CBF No Apelido,Nome Completo T/R P/A,,CBF
1,Klever,Klever Rodrigo Gomes ...,T P,178962 1 Eduardo,Eduardo Martini T,P,133435
2,Matheus,Matheus Antunes Ribeiro,T P,324513 2 Wender,Wender Almeida Silva T,P,142654
3,Marllon,Marllon Goncalves Je ...,T P,299840 3 Cirilo,Jeferson Cirilo Mesq... T,P,140044
4,Lino,Leandro Lino de Freitas,T P,163660 4 Leandro Ca ...,Leandro Camilo de Al... T,P,172296
5,Michel,Michel Ferreira dos  ...,T P,298485 5 Leandro,Leandro Leite Mateus T,P,146430
6,Romario,Romario Guilherme do ...,T P,305959 6 Marlon,Marlon Farias Castel... T,P,183840
7,Magno,Magno Damasceno Sant ...,T P,176899 7 Felipe,Felipe Garcia Goncalves T,P,311487
8,Pedrinho,Pedro Gonzaga,T P,298432 8 Cezar,Cezar Washington Alv... T,P,179012
9,Vicosa,Luiz Severo Junior,T P,293172 9 Ramon,Ramon Machado de MacedoT,P,295017
10,Luiz Ferna ...,Luiz Fernando Moraes ...,T P,451607 10 Diogo,Diogo Ribeiro de Oli... T,P,160174
11,Gilson,Gilson do Amaral,T P,165040 11 Parana,Marcos dos Santos Ca... T,P,164863
12,Marcos,Marcos de Paula Dutra,R P,331869 12 Luiz Carlos,Luiz Carlos Muller R,P,143759
13,Thales,Thales Natanael Lira ...,R P,341715 13 Eduardo,Eduardo Schroeder Brock R,P,291997
14,Anderson,Anderson Mauro Vitor ...,R P,346440 14 Wender,Wender Coelho da Silva R,P,160238
15,Willian Sc ...,Willian Schuster Dor ...,R P,170488 15 Ronilson,Ronilson Donizetti G... R,P,171958
16,Eduardo,Eduardo Felipe Lacer ...,R P,404648 16 Everton,Everton Cordova Correa R,P,291966
17,Caique,Caique Silva Rocha,R P,170547 17 Nathan,Nathan Athaydes Camp... R,P,296334
18,Herlison,Herlison Caion de So ...,R P,292500 18 Marcos,Marcos Antonio Almei... R,P,345210
19,Alison,Alison Henrique Mira,R P,375562 19 Nena,Ygor da Silva R,P,158841
20,Ayrton,Ayrton de Melo Carneiro,R P,406454 20 Welder,Welder da Silva Marcal R,P,293010
"",,Comissão Técnica
"",Atlético / GO,Brasil / RS
Técnico:,Marcelo Ribeiro Cabo - CREF-023847 RJ,Técnico: Rogério Garcia Zimermann - 8027081581-RS
Auxiliar Técnico:,Rodolfo Andrade De Oliveira - 084484922-RJ,Auxiliar Técnico: José Ney Dutra Martins - 9024711633-RS
Médico:,Avimar Teodoro Oliveira Junior - 12245,Médico: Gustavo Dantas Lahm - 37717
Preparador Físico:,Jorge Alberto Pinto Soter - 5113- RJ,Preparador Físico: João Francisco Beschorner - 3889-RS
Massagista:,Robson Porto Do Nascimento - 2124274-GO,Massagista: Paulo Sérgio Gonçalves Teixeira - 24116665-2
Preparador De GoleiroM:a rcos Roberto Medeiros - 3351-GO,,Preparador De GoleiroA:l ex Lessa Afonso - 6066791374-RS
"",,,,,Gols,
Tempo,1T/2T,No,Tipo,Nome do Jogador,,Equipe
38:00,2T,19,NR,Alison Henrique Mira,,Atlético/GO
"",,,,Substituições,
Tempo,1T/2T,,Equipe,Entrou,Saiu
17:00,2T,Atlético/GO,,18 - Herlison Caion de Sousa F ...,7 - Magno Damasceno Santos da ...
18:00,2T,Brasil/RS,,18 - Marcos Antonio Almeida Si ...,7 - Felipe Garcia Goncalves
25:00,2T,Atlético/GO,,19 - Alison Henrique Mira,11 - Gilson do Amaral
27:00,2T,Brasil/RS,,17 - Nathan Athaydes Campos Fe ...,9 - Ramon Machado de Macedo
34:00,2T,Brasil/RS,,19 - Ygor da Silva,11 - Marcos dos Santos Camargo ...
35:00,2T,Atlético/GO,,17 - Caique Silva Rocha,2 - Matheus Antunes Ribeiro
