"",,Arbitragem
Arbitro:,Jailson Macedo Freitas (ESP / BA),
Arbitro Assistente 1:,Elicarlos Franco de Oliveira (ASP-FIFA / BA),
Arbitro Assistente 2:,Adailton Jose de Jesus Silva (CBF-2 / BA),
Quarto Arbitro:,Breno Veira Souza (CBF-2 / GO),
Assessor:,Vicente de Paula da Silva Moraes (ASS / GO),
Delegado Local:,Adalberto Grecco (000 / ),
"",,,Cronologia,,,
"",1o Tempo,,2o Tempo,,,
Entrada do mandante:,15:50Atraso:,,Não Houve Entrada do mandante: 16:59,Atraso:,,Não Houve
Entrada do visitante:,15:50Atraso:,,Não Houve Entrada do visitante: 16:59,Atraso:,,Não Houve
Início 1o Tempo:,16:00 Atraso:,,Não Houve Início do 2o Tempo: 17:01,Atraso:,,Não Houve
Término do 1o Tempo:,16:46 Acréscimo:,,1 min Término do 2o Tempo: 17:50,Acréscimo:,,4 min
Resultado do 1o Tempo: 0 X 0,,,Resultado Final: 1 X 2,,,
"",,,,Relação de Jogadores,,,
"",,Atlético / GO,,,Crb / AL,,
No,Apelido,Nome Completo T/R P/A,,CBF No Apelido,Nome Completo T/R P/A,,CBF
1,Marcos,Marcos de Paula Dutra,T P,331869 1 Juliano,Juliano Aparecido do... T,P,184393
2,Matheus,Matheus Antunes Ribeiro,T P,324513 2 Jonathan,Jonathan Ferreira da... T,P,343392
3,Marllon,Marllon Goncalves Je ...,T P,299840 3 Flavio Boa ...,Flavio de Souza Boav... T,P,180253
4,Ricardo,Ricardo Cesar Dantas ...,T P,327667 4 Adalberto,Adalberto Hilario Fe... T,P,165391
5,Michel,Michel Ferreira dos  ...,T P,298485 5 Olivio,Olivio Aparecido Costa T,P,178674
6,Romario,Romario Guilherme do ...,T P,305959 6 Diego,Diego Pereira Correa T,P,161603
7,Magno,Magno Damasceno Sant ...,T P,176899 7 Luidy,Luidy Viegas T,P,409509
8,Pedrinho,Pedro Gonzaga,T P,298432 8 Matheus,Matheus Galdezani T,P,303542
9,Vicosa,Luiz Severo Junior,T P,293172 9 Lucio,Lucielmo Palhano Soares T,P,325678
10,Jorge,Jorge de Moura Xavier,T P,330015 10 Dakson,Dakson Soares da Silva T,P,175011
11,Gilson,Gilson do Amaral,T P,165040 11 Bruno,Bruno Nascimento Barbosa T,P,412900
12,Klever,Klever Rodrigo Gomes ...,R P,178962 12 Julio Cesar,Julio Cesar Martins R,P,132047
13,Ednei,Ednei Ferreira de Ol ...,R P,171685 13 Marcos,Marcos Martins dos Anjos R,P,184247
14,Thales,Thales Natanael Lira ...,R P,341715 14 Audálio,Jose Audalio Silva S... R,P,172203
15,Adniellyson,Adniellyson da Silva ...,R P,340240 15 Eder,Eder Marcelo Prudencio R,P,138485
16,Bruno,Bruno Sergio Jaime,R P,184226 16 Paulinho,Paulo Rogerio Reis Silva R,P,159393
17,Willian Sc ...,Willian Schuster Dor ...,R P,170488 17 Welinton,Welinton Junior Ferr... R,P,321011
18,Caique,Caique Silva Rocha,R P,170547 18 Elton,Elton Santiago dos S... R,P,165990
19,Luiz Ferna ...,Luiz Fernando Moraes ...,R P,451607 19 Rodolfo,Rodolfo Jose da Silv... R,P,423003
20,Kennedy An ...,Kennedy Anderson Nun ...,R P,464750,,,
21,Anildson,Anildson Luis da Sil ...,R P,371590,,,
22,Herlison,Herlison Caion de So ...,R P,292500,,,
"",,Comissão Técnica
"",Atlético / GO,Crb / AL
Técnico:,Marcelo Ribeiro Cabo - 023847,Técnico: Uiles Freitas Junior - 037092
Auxiliar Técnico:,Rodolfo Andrade De Oliveira - 084484922,Auxiliar Técnico: Joao Brigatti - 03777711
Médico:,Eduardo De Morais Duarte - 16327,Médico: Luis Carlos Tavares Juniior - 5606-AL
Preparador Físico:,Joao Paulo Imbernom Sanches - 9892,Preparador Físico: Adriano De Oliveira Gomes - 1148-AL
Massagista:,Robson Porto Do Nascimento - 2124274,Massagista: Francisco De Assis Rodrigues Miranda - 2002001196558AL
Preparador De GoleiroM:a rcos Roberto Medeiros - 3351,,Preparador De GoleiroL:u ciano Dias Fragoso - 1167765-AL
"",,,,,Gols,
Tempo,1T/2T,No,Tipo,Nome do Jogador,,Equipe
20:00,2T,5,NR,Michel Ferreira dos Santos,,Atlético/GO
27:00,2T,4,NR,Adalberto Hilario Ferreira Neto,,Crb/AL
42:00,2T,17,NR,Welinton Junior Ferreira dos Santos,,Crb/AL
"",,,,Substituições,
Tempo,1T/2T,,Equipe,Entrou,Saiu
15:00,2T,Atlético/GO,,18 - Caique Silva Rocha,10 - Jorge de Moura Xavier
15:00,2T,Crb/AL,,17 - Welinton Junior Ferreira  ...,11 - Bruno Nascimento Barbosa
26:00,2T,Atlético/GO,,17 - Willian Schuster Dornelle ...,11 - Gilson do Amaral
31:00,2T,Crb/AL,,15 - Eder Marcelo Prudencio,10 - Dakson Soares da Silva
32:00,2T,Atlético/GO,,21 - Anildson Luis da Silva So ...,7 - Magno Damasceno Santos da ...
38:00,2T,Crb/AL,,19 - Rodolfo Jose da Silva Bar ...,7 - Luidy Viegas
