"",Arbitragem
Arbitro:,Emerson de Almeida Ferreira (ASP-FIFA / MG)
Arbitro Assistente 1:,Wesley Moreira de Carvalho (CBF-2 / MG)
Arbitro Assistente 2:,Breno Rodrigues (CBF-2 / MG)
Quarto Arbitro:,Bruno Rezende Silva (CBF-1 / GO)
Assessor:,Urias Crescente Alves Junior (ASS / GO)
"",,,Cronologia,,,
"",1o Tempo,,2o Tempo,,,
Entrada do mandante:,20:20Atraso:,,Não Houve Entrada do mandante: 21:31,Atraso:,,Não Houve
Entrada do visitante:,20:20Atraso:,,Não Houve Entrada do visitante: 21:30,Atraso:,,Não Houve
Início 1o Tempo:,20:30 Atraso:,,Não Houve Início do 2o Tempo: 21:32,Atraso:,,Não Houve
Término do 1o Tempo:,21:17 Acréscimo:,,2 min Término do 2o Tempo: 22:21,Acréscimo:,,4 min
Resultado do 1o Tempo: 0 X 0,,,Resultado Final: 1 X 1,,,
"",,,,Relação de Jogadores,,,
"",,Goiás / GO,,,Londrina / PR,,
No,Apelido,Nome Completo,T/R P/A,CBF No Apelido,Nome Completo T/R P/A,,CBF
1,Renan,Renan Brito Soares,T P,155703 1 Marcelo,Marcelo Rangel Rosa T,P,186722
2,Sueliton,Sueliton Pereira de  ...,T P,171745 2 Igor,Igor Bosel Dias T,P,372585
3,David,David de Duarte Macedo,T P,348537 4 Silvio,Silvio Henderson San... T,P,171894
4,Anderson,Anderson Aparecido S ...,T P,178500 5 Diogo,Diogo Roberto Roque T,P,169115
5,David França,David Franca Oliveir ...,T P,150731 8 Germano,Germano Borovicz Car... T,P,155026
6,Jefferson,Jefferson Junio Anto ...,T P,400906 10 Jose,Jose Rafael Vivian T,P,330886
7,Cassiano,Cassiano Dias Moreira,T P,181681 16 Leo,Leonardo Pinheiro da... T,P,346294
8,Wendel,Wendel Geraldo Mauri ...,T P,140053 23 Rafael Gava,Rafael Gustavo Meneg... T,P,313001
9,Rafhael,Rafhael Lucas Olivei ...,T P,309723 25 Matheus,Matheus Borges Domingues T,P,301741
10,Jhon,Jhon Cley Jesus Silva,T P,323597 77 Jo,Jonathan Oliveira da... T,P,293622
11,Patrick,Patrick Bezerra do N ...,T P,315585 99 Keirrison,Keirrison de Souza C... T,P,171998
12,Ivan,Gilsivan Soares da Silva,R P,169226 7 Paulo,Paulo Roberto Moccelin R,P,360467
13,Wesley,Wesley Ladeira Matos,R P,306551 9 Bruno Batata,Bruno Fressato Cardoso R,P,162152
14,Johnathan,Johnathan Carlos Pereira,R P,346994 15 Elias,Elias Nascimento Felicio R,P,308624
15,Ramires,Ramires dos Anjos Alves,R P,186557 17 Leilson,Leilson Carlos de Ol... R,P,293515
16,Willian,Willian Osmar de Oli ...,R P,334881 20 Julio,Julio Guilherme Jero... R,P,357300
17,Thalles,Thalles Gabriel Mora ...,R P,428831 29 Jadi,Jardiel Sousa Pereira R,P,344899
18,Cleo,Cleverson Gabriel Co ...,R P,160606 33 Marcondes,Marcondes de Jesus S... R,P,311339
19,Wagner,Wagner Ricardo Silva ...,R P,344955 41 Alan,Alan Jose Bernardon R,P,326968
20,Murilo,Murilo Henrique Pere ...,R P,304816 45 Wellisson,Wellisson Almeida Nunes R,P,525810
"",Comissão Técnica
Goiás / GO,Londrina / PR
Preparador De GoleiroA:i lton Serafim Da Hora Filho - 3672627623,Técnico: Claudio Aparecido Tencati - 4240 G-PR
Técnico: Enderson Alves Moreira - 80911064672,Auxiliar Técnico: Alessio Da Costa Antunes - 8558 P-PR
Preparador Físico: Gerson Oliveira Rocha - 94138168672,Médico: Jean A. F. C. Francisco - 12026
Massagista: Jose Carlos Da Silva Buri - 41891767100,Preparador Físico: Joao Carlos Martins Ruiz - 945 G-SP
Fisioterapeuta: Leonardo Oliveira De Morais - 3011324611,Massagista: Marcelo Felipe B. Rockenbach - 117914-F
Auxiliar Técnico: Luis Fernando Rosa Flores - 39299490082,Preparador De GoleiroE:d son Luiz Da Silva - 9990 P-PR
Médico: Mauro Pereira Machado - 34822275191,
"",Gols
Tempo 1T/2T No Tipo Nome do Jogador,Equipe
10:00 2T 2 NR Igor Bosel Dias,Londrina/PR
33:00 2T 8 NR Wendel Geraldo Mauricio E Silva,Goiás/GO
"",,,,Substituições,
Tempo,1T/2T,,Equipe,Entrou,Saiu
45:00,INT,Goiás/GO,,18 - Cleverson Gabriel Cordova ...,9 - Rafhael Lucas Oliveira da ...
32:00,1T,Londrina/PR,,7 - Paulo Roberto Moccelin,77 - Jonathan Oliveira da Silv ...
15:00,2T,Goiás/GO,,17 - Thalles Gabriel Morais do ...,10 - Jhon Cley Jesus Silva
15:00,2T,Goiás/GO,,19 - Wagner Ricardo Silva da S ...,7 - Cassiano Dias Moreira
26:00,2T,Londrina/PR,,20 - Julio Guilherme Jeronimo  ...,10 - Jose Rafael Vivian
30:00,2T,Londrina/PR,,9 - Bruno Fressato Cardoso,99 - Keirrison de Souza Carnei ...
