"",Arbitragem
Arbitro:,Claudio Francisco Lima E Silva (ESP / SE)
Arbitro Assistente 1:,Ailton Farias da Silva (CBF-2 / SE)
Arbitro Assistente 2:,Daniel Vidal Pimentel (CBF-2 / SE)
Quarto Arbitro:,Paulo Roberto Alves Junior (CBF-1 / PR)
Assessor:,Afonso Vitor de Oliveira (000 / PR)
Delegado Local:,Arari Teixeira (000 / )
"",,,Cronologia,,,
"",1o Tempo,,2o Tempo,,,
Entrada do mandante:,16:10Atraso:,,Não Houve Entrada do mandante: 17:01,Atraso:,,Não Houve
Entrada do visitante:,16:10Atraso:,,Não Houve Entrada do visitante: 17:01,Atraso:,,Não Houve
Início 1o Tempo:,16:20 Atraso:,,Não Houve Início do 2o Tempo: 17:23,Atraso:,,Não Houve
Término do 1o Tempo:,17:08 Acréscimo:,,3 min Término do 2o Tempo: 18:12,Acréscimo:,,4 min
Resultado do 1o Tempo: 0 X 1,,,Resultado Final: 1 X 2,,,
"",,,,Relação de Jogadores,,,
"",,Paraná / PR,,,Náutico / PE,,
No,Apelido,Nome Completo,T/R P/A,CBF No Apelido,Nome Completo T/R P/A,,CBF
1,Marcao,Sebastiao Marcos Bar ...,T(g) P,126468 1 Julio Cesar,Julio Cesar de Souza... T(g),P,150963
2,Lucas,Lucas Taylor Maia Reis,T P,351207 2 Joazi,Joazi Oliviera da Silva T,P,392907
3,Leandro,Leandro Paulino da Silva,T P,175588 7 Roni,Ronielson da Silva B... T,P,427806
4,Leonardo M ...,Leonardo Jose Aparec ...,T P,165264 8 Rodrigo,Rodrigo de Souza Fonseca T,P,293529
5,Uchoa,Anderson Uchoa dos S ...,T P,183385 10 Marquinhos,Marcos Antonio Miran... T,P,161039
6,Henrique,Henrique Gelain Custodio,T P,343787 11 Bergson,Bergson Gustavo Silv... T,P,191433
7,Guilherme  ...,Guilherme de Queiroz ...,T P,336063 13 Joao,Joao Ananias Jordao ... T,P,337194
8,Lucas,Lucas Otavio Veiga Lopes,T P,316765 19 Gaston,Gaston Filgueira Mendez T,P,517393
9,Caranga,Luiz Fernando da Sil ...,T P,308608 29 Vinicius,Vinicius Goes Barbos... T,P,294769
10,Nadson,Nadson da Silva Almeida,T P,293188 33 Rafael,Rafael Pereira dos S... T,P,170563
11,Diego,Diego Barbosa Tavares,T P,331248 41 Adalberto,Adalberto dos Santos... T,P,184704
12,Wendel,Wendell Pericles Fer ...,R P,310072 6 Muller,Mateus Muller de Sou... R,P,373728
13,Alisson,Alisson Christhian Brand,R P,303987 9 Yuri Mamute,Yuri Souza Almeida R,P,349171
14,Pitty,Luiz Paulo Daniel Ba ...,R P,293201 12 Rodolpho,Rodolpho Henrique Al... R,P,142924
15,Wellington,Wellington Rodrigues ...,R P,325913 16 Igor,Igor Rabello da Costa R,P,307840
16,Murilo,Murilo Rangel Barbosa,R P,190032 20 Esquerdinha,Rubens Raimundo da Silva R,P,298531
17,Jhony,Jhony Douglas Santiago,R P,374851 23 Renan,Renan Henrique Olive... R,P,178684
18,Fernandes,Micerlanio Fernandes ...,R P,161974 69 Jefferson  ...,Jefferson Vasconcelo... R,P,417467
19,Lucio,Lucio Flavio da Silv ...,R P,166180 85 Samuel Rosa,Samuel Rosa Pereira R,P,173707
20,Henrique,Henrique Roberto Rafael,R P,331360 99 Tiago,Tiago Adan Fonseca R,P,176993
21,Nubio Flavio,Nubio Flavio Martins ...,R P,328098,,,
22,Ze Roberto,Jose Roberto Lucini,R P,136391,,,
"",,Comissão Técnica
"",Paraná / PR,Náutico / PE
Técnico:,Marcelo Martelotte - CREF 027068 SP,Técnico: Givanildo José De Oliveira - 931503 PE
Auxiliar Técnico:,Antonio Carlos Ribeiro Junior - CREF 37147 SP,Auxiliar Técnico: Levi Marcelino Gomes - 631987 PB
Médico:,Lucinio Leonidas Grebos - 9866 PR,Médico: Mucio B. Vaz De Almeida - 11161 PE
Preparador Físico:,Marcos Eduardo Walczak - 7091 PR,Preparador Físico: Wellington Jose Vero - 00768 PE
Massagista:,Gilmar Ribeiro Da Silva - 52630738 PR,Massagista: Alexandre Batista Da Silva - 5556719 PE
Preparador De GoleiroX:  - X,,Preparador De GoleiroW: ashington Paulino De Araujo - 192654 PE
"",,,,,Gols,
Tempo,1T/2T,No,Tipo,Nome do Jogador,,Equipe
26:00,1T,8,NR,Rodrigo de Souza Fonseca,,Náutico/PE
01:00,2T,7,NR,Ronielson da Silva Barbosa,,Náutico/PE
18:00,2T,9,NR,Luiz Fernando da Silva Monte,,Paraná/PR
"",,,,Substituições,
Tempo,1T/2T,,Equipe,Entrou,Saiu
45:00,INT,Náutico/PE,,16 - Igor Rabello da Costa,33 - Rafael Pereira dos Santos ...
03:00,2T,Paraná/PR,,20 - Henrique Roberto Rafael,7 - Guilherme de Queiroz Gonc ...
04:00,2T,Paraná/PR,,16 - Murilo Rangel Barbosa,2 - Lucas Taylor Maia Reis
17:00,2T,Paraná/PR,,18 - Micerlanio Fernandes da S ...,6 - Henrique Gelain Custodio
28:00,2T,Náutico/PE,,9 - Yuri Souza Almeida,11 - Bergson Gustavo Silveira  ...
40:00,2T,Náutico/PE,,85 - Samuel Rosa Pereira,8 - Rodrigo de Souza Fonseca
