"",Arbitragem
Arbitro:,Felipe Duarte Varejao (ASP-FIFA / ES)
Arbitro Assistente 1:,Leonardo Mendonca (CBF-1 / ES)
Arbitro Assistente 2:,Ramires Santos Candido (CBF-2 / ES)
Quarto Arbitro:,Leonardo Sígari Zanon (CBF-2 / PR)
Assessor:,Helio Henrique de Camargo (ASS / PR)
"",,,Cronologia,,,
"",1o Tempo,,2o Tempo,,,
Entrada do mandante:,19:08Atraso:,,Não Houve Entrada do mandante: 20:15,Atraso:,,Não Houve
Entrada do visitante:,19:08Atraso:,,Não Houve Entrada do visitante: 20:16,Atraso:,,Não Houve
Início 1o Tempo:,19:15 Atraso:,,Não Houve Início do 2o Tempo: 20:32,Atraso:,,15 min
Término do 1o Tempo:,20:02 Acréscimo:,,2 min Término do 2o Tempo: 21:21,Acréscimo:,,4 min
Resultado do 1o Tempo: 0 X 0,,,Resultado Final: 1 X 0,,,
"",,,,Relação de Jogadores,,,
"",,Londrina / PR,,,Náutico / PE,,
No,Apelido,Nome Completo T/R P/A,,CBF No Apelido,Nome Completo T/R P/A,,CBF
1,Marcelo,Marcelo Rangel Rosa T,P,186722 1 Julio Cesar,Julio Cesar de Souza... T,P,150963
2,Igor,Igor Bosel Dias T,P,372585 2 Joazi,Joazi Oliviera da Silva T,P,392907
4,Silvio,Silvio Henderson San ... T,P,171894 3 Rafael,Rafael Pereira dos S... T,P,170563
5,Diogo,Diogo Roberto Roque T,P,169115 4 Eduardo,Eduardo Gabriel dos ... T,P,304071
8,Germano,Germano Borovicz Car ... T,P,155026 6 Muller,Mateus Muller de Sou... T,P,373728
10,Jose,Jose Rafael Vivian T,P,330886 7 Roni,Ronielson da Silva B... T,P,427806
16,Leo,Leonardo Pinheiro da ... T,P,346294 8 Rodrigo,Rodrigo de Souza Fonseca T,P,293529
23,Rafael Gava,Rafael Gustavo Meneg ... T,P,313001 9 Rafael,Rafael Coelho Luiz T,P,174140
25,Matheus,Matheus Borges Domingues T,P,301741 10 Caique,Caique Ferreira da S... T,P,370426
77,Jo,Jonathan Oliveira da ... T,P,293622 11 Jefferson  ...,Jefferson Vasconcelo... T,P,417467
99,Keirrison,Keirrison de Souza C ... T,P,171998 22 Gaston,Gaston Filgueira Mendez T,P,517393
7,Paulo,Paulo Roberto Moccelin R,P,360467 5 Helder,Helder Ribeiro Silva R,P,308607
9,Bruno Batata,Bruno Fressato Cardoso R,P,162152 12 Rodolpho,Rodolpho Henrique Al... R,P,142924
11,Itamar,Itamar Batista da Silva R,P,139015 13 Henrique,Henrique Gelain Custodio R,P,343787
15,Elias,Elias Nascimento Felicio R,P,308624 15 Eurico,Eurico Nicolau de Li... R,P,328399
20,Julio,Julio Guilherme Jero ... R,P,357300 16 Maylson,Maylson Barbosa Teixeira R,P,176854
26,Rai,Rai dos Reis Ramos R,P,331532 17 Renan,Renan Henrique Olive... R,P,178684
29,Jadi,Jardiel Sousa Pereira R,P,344899 18 Rafael,Rafael Rogerio da Silva R,P,354183
33,Marcondes,Marcondes de Jesus S ... R,P,311339 19 Taiberson,Taiberson Ruan Menez... R,P,295789
36,Anderson,Anderson Leite Morais R,P,323184,,,
41,Alan,Alan Jose Bernardon R,P,326968,,,
42,Cesar,Cesar Augusto Soares ... R,P,409084,,,
45,Wellisson,Wellisson Almeida Nunes R,P,525810,,,
"",,Comissão Técnica
"",Londrina / PR,Náutico / PE
Técnico:,Claudio Aparecido Tencati - CREF4240G/PR,Técnico: Alexandre Tadeu Gallo - 154664649
Auxiliar Técnico:,Alessio Da Costa Antunes - CREF008558P-PR,Auxiliar Técnico: Valdir Benedito  - 15723350
Médico:,Jean Alexandre Furtado Correa Francisco - 12026-PR,Médico: Renato C. Carneiro L.p. Barreto - 18121PE
Preparador Físico:,Joao Carlos Martins Ruiz - 000945G-SP,Preparador Físico: Elliot Paes Alves Junior - 052231-G/SP
Massagista:,Marcelo Felipe Barbosa Rockenbach - CREFITO117914-F Massagista:,Wlington Rodrigues De Oliveira - 57687 MTPE
Preparador De GoleiroE:d son Luiz Da Silva - CREF 009990-P/P,,Preparador De Goleiro..:.. .............. - ...............
"",,,,,Gols,
Tempo,1T/2T,No,Tipo,Nome do Jogador,,Equipe
24:00,2T,99,NR,Keirrison de Souza Carneiro,,Londrina/PR
"",,,,Substituições,
Tempo,1T/2T,,Equipe,Entrou,Saiu
45:00,INT,Náutico/PE,,17 - Renan Henrique Oliveira V ...,10 - Caique Ferreira da Silva  ...
12:00,2T,Náutico/PE,,19 - Taiberson Ruan Menezes Nu ...,11 - Jefferson Vasconcelos Bra ...
13:00,2T,Londrina/PR,,7 - Paulo Roberto Moccelin,77 - Jonathan Oliveira da Silv ...
32:00,2T,Londrina/PR,,9 - Bruno Fressato Cardoso,99 - Keirrison de Souza Carnei ...
34:00,2T,Náutico/PE,,18 - Rafael Rogerio da Silva,7 - Ronielson da Silva Barbos ...
44:00,2T,Londrina/PR,,33 - Marcondes de Jesus Santos ...,4 - Silvio Henderson Santos d ...
44:00,2T,Londrina/PR,33 - Marcondes de Jesus Santos ...,4 - Silvio Henderson Santos d ...
