"",,Arbitragem
Arbitro:,Joao Batista de Arruda (CBF-1 / RJ),
Arbitro Assistente 1:,Michael Correia (CBF-1 / RJ),
Arbitro Assistente 2:,Joao Luiz Coelho de Albuquerque (CBF-1 / RJ),
Quarto Arbitro:,Charles Hebert Cavalcante Ferreira (CBF-1 / AL),
Assessor:,Claudio Mercante Júnior (000 / PE),
Delegado Local:,Murilo Savio Barbalho Falcao (000 / ),
"",,,Cronologia,,,
"",1o Tempo,,2o Tempo,,,
Entrada do mandante:,18:20Atraso:,,Não Houve Entrada do mandante: 19:31,Atraso:,,Não Houve
Entrada do visitante:,18:20Atraso:,,Não Houve Entrada do visitante: 19:31,Atraso:,,Não Houve
Início 1o Tempo:,18:30 Atraso:,,Não Houve Início do 2o Tempo: 19:32,Atraso:,,Não Houve
Término do 1o Tempo:,19:17 Acréscimo:,,2 min Término do 2o Tempo: 20:22,Acréscimo:,,5 min
Resultado do 1o Tempo: 0 X 0,,,Resultado Final: 1 X 0,,,
"",,,,Relação de Jogadores,,,
"",,Náutico / PE,,,Ceará / CE,,
No,Apelido,Nome Completo T/R P/A,,CBF No Apelido,Nome Completo T/R P/A,,CBF
12,Rodolpho,Rodolpho Henrique Al ... T(g),P,142924 1 Everson,Everson Felipe Marqu... T(g),P,188398
2,Joazi,Joazi Oliviera da Silva T,P,392907 2 Cametá,Tiago Coelho Andrade T,P,392058
7,Roni,Ronielson da Silva B ... T,P,427806 10 Felipe,Felipe de Oliveira Silva T,P,189538
8,Rodrigo,Rodrigo de Souza Fonseca T,P,293529 13 Thallyson,Thallyson Augusto Ta... T,P,305917
10,Marquinhos,Marcos Antonio Miran ... T,P,161039 14 Ewerton,Ewerton Ribeiro Pascoa T,P,182550
11,Bergson,Bergson Gustavo Silv ... T,P,191433 18 Bil,Rosimar Amancio T,P,159343
13,Joao,Joao Ananias Jordao  ... T,P,337194 22 Diego Felipe,Diego Felipe Coutinho T,P,188803
16,Igor,Igor Rabello da Costa T,P,307840 27 Wescley,Wescley Gomes dos Santos T,P,297441
19,Gaston,Gaston Filgueira Mendez T,P,517393 37 Raul,Raul Lo Goncalves T,P,446399
29,Vinicius,Vinicius Goes Barbos ... T,P,294769 88 Charles,Charles Luis Reiter T,P,300886
33,Rafael,Rafael Pereira dos S ... T,P,170563 90 Lele,Wesley de Jesus Correia T,P,191513
4,Leonardo,Leonardo Pereira R,P,310373 6 Eduardo,Eduardo Jose Diniz Costa R,P,176196
6,Muller,Mateus Muller de Sou ... R,P,373728 9 Rafael Costa,Rafael Costa dos Santos R,P,180284
9,Yuri Mamute,Yuri Souza Almeida R,P,349171 16 Felipe,Felipe Menezes Jacomo R,P,179098
20,Esquerdinha,Rubens Raimundo da Silva R,P,298531 20 Ricardinho,Ricardo de Souza Silva R,P,159341
22,Walber,Walber da Silva Sous ... R,P,173921 23 Douglas,Douglas Marques dos ... R,P,158644
23,Renan,Renan Henrique Olive ... R,P,178684 32 Lauro,Lauro Junior Batista... R,P,139461
32,Magrão,Jefferson Adelino da ... R,P,324879 99 Jociel,Jociel Ferreira da Silva R,P,154961
49,Eurico,Eurico Nicolau de Li ... R,P,328399,,,
69,Jefferson  ...,Jefferson Vasconcelo ... R,P,417467,,,
85,Samuel Rosa,Samuel Rosa Pereira R,P,173707,,,
99,Tiago,Tiago Adan Fonseca R,P,176993,,,
"",,Comissão Técnica
"",Náutico / PE,Ceará / CE
Técnico:,Givanildo Jose De Oliveira - 931503 SSP/PE,Massagista: Anacleto Pires De Sousa - 9669612349
Auxiliar Técnico:,Levi Marcelino Gomes - 631987 SSP/PB,Auxiliar Técnico: Denys Luctke Facincani - 5446615832
Médico:,Múcio B. Vaz De Almeida - 11161/PE,Treinador De GoleirosE:v eraldo Goncalves Santana - 94772495487
Preparador Físico:,Welligton Jose Vero - 768 G/PE,Médico: Henrique Jose Bastos Pinheiro - 2789755507
Massagista:,Welington Rodrigues De Oliveira  - 57687 MT PE,Técnico: Sergio Soares Da Silva - 93978278715
Preparador De GoleiroW: ashington Paulino De Araujo - 1927654 SSP/PE,,Preparador Físico: Walmir Da Cruz - 4284004859
"",,Preparador De GoleiroE:v eraldo Gonçalves Santana - 94772495487
"",,,,,Gols,
Tempo,1T/2T,No,Tipo,Nome do Jogador,,Equipe
+4,2T,16,NR,Igor Rabello da Costa,,Náutico/PE
"",,,,Substituições,
Tempo,1T/2T,,Equipe,Entrou,Saiu
13:00,2T,Náutico/PE,,9 - Yuri Souza Almeida,8 - Rodrigo de Souza Fonseca
18:00,2T,Náutico/PE,,69 - Jefferson Vasconcelos Bra ...,11 - Bergson Gustavo Silveira  ...
20:00,2T,Ceará/CE,,99 - Jociel Ferreira da Silva,90 - Wesley de Jesus Correia
30:00,2T,Ceará/CE,,16 - Felipe Menezes Jacomo,10 - Felipe de Oliveira Silva
40:00,2T,Ceará/CE,,9 - Rafael Costa dos Santos,18 - Rosimar Amancio
41:00,2T,Náutico/PE,,23 - Renan Henrique Oliveira V ...,29 - Vinicius Goes Barbosa de  ...
