"",,Arbitragem
Arbitro:,Pablo dos Santos Alves (ESP / PB),
Arbitro Assistente 1:,Luis Filipe Gonçalves Correa (CBF-1 / PB),
Arbitro Assistente 2:,Marcio Freire Lopes (CBF-1 / PB),
Quarto Arbitro:,Renato Cardoso da Conceição (CBF-2 / MG),
Assessor:,Joel Tolentino da Mata Junior (ASS / MG),
Delegado Local:,Flavio de Carvalho Drummond (000 / ),
"",,,Cronologia,,,
"",1o Tempo,,2o Tempo,,,
Entrada do mandante:,21:20Atraso:,,Não Houve Entrada do mandante: 22:30,Atraso:,,Não Houve
Entrada do visitante:,21:20Atraso:,,Não Houve Entrada do visitante: 22:30,Atraso:,,Não Houve
Início 1o Tempo:,21:30 Atraso:,,Não Houve Início do 2o Tempo: 22:33,Atraso:,,Não Houve
Término do 1o Tempo:,22:18 Acréscimo:,,3 min Término do 2o Tempo: 23:21,Acréscimo:,,3 min
Resultado do 1o Tempo: 1 X 1,,,Resultado Final: 2 X 1,,,
"",,,,Relação de Jogadores,,,
"",,Tupi / MG,,,Ceará / CE,,
No,Apelido,Nome Completo,T/R P/A,CBF No Apelido,Nome Completo T/R P/A,,CBF
12,Rafael,Rafael de Carvalho S ...,T P,177436 1 Everson,Everson Felipe Marqu... T,P,188398
2,Wesley,Wesley Douglas Teixe ...,T P,316766 3 Sandro,Sandro Silva de Souza T,P,172036
3,Gabriel,Gabriel dos Santos N ...,T P,142460 4 Andrevaldo,Andrevaldo de Jesus ... T,P,326990
4,Rodolfo,Rodolfo Reydel Mol d ...,T P,293718 5 Joao Marcos,Joao Marcos Alves Fe... T,P,155201
5,Renan,Renan Teixeira da Silva,T P,166416 6 Eduardo,Eduardo Jose Diniz Costa T,P,176196
6,Bruno,Bruno Costa de Souza,T P,177098 8 Richardson,Richardson Fernandes... T,P,328312
7,Marcos,Marcos Vinicius Serrato,T P,355387 9 Rafael Costa,Rafael Costa dos Santos T,P,180284
8,Jatai,Rafael Fagundes Mariano,T P,175008 10 Felipe,Felipe de Oliveira Silva T,P,189538
10,Pituco,Luiz Gabriel Sacilot ...,T P,163216 11 Wescley,Wescley Gomes dos Santos T,P,297441
11,Jonathan,Jonathan Oliveira Gu ...,T P,307486 13 Thallyson,Thallyson Augusto Ta... T,P,305917
18,Rubens,Rubens da Silva Coura,T P,310961 18 Bil,Rosimar Amancio T,P,159343
1,Glaysson,Glaysson Leandro Rod ...,R P,137433 12 Lauro,Lauro Junior Batista... R,P,139461
9,Giancarlo,Giancarlo da Silva Moro,R P,150855 14 Lucas,Lucas da Silva Gomes R,P,355348
13,Euller,Euller Viana,R P,401579 15 Andres,Andres Fernandes Gon... R,P,180842
14,Thiago Esp ...,Thiago Espindola de  ...,R P,314387 16 Diego Felipe,Diego Felipe Coutinho R,P,188803
15,Wheidson,Wheidson Roberto dos ...,R P,320592 17 William He ...,William Henrique Rod... R,P,305534
16,Nenem,Marcel Costa de Souza,R P,179582 19 Rafinha,Rafael Diniz Alves e... R,P,321556
17,Felipe,Felipe da Silva Alves,R P,373420 20 Ricardinho,Ricardo de Souza Silva R,P,159341
19,Vinicius,Vinicius Kiss Silva  ...,R P,185860 21 Serginho,Sergio Ricardo dos S... R,P,305977
20,Savio,Savio Henrique Braz  ...,R P,343790,,,
21,Thiago,Thiago Silvy Coelho,R P,160336,,,
"",,Comissão Técnica
"",Tupi / MG,Ceará / CE
Técnico:,Estevam Eduardo Lemos Soares - 6511830,Massagista: Anacleto Pires De Sousa - 9669612349
Auxiliar Técnico:,Julio Cesar Cirico - 8895381,Médico: Daniel Gomes Costa - 64098621304
Médico:,Dr. José Roberto Maranhas Brandão - 16.833,Auxiliar Técnico: Denys Luctke Facincani - 5446615832
Preparador Físico:,Rene Carlos De Almeida - 9198,Treinador De GoleirosE:v eraldo Goncalves Santana - 94772495487
Massagista:,Creso Heleno Cordeiro - 049.332.721-7,Técnico: Sergio Soares Da Silva - 93978278715
Preparador De GoleiroW: alker Campos Pinto - 4.292285,,Preparador Físico: Walmir Da Cruz - 4284004859
"",,Preparador De GoleiroE:v eraldo Gonçalves Santana - 947.724.954-87
"",,,,,Gols,
Tempo,1T/2T,No,Tipo,Nome do Jogador,,Equipe
09:00,1T,11,NR,Wescley Gomes dos Santos,,Ceará/CE
27:00,1T,4,NR,Rodolfo Reydel Mol de Morais,,Tupi/MG
41:00,2T,7,NR,Marcos Vinicius Serrato,,Tupi/MG
"",,,,Substituições,
Tempo,1T/2T,,Equipe,Entrou,Saiu
15:00,2T,Ceará/CE,,21 - Sergio Ricardo dos Santos ...,11 - Wescley Gomes dos Santos
22:00,2T,Tupi/MG,,19 - Vinicius Kiss Silva Tobia ...,18 - Rubens da Silva Coura
22:00,2T,Tupi/MG,,21 - Thiago Silvy Coelho,2 - Wesley Douglas Teixeira D ...
24:00,2T,Ceará/CE,,19 - Rafael Diniz Alves E Silv ...,9 - Rafael Costa dos Santos
38:00,2T,Ceará/CE,,17 - William Henrique Rodrigue ...,18 - Rosimar Amancio
38:00,2T,Tupi/MG,,14 - Thiago Espindola de Paula ...,10 - Luiz Gabriel Sacilotto Fi ...
