"",Arbitragem
Arbitro:,Diego Almeida Real (ASP-FIFA / RS)
Arbitro Assistente 1:,Alexandre A Pruinelli Kleiniche (CBF-1 / RS)
Arbitro Assistente 2:,Jose Eduardo Calza (CBF-1 / RS)
Quarto Arbitro:,Aurelio Santana Martins (CBF-1 / SP)
Assessor:,Marcio Verri Brandao (ASS / SP)
"",,,Cronologia,,,
"",1o Tempo,,2o Tempo,,,
Entrada do mandante:,21:22Atraso:,,Não Houve Entrada do mandante: 22:32,Atraso:,,2 min
Entrada do visitante:,21:22Atraso:,,Não Houve Entrada do visitante: 22:28,Atraso:,,Não Houve
Início 1o Tempo:,21:30 Atraso:,,Não Houve Início do 2o Tempo: 22:32,Atraso:,,2 min
Término do 1o Tempo:,22:15 Acréscimo:,,Não Houve Término do 2o Tempo: 23:20,Acréscimo:,,3 min
Resultado do 1o Tempo: 1 X 1,,,Resultado Final: 1 X 1,,,
"",,,,Relação de Jogadores,,,
"",,Oeste / SP,,,Vasco da Gama / RJ,,
No,Apelido,Nome Completo,T/R P/A,CBF No Apelido,Nome Completo T/R P/A,,CBF
1,Felipe,Felipe Alves Raymundo,T P,177931 1 Jordi,Jordi Martins Almeida T,P,320196
2,Felipe Neg ...,Felipe Rodrigues dos ...,T P,352632 2 Yago,Glaybson Yago Souza ... T,P,364829
3,Francis,Francis Jose da Silva,T P,151406 3 Rodrigo,Rodrigo Baldasso da ... T,P,137340
4,Velicka,Leandro Nunes Velicka,T P,164453 4 Luan,Luan Garcia Teixeira T,P,307406
5,Daniel,Daniel de Oliveira S ...,T P,335362 5 Marcelo Ma ...,Marcelo de Mattos Terra T,P,154766
6,Renan,Renan Carvalho Mota,T P,187591 6 Julio Cesar,Julio Cesar Coelho d... T,P,155605
7,Mauro,Mauro Job Pontes Junior,T P,188941 7 Eder,Eder Luis de Oliveira T,P,165075
8,Francisco  ...,Francisco Alex Souza ...,T P,148155 8 Julio dos  ...,Julio Daniel dos San... T,P,292789
9,Marcus Vin ...,Marcus Vinicius Arau ...,T P,185030 9 Thalles,Thalles Lima da Conc... T,P,308877
10,Mazinho,Anderson Soares da Silva,T P,181254 10 Nene,Anderson Luis de Car... T,P,150986
11,Leonardo,Leonardo Artur de Melo,T P,343349 11 Jorge Henr ...,Jorge Henrique de Souza T,P,153189
12,Je,Jefferson da Silva P ...,R P,335765 12 Gabriel,Gabriel Felix dos Santos R,P,330667
13,Leonardo,Leonardo Alves Sao P ...,R P,415484 13 Aislan,Aislan Paulo Lotici Back R,P,180866
14,Mauricio,Mauricio de Oliveira ...,R P,378543 14 Jomar,Jomar Herculano Lourenco R,P,307645
15,Joao Roberto,Joao Roberto Custodio,R P,294996 15 Rodrigo Ol ...,Rodrigo Oliveira de ... R,P,147224
16,Matheus,Matheus de Vargas,R P,338237 16 Henrique,Henrique Silva Milagres R,P,308965
17,Carlos,Carlos Rafael Rocha  ...,R P,184046 17 Caio,Caio Monteiro Costa R,P,404815
18,Robert,Robert Geannine de S ...,R P,304433 18 Gallo,Bruno Vieira Gallo d... R,P,175300
19,Samoel,Samoel Demetrius Pizzi,R P,380607 19 Bruno,Bruno Ferreira dos S... R,P,355297
"",,,,20 Evander,Evander da Silva Fer... R,P,362659
"",,,,21 Leandrao,Leandro Costa Miranda R,P,144035
"",,,,22 Indio,Matheus da Cunha Gomes R,P,341827
"",,,,23 Willian,Willian Oliveira dos... R,P,430883
"",,Comissão Técnica
"",Oeste / SP,Vasco da Gama / RJ
Técnico:,Fernando Diniz Silva  - 18.755.002,Massagista: Andre Luis Nascimento Gomes - 10439598-3
Auxiliar Técnico:,Eduardo Maciel De Barros  - 34.007.977-0,Auxiliar Técnico: Crizan Cesar De Oliveira Filho - 99328542715
Médico:,Pedro Henrique Peres Da Costa  - 152.137,Auxiliar Técnico: Crizan Cesar De Oliveira Filho  - 05956193-6
Preparador Físico:,Wagner Bertelli  - 034689-G/SP,Preparador Físico: Joelton Francisco Urtiga - 022583-G/RJ
Massagista:,Luciano Moreira Rocha  - 9.062.732,Técnico: Jorge De Amorim Campos - 36225005
Preparador De GoleiroX:. x.x.x.x.x.x. - X.X.X.X.,,Médico: Victor Luiz Baitelli Leite - 52747912RJ
"",,Preparador De GoleiroF:a bio Muchinel Tepedino  - 1006797031
"",,,,,Gols,
Tempo,1T/2T,No,Tipo,Nome do Jogador,,Equipe
01:00,1T,10,NR,Anderson Luis de Carvalho,,Vasco da Gama/RJ
29:00,1T,8,NR,Francisco Alex Souza da Silva,,Oeste/SP
"",,,Substituições,
Tempo,1T/2T,Equipe,Entrou,Saiu
45:00,INT,Vasco da Gama/RJ,23 - Willian Oliveira dos Sant ...,8 - Julio Daniel dos Santos R ...
06:00,2T,Oeste/SP,15 - Joao Roberto Custodio,6 - Renan Carvalho Mota
16:00,2T,Vasco da Gama/RJ,17 - Caio Monteiro Costa,9 - Thalles Lima da Conceição ...
21:00,2T,Oeste/SP,17 - Carlos Rafael Rocha Ferre ...,9 - Marcus Vinicius Araujo Si ...
25:00,2T,Oeste/SP,14 - Mauricio de Oliveira Mora ...,2 - Felipe Rodrigues dos Sant ...
33:00,2T,Vasco da Gama/RJ,16 - Henrique Silva Milagres,5 - Marcelo de Mattos Terra
