"",Arbitragem
Arbitro:,Leandro Bizzio Marinho (CBF-1 / SP)
Arbitro Assistente 1:,Herman Brumel Vani (CBF-1 / SP)
Arbitro Assistente 2:,Bruno Salgado Rizo (CBF-1 / SP)
Quarto Arbitro:,Gleidson Santos Oliveira (CBF-2 / BA)
Assessor:,Tania Regina Magalhães Saldanha (000 / BA)
"",,,Cronologia,,,
"",1o Tempo,,2o Tempo,,,
Entrada do mandante:,15:50Atraso:,,Não Houve Entrada do mandante: 17:00,Atraso:,,Não Houve
Entrada do visitante:,15:50Atraso:,,Não Houve Entrada do visitante: 16:59,Atraso:,,Não Houve
Início 1o Tempo:,16:00 Atraso:,,Não Houve Início do 2o Tempo: 17:02,Atraso:,,Não Houve
Término do 1o Tempo:,16:47 Acréscimo:,,2 min Término do 2o Tempo: 17:53,Acréscimo:,,6 min
Resultado do 1o Tempo: 1 X 1,,,Resultado Final: 1 X 2,,,
"",,,,Relação de Jogadores,,,
"",,Bahia / BA,,,Londrina / PR,,
No,Apelido,Nome Completo,T/R P/A,CBF No Apelido,Nome Completo T/R P/A,,CBF
1,Marcelo,Marcelo Lomba do Nas ...,T P,157264 1 Marcelo,Marcelo Rangel Rosa T,P,186722
2,Guilherme,Guilherme de Jesus d ...,T P,348138 2 Igor,Igor Bosel Dias T,P,372585
3,Jackson,Jackson de Souza,T P,299142 3 Luizao,Walter Luiz Silva de... T,P,301156
4,Lucas,Lucas Silva Fonseca,T P,309265 8 Germano,Germano Borovicz Car... T,P,155026
5,Paulo Robe ...,Paulo Roberto da Silva,T P,175560 10 Jose,Jose Rafael Vivian T,P,330886
6,Joao Paulo,Joao Paulo Gomes da  ...,T P,155855 11 Itamar,Itamar Batista da Silva T,P,139015
7,Danilo,Danilo Pires Costa,T P,302560 16 Leo,Leonardo Pinheiro da... T,P,346294
8,Junior,Paulo Roberto Valour ...,T P,179395 23 Rafael Gava,Rafael Gustavo Meneg... T,P,313001
9,Hernane,Hernane Vidal de Souza,T P,186467 25 Matheus,Matheus Borges Domingues T,P,301741
10,Regis,Regis Augusto Salmazzo,T P,305723 52 Rondinelly,Rondinelly de Andrad... T,P,300562
11,Thiago Rib ...,Thiago Ribeiro Cardoso,T P,164974 77 Jo,Jonathan Oliveira da... T,P,293622
12,Jean,Jean Paulo Fernandes ...,R P,420409 6 Paulinho,Paulo Oliveira de So... R,P,184316
13,Hayner,Hayner Willian Monja ...,R P,402405 15 Elias,Elias Nascimento Felicio R,P,308624
14,Eder Ferre ...,Eder Ferreira Graminho,R P,318115 19 Netinho,Artur Pereira Neto R,P,155995
15,Luis Ferna ...,Luis Fernando Santos ...,R P,444966 20 Julio,Julio Guilherme Jero... R,P,357300
16,Moises,Moises Roberto Barbosa,R P,318481 22 Alan,Alan Jose Bernardon R,P,326968
17,Luis,Luis Gustavo Melere  ...,R P,309982 36 Anderson,Anderson Leite Morais R,P,323184
18,Gustavo,Gustavo Blanco Peter ...,R P,367216 45 Wellisson,Wellisson Almeida Nunes R,P,525810
19,Rodrigo,Rodrigo Rodrigues Silva,R P,356563 47 Marcelo,Marcelo Antonio de O... R,P,508210
20,João Paulo,Joao Paulo de Assis  ...,R P,363827 94 Fabiano,Fabiano Donato Alves R,P,372029
21,Ze Roberto,Jose Roberto Assunca ...,R P,334457,,,
22,Douglas,Douglas Moreira Pires,R P,187561,,,
23,Dede,Jhosef Pedro Santos  ...,R P,338938,,,
"",,Comissão Técnica
"",Bahia / BA,Londrina / PR
Técnico:,Dorival Ghidoni Junior - cbf42427,Auxiliar Técnico: Alessio Da Costa Antunes - 73089370972
Auxiliar Técnico:,Eduardo Do Nascimento Souza - 29692069-1,Técnico: Claudio Aparecido Tencati - 88360520968
Médico:,Rodrigo Daniel Souza - 18703,Preparador De GoleiroE:d son Luiz Da Silva - 80516483900
Preparador Físico:,Reverson Bastos Pimentel - 034749G/SP,Médico: Jean Alexandre Furtado Correa Francisco - 12026 PR
Massagista:,Fabio Lima Fontes - 855718145,Massagista: Marcelo Felipe Barbosa Rockenbach - 5828582917
Preparador De GoleiroT:h iago Costa Mehl - 015501g-pr,,Preparador Físico: João Carlos Martins Ruiz - 000945-G/SP
"",,,,,Gols,
Tempo,1T/2T,No,Tipo,Nome do Jogador,,Equipe
01:00,1T,10,NR,Jose Rafael Vivian,,Londrina/PR
26:00,1T,8,FT,Paulo Roberto Valoura Junior,,Bahia/BA
43:00,2T,77,NR,Jonathan Oliveira da Silva,,Londrina/PR
"",,,,Substituições,
Tempo,1T/2T,,Equipe,Entrou,Saiu
16:00,2T,Bahia/BA,,16 - Moises Roberto Barbosa,6 - Joao Paulo Gomes da Costa ...
16:00,2T,Bahia/BA,,17 - Luis Gustavo Melere da Si ...,11 - Thiago Ribeiro Cardoso
17:00,2T,Londrina/PR,,20 - Julio Guilherme Jeronimo  ...,10 - Jose Rafael Vivian
21:00,2T,Londrina/PR,,36 - Anderson Leite Morais,25 - Matheus Borges Domingues
29:00,2T,Bahia/BA,,21 - Jose Roberto Assuncao de  ...,10 - Regis Augusto Salmazzo
36:00,2T,Londrina/PR,,15 - Elias Nascimento Felicio,52 - Rondinelly de Andrade Sil ...
