"",,Arbitragem
Arbitro:,Raphael Claus (FIFA / SP),
Arbitro Assistente 1:,Danilo Ricardo Simon Manis (ASP-FIFA / SP),
Arbitro Assistente 2:,Alex Ang Ribeiro (ASP-FIFA / SP),
Quarto Arbitro:,Rodrigo Nunes de Sa (CBF-1 / RJ),
Inspetor:,Rogério Pereira da Costa (000 / MG),
"",,,Cronologia,,,
"",1o Tempo,,2o Tempo,,,
Entrada do mandante:,18:20Atraso:,,Não Houve Entrada do mandante: 19:29,Atraso:,,Não Houve
Entrada do visitante:,18:20Atraso:,,Não Houve Entrada do visitante: 19:29,Atraso:,,Não Houve
Início 1o Tempo:,18:30 Atraso:,,Não Houve Início do 2o Tempo: 19:32,Atraso:,,Não Houve
Término do 1o Tempo:,19:17 Acréscimo:,,2 min Término do 2o Tempo: 20:21,Acréscimo:,,4 min
Resultado do 1o Tempo: 0 X 0,,,Resultado Final: 0 X 0,,,
"",,,,Relação de Jogadores,,,
"",,América / MG,,,Grêmio / RS,,
No,Apelido,Nome Completo T/R P/A,,CBF No Apelido,Nome Completo T/R P/A,,CBF
1,Joao,Joao Ricardo Riedi,T P,298660 1 M. Grohe,Marcelo Grohe T,P,168351
2,Jonas,Jonas Jessue da Silv ...,T P,160466 3 Geromel,Pedro Tonon Geromel T,P,165322
3,Alison,Alison Wagner Lira F ...,T P,162004 10 Douglas,Douglas dos Santos T,P,146817
4,Sueliton,Sueliton Florencio N ...,T P,306025 14 Wallace Reis,Wallace Reis Silva T,P,166649
5,Adilson,Adilson dos Anjos Ol ...,T P,337261 19 Maicon,Maicon Thiago Pereir... T,P,166603
7,Osman,Osman de Menezes Ven ...,T P,335599 23 Miller,Miler Alejandro Bola... T,P,541503
8,Leandro,Leandro Luchese Guer ...,T P,137403 25 Jailson,Jailson Marques Siqueira T,P,407095
9,Michael,Michael Vinicius Sil ...,T P,329015 26 M. Oliveira,Marcelo Oliveira Fer... T,P,172123
10,Matheusinho,Matheus Leonardo Sal ...,T P,398805 32 Pedro Rocha,Pedro Rocha Neves T,P,379462
11,Gilson,Gilson Gomes do Nasc ...,T P,167201 33 Edilson,Edilson Mendes Guimaraes T,P,161745
22,Pablo,Pablo de Barros Paulino,T P,181190 77 Negueba,Guilherme Ferreira Pinto T,P,307277
12,Fernando L ...,Fernando Leal Fonseca,R P,151033 2 W. Oliveira,Wallace Oliveira dos... R,P,307605
13,Roger,Roger Duarte de Oliveira,R P,318036 6 Fred,Frederico Burgel Xavier R,P,172404
15,Helder,Helder Maurilio da S ...,R P,179928 13 Bobo,Deyvison Rogerio da ... R,P,149578
16,Claudinei,Claudinei Junio de Souza,R P,306822 17 Ramiro,Ramiro Moschen Benetti R,P,295418
17,Guilherme,Guilherme Xavier de  ...,R P,312572 27 Lincoln,Lincoln Henrique Oli... R,P,421665
18,Vitinho,Victor Neves Rangel,R P,359362 28 Kaio,Kaio Silva Mendes R,P,359493
19,Danilo,Danilo Leandro Dias,R P,172918 30 Bruno Grassi,Bruno Medeiros Grassi R,P,172342
20,Loboa,Eisner Ivan Loboa Ba ...,R P,554935 34 Iago,Iago Sampaio Silva R,P,308774
23,Diego,Diego Hipolito da Si ...,R P,554575 38 Guilherme,Guilherme Augusto Vi... R,P,410547
"",,,,91 H. Almeida,Henrique Almeida Cai... R,P,178303
"",,Comissão Técnica
"",América / MG,Grêmio / RS
Técnico:,Enderson Alves Moreira - 4870873 MG,Auxiliar Técnico: James Francisco Freitas Iahnke - 056371
Auxiliar Técnico:,Luis Fernando Rosa Flores - 13282344 MG,Massagista: Lucas Silva Da Cruz - 7082474185
Médico:,Cimar Eustaquio Marques Da Silva - 8712,Médico: Marcio Augusto Bolzoni - 12567
Preparador Físico:,Edy Carlos Toporowicz Soares - 07447 G PR,Técnico: Roger Machado Marques - 056134
Massagista:,Silvio Junio Nunes Da Silva - 4761735 MG,Treinador De GoleirosR: ogerio Augusto Godoy Da Silva - 51650320000
Preparador De GoleiroS:i lvio Siqueira Jardim - 3153313,,Preparador Físico: Rogerio Dias Luiz - 003934 G RS
"",,Preparador De GoleiroR:o gerio Augusto Godoy Da Silva - 513012
"",,,,Substituições,
Tempo,1T/2T,,Equipe,Entrou,Saiu
13:00,2T,Grêmio/RS,,38 - Guilherme Augusto Vieira  ...,32 - Pedro Rocha Neves
25:00,2T,América/MG,,16 - Claudinei Junio de Souza,8 - Leandro Luchese Guerreiro ...
27:00,2T,Grêmio/RS,,91 - Henrique Almeida Caixeta  ...,23 - Miler Alejandro Bolanos R ...
29:00,2T,América/MG,,20 - Eisner Ivan Loboa Balanta ...,10 - Matheus Leonardo Sales Ca ...
31:00,2T,Grêmio/RS,,17 - Ramiro Moschen Benetti,10 - Douglas dos Santos
41:00,2T,América/MG,,18 - Victor Neves Rangel,9 - Michael Vinicius Silva de ...
