"",Arbitragem
Arbitro:,Eduardo Tomaz de Aquino Valadao (ASP-FIFA / GO)
Arbitro Assistente 1:,Alessandro A Rocha de Matos (FIFA / BA)
Arbitro Assistente 2:,Bruno Raphael Pires (FIFA / GO)
Quarto Arbitro:,Cleber Vaz da Silva (CBF-2 / GO)
Inspetor:,Alicio Pena Junior (000 / MG)
Delegado Local:,Marcelo Carlos Nascimento Viana (000 / )
"",,,Cronologia,,,
"",1o Tempo,,2o Tempo,,,
Entrada do mandante:,16:53Atraso:,,Não Houve Entrada do mandante: 18:02,Atraso:,,Não Houve
Entrada do visitante:,16:53Atraso:,,Não Houve Entrada do visitante: 18:02,Atraso:,,Não Houve
Início 1o Tempo:,17:00 Atraso:,,Não Houve Início do 2o Tempo: 18:04,Atraso:,,Não Houve
Término do 1o Tempo:,17:49 Acréscimo:,,4 min Término do 2o Tempo: 18:53,Acréscimo:,,4 min
Resultado do 1o Tempo: 1 X 0,,,Resultado Final: 2 X 0,,,
"",,,,Relação de Jogadores,,,
"",,Flamengo / RJ,,,Santos / SP,,
No,Apelido,Nome Completo,T/R P/A,CBF No Apelido,Nome Completo T/R P/A,,CBF
38,Alex Muralha,Alex Roberto Santana ...,T(g) P,177010 1 Vanderlei,Vanderlei Farias da ... T(g),P,177770
5,Willian Arão,Willian Souza Arao d ...,T P,293420 4 Victor Fer ...,Victor Ferraz Macedo T,P,170272
6,Jorge,Jorge Marco de Olive ...,T P,320593 8 Renato,Renato Dirnei Florencio T,P,123823
8,Marcio Ara ...,Marcio Rodrigues Araujo,T P,162907 9 Ricardo Ol ...,Ricardo de Oliveira T,P,150151
9,Guerrero,Jose Paolo Guerrero  ...,T P,420184 10 Lucas Lima,Lucas Rafael Araujo Lima T,P,331937
15,Rever,Rever Humberto Alves ...,T P,167509 14 David Braz,David Braz Oliveira ... T,P,168008
17,Gabriel,Gabriel Santana Pinto,T P,335611 18 Vitor Bueno,Vitor Frezarin Bueno T,P,322748
21,Pará,Marcos Rogerio Ricci ...,T P,165065 25 Yuri,Yuri Oliveira Lima T,P,307979
22,Everton,Everton Cardoso Silva,T P,178361 29 Thiago Maia,Thiago Maia Alencar T,P,384124
33,Rafael Vaz,Rafael Vaz dos Santos,T P,171406 36 Copete,Jonathan Copete Valencia T,P,553190
35,Diego,Diego Ribas da Cunha,T P,152138 37 Zeca,Jose Carlos Cracco Neto T,P,294382
2,Rodinei,Rodinei Marcelo de A ...,R P,353568 3 Caju,Wanderson de Jesus M... R,P,445012
4,Juan,Juan Silveira dos Santos,R P,123816 11 Elano,Elano Blumer R,P,137518
7,Marcelo Ci ...,Marcelo Cirino da Silva,R P,293440 12 Vladimir,Vladimir Orlando Car... R,P,180622
11,Emerson Sh ...,Marcio Passos de Alb ...,R P,310950 17 Rafael,Rafael Vinicius Carv... R,P,183844
18,Leandro Da ...,Leandro Damião da Si ...,R P,291866 20 Vecchio,Emiliano Gabriel Vecchio R,P,308527
19,Alan Patrick,Alan Patrick Lourenço,R P,305976 22 Rodrigão,Rodrigo Gomes dos Santos R,P,398368
23,Mancuello,Federico Andres Manc ...,R P,541197 27 Leo Cittad ...,Leonardo Cittadini R,P,321574
25,Donatti,Alejandro Cesar Donatti,R P,554372 28 Lucas Veri ...,Lucas Verissimo da Silva R,P,377476
26,Cuellar,Gustavo Leonardo Cue ...,R P,541232 30 Joel,Diederrick Joel Tagu... R,P,402984
31,Fernandinho,Luiz Fernando Pereir ...,R P,173277 31 Arthur,Arthur Gomes Lourenco R,P,387808
47,Felipe Vizeu,Felipe dos Reis Pere ...,R P,399284 32 Noguera,Fabian Ariel Noguera R,P,553997
48,Paulo Victor,Paulo Victor Mileo V ...,R P,175411 38 Daniel,Daniel Guedes da Silva R,P,317780
"",,Comissão Técnica
"",Flamengo / RJ,Santos / SP
Técnico:,José Ricardo Mannarino - 078128949/RJ,Preparador Físico: Celso De Rezende - 3756-G/SC
Auxiliar Técnico:,Jayme De Almeida Filho - 3304819/RJ,Técnico: Dorival Silvestre Junior - 3544655896
Médico:,Marcio A. Tannure - 5277379-4/RJ,Massagista: Jose Jorge Jesuino - 1804451894
Preparador Físico:,Daniel Soares Gonçalves - 099451403/RJ,Auxiliar Técnico: Lucas Khodor Silvestre - 35179920892
Massagista:,Frederico De Sá Manhães - 099678559/RJ,Médico: Mauricio Rodrigues Zenaide - 108315
Preparador De GoleiroV:i ctor Hugo Marinho Signorelli - 047794995/RJ,,Treinador De GoleirosS:e bastiao Martins De Oliveira Junior - 14255792801
"",,Preparador De GoleiroS:e bastião Martins De Oliveira Junior - 142557928-01
"",,,,,Gols,
Tempo,1T/2T,No,Tipo,Nome do Jogador,,Equipe
05:00,1T,9,NR,Jose Paolo Guerrero Gonzales,,Flamengo/RJ
41:00,2T,35,NR,Diego Ribas da Cunha,,Flamengo/RJ
"",,,,Substituições,
Tempo,1T/2T,,Equipe,Entrou,Saiu
16:00,2T,Santos/SP,,27 - Leonardo Cittadini,18 - Vitor Frezarin Bueno
20:00,2T,Flamengo/RJ,,4 - Juan Silveira dos Santos,33 - Rafael Vaz dos Santos
37:00,2T,Santos/SP,,31 - Arthur Gomes Lourenco,8 - Renato Dirnei Florencio
40:00,2T,Flamengo/RJ,,18 - Leandro Damião da Silva d ...,9 - Jose Paolo Guerrero Gonza ...
44:00,2T,Flamengo/RJ,,31 - Luiz Fernando Pereira da  ...,17 - Gabriel Santana Pinto
