"",Arbitragem
Arbitro:,Braulio da Silva Machado (CBF / SC)
Arbitro Assistente 1:,Angelo Rudimar Bechi (CBF / SC)
Arbitro Assistente 2:,Jose Roberto Larroyd (CBF / SC)
Quarto Arbitro:,Diego Almeida Real (CBF / RS)
Assessor:,Alexandre Lourenço Barreto (CBF / RS)
"",,,Cronologia,,,
"",1o Tempo,,2o Tempo,,,
Entrada do mandante:,19:25Atraso:,,Não Houve Entrada do mandante: 20:30,Atraso:,,Não Houve
Entrada do visitante:,19:26Atraso:,,Não Houve Entrada do visitante: 20:30,Atraso:,,Não Houve
Início 1o Tempo:,19:30 Atraso:,,Não Houve Início do 2o Tempo: 20:31,Atraso:,,Não Houve
Término do 1o Tempo:,20:16 Acréscimo:,,1 min Término do 2o Tempo: 21:19,Acréscimo:,,3 min
Resultado do 1o Tempo: 0 X 1,,,Resultado Final: 0 X 1,,,
"",,,,Relação de Jogadores,,,
"",,Brasil / RS,,,Atlético / PR,,
No,Apelido,Nome Completo,T/R P/A,CBF No Apelido,Nome Completo T/R P/A,,CBF
1,Luiz Carlos,Luiz Carlos Muller,T(g) P,143759 1 Weverton,Weverton Pereira da ... T(g),P,169050
2,Ricardo,Ricardo Chaves Schen ...,T P,168233 2 Jonas,Jonas Jessue da Silv... T,P,160466
3,Cirilo,Jeferson Cirilo Mesq ...,T P,140044 3 Manoel,Manoel Messias Silva... T,P,182423
4,Fernando,Fernando da Silva Ca ...,T P,129549 4 Luiz Alber ...,Luiz Alberto da Silv... T,P,130372
5,Leandro,Leandro Leite Mateus,T P,146430 5 Deivid,Deivid Willian da Silva T,P,182609
6,Edu Silva,Eduardo Silva Sales,T P,137569 6 Leonardo,Leonardo Moreira Morais T,P,303922
7,Wender,Wender Almeida Silva,T P,142654 7 Marcelo Ci ...,Marcelo Cirino da Silva T,P,293440
8,Cezar,Cezar Washington Alv ...,T P,179012 8 Joao Paulo,Joao Paulo da Silva T,P,174223
9,Ivan,Ivan Fiel da Silva,T P,151020 9 Marcao,Marcos Assis de Santana T,P,185680
10,Leandro,Leandro Porto Torma,T P,348945 10 Elias,Elias Ribeiro de Oli... T,P,150547
11,Alex,Alex Broch Amado,T P,293164 11 Everton,Everton Cardoso Silva T,P,178361
12,Anderson,Anderson Correa,R P,156218 12 Renan Rocha,Renan Nelson Rocha R,P,172299
13,Cleiton,Cleiton de Oliveira  ...,R P,189861 13 Bruno,Bruno Costa de Souza R,P,177098
14,Renato,Renato Garcia Martins,R P,132817 14 Derley,Wanderley de Jesus Sousa R,P,166491
15,Rafael,Rafael Foster,R P,175720 15 Paulo Baier,Paulo Cesar Baier R,P,122631
16,Maicon Sap ...,Maicom Falheiro da Silva,R P,152971 16 Francisco,Francisco Merida Perez R,P,432122
17,Jonatan,Marcio Jonatan Dias,R P,388330 17 Felipe,Felipe de Oliveira Silva R,P,189538
18,Eder Machado,Eder Machado Carvalho,R P,153102 18 Douglas,Douglas Coutinho Gom... R,P,303545
"",,Comissão Técnica,
"",Brasil / RS,,Atlético / PR
Tecnico:,Rogério Zimmermann - 10892 GRS,Tecnico:,Sebastião Ricardo Drubscky De Campos - 1240707 MG
Auxiliar Tecnico:,Não Houve - -------,Auxiliar Tecnico:,Luciano De Oliveira Junior - 0465124461 BA
Medico:,André Guerreiro - 22650 RS,Medico:,Christiano Saliba Uliana - 22846 PR
Preparador Fisico:,João F. Breschoner - 3889 G RS,Massagista:,. - .
Massagista:,Guilherme B. Leal - 6071677899,,
"",,Gols,
Tempo 1T/2T,No Tipo Nome do Jogador,,Equipe
45:00 1T,10 PN Elias Ribeiro de Oliveira,,Atlético/PR
"",,,,Substituições,
Tempo,1T/2T,,Equipe,Entrou,Saiu
17:00,2T,Brasil/RS,,16 - Maicom Falheiro da Silva,10 - Leandro Porto Torma
29:00,2T,Atlético/PR,,18 - Douglas Coutinho Gomes de ...,7 - Marcelo Cirino da Silva
42:00,2T,Atlético/PR,,17 - Felipe de Oliveira Silva,11 - Everton Cardoso Silva
