"",Arbitragem
Arbitro:,Claudio Francisco Lima E Silva (CBF / SE)
Arbitro Assistente 1:,Cleriston Clay Barreto Rios (CBF / SE)
Arbitro Assistente 2:,Clovis Amaral da Silva (CBF / PE)
Quarto Arbitro:,José Reinaldo Figueiredo da Silva Filho (CBF / AL)
Assessor:,Hercules Martins da Silva (CBF / AL)
"",,,Cronologia,,,
"",1o Tempo,,2o Tempo,,,
Entrada do mandante:,19:20Atraso:,,Não Houve Entrada do mandante: 20:36,Atraso:,,Não Houve
Entrada do visitante:,19:28Atraso:,,Não Houve Entrada do visitante: 20:39,Atraso:,,2 min
Início 1o Tempo:,19:36 Atraso:,,6 min Início do 2o Tempo: 20:39,Atraso:,,2 min
Término do 1o Tempo:,20:23 Acréscimo:,,1 min Término do 2o Tempo: 21:30,Acréscimo:,,3 min
Resultado do 1o Tempo: 0 X 0,,,Resultado Final: 0 X 0,,,
"",,,,Relação de Jogadores,,,
"",,Crb / AL,,,Botafogo / RJ,,
No,Apelido,Nome Completo,T/R P/A,CBF No Apelido,Nome Completo T/R P/A,,CBF
1,Galatto,Rodrigo Jose Galatto,T(g) P,153784 1 Jefferson,Jefferson de Oliveir... T(g),P,140841
2,Paulo Sergio,Paulo Sergio Rocha,T P,136781 3 Antonio Ca ...,Antonio Carlos dos S... T,P,161940
3,Vinicius,Marcus Vinicius de M ...,T P,160738 8 Renato,Renato Dirnei Florencio T,P,123823
4,Gladstone,Gladstone Pereira De ...,T P,158421 16 Lima,Lucas Pedro Alves de... T,P,187540
5,Everton,Everton Luiz Guimara ...,T P,188475 17 Andrezinho,Andre Luiz Tavares T,P,144360
6,Joao Victor,Joao Victor Severino,T P,159361 19 Andre Bahia,Andre Luiz Bahia San... T,P,150642
7,Carlos Hen ...,Carlos Henrique de M ...,T P,298550 25 Lucas,Lucas Lacerda Lima G... T,P,291609
8,Johnnattan,Johnnattan Wendell d ...,T P,183774 31 Vitinho,Victor Vinicius Coel... T,P,307245
9,Cleber,Cleber Schwenck Tiene,T P,132803 33 Edilson,Edilson Mendes Guimaraes T,P,161745
10,Walter Min ...,Walter Junio da Silv ...,T P,143187 34 Geirton,Geirton Marques Aires T,P,310627
11,Jairo,Francisco Jairo Silv ...,T P,175353 38 Bruno Mendes,Bruno Pereira Mendes T,P,374375
12,Tiago,Tiago de Nobrega Rod ...,R(g) P,184820 22 Renan,Renan dos Santos R(g),P,188424
13,Filipe,Filipe da Costa Figuero,R P,165107 9 H. Almeida,Henrique Almeida Cai... R,P,178303
14,Tinho,Djavan da Silva Ferreira,R P,356092 13 Gilberto,Gilberto Moraes Junior R,P,307134
15,Jonathas,Jonathas de Souza Pe ...,R P,182595 18 Jadson,Jadson Alves dos Santos R,P,302192
16,Marco Anto ...,Marcos Antonio Nasci ...,R P,172181 29 Sassá,Luiz Ricardo Alves R,P,337172
17,Diego Aragao,Diego Aragao dos Santos,R P,184506 30 Jeferson,Jeferson Anti Filho R,P,295383
18,Thiago,Thiago Jefferson da  ...,R P,177887 36 Matheus,Matheus Menezes Jacomo R,P,329591
"",,Comissão Técnica,
"",Crb / AL,,Botafogo / RJ
Tecnico:,Ademir Fonseca - 006189 P/SC,Tecnico:,Oswaldo De Oliveira Filho - 0002751822 IFP
Auxiliar Tecnico:,Ademir Willander Cardao Fonseca - 026897 G/RJ,Auxiliar Tecnico:,---- - ----
Medico:,Orlando Baia De Barros Filho - 2461/AL,Medico:,Gustavo De Albuquerque Dutra - 5281425 - 3
Preparador Fisico:,Francisco Eduardo Ortiz Batista - 010387 G/SP,Preparador Fisico:,Ricardo Henrique  Pinho - 0688683 -6 RJ
Massagista:,Francisco De Assis Rodrigues Miranda - 2002001196558ALMassagista:,,Fabio Cesar De Souza Azevedo - 09147290-2 IFP
"",,,,Substituições,
Tempo,1T/2T,,Equipe,Entrou,Saiu
19:00,2T,Crb/AL,,14 - Djavan da Silva Ferreira,9 - Cleber Schwenck Tiene
21:00,2T,Botafogo/RJ,,29 - Luiz Ricardo Alves,38 - Bruno Pereira Mendes
28:00,2T,Crb/AL,,18 - Thiago Jefferson da Silva ...,10 - Walter Junio da Silva Cle ...
33:00,2T,Botafogo/RJ,,9 - Henrique Almeida Caixeta  ...,17 - Andre Luiz Tavares
33:00,2T,Crb/AL,,16 - Marcos Antonio Nascimento ...,11 - Francisco Jairo Silva San ...
33:00,2T,Botafogo/RJ,,18 - Jadson Alves dos Santos,8 - Renato Dirnei Florencio
