Campeonato:,Campeonato Brasileiro - Série A/2017,,Rodada:,29
Jogo:,Flamengo / RJ X Bahia / BA,,,
Data:,19/10/2017 Horário: 21:00 Estádio:,Luso Brasileiro / Rio de Janeiro,,
"",Arbitragem
Arbitro:,Marcelo Aparecido R de Souza (AB / SP)
Arbitro Assistente 1:,Anderson José de Moraes Coelho (AB / SP)
Arbitro Assistente 2:,Alex Ang Ribeiro (AB / SP)
Quarto Arbitro:,Fabio Rogerio Baesteiro (AB / SP)
Arbitro Assist Adic 1:,Jose Claudio Rocha Filho (AB / SP)
Arbitro Assist Adic 2:,Adriano de Assis Miranda (CD / SP)
Inspetor:,Cláudio Vinícius Cerdeira (CBF / BRA)
Delegado Local:,Marcos Vinicio de Abreu Trindade (CBF / )
"",,,Cronologia,,,
"",1o Tempo,,2o Tempo,,,
Entrada do mandante:,20:50Atraso:,,Não Houve Entrada do mandante: 22:02,,Atraso:,Não Houve
Entrada do visitante:,20:50Atraso:,,Não Houve Entrada do visitante: 22:01,,Atraso:,Não Houve
Início 1o Tempo:,21:00Atraso:,,Não Houve Início do 2o Tempo: 22:04,,Atraso:,Não Houve
Término do 1o Tempo:,21:49Acréscimo:,,4 min Término do 2o Tempo: 22:52,Acréscimo:,,3 min
Resultado do 1o Tempo: 0 X 0,,,Resultado Final: 4 X 1,,,
"",,,,,Relação de Jogadores,,,,
"",,Flamengo / RJ,,,,Bahia / BA,,,
No,Apelido,Nome Completo,T/R,P/A,CBF No Apelido,Nome Completo T/R,,P/A,CBF
1,Diego Alves,Diego Alves Carreira,T(g),P,159238 1 Jean,Jean Paulo Fernandes... T(g),,P,420409
4,Juan,Juan Silveira dos Santos,T,P,123816 3 Tiago,Tiago Pagnussat T,,P,188260
5,Willian Arão,Willian Souza Arao d ...,T,P,293420 11 Edigar Junio,Edigar Junio Teixeir... T,,P,296349
9,Guerrero,Jose Paolo Guerrero  ...,T,P,420184 17 Mendoza,John Steven Mendoza ... T,,P,522146
13,Trauco,Miguel Angel Trauco  ...,T,P,565356 18 Jose,Jose Rafael Vivian T,,P,330886
15,Rever,Rever Humberto Alves ...,T,P,167509 19 Edson,Edson Felipe da Cruz T,,P,291843
21,Pará,Marcos Rogerio Ricci ...,T,P,165065 22 Eduardo,Carlos Eduardo Santo... T,,P,170077
22,Everton,Everton Cardoso Silva,T,P,178361 23 Rene,Rene dos Santos Junior T,,P,185339
26,Cuellar,Gustavo Leonardo Cue ...,T,P,541232 28 Lucas,Lucas Silva Fonseca T,,P,309265
28,Berrio,Orlando Enrique Berr ...,T,P,565602 29 Vinicius,Vinicius Goes Barbos... T,,P,294769
35,Diego,Diego Ribas da Cunha,T,P,152138 36 Juninho Ca ...,Luis Antonio da Roch... T,,P,402681
38,Alex Muralha,Alex Roberto Santana ...,R(g),P,177010 33 Anderson,Anderson Pedro da Si... R(g),,P,155955
2,Rodinei,Rodinei Marcelo de A ...,R,P,353568 2 Thiago,Thiago Martins Bueno R,,P,353798
6,Rene,Rene Rodrigues Martins,R,P,346636 5 Junior,Paulo Roberto Valour... R,,P,179395
7,Everton Ri ...,Everton Augusto de B ...,R,P,177444 6 Matheus Reis,Matheus Reis de Lima R,,P,337413
17,Gabriel,Gabriel Santana Pinto,R,P,335611 8 Allione,Agustin Lionel Allione R,,P,509926
23,Gigio,Geuvanio Santos Silva,R,P,311336 9 Hernane,Hernane Vidal de Souza R,,P,186467
27,Romulo,Romulo Borges Monteiro,R,P,183094 13 Matheus,Matheus de Sales Cabral R,,P,338849
33,Rafael Vaz,Rafael Vaz dos Santos,R,P,171406 15 Feijao,Antonio Filipe Gonza... R,,P,352645
39,Lucas Paqu ...,Lucas Tolentino Coel ...,R,P,319635 16 Rodrigo Na ...,Rodrigo Nascimento Franca R,,P,447682
43,Leonardo,Leonardo Campos Duar ...,R,P,355960 20 Regis,Regis Augusto Salmazzo R,,P,305723
44,Rhodolfo,Luiz Rhodolfo Dini Gaioto,R,P,169286 30 Eder,Eder Ferreira Graminho R,,P,318115
47,Felipe Vizeu,Felipe dos Reis Pere ...,R,P,399284,,,,
"",,Comissão Técnica
"",Flamengo / RJ,Bahia / BA
Técnico:,Reinaldo Rueda Rivera,Técnico: Paulo Cezar Carpegiani
Auxiliar Técnico:,Bernardo Redin,Auxiliar Técnico: Rodrigo Meneghetti Carpegiani
Auxiliar Técnico:,Carlos Eduardo Velasco Toro,Preparador Físico: Luis Fernando De Andrade Teixeira
Treinador De GoleirosV:i ctor Hugo Marinho Signorelli,,Treinador De GoleirosT:h iago Costa Mehl
Médico:,Joao Marcelo Silveira De Amorim,Médico: Daniel Jose De Araujo Silva
Massagista:,Mario Galdi Peixoto,Massagista: Fabio Lima Fontes
"",,,,,Gols,
Tempo,1T/2T,No,Tipo,Nome do Jogador,,Equipe
05:00,2T,15,NR,Rever Humberto Alves de Araujo,,Flamengo/RJ
23:00,2T,17,PN,John Steven Mendoza Valencia,,Bahia/BA
31:00,2T,15,NR,Rever Humberto Alves de Araujo,,Flamengo/RJ
39:00,2T,35,PN,Diego Ribas da Cunha,,Flamengo/RJ
41:00,2T,35,NR,Diego Ribas da Cunha,,Flamengo/RJ
"",,,,Cartões Amarelos
Tempo,1T/2T,No,Nome do Jogador,Equipe
01:00,2T,22,Carlos Eduardo Santos Oliveira,Bahia/BA
"",,,Motivo: A2.  Desaprovar com palavras ou gestos as decisões da arbitragem  - Por reclamar e gesticular de forma acintosa contra as,
"",,,decisões da arbitragem.,
"",,,,Substituições,
Tempo,1T/2T,,Equipe,Entrou,Saiu
45:00,INT,Flamengo/RJ,,7 - Everton Augusto de Barros Ri...,28 - Orlando Enrique Berrio Melen...
33:00,1T,Bahia/BA,,20 - Regis Augusto Salmazzo,29 - Vinicius Goes Barbosa de Souza
17:00,2T,Bahia/BA,,9 - Hernane Vidal de Souza,11 - Edigar Junio Teixeira Lima
20:00,2T,Bahia/BA,,8 - Agustin Lionel Allione,18 - Jose Rafael Vivian
20:00,2T,Flamengo/RJ,,39 - Lucas Tolentino Coelho de Lima,9 - Jose Paolo Guerrero Gonzales
42:00,2T,Flamengo/RJ,,27 - Romulo Borges Monteiro,35 - Diego Ribas da Cunha
