"",,Arbitragem
Arbitro:,Marielson Alves Silva (AB / BA),
Arbitro Assistente 1:,Jucimar dos Santos Dias (AB / BA),
Arbitro Assistente 2:,Paulo de Tarso Bregalda Gussen (CD / BA),
Quarto Arbitro:,Douglas Schwengber da Silva (INT / RS),
Analista de Campo:,Paulo Ricardo Silva Conceicao (CBF / RS),
"",,,Cronologia,,,
"",1o Tempo,,2o Tempo,,,
Entrada do mandante:,19:20Atraso:,,Não Houve Entrada do mandante: 20:31,Atraso:,,Não Houve
Entrada do visitante:,19:20Atraso:,,Não Houve Entrada do visitante: 20:31,Atraso:,,Não Houve
Início 1o Tempo:,19:30 Atraso:,,Não Houve Início do 2o Tempo: 20:33,Atraso:,,Não Houve
Término do 1o Tempo:,20:18 Acréscimo:,,3 min Término do 2o Tempo: 21:23,Acréscimo:,,5 min
Resultado do 1o Tempo: 0 X 0,,,Resultado Final: 0 X 0,,,
"",,,,Relação de Jogadores,,,
"",,Ypiranga / RS,,,São Bento / SP,,
No,Apelido,Nome Completo T/R P/A,,CBF No Apelido,Nome Completo T/R P/A,,CBF
1,Carlos,Carlos Adiel Deuschle T(g),P,186446 1 Rodrigo,Rodrigo Viana Conceicao T(g),P,298952
2,Pedro,Pedro Ivo Gomes da Silva T,P,300322 2 Lucas Mendes,Lucas Ferreira Mende... T,P,305809
3,Tairone,Tairone Santos da Silva T,P,181688 3 Rogério,Rogério Campos Nicolau T,P,172886
4,Carlos Ric ...,Carlos Ricardo Ribei ... T,P,329988 4 Mateus,Mateus Ferreira da Silva T,P,378323
5,Henrique,Henrique Schwarzer T,P,354638 5 Fábio Bahia,Fabio Junior Nascime... T,P,156835
6,Rennan,Rennan Fonseca Siqueira T,P,295793 6 Edu Pina,Luiz Eduardo Soares Pina T,P,177476
7,Juninho,Junior Cezar de Souz ... T,P,298805 7 Eder,Edson Correia de Araujo T,P,176092
8,Carrilho,Rafael Carrilho Delvaux T,P,347208 8 Everaldo,Everaldo Silva do Na... T,P,438556
9,Rafael,Rafael Alves Targino T,P,180630 9 Anderson,Anderson Aparecido d... T,P,181490
10,Maycon,Maycon Eduardo Bamberg T,P,182799 10 Maicon,Maicon Souza de Jesus T,P,188294
11,Gabriel,Gabriel Araujo Carvalho T,P,296295 11 Branquinho,Alvaro Andre Rodrigu... T,P,341133
12,Rafael,Rafael Roballo Maciel R(g),P,187908 12 Matheus,Matheus Gomes Sanchez R(g),P,352611
13,Wagner,Wagner da Silva Freitas R,P,291374 13 Fandinho,Bruno Fandinho Franzo R,P,295449
14,Diego Niza,Diego Niza de Oliveira R,P,171863 14 Leandro,Leandro Domingos de Melo R,P,163929
15,Daniel,Daniel Lucini R,P,340881 15 Felipe Man ...,Felipe Manoel Goncalves R,P,292320
16,Adriano,Adriano Jose de Lara R,P,187728 16 Cassio,Cassio Gabriel Vilel... R,P,320834
17,Lucas,Lucas Vieira de Goes R,P,392057 17 Judson,Judson Augusto do Bo... R,P,292481
18,Michel,Michel Das Chagas He ... R,P,293136 18 Rennan,Rennan Gonçalves de ... R,P,315645
19,Guilherme,Guilherme Parede Pin ... R,P,411198 19 Nilson,Jose Nilson dos Sant... R,P,303459
20,Anderson,Anderson Pelegrini S ... R,P,158513 20 Caio,Caio Cezar Valerio R... R,P,340657
21,Vandinho,Vanderson da Silva Souza R,P,161683,,,
23,Fabio,Fabio da Silva Calonego R,P,418480,,,
"",,Comissão Técnica
"",Ypiranga / RS,São Bento / SP
Preparador Físico:,Anderson Claiton De Lazari - 892280069,Técnico: Paulo Roberto Dos Santos - 50836196791
Treinador De GoleirosA:n dre Souza Guimaraes - 678846529,,Auxiliar Técnico: Luiz Ronaldo Nunes Rangel - 45812861749
Analista De DesempeCnheolio T Ráitcicaord: o Toledo Pretto - 686253086,,Médico: Marcelo Mansueto Baccin - 25429
Técnico:,Helio Fernando Xavier Vieira - 40126986053,Preparador Físico: Renato Vinhas Antunes - 009932-GRJ
Auxiliar Técnico:,Jean Paulo Brustolin - 50701703091,Massagista: Mauricio Ferreira Da Silva - 09022091830
Médico:,Marcos Antonio Busetto - 50702483087,Preparador De GoleiroJe: an Carlos Garcia - 28011288806
Massagista:,Marcos Jose Copetti - 76666352068,
Preparador De GoleiroA:n dre Souza Guimarães - 1400506719,,Gols
NÃO HOUVE MARCADORES,,
"",,,,Substituições,
Tempo,1T/2T,,Equipe,Entrou,Saiu
15:00,1T,Ypiranga/RS,,19 - Guilherme Parede Pinheiro ...,10 - Maycon Eduardo Bamberg
11:00,2T,Ypiranga/RS,,20 - Anderson Pelegrini Safira ...,6 - Rennan Fonseca Siqueira
25:00,2T,São Bento/SP,,20 - Caio Cezar Valerio Ramalh ...,11 - Alvaro Andre Rodrigues da ...
29:00,2T,Ypiranga/RS,,18 - Michel das Chagas Henriqu ...,7 - Junior Cezar de Souza Ram ...
29:00,2T,São Bento/SP,,15 - Felipe Manoel Goncalves,7 - Edson Correia de Araujo
34:00,2T,São Bento/SP,,19 - Jose Nilson dos Santos Si ...,9 - Anderson Aparecido dos Sa ...
