"",,Arbitragem
Arbitro:,Celio Amorim (AB / SC),
Arbitro Assistente 1:,Helton Nunes (AB / SC),
Arbitro Assistente 2:,Jose Roberto Larroyd (CD / SC),
Quarto Arbitro:,Deborah Cecilia C Correia (FIFA / PE),
Analista de Campo:,Francisco Domingos da Silva (CBF / PE),
"",,,Cronologia,,,
"",1o Tempo,,2o Tempo,,,
Entrada do mandante:,19:50Atraso:,,Não Houve Entrada do mandante: 20:59,Atraso:,,Não Houve
Entrada do visitante:,19:50Atraso:,,Não Houve Entrada do visitante: 20:59,Atraso:,,Não Houve
Início 1o Tempo:,20:00 Atraso:,,Não Houve Início do 2o Tempo: 21:01,Atraso:,,Não Houve
Término do 1o Tempo:,20:46 Acréscimo:,,1 min Término do 2o Tempo: 21:50,Acréscimo:,,4 min
Resultado do 1o Tempo: 0 X 0,,,Resultado Final: 1 X 0,,,
"",,,,Relação de Jogadores,,,
"",,Salgueiro / PE,,,Botafogo / PB,,
No,Apelido,Nome Completo T/R P/A,,CBF No Apelido,Nome Completo T/R P/A,,CBF
1,Mandragon,Jose Correia de Arau ... T(g),P,162211 1 Michel Alves,Michel Aluizio da Cr... T(g),P,146379
2,Andre,Andre Victor Silva Reis T,P,533069 2 Gustavo,Jose Gustavo Pereira... T,P,187568
3,Ranieri,Ranieri da Silva Rod ... T,P,151886 3 Plinio,Plinio Marcos da Silva T,P,156897
4,Luis Eduardo,Luis Eduardo Gomes Pinto T,P,170277 6 Fernandes,Micerlanio Fernandes... T,P,161974
5,Rodolfo,Gerson Rodolfo da Silva T,P,183707 11 Acrizio,Acrizio Militao de C... T,P,293090
6,Daniel,Daniel Rodrigues Nazare T,P,336836 16 Jardson,Jardson Marcolino Coelho T,P,307961
7,Diego Aragao,Diego Aragao dos Santos T,P,184506 19 Rafael Nas ...,Rafael Oliveira Nasc... T,P,182088
8,Jeffson,Jose Jeffson Cordeir ... T,P,178383 20 Magno,Magno Souza da Silva T,P,292998
9,Alvaro,Alvaro Vieira de Oli ... T,P,541189 21 Andrezinho,Andre Ricardo de Oli... T,P,306140
10,Cassio,Cassio Emmanuel da S ... T,P,307032 22 Cleyton,Cleyton Rafael Lima ... T,P,183073
11,Jean,Jean Carlos Cloth Go ... T,P,327039 23 Roger,Roger Roberto dos Santos T,P,172933
12,Luciano,Luciano da Rocha Nas ... R(g),P,161304 12 Mano,João Manoel Alves do... R(g),P,327028
13,Rafael Ara ...,Rafael Silva de Araujo R,P,160878 4 Bruno,Bruno Goncalves Maia... R,P,183732
14,Paulo Vitor,Paulo Vitor Balbi Serra R,P,297632 5 Carlos Ren ...,Carlos Renato Laurin... R,P,307111
15,Vitor Caico,Vitor Alves dos Santos R,P,151871 8 Val,Lucivaldo Lazaro de ... R,P,166989
16,Jaildo,Jaildo Marques da Cu ... R,P,296620 9 Warley,Warley Silva dos Santos R,P,129325
17,Willian,Willian da Silva Anicete R,P,370747 10 Marcio Iva ...,Marcio Ivanildo da Silva R,P,142928
18,Diogo,Diogo Roberto de Fra ... R,P,302554 17 Patrick Si ...,Patrick Silva Mota R,P,307502
19,Adailson,Adailson Freire Pere ... R,P,533140 18,Wanderley Francisco R,,326682
20,João Paulo,João Paulo Pereira d ... R,P,373724 25 Fernando,Fernando Jose Gomes ... R,P,317025
"",,Comissão Técnica
"",Salgueiro / PE,Botafogo / PB
Médico:,Carlos Frederico Soares Ribeiro De Barros - 13892,Técnico: Ademir Fonseca - 065735912
Coordenador TécnicoC: arlos Jose De Araujo - 63366452404,,Auxiliar Técnico: Marcos Galgaro - 8093339284
Técnico:,Evandro Braz Guimaraes - 37.374.2320,Médico: Fabio Farias De Lima - 4680
Auxiliar Técnico:,George Litiere Lopes Das Merces - 0419265449,Preparador Físico: Ramiro De Souza - 475
Treinador De GoleirosG: ilmar Gomes De Melo - 77067002400,,Massagista: Ermirio De Sousa L.filho - 903502
Fisiologista:,Glaydson Cassio Galdino Da Silva - 1171904460,Preparador De GoleiroS:i lvano De Morais Silva - 74485734
Massagista:,Joao Paulo Vieira - 6119622,
Supervisor:,Waldir Lins E Silva - 19371853468,Gols
PrepTaeramdpoor Físico1: T/2CTarlos NJoose DeT Aipraoujo NJuonmioer  d- o8 5J6o1gador,,Equipe
Prep3ar6a:d0o0r De Gole2irToG:i lmar G9omes DNeR MeloA -l v3a0r3o1 1V2i7eira de Oliveira,,Salgueiro/PE
"",,,,Substituições,
Tempo,1T/2T,,Equipe,Entrou,Saiu
09:00,2T,Salgueiro/PE,,19 - Adailson Freire Pereira d ...,2 - Andre Victor Silva Reis
21:00,2T,Salgueiro/PE,,18 - Diogo Roberto de Franca P ...,8 - Jose Jeffson Cordeiro de  ...
22:00,2T,Botafogo/PB,,25 - Fernando Jose Gomes Junio ...,23 - Roger Roberto dos Santos
28:00,2T,Botafogo/PB,,8 - Lucivaldo Lazaro de Abreu ...,16 - Jardson Marcolino Coelho
32:00,2T,Botafogo/PB,,10 - Marcio Ivanildo da Silva,11 - Acrizio Militao de Castro ...
