"",Arbitragem
Arbitro:,Denis da Silva Ribeiro Serafim (CD / AL)
Arbitro Assistente 1:,Esdras Mariano de Lima Albuquerque (CD / AL)
Arbitro Assistente 2:,Lennon Mccartney Farias (CD / AL)
Quarto Arbitro:,Katiucia da Mota Lima (CBF / SP)
Assessor:,Silvio Cesar Silva de Lima (CBF / SP)
"",,,Cronologia,,,
"",1o Tempo,,2o Tempo,,,
Entrada do mandante:,16:49Atraso:,,Não Houve Entrada do mandante: 17:58,Atraso:,,Não Houve
Entrada do visitante:,16:50Atraso:,,Não Houve Entrada do visitante: 17:59,Atraso:,,Não Houve
Início 1o Tempo:,17:00 Atraso:,,Não Houve Início do 2o Tempo: 18:01,Atraso:,,Não Houve
Término do 1o Tempo:,17:46 Acréscimo:,,1 min Término do 2o Tempo: 19:20,Acréscimo:,,5 min
Resultado do 1o Tempo: 1 X 0,,,Resultado Final: 2 X 1,,,
"",,,,Relação de Jogadores,,,
"",,São Bento / SP,,,Tombense / MG,,
No,Apelido,Nome Completo T/R P/A,,CBF No Apelido,Nome Completo,T/R P/A,CBF
1,Rodrigo,Rodrigo Viana Conceicao T(g),P,298952 1 Darley,Darley Ramon Torres,T(g) P,178158
2,Muriel,Muriel Leite Magalhaes T,P,188557 2 Glekson,Glekson Marrone Pire...,T P,331630
3,Rafael,Rafael Tavares de So ... T,P,176129 3 Wellington,Wellington Carvalho ...,T P,307674
4,Joao Paulo,Joao Paulo Goncalves ... T,P,161639 4 Anderson,Anderson Grasiane de...,T P,144802
5,Fábio Bahia,Fabio Junior Nascime ... T,P,156835 5 Everton,Everton Macedo Dias,T P,320318
6,Marcelo,Marcelo Cordeiro de  ... T,P,159612 6 Dieyson,Dieyson Anjos da Silva,T P,370703
7,Caio,Caio Cezar Valerio R ... T,P,340657 7 Pedro Henr ...,Pedro Henrique de Ca...,T P,297781
8,Felipe Man ...,Felipe Manoel Goncalves T,P,292320 8 Gelson,Gelson Luis Pinto Mello,T P,426457
9,Hudson,Hudson Ney Batista d ... T,P,318788 9 Max,Max Brendon Costa Pi...,T P,178836
10,Maicon,Maicon Souza de Jesus T,P,188294 10 Everton,Everton Galdino Moreira,T P,415027
11,Judson,Judson Augusto do Bo ... T,P,292481 11 Paulo,Paulo de Souza Junior,T P,412193
12,Fabio,Fabio Szymonek R,P,177099 12 Victor,Victor Bernardes And...,R P,299833
13,Lucas Mendes,Lucas Ferreira Mende ... R,P,305809 13 Ednei,Ednei Barbosa de Souza,R P,293385
14,Fandinho,Bruno Fandinho Franzo R,P,295449 14 Oliveira,Matheus Oliveira de ...,R P,310512
15,Muller,Mateus Muller de Sou ... R,P,373728 15 Natanael,Natanael de Sa Costa,R P,430311
16,Leandro,Leandro Domingos de Melo R,P,163929 16 Coutinho,Rafael Coutinho Barc...,R P,155956
17,Cassio,Cassio Gabriel Vilel ... R,P,320834 17 Ewerton,Ewerton Leandro Diniz,R P,137759
18,Everaldo,Everaldo Silva do Na ... R,P,438556 18 Paulo,Joao Paulo da Silva ...,R P,371170
19,Matheus,Matheus Cardoso de Souza R,P,333800 19 Jonathan,Jonathan Oliveira Gu...,R P,307486
20,Anderson,Anderson Aparecido d ... R,P,181490 20 Taua,Taua Ferreira dos Santos,R P,353985
21,Erik,Erik Felipe Damasceno R,P,459654,,,
"",,Comissão Técnica
"",São Bento / SP,Tombense / MG
Técnico:,Paulo Roberto Dos Santos - 2653114,Auxiliar Técnico: Andre Walter - 4697727/SC
Auxiliar Técnico:,Luiz Ronaldo Nunes Rangel - 026608737,Massagista: Claudio Henrique Brito Batista - 6399932
Médico:,Cassio Augusto De Mello Rusconi - 89.272,Médico: Joao Paulo Gazarini - 163.633
Preparador Físico:,Renato Vinhas Antunes - 009932-G/RJ,Preparador Físico: Luiz Carlos Coutinho De Souza - 012689
Massagista:,Mauricio Ferreira Da Silva - 17721249,Técnico: Raul Maia Cabral - 3504177/SC
Preparador De GoleiroJe: an Carlos Garcia - 27.713.809-7,,Treinador De GoleirosR: ogerio Maia De Brum - 64712974087
"",,Preparador De GoleiroR:o gerio Maia De Brum - 9050209759/RS
"",,,,,Gols,
Tempo,1T/2T,No,Tipo,Nome do Jogador,,Equipe
04:00,1T,4,NR,Joao Paulo Goncalves Jesuino,,São Bento/SP
06:00,2T,9,NR,Max Brendon Costa Pinheiro,,Tombense/MG
36:00,2T,4,NR,Joao Paulo Goncalves Jesuino,,São Bento/SP
"",,,Substituições,
Tempo,1T/2T,Equipe,Entrou,Saiu
45:00,INT,São Bento/SP,20 - Anderson Aparecido dos Sa ...,9 - Hudson Ney Batista da Sil ...
15:00,2T,São Bento/SP,17 - Cassio Gabriel Vilela Fer ...,8 - Felipe Manoel Goncalves
17:00,2T,Tombense/MG,15 - Natanael de Sa Costa,8 - Gelson Luis Pinto Mello
19:00,2T,São Bento/SP,19 - Matheus Cardoso de Souza,7 - Caio Cezar Valerio Ramalh ...
27:00,2T,Tombense/MG,16 - Rafael Coutinho Barcelos  ...,5 - Everton Macedo Dias
37:00,2T,Tombense/MG,20 - Taua Ferreira dos Santos,6 - Dieyson Anjos da Silva
