"",Arbitragem
Arbitro:,Leandro Saraiva Dantas de Oliveira (CD / RN)
Arbitro Assistente 1:,Lorival Candido das Flores (CD / RN)
Arbitro Assistente 2:,Jean Marcio dos Santos (AB / RN)
Quarto Arbitro:,Luiz Claudio Sobral (CD / PE)
Analista de Campo:,Francisco Domingos da Silva (CBF / PE)
"",,,Cronologia,,,
"",1o Tempo,,2o Tempo,,,
Entrada do mandante:,19:50Atraso:,,Não Houve Entrada do mandante: 21:00,Atraso:,,Não Houve
Entrada do visitante:,19:50Atraso:,,Não Houve Entrada do visitante: 21:01,Atraso:,,Não Houve
Início 1o Tempo:,20:00 Atraso:,,Não Houve Início do 2o Tempo: 21:02,Atraso:,,Não Houve
Término do 1o Tempo:,20:47 Acréscimo:,,2 min Término do 2o Tempo: 21:51,Acréscimo:,,4 min
Resultado do 1o Tempo: 0 X 1,,,Resultado Final: 1 X 2,,,
"",,,,Relação de Jogadores,,,
"",,Salgueiro / PE,,,Fortaleza / CE,,
No,Apelido,Nome Completo T/R P/A,,CBF No Apelido,Nome Completo,T/R P/A,CBF
1,Mandragon,Jose Correia de Arau ... T(g),P,162211 1 Marcelo Bo ...,Marcelo Boeck,T(g) P,154969
2,Marcos Tam ...,Marcos Roberto Nasci ... T,P,156119 2 Luis,Luis Antonio Ferreir...,T P,420080
3,Ranieri,Ranieri da Silva Rod ... T,P,151886 3 Rodrigo Ma ...,Rodrigo Marcos dos S...,T P,169990
4,Luis Eduardo,Luis Eduardo Gomes Pinto T,P,170277 4 Ligger,Ligger Moreira Malaquias,T P,291797
5,Rodolfo,Gerson Rodolfo da Silva T,P,183707 5 Uchoa,Anderson Uchoa dos S...,T P,183385
6,Daniel,Daniel Rodrigues Nazare T,P,336836 6 Bruno,Bruno Ferreira Melo,T P,329952
7,Toty,Christofoly Acioly d ... T,P,299231 7 Everton,Francisco Everton de...,T P,171339
8,Jeffson,Jose Jeffson Cordeir ... T,P,178383 9 Lucio,Lucio Flavio da Silv...,T P,166180
9,Willian,Willian Lira Sousa T,P,368000 10 Adenilson,Adenilson Martins do...,T P,366127
10,Jean,Jean Carlos Cloth Go ... T,P,327039 11 Hiago,Hiago de Oliveira Ramiro,T P,179600
11,Alvaro,Alvaro Vieira de Oli ... T,P,541189 22 Pablo,Pablo de Barros Paulino,T P,181190
12,Luciano,Luciano da Rocha Nas ... R(g),P,161304 12 Matheus,Matheus Francisco Inacio,R(g) P,324710
13,Mauricio,Mauricio Barbosa Tei ... R,P,400624 8 Ronny,Ronny Heberson Furta...,R P,160276
14,Rafael Ara ...,Rafael Silva de Araujo R,P,160878 13 Edimar,Edimar de Oliveira M...,R P,185649
15,Paulo Vitor,Paulo Vitor Balbi Serra R,P,297632 14 Wellington,Wellington Rodrigues...,R P,325913
16,Vitor Caico,Vitor Alves dos Santos R,P,151871 16 Jefferson,Jefferson Nogueira J...,R P,326522
17,Andre,Andre Victor Silva Reis R,P,533069 17 Willian Sc ...,Willian Schuster Dor...,R P,170488
18,Diego Aragao,Diego Aragao dos Santos R,P,184506 19 Leandro Ce ...,Leandro de Oliveira ...,R P,340020
19,Valdeir,Valdeir Batista de Souza R,P,341083 20 Leandro Lima,George Leandro Abreu...,R P,335303
20,Diogo,Diogo Roberto de Fra ... R,P,302554,,,
21,Elvis,Elvis Jose de Lima R,P,172045,,,
22,Adailson,Adailson Freire Pere ... R,P,533140,,,
"",,Comissão Técnica
"",Salgueiro / PE,Fortaleza / CE
Técnico:,Evandro Braz Guimaraes - 37374232-0,Técnico: Paulo Afonso Bonamigo - 9010377498
Auxiliar Técnico:,George Litiere Lopes Das Merces - 0419265449,Auxiliar Técnico: Edson Gonzaga Alves Filho - 010469
Médico:,Carlos Frederico S.r. De Barros - 864226184-68,Médico: Rafael Luis Cavalcante Veras Ribeiro - 016416
Preparador Físico:,Glaydson Cassio Galdino Da Silva - 4285,Preparador Físico: Fabiano Bruno Rosenau - 004004
Massagista:,Joao Paulo Vieira - 6119622,Massagista: Jose Wellington Nunes De Moura - 92005008761
Preparador De GoleiroG:i lmar Gomes De Melo - 3031127,,Preparador De GoleiroJo: se Augusto Da Cruz Albuquerque - 131801587
"",,,,,Gols,
Tempo,1T/2T,No,Tipo,Nome do Jogador,,Equipe
28:00,1T,22,NR,Pablo de Barros Paulino,,Fortaleza/CE
18:00,2T,7,NR,Francisco Everton de Almeida Andrade,,Fortaleza/CE
22:00,2T,11,NR,Alvaro Vieira de Oliveira,,Salgueiro/PE
"",,,,Substituições,
Tempo,1T/2T,,Equipe,Entrou,Saiu
45:00,INT,Salgueiro/PE,,18 - Diego Aragao dos Santos,8 - Jose Jeffson Cordeiro de  ...
07:00,2T,Salgueiro/PE,,19 - Valdeir Batista de Souza,10 - Jean Carlos Cloth Gonçalv ...
20:00,2T,Salgueiro/PE,,22 - Adailson Freire Pereira d ...,2 - Marcos Roberto Nascimento ...
20:00,2T,Fortaleza/CE,,19 - Leandro de Oliveira Noron ...,9 - Lucio Flavio da Silva Oli ...
20:00,2T,Fortaleza/CE,,17 - Willian Schuster Dornelle ...,7 - Francisco Everton de Alme ...
39:00,2T,Fortaleza/CE,,8 - Ronny Heberson Furtado de ...,10 - Adenilson Martins do Carm ...
