"",,Arbitragem
Arbitro:,Raphael Claus (ASP-FIFA / SP),
Arbitro Assistente 1:,Anderson José de Moraes Coelho (CBF-1 / SP),
Arbitro Assistente 2:,Marcio Luiz Augusto (ESP-2 / SP),
Quarto Arbitro:,Adriano de Assis Miranda (CBF-2 / SP),
Delegado  Especial:,Dionisio Roberto Domingos (ASS / BRA),
"",,,Cronologia,,,
"",1o Tempo,,2o Tempo,,,
Entrada do mandante:,15:58Atraso:,,Não Houve Entrada do mandante: 17:08,Atraso:,,Não Houve
Entrada do visitante:,16:00Atraso:,,Não Houve Entrada do visitante: 17:09,Atraso:,,Não Houve
Início 1o Tempo:,16:10 Atraso:,,Não Houve Início do 2o Tempo: 17:11,Atraso:,,Não Houve
Término do 1o Tempo:,16:56 Acréscimo:,,1 min Término do 2o Tempo: 17:58,Acréscimo:,,2 min
Resultado do 1o Tempo: 1 X 1,,,Resultado Final: 4 X 1,,,
"",,,,Relação de Jogadores,,,
"",,Oeste / SP,,,Bragantino / SP,,
No,Apelido,Nome Completo T/R P/A,,CBF No Apelido,Nome Completo T/R P/A,,CBF
1,Anderson,Anderson Pedro da Si ... T,P,155955 1 Matheus,Matheus Francisco Inacio,T P,324710
2,Ezequiel,Ezequiel Jacinto de  ... T,P,302436 2 Samuel,Samuel Henrique dos ...,T P,292280
3,Daniel,Daniel Carvalho da Silva T,P,155651 3 Gerson,Gerson Barbosa,T P,135260
4,Halisson,Halisson Bruno Melo  ... T,P,154584 4 Guilherme,Guilherme Cruz de Mattis,T P,291534
5,Leandro,Leandro Domingos de Melo T,P,163929 5 Geandro,Geandro Augusto de Paula,T P,176739
6,Denis,Denis Neves Resende  ... T,P,189556 6 Bruno,Bruno Felipe de Abre...,T P,323009
7,Dionisio,Dionisio de Oliveira ... T,P,178340 7 Francisco,Francisco Lisvaldo D...,T P,364594
8,Kleber,Kleber do Amaral Ribeiro T,P,184508 8 Magno,Magno Damasceno Sant...,T P,176899
9,Fabio,Jose Fabio Santos de ... T,P,166109 9 Mota,Joao Soares da Mota Neto,T P,135893
10,Roger,Roger Roberto dos Santos T,P,172933 10 Sandro,Sandro da Silva Mendonca,T P,155550
11,Serginho,Sergio Ricardo dos S ... T,P,305977 11 Washington,Washington Luiz Masc...,T P,137418
12,Enoque,Enoque Vicente Paes R,P,161740 12 Wilson,Wilson Raimundo Junior,R P,127151
13,Everton,Everton Macedo Dias R,P,320318 13 Alexandre,Alexandre Moraes Ber...,R P,466918
14,Renan,Renan Souza Diniz R,P,335325 14 Yago,Yago Fernando da Silva,R P,317022
15,Ramires,Ramires dos Anjos Alves R,P,186557 15 Roberto,Roberto Santos da Si...,R P,191476
16,Joao Junior,Joao Denoni Junior R,P,318773 16 Uchoa,Anderson Uchoa dos S...,R P,183385
17,Lele,Wesley de Jesus Correia R,P,191513 17 Graciano,Graciano Junior Gonç...,R P,351450
18,Waguininho,Wagner da Silva Souza R,P,300229 18 Adeilson,Adeilson Pereira de ...,R P,171224
19,Deivdy,Deivdy Reis Marques  ... R,P,182156 19 Sodre,Diogo Henrique Sodre,R P,303487
20,Cristiano,Cristiano Lopes R,P,172817 20 Caio,Antonio Caio Silva Sousa,R P,144165
21,Jacson,Jacson da Paixao Nep ... R,P,188619 21 Antonio Fl ...,Antonio Flavio Aires...,R P,183377
31,Pablo,Pablo Diogo Lopes de ... R,P,312907 22 Erick,Erick Luis Palma dos...,R P,333705
41,Jeferson,Jeferson Anti Filho R,P,295383,,,
"",,Comissão Técnica,
"",Oeste / SP,,Bragantino / SP
Tecnico:,Roberto Fernando Schneiger - 3324441,Tecnico:,Paulo Cesar Lopes De Gusmão - 053595310
Auxiliar Tecnico:,Renan Roberto De Freitas - 43.693.245-3,Auxiliar Tecnico:,Franco Rafael Muller - 8091626468
Medico:,Dr. Mario Sergio De Lucca Fabri - 156993/SP,Medico:,Dr. Rodrigo Aleixo Martins - 116.724
Preparador Fisico:,Fabiano Rinaldi - 003866-G/PR,Preparador Fisico:,Jorge Alberto Pinto Soter - 005113-G/RJ
Massagista:,Ocimar Manoel Barcelos - 22.857.778-0,Massagista:,Marcelo Jose Da Silva - 26.713.464
"",,,,,Gols,
Tempo,1T/2T,No,Tipo,Nome do Jogador,,Equipe
14:00,1T,9,NR,Joao Soares da Mota Neto,,Bragantino/SP
35:00,1T,10,NR,Roger Roberto dos Santos,,Oeste/SP
20:00,2T,10,NR,Roger Roberto dos Santos,,Oeste/SP
23:00,2T,11,NR,Sergio Ricardo dos Santos Junior,,Oeste/SP
33:00,2T,16,NR,Joao Denoni Junior,,Oeste/SP
"",,,,Substituições,
Tempo,1T/2T,,Equipe,Entrou,Saiu
45:00,INT,Oeste/SP,,18 - Wagner da Silva Souza,9 - Jose Fabio Santos de Oliv ...
34:00,1T,Oeste/SP,,16 - Joao Denoni Junior,8 - Kleber do Amaral Ribeiro
13:00,2T,Oeste/SP,,15 - Ramires dos Anjos Alves,5 - Leandro Domingos de Melo
13:00,2T,Bragantino/SP,,13 - Alexandre Moraes Bernardi ...,6 - Bruno Felipe de Abreu Bar ...
21:00,2T,Bragantino/SP,,15 - Roberto Santos da Silveir ...,2 - Samuel Henrique dos Santo ...
27:00,2T,Bragantino/SP,,20 - Antonio Caio Silva Sousa,8 - Magno Damasceno Santos da ...
