Campeonato:,Campeonato Brasileiro - Série A/2020,,Rodada:,38
Jogo:,Internacional / RS X Corinthians / SP,,,
Data:,25/02/2021 Horário: 21:30 Estádio:,José Pinheiro Borda / Porto Alegre,,
"",,Arbitragem
Arbitro:,Wilton Pereira Sampaio  (FIFA / GO),
Arbitro Assistente 1:,Fabricio Vilarinho da Silva (FIFA / GO),
Arbitro Assistente 2:,Bruno Raphael Pires (FIFA / GO),
Quarto Arbitro:,Roger Goulart (AB / RS),
Inspetor:,Jose Mocellin (CBF / RS),
Delegado Local:,Paulo Ricardo Machado Santos (CBF / ),
VAR:,Rodrigo Dalonso Ferreira (AB / SC),
AVAR1:,Felipe Fernandes de Lima (AB / MG),
AVAR2:,Johnny Barros de Oliveira (AB / SC),
"",,,Cronologia,,,
"",1o Tempo,,2o Tempo,,,
Entrada do mandante:,21:26Atraso:,,Não Houve Entrada do mandante: 22:32,,Atraso:,Não Houve
Entrada do visitante:,21:26Atraso:,,Não Houve Entrada do visitante: 22:34,,Atraso:,Não Houve
Início 1o Tempo:,21:30Atraso:,,Não Houve Início do 2o Tempo: 22:39,,Atraso:,3 min
Término do 1o Tempo:,22:21Acréscimo:,,6 min Término do 2o Tempo: 23:32,Acréscimo:,,8 min
Resultado do 1o Tempo: 0 X 0,,,Resultado Final: 0 X 0,,,
"",,,,,Relação de Jogadores,,,,
"",,Internacional / RS,,,,Corinthians / SP,,,
No,Apelido,Nome Completo T/R,,P/A,CBF No Apelido,Nome Completo T/R,,P/A,CBF
12,Marcelo,Marcelo Lomba do Nas ... T(g),,P,157264 12 Cássio,Cassio Ramos T(g),,P,166276
2,Heitor Rod ...,Heitor Rodrigues da  ... T,,P,464051 3 Jemerson,Jemerson de Jesus Na ... T,,P,335312
8,Edenilson,Edenilson Andrade do ... T,,P,306270 4 Gil,Carlos Gilberto do N ... T,,P,178854
11,Yuri Alberto,Yuri Alberto Monteir ... T,,P,436395 8 Ramiro,Ramiro Moschen Benetti T,,P,295418
13,Rodrigo Do ...,Rodrigo Dourado Cunha T,,P,296330 10 Cazares,Juan Ramon Cazares S ... T,,P,540839
14,Lucas Ribeiro,Lucas Ribeiro dos Santos T,,P,540238 11 Otero,Romulo Otero Vasquez T,,P,554728
15,Victor Cuesta,Victor Leandro Cuesta T,,P,567555 14 Bruno Mendez,Bruno Mendez Cittadini T,,P,648335
20,Moises,Moises Roberto Barbosa T,,P,318481 24 Cantillo,Victor Danilo Cantil ... T,,P,691641
45,Praxedes,Bruno Conceicao Praxedes T,,P,541788 26 Fabio Santos,Fabio Santos Romeu T,,P,162248
47,Caio,Caio Vidal Rocha T,,P,442105 29 Roni,Roni Medeiros de Moura T,,P,387432
88,Patrick,Patrick Bezerra do N ... T,,P,315585 77 Jo,Joao Alves de Assis Silva T,,P,162504
1,Danilo Fer ...,Danilo Fernandes Batista R(g),,P,165830 27 Walter,Walter Leandro Capel ... R(g),,P,177853
6,Uendel,Uendel Pereira Goncalves R,,P,175320 6 Piton,Lucas Piton Crivellaro R,,P,439689
17,Thiago Gal ...,Thiago Galhardo do N ... R,,P,189822 16 Matheus Ar ...,Matheus de Araujo Andrade R,,P,545392
18,Leandro,Leandro Miguel Fernandez R,,P,701189 17 Cauê,Caue Vinicius dos Santos R,,P,582600
19,Rodrigo,Rodrigo Oliveira Lindoso R,,P,184455 18 Leo,Leonardo Natel Vieira R,,P,435371
27,Mauricio,Mauricio Magalhaes Prado R,,P,542337 20 Camacho,Guilherme de Aguiar  ... R,,P,183873
30,Joao Lucas,Joao Lucas de Souza  ... R,,P,516798 21 Angelo Araos,Angelo Giovani Araos ... R,,P,633271
31,João Peglow,Joao Gabriel Martins ... R,,P,520239 22 Mateus,Mateus da Silva Vita ... R,,P,405246
33,Nonato,Gustavo Nonato Santana R,,P,337363 25 Marllon,Marllon Goncalves Je ... R,,P,299840
35,Gabriel,Jose Gabriel dos San ... R,,P,372403 34 Raul,Raul Gustavo Pereira ... R,,P,509667
38,Lucas,Lucas Henrique Mazetti R,,P,441662 38 Gabriel,Gabriel Pereira dos  ... R,,P,542398
99,Abel,Abel Mathias Hernand ... R,,P,701161 39 Xavier,João Vitor Xavier de ... R,,P,523897
No,Apelido,Nome Completo T/R,,P/A,CBF,No,Apelido,Nome Completo T/R,,P/A,CBF
12,Marcelo,Marcelo Lomba do Nas ... T(g),,P,157264,12,Cássio,Cassio Ramos T(g),,P,166276
2,Heitor Rod ...,Heitor Rodrigues da  ... T,,P,464051,3,Jemerson,Jemerson de Jesus Na ... T,,P,335312
8,Edenilson,Edenilson Andrade do ... T,,P,306270,4,Gil,Carlos Gilberto do N ... T,,P,178854
11,Yuri Alberto,Yuri Alberto Monteir ... T,,P,436395,8,Ramiro,Ramiro Moschen Benetti T,,P,295418
13,Rodrigo Do ...,Rodrigo Dourado Cunha T,,P,296330,10,Cazares,Juan Ramon Cazares S ... T,,P,540839
14,Lucas Ribeiro,Lucas Ribeiro dos Santos T,,P,540238,11,Otero,Romulo Otero Vasquez T,,P,554728
15,Victor Cuesta,Victor Leandro Cuesta T,,P,567555,14,Bruno Mendez,Bruno Mendez Cittadini T,,P,648335
20,Moises,Moises Roberto Barbosa T,,P,318481,24,Cantillo,Victor Danilo Cantil ... T,,P,691641
45,Praxedes,Bruno Conceicao Praxedes T,,P,541788,26,Fabio Santos,Fabio Santos Romeu T,,P,162248
47,Caio,Caio Vidal Rocha T,,P,442105,29,Roni,Roni Medeiros de Moura T,,P,387432
88,Patrick,Patrick Bezerra do N ... T,,P,315585,77,Jo,Joao Alves de Assis Silva T,,P,162504
1,Danilo Fer ...,Danilo Fernandes Batista R(g),,P,165830,27,Walter,Walter Leandro Capel ... R(g),,P,177853
6,Uendel,Uendel Pereira Goncalves R,,P,175320,6,Piton,Lucas Piton Crivellaro R,,P,439689
17,Thiago Gal ...,Thiago Galhardo do N ... R,,P,189822,16,Matheus Ar ...,Matheus de Araujo Andrade R,,P,545392
18,Leandro,Leandro Miguel Fernandez R,,P,701189,17,Cauê,Caue Vinicius dos Santos R,,P,582600
19,Rodrigo,Rodrigo Oliveira Lindoso R,,P,184455,18,Leo,Leonardo Natel Vieira R,,P,435371
27,Mauricio,Mauricio Magalhaes Prado R,,P,542337,20,Camacho,Guilherme de Aguiar  ... R,,P,183873
30,Joao Lucas,Joao Lucas de Souza  ... R,,P,516798,21,Angelo Araos,Angelo Giovani Araos ... R,,P,633271
31,João Peglow,Joao Gabriel Martins ... R,,P,520239,22,Mateus,Mateus da Silva Vita ... R,,P,405246
33,Nonato,Gustavo Nonato Santana R,,P,337363,25,Marllon,Marllon Goncalves Je ... R,,P,299840
35,Gabriel,Jose Gabriel dos San ... R,,P,372403,34,Raul,Raul Gustavo Pereira ... R,,P,509667
38,Lucas,Lucas Henrique Mazetti R,,P,441662,38,Gabriel,Gabriel Pereira dos  ... R,,P,542398
99,Abel,Abel Mathias Hernand ... R,,P,701161,39,Xavier,João Vitor Xavier de ... R,,P,523897
"",,Comissão Técnica,
"",Internacional / RS,,Corinthians / SP
Técnico:,Abel Carlos Da Silva Braga,Técnico:,Vagner Carmo Mancini
Auxiliar Técnico:,Leomir De Souza,Auxiliar Técnico:,Anderson Luis Da Silva
Médico:,Carlos Henrique Poisl Junior,Médico:,Julio Stancati Filho
Treinador De Goleiros:,Daniel Da Fonseca Pavan,Treinador De Goleiros:,Marcelo Flain Carpes
Preparador Físico:,Cristiano Garcia Nunes,Preparador Físico:,Flavio Henrique De Oliveira
Massagista:,Paulo Renato Aviz Da Silva,Massagista:,Cleber Costa De Souza
"",,,Substituições,
Tempo,1T/2T,Equipe,Entrou,Saiu
40:00,1T,Internacional/RS,19 - Rodrigo Oliveira Lindoso,13 - Rodrigo Dourado Cunha
24:00,2T,Internacional/RS,99 - Abel Mathias Hernandez Platero,11 - Yuri Alberto Monteiro da Silva
24:00,2T,Internacional/RS,17 - Thiago Galhardo do Nasciment...,45 - Bruno Conceicao Praxedes
26:00,2T,Corinthians/SP,18 - Leonardo Natel Vieira,11 - Romulo Otero Vasquez
26:00,2T,Corinthians/SP,22 - Mateus da Silva Vital Assump...,29 - Roni Medeiros de Moura
31:00,2T,Corinthians/SP,39 - João Vitor Xavier de Almeida,8 - Ramiro Moschen Benetti
31:00,2T,Corinthians/SP,20 - Guilherme de Aguiar Camacho,24 - Victor Danilo Cantillo Jimenez
33:00,2T,Internacional/RS,31 - Joao Gabriel Martins Peglow,47 - Caio Vidal Rocha
33:00,2T,Internacional/RS,38 - Lucas Henrique Mazetti,2 - Heitor Rodrigues da Fonseca
36:00,2T,Corinthians/SP,25 - Marllon Goncalves Jeronimo B...,14 - Bruno Mendez Cittadini
