Campeonato:,Campeonato Brasileiro - Série A/2020,,Rodada:,27
Jogo:,Bahia / BA X Internacional / RS,,,
Data:,27/12/2020 Horário: 16:00 Estádio:,Octávio Mangabeira / Salvador,,
"",Arbitragem
Arbitro:,Paulo Roberto Alves Junior (AB / PR)
Arbitro Assistente 1:,Rafael Trombeta (AB / PR)
Arbitro Assistente 2:,Victor Hugo Imazu dos Santos (AB / PR)
Quarto Arbitro:,Ricarle Gustavo Gonçalves Batista (CD / BA)
Inspetor:,Manoel Serapiao Filho (CBF / BA)
VAR:,Elmo Alves Resende Cunha (MTR / GO)
AVAR1:,Antonio Dib Moraes de Sousa (AB / PI)
AVAR2:,Ciro Chaban Junqueira (AB / DF)
Operador de replay 2:,Maria Modenko (AB / BA)
"",,,Cronologia,,,
"",1o Tempo,,2o Tempo,,,
Entrada do mandante:,15:54Atraso:,,Não Houve Entrada do mandante: 17:02,,Atraso:,Não Houve
Entrada do visitante:,15:55Atraso:,,Não Houve Entrada do visitante: 17:02,,Atraso:,Não Houve
Início 1o Tempo:,16:00Atraso:,,Não Houve Início do 2o Tempo: 17:06,,Atraso:,2 min
Término do 1o Tempo:,16:49Acréscimo:,,4 min Término do 2o Tempo: 17:56,Acréscimo:,,5 min
Resultado do 1o Tempo: 0 X 1,,,Resultado Final: 1 X 2,,,
"",,,,,Relação de Jogadores,,,,
"",,Bahia / BA,,,,Internacional / RS,,,
No,Apelido,Nome Completo,T/R,P/A,CBF No Apelido,Nome Completo T/R,,P/A,CBF
1,Douglas Fr ...,Douglas Alan Schuck  ...,T(g),P,182717 1 Danilo Fer ...,Danilo Fernandes Batista T(g),,P,165830
2,Nino Paraiba,Severino do Ramo Cle ...,T,P,183977 6 Uendel,Uendel Pereira Goncalves T,,P,175320
9,Gilberto,Gilberto Oliveira So ...,T,P,185444 8 Edenilson,Edenilson Andrade do ... T,,P,306270
11,Rossi,Rosicley Pereira da Silva,T,P,314059 13 Rodrigo Do ...,Rodrigo Dourado Cunha T,,P,296330
14,Ernando,Ernando Rodrigues Lopes,T,P,178875 14 Lucas Ribeiro,Lucas Ribeiro dos Santos T,,P,540238
15,Indio,Juan Pablo Ramirez V ...,T,P,706844 15 Victor Cuesta,Victor Leandro Cuesta T,,P,567555
16,Ronaldo,Ronaldo da Silva Souza,T,P,405698 17 Thiago Gal ...,Thiago Galhardo do N ... T,,P,189822
21,Alesson,Alesson dos Santos B ...,T,P,443663 22 Rodinei,Rodinei Marcelo de A ... T,,P,353568
26,Gregore,Gregore de Magalhaes ...,T,P,314357 45 Praxedes,Bruno Conceicao Praxedes T,,P,541788
29,J. Capixaba,Luis Antonio da Roch ...,T,P,402681 47 Caio,Caio Vidal Rocha T,,P,442105
40,Juninho,Jose Carlos Ferreira ...,T,P,378851 88 Patrick,Patrick Bezerra do N ... T,,P,315585
77,Mateus Claus,Mateus Eduardo Claus R(g),,P,350716 42 Daniel,Daniel de Sousa Brito R(g),,P,331033
4,Anderson,Anderson Vieira Martins,R,P,166258 2 Heitor Rod ...,Heitor Rodrigues da  ... R,,P,464051
25,Clayson,Clayson Henrique da  ...,R,P,376734 11 Yuri Alberto,Yuri Alberto Monteir ... R,,P,436395
30,Marco Antonio,Marco Antonio Rosa F ...,R,P,518590 18 Leandro,Leandro Miguel Fernandez R,,P,701189
32,Matheus Te ...,Matheus Henrique Teixeira,R,P,415232 19 Rodrigo,Rodrigo Oliveira Lindoso R,,P,184455
35,Edson,Edson Fernando da Si ...,R,P,454737 23 Marcos Gui ...,Marcos Guilherme de  ... R,,P,295821
39,Gabriel No ...,Gabriel Novaes Fernandes,R,P,389034 27 Mauricio,Mauricio Magalhaes Prado R,,P,542337
70,Fessin,Jefferson Gabriel Na ...,R,P,538843 31 João Peglow,Joao Gabriel Martins ... R,,P,520239
72,Everson Bispo,Everson Bispo Pereira,R,P,451459 33 Nonato,Gustavo Nonato Santana R,,P,337363
79,Matheus Bahia Matheus Bahia Santos,,R,P,431101 35 Gabriel,Jose Gabriel dos San ... R,,P,372403
"",,,,,36 Leonardo,Leonardo Borges da Silva R,,P,529339
"",,,,,99 Abel,Abel Mathias Hernand ... R,,P,701161
No,Apelido Nome Completo,,T/R,P/A,CBF,No,Apelido,Nome Completo T/R,,P/A,CBF
1,Douglas Fr ... Douglas Alan Schuck  ...,,T(g),P,182717,1,Danilo Fer ...,Danilo Fernandes Batista T(g),,P,165830
2,Nino Paraiba Severino do Ramo Cle ...,,T,P,183977,6,Uendel,Uendel Pereira Goncalves T,,P,175320
9,Gilberto Gilberto Oliveira So ...,,T,P,185444,8,Edenilson,Edenilson Andrade do ... T,,P,306270
11,Rossi Rosicley Pereira da Silva,,T,P,314059,13,Rodrigo Do ...,Rodrigo Dourado Cunha T,,P,296330
14,Ernando Ernando Rodrigues Lopes,,T,P,178875,14,Lucas Ribeiro,Lucas Ribeiro dos Santos T,,P,540238
15,Indio Juan Pablo Ramirez V ...,,T,P,706844,15,Victor Cuesta,Victor Leandro Cuesta T,,P,567555
16,Ronaldo Ronaldo da Silva Souza,,T,P,405698,17,Thiago Gal ...,Thiago Galhardo do N ... T,,P,189822
21,Alesson Alesson dos Santos B ...,,T,P,443663,22,Rodinei,Rodinei Marcelo de A ... T,,P,353568
26,Gregore Gregore de Magalhaes ...,,T,P,314357,45,Praxedes,Bruno Conceicao Praxedes T,,P,541788
29,J. Capixaba Luis Antonio da Roch ...,,T,P,402681,47,Caio,Caio Vidal Rocha T,,P,442105
40,Juninho Jose Carlos Ferreira ...,,T,P,378851,88,Patrick,Patrick Bezerra do N ... T,,P,315585
77,Mateus Claus Mateus Eduardo Claus,R(g),,P,350716,42,Daniel,Daniel de Sousa Brito R(g),,P,331033
4,Anderson Anderson Vieira Martins,,R,P,166258,2,Heitor Rod ...,Heitor Rodrigues da  ... R,,P,464051
25,Clayson Clayson Henrique da  ...,,R,P,376734,11,Yuri Alberto,Yuri Alberto Monteir ... R,,P,436395
30,Marco Antonio Marco Antonio Rosa F ...,,R,P,518590,18,Leandro,Leandro Miguel Fernandez R,,P,701189
32,Matheus Te ... Matheus Henrique Teixeira,,R,P,415232,19,Rodrigo,Rodrigo Oliveira Lindoso R,,P,184455
35,Edson Edson Fernando da Si ...,,R,P,454737,23,Marcos Gui ...,Marcos Guilherme de  ... R,,P,295821
39,Gabriel No ... Gabriel Novaes Fernandes,,R,P,389034,27,Mauricio,Mauricio Magalhaes Prado R,,P,542337
70,Fessin Jefferson Gabriel Na ...,,R,P,538843,31,João Peglow,Joao Gabriel Martins ... R,,P,520239
72,Everson Bispo Everson Bispo Pereira,,R,P,451459,33,Nonato,Gustavo Nonato Santana R,,P,337363
79,Matheus Bahia Matheus Bahia Santos,,R,P,431101,35,Gabriel,Jose Gabriel dos San ... R,,P,372403
"",,,,,,36,Leonardo,Leonardo Borges da Silva R,,P,529339
"",,,,,,99,Abel,Abel Mathias Hernand ... R,,P,701161
"",,Comissão Técnica,
"",Bahia / BA,,Internacional / RS
Técnico:,Luiz Eduardo Barros Cavalcanti,Técnico:,Abel Carlos Da Silva Braga
Auxiliar Técnico:,Pedro Faria Gama,Auxiliar Técnico:,Leomir De Souza
Médico:,Rodrigo Daniel Sousa,Médico:,Carlos Henrique Poisl Junior
Treinador De Goleiros:,Rogerio Alves De Lima,Treinador De Goleiros:,Daniel Da Fonseca Pavan
Preparador Físico:,Luiz Fernando De Andrade Teixeira,Preparador Físico:,Cristiano Garcia Nunes
Massagista:,Sergio Dos Santos Sales,Massagista:,Paulo Renato Aviz Da Silva
"",,,,,Gols,
Tempo,1T/2T,No,Tipo,Nome do Jogador,,Equipe
45:00,1T,13,NR,Rodrigo Dourado Cunha,,Internacional/RS
03:00,2T,17,PN,Thiago Galhardo do Nascimento Rocha,,Internacional/RS
23:00,2T,15,NR,Juan Pablo Ramirez Velasquez,,Bahia/BA
"",,,,Cartões Amarelos
Tempo,1T/2T,No,Nome do Jogador,Equipe
25:00,1T,40,Jose Carlos Ferreira Junior,Bahia/BA
"",,,Motivo: A1.3.  Cometer uma falta tática para impedir um ataque promissor - Por calçar seu adversário cometendo uma falta tática,
"",,,impedindo um ataque promissor.,
"",,,,Substituições,
Tempo,1T/2T,,Equipe,Entrou,Saiu
17:00,2T,Bahia/BA,,39 - Gabriel Novaes Fernandes,11 - Rosicley Pereira da Silva
17:00,2T,Bahia/BA,,25 - Clayson Henrique da Silva Vi...,21 - Alesson dos Santos Batista
27:00,2T,Internacional/RS,,11 - Yuri Alberto Monteiro da Silva,47 - Caio Vidal Rocha
31:00,2T,Internacional/RS,,19 - Rodrigo Oliveira Lindoso,13 - Rodrigo Dourado Cunha
39:00,2T,Internacional/RS,,99 - Abel Mathias Hernandez Platero,17 - Thiago Galhardo do Nasciment...
39:00,2T,Bahia/BA,,30 - Marco Antonio Rosa Furtado J...,16 - Ronaldo da Silva Souza
39:00,2T,Internacional/RS,,33 - Gustavo Nonato Santana,45 - Bruno Conceicao Praxedes
40:00,2T,Bahia/BA,,70 - Jefferson Gabriel Nascimento...,15 - Juan Pablo Ramirez Velasquez
