Campeonato:,Campeonato Brasileiro - Série A/2020,,Rodada:,37
Jogo:,Goiás / GO X Red Bull Bragantino / SP,,,
Data:,21/02/2021 Horário: 20:30 Estádio:,Hailé Pinheiro / Goiania,,
"",Arbitragem
Arbitro:,Jean Pierre Goncalves Lima (AB / RS)
Arbitro Assistente 1:,Leirson Peng Martins (AB / RS)
Arbitro Assistente 2:,Lucio Beiersdorf Flor (AB / RS)
Quarto Arbitro:,Anderson Ribeiro Gonçalves (CD / GO)
Delegado Local:,Adalberto Grecco (CBF / GO)
Analista de Campo:,Cleiber Elias Leite (CBF / GO)
VAR:,Rafael Traci (FIFA / SC)
AVAR1:,Vinicius Gomes do Amaral (AB / RS)
AVAR2:,Alex dos Santos (AB / SC)
"",,,Cronologia,,,
"",1o Tempo,,2o Tempo,,,
Entrada do mandante:,20:20Atraso:,,Não Houve Entrada do mandante: 21:29,,Atraso:,Não Houve
Entrada do visitante:,20:20Atraso:,,Não Houve Entrada do visitante: 21:29,,Atraso:,Não Houve
Início 1o Tempo:,20:30Atraso:,,Não Houve Início do 2o Tempo: 21:32,,Atraso:,Não Houve
Término do 1o Tempo:,21:17Acréscimo:,,2 min Término do 2o Tempo: 22:22,Acréscimo:,,5 min
Resultado do 1o Tempo: 0 X 0,,,Resultado Final: 0 X 0,,,
"",,,,,Relação de Jogadores,,,
"",,Goiás / GO,,,,Red Bull Bragantino / SP,,
No,Apelido,Nome Completo T/R,,P/A,CBF No Apelido,Nome Completo T/R,P/A,CBF
88,Rangel,Marcelo Rangel Rosa T(g),,P,186722 40 Cleiton,Cleiton Schwengber T(g),P,384823
3,David Duarte,David de Duarte Macedo T,,P,348537 4 Ligger,Ligger Moreira Malaquias T,P,291797
9,Rafael Moura,Rafael Martiniano de ... T,,P,151437 7 Artur,Artur Victor Guimaraes T,P,419646
13,Jefferson  ...,Jefferson Junio Anto ... T,,P,400906 10 Claudinho,Claudio Luiz Rodrigu ... T,P,339209
15,Heron,Heron Crespo da Silva T,,P,533689 13 Aderlan,Aderlan de Lima Silva T,P,291939
17,Shaylon,Shaylon Kallyson Cardozo T,,P,421138 14 Fabricio B ...,Fabricio Bruno Soare ... T,P,389228
27,Fabio Sanches Fabio Pizarro Sanches,T,,P,186135 15 Ytalo,Ytalo Jose Oliveira  ... T,P,169945
44,Henrique,Henrique Lordelo Sou ... T,,P,509064 23 Raul,Raul Lo Goncalves T,P,446399
70,Vinicius L ...,Vinicius Lopes da Silva T,,P,543767 25 Ricardo,Ricardo Ryller Ribei ... T,P,428406
80,Miguel Fig ...,Miguel Ferreira Damasceno T,,P,529621 31 Vitinho,Victor Hugo Santana  ... T,P,409125
99,Fernandao,Jose Fernando Viana  ... T,,P,188453 36 Luan Candido,Luan Candido de Almeida T,P,540157
23,Tadeu,Tadeu Antonio Ferreira R(g),,P,308316 1 Julio Cesar,Julio Cesar de Souza ... R(g),P,150963
4,Iago Mendo ...,Iago Pereira Mendonça R,,P,463995 2 Léo Realpe,Leonardo Javier Real ... R,P,691587
5,Breno,Breno Washington Rod ... R,,P,567913 6 Edimar,Edimar Curitiba Fraga R,P,163254
10,Índio,Eduardo Figueiredo d ... R,,P,539272 16 Eric Ramires,Eric dos Santos Rodrigues R,P,521939
11,SANDRINHO,Sandro Diego de Mora ... R,,P,613895 17 Weverton,Weverton Guilherme d ... R,P,537549
16,Ariel Cabral,Alejandro Ariel Cabral R,,P,535421 18 Chrigor,Chrigor Flores Moraes R,P,581594
21,Daniel,Daniel de Pauli Oliveira R,,P,459004 22 Leandro,Leandro Henrique do  ... R,P,409664
32,Taylon,Taylon Vinicius dos  ... R,,P,539681 28 Cuello,Tomas Esteban Cuello R,P,695547
38,Gustavinho,Gustavo Luis Silva Aguiar R,,P,536569 33 Jan Hurtado,Jan Carlos Hurtado A ... R,P,700808
55,Chico,Luis Francisco Grando R,,P,169890 34 Weverson,Weverson Moreira da Costa R,P,464293
95,Douglas Ba ...,Douglas Baggio de Ol ... R,,P,363149 35 Lucas,Lucas Evangelista Sa ... R,P,345109
No,Apelido Nome Completo,T/R,,P/A,CBF,No,Apelido,Nome Completo T/R,,P/A,CBF
88,Rangel Marcelo Rangel Rosa,T(g),,P,186722,40,Cleiton,Cleiton Schwengber T(g),,P,384823
3,David Duarte David de Duarte Macedo,T,,P,348537,4,Ligger,Ligger Moreira Malaquias T,,P,291797
9,Rafael Moura Rafael Martiniano de ...,T,,P,151437,7,Artur,Artur Victor Guimaraes T,,P,419646
13,Jefferson  ... Jefferson Junio Anto ...,T,,P,400906,10,Claudinho,Claudio Luiz Rodrigu ... T,,P,339209
15,Heron Heron Crespo da Silva,T,,P,533689,13,Aderlan,Aderlan de Lima Silva T,,P,291939
17,Shaylon Shaylon Kallyson Cardozo,T,,P,421138,14,Fabricio B ...,Fabricio Bruno Soare ... T,,P,389228
27,Fabio Sanches Fabio Pizarro Sanches,T,,P,186135,15,Ytalo,Ytalo Jose Oliveira  ... T,,P,169945
44,Henrique Henrique Lordelo Sou ...,T,,P,509064,23,Raul,Raul Lo Goncalves T,,P,446399
70,Vinicius L ... Vinicius Lopes da Silva,T,,P,543767,25,Ricardo,Ricardo Ryller Ribei ... T,,P,428406
80,Miguel Fig ... Miguel Ferreira Damasceno,T,,P,529621,31,Vitinho,Victor Hugo Santana  ... T,,P,409125
99,Fernandao Jose Fernando Viana  ...,T,,P,188453,36,Luan Candido,Luan Candido de Almeida T,,P,540157
23,Tadeu Tadeu Antonio Ferreira,R(g),,P,308316,1,Julio Cesar,Julio Cesar de Souza ... R(g),,P,150963
4,Iago Mendo ... Iago Pereira Mendonça,R,,P,463995,2,Léo Realpe,Leonardo Javier Real ... R,,P,691587
5,Breno Breno Washington Rod ...,R,,P,567913,6,Edimar,Edimar Curitiba Fraga R,,P,163254
10,Índio Eduardo Figueiredo d ...,R,,P,539272,16,Eric Ramires,Eric dos Santos Rodrigues R,,P,521939
11,SANDRINHO Sandro Diego de Mora ...,R,,P,613895,17,Weverton,Weverton Guilherme d ... R,,P,537549
16,Ariel Cabral Alejandro Ariel Cabral,R,,P,535421,18,Chrigor,Chrigor Flores Moraes R,,P,581594
21,Daniel Daniel de Pauli Oliveira,R,,P,459004,22,Leandro,Leandro Henrique do  ... R,,P,409664
32,Taylon Taylon Vinicius dos  ...,R,,P,539681,28,Cuello,Tomas Esteban Cuello R,,P,695547
38,Gustavinho Gustavo Luis Silva Aguiar,R,,P,536569,33,Jan Hurtado,Jan Carlos Hurtado A ... R,,P,700808
55,Chico Luis Francisco Grando,R,,P,169890,34,Weverson,Weverson Moreira da Costa R,,P,464293
95,Douglas Ba ... Douglas Baggio de Ol ...,R,,P,363149,35,Lucas,Lucas Evangelista Sa ... R,,P,345109
"",,Comissão Técnica,
"",Goiás / GO,,Red Bull Bragantino / SP
Técnico:,Glauber Ramos Da Silva,Técnico:,Mauricio Nogueira Barbieri
Auxiliar Técnico:,Augusto Pedro De Souza,Auxiliar Técnico:,Claudio Andres Del Transito Maldonado Rivera
Médico:,Bruno Rafael Silva Favaron,Médico:,Ricardo Guilherme Eid
Treinador De Goleiros:,Marlos Gomes Santos,Treinador De Goleiros:,Rodrigo Guido Bruns
Preparador Físico:,Leandro Campos Borges,Preparador Físico:,Reverson Bastos Pimentel
Fisioterapeuta:,Marcos Vinicius De Souza Duarte,Massagista:,Augusto Luis Boschi Riboldi
"",,,,Substituições,
Tempo,1T/2T,,Equipe,Entrou,Saiu
45:00,INT,Goiás/GO,,21 - Daniel de Pauli Oliveira,15 - Heron Crespo da Silva
09:00,2T,Red Bull Bragantino/SP,,35 - Lucas Evangelista Santana de...,25 - Ricardo Ryller Ribeiro Lino ...
23:00,2T,Goiás/GO,,38 - Gustavo Luis Silva Aguiar,70 - Vinicius Lopes da Silva
23:00,2T,Goiás/GO,,10 - Eduardo Figueiredo da Cruz,80 - Miguel Ferreira Damasceno
26:00,2T,Red Bull Bragantino/SP,,16 - Eric dos Santos Rodrigues,31 - Victor Hugo Santana Carvalho
36:00,2T,Goiás/GO,,4 - Iago Pereira Mendonça,44 - Henrique Lordelo Souza de Ol...
40:00,2T,Goiás/GO,,95 - Douglas Baggio de Oliveira C...,13 - Jefferson Junio Antonio da S...
44:00,2T,Red Bull Bragantino/SP,,33 - Jan Carlos Hurtado Anchico,15 - Ytalo Jose Oliveira dos Santos
44:00,2T,Red Bull Bragantino/SP,,22 - Leandro Henrique do Nascimento,13 - Aderlan de Lima Silva
