Campeonato:,Campeonato Brasileiro - Série A/2020,,Rodada:,26
Jogo:,Internacional / RS X Palmeiras / SP,,,
Data:,19/12/2020 Horário: 21:00 Estádio:,José Pinheiro Borda / Porto Alegre,,
"",,Arbitragem
Arbitro:,Savio Pereira Sampaio (AB / DF),
Arbitro Assistente 1:,Daniel Henrique da Silva Andrade (AB / DF),
Arbitro Assistente 2:,Jose Reinaldo Nascimento Junior (AB / DF),
Quarto Arbitro:,Daniel Nobre Bins (AB / RS),
Inspetor:,Jose Mocellin (CBF / RS),
Delegado Local:,Paulo Ricardo Machado Santos (CBF / ),
VAR:,Wagner Reway (MTR / PB),
AVAR1:,Marielson Alves Silva (AB / BA),
AVAR2:,Ciro Chaban Junqueira (AB / DF),
"",,,Cronologia,,,
"",1o Tempo,,2o Tempo,,,
Entrada do mandante:,20:55Atraso:,,Não Houve Entrada do mandante: 22:01,,Atraso:,Não Houve
Entrada do visitante:,20:56Atraso:,,Não Houve Entrada do visitante: 22:01,,Atraso:,Não Houve
Início 1o Tempo:,21:00Atraso:,,Não Houve Início do 2o Tempo: 22:03,,Atraso:,Não Houve
Término do 1o Tempo:,21:48Acréscimo:,,3 min Término do 2o Tempo: 22:53,Acréscimo:,,5 min
Resultado do 1o Tempo: 1 X 0,,,Resultado Final: 2 X 0,,,
"",,,,,Relação de Jogadores,,,,
"",,Internacional / RS,,,Palmeiras / SP,,,,
No,Apelido,Nome Completo T/R,,P/A,CBF No Apelido Nome Completo,T/R,,P/A,CBF
12,Marcelo,Marcelo Lomba do Nas ... T(g),,P,157264 21 Weverton Weverton Pereira da Silva,T(g),,P,169050
2,Heitor Rod ...,Heitor Rodrigues da  ... T,,P,464051 2 Marcos Rocha Marcos Luis Rocha Aquino,T,,P,176390
4,Moledo,Rodrigo Modesto da S ... T,,P,173551 13 Luan Garcia Luan Garcia Teixeira,T,,P,307406
8,Edenilson,Edenilson Andrade do ... T,,P,306270 14 Gustavo Sc ... Gustavo Henrique Fur ...,T,,P,313426
13,Rodrigo Do ...,Rodrigo Dourado Cunha T,,P,296330 15 GUSTAVO GOMGEuZstavo Raul Gomez P ...,T,,P,633571
15,Victor Cuesta,Victor Leandro Cuesta T,,P,567555 17 VINA Matias Nicolas Viña  ...,T,,P,694293
17,Thiago Gal ...,Thiago Galhardo do N ... T,,P,189822 20 Lucas Lima Lucas Rafael Araujo Lima,T,,P,331937
20,Moises,Moises Roberto Barbosa T,,P,318481 23 Raphael Veiga Raphael Cavalcante Veiga,T,,P,308405
45,Praxedes,Bruno Conceicao Praxedes T,,P,541788 25 Gabriel Me ... Gabriel Vinicius Menino,T,,P,501063
47,Caio,Caio Vidal Rocha T,,P,442105 28 Danilo Santos Danilo dos Santos de ...,T,,P,540357
88,Patrick,Patrick Bezerra do N ... T,,P,315585 29 Willian Willian Gomes de Siqueira,T,,P,166061
1,Danilo Fer ...,Danilo Fernandes Batista R(g),,P,165830 42 Jailson Jailson Marcelino do ...,R(g),,P,153229
6,Uendel,Uendel Pereira Goncalves R,,P,175320 3 Emerson Emerson Raymundo Santos R,,,P,348257
10,Dalessandro,Andres Nicolas Dales ... R,,P,299481 4 BENJAMIN Benjamin Kuscevic Ja ...,R,,P,706084
11,Yuri Alberto,Yuri Alberto Monteir ... R,,P,436395 8 Ze Rafael Jose Rafael Vivian,R,,P,330886
14,Lucas Ribeiro,Lucas Ribeiro dos Santos R,,P,540238 12 Mayke Mayke Rocha de Oliveira,R,,P,312950
18,Leandro,Leandro Miguel Fernandez R,,P,701189 16 Lucas Esteves Lucas Esteves Souza,R,,P,413352
19,Rodrigo,Rodrigo Oliveira Lindoso R,,P,184455 26 Renan Renan Victor da Silva,R,,P,551741
23,Marcos Gui ...,Marcos Guilherme de  ... R,,P,295821 27 Gabriel Veron Gabriel Veron Fonsec ...,R,,P,541921
31,João Peglow,Joao Gabriel Martins ... R,,P,520239 39 Breno Breno Henrique Vasco ...,R,,P,389378
33,Nonato,Gustavo Nonato Santana R,,P,337363 49 Gabriel Silva Gabriel Silva Vieira,R,,P,553046
38,Lucas,Lucas Henrique Mazetti R,,P,441662 72 Vinicius Vinicius Silvestre d ...,R,,P,308661
99,Abel,Abel Mathias Hernand ... R,,P,701161,,,,
No,Apelido,Nome Completo T/R,,P/A,CBF,No,Apelido Nome Completo,T/R,,P/A,CBF
12,Marcelo,Marcelo Lomba do Nas ... T(g),,P,157264,21,Weverton Weverton Pereira da Silva,T(g),,P,169050
2,Heitor Rod ...,Heitor Rodrigues da  ... T,,P,464051,2,Marcos Rocha Marcos Luis Rocha Aquino,T,,P,176390
4,Moledo,Rodrigo Modesto da S ... T,,P,173551,13,Luan Garcia Luan Garcia Teixeira,T,,P,307406
8,Edenilson,Edenilson Andrade do ... T,,P,306270,14,Gustavo Sc ... Gustavo Henrique Fur ...,T,,P,313426
13,Rodrigo Do ...,Rodrigo Dourado Cunha T,,P,296330,15,GUSTAVO GOMGEuZstavo Raul Gomez P ...,T,,P,633571
15,Victor Cuesta,Victor Leandro Cuesta T,,P,567555,17,VINA Matias Nicolas Viña  ...,T,,P,694293
17,Thiago Gal ...,Thiago Galhardo do N ... T,,P,189822,20,Lucas Lima Lucas Rafael Araujo Lima,T,,P,331937
20,Moises,Moises Roberto Barbosa T,,P,318481,23,Raphael Veiga Raphael Cavalcante Veiga,T,,P,308405
45,Praxedes,Bruno Conceicao Praxedes T,,P,541788,25,Gabriel Me ... Gabriel Vinicius Menino,T,,P,501063
47,Caio,Caio Vidal Rocha T,,P,442105,28,Danilo Santos Danilo dos Santos de ...,T,,P,540357
88,Patrick,Patrick Bezerra do N ... T,,P,315585,29,Willian Willian Gomes de Siqueira,T,,P,166061
1,Danilo Fer ...,Danilo Fernandes Batista R(g),,P,165830,42,Jailson Jailson Marcelino do ...,R(g),,P,153229
6,Uendel,Uendel Pereira Goncalves R,,P,175320,3,Emerson Emerson Raymundo Santos R,,,P,348257
10,Dalessandro,Andres Nicolas Dales ... R,,P,299481,4,BENJAMIN Benjamin Kuscevic Ja ...,R,,P,706084
11,Yuri Alberto,Yuri Alberto Monteir ... R,,P,436395,8,Ze Rafael Jose Rafael Vivian,R,,P,330886
14,Lucas Ribeiro,Lucas Ribeiro dos Santos R,,P,540238,12,Mayke Mayke Rocha de Oliveira,R,,P,312950
18,Leandro,Leandro Miguel Fernandez R,,P,701189,16,Lucas Esteves Lucas Esteves Souza,R,,P,413352
19,Rodrigo,Rodrigo Oliveira Lindoso R,,P,184455,26,Renan Renan Victor da Silva,R,,P,551741
23,Marcos Gui ...,Marcos Guilherme de  ... R,,P,295821,27,Gabriel Veron Gabriel Veron Fonsec ...,R,,P,541921
31,João Peglow,Joao Gabriel Martins ... R,,P,520239,39,Breno Breno Henrique Vasco ...,R,,P,389378
33,Nonato,Gustavo Nonato Santana R,,P,337363,49,Gabriel Silva Gabriel Silva Vieira,R,,P,553046
38,Lucas,Lucas Henrique Mazetti R,,P,441662,72,Vinicius Vinicius Silvestre d ...,R,,P,308661
99,Abel,Abel Mathias Hernand ... R,,P,701161,,,,,,
"",,Comissão Técnica,
"",Internacional / RS,,Palmeiras / SP
Técnico:,Abel Carlos Da Silva Braga,Técnico:,Abel Fernando Moreira Ferreira
Auxiliar Técnico:,Leomir De Souza,Auxiliar Técnico:,Vitor Ilidio Castanheiras Penas
Médico:,Rodrigo Hoffmeister Silva,Auxiliar Técnico:,Joao Miguel Barreto Martins
Treinador De Goleiros:,Daniel Da Fonseca Pavan,Médico:,Gilberto Amado Rodrigues Da Cunha Filho
Preparador Físico:,Cristiano Garcia Nunes,Preparador Físico:,Marco Aurelio Schiavo Reis
Massagista:,Paulo Renato Aviz Da Silva,Massagista:,Marcelo Massao Gondo
"",,,,,Gols,
Tempo,1T/2T,No,Tipo,Nome do Jogador,,Equipe
10:00,1T,8,NR,Edenilson Andrade dos Santos,,Internacional/RS
37:00,2T,11,NR,Yuri Alberto Monteiro da Silva,,Internacional/RS
"",,,Substituições,
Tempo,1T/2T,Equipe,Entrou,Saiu
45:00,INT,Palmeiras/SP,39 - Breno Henrique Vasconcelos L...,23 - Raphael Cavalcante Veiga
45:00,INT,Internacional/RS,11 - Yuri Alberto Monteiro da Silva,45 - Bruno Conceicao Praxedes
13:00,2T,Palmeiras/SP,27 - Gabriel Veron Fonseca de Souza,17 - Matias Nicolas Viña Susperre...
13:00,2T,Palmeiras/SP,12 - Mayke Rocha de Oliveira,2 - Marcos Luis Rocha Aquino
13:00,2T,Palmeiras/SP,8 - Jose Rafael Vivian,28 - Danilo dos Santos de Oliveira
25:00,2T,Internacional/RS,19 - Rodrigo Oliveira Lindoso,17 - Thiago Galhardo do Nasciment...
25:00,2T,Internacional/RS,23 - Marcos Guilherme de Almeida ...,47 - Caio Vidal Rocha
31:00,2T,Palmeiras/SP,49 - Gabriel Silva Vieira,20 - Lucas Rafael Araujo Lima
42:00,2T,Internacional/RS,14 - Lucas Ribeiro dos Santos,13 - Rodrigo Dourado Cunha
42:00,2T,Internacional/RS,10 - Andres Nicolas Dalessandro,88 - Patrick Bezerra do Nascimento
