Campeonato:,Campeonato Brasileiro - Série A/2020,,Rodada:,29
Jogo:,Vasco da Gama / RJ X Botafogo / RJ,,,
Data:,10/01/2021 Horário: 20:30 Estádio:,São Januário / Rio de Janeiro,,
"",,Arbitragem
Arbitro:,Raphael Claus (FIFA / SP),
Arbitro Assistente 1:,Marcelo Carvalho Van Gasse (FIFA / SP),
Arbitro Assistente 2:,Alex Ang Ribeiro (AB / SP),
Quarto Arbitro:,João Ennio Sobral (CD / RJ),
Inspetor:,Ricardo Mauricio Ferreira de Almeida (CBF / RJ),
Delegado Local:,Marcos Vinicio de Abreu Trindade (CBF / ),
VAR:,Rodrigo Guarizo Ferreira do Amaral (AB / SP),
AVAR1:,Elmo Alves Resende Cunha (MTR / GO),
AVAR2:,Fabricio Porfirio de Moura (AB / SP),
"",,,Cronologia,,,
"",1o Tempo,,2o Tempo,,,
Entrada do mandante:,20:26Atraso:,,Não Houve Entrada do mandante: 21:29,,Atraso:,Não Houve
Entrada do visitante:,20:25Atraso:,,Não Houve Entrada do visitante: 21:29,,Atraso:,Não Houve
Início 1o Tempo:,20:30Atraso:,,Não Houve Início do 2o Tempo: 21:31,,Atraso:,Não Houve
Término do 1o Tempo:,21:16Acréscimo:,,1 min Término do 2o Tempo: 22:22,Acréscimo:,,6 min
Resultado do 1o Tempo: 1 X 0,,,Resultado Final: 3 X 0,,,
"",,,,,Relação de Jogadores,,,,
"",,Vasco da Gama / RJ,,,,Botafogo / RJ,,,
No,Apelido,Nome Completo T/R,,P/A,CBF No Apelido,Nome Completo T/R,,P/A,CBF
1,Fernando M ...,Fernando Miguel KaufmannT(g),,P,159684 12 Diego Cava ...,Diego Cavalieri T(g),,P,137990
5,Leandro,Leandro Castan da Silva T,,P,164170 2 Kevin,Kevin Peterson dos S ... T,,P,502001
7,Gil,Leonardo Roque Albano Gil T,,P,704417 3 Victor,Victor Hugo Soares d ... T,,P,355418
11,Talles Magno,Talles Magno Bacelar ... T,,P,563898 6 Victor,Victor Luis Chuab Za ... T,,P,309431
14,German Cano,German Ezequiel Cano T,,P,691654 7 Rhuan da S ...,Rhuan da Silveira Castro T,,P,466025
18,Bruno Gomes,Bruno Gomes da Silva ... T,,P,526369 9 Pedro Raul,Pedro Raul Garay da Silva T,,P,502361
22,Yago,Glaybson Yago Souza  ... T,,P,364829 21 Romildo,Romildo Del Piage de ... T,,P,544673
34,Werley,Werley Ananias da Silva T,,P,172411 25 Warley,Warley Leandro da Silva T,,P,581767
37,Henrique,Henrique Silva Milagres T,,P,308965 30 David Sousa,David Sousa Albino T,,P,567849
41,Cayo,Cayo Henrique Nascim ... T,,P,435217 37 Kelvin,Kelvin Mateus de Oliveira T,,P,300791
50,Alexandre,Alexandre de Almeida ... T,,P,540274 50 Welison,José Welison da Silva T,,P,313780
56,Lucão,Lucas Alexandre Gald ... R(g),,P,523351 29 Diego,Diego Terra Loureiro R(g),,P,437115
2,Jacson,Jadson Cristiano Sil ... R,,P,334510 8 Kalou,Salomon Armand Maglo ... R,,P,700591
15,Andrey,Andrey Ramos do Nasc ... R,,P,404816 10 Bruno Nazario,Bruno dos Santos Nazario R,,P,314287
16,Caio Lopes,Caio Lopes da Costa  ... R,,P,526365 16 Gustavo Ca ...,Gustavo Cascardo de Assis R,,P,339292
17,Gabriel Fo ...,Gabriel Fortes Chaves R,,P,523349 17 Renteria,Carlos Enrique Rente ... R,,P,701108
20,Marcos Junior,Marcos Antonio Candi ... R,,P,420566 20 Alexander  ...,Alexander Lecaros Aragon R,,P,693058
23,Carlos Vin ...,Carlos Vinicios Sant ... R,,P,322321 28 Cicero,Cicero Santos R,,P,155840
27,Tiago Rodr ...,Tiago Rodrigues dos Reis R,,P,518160 34 Cesar,Cesar Coelho Campos  ... R,,P,524246
30,Marcelo,Marcelo Alves Santos R,,P,441866 38 Federico B ...,Federico Ricardo Bar ... R,,P,692836
33,Netinho,Vivaldo Borges dos S ... R,,P,426024 39 Matheus Na ...,Matheus Nascimento d ... R,,P,612641
38,Ygor,Ygor de Oliveira Ferreira R,,P,537477 40 Saulo,Saulo Ferreira Silva R,,P,345455
49,Vinicius,Vinicius dos Santos  ... R,,P,543481 43 Helerson,Helerson Mateus do N ... R,,P,352573
No,Apelido,Nome Completo T/R,,P/A,CBF,No,Apelido,Nome Completo T/R,,P/A,CBF
1,Fernando M ...,Fernando Miguel KaufmannT(g),,P,159684,12,Diego Cava ...,Diego Cavalieri T(g),,P,137990
5,Leandro,Leandro Castan da Silva T,,P,164170,2,Kevin,Kevin Peterson dos S ... T,,P,502001
7,Gil,Leonardo Roque Albano Gil T,,P,704417,3,Victor,Victor Hugo Soares d ... T,,P,355418
11,Talles Magno,Talles Magno Bacelar ... T,,P,563898,6,Victor,Victor Luis Chuab Za ... T,,P,309431
14,German Cano,German Ezequiel Cano T,,P,691654,7,Rhuan da S ...,Rhuan da Silveira Castro T,,P,466025
18,Bruno Gomes,Bruno Gomes da Silva ... T,,P,526369,9,Pedro Raul,Pedro Raul Garay da Silva T,,P,502361
22,Yago,Glaybson Yago Souza  ... T,,P,364829,21,Romildo,Romildo Del Piage de ... T,,P,544673
34,Werley,Werley Ananias da Silva T,,P,172411,25,Warley,Warley Leandro da Silva T,,P,581767
37,Henrique,Henrique Silva Milagres T,,P,308965,30,David Sousa,David Sousa Albino T,,P,567849
41,Cayo,Cayo Henrique Nascim ... T,,P,435217,37,Kelvin,Kelvin Mateus de Oliveira T,,P,300791
50,Alexandre,Alexandre de Almeida ... T,,P,540274,50,Welison,José Welison da Silva T,,P,313780
56,Lucão,Lucas Alexandre Gald ... R(g),,P,523351,29,Diego,Diego Terra Loureiro R(g),,P,437115
2,Jacson,Jadson Cristiano Sil ... R,,P,334510,8,Kalou,Salomon Armand Maglo ... R,,P,700591
15,Andrey,Andrey Ramos do Nasc ... R,,P,404816,10,Bruno Nazario,Bruno dos Santos Nazario R,,P,314287
16,Caio Lopes,Caio Lopes da Costa  ... R,,P,526365,16,Gustavo Ca ...,Gustavo Cascardo de Assis R,,P,339292
17,Gabriel Fo ...,Gabriel Fortes Chaves R,,P,523349,17,Renteria,Carlos Enrique Rente ... R,,P,701108
20,Marcos Junior,Marcos Antonio Candi ... R,,P,420566,20,Alexander  ...,Alexander Lecaros Aragon R,,P,693058
23,Carlos Vin ...,Carlos Vinicios Sant ... R,,P,322321,28,Cicero,Cicero Santos R,,P,155840
27,Tiago Rodr ...,Tiago Rodrigues dos Reis R,,P,518160,34,Cesar,Cesar Coelho Campos  ... R,,P,524246
30,Marcelo,Marcelo Alves Santos R,,P,441866,38,Federico B ...,Federico Ricardo Bar ... R,,P,692836
33,Netinho,Vivaldo Borges dos S ... R,,P,426024,39,Matheus Na ...,Matheus Nascimento d ... R,,P,612641
38,Ygor,Ygor de Oliveira Ferreira R,,P,537477,40,Saulo,Saulo Ferreira Silva R,,P,345455
49,Vinicius,Vinicius dos Santos  ... R,,P,543481,43,Helerson,Helerson Mateus do N ... R,,P,352573
"",,Comissão Técnica,
"",Vasco da Gama / RJ,,Botafogo / RJ
Técnico:,Vanderlei Luxemburgo Da Silva,Técnico:,Eduardo De Souza Barroca
Auxiliar Técnico:,Mauricio Almeida Copertino,Auxiliar Técnico:,Felipe Mercier De Lucena
Médico:,Victor Luiz Baitelli Leite,Médico:,Salvio Lucio De Almeida Magalhaes
Treinador De Goleiros:,Carlos Germano Schwambach Neto,Treinador De Goleiros:,Flavio De Britto Pereira Tenius
Preparador Físico:,Daniel Guimaraes Felix Da Silva,Preparador Físico:,Anderson Leal Gomes
Fisioterapeuta:,Alexandre Barbosa Da Silva,Massagista:,Reginaldo De Oliveira
"",,,,,Gols,
Tempo,1T/2T,No,Tipo,Nome do Jogador,,Equipe
21:00,1T,11,NR,Talles Magno Bacelar Martins,,Vasco da Gama/RJ
32:00,2T,15,NR,Andrey Ramos do Nascimento,,Vasco da Gama/RJ
+6,2T,22,PN,Glaybson Yago Souza Lisbôa,,Vasco da Gama/RJ
"",,,,Cartões Amarelos
Tempo,1T/2T,No,Nome do Jogador,Equipe
+06:00,2T,22,Glaybson Yago Souza Lisbôa,Vasco da Gama/RJ
"",,,Motivo: A8.4.  Tirar a camisa por cima de sua cabeça ou cobri-la com a camisa - Por tirar a camisa para comemorar um gol.,
"",,,,Substituições,
Tempo,1T/2T,,Equipe,Entrou,Saiu
45:00,INT,Botafogo/RJ,,8 - Salomon Armand Magloire Kalou,7 - Rhuan da Silveira Castro
45:00,INT,Botafogo/RJ,,10 - Bruno dos Santos Nazario,25 - Warley Leandro da Silva
08:00,2T,Botafogo/RJ,,28 - Cicero Santos,21 - Romildo Del Piage de Souza
21:00,2T,Botafogo/RJ,,20 - Alexander Lecaros Aragon,37 - Kelvin Mateus de Oliveira
21:00,2T,Vasco da Gama/RJ,,15 - Andrey Ramos do Nascimento,50 - Alexandre de Almeida Silva J...
29:00,2T,Vasco da Gama/RJ,,2 - Jadson Cristiano Silva de Mo...,41 - Cayo Henrique Nascimento Fer...
29:00,2T,Vasco da Gama/RJ,,16 - Caio Lopes da Costa Schoell,7 - Leonardo Roque Albano Gil
31:00,2T,Botafogo/RJ,,38 - Federico Ricardo Barrandeguy...,2 - Kevin Peterson dos Santos Si...
40:00,2T,Vasco da Gama/RJ,,20 - Marcos Antonio Candido Ferre...,18 - Bruno Gomes da Silva Clevela...
40:00,2T,Vasco da Gama/RJ,,17 - Gabriel Fortes Chaves,11 - Talles Magno Bacelar Martins
