Campeonato:,Campeonato Brasileiro - Série A/2020,,Rodada:,19
Jogo:,Palmeiras / SP X Atlético / MG,,,
Data:,02/11/2020 Horário: 17:00 Estádio:,Allianz Parque / Sao Paulo,,
"",Arbitragem
Arbitro:,Braulio da Silva Machado (FIFA / SC)
Arbitro Assistente 1:,Kleber Lucio Gil (FIFA / SC)
Arbitro Assistente 2:,Éder Alexandre (AB / SC)
Quarto Arbitro:,Thiago Luis Scarascati (CD / SP)
Delegado Local:,Marcus Vinicius de Hollanda Montemor Mollo (FD / SP)
Analista de Campo:,Marcelo Rogério (CBF / SP)
VAR:,Rodrigo Dalonso Ferreira (AB / SC)
AVAR1:,William Machado Steffen (AB / SC)
AVAR2:,Thiaggo Americano Labes (AB / SC)
"",,,Cronologia,,,
"",1o Tempo,,2o Tempo,,,
Entrada do mandante:,16:50Atraso:,,Não Houve Entrada do mandante: 17:59,,Atraso:,Não Houve
Entrada do visitante:,16:50Atraso:,,Não Houve Entrada do visitante: 17:58,,Atraso:,Não Houve
Início 1o Tempo:,17:00Atraso:,,Não Houve Início do 2o Tempo: 18:01,,Atraso:,Não Houve
Término do 1o Tempo:,17:46Acréscimo:,,1 min Término do 2o Tempo: 18:50,Acréscimo:,,4 min
Resultado do 1o Tempo: 1 X 0,,,Resultado Final: 3 X 0,,,
"",,,,,Relação de Jogadores,,,,
"",,Palmeiras / SP,,,Atlético / MG,,,,
No,Apelido,Nome Completo T/R,,P/A,CBF No Apelido Nome Completo,,T/R,P/A,CBF
21,Weverton,Weverton Pereira da Silva T(g),,P,169050 31 Everson Everson Felipe Marqu ...,T(g),,P,188398
8,Ze Rafael,Jose Rafael Vivian T,,P,330886 2 Guga Claudio Rodrigues Gomes,,T,P,317445
10,Luiz Adriano,Luiz Adriano Souza d ... T,,P,165924 3 Júnior Al ... Junior Osmar Ignacio ...,,T,P,699115
11,Rony,Ronielson da Silva B ... T,,P,427806 4 Rever Rever Humberto Alves ...,,T,P,167509
13,Luan Garcia,Luan Garcia Teixeira T,,P,307406 8 Jair Jair Rodrigues Junior,,T,P,347809
15,GUSTAVO GOMGEuZstavo Raul Gomez P ...,T,,P,633571 13 Guilherme  ... Guilherme Antonio Ar ...,,T,P,339258
17,VINA,Matias Nicolas Viña  ... T,,P,694293 15 Zaracho Federico Matias Zaracho,,T,P,703937
23,Raphael Veiga,Raphael Cavalcante Veiga T,,P,308405 23 Nathan Nathan Allan de Souza,,T,P,344314
25,Gabriel Me ...,Gabriel Vinicius Menino T,,P,501063 29 Allan Allan Rodrigues de Souza,,T,P,339266
30,Felipe Melo,Felipe Melo de Carvalho T,,P,150801 38 Marrony Marrony da Silva Lib ...,,T,P,463599
47,Wesley Rib ...,Wesley Ribeiro Silva T,,P,517179 70 Savarino Jefferson David Sava ...,,T,P,694075
42,Jailson,Jailson Marcelino do ... R(g),,P,153229 1 Victor Victor Leandro Bagy,R(g),,P,156659
3,Emerson,Emerson Raymundo Santos R,,P,348257 16 Igor Igor Rabello da Costa,,R,P,307840
5,Patrick de ...,Patrick de Paula Carreiro R,,P,453232 18 Eduardo Sasha Eduardo Colcenti Antunes,,R,P,295792
12,Mayke,Mayke Rocha de Oliveira R,,P,312950 19 DYLAN Dylan Felipe Borrero ...,,R,P,691581
14,Gustavo Sc ...,Gustavo Henrique Fur ... R,,P,313426 21 Alan Franco Alan Steven Franco Palma,,R,P,699171
18,Ramires,Ramires Santos do Na ... R,,P,176640 25 Mariano Mariano Ferreira Filho,,R,P,170144
20,Lucas Lima,Lucas Rafael Araujo Lima R,,P,331937 26 Calebe Calebe Gonçalves Fer ...,,R,P,440499
26,Renan,Renan Victor da Silva R,,P,551741 30 Gabriel Co ... Gabriel Costa Franca,,R,P,318309
27,Gabriel Veron,Gabriel Veron Fonsec ... R,,P,541921 32 Rafael Rafael Pires Monteiro,,R,P,180213
28,Danilo Santos,Danilo dos Santos de ... R,,P,540357 33 Sávio Savio Moreira de Oliveira,,R,P,620423
29,Willian,Willian Gomes de Siqueira R,,P,166061 40 Bueno Wellington Daniel Bueno,,R,P,346196
49,Gabriel Silva,Gabriel Silva Vieira R,,P,553046 50 Marquinhos Jose Marcos Costa Martins,,R,P,504064
No,Apelido Nome Completo,T/R,,P/A,CBF,No,Apelido Nome Completo,,T/R,P/A,CBF
21,Weverton Weverton Pereira da Silva,T(g),,P,169050,31,Everson Everson Felipe Marqu ...,T(g),,P,188398
8,Ze Rafael Jose Rafael Vivian,T,,P,330886,2,Guga Claudio Rodrigues Gomes,,T,P,317445
10,Luiz Adriano Luiz Adriano Souza d ...,T,,P,165924,3,Júnior Al ... Junior Osmar Ignacio ...,,T,P,699115
11,Rony Ronielson da Silva B ...,T,,P,427806,4,Rever Rever Humberto Alves ...,,T,P,167509
13,Luan Garcia Luan Garcia Teixeira,T,,P,307406,8,Jair Jair Rodrigues Junior,,T,P,347809
15,GUSTAVO GOMGEuZstavo Raul Gomez P ...,T,,P,633571,13,Guilherme  ... Guilherme Antonio Ar ...,,T,P,339258
17,VINA Matias Nicolas Viña  ...,T,,P,694293,15,Zaracho Federico Matias Zaracho,,T,P,703937
23,Raphael Veiga Raphael Cavalcante Veiga,T,,P,308405,23,Nathan Nathan Allan de Souza,,T,P,344314
25,Gabriel Me ... Gabriel Vinicius Menino,T,,P,501063,29,Allan Allan Rodrigues de Souza,,T,P,339266
30,Felipe Melo Felipe Melo de Carvalho,T,,P,150801,38,Marrony Marrony da Silva Lib ...,,T,P,463599
47,Wesley Rib ... Wesley Ribeiro Silva,T,,P,517179,70,Savarino Jefferson David Sava ...,,T,P,694075
42,Jailson Jailson Marcelino do ...,R(g),,P,153229,1,Victor Victor Leandro Bagy,R(g),,P,156659
3,Emerson Emerson Raymundo Santos R,,,P,348257,16,Igor Igor Rabello da Costa,,R,P,307840
5,Patrick de ... Patrick de Paula Carreiro,R,,P,453232,18,Eduardo Sasha Eduardo Colcenti Antunes,,R,P,295792
12,Mayke Mayke Rocha de Oliveira,R,,P,312950,19,DYLAN Dylan Felipe Borrero ...,,R,P,691581
14,Gustavo Sc ... Gustavo Henrique Fur ...,R,,P,313426,21,Alan Franco Alan Steven Franco Palma,,R,P,699171
18,Ramires Ramires Santos do Na ...,R,,P,176640,25,Mariano Mariano Ferreira Filho,,R,P,170144
20,Lucas Lima Lucas Rafael Araujo Lima,R,,P,331937,26,Calebe Calebe Gonçalves Fer ...,,R,P,440499
26,Renan Renan Victor da Silva,R,,P,551741,30,Gabriel Co ... Gabriel Costa Franca,,R,P,318309
27,Gabriel Veron Gabriel Veron Fonsec ...,R,,P,541921,32,Rafael Rafael Pires Monteiro,,R,P,180213
28,Danilo Santos Danilo dos Santos de ...,R,,P,540357,33,Sávio Savio Moreira de Oliveira,,R,P,620423
29,Willian Willian Gomes de Siqueira,R,,P,166061,40,Bueno Wellington Daniel Bueno,,R,P,346196
49,Gabriel Silva Gabriel Silva Vieira,R,,P,553046,50,Marquinhos Jose Marcos Costa Martins,,R,P,504064
"",,Comissão Técnica,
"",Palmeiras / SP,,Atlético / MG
Técnico:,Andrey Lopes Dos Santos,Técnico:,Jorge Luis Sampaoli Moya
Auxiliar Técnico:,Daniel Soares Goncalves,Auxiliar Técnico:,Jorge Alberto Desio
Médico:,Gilberto Amado Rodrigues Da Cunha Filho,Médico:,Otaviano De Oliveira Junior
Treinador De Goleiros:,Rogerio Augusto Godoy Da Silva,Treinador De Goleiros:,Diogo Meschine Alves
Preparador Físico:,Marco Aurelio Schiavo Reis,Preparador Físico:,Pablo Candido Fernandez
Massagista:,Marcelo Massao Gondo,Massagista:,Alexandre William Pinto Coelho
"",,,,,Gols,
Tempo,1T/2T,No,Tipo,Nome do Jogador,,Equipe
18:00,1T,23,NR,Raphael Cavalcante Veiga,,Palmeiras/SP
24:00,2T,11,NR,Ronielson da Silva Barbosa,,Palmeiras/SP
31:00,2T,47,NR,Wesley Ribeiro Silva,,Palmeiras/SP
"",,,,Cartões Amarelos
Tempo,1T/2T,No,Nome do Jogador,Equipe
06:00,2T,25,Gabriel Vinicius Menino,Palmeiras/SP
"",,,Motivo: A1.11.  Golpear um adversário de maneira temerária na disputa da bola - Por golpear um adversário de maneira temerária na,
"",,,disputa de bola.,
"",,,,Substituições,
Tempo,1T/2T,,Equipe,Entrou,Saiu
13:00,2T,Atlético/MG,,50 - Jose Marcos Costa Martins,15 - Federico Matias Zaracho
29:00,2T,Atlético/MG,,18 - Eduardo Colcenti Antunes,38 - Marrony da Silva Liberato Si...
29:00,2T,Atlético/MG,,21 - Alan Steven Franco Palma,8 - Jair Rodrigues Junior
35:00,2T,Palmeiras/SP,,27 - Gabriel Veron Fonseca de Souza,11 - Ronielson da Silva Barbosa
35:00,2T,Palmeiras/SP,,29 - Willian Gomes de Siqueira,10 - Luiz Adriano Souza da Silva
38:00,2T,Palmeiras/SP,,28 - Danilo dos Santos de Oliveira,47 - Wesley Ribeiro Silva
39:00,2T,Atlético/MG,,26 - Calebe Gonçalves Ferreira da...,23 - Nathan Allan de Souza
