Campeonato:,Campeonato Brasileiro - Série A/2020,,Rodada:,23
Jogo:,Palmeiras / SP X Athletico Paranaense / PR,,,
Data:,28/11/2020 Horário: 17:00 Estádio:,Allianz Parque / Sao Paulo,,
"",,Arbitragem
Arbitro:,Anderson Daronco (FIFA / RS),
Arbitro Assistente 1:,Rafael da Silva Alves (FIFA / RS),
Arbitro Assistente 2:,Michael Stanislau (AB / RS),
Quarto Arbitro:,Marcio Henrique de Gois (AB / SP),
Inspetor:,Sergio Correa da Silva (CBF / RJ),
Delegado Local:,Marcus Vinicius de Hollanda Montemor Mollo (FD / SP),
VAR:,Daniel Nobre Bins (AB / RS),
AVAR1:,Marielson Alves Silva (AB / BA),
AVAR2:,Andre da Silva Bitencourt (AB / RS),
"",,,Cronologia,,,
"",1o Tempo,,2o Tempo,,,
Entrada do mandante:,16:50Atraso:,,Não Houve Entrada do mandante: 18:03,,Atraso:,Não Houve
Entrada do visitante:,16:50Atraso:,,Não Houve Entrada do visitante: 18:03,,Atraso:,Não Houve
Início 1o Tempo:,17:00Atraso:,,Não Houve Início do 2o Tempo: 18:05,,Atraso:,Não Houve
Término do 1o Tempo:,17:50Acréscimo:,,5 min Término do 2o Tempo: 18:51,Acréscimo:,,1 min
Resultado do 1o Tempo: 2 X 0,,,Resultado Final: 3 X 0,,,
"",,,,,Relação de Jogadores,,,
"",,Palmeiras / SP,,,,Athletico Paranaense / PR,,
No,Apelido,Nome Completo T/R,,P/A,CBF No Apelido,Nome Completo T/R,P/A,CBF
51,Weverton,Weverton Pereira da Silva T(g),,P,169050 99 Bento,Bento Matheus Krepski T(g),P,446408
45,GUSTAVO GOMGEuZstavo Raul Gomez P ...,T,,P,633571 5 Wellington,Wellington Aparecido ... T,P,184600
47,VINA,Matias Nicolas Viña  ... T,,P,694293 17 Guilherme  ...,Guilherme Bissoli Campos T,P,322642
48,Ze Rafael,Jose Rafael Vivian T,,P,330886 18 Cittadini,Leonardo Cittadini T,P,321574
50,Lucas Lima,Lucas Rafael Araujo Lima T,,P,331937 19 Walter,Walter Henrique da Silva T,P,179832
55,Patrick de ...,Patrick de Paula Carreiro T,,P,453232 26 Erick,Erick Luis Conrado C ... T,P,376073
58,Danilo Santos,Danilo dos Santos de ... T,,P,540357 34 Pedro Henr ...,Pedro Henrique Ribei ... T,P,352037
61,Rony,Ronielson da Silva B ... T,,P,427806 40 Joao Victor,Joao Victor da Silva ... T,P,547043
62,Emerson,Emerson Raymundo Santos T,,P,348257 44 Thiago Heleno,Thiago Heleno Henriq ... T,P,171788
64,Gustavo Sc ...,Gustavo Henrique Fur ... T,,P,313426 79 Renato Kayzer,Renato Kayzer de Souza T,P,337840
65,Gabriel Me ...,Gabriel Vinicius Menino T,,P,501063 88 Christian,Christian Roberto Al ... T,P,546294
52,Vinicius,Vinicius Silvestre d ... R(g),,P,308661 7 Fabinho,Fabio Augusto Lucian ... R,P,336900
46,Lucas Esteves,Lucas Esteves Souza R,,P,413352 10 Lucho Gonz ...,Luis Oscar Gonzalez R,P,559270
49,Breno,Breno Henrique Vasco ... R,,P,389378 14 Ravanelli,Ravanelli Ferreira d ... R,P,443517
54,BENJAMIN,Benjamin Kuscevic Ja ... R,,P,706084 31 Iago,Iago Andre Pires de  ... R,P,529404
56,ALAN,Alan Pereira Empereur R,,P,706429 33 Halter,Lucas Halter R,P,440063
57,Veron,Gabriel Veron Fonsec ... R,,P,541921 70 Bruno Leite,Bruno da Silva Costa ... R,P,501383
59,Gabriel Silva,Gabriel Silva Vieira R,,P,553046 77 Kawan,Kawan Gabriel da Silva R,P,542580
63,Luan Garcia,Luan Garcia Teixeira R,,P,307406 91 Jorginho,Jorge de Moura Xavier R,P,330015
No,Apelido Nome Completo,T/R,,P/A,CBF,No,Apelido,Nome Completo,T/R,P/A,CBF
51,Weverton Weverton Pereira da Silva,T(g),,P,169050,99,Bento,Bento Matheus Krepski,T(g),P,446408
45,GUSTAVO GOMGEuZstavo Raul Gomez P ...,T,,P,633571,5,Wellington,Wellington Aparecido ...,T,P,184600
47,VINA Matias Nicolas Viña  ...,T,,P,694293,17,Guilherme  ...,Guilherme Bissoli Campos,T,P,322642
48,Ze Rafael Jose Rafael Vivian,T,,P,330886,18,Cittadini,Leonardo Cittadini,T,P,321574
50,Lucas Lima Lucas Rafael Araujo Lima,T,,P,331937,19,Walter,Walter Henrique da Silva,T,P,179832
55,Patrick de ... Patrick de Paula Carreiro,T,,P,453232,26,Erick,Erick Luis Conrado C ...,T,P,376073
58,Danilo Santos Danilo dos Santos de ...,T,,P,540357,34,Pedro Henr ...,Pedro Henrique Ribei ...,T,P,352037
61,Rony Ronielson da Silva B ...,T,,P,427806,40,Joao Victor,Joao Victor da Silva ...,T,P,547043
62,Emerson Emerson Raymundo Santos T,,,P,348257,44,Thiago Heleno,Thiago Heleno Henriq ...,T,P,171788
64,Gustavo Sc ... Gustavo Henrique Fur ...,T,,P,313426,79,Renato Kayzer,Renato Kayzer de Souza,T,P,337840
65,Gabriel Me ... Gabriel Vinicius Menino,T,,P,501063,88,Christian,Christian Roberto Al ...,T,P,546294
52,Vinicius Vinicius Silvestre d ...,R(g),,P,308661,7,Fabinho,Fabio Augusto Lucian ...,R,P,336900
46,Lucas Esteves Lucas Esteves Souza,R,,P,413352,10,Lucho Gonz ...,Luis Oscar Gonzalez,R,P,559270
49,Breno Breno Henrique Vasco ...,R,,P,389378,14,Ravanelli,Ravanelli Ferreira d ...,R,P,443517
54,BENJAMIN Benjamin Kuscevic Ja ...,R,,P,706084,31,Iago,Iago Andre Pires de  ...,R,P,529404
56,ALAN Alan Pereira Empereur,R,,P,706429,33,Halter,Lucas Halter,R,P,440063
57,Veron Gabriel Veron Fonsec ...,R,,P,541921,70,Bruno Leite,Bruno da Silva Costa ...,R,P,501383
59,Gabriel Silva Gabriel Silva Vieira,R,,P,553046,77,Kawan,Kawan Gabriel da Silva,R,P,542580
63,Luan Garcia Luan Garcia Teixeira,R,,P,307406,91,Jorginho,Jorge de Moura Xavier,R,P,330015
"",,Comissão Técnica,
"",Palmeiras / SP,,Athletico Paranaense / PR
Técnico:,Abel Fernando Moreira Ferreira,Técnico:,Paulo Autuori De Mello
Auxiliar Técnico:,Vitor Ilidio Castanheiras Penas,Auxiliar Técnico:,Bernardo Franco Junior
Auxiliar Técnico:,Joao Miguel Barreto Martins,Médico:,Rodrigo Gorte Basaglia
Médico:,Guilherme Dalcin Dilda,Treinador De Goleiros:,Felipe Faria De Souza
Preparador Físico:,Marco Aurelio Schiavo Reis,Preparador Físico:,Tulio Flores Dos Santos
Massagista:,Rodrigo De Alencar Bonfim,Fisioterapeuta:,Caio Bevilaqua Verona
"",,,,,Gols,
Tempo,1T/2T,No,Tipo,Nome do Jogador,,Equipe
07:00,1T,55,NR,Patrick de Paula Carreiro,,Palmeiras/SP
33:00,1T,61,NR,Ronielson da Silva Barbosa,,Palmeiras/SP
04:00,2T,61,NR,Ronielson da Silva Barbosa,,Palmeiras/SP
"",,,,Cartões Amarelos
Tempo,1T/2T,No,Nome do Jogador,Equipe
03:00,2T,58,Danilo dos Santos de Oliveira,Palmeiras/SP
"",,,Motivo: A1.2.  Dar ou tentar dar uma rasteira ou um calço em um adversário de maneira temerária na disputa da bola  -  calçar seu,
"",,,adversário de forma temerária na disputa de bola.,
"",,,Substituições,
Tempo,1T/2T,Equipe,Entrou,Saiu
45:00,INT,Athletico Paranaense/PR,7 - Fabio Augusto Luciano da Silva,19 - Walter Henrique da Silva
45:00,INT,Athletico Paranaense/PR,33 - Lucas Halter,17 - Guilherme Bissoli Campos
17:00,2T,Palmeiras/SP,59 - Gabriel Silva Vieira,48 - Jose Rafael Vivian
17:00,2T,Athletico Paranaense/PR,14 - Ravanelli Ferreira dos Santos,26 - Erick Luis Conrado Carvalho
17:00,2T,Palmeiras/SP,57 - Gabriel Veron Fonseca de Souza,61 - Ronielson da Silva Barbosa
17:00,2T,Athletico Paranaense/PR,10 - Luis Oscar Gonzalez,18 - Leonardo Cittadini
24:00,2T,Palmeiras/SP,49 - Breno Henrique Vasconcelos L...,50 - Lucas Rafael Araujo Lima
29:00,2T,Palmeiras/SP,56 - Alan Pereira Empereur,64 - Gustavo Henrique Furtado Sca...
29:00,2T,Palmeiras/SP,63 - Luan Garcia Teixeira,55 - Patrick de Paula Carreiro
