Campeonato:,Campeonato Brasileiro - Série A/2020,Rodada:,32
Jogo:,Ceará / CE X Palmeiras / SP,,
Data:,24/01/2021 Horário: 16:00 Estádio:,Governador Plácido Aderaldo Castelo / Fortaleza,
"",Arbitragem
Arbitro:,Braulio da Silva Machado (FIFA / SC)
Arbitro Assistente 1:,Helton Nunes (AB / SC)
Arbitro Assistente 2:,Johnny Barros de Oliveira (AB / SC)
Quarto Arbitro:,Leo Simão Holanda (AB / CE)
Delegado Local:,Claudemiro Silva Soares (CBF / CE)
Analista de Campo:,Paulo Silvio dos Santos (CBF / CE)
VAR:,Adriano Milczvski (AB / PR)
AVAR1:,Lucas Paulo Torezin (CD / PR)
AVAR2:,Jefferson Cleiton Piva da Silva (AB / PR)
"",,,Cronologia,,,
"",1o Tempo,,2o Tempo,,,
Entrada do mandante:,15:56Atraso:,,Não Houve Entrada do mandante: 17:02,,Atraso:,2 min
Entrada do visitante:,15:55Atraso:,,Não Houve Entrada do visitante: 17:00,,Atraso:,Não Houve
Início 1o Tempo:,16:00Atraso:,,Não Houve Início do 2o Tempo: 17:02,,Atraso:,Não Houve
Término do 1o Tempo:,16:47Acréscimo:,,2 min Término do 2o Tempo: 17:52,Acréscimo:,,5 min
Resultado do 1o Tempo: 2 X 1,,,Resultado Final: 2 X 1,,,
"",,,,,Relação de Jogadores,,,,
"",,Ceará / CE,,,Palmeiras / SP,,,,
No,Apelido,Nome Completo T/R,,P/A,CBF No Apelido Nome Completo,T/R,,P/A,CBF
91,Richard,Richard de Oliveira Costa T(g),,P,291617 42 Jailson Jailson Marcelino do ...,T(g),,P,153229
3,Tiago,Tiago Pagnussat T,,P,188260 3 Emerson Emerson Raymundo Santos T,,,P,348257
6,Bruno Pacheco Bruno de Jesus Pacheco,T,,P,333975 5 Patrick de ... Patrick de Paula Carreiro,T,,P,453232
13,Luiz,Luiz Otavio Anacleto ... T,,P,291651 12 Mayke Mayke Rocha de Oliveira,T,,P,312950
19,Fabinho,Fabio Goncalves T,,P,175065 14 Gustavo Sc ... Gustavo Henrique Fur ...,T,,P,313426
22,Samuel,Samuel Xavier Brito T,,P,292428 15 GUSTAVO GOMGEuZstavo Raul Gomez P ...,T,,P,633571
26,Leo Chu,Leonardo Alves Chu Franco T,,P,464173 20 Lucas Lima Lucas Rafael Araujo Lima,T,,P,331937
29,Vinicius,Vinicius Goes Barbos ... T,,P,294769 27 Gabriel Veron Gabriel Veron Fonsec ...,T,,P,541921
45,Lima,Vinicius Moreira de Lima T,,P,403112 33 ALAN Alan Pereira Empereur,T,,P,706429
88,Fernando,Fernando Pereira do  ... T,,P,399713 39 Breno Breno Henrique Vasco ...,T,,P,389378
89,CLEBER,Cleber Bomfim de Jesus T,,P,601171 49 Gabriel Silva Gabriel Silva Vieira,T,,P,553046
1,Fernando P ...,Fernando Buttenbende ... R(g),,P,137377 72 Vinicius Vinicius Silvestre d ...,R(g),,P,308661
4,Brock,Eduardo Schroeder Brock R,,P,291997 4 BENJAMIN Benjamin Kuscevic Ja ...,R,,P,706084
5,Willian,Willian Oliveira dos ... R,,P,430883 16 Lucas Esteves Lucas Esteves Souza,R,,P,413352
8,Ricardinho,Ricardo Dias Acosta R,,P,169114 26 Renan Renan Victor da Silva,R,,P,551741
11,Felipe Vizeu,Felipe dos Reis Pere ... R,,P,399284 30 Felipe Melo Felipe Melo de Carvalho,R,,P,150801
14,Alyson,Alyson Vinicius Alme ... R,,P,336531 34 Ramon Cesar Ramon César Cirino,R,,P,546095
35,Charles,Charles Rigon Matos R,,P,407683 38 Marcelo Marcelo Jose de Lima ...,R,,P,534970
39,Wescley,Wescley Gomes dos Santos R,,P,297441 51 Mateus Oli ... Mateus Oliveira Mendes,R,,P,544385
44,Klaus,William Klaus R,,P,360293 57 Pedro Pedro Acacio Monteir ...,R,,P,679572
70,Kelvyn,Kelvyn Ramos da Fonseca R,,P,555438 60 Fabrício Fabricio do Nascimen ...,R,,P,540031
73,Saulo,Saulo Rodrigues da Silva R,,P,375896 65 Pedro Bicalho Pedro Henrique Rodri ...,R,,P,440763
86,Eduardo,Carlos Eduardo Santo ... R,,P,170077 68 Caio Caio Santos Cunha,R,,P,501487
No,Apelido Nome Completo,T/R,,P/A,CBF,No,Apelido Nome Completo,T/R,,P/A,CBF
91,Richard Richard de Oliveira Costa,T(g),,P,291617,42,Jailson Jailson Marcelino do ...,T(g),,P,153229
3,Tiago Tiago Pagnussat,T,,P,188260,3,Emerson Emerson Raymundo Santos T,,,P,348257
6,Bruno Pacheco Bruno de Jesus Pacheco,T,,P,333975,5,Patrick de ... Patrick de Paula Carreiro,T,,P,453232
13,Luiz Luiz Otavio Anacleto ...,T,,P,291651,12,Mayke Mayke Rocha de Oliveira,T,,P,312950
19,Fabinho Fabio Goncalves,T,,P,175065,14,Gustavo Sc ... Gustavo Henrique Fur ...,T,,P,313426
22,Samuel Samuel Xavier Brito,T,,P,292428,15,GUSTAVO GOMGEuZstavo Raul Gomez P ...,T,,P,633571
26,Leo Chu Leonardo Alves Chu Franco T,,,P,464173,20,Lucas Lima Lucas Rafael Araujo Lima,T,,P,331937
29,Vinicius Vinicius Goes Barbos ...,T,,P,294769,27,Gabriel Veron Gabriel Veron Fonsec ...,T,,P,541921
45,Lima Vinicius Moreira de Lima,T,,P,403112,33,ALAN Alan Pereira Empereur,T,,P,706429
88,Fernando Fernando Pereira do  ...,T,,P,399713,39,Breno Breno Henrique Vasco ...,T,,P,389378
89,CLEBER Cleber Bomfim de Jesus,T,,P,601171,49,Gabriel Silva Gabriel Silva Vieira,T,,P,553046
1,Fernando P ... Fernando Buttenbende ...,R(g),,P,137377,72,Vinicius Vinicius Silvestre d ...,R(g),,P,308661
4,Brock Eduardo Schroeder Brock,R,,P,291997,4,BENJAMIN Benjamin Kuscevic Ja ...,R,,P,706084
5,Willian Willian Oliveira dos ...,R,,P,430883,16,Lucas Esteves Lucas Esteves Souza,R,,P,413352
8,Ricardinho Ricardo Dias Acosta,R,,P,169114,26,Renan Renan Victor da Silva,R,,P,551741
11,Felipe Vizeu Felipe dos Reis Pere ...,R,,P,399284,30,Felipe Melo Felipe Melo de Carvalho,R,,P,150801
14,Alyson Alyson Vinicius Alme ...,R,,P,336531,34,Ramon Cesar Ramon César Cirino,R,,P,546095
35,Charles Charles Rigon Matos,R,,P,407683,38,Marcelo Marcelo Jose de Lima ...,R,,P,534970
39,Wescley Wescley Gomes dos Santos R,,,P,297441,51,Mateus Oli ... Mateus Oliveira Mendes,R,,P,544385
44,Klaus William Klaus,R,,P,360293,57,Pedro Pedro Acacio Monteir ...,R,,P,679572
70,Kelvyn Kelvyn Ramos da Fonseca,R,,P,555438,60,Fabrício Fabricio do Nascimen ...,R,,P,540031
73,Saulo Saulo Rodrigues da Silva,R,,P,375896,65,Pedro Bicalho Pedro Henrique Rodri ...,R,,P,440763
86,Eduardo Carlos Eduardo Santo ...,R,,P,170077,68,Caio Caio Santos Cunha,R,,P,501487
"",,Comissão Técnica,
"",Ceará / CE,,Palmeiras / SP
Técnico:,Augusto Sergio Ferreira,Técnico:,Abel Fernando Moreira Ferreira
Auxiliar Técnico:,Alexandre Faganello,Auxiliar Técnico:,Joao Miguel Barreto Martins
Médico:,Joaquim Sampaio Garcia Filho,Médico:,Guilherme Dalcin Dilda
Treinador De Goleiros:,Everaldo Goncalves Santana,Treinador De Goleiros:,Vitor Ilidio Castanheiras Penas
Preparador Físico:,Valdir Nogueira De Oliveira Junior,Preparador Físico:,Marco Aurelio Schiavo Reis
Fisioterapeuta:,Wellington Lima De Alencar,Massagista:,Rodrigo De Alencar Bonfim
"",,,,,Gols,
Tempo,1T/2T,No,Tipo,Nome do Jogador,,Equipe
09:00,1T,45,NR,Vinicius Moreira de Lima,,Ceará/CE
29:00,1T,29,PN,Vinicius Goes Barbosa de Souza,,Ceará/CE
33:00,1T,27,NR,Gabriel Veron Fonseca de Souza,,Palmeiras/SP
"",,,,Cartões Amarelos
Tempo,1T/2T,No,Nome do Jogador,Equipe
03:00,2T,3,Emerson Raymundo Santos,Palmeiras/SP
"",,,Motivo: A1.2.  Dar ou tentar dar uma rasteira ou um calço em um adversário de maneira temerária na disputa da bola  - Por calçar um,
"",,,adversário de forma temerária na disputa de bola.,
"",,,,Cartões Vermelhos
Tempo 1T/2T,No,,Nome do Jogador,
37:00 2T,86,,Carlos Eduardo Santos Oliveira - Ceará/CE,
2o Cartão Amarelo,,,Motivo: V2.8.  Outro motivo (detalhar no campo expulsões) - Por reclamar de maneira acintosa contra as decisões da arbitragem no,
"",,,"momento em que encontrava na área destinada ao aquecimento dos atletas da equipe ceara sc, chutando a placa de publicidade em",
"",,,"forma de protesto, e proferindo as seguintes palavras:"" caralho tu não vai marcar a falta."" informo que o atleta deixou as imediações do",
"",,,campo de jogo sem oferecer resistência.,
"",,,,Substituições,
Tempo,1T/2T,,Equipe,Entrou,Saiu
13:00,2T,Ceará/CE,,35 - Charles Rigon Matos,26 - Leonardo Alves Chu Franco
22:00,2T,Palmeiras/SP,,16 - Lucas Esteves Souza,27 - Gabriel Veron Fonseca de Souza
28:00,2T,Palmeiras/SP,,60 - Fabricio do Nascimento Biato,49 - Gabriel Silva Vieira
28:00,2T,Palmeiras/SP,,57 - Pedro Acacio Monteiro da Silva,14 - Gustavo Henrique Furtado Sca...
28:00,2T,Palmeiras/SP,,30 - Felipe Melo de Carvalho,5 - Patrick de Paula Carreiro
31:00,2T,Ceará/CE,,73 - Saulo Rodrigues da Silva,89 - Cleber Bomfim de Jesus
44:00,2T,Ceará/CE,,5 - Willian Oliveira dos Santos,19 - Fabio Goncalves
44:00,2T,Ceará/CE,,11 - Felipe dos Reis Pereira Vize...,29 - Vinicius Goes Barbosa de Souza
