Campeonato:,Campeonato Brasileiro - Série A/2020,,Rodada:,26
Jogo:,Vasco da Gama / RJ X Santos / SP,,,
Data:,20/12/2020 Horário: 16:00 Estádio:,São Januário / Rio de Janeiro,,
"",Arbitragem
Arbitro:,Ricardo Marques Ribeiro (MTR / MG)
Arbitro Assistente 1:,Alessandro Alvaro Rocha de Matos (FIFA / BA)
Arbitro Assistente 2:,Guilherme Dias Camilo (FIFA / MG)
Quarto Arbitro:,Rafael Martins de Sá (CD / RJ)
Inspetor:,Ricardo Mauricio Ferreira de Almeida (CBF / RJ)
Delegado Local:,Marcos Vinicio de Abreu Trindade (CBF / )
VAR:,Igor Junio Benevenuto de Oliveira (AB / MG)
AVAR1:,Marco Aurelio Augusto Fazekas Ferreira (AB / MG)
AVAR2:,Marcus Vinicius Gomes (AB / MG)
"",,,Cronologia,,,
"",1o Tempo,,2o Tempo,,,
Entrada do mandante:,15:55Atraso:,,Não Houve Entrada do mandante: 17:01,,Atraso:,Não Houve
Entrada do visitante:,15:54Atraso:,,Não Houve Entrada do visitante: 17:02,,Atraso:,Não Houve
Início 1o Tempo:,16:00Atraso:,,Não Houve Início do 2o Tempo: 17:05,,Atraso:,Não Houve
Término do 1o Tempo:,16:50Acréscimo:,,5 min Término do 2o Tempo: 17:59,Acréscimo:,,9 min
Resultado do 1o Tempo: 1 X 0,,,Resultado Final: 1 X 0,,,
"",,,,,Relação de Jogadores,,,,
"",,Vasco da Gama / RJ,,,,Santos / SP,,,
No,Apelido,Nome Completo T/R,,P/A,CBF No Apelido,Nome Completo,T/R,P/A,CBF
1,Fernando M ...,Fernando Miguel KaufmannT(g),,P,159684 31 John,John Victor Maciel F ...,T(g),P,385767
2,Jacson,Jadson Cristiano Sil ... T,,P,334510 2 Luiz,Luiz Felipe do Nasci ...,T,P,354299
3,Leonardo,Leonardo de Matos Cruz T,,P,165709 3 Felipe,Felipe Jonatan Rocha ...,T,P,373768
5,Leandro,Leandro Castan da Silva T,,P,164170 5 Alison,Alison Lopes Ferreira,T,P,308980
14,German Cano,German Ezequiel Cano T,,P,691654 9 Kaio Jorge,Kaio Jorge Pinto Ramos,T,P,541499
15,Andrey,Andrey Ramos do Nasc ... T,,P,404816 13 Madson,Madson Ferreira dos  ...,T,P,321829
20,Marcos Junior,Marcos Antonio Candi ... T,,P,420566 18 Fernando,Fernando Moraes Pileggi,T,P,422859
23,Carlos Vin ...,Carlos Vinicios Sant ... T,,P,322321 21 Diego,Diego Cristiano Evaristo,T,P,334559
37,Henrique,Henrique Silva Milagres T,,P,308965 30 Lucas,Lucas Braga Ribeiro,T,P,541268
49,Vinicius,Vinicius dos Santos  ... T,,P,543481 38 Sandry,Sandry Roberto Santo ...,T,P,541292
50,Alexandre,Alexandre de Almeida ... T,,P,540274 44 Alex,Alex de Oliveira Nas ...,T,P,432392
56,Lucão,Lucas Alexandre Gald ... R(g),,P,523351 34 Joao Paulo,Joao Paulo Silva Martins,R(g),P,362877
9,Lucas Ribamar Lucas Ribamar Lopes  ...,R,,P,413248 6 Laercio,Laercio Solda,R,P,361960
18,Bruno Gomes,Bruno Gomes da Silva ... R,,P,526369 10 Yeferson S ...,Yeferson Julio Sotel ...,R,P,646668
22,Yago,Glaybson Yago Souza  ... R,,P,364829 11 Marinho,Mario Sergio Santos Costa,R,P,184307
27,Tiago Rodr ...,Tiago Rodrigues dos Reis R,,P,518160 19 Bruno Henr ...,Bruno Henrique Marqu ...,R,P,606130
30,Marcelo,Marcelo Alves Santos R,,P,441866 23 Arthur,Arthur Gomes Lourenco,R,P,387808
34,Werley,Werley Ananias da Silva R,,P,172411 25 Guilherme,Guilherme Nunes da Silva,R,P,460473
36,Ricardo,Ricardo Queiroz de A ... R,,P,372370 36 Marcos Leo ...,Marcos Leonardo Sant ...,R,P,568013
38,Ygor,Ygor de Oliveira Ferreira R,,P,537477 37 Lucas Lour ...,Lucas Lourenco Andrade,R,P,445329
41,Cayo,Cayo Henrique Nascim ... R,,P,435217 41 Sousa,Jean Mota Oliveira d ...,R,P,331842
45,Riquelme,Riquelme de Carvalho ... R,,P,558560 42 Wagner,Wagner Leonardo Calv ...,R,P,408944
77,Gustavo To ...,Gustavo Adolfo Torre ... R,,P,706047 45 Ivonei,Ivonei Junior da Sil ...,R,P,541293
No,Apelido Nome Completo,T/R,,P/A,CBF,No,Apelido,Nome Completo,T/R,P/A,CBF
1,Fernando M ... Fernando Miguel KaufmannT(g),,,P,159684,31,John,John Victor Maciel F ...,T(g),P,385767
2,Jacson Jadson Cristiano Sil ...,T,,P,334510,2,Luiz,Luiz Felipe do Nasci ...,T,P,354299
3,Leonardo Leonardo de Matos Cruz,T,,P,165709,3,Felipe,Felipe Jonatan Rocha ...,T,P,373768
5,Leandro Leandro Castan da Silva,T,,P,164170,5,Alison,Alison Lopes Ferreira,T,P,308980
14,German Cano German Ezequiel Cano,T,,P,691654,9,Kaio Jorge,Kaio Jorge Pinto Ramos,T,P,541499
15,Andrey Andrey Ramos do Nasc ...,T,,P,404816,13,Madson,Madson Ferreira dos  ...,T,P,321829
20,Marcos Junior Marcos Antonio Candi ...,T,,P,420566,18,Fernando,Fernando Moraes Pileggi,T,P,422859
23,Carlos Vin ... Carlos Vinicios Sant ...,T,,P,322321,21,Diego,Diego Cristiano Evaristo,T,P,334559
37,Henrique Henrique Silva Milagres,T,,P,308965,30,Lucas,Lucas Braga Ribeiro,T,P,541268
49,Vinicius Vinicius dos Santos  ...,T,,P,543481,38,Sandry,Sandry Roberto Santo ...,T,P,541292
50,Alexandre Alexandre de Almeida ...,T,,P,540274,44,Alex,Alex de Oliveira Nas ...,T,P,432392
56,Lucão Lucas Alexandre Gald ...,R(g),,P,523351,34,Joao Paulo,Joao Paulo Silva Martins,R(g),P,362877
9,Lucas Ribamar Lucas Ribamar Lopes  ...,R,,P,413248,6,Laercio,Laercio Solda,R,P,361960
18,Bruno Gomes Bruno Gomes da Silva ...,R,,P,526369,10,Yeferson S ...,Yeferson Julio Sotel ...,R,P,646668
22,Yago Glaybson Yago Souza  ...,R,,P,364829,11,Marinho,Mario Sergio Santos Costa,R,P,184307
27,Tiago Rodr ... Tiago Rodrigues dos Reis,R,,P,518160,19,Bruno Henr ...,Bruno Henrique Marqu ...,R,P,606130
30,Marcelo Marcelo Alves Santos,R,,P,441866,23,Arthur,Arthur Gomes Lourenco,R,P,387808
34,Werley Werley Ananias da Silva,R,,P,172411,25,Guilherme,Guilherme Nunes da Silva,R,P,460473
36,Ricardo Ricardo Queiroz de A ...,R,,P,372370,36,Marcos Leo ...,Marcos Leonardo Sant ...,R,P,568013
38,Ygor Ygor de Oliveira Ferreira,R,,P,537477,37,Lucas Lour ...,Lucas Lourenco Andrade,R,P,445329
41,Cayo Cayo Henrique Nascim ...,R,,P,435217,41,Sousa,Jean Mota Oliveira d ...,R,P,331842
45,Riquelme Riquelme de Carvalho ...,R,,P,558560,42,Wagner,Wagner Leonardo Calv ...,R,P,408944
77,Gustavo To ... Gustavo Adolfo Torre ...,R,,P,706047,45,Ivonei,Ivonei Junior da Sil ...,R,P,541293
"",,Comissão Técnica,
"",Vasco da Gama / RJ,,Santos / SP
Técnico:,Ricardo Manuel Da Silva Sá Pinto,Técnico:,Alexi Stival
Auxiliar Técnico:,Rui Tomas Faustino Pinto Da Mota,Auxiliar Técnico:,Avlamir Dirceo Stival
Médico:,Marcos Fernandes Teixeira,Médico:,Ricardo Galotti
Treinador De Goleiros:,Carlos Germano Schwambach Neto,Treinador De Goleiros:,Sebastiao Martins De Oliveira Junior
Preparador Físico:,Mauro Cesar De Melo Britto,Preparador Físico:,Jose Omar Alves Feitosa
Fisioterapeuta:,Marcio De Araujo Monteiro,Massagista:,Jailson Silva Dos Santos
"",,,,,Gols,
Tempo,1T/2T,No,Tipo,Nome do Jogador,,Equipe
08:00,1T,23,NR,Carlos Vinicios Santos de Jesus,,Vasco da Gama/RJ
"",,,,Cartões Amarelos
Tempo,1T/2T,No,Nome do Jogador,Equipe
44:00,1T,2,Jadson Cristiano Silva de Morais,Vasco da Gama/RJ
"",,,Motivo: A1.3.  Cometer uma falta tática para impedir um ataque promissor - Por segurar o seu adversário na disputa pela bola,
"",,,impedindo um ataque promissor.,
"",,,Substituições,
Tempo,1T/2T,Equipe,Entrou,Saiu
+2:00,2T,Vasco da Gama/RJ,27 - Tiago Rodrigues dos Reis,14 - German Ezequiel Cano
45:00,INT,Santos/SP,10 - Yeferson Julio Soteldo Marti...,2 - Luiz Felipe do Nascimento do...
45:00,INT,Santos/SP,19 - Bruno Henrique Marques Torres,18 - Fernando Moraes Pileggi
22:00,2T,Vasco da Gama/RJ,30 - Marcelo Alves Santos,50 - Alexandre de Almeida Silva J...
22:00,2T,Vasco da Gama/RJ,77 - Gustavo Adolfo Torres Grueso,49 - Vinicius dos Santos de Olive...
28:00,2T,Santos/SP,11 - Mario Sergio Santos Costa,13 - Madson Ferreira dos Santos
34:00,2T,Vasco da Gama/RJ,22 - Glaybson Yago Souza Lisbôa,23 - Carlos Vinicios Santos de Je...
34:00,2T,Vasco da Gama/RJ,18 - Bruno Gomes da Silva Clevela...,20 - Marcos Antonio Candido Ferre...
37:00,2T,Santos/SP,36 - Marcos Leonardo Santos Almeida,9 - Kaio Jorge Pinto Ramos
40:00,2T,Santos/SP,37 - Lucas Lourenco Andrade,38 - Sandry Roberto Santos Goes
