Campeonato:,Campeonato Brasileiro - Série A/2020,,Rodada:,20
Jogo:,Fluminense / RJ X Grêmio / RS,,,
Data:,08/11/2020 Horário: 20:30 Estádio:,Jornalista Mário Filho / Rio de Janeiro,,
"",,Arbitragem
Arbitro:,Edina Alves Batista (FIFA / SP),
Arbitro Assistente 1:,Alex Ang Ribeiro (AB / SP),
Arbitro Assistente 2:,Evandro de Melo Lima (AB / SP),
Quarto Arbitro:,Paulo Renato Moreira da Silva Coelho (CD / RJ),
Inspetor:,Cláudio Vinícius Cerdeira (CBF / RJ),
Delegado Local:,Marcos Vinicio de Abreu Trindade (CBF / ),
VAR:,Marcio Henrique de Gois (AB / SP),
AVAR1:,Andrey da Silva E Silva (AB / PA),
AVAR2:,Jefferson Cleiton Piva da Silva (AB / PR),
"",,,Cronologia,,,
"",1o Tempo,,2o Tempo,,,
Entrada do mandante:,20:25Atraso:,,Não Houve Entrada do mandante: 21:28,,Atraso:,Não Houve
Entrada do visitante:,20:26Atraso:,,Não Houve Entrada do visitante: 21:28,,Atraso:,Não Houve
Início 1o Tempo:,20:30Atraso:,,Não Houve Início do 2o Tempo: 21:31,,Atraso:,Não Houve
Término do 1o Tempo:,21:16Acréscimo:,,1 min Término do 2o Tempo: 22:22,Acréscimo:,,6 min
Resultado do 1o Tempo: 0 X 1,,,Resultado Final: 0 X 1,,,
"",,,,,Relação de Jogadores,,,,
"",,Fluminense / RJ,,,,Grêmio / RS,,,
No,Apelido,Nome Completo T/R,,P/A,CBF No Apelido,Nome Completo T/R,,P/A,CBF
27,Muriel,Muriel Gustavo Becker T(g),,P,165925 1 Paulo Victor,Paulo Victor Mileo V ... T(g),,P,175411
4,Luccas Claro,Luccas Claro dos Santos T,,P,291708 7 Matheus He ...,Matheus Henrique de SouzaT,,P,407776
9,Fred,Frederico Chaves Guedes T,,P,148994 14 David Braz,David Braz de Olivei ... T,,P,168008
14,Danilo Bar ...,Danilo Carvalho Barcelos T,,P,313755 15 Darlan,Darlan Pereira Mendes T,,P,422352
15,Michel Araujo,Michel Daryl Araujo  ... T,,P,693055 17 Orejuela,Luis Manuel Orejuela ... T,,P,646474
17,Wellington ...,Wellington Alves da Silva T,,P,306146 19 Churin,Diego Churin T,,P,705188
21,Igor Julião,Igor de Carvalho Juliao T,,P,307616 21 Jean Pyerre,Jean Pyerre Casagran ... T,,P,422351
22,Dodi,Douglas Moreira Fagundes T,,P,354201 25 Pepe,Eduardo Gabriel Aqui ... T,,P,428672
25,Hudson,Hudson Rodrigues dos ... T,,P,176729 32 Diogo,Diogo Barbosa Mendanha T,,P,339876
33,Nino,Marcilio Florencio M ... T,,P,379386 33 Luiz Fernando,Luiz Fernando Moraes ... T,,P,451607
70,Caio Paulista,Caio Fernando de Oliveira T,,P,460683 38 Rodrigues,Antonio Josenildo Ro ... T,,P,434738
1,Marcos Felipe,Marcos Felipe de Fre ... R(g),,P,318563 22 Julio Cesar,Julio Cesar Jacobi R(g),,P,169978
6,Egidio,Egidio de Araujo Per ... R,,P,157280 2 Victor Ferraz,Victor Ferraz Macedo R,,P,170272
7,Lucca,Lucca Borges de Brito R,,P,292592 11 Everton,Everton Cardoso da Silva R,,P,178361
10,PH GANSO,Paulo Henrique Chaga ... R,,P,184364 12 Cortez,Bruno Cortes Barbosa R,,P,180546
11,Marcos Paulo,Marcos Paulo Costa d ... R,,P,526048 18 Robinho,Robson Michael Signorini R,,P,172189
19,Felippe Ca ...,Wanderson Felippe Ca ... R,,P,536862 20 Thaciano,Thaciano Mickael da Silva R,,P,391953
26,Digão,Rodrigo Junior Paula ... R,,P,172038 28 P. Miranda,Jonathan Doin R,,P,291380
30,Miguel,Miguel Silveira dos  ... R,,P,582161 29 Diego Souza,Diego de Souza Andrade R,,P,161625
31,Calegari,Lucas Felipe Calegari R,,P,544799 34 Lucas Araujo,Lucas Araujo de Oliveira R,,P,434877
34,Luiz Henrique,Luiz Henrique Andre  ... R,,P,523841 44 Ruan,Ruan Tressoldi Netto R,,P,462332
35,André,André Trindade da Co ... R,,P,535518 46 Isaque,Isaque Elias Brito R,,P,354923
"",,,,,47 Ferreira,Aldemir dos Santos F ... R,,P,505058
No,Apelido,Nome Completo T/R,,P/A,CBF,No,Apelido,Nome Completo T/R,,P/A,CBF
27,Muriel,Muriel Gustavo Becker T(g),,P,165925,1,Paulo Victor,Paulo Victor Mileo V ... T(g),,P,175411
4,Luccas Claro,Luccas Claro dos Santos T,,P,291708,7,Matheus He ...,Matheus Henrique de SouzaT,,P,407776
9,Fred,Frederico Chaves Guedes T,,P,148994,14,David Braz,David Braz de Olivei ... T,,P,168008
14,Danilo Bar ...,Danilo Carvalho Barcelos T,,P,313755,15,Darlan,Darlan Pereira Mendes T,,P,422352
15,Michel Araujo,Michel Daryl Araujo  ... T,,P,693055,17,Orejuela,Luis Manuel Orejuela ... T,,P,646474
17,Wellington ...,Wellington Alves da Silva T,,P,306146,19,Churin,Diego Churin T,,P,705188
21,Igor Julião,Igor de Carvalho Juliao T,,P,307616,21,Jean Pyerre,Jean Pyerre Casagran ... T,,P,422351
22,Dodi,Douglas Moreira Fagundes T,,P,354201,25,Pepe,Eduardo Gabriel Aqui ... T,,P,428672
25,Hudson,Hudson Rodrigues dos ... T,,P,176729,32,Diogo,Diogo Barbosa Mendanha T,,P,339876
33,Nino,Marcilio Florencio M ... T,,P,379386,33,Luiz Fernando,Luiz Fernando Moraes ... T,,P,451607
70,Caio Paulista,Caio Fernando de Oliveira T,,P,460683,38,Rodrigues,Antonio Josenildo Ro ... T,,P,434738
1,Marcos Felipe,Marcos Felipe de Fre ... R(g),,P,318563,22,Julio Cesar,Julio Cesar Jacobi R(g),,P,169978
6,Egidio,Egidio de Araujo Per ... R,,P,157280,2,Victor Ferraz,Victor Ferraz Macedo R,,P,170272
7,Lucca,Lucca Borges de Brito R,,P,292592,11,Everton,Everton Cardoso da Silva R,,P,178361
10,PH GANSO,Paulo Henrique Chaga ... R,,P,184364,12,Cortez,Bruno Cortes Barbosa R,,P,180546
11,Marcos Paulo,Marcos Paulo Costa d ... R,,P,526048,18,Robinho,Robson Michael Signorini R,,P,172189
19,Felippe Ca ...,Wanderson Felippe Ca ... R,,P,536862,20,Thaciano,Thaciano Mickael da Silva R,,P,391953
26,Digão,Rodrigo Junior Paula ... R,,P,172038,28,P. Miranda,Jonathan Doin R,,P,291380
30,Miguel,Miguel Silveira dos  ... R,,P,582161,29,Diego Souza,Diego de Souza Andrade R,,P,161625
31,Calegari,Lucas Felipe Calegari R,,P,544799,34,Lucas Araujo,Lucas Araujo de Oliveira R,,P,434877
34,Luiz Henrique,Luiz Henrique Andre  ... R,,P,523841,44,Ruan,Ruan Tressoldi Netto R,,P,462332
35,André,André Trindade da Co ... R,,P,535518,46,Isaque,Isaque Elias Brito R,,P,354923
"",,,,,,47,Ferreira,Aldemir dos Santos F ... R,,P,505058
"",,Comissão Técnica,
"",Fluminense / RJ,,Grêmio / RS
Técnico:,Odair Hellmann,Técnico:,Renato Portaluppi
Auxiliar Técnico:,Mauricio Correa Dulac,Auxiliar Técnico:,Alexandre Pereira Mendes
Médico:,Ricardo Reiniger Olivero,Médico:,Paulo Augusto Da Silva Rabaldo
Treinador De Goleiros:,Andre Carvalho Da Silva,Treinador De Goleiros:,Mauri Costa Lima
Preparador Físico:,Marcelo Barbosa Leite Chirol,Preparador Físico:,Marcio Meira De Vasconcelos
Fisioterapeuta:,Nilton Petrone Vilardi Junior,Massagista:,Lucas Silva Da Cruz
"",,,,,Gols,
Tempo,1T/2T,No,Tipo,Nome do Jogador,,Equipe
27:00,1T,25,NR,Eduardo Gabriel Aquino Cossa,,Grêmio/RS
"",,,,Cartões Amarelos,
Tempo,1T/2T,No,Nome do Jogador,,Equipe
+04:00,2T,32,Diogo Barbosa Mendanha,,Grêmio/RS
"",,,Motivo: A3.  Retardar o reinício do jogo  - Por retardar a colocação da bola em jogo.,,
"",,,,Substituições,
Tempo,1T/2T,,Equipe,Entrou,Saiu
45:00,INT,Grêmio/RS,,11 - Everton Cardoso da Silva,25 - Eduardo Gabriel Aquino Cossa
45:00,INT,Fluminense/RJ,,11 - Marcos Paulo Costa do Nascim...,70 - Caio Fernando de Oliveira
45:00,INT,Fluminense/RJ,,10 - Paulo Henrique Chagas de Lima,15 - Michel Daryl Araujo Villar
16:00,2T,Fluminense/RJ,,19 - Wanderson Felippe Cardoso do...,9 - Frederico Chaves Guedes
16:00,2T,Fluminense/RJ,,34 - Luiz Henrique Andre Rosa da ...,17 - Wellington Alves da Silva
19:00,2T,Grêmio/RS,,47 - Aldemir dos Santos Ferreira,19 - Diego Churin
33:00,2T,Grêmio/RS,,20 - Thaciano Mickael da Silva,33 - Luiz Fernando Moraes dos San...
33:00,2T,Grêmio/RS,,46 - Isaque Elias Brito,21 - Jean Pyerre Casagrande Silve...
40:00,2T,Grêmio/RS,,28 - Jonathan Doin,15 - Darlan Pereira Mendes
40:00,2T,Fluminense/RJ,,7 - Lucca Borges de Brito,25 - Hudson Rodrigues dos Santos
