Campeonato:,Campeonato Brasileiro - Série A/2020,,Rodada:,21
Jogo:,Goiás / GO X Athletico Paranaense / PR,,,
Data:,14/11/2020 Horário: 17:00 Estádio:,Hailé Pinheiro / Goiania,,
"",Arbitragem
Arbitro:,Flavio Rodrigues de Souza (FIFA / SP)
Arbitro Assistente 1:,Miguel Cataneo Ribeiro da Costa (AB / SP)
Arbitro Assistente 2:,Luiz Alberto Andrini Nogueira (AB / SP)
Quarto Arbitro:,Rubens Paulo Rodrigues dos Santos (CD / GO)
Inspetor:,Antonio Pereira da Silva (CBF / GO)
Delegado Local:,Jose Luiz Pitta Pires (CBF / GO)
VAR:,Daniel Nobre Bins (AB / RS)
AVAR1:,Tiago Nascimento dos Santos (AB / PE)
AVAR2:,Mauricio Coelho Silva Penna (AB / RS)
"",,,Cronologia,,,
"",1o Tempo,,2o Tempo,,,
Entrada do mandante:,16:54Atraso:,,Não Houve Entrada do mandante: 17:59,,Atraso:,Não Houve
Entrada do visitante:,16:53Atraso:,,Não Houve Entrada do visitante: 17:58,,Atraso:,Não Houve
Início 1o Tempo:,17:00Atraso:,,Não Houve Início do 2o Tempo: 18:02,,Atraso:,Não Houve
Término do 1o Tempo:,17:47Acréscimo:,,2 min Término do 2o Tempo: 18:55,Acréscimo:,,8 min
Resultado do 1o Tempo: 0 X 1,,,Resultado Final: 0 X 1,,,
"",,,,,Relação de Jogadores,,,
"",,Goiás / GO,,,,Athletico Paranaense / PR,,
No,Apelido,Nome Completo,T/R,P/A,CBF No Apelido,Nome Completo T/R,P/A,CBF
23,Tadeu,Tadeu Antonio Ferreira,T(g),P,308316 1 Santos,Aderbar Melo dos San ... T(g),P,293428
2,Juan Pintado,Juan de Dios Pintado ...,T,P,693536 5 Wellington,Wellington Aparecido ... T,P,184600
3,David Duarte,David de Duarte Macedo,T,P,348537 11 Nikao,Maycon Vinicius Ferr ... T,P,306616
6,Caju,Wanderson de Jesus M ...,T,P,445012 16 Abner Vini ...,Abner Vinicius da Si ... T,P,524291
11,KEKO,Daniel Alberto Villa ...,T,P,693089 18 Cittadini,Leonardo Cittadini T,P,321574
16,Ariel Cabral,Alejandro Ariel Cabral,T,P,535421 26 Erick,Erick Luis Conrado C ... T,P,376073
29,Gilberto Jr.,Gilberto dos Santos  ...,T,P,181827 34 Pedro Henr ...,Pedro Henrique Ribei ... T,P,352037
55,Chico,Luis Francisco Grando,T,P,169890 44 Thiago Heleno,Thiago Heleno Henriq ... T,P,171788
70,Vinicius L ...,Vinicius Lopes da Silva,T,P,543767 79 Renato Kayzer,Renato Kayzer de Souza T,P,337840
95,Douglas Ba ...,Douglas Baggio de Ol ...,T,P,363149 88 Christian,Christian Roberto Al ... T,P,546294
99,Fernandao,Jose Fernando Viana  ...,T,P,188453 96 Carlos Edu ...,Carlos Eduardo Ferre ... T,P,408134
88,Rangel,Marcelo Rangel Rosa,R(g),P,186722 93 Jandrei,Jandrei Chitolina Carniel R(g),P,295557
4,Iago Mendo ...,Iago Pereira Mendonça,R,P,463995 8 Geuvanio,Geuvanio Santos da S ... R,P,311336
7,Alyson,Alyson Jose da Motta,R,P,439510 13 Khellven,Khellven Douglas Sil ... R,P,557878
9,Rafael Moura,Rafael Martiniano de ...,R,P,151437 15 Jaime Alva ...,Jaime Alberto Alvara ... R,P,699299
13,Jefferson  ...,Jefferson Junio Anto ...,R,P,400906 19 Walter,Walter Henrique da Silva R,P,179832
15,Heron,Heron Crespo da Silva,R,P,533689 20 Reinaldo,Reinaldo Nascimento  ... R,P,527941
17,Shaylon,Shaylon Kallyson Cardozo,R,P,421138 23 Felipe Agu ...,Felipe Aguilar Mendoza R,P,646663
22,Kevin Quevedo Kevin Martin Quevedo ...,,R,P,694700 25 Richard,Richard Candido Coelho R,P,376786
25,Gustavo,Gustavo Blanco Peter ...,R,P,367216 27 Ze Ivaldo,Jose Ivaldo Almeida Silva R,P,409873
30,Sandro,Sandro Raniere Guima ...,R,P,187458 40 Joao Victor,Joao Victor da Silva ... R,P,547043
56,Ratinho,Jurani Francisco Ferreira,R,P,434440 55 Canesin,Fernando Canesin Matos R,P,307508
94,Matheus Alves,Matheus Alves da Sil ...,R,P,381586 70 Bruno Leite,Bruno da Silva Costa ... R,P,501383
No,Apelido Nome Completo,,T/R,P/A,CBF,No,Apelido,Nome Completo,T/R,P/A,CBF
23,Tadeu Tadeu Antonio Ferreira,,T(g),P,308316,1,Santos,Aderbar Melo dos San ...,T(g),P,293428
2,Juan Pintado Juan de Dios Pintado ...,,T,P,693536,5,Wellington,Wellington Aparecido ...,T,P,184600
3,David Duarte David de Duarte Macedo,,T,P,348537,11,Nikao,Maycon Vinicius Ferr ...,T,P,306616
6,Caju Wanderson de Jesus M ...,,T,P,445012,16,Abner Vini ...,Abner Vinicius da Si ...,T,P,524291
11,KEKO Daniel Alberto Villa ...,,T,P,693089,18,Cittadini,Leonardo Cittadini,T,P,321574
16,Ariel Cabral Alejandro Ariel Cabral,,T,P,535421,26,Erick,Erick Luis Conrado C ...,T,P,376073
29,Gilberto Jr. Gilberto dos Santos  ...,,T,P,181827,34,Pedro Henr ...,Pedro Henrique Ribei ...,T,P,352037
55,Chico Luis Francisco Grando,,T,P,169890,44,Thiago Heleno,Thiago Heleno Henriq ...,T,P,171788
70,Vinicius L ... Vinicius Lopes da Silva,,T,P,543767,79,Renato Kayzer,Renato Kayzer de Souza,T,P,337840
95,Douglas Ba ... Douglas Baggio de Ol ...,,T,P,363149,88,Christian,Christian Roberto Al ...,T,P,546294
99,Fernandao Jose Fernando Viana  ...,,T,P,188453,96,Carlos Edu ...,Carlos Eduardo Ferre ...,T,P,408134
88,Rangel Marcelo Rangel Rosa,,R(g),P,186722,93,Jandrei,Jandrei Chitolina Carniel,R(g),P,295557
4,Iago Mendo ... Iago Pereira Mendonça,,R,P,463995,8,Geuvanio,Geuvanio Santos da S ...,R,P,311336
7,Alyson Alyson Jose da Motta,,R,P,439510,13,Khellven,Khellven Douglas Sil ...,R,P,557878
9,Rafael Moura Rafael Martiniano de ...,,R,P,151437,15,Jaime Alva ...,Jaime Alberto Alvara ...,R,P,699299
13,Jefferson  ... Jefferson Junio Anto ...,,R,P,400906,19,Walter,Walter Henrique da Silva,R,P,179832
15,Heron Heron Crespo da Silva,,R,P,533689,20,Reinaldo,Reinaldo Nascimento  ...,R,P,527941
17,Shaylon Shaylon Kallyson Cardozo,,R,P,421138,23,Felipe Agu ...,Felipe Aguilar Mendoza,R,P,646663
22,Kevin Quevedo Kevin Martin Quevedo ...,,R,P,694700,25,Richard,Richard Candido Coelho,R,P,376786
25,Gustavo Gustavo Blanco Peter ...,,R,P,367216,27,Ze Ivaldo,Jose Ivaldo Almeida Silva,R,P,409873
30,Sandro Sandro Raniere Guima ...,,R,P,187458,40,Joao Victor,Joao Victor da Silva ...,R,P,547043
56,Ratinho Jurani Francisco Ferreira,,R,P,434440,55,Canesin,Fernando Canesin Matos,R,P,307508
94,Matheus Alves Matheus Alves da Sil ...,,R,P,381586,70,Bruno Leite,Bruno da Silva Costa ...,R,P,501383
"",,Comissão Técnica,
"",Goiás / GO,,Athletico Paranaense / PR
Técnico:,Enderson Alves Moreira,Técnico:,Paulo Autuori De Mello
Auxiliar Técnico:,Luis Fernando Rosa Flores,Auxiliar Técnico:,Bernardo Franco Junior
Médico:,Igor De Castro Aquino,Médico:,Rodrigo Gorte Basaglia
Treinador De Goleiros:,Marlos Gomes Santos,Treinador De Goleiros:,Felipe Faria De Souza
Preparador Físico:,Edy Carlos Toporowicz,Preparador Físico:,Tulio Flores Dos Santos
Fisioterapeuta:,Leonardo Oliveira De Morais,Massagista:,Juan Pablo Fiorenza
"",,,,,Gols,
Tempo,1T/2T,No,Tipo,Nome do Jogador,,Equipe
19:00,1T,79,NR,Renato Kayzer de Souza,,Athletico Paranaense/PR
"",,,,Substituições,
Tempo,1T/2T,,Equipe,Entrou,Saiu
45:00,INT,Goiás/GO,,30 - Sandro Raniere Guimaraes Cor...,29 - Gilberto dos Santos Souza Ju...
45:00,INT,Goiás/GO,,17 - Shaylon Kallyson Cardozo,70 - Vinicius Lopes da Silva
18:00,2T,Goiás/GO,,15 - Heron Crespo da Silva,55 - Luis Francisco Grando
20:00,2T,Athletico Paranaense/PR,,55 - Fernando Canesin Matos,18 - Leonardo Cittadini
22:00,2T,Athletico Paranaense/PR,,20 - Reinaldo Nascimento Satorno,96 - Carlos Eduardo Ferreira de S...
28:00,2T,Goiás/GO,,9 - Rafael Martiniano de Miranda...,11 - Daniel Alberto Villalva Barr...
35:00,2T,Athletico Paranaense/PR,,25 - Richard Candido Coelho,88 - Christian Roberto Alves Card...
35:00,2T,Goiás/GO,,25 - Gustavo Blanco Petersen Macedo,16 - Alejandro Ariel Cabral
35:00,2T,Athletico Paranaense/PR,,27 - Jose Ivaldo Almeida Silva,5 - Wellington Aparecido Martins
