Campeonato:,Campeonato Brasileiro - Série A/2020,,Rodada:,35
Jogo:,Red Bull Bragantino / SP X Flamengo / RJ,,,
Data:,07/02/2021 Horário: 20:30 Estádio:,Nabi Abi Chedid / Braganca Paulista,,
"",,Arbitragem
Arbitro:,Wilton Pereira Sampaio (FIFA / GO),
Arbitro Assistente 1:,Fabricio Vilarinho da Silva (FIFA / GO),
Arbitro Assistente 2:,Bruno Raphael Pires (FIFA / GO),
Quarto Arbitro:,Rafael Gomes Felix da Silva (CD / SP),
Delegado Local:,Rogerio Menezes Lopes (FD / SP),
Analista de Campo:,Marcelino Tomaz de Brito Neto (CBF / SP),
VAR:,Elmo Alves Resende Cunha (MTR / GO),
AVAR1:,Jefferson Ferreira de Moraes (AB / GO),
AVAR2:,Leone Carvalho Rocha (AB / GO),
"",,,Cronologia,,,
"",1o Tempo,,2o Tempo,,,
Entrada do mandante:,20:20Atraso:,,Não Houve Entrada do mandante: 21:31,,Atraso:,Não Houve
Entrada do visitante:,20:20Atraso:,,Não Houve Entrada do visitante: 21:32,,Atraso:,Não Houve
Início 1o Tempo:,20:30Atraso:,,Não Houve Início do 2o Tempo: 21:34,,Atraso:,Não Houve
Término do 1o Tempo:,21:19Acréscimo:,,4 min Término do 2o Tempo: 22:25,Acréscimo:,,6 min
Resultado do 1o Tempo: 0 X 1,,,Resultado Final: 1 X 1,,,
"",,,,,Relação de Jogadores,,,,
"",,Red Bull Bragantino / SP,,,,Flamengo / RJ,,,
No,Apelido,Nome Completo T/R,,P/A,CBF No Apelido,Nome Completo,T/R,P/A,CBF
40,Cleiton,Cleiton Schwengber T(g),,P,384823 45 Hugo,Hugo de Souza Nogueira,T(g),P,376228
3,Ortiz,Leonardo Rech Ortiz T,,P,422469 2 Gustavo,Gustavo Henrique Vernes,T,P,186450
4,Ligger,Ligger Moreira Malaquias T,,P,291797 5 Willian Arão,Willian Souza Arao d ...,T,P,293420
6,Edimar,Edimar Curitiba Fraga T,,P,163254 7 Everton Ri ...,Everton Augusto de B ...,T,P,177444
7,Artur,Artur Victor Guimaraes T,,P,419646 8 Gerson,Gerson Santos da Silva,T,P,310733
10,Claudinho,Claudio Luiz Rodrigu ... T,,P,339209 9 Gabriel Ba ...,Gabriel Barbosa Almeida,T,P,337830
13,Aderlan,Aderlan de Lima Silva T,,P,291939 14 De Arrascaeta,Giorgian Daniel de A ...,T,P,521990
15,Ytalo,Ytalo Jose Oliveira  ... T,,P,169945 16 Filipe Luís,Filipe Luis Kasmirski,T,P,156447
23,Raul,Raul Lo Goncalves T,,P,446399 27 Bruno Henr ...,Bruno Henrique Pinto,T,P,401839
25,Ricardo,Ricardo Ryller Ribei ... T,,P,428406 35 João Victor,João Victor Gomes da ...,T,P,567529
37,Hélio Junio,Helio Junio Nunes de ... T,,P,464258 44 Isla,Mauricio Anibal Isla Isla,T,P,700851
1,Julio Cesar,Julio Cesar de Souza ... R(g),,P,150963 37 Cesar,Cesar Bernardo Dutra,R(g),P,307296
8,Uillian Co ...,Uillian Correia Granemann R,,P,180789 4 Leo Pereira,Leonardo Pereira,R,P,310373
16,Eric Ramires,Eric dos Santos Rodrigues R,,P,521939 6 Rene,Rene Rodrigues Martins,R,P,346636
17,Weverton,Weverton Guilherme d ... R,,P,537549 11 Vitinho,Victor Vinicius Coel ...,R,P,307245
18,Chrigor,Chrigor Flores Moraes R,,P,581594 13 Joao,Joao Lucas de Almeid ...,R,P,530965
20,Bruno,Bruno Nunes de Barros R,,P,308190 19 Michael,Michael Richard Delg ...,R,P,534667
28,Cuello,Tomas Esteban Cuello R,,P,695547 21 Pedro,Pedro Guilherme Abre ...,R,P,303716
31,Vitinho,Victor Hugo Santana  ... R,,P,409125 31 Natan,Natan Bernardo de Souza,R,P,538649
33,Jan Hurtado,Jan Carlos Hurtado A ... R,,P,700808 34 Matheuzinho,Matheus Franca Silva,R,P,565578
34,Weverson,Weverson Moreira da Costa R,,P,464293 40 Joao,Joao Pedro Vilardi Pinto,R,P,321898
36,Luan Candido,Luan Candido de Almeida R,,P,540157 43 Rodrigo Muniz,Rodrigo Muniz Carvalho,R,P,544730
"",,,,,54 RICHARD,Richard Rios Montoya,R,P,672172
No,Apelido,Nome Completo T/R,,P/A,CBF,No,Apelido,Nome Completo,T/R,P/A,CBF
40,Cleiton,Cleiton Schwengber T(g),,P,384823,45,Hugo,Hugo de Souza Nogueira,T(g),P,376228
3,Ortiz,Leonardo Rech Ortiz T,,P,422469,2,Gustavo,Gustavo Henrique Vernes,T,P,186450
4,Ligger,Ligger Moreira Malaquias T,,P,291797,5,Willian Arão,Willian Souza Arao d ...,T,P,293420
6,Edimar,Edimar Curitiba Fraga T,,P,163254,7,Everton Ri ...,Everton Augusto de B ...,T,P,177444
7,Artur,Artur Victor Guimaraes T,,P,419646,8,Gerson,Gerson Santos da Silva,T,P,310733
10,Claudinho,Claudio Luiz Rodrigu ... T,,P,339209,9,Gabriel Ba ...,Gabriel Barbosa Almeida,T,P,337830
13,Aderlan,Aderlan de Lima Silva T,,P,291939,14,De Arrascaeta,Giorgian Daniel de A ...,T,P,521990
15,Ytalo,Ytalo Jose Oliveira  ... T,,P,169945,16,Filipe Luís,Filipe Luis Kasmirski,T,P,156447
23,Raul,Raul Lo Goncalves T,,P,446399,27,Bruno Henr ...,Bruno Henrique Pinto,T,P,401839
25,Ricardo,Ricardo Ryller Ribei ... T,,P,428406,35,João Victor,João Victor Gomes da ...,T,P,567529
37,Hélio Junio,Helio Junio Nunes de ... T,,P,464258,44,Isla,Mauricio Anibal Isla Isla,T,P,700851
1,Julio Cesar,Julio Cesar de Souza ... R(g),,P,150963,37,Cesar,Cesar Bernardo Dutra,R(g),P,307296
8,Uillian Co ...,Uillian Correia Granemann R,,P,180789,4,Leo Pereira,Leonardo Pereira,R,P,310373
16,Eric Ramires,Eric dos Santos Rodrigues R,,P,521939,6,Rene,Rene Rodrigues Martins,R,P,346636
17,Weverton,Weverton Guilherme d ... R,,P,537549,11,Vitinho,Victor Vinicius Coel ...,R,P,307245
18,Chrigor,Chrigor Flores Moraes R,,P,581594,13,Joao,Joao Lucas de Almeid ...,R,P,530965
20,Bruno,Bruno Nunes de Barros R,,P,308190,19,Michael,Michael Richard Delg ...,R,P,534667
28,Cuello,Tomas Esteban Cuello R,,P,695547,21,Pedro,Pedro Guilherme Abre ...,R,P,303716
31,Vitinho,Victor Hugo Santana  ... R,,P,409125,31,Natan,Natan Bernardo de Souza,R,P,538649
33,Jan Hurtado,Jan Carlos Hurtado A ... R,,P,700808,34,Matheuzinho,Matheus Franca Silva,R,P,565578
34,Weverson,Weverson Moreira da Costa R,,P,464293,40,Joao,Joao Pedro Vilardi Pinto,R,P,321898
36,Luan Candido,Luan Candido de Almeida R,,P,540157,43,Rodrigo Muniz,Rodrigo Muniz Carvalho,R,P,544730
"",,,,,,54,RICHARD,Richard Rios Montoya,R,P,672172
"",,Comissão Técnica,
"",Red Bull Bragantino / SP,,Flamengo / RJ
Técnico:,Mauricio Nogueira Barbieri,Técnico:,Rogerio Ceni
Auxiliar Técnico:,Claudio Andres Del Transito Maldonado Rivera,Auxiliar Técnico:,Charles Alexandre Patrice Francis Hembert
Médico:,Ricardo Guilherme Eid,Médico:,Marcelo Soares Da Silva
Treinador De Goleiros:,Rodrigo Guido Bruns,Treinador De Goleiros:,Wagner Paulino Miranda
Preparador Físico:,Reverson Bastos Pimentel,Preparador Físico:,Danilo Augusto Da Silva
Massagista:,Joao Carlos De Sousa Nobre,Fisioterapeuta:,Mario Galdi Peixoto
"",,,,,Gols,
Tempo,1T/2T,No,Tipo,Nome do Jogador,,Equipe
34:00,1T,9,PN,Gabriel Barbosa Almeida,,Flamengo/RJ
17:00,2T,15,NR,Ytalo Jose Oliveira dos Santos,,Red Bull Bragantino/SP
"",,,,Substituições,
Tempo,1T/2T,,Equipe,Entrou,Saiu
+1:00,2T,Flamengo/RJ,,11 - Victor Vinicius Coelho Santos,27 - Bruno Henrique Pinto
+1:00,2T,Flamengo/RJ,,34 - Matheus Franca Silva,44 - Mauricio Anibal Isla Isla
25:00,2T,Red Bull Bragantino/SP,,16 - Eric dos Santos Rodrigues,25 - Ricardo Ryller Ribeiro Lino ...
37:00,2T,Red Bull Bragantino/SP,,33 - Jan Carlos Hurtado Anchico,15 - Ytalo Jose Oliveira dos Santos
42:00,2T,Flamengo/RJ,,21 - Pedro Guilherme Abreu dos Sa...,8 - Gerson Santos da Silva
42:00,2T,Flamengo/RJ,,40 - Joao Pedro Vilardi Pinto,35 - João Victor Gomes da Silva
45:00,2T,Red Bull Bragantino/SP,,36 - Luan Candido de Almeida,6 - Edimar Curitiba Fraga
45:00,2T,Red Bull Bragantino/SP,,20 - Bruno Nunes de Barros,37 - Helio Junio Nunes de Castro
