Campeonato:,Campeonato Brasileiro - Série A/2020,,Rodada:,32
Jogo:,Internacional / RS X Grêmio / RS,,,
Data:,24/01/2021 Horário: 16:00 Estádio:,José Pinheiro Borda / Porto Alegre,,
"",,Arbitragem
Arbitro:,Luiz Flavio de Oliveira (FIFA / SP),
Arbitro Assistente 1:,Danilo Ricardo Simon Manis (FIFA / SP),
Arbitro Assistente 2:,Miguel Cataneo Ribeiro da Costa (AB / SP),
Quarto Arbitro:,Jonathan Benkenstein Pinheiro (CD / RS),
Inspetor:,Jose Mocellin (CBF / RS),
Delegado Local:,Paulo Ricardo Machado Santos (CBF / ),
VAR:,Wagner Reway (MTR / PB),
AVAR1:,Dewson Fernando Freitas da Silva (MTR / PA),
AVAR2:,Oberto da Silva Santos (AB / PB),
"",,,Cronologia,,,
"",1o Tempo,,2o Tempo,,,
Entrada do mandante:,15:55Atraso:,,Não Houve Entrada do mandante: 17:02,,Atraso:,Não Houve
Entrada do visitante:,15:56Atraso:,,Não Houve Entrada do visitante: 17:01,,Atraso:,Não Houve
Início 1o Tempo:,16:00Atraso:,,Não Houve Início do 2o Tempo: 17:04,,Atraso:,Não Houve
Término do 1o Tempo:,16:49Acréscimo:,,4 min Término do 2o Tempo: 17:56,Acréscimo:,,7 min
Resultado do 1o Tempo: 0 X 0,,,Resultado Final: 2 X 1,,,
"",,,,,Relação de Jogadores,,,,
"",,Internacional / RS,,,,Grêmio / RS,,,
No,Apelido,Nome Completo T/R,,P/A,CBF No Apelido,Nome Completo T/R,,P/A,CBF
12,Marcelo,Marcelo Lomba do Nas ... T(g),,P,157264 27 Vanderlei,Vanderlei Farias da Silva T(g),,P,177770
8,Edenilson,Edenilson Andrade do ... T,,P,306270 2 Victor Ferraz,Victor Ferraz Macedo T,,P,170272
11,Yuri Alberto,Yuri Alberto Monteir ... T,,P,436395 3 Geromel,Pedro Tonon Geromel T,,P,165322
13,Rodrigo Do ...,Rodrigo Dourado Cunha T,,P,296330 4 Kannemann,Walter Kannemann T,,P,554626
14,Lucas Ribeiro,Lucas Ribeiro dos Santos T,,P,540238 7 Matheus He ...,Matheus Henrique de SouzaT,,P,407776
15,Victor Cuesta,Victor Leandro Cuesta T,,P,567555 10 Jean Pyerre,Jean Pyerre Casagran ... T,,P,422351
20,Moises,Moises Roberto Barbosa T,,P,318481 16 Lucas Silva,Lucas Silva Borges T,,P,320111
22,Rodinei,Rodinei Marcelo de A ... T,,P,353568 23 Alisson,Alisson Euler de Fre ... T,,P,317751
31,João Peglow,Joao Gabriel Martins ... T,,P,520239 25 Pepe,Eduardo Gabriel Aqui ... T,,P,428672
45,Praxedes,Bruno Conceicao Praxedes T,,P,541788 29 Diego Souza,Diego de Souza Andrade T,,P,161625
88,Patrick,Patrick Bezerra do N ... T,,P,315585 32 Diogo,Diogo Barbosa Mendanha T,,P,339876
1,Danilo Fer ...,Danilo Fernandes Batista R(g),,P,165830 1 Paulo Victor,Paulo Victor Mileo V ... R(g),,P,175411
2,Heitor Rod ...,Heitor Rodrigues da  ... R,,P,464051 8 Maicon,Maicon Thiago Pereir ... R,,P,166603
6,Uendel,Uendel Pereira Goncalves R,,P,175320 11 Everton,Everton Cardoso da Silva R,,P,178361
18,Leandro,Leandro Miguel Fernandez R,,P,701189 12 Cortez,Bruno Cortes Barbosa R,,P,180546
19,Rodrigo,Rodrigo Oliveira Lindoso R,,P,184455 14 David Braz,David Braz de Olivei ... R,,P,168008
23,Marcos Gui ...,Marcos Guilherme de  ... R,,P,295821 15 Darlan,Darlan Pereira Mendes R,,P,422352
27,Mauricio,Mauricio Magalhaes Prado R,,P,542337 19 Churin,Diego Churin R,,P,705188
30,Joao Lucas,Joao Lucas de Souza  ... R,,P,516798 20 Thaciano,Thaciano Mickael da Silva R,,P,391953
33,Nonato,Gustavo Nonato Santana R,,P,337363 21 Cesar Pinares,Cesar Ignacio Pinare ... R,,P,706467
35,Gabriel,Jose Gabriel dos San ... R,,P,372403 33 Luiz Fernando,Luiz Fernando Moraes ... R,,P,451607
41,Pedro Henr ...,Pedro Henrique Alves ... R,,P,532559 38 Rodrigues,Antonio Josenildo Ro ... R,,P,434738
99,Abel,Abel Mathias Hernand ... R,,P,701161 47 Ferreira,Aldemir dos Santos F ... R,,P,505058
No,Apelido,Nome Completo T/R,,P/A,CBF,No,Apelido,Nome Completo T/R,,P/A,CBF
12,Marcelo,Marcelo Lomba do Nas ... T(g),,P,157264,27,Vanderlei,Vanderlei Farias da Silva T(g),,P,177770
8,Edenilson,Edenilson Andrade do ... T,,P,306270,2,Victor Ferraz,Victor Ferraz Macedo T,,P,170272
11,Yuri Alberto,Yuri Alberto Monteir ... T,,P,436395,3,Geromel,Pedro Tonon Geromel T,,P,165322
13,Rodrigo Do ...,Rodrigo Dourado Cunha T,,P,296330,4,Kannemann,Walter Kannemann T,,P,554626
14,Lucas Ribeiro,Lucas Ribeiro dos Santos T,,P,540238,7,Matheus He ...,Matheus Henrique de SouzaT,,P,407776
15,Victor Cuesta,Victor Leandro Cuesta T,,P,567555,10,Jean Pyerre,Jean Pyerre Casagran ... T,,P,422351
20,Moises,Moises Roberto Barbosa T,,P,318481,16,Lucas Silva,Lucas Silva Borges T,,P,320111
22,Rodinei,Rodinei Marcelo de A ... T,,P,353568,23,Alisson,Alisson Euler de Fre ... T,,P,317751
31,João Peglow,Joao Gabriel Martins ... T,,P,520239,25,Pepe,Eduardo Gabriel Aqui ... T,,P,428672
45,Praxedes,Bruno Conceicao Praxedes T,,P,541788,29,Diego Souza,Diego de Souza Andrade T,,P,161625
88,Patrick,Patrick Bezerra do N ... T,,P,315585,32,Diogo,Diogo Barbosa Mendanha T,,P,339876
1,Danilo Fer ...,Danilo Fernandes Batista R(g),,P,165830,1,Paulo Victor,Paulo Victor Mileo V ... R(g),,P,175411
2,Heitor Rod ...,Heitor Rodrigues da  ... R,,P,464051,8,Maicon,Maicon Thiago Pereir ... R,,P,166603
6,Uendel,Uendel Pereira Goncalves R,,P,175320,11,Everton,Everton Cardoso da Silva R,,P,178361
18,Leandro,Leandro Miguel Fernandez R,,P,701189,12,Cortez,Bruno Cortes Barbosa R,,P,180546
19,Rodrigo,Rodrigo Oliveira Lindoso R,,P,184455,14,David Braz,David Braz de Olivei ... R,,P,168008
23,Marcos Gui ...,Marcos Guilherme de  ... R,,P,295821,15,Darlan,Darlan Pereira Mendes R,,P,422352
27,Mauricio,Mauricio Magalhaes Prado R,,P,542337,19,Churin,Diego Churin R,,P,705188
30,Joao Lucas,Joao Lucas de Souza  ... R,,P,516798,20,Thaciano,Thaciano Mickael da Silva R,,P,391953
33,Nonato,Gustavo Nonato Santana R,,P,337363,21,Cesar Pinares,Cesar Ignacio Pinare ... R,,P,706467
35,Gabriel,Jose Gabriel dos San ... R,,P,372403,33,Luiz Fernando,Luiz Fernando Moraes ... R,,P,451607
41,Pedro Henr ...,Pedro Henrique Alves ... R,,P,532559,38,Rodrigues,Antonio Josenildo Ro ... R,,P,434738
99,Abel,Abel Mathias Hernand ... R,,P,701161,47,Ferreira,Aldemir dos Santos F ... R,,P,505058
"",,Comissão Técnica,
"",Internacional / RS,,Grêmio / RS
Técnico:,Abel Carlos Da Silva Braga,Técnico:,Renato Portaluppi
Auxiliar Técnico:,Leomir De Souza,Auxiliar Técnico:,Alexandre Pereira Mendes
Médico:,Guilherme Velho Caputo,Médico:,Paulo Augusto Da Silva Rabaldo
Treinador De Goleiros:,Daniel Da Fonseca Pavan,Treinador De Goleiros:,Mauri Costa Lima
Preparador Físico:,Cristiano Garcia Nunes,Preparador Físico:,Marcio Meira De Vasconcelos
Massagista:,Paulo Renato Aviz Da Silva,Massagista:,Marco Aurelio Zeilmann
"",,,,,Gols,
Tempo,1T/2T,No,Tipo,Nome do Jogador,,Equipe
30:00,2T,10,NR,Jean Pyerre Casagrande Silveira Correa,,Grêmio/RS
44:00,2T,99,NR,Abel Mathias Hernandez Platero,,Internacional/RS
+7,2T,8,PN,Edenilson Andrade dos Santos,,Internacional/RS
"",,,,Cartões Amarelos
Tempo,1T/2T,No,Nome do Jogador,Equipe
24:00,2T,20,Moises Roberto Barbosa,Internacional/RS
"",,,Motivo: A4.  Infringir persistentemente as regras do jogo  - Por cometer seguidas faltas em curto espaço de tempo.,
"",,,,Substituições,
Tempo,1T/2T,,Equipe,Entrou,Saiu
41:00,1T,Grêmio/RS,,38 - Antonio Josenildo Rodrigues ...,3 - Pedro Tonon Geromel
12:00,2T,Internacional/RS,,27 - Mauricio Magalhaes Prado,31 - Joao Gabriel Martins Peglow
28:00,2T,Grêmio/RS,,8 - Maicon Thiago Pereira de Souza,23 - Alisson Euler de Freitas Cas...
28:00,2T,Grêmio/RS,,47 - Aldemir dos Santos Ferreira,16 - Lucas Silva Borges
28:00,2T,Grêmio/RS,,33 - Luiz Fernando Moraes dos San...,25 - Eduardo Gabriel Aquino Cossa
33:00,2T,Internacional/RS,,23 - Marcos Guilherme de Almeida ...,88 - Patrick Bezerra do Nascimento
33:00,2T,Internacional/RS,,99 - Abel Mathias Hernandez Platero,45 - Bruno Conceicao Praxedes
39:00,2T,Grêmio/RS,,21 - Cesar Ignacio Pinares Tamayo,10 - Jean Pyerre Casagrande Silve...
39:00,2T,Internacional/RS,,6 - Uendel Pereira Goncalves,20 - Moises Roberto Barbosa
39:00,2T,Internacional/RS,,33 - Gustavo Nonato Santana,13 - Rodrigo Dourado Cunha
