Campeonato:,Campeonato Brasileiro - Série D/2019,,Rodada:,Volta
Jogo:,Tupi / MG X Hercilio Luz Futebol Clube / SC,,,
Data:,09/06/2019 Horário: 18:00 Estádio:,Mario Helênio / Juiz de Fora,,
"",Arbitragem
Arbitro:,Valdicleuson Silva da Costa (CD / AP)
Arbitro Assistente 1:,Inácio Barreto da Camara (CD / AP)
Arbitro Assistente 2:,Roberto Soares dos Santos Junior (CD / AP)
Quarto Arbitro:,Michel Patrick Costa Guimaraes (INT / MG)
Analista de Campo:,Marcio Eustaquio Sousa Santiago (CBF / MG)
"",,,Cronologia,,,
"",1o Tempo,,2o Tempo,,,
Entrada do mandante:,17:50Atraso:,,Não Houve Entrada do mandante: 19:00,,Atraso:,Não Houve
Entrada do visitante:,17:50Atraso:,,Não Houve Entrada do visitante: 19:00,,Atraso:,Não Houve
Início 1o Tempo:,18:00Atraso:,,Não Houve Início do 2o Tempo: 19:02,,Atraso:,Não Houve
Término do 1o Tempo:,18:47Acréscimo:,,02 min Término do 2o Tempo: 19:52,Acréscimo:,,05 min
Resultado do 1o Tempo: 0 X 0,,,Resultado Final: 2 X 0,,,
"",,,,,Relação de Jogadores,,,
"",,Tupi / MG,,,Hercilio Luz Futebol Clube / SC,,,
No,Apelido,Nome Completo,T/R,P/A,CBF No Apelido,Nome Completo T/R,P/A,CBF
1,Ricardo Vilar,Ricardo Kaschensky Vilar T(g),,P,161666 1 Paulo Sergio,Paulo Sergio dos San ... T(g),P,141955
2,Ryan,Thiago Ryan Andrade  ...,T,P,299628 2 Thiago Mac ...,Thiago Flores Machado T,P,167312
3,Matheus,Matheus Miguel Guima ...,T,P,511457 3 Murilo Freire,Murilo Henrique Frei ... T,P,181198
4,Jose Arthur,Jose Arthur Sanches Filho,T,P,295536 4 Carlos Ric ...,Carlos Ricardo Ribei ... T,P,329988
5,Thales,Thales Fernandes Jardim,T,P,423161 5 Leonardo,Leonardo de Oliveira ... T,P,377082
6,Pablo,Pablo Gabriel dos Santos,T,P,533513 6 VAVA,Evailton de Franca Rocha T,P,350451
7,Pedro,Pedro Vitor de Sousa ...,T,P,403455 7 Erick,Erick Samuel Correa  ... T,P,349759
8,Joao Vitor,Joao Vitor Ribeiro R ...,T,P,294832 8 Rudnei,Rudnei da Rosa T,P,155518
9,Ademilson,Ademilson Correa,T,P,121951 9 Kayron,Kayron Batista Ramos T,P,395092
10,Hugo,Hugo Rodrigues Barbosa,T,P,316648 10 Juliano,Juliano Alexandre Borges T,P,298313
11,Washington,Washington Cesar do  ...,T,P,551868 11 Leo Bahia,Francisco Eliomar Ro ... T,P,359353
12,Davyd,Davyd Sena Francoso R(g),,P,533503 12 Tigre,Vanderson Luiz Rodri ... R(g),P,168000
13,Guilherme  ...,Guilherme Henrique S ...,R,P,523707 13 HITALO,Hitalo Rogerio Coelh ... R,P,291704
14,Pedro Henr ...,Pedro Henrique Nasci ...,R,P,534028 14 JÔ,Joshua de Souza Ribeiro R,P,400878
15,Rodrigo So ...,Rodrigo Souza de Jesus,R,P,447820 15 Janderson,Janderson de Almeida ... R,P,181751
16,Marco Tulio,Marco Tulio do Nascimento,R,P,415465 16 Mateus,Mateus de Souza Arence R,P,359887
17,Gabrielzinho,Gabriel de Melo Prates,R,P,456935 17 Rafael,Rafael Sayao Rodrigu ... R,P,370076
18,Patrick,Patrick Cruz de Mour ...,R,P,532696 18 Junior Jua ...,Jose Josenildo Marqu ... R,P,295958
19,Cazares,Samuel Meguias de Al ...,R,P,554443,,,
"",,Comissão Técnica,
"",Tupi / MG,Hercilio Luz Futebol Clube / SC,
Técnico:,Tarso Teixeira Lobo Guarino,Técnico:,Julio Cesar Nunes
Médico:,Waltencir Norberto Freguglia,Auxiliar Técnico:,Everton Soares Ernesto
Treinador De Goleiros:,Rogerio Matheus Da Silva,Treinador De Goleiros:,Tiago Schmidt
Preparador Físico:,Jonas Mauro Das Neves Oliveira,Preparador Físico:,Pedro Evandro Francke
Massagista:,Adeil De Souza Silva,Massagista:,Joao Ricardo Bueno Lemes
"",,,,,Gols,
Tempo,1T/2T,No,Tipo,Nome do Jogador,,Equipe
04:00,2T,11,NR,Washington Cesar do Carmo Ferreira,,Tupi/MG
44:00,2T,19,NR,Samuel Meguias de Almeida Conrado,,Tupi/MG
"",,,Substituições,
Tempo,1T/2T,Equipe,Entrou,Saiu
12:00,2T,Hercilio Luz Futebol Clube...,18 - Jose Josenildo Marques de Ar...,9 - Kayron Batista Ramos
13:00,2T,Tupi/MG,13 - Guilherme Henrique Souza de ...,6 - Pablo Gabriel dos Santos
18:00,2T,Tupi/MG,19 - Samuel Meguias de Almeida Co...,7 - Pedro Vitor de Sousa Neto Si...
22:00,2T,Hercilio Luz Futebol Clube...,16 - Mateus de Souza Arence,5 - Leonardo de Oliveira Costa
26:00,2T,Tupi/MG,15 - Rodrigo Souza de Jesus,5 - Thales Fernandes Jardim
34:00,2T,Hercilio Luz Futebol Clube...,17 - Rafael Sayao Rodrigues de Ol...,2 - Thiago Flores Machado
