"",,Arbitragem
Arbitro:,Leo Simão Holanda (CBF-2 / CE),
Arbitro Assistente 1:,Ricardo Bezerra Chianca (CBF-1 / PE),
Arbitro Assistente 2:,Fabrício Leite Sales (CBF-2 / PE),
Quarto Arbitro:,Diego Fernando Silva E Lima (CBF-2 / PE),
Assessor:,Francisco Domingos da Silva (ASS / PE),
"",,,Cronologia,,,
"",1o Tempo,,2o Tempo,,,
Entrada do mandante:,15:50Atraso:,,Não Houve Entrada do mandante: 16:58,Atraso:,,Não Houve
Entrada do visitante:,15:50Atraso:,,Não Houve Entrada do visitante: 16:58,Atraso:,,Não Houve
Início 1o Tempo:,16:00 Atraso:,,Não Houve Início do 2o Tempo: 17:01,Atraso:,,Não Houve
Término do 1o Tempo:,16:46 Acréscimo:,,1 min Término do 2o Tempo: 17:51,Acréscimo:,,5 min
Resultado do 1o Tempo: 0 X 0,,,Resultado Final: 1 X 0,,,
"",,,,Relação de Jogadores,,,
"",,Serra Talhada / PE,,,Campinense / PB,,
No,Apelido,Nome Completo,T/R P/A,CBF No Apelido,Nome Completo T/R P/A,,CBF
1,Severino,Severino Ferreira de ...,T P,158653 1 Gledson,Gledson Ribeiro dos ... T,P,159483
2,Robert,Robert Junior Sousa  ...,T P,175481 2 Everaldo,Everaldo Gomes da Silva T,P,313927
3,Alenilson,Alenilson Dantas de  ...,T P,296145 3 Joecio,Joecio Barbosa dos S... T,P,174017
4,Alexandre,Alexandre Henrique R ...,T P,170707 4 Tiago Sala,Tiago Sala T,P,154309
5,Ramon,Carlos Ramon Bezerra ...,T P,187342 5 Joao Neto,Joao de Oliveira Cav... T,P,184416
6,Enercino,Enercino Moreira Bezerra,T P,172922 6 Filipe,Filipe Ramon Silva L... T,P,299373
7,Franca,Francieudo de Souza,T P,174968 7 Magno,Magno Souza da Silva T,P,292998
8,Fernando,Fernando Pires dos S ...,T P,297409 8 Valdeir,Valdeir Batista de Souza T,P,341083
9,Andre,Andre Tavares da Cunha,T P,166228 9 Rodrigo,Rodrigo Gomes dos Santos T,P,398368
10,Lucas,Lucas Henrique Loure ...,T P,404447 10 Eder,Eder Sales Guerreiro T,P,306397
11,Patrick,Patrick dos Santos Silva,T P,363869 11 Tulio,Tulio Renan Souza Xavier T,P,291978
12,Beto,Carlos Weberton da S ...,R P,137022 12 Alex,Alex Alves de Lima R,P,173056
13,Amaury,Amaury Gomes do Nasc ...,R A,436677 14 Joao Paulo,Joao Paulo Pereira M... R,P,165296
14,Anderson,Andson Cicero da Silva,R P,373133 15 Ronaell,Ronaell Rubens da Si... R,P,182403
15,Everton,Everton Nascimento R ...,R P,435570 16 Jackson,Jackson Felipe Apare... R,P,185893
16,Neto,Joaquim Barbosa da S ...,R A,404446 17 Marcelo,Marcelo de Souza Maciel R,P,177543
17,Arthur Men ...,Arthur Mendes da Silva,R P,455666 18 Endrick,Endrick dos Santos P... R,P,380845
18,Geovani,Geovani Cortes Gomes,R P,400288 19 Canga,Adilson Ferreira Gomes R,P,334012
19,Paulo Victor,Paulo Victor Marinho ...,R P,436673,,,
"",,Comissão Técnica,
"",Serra Talhada / PE,,Campinense / PB
Técnico:,Alexandre Lima - 1629166,Técnico:,Francisco De Assis Ciriaco Dos Santos - 000191303670000
Auxiliar Técnico:,Xxxxxxxxx - XXXXXXX,Auxiliar Técnico:,Romildo Freire De Lima - 000628642
Médico:,Marcelo André De Ferraz Barros - 15089,Médico:,Daniel Guerra Araújo - 5149
Preparador Físico:,Igor José Valença Tenório - 001923,Preparador Físico:,Jean Robson Barros - 001201
Massagista:,Danilo Kleber Pereira Da Silva - 7347263,Massagista:,Francisco De Assis Dos Santos - 365112
"",,,,,Gols,
Tempo,1T/2T,No,Tipo,Nome do Jogador,,Equipe
38:00,2T,9,NR,Andre Tavares da Cunha,,Serra Talhada/PE
"",,,Substituições,
Tempo,1T/2T,Equipe,Entrou,Saiu
37:00,1T,Campinense/PB,19 - Adilson Ferreira Gomes,9 - Rodrigo Gomes dos Santos
12:00,2T,Campinense/PB,14 - Joao Paulo Pereira Mendes ...,8 - Valdeir Batista de Souza
27:00,2T,Serra Talhada/PE,18 - Geovani Cortes Gomes,10 - Lucas Henrique Lourenço d ...
27:00,2T,Campinense/PB,17 - Marcelo de Souza Maciel,11 - Tulio Renan Souza Xavier
43:00,2T,Serra Talhada/PE,14 - Andson Cicero da Silva,7 - Francieudo de Souza
