"",Arbitragem
Arbitro:,Valdicleuson Silva da Costa (CBF-1 / AP)
Arbitro Assistente 1:,Vitor Carmona Metestaine (CBF-2 / SP)
Arbitro Assistente 2:,Daniel Luis Marques (CBF-2 / SP)
Quarto Arbitro:,Antonio Rogerio Batista do Prado (CBF-1 / SP)
Assessor:,Roberto Perassi (ASS / SP)
"",,,Cronologia,,,
"",1o Tempo,,2o Tempo,,,
Entrada do mandante:,15:50Atraso:,,Não Houve Entrada do mandante: 17:01,Atraso:,,Não Houve
Entrada do visitante:,15:50Atraso:,,Não Houve Entrada do visitante: 17:01,Atraso:,,Não Houve
Início 1o Tempo:,16:00 Atraso:,,Não Houve Início do 2o Tempo: 17:02,Atraso:,,Não Houve
Término do 1o Tempo:,16:47 Acréscimo:,,2 min Término do 2o Tempo: 17:51,Acréscimo:,,4 min
Resultado do 1o Tempo: 0 X 0,,,Resultado Final: 0 X 0,,,
"",,,,Relação de Jogadores,,,
"",,Red Bull Brasil / SP,,,Resende / RJ,,
No,Apelido,Nome Completo,T/R P/A,CBF No Apelido,Nome Completo T/R P/A,,CBF
1,Junior,Tadeu de Jesus Nogue ...,T P,137385 19 Arthur,Arthur Pedro de Oliv... T,P,187255
2,Alex,Alex Reinaldo da Sil ...,T P,306228 2 Muriel,Muriel Leite Magalhaes T,P,188557
3,Anderson,Anderson Marques de  ...,T P,154089 3 Carlos,Carlos Bruno Gomes Costa T,P,184281
4,Gerson,Gerson Fraga Vieira,T P,303751 4 Lucas,Lucas Jaques Varone Maia T,P,360603
5,Luan,Lazaro Luan Scapolan,T P,184597 5 Iuri,Iuri Pimentel da Silva T,P,292227
6,Marcelo,Marcelo Cordeiro de  ...,T P,159612 6 Joaquim,Joaquim Flavio Ribei... T,P,292029
7,Raul,Raul Ferreira dos Anjos,T P,180644 7 Leo,Leonardo da Silva Ol... T,P,295764
8,Nando Cara ...,Fernando Gasparini C ...,T P,298709 8 Cassio,Cassio Miller Araujo... T,P,306846
9,Caio,Caio Henrique da Sil ...,T P,369639 9 Willian,Willian Vitorino Pereira T,P,370590
10,Eder,Eder Marcelo Prudencio,T P,138485 10 Marcel,Marcel Silva Andrade T,P,154780
11,Igor,Igor Torres Sartori,T P,373438 11 Wander Luiz,Wander Luiz Reis Soares T,P,342935
12,Marcio,Marcio Augusto dos S ...,R P,144842 12 Filipe,Filipe Quintiliano M... R,P,307759
13,Sousa,Regis Ribeiro de Sousa,R P,190286 13 Rogerio,Rogerio Campos Nicolau R,P,172886
14,Bernardo,Bernardo Fernandes d ...,R P,312029 14 Marcelo,Marcelo Costa Olegario R,P,187612
15,Dudu,Luis Eduardo Chebel  ...,R P,188703 15 Caio,Caio Batista Camelo R,P,166048
16,Francis,Francis Jose da Silva,R P,151406 16 Jeferson,Jeferson da Costa Silva R,P,291979
17,Arthur,Arthur Alves Neves,R P,309861 17 Gabriel,Gabriel de Paula Cas... R,P,316923
18,Wellington,Wellington Soares da ...,R P,307285 18 Douglas,Douglas de Almeida C... R,P,182893
19,Romao,Luiz Fernando Borges ...,R P,190258 20 Lucas,Lucas Perdomo Duarte... R,P,321445
20,Wilson Jun ...,Wilson dos Santos Vi ...,R P,300968 21 Jefferson,Jefferson da Silva N... R,P,169827
"",,Comissão Técnica,
"",Red Bull Brasil / SP,,Resende / RJ
Técnico:,Maurício Nogueira Barbieri - 30571421-1,Técnico:,Ailton Dos Santos Ferraz - 05456333-3
Auxiliar Técnico:,Ricardo Catala Salgado Junior - 30866984-8,Auxiliar Técnico:,Jaci Luis Pichetti - 3049227998
Médico:,Dr. Thiago Simões Miyasato - 116732,Médico:,Dr. Alvaro Machado  - 523607645
Preparador Físico:,Claudio Roberto Creato - 044050 G/SP,Preparador Físico:,Nardo Siqueira - 037220 G/RJ
Massagista:,Fernando Alberti - 32585717-9,Massagista:,Paulo Ricardo C. Leite - 46960937
Técnico:,Maurício Nogueira Barbieri - 30571421-1,Técnico:,Ailton Dos Santos Ferraz - 05456333-3
Auxiliar Técnico:,Ricardo Catala Salgado Junior - 30866984-8,Auxiliar Técnico:,Jaci Luis Pichetti - 3049227998
Médico:,Dr. Thiago Simões Miyasato - 116732,Médico:,Dr. Alvaro Machado  - 5236076-5
Preparador Físico:,Claudio Roberto Creato - 044050 G/SP,Preparador Físico:,Nardo Siqueira - 037220 G/RJ
"",,,,Substituições,
Tempo,1T/2T,,Equipe,Entrou,Saiu
+2:00,2T,Resende/RJ,,16 - Jeferson da Costa Silva,10 - Marcel Silva Andrade
06:00,2T,Red Bull Brasil/SP,,19 - Luiz Fernando Borges Roma ...,9 - Caio Henrique da Silva Da ...
21:00,2T,Red Bull Brasil/SP,,18 - Wellington Soares da Silv ...,11 - Igor Torres Sartori
28:00,2T,Red Bull Brasil/SP,,20 - Wilson dos Santos Vieira  ...,7 - Raul Ferreira dos Anjos
33:00,2T,Resende/RJ,,18 - Douglas de Almeida Cae da ...,9 - Willian Vitorino Pereira
