"",Arbitragem
Arbitro:,Jose Cleuton de Souza Lima (CBF-2 / CE)
Arbitro Assistente 1:,Thyago Costa Leitao (CBF-1 / PI)
Arbitro Assistente 2:,Rogério de Oliveira Braga (CBF-1 / PI)
Quarto Arbitro:,Antonio J L Trindade de Sousa (CBF-2 / PI)
Assessor:,Carlos Lustosa Filho (ASS / PI)
"",,,Cronologia,,,
"",1o Tempo,,2o Tempo,,,
Entrada do mandante:,16:50Atraso:,,Não Houve Entrada do mandante: 18:00,Atraso:,,Não Houve
Entrada do visitante:,16:50Atraso:,,Não Houve Entrada do visitante: 18:00,Atraso:,,Não Houve
Início 1o Tempo:,17:00 Atraso:,,Não Houve Início do 2o Tempo: 18:02,Atraso:,,Não Houve
Término do 1o Tempo:,17:47 Acréscimo:,,02 min Término do 2o Tempo: 18:51,Acréscimo:,,04 min
Resultado do 1o Tempo: 1 X 1,,,Resultado Final: 1 X 1,,,
"",,,,Relação de Jogadores,,,
"",,Ríver / PI,,,Palmas / TO,,
No,Apelido,Nome Completo,T/R P/A,CBF No Apelido,Nome Completo T/R P/A,,CBF
1,Naylson,Naylson Carvalho Bentes,T P,168289 1 Carlos Edu ...,Carlos Eduardo dos S... T,P,163990
2,Tote,Joao Nilson Ferreira ...,T P,186106 2 Leandro Al ...,Leandro Alves de Oli... T,P,181025
3,Paulo Para ...,Paulo Roberto Timoso ...,T P,177822 3 Helber,Helber Henrique Esteves T,P,301646
4,Indio,Israel da Silva Alves,T P,167797 4 Alan Kardek,Alan Kardek de Souza T,P,130986
5,Amarildo,Marcelo Amarildo de  ...,T P,147306 5 Wallace,Wallace Marques de Souza T,P,356669
6,Rafael Ara ...,Rafael Silva de Araujo,T P,160878 6 Daylson,Daylson Warwyck Sant... T,P,154200
7,Jorge,Luis Jorge Costa Ribeiro,T P,291685 7 Leandro,Leandro Teofilo Sant... T,P,159675
8,Rogerio,Rogerio Antonio Siqu ...,T P,177456 8 Ederson,Ederson Francisco do... T,P,152739
9,Eduardo,Eduardo Ribeiro dos  ...,T P,138279 9 Danilson,Danilson Mota da Silva T,P,342423
10,Esquerdinha,Eduardo Souza Reis,T P,161942 10 Valdo,Emivaldo Alves dos S... T,P,143703
11,Fabinho,Fabio Alves dos Santos,T P,172162 11 Eduardo,Eduardo dos Santos Souza T,P,330129
12,Dalton,Dalton Alan Munaretto,R P,174147 12 Edmar,Edmar da Silva Oliveira R,P,187833
13,Jadson,Wender Jadson Silva  ...,R P,378939 13 Matheus,Matheus Mendes de Ol... R,P,432857
14,Alex,Alex dos Santos,R P,160893 14 Moacri,Moacri Alves Feitosa... R,P,144442
15,Kassio,Kassio Fernando Roch ...,R P,303762 15 Pedro,Pedro Sobrinho Aires... R,P,331441
16,Thiago Dias,Thiago Dias Santos,R P,163061 16 Otavio Berte,Otavio Berte R,P,409309
17,Leandro,Leandro Thomas Batis ...,R P,187282 17 Gean,Geane Pereira dos Santos R,P,152603
18,Thiago Mar ...,Thiago Nascimento Ba ...,R P,172184 18 Aru,Paulo Aritana Sompre R,P,309468
19,Celio,Celio Luis de Sousa  ...,R P,292621,,,
20,Raphael,Raphael Barbosa de F ...,R P,154065,,,
21,Jackson Fe ...,Jackson Fernandes da ...,R P,464546,,,
22,Carlinho,Carlos Augusto Farias,R P,160751,,,
"",,Comissão Técnica,
"",Ríver / PI,,Palmas / TO
Tecnico:,Flávio José Araújo - CREF 001995 CE,Tecnico:,Wilsomar Arujo De Sena - CREF 00226 G-TO
Auxiliar Tecnico:,Francisco Hélio Alves Pinheiro - 2006029238676,Auxiliar Tecnico:,Felipe De Souza Rodrigues - 1023059 TO
Medico:,Miguel Angelo Costa Lago - 732 PI,Medico:,Xxxxxxxxxxxxxx - XXXXXXXXX
Preparador Fisico:,Pedro Henrique Dos Santos Alves - 001711 CE,Preparador Fisico:,Xxxxxxxxxxxxxxxxx - XXXXXXXXXX
Massagista:,Luis Amancio Na Nascimento Neto - 357549 PI,Massagista:,Wilson Vaz Rodrigues - 387315 TO
"",,,,,Gols,
Tempo,1T/2T,No,Tipo,Nome do Jogador,,Equipe
36:00,1T,11,NR,Fabio Alves dos Santos,,Ríver/PI
40:00,1T,9,NR,Danilson Mota da Silva,,Palmas/TO
"",,,,Substituições,
Tempo,1T/2T,,Equipe,Entrou,Saiu
45:00,INT,Ríver/PI,,17 - Leandro Thomas Batista da ...,10 - Eduardo Souza Reis
13:00,2T,Ríver/PI,,19 - Celio Luis de Sousa Bispo ...,6 - Rafael Silva de Araujo
19:00,2T,Palmas/TO,,15 - Pedro Sobrinho Aires Leit ...,7 - Leandro Teofilo Santos Pi ...
30:00,2T,Ríver/PI,,18 - Thiago Nascimento Barbosa ...,9 - Eduardo Ribeiro dos Santo ...
31:00,2T,Palmas/TO,,17 - Geane Pereira dos Santos,9 - Danilson Mota da Silva
37:00,2T,Palmas/TO,,18 - Paulo Aritana Sompre,11 - Eduardo dos Santos Souza
