"",Arbitragem
Arbitro:,Diego Fernando Silva E Lima (CBF-2 / PE)
Arbitro Assistente 1:,Oberto da Silva Santos (CBF-2 / PB)
Arbitro Assistente 2:,Jose Maria de Lucena Netto (CBF-2 / PB)
Quarto Arbitro:,Clizaldo L M Di Pace França (CBF-2 / PB)
Assessor:,Joao Bosco Honorato (000 / PB)
"",,,Cronologia,,,
"",1o Tempo,,2o Tempo,,,
Entrada do mandante:,15:53Atraso:,,Não Houve Entrada do mandante: 16:59,Atraso:,,Não Houve
Entrada do visitante:,15:52Atraso:,,Não Houve Entrada do visitante: 16:58,Atraso:,,Não Houve
Início 1o Tempo:,16:00 Atraso:,,Não Houve Início do 2o Tempo: 17:01,Atraso:,,Não Houve
Término do 1o Tempo:,16:46 Acréscimo:,,1 min Término do 2o Tempo: 17:50,Acréscimo:,,4 min
Resultado do 1o Tempo: 0 X 0,,,Resultado Final: 2 X 0,,,
"",,,,Relação de Jogadores,,,
"",,Campinense / PB,,,Globo / RN,,
No,Apelido,Nome Completo T/R P/A,,CBF No Apelido,Nome Completo,T/R P/A,CBF
1,Gledson,Gledson Ribeiro dos  ... T,P,159483 1 Rafael,Rafael de Jesus Mariano,T P,294558
2,David,David Willian Jose A ... T,P,299159 2 Ronaldo,Ronaldo Luiz Ciriaco...,T P,292997
3,Joecio,Joecio Barbosa dos S ... T,P,174017 3 Marcelo,Marcelessandro Santi...,T P,186108
4,Tiago Sala,Tiago Sala T,P,154309 4 Robson,Robson Freitas da Silva,T P,126203
5,Samuel Rosa,Samuel Rosa Pereira T,P,173707 5 Leomir,Leomir Lucena da Silva,T P,188135
6,Filipe,Filipe Ramon Silva L ... T,P,299373 6 Araujo,Adeilton Araujo Cruz,T P,417944
7,Magno,Magno Souza da Silva T,P,292998 7 Joziclrey,Jozicley Souza Filgueira,T P,151607
8,Ronaell,Ronaell Rubens da Si ... T,P,182403 8 Rivaldo,Rivaldo Soares Paulo,T P,345448
9,Rennan,Rennan Francisco Alm ... T,P,321784 9 Fabinho,Fabio Almeida de Jesus,T P,168544
10,Josemar do ...,Josemar dos Santos Silva T,P,131612 10 Marcel,Marcel Silva Sacramento,T P,164109
11,Tulio,Tulio Renan Souza Xavier T,P,291978 11 Romário,José Romário Silva d...,T P,413857
12,Alex,Alex Alves de Lima R,P,173056 12 Danilo,Emmanuel Danilo Clem...,R P,140660
14,Jairo,Jairo Souza da Silva R,P,335961 13 Alex,Alex Lopes dos Santos,R P,304381
15,Leandro,Leandro Trajano de Lima R,P,350031 14 Emerson,Emerson Souza da Silva,R P,182879
16,da Silva,Jeferson da Silva Sa ... R,P,402460 15 Jamerson,Jamerson Julio da Si...,R P,319715
17,Ademar,Ademar Fernandes de  ... R,P,345156 16 Diego,Diego da Silva Maia,R P,342212
18,Re,Renato Diniz Cruz R,P,378111 17 Ramon,Ramon Gabriel Santos...,R P,184882
19,Rodrigo,Rodrigo Gomes dos Santos R,P,398368 18 Rodolfo,Rodolfo Luciano Bast...,R P,177624
20,Sandro,Sandro Henrique Alve ... R,P,297584 19 Andre Carl ...,Andre Carlos Penha d...,R P,506548
"",,Comissão Técnica,
"",Campinense / PB,,Globo / RN
Tecnico:,Francisco De Assis Ciriaco Dos Santos - 191303670000-SPTecnico:,,Anthoni Santoro - 078416062
Auxiliar Tecnico:,Romildo Freire De Lima  - 000628642,Auxiliar Tecnico:,Marildo Luis - 1347382
Medico:,Gilberto Cavalcanti De Farias - 3316-PB,Medico:,João Batista De Sousa Rabelo - 1324-RN
Preparador Fisico:,Jean Robson Barros - 1201-RN,Preparador Fisico:,Lawrence Borba - 66-RN
Massagista:,Francisco De Assis Dos Santos - 365112-AC,Massagista:,Daniel Lopes Da Silva - 1658821
"",,,,,Gols,
Tempo,1T/2T,No,Tipo,Nome do Jogador,,Equipe
10:00,2T,19,NR,Rodrigo Gomes dos Santos,,Campinense/PB
35:00,2T,19,NR,Rodrigo Gomes dos Santos,,Campinense/PB
"",,,Substituições,
Tempo,1T/2T,Equipe,Entrou,Saiu
45:00,INT,Campinense/PB,19 - Rodrigo Gomes dos Santos,10 - Josemar dos Santos Silva
11:00,2T,Campinense/PB,17 - Ademar Fernandes de Olive ...,8 - Ronaell Rubens da Silva A ...
17:00,2T,Globo/RN,18 - Rodolfo Luciano Bastos Au ...,9 - Fabio Almeida de Jesus
17:00,2T,Globo/RN,16 - Diego da Silva Maia,8 - Rivaldo Soares Paulo
25:00,2T,Globo/RN,19 - Andre Carlos Penha da Cos ...,6 - Adeilton Araujo Cruz
27:00,2T,Campinense/PB,15 - Leandro Trajano de Lima,9 - Rennan Francisco Almeida  ...
