"",,Arbitragem
Arbitro:,Rafael Traci (AB / PR),
Arbitro Assistente 1:,Ivan Carlos Bohn (AB / PR),
Arbitro Assistente 2:,Pedro Martinelli Christino (AB / PR),
Quarto Arbitro:,Leonardo Sígari Zanon (CD / PR),
Analista de Campo:,Afonso Vitor de Oliveira (CBF / PR),
"",,,Cronologia,,,
"",1o Tempo,,2o Tempo,,,
Entrada do mandante:,21:35Atraso:,,Não Houve Entrada do mandante: 22:43,Atraso:,,Não Houve
Entrada do visitante:,21:35Atraso:,,Não Houve Entrada do visitante: 22:45,Atraso:,,Não Houve
Início 1o Tempo:,21:45 Atraso:,,Não Houve Início do 2o Tempo: 22:46,Atraso:,,Não Houve
Término do 1o Tempo:,22:31 Acréscimo:,,1 min Término do 2o Tempo: 23:34,Acréscimo:,,3 min
Resultado do 1o Tempo: 0 X 1,,,Resultado Final: 0 X 1,,,
"",,,,Relação de Jogadores,,,
"",,Madureira / RJ,,,São Paulo / SP,,
No,Apelido,Nome Completo T/R P/A,,CBF No Apelido,Nome Completo T/R P/A,,CBF
1,Douglas,Douglas Lima da Cruz T(g),P,355162 12 Sidão,Sidney Aparecido Ram... T(g),P,154179
2,Filippe,Filippe Souza Pereira T,P,319141 3 Rodrigo Caio,Rodrigo Caio Coquett... T,P,316645
3,Danrlei,Danrlei Rosa dos Santos T,P,327891 4 Anderson,Anderson Vieira Martins T,P,166258
4,Edmario,Edmario Miguel dos S ... T,P,299727 8 Jucilei,Jucilei da Silva T,P,184845
5,Thiago,Thiago de Medeiros G ... T,P,303392 9 Diego Souza,Diego de Souza Andrade T,P,161625
6,Douglas,Douglas de Jesus Lima T,P,320081 13 Eder Militão,Eder Gabriel Militao T,P,403320
7,Julio Cesa ...,Julio Cesar de Rezen ... T,P,315696 16 Edimar,Edimar Curitiba Fraga T,P,163254
8,Willian,Willian Oliveira dos ... T,P,430883 20 Shaylon,Shaylon Kallyson Cardozo T,P,421138
9,Souza,Rodrigo de Souza Cardoso T,P,136730 23 Marcos Gui ...,Marcos Guilherme de ... T,P,295821
10,Luciano,Luciano Francisco Pa ... T,P,359865 28 Felipe,Felipe Araruna Hoffmann T,P,356726
11,Ygor,Ygor de Oliveira Fer ... T,P,537477 30 Brenner,Brenner Souza da Silva T,P,434301
12,Jonathan,Jonathan Ribeiro Louredo R(g),P,299473 1 Jean,Jean Paulo Fernandes... R(g),P,420409
13,Joao Carlo ...,Joao Carlos Pinto Chaves R,P,154342 2 Bruno,Bruno Vieira do Nasc... R,P,172996
14,Renan,Renan de Souza Barcelos R,P,325004 11 Lucas,Lucas Fernandes da Silva R,P,374303
15,Henrique,Henrique Loureiro do ... R,P,167360 14 Reinaldo,Reinaldo Manoel da Silva R,P,332318
16,Rafael,Rafael Gimenes da Silva R,P,307753 22 Junior,Carlos Eugenio Junio... R,P,384984
17,Derek,Derek Freitas Ribeiro R,P,313072 25 Hudson,Hudson Rodrigues dos... R,P,176729
18,Tessio,Tessio Lucas Ferreir ... R,P,361925 26 Paulo,Paulo Henrique Perei... R,P,432391
19,Keven,Keven Alex Leite da  ... R,P,341056 29 Guilherme,Guilherme Bissoli Campos R,P,322642
"",,,,32 Aderllan,Aderllan Leandro de ... R,P,291786
"",,,,34 Bruno Alves,Bruno Fabiano Alves R,P,312015
"",,,,35 Paulo Henr ...,Paulo Henrique Rolim... R,P,408193
"",,,,36 Caique,Caique da Silva Maria R,P,318279
"",,Comissão Técnica
"",Madureira / RJ,São Paulo / SP
Técnico:,Acácio Cordeiro Barreto - 045280419,Médico: Auro De Freitas Rayel - 94020175853
Auxiliar Técnico:,Luiz Claudio Alves De Souza - 110204856,Massagista: Carlos Alberto Vasconcellos Presinoti - 10504537865
Médico:,André Luiz Abrantes De Menezes - 5267792-0,Técnico: Dorival Silvestre Junior - 3544655896
Preparador Físico:,Luiz Carlos Silva Cerqueira - 046693156,Auxiliar Técnico: Lucas Khodor Silvestre - 35179920892
Massagista:,Paulo Adriano Da Silva - 062520432,Treinador De GoleirosM: arco Antonio Trocourt - 37881310049
Preparador De GoleiroR:o berto Almeida Dos Santos  - 097943070,,Preparador Físico: Pedro Augusto Biccari Franco De Campos - 22836121874
"",,Preparador De Goleiro..:.. ......... - ..........
"",,,,,Gols,
Tempo,1T/2T,No,Tipo,Nome do Jogador,,Equipe
17:00,1T,30,NR,Brenner Souza da Silva,,São Paulo/SP
"",,,,Substituições,
Tempo,1T/2T,,Equipe,Entrou,Saiu
11:00,2T,Madureira/RJ,,14 - Renan de Souza Barcelos,6 - Douglas de Jesus Lima
18:00,2T,São Paulo/SP,,11 - Lucas Fernandes da Silva,28 - Felipe Araruna Hoffmann
21:00,2T,Madureira/RJ,,18 - Tessio Lucas Ferreira Caj ...,7 - Julio Cesar de Rezende Mi ...
27:00,2T,São Paulo/SP,,29 - Guilherme Bissoli Campos,9 - Diego de Souza Andrade
28:00,2T,São Paulo/SP,,26 - Paulo Henrique Pereira da ...,30 - Brenner Souza da Silva
29:00,2T,Madureira/RJ,,17 - Derek Freitas Ribeiro,9 - Rodrigo de Souza Cardoso
