"",Arbitragem
Arbitro:,Dyorgines Jose Padovani de Andrade (AB / ES)
Arbitro Assistente 1:,Fabiano da Silva Ramires (AB / ES)
Arbitro Assistente 2:,Vanderson Antonio Zanotti (AB / ES)
Quarto Arbitro:,Douglas Schwengber da Silva (INT / RS)
Delegado Local:,PAULO HENRIQUE FERRO DE GUIMARÃES ( / )
Analista de Campo:,Flavio Pinheiro de Abreu (CBF / RS)
"",,,Cronologia,,,
"",1o Tempo,,2o Tempo,,,
Entrada do mandante:,21:20Atraso:,,Não Houve Entrada do mandante: 22:29,Atraso:,,Não Houve
Entrada do visitante:,21:20Atraso:,,Não Houve Entrada do visitante: 22:29,Atraso:,,Não Houve
Início 1o Tempo:,21:30 Atraso:,,Não Houve Início do 2o Tempo: 22:30,Atraso:,,Não Houve
Término do 1o Tempo:,22:15 Acréscimo:,,Não Houve Término do 2o Tempo: 23:19,Acréscimo:,,4 min
Resultado do 1o Tempo: 0 X 0,,,Resultado Final: 0 X 0,,,
"",,,,Relação de Jogadores,,,
"",,Caxias / RS,,,Atlético / PR,,
No,Apelido,Nome Completo,T/R P/A,CBF No Apelido,Nome Completo T/R P/A,,CBF
1,Gledson,Gledson Ribeiro dos  ...,T(g) P,159483 1 Santos,Aderbar Melo dos San... T(g),P,293428
2,Cleiton,Cleiton Savedra Garcia,T P,327376 2 Jonathan,Jonathan Cicero Moreira T,P,165198
3,Junior Alves,Jose Teixeira Alves  ...,T P,295525 7 Raphael Ve ...,Raphael Cavalcante Veiga T,P,308405
4,Laercio,Laercio Solda,T P,361960 9 Lucas Riba ...,Lucas Ribamar Lopes ... T,P,413248
5,Regis,Regis dos Santos Silva,T P,188165 11 Nikao,Maycon Vinicius Ferr... T,P,306616
6,Julinho,Julio Cesar Machado  ...,T P,179831 13 Paulo Andre,Paulo Andre Cren Benini T,P,155991
7,Tulio,Tulio Renan Souza Xavier,T P,291978 17 Guilherme,Guilherme Milhomem G... T,P,171975
8,Rafael Gava,Rafael Gustavo Meneg ...,T P,313001 20 Matheus,Matheus Rossetto T,P,340736
9,Joao Paulo,Joao Paulo de Oliveira,T P,170016 25 Wanderson,Wanderson Santos Pereira T,P,300394
10,Miranda,Diego Miranda,T P,341926 26 Carleto,Thiago Carletti Alves T,P,183853
11,Nicolas,Nicolas Godinho Johann,T P,179934 44 Thiago Hel ...,Thiago Heleno Henriq... T,P,171788
12,Lucio,Lucio Hernandes da S ...,R(g) P,305608 99 Leonardo,Leonardo da Silva Vieira R(g),P,177092
13,Igor,Igor Bosel Dias,R P,372585 8 Sidcley,Sidcley Ferreira Pereira R,P,355990
14,Geninho,Genisson Correia Das ...,R P,340109 10 Felipe,Felipe Gedoz da Conc... R,P,346890
15,Josias,Josias Basso Lisboa,R P,177586 21 Esteban Pa ...,Esteban Andres Pavez... R,P,598709
16,Evailton,Evailton de Franca Rocha,R P,350451 22 Marcio Ant ...,Marcio Antonio de So... R,P,305360
17,Maraba,Marcio da Silva Gomes,R P,164348 27 Ivaldo,Jose Ivaldo Almeida ... R,P,409873
18,Guto Dresch,Gustavo Dresch,R P,327116 30 Bergson,Bergson Gustavo Silv... R,P,191433
19,Gilson,Gilson Cesar Santos  ...,R P,296117 39 Bruno Guim ...,Bruno Guimaraes Rodr... R,P,319832
20,Alex,Alex Willian Costa Silva,R P,178374 49 Warleson,Warleson Steillon Li... R,P,409079
21,Carlos Andre,Carlos Andre dos San ...,R P,181173 55 Matheus,Matheus Aleksander d... R,P,337245
22,Daniel,Daniel Paulo da Cruz,R P,316173 92 Pablo,Pablo Felipe Teixeira R,P,307317
23,Ramon,Ramon da Silva Costa,R P,320928,,,
"",,Comissão Técnica
"",Caxias / RS,Atlético / PR
Técnico:,Luis Carlos Coelho Wink - 4011212836,Auxiliar Técnico: Eduardo Maciel De Barros - 33913970800
Auxiliar Técnico:,Jose Carlos Marques Da Silva - 1028026902,Coordenador TécnicoF: ernando Diniz Silva - 16780711888
Médico:,Rafael Lessa Costa - 37235,Massagista: Juan Pablo Fiorenza - 80019376901
Preparador Físico:,Marcelo Henrique Carneiro - 8454,Treinador De GoleirosL:u ciano De Oliveira Junior - 65089561591
Massagista:,Kleber Ramos Nicolodi - 74429,Médico: Murilo Marcondes Ribas - 13124
Preparador De GoleiroH:u mberto A. Da Fontoura Flores - 15624,,Técnico: Fernando Diniz Silva - 18755002
"",,Preparador Físico: Jean Carlos De Freitas Lourenço - 6681
"",,Preparador De GoleiroL:u ciano De Oiveira Junior - 465124461
"",,,,Substituições,
Tempo,1T/2T,,Equipe,Entrou,Saiu
15:00,2T,Caxias/RS,,22 - Daniel Paulo da Cruz,7 - Tulio Renan Souza Xavier
25:00,2T,Atlético/PR,,30 - Bergson Gustavo Silveira  ...,17 - Guilherme Milhomem Gusmao ...
30:00,2T,Caxias/RS,,21 - Carlos Andre dos Santos V ...,9 - Joao Paulo de Oliveira
36:00,2T,Caxias/RS,,23 - Ramon da Silva Costa,6 - Julio Cesar Machado Colar ...
42:00,2T,Atlético/PR,,39 - Bruno Guimaraes Rodriguez ...,20 - Matheus Rossetto
44:00,2T,Atlético/PR,,92 - Pablo Felipe Teixeira,11 - Maycon Vinicius Ferreira  ...
