Campeonato:,Copa do Brasil - Profissional/2018,,,Rodada:,Volta
Jogo:,América / MG X Palmeiras / SP,,,,
Data:,09/05/2018 Horário: 19:30,Estádio:,Raimundo Sampaio / Belo Horizonte,,
"",,Arbitragem
Arbitro:,Braulio da Silva Machado (AB / SC),
Arbitro Assistente 1:,Kleber Lucio Gil (FIFA / SC),
Arbitro Assistente 2:,Neuza Ines Back (FIFA / SC),
Quarto Arbitro:,William Machado Steffen (AB / SC),
Inspetor:,Paulo Jorge Alves (CBF / BRA),
"",,,Cronologia,,,
"",1o Tempo,,2o Tempo,,,
Entrada do mandante:,19:20Atraso:,,Não Houve Entrada do mandante: 20:27,,Atraso:,Não Houve
Entrada do visitante:,19:20Atraso:,,Não Houve Entrada do visitante: 20:28,,Atraso:,Não Houve
Início 1o Tempo:,19:30Atraso:,,Não Houve Início do 2o Tempo: 20:30,,Atraso:,Não Houve
Término do 1o Tempo:,20:15Acréscimo:,,Não Houve Término do 2o Tempo: 21:20,Acréscimo:,,5 min
Resultado do 1o Tempo: 0 X 1,,,Resultado Final: 1 X 2,,,
"",,,,,Relação de Jogadores,,,,
"",,América / MG,,,,Palmeiras / SP,,,
No,Apelido,Nome Completo,T/R,P/A,CBF No Apelido,Nome Completo T/R,,P/A,CBF
1,João Ricardo,Joao Ricardo Riedi,T(g),P,298660 42 Jailson,Jailson Marcelino do... T(g),,P,153229
2,Neto,Norberto Pereira Mar ...,T,P,186564 2 Marcos Rocha,Marcos Luis Rocha Aquino T,,P,176390
3,Rafael,Rafael Ramos de Lima,T,P,160686 3 Edu Dracena,Eduardo Luis Abonizi... T,,P,136752
4,Messias,Messias Rodrigues da ...,T,P,381149 6 Diogo,Diogo Barbosa Mendanha T,,P,339876
5,Leandro Do ...,Leandro Donizete Gon ...,T,P,163939 7 Dudu,Eduardo Pereira Rodrigues T,,P,291738
6,Giovanni,Giovanni Palmieri do ...,T,P,175878 9 Borja,Miguel Angel Borja H... T,,P,566895
8,Christian,Christian Savio Machado,T,P,329524 11 Keno,Marcos da Silva Franca T,,P,375634
9,Rafael Moura,Rafael Martiniano de ...,T,P,151437 19 Bruno,Bruno Henrique Corsini T,,P,292132
10,Sergio,Sergio Antonio Soler ...,T,P,328835 20 Lucas Lima,Lucas Rafael Araujo Lima T,,P,331937
11,Luan,Luan Michel Louza,T,P,183381 25 Antonio Ca ...,Antonio Carlos Cunha... T,,P,307273
13,Aderlan,Aderlan de Lima Silva,T,P,291939 30 Felipe Melo,Felipe Melo de Carvalho T,,P,150801
12,Joriwinnyson,Joriwinnyson Santos  ...,R(g),P,427979 21 Weverton,Weverton Pereira da Silva R(g),,P,169050
7,Marquinhos,Marcos Antonio da Si ...,R,P,180838 1 Fernando P ...,Fernando Buttenbende... R,,P,137377
14,Adilson,Adilson dos Anjos Ol ...,R,P,337261 5 Thiago Santos,Thiago dos Santos R,,P,293712
15,Ze Ricardo,Jose Ricardo Barbosa ...,R,P,358808 8 Tche Tche,Danilo das Neves Pinheiro R,,P,308348
16,Matheus Fe ...,Matheus Ferraz Pereira,R,P,175475 12 Mayke,Mayke Rocha de Oliveira R,,P,312950
17,Gerson,Gerson Alencar de Li ...,R,P,147495 13 Luan Garcia,Luan Garcia Teixeira R,,P,307406
18,Aylon,Aylon Darwin Tavella,R,P,355362 16 Deyverson,Deyverson Brum Silva R,,P,359696
19,Carlinho,Carlos Emiliano Pereira,R,P,186140 18 Guerra,Alejandro Abraham Gu... R,,P,565572
20,Judivan,Judivan Flor da Silva,R,P,354104 26 Victor,Victor Luis Chuab Za... R,,P,309431
21,Ruy,Ruy Franco de Almeid ...,R,P,178472 28 Hyoran,Hyoran Kaue Dalmoro R,,P,304434
22,Wesley,Wesley Lopes Beltrame,R,P,170540 29 Willian,Willian Gomes de Siqueira R,,P,166061
23,Renan,Renan Henrique Olive ...,R,P,178684 31 Thiago Mar ...,Thiago Martins Bueno R,,P,353798
"",,Comissão Técnica,
"",América / MG,,Palmeiras / SP
Técnico:,ENDERSON ALVES MOREIRA,Técnico:,Roger Machado Marques
Auxiliar Técnico:,LUIS FERNANDO ROSA FLORES,Auxiliar Técnico:,ROBERTO LAMPERT RIBAS
Médico:,Celso Furtado De Azevedo Filho,Médico:,GILBERTO AMADO RODRIGUES DA CUNHA FILHO
Treinador De Goleiros:,SILVIO SIQUEIRA JARDIM,Preparador Físico:,JOSE OMAR ALVES FEITOSA
Preparador Físico:,EDY CARLOS TOPOROWICZ,Massagista:,JOMAR JORGE OTTONI
Massagista:,SILVIO JUNIO NUNES DA SILVA,,
"",,,,,Gols,
Tempo,1T/2T,No,Tipo,Nome do Jogador,,Equipe
37:00,1T,9,NR,Miguel Angel Borja Hernandez,,Palmeiras/SP
11:00,2T,11,NR,Marcos da Silva Franca,,Palmeiras/SP
27:00,2T,10,NR,Sergio Antonio Soler de Oliveira Junior,,América/MG
"",,,,Cartões Amarelos
Tempo,1T/2T,No,Nome do Jogador,Equipe
22:00,2T,5,Leandro Donizete Goncalves da Silva,América/MG
"",,,Motivo: A1.1.  Dar ou tentar dar um pontapé (chute) em um adversário de maneira temerária na disputa da bola  - Dar um pontapé em,
"",,,um adversário de maneira temerária na disputa de bola.,
"",,,,Substituições,
Tempo,1T/2T,,Equipe,Entrou,Saiu
21:00,2T,América/MG,,7 - Marcos Antonio da Silva Gonc...,2 - Norberto Pereira Marinho Neto
25:00,2T,América/MG,,18 - Aylon Darwin Tavella,9 - Rafael Martiniano de Miranda...
32:00,2T,Palmeiras/SP,,18 - Alejandro Abraham Guerra Mor...,20 - Lucas Rafael Araujo Lima
35:00,2T,Palmeiras/SP,,5 - Thiago dos Santos,30 - Felipe Melo de Carvalho
39:00,2T,Palmeiras/SP,,29 - Willian Gomes de Siqueira,11 - Marcos da Silva Franca
40:00,2T,América/MG,,21 - Ruy Franco de Almeida Junior,11 - Luan Michel Louza
