Campeonato:,Campeonato Brasileiro - Série D/2021,,Rodada:,Volta
Jogo:,Rio Branco Sport Club / PR X Fc Cascavel / PR,,,
Data:,18/07/2021 Horário: 15:00 Estádio:,Nelson Medrado Dias / Paranagua,,
"",Arbitragem
Arbitro:,Josue Reis de Jesus Junior (CD / BA)
Arbitro Assistente 1:,Leandro Polli Glugoski (CD / PR)
Arbitro Assistente 2:,Zacarias Chumlhak (CD / PR)
Quarto Arbitro:,Robson Babinski (CD / PR)
Delegado Local:,Eduardo Senna (CBF / PR)
Analista de Campo:,Joao Candido Hartmann (CBF / PR)
"",,,Cronologia,,,
"",1o Tempo,,2o Tempo,,,
Entrada do mandante:,14:54Atraso:,,Não Houve Entrada do mandante: 16:01,,Atraso:,Não Houve
Entrada do visitante:,14:55Atraso:,,Não Houve Entrada do visitante: 16:02,,Atraso:,Não Houve
Início 1o Tempo:,15:00Atraso:,,Não Houve Início do 2o Tempo: 16:05,,Atraso:,Não Houve
Término do 1o Tempo:,15:50Acréscimo:,,5 min Término do 2o Tempo: 16:55,Acréscimo:,,5 min
Resultado do 1o Tempo: 0 X 2,,,Resultado Final: 1 X 4,,,
"",,,,,Relação de Jogadores,,,,
"",,Rio Branco Sport Club / PR,,,,Fc Cascavel / PR,,,
No,Apelido,Nome Completo T/R,,P/A,CBF No Apelido,Nome Completo T/R,,P/A,CBF
12,Junior,Aparecido Pereira do ... T(g),,P,293707 12 Ricardo,Ricardo Ernesto Ahlf T(g),,P,174338
2,Matheus,Igor Matheus Mathias ... T,,P,546726 2 Libano,Wagner de Medeiros Libano T,,P,171418
3,Renato,Renato de Oliveira Emilio T,,P,324977 3 Afonso,Stephannyo Afonso Lo ... T,,P,330690
4,Pedro Botelho,Pedro Roberto Silva  ... T,,P,183902 4 Diego,Diego da Silva Giaretta T,,P,158675
5,Jacy,Jacy Maranhao Oliveira T,,P,403078 5 Lucas Oliv ...,Lucas Oliveira dos Santos T,,P,378253
6,HIGOR,Higor Henrique Gonça ... T,,P,411792 6 Willian,Willian da Silva Gom ... T,,P,179650
7,Leonardo,Leonardo da Silva Simas T,,P,433824 7 Marcelo,Marcelo Gama Ramos T,,P,454694
8,Demethryus,Demethryus Maciel Ar ... T,,P,417334 8 Duda,Jhonatan Martins da Cunha T,,P,185071
9,Bruno,Bruno da Silva Lopes T,,P,168956 9 Carlos,Carlos Henrique Alve ... T,,P,348899
10,Gabriel Ho ...,Gabriel Honorio Ramos T,,P,448286 10 Robinho,Robson Ferreira de A ... T,,P,379134
11,Gustavo,Gustavo Eduardo Cast ... T,,P,432191 11 Léo Itape ...,Leonardo de Oliveira ... T,,P,184221
13,Thiaguinho,Thiago Brito dos Santos R,,P,431399 40 Luis Augusto,Luis Augusto Santos  ... R(g),,P,354220
14,Maycon,Maycon Lucas Nogueir ... R,,P,291597 14 Echeverria,Eduardo Alberto Eche ... R,,P,541203
15,Bill,Vitor Motta Nunes Bill R,,P,522880 15 Bileu,Josileudo Rodrigues  ... R,,P,176416
16,Regino Nas ...,Regino Nascimento de ... R,,P,457553 16 Carlos,Carlos Henrique de Lima R,,P,525583
17,Matheus,Matheus Augusto dos  ... R,,P,374269 17 Douglas,Douglas Netto Faria R,,P,355787
18,Douglas,Douglas Santana Veloso R,,P,363462 18 Joao,Joao Vittor Duarte G ... R,,P,429671
19,Luiz,Luiz Vinicius Martins R,,P,190281 19 Eduardo,Eduardo Gomes Hyppol ... R,,P,446510
20,WILLIAM,William Pereira dos  ... R,,P,187059 20 Henrique,Henrique Fernandes C ... R,,P,186104
21,Felipe,Felipe Soares da Cruz R,,P,584331 21 Vinicius,Vinicius Dias de Novais R,,P,434759
"",,,,,22 Rogerio Luis,Rogerio Luis Leichtweis R,,P,565560
"",,,,,23 Sotto,Willyan Douglas Sotto R,,P,308339
"",,Comissão Técnica,
"",Rio Branco Sport Club / PR,,Fc Cascavel / PR
Técnico:,Victor Hugo Annes,Técnico:,Anderson Simas Luciano
Médico:,Renato De Souza Malverde,Assistente Técnico:,Jose Luiz Fonseca
Treinador De Goleiros:,Mauryelton Sanndy Da Costa E Silva,Médico:,Claudio Bibiano De Oliveira
Preparador Físico:,Rafael Clodson Lopes,Treinador De Goleiros:,Gilberto Lopes Da Silva Junior
Massagista:,Jefferson Selouan De Oliveira,Preparador Físico:,Dante Luiz Pereira
"",,Fisioterapeuta:,Marcos Vinicius Favero
"",,,,,Gols,
Tempo,1T/2T,No,Tipo,Nome do Jogador,,Equipe
22:00,1T,11,NR,Leonardo de Oliveira Clemente Marins,,Fc Cascavel/PR
35:00,1T,10,PN,Robson Ferreira de Azevedo,,Fc Cascavel/PR
06:00,2T,10,NR,Robson Ferreira de Azevedo,,Fc Cascavel/PR
16:00,2T,9,NR,Bruno da Silva Lopes,,Rio Branco Sport Club/PR
+2,2T,21,PN,Vinicius Dias de Novais,,Fc Cascavel/PR
"",,,Substituições,
Tempo,1T/2T,Equipe,Entrou,Saiu
45:00,INT,Rio Branco Sport Club/PR,16 - Regino Nascimento de Sousa,2 - Igor Matheus Mathias Lopes
11:00,2T,Fc Cascavel/PR,14 - Eduardo Alberto Echeverria E...,8 - Jhonatan Martins da Cunha
18:00,2T,Rio Branco Sport Club/PR,19 - Luiz Vinicius Martins,5 - Jacy Maranhao Oliveira
18:00,2T,Rio Branco Sport Club/PR,14 - Maycon Lucas Nogueira Mansano,8 - Demethryus Maciel Areias Nas...
18:00,2T,Rio Branco Sport Club/PR,17 - Matheus Augusto dos Reis da ...,11 - Gustavo Eduardo Castilho Silva
31:00,2T,Fc Cascavel/PR,19 - Eduardo Gomes Hyppolito Junior,11 - Leonardo de Oliveira Clement...
33:00,2T,Rio Branco Sport Club/PR,20 - William Pereira dos Santos,10 - Gabriel Honorio Ramos
40:00,2T,Fc Cascavel/PR,15 - Josileudo Rodrigues de Araujo,7 - Marcelo Gama Ramos
40:00,2T,Fc Cascavel/PR,21 - Vinicius Dias de Novais,2 - Wagner de Medeiros Libano
40:00,2T,Fc Cascavel/PR,17 - Douglas Netto Faria,9 - Carlos Henrique Alves Pereira
