Campeonato:,Copa do Brasil - Profissional/2020,,,Rodada:,Volta
Jogo:,Bangu / RJ X Oeste / SP,,,,
Data:,12/02/2020 Horário: 16:00,Estádio:,Guilherme da Silveira Filho / Rio de Janeiro,,
"",,Arbitragem
Arbitro:,Vinicius Gomes do Amaral (AB / RS),
Arbitro Assistente 1:,Jorge Eduardo Bernardi (AB / RS),
Arbitro Assistente 2:,Luiza Naujorks Reis (CD / RS),
Quarto Arbitro:,Paulo Renato Moreira da Silva Coelho (INT / RJ),
Inspetor:,Jose Mocellin (CBF / BR),
Delegado Local:,Paulo Fernando Nunes Blanco (CBF / ),
"",,,Cronologia,,,
"",1o Tempo,,2o Tempo,,,
Entrada do mandante:,15:50Atraso:,,Não Houve Entrada do mandante: 17:01,,Atraso:,Não Houve
Entrada do visitante:,15:50Atraso:,,Não Houve Entrada do visitante: 17:00,,Atraso:,Não Houve
Início 1o Tempo:,16:00Atraso:,,Não Houve Início do 2o Tempo: 17:03,,Atraso:,Não Houve
Término do 1o Tempo:,16:48Acréscimo:,,3 min Término do 2o Tempo: 17:53,Acréscimo:,,5 min
Resultado do 1o Tempo: 1 X 0,,,Resultado Final: 1 X 1,,,
"",,,,,Relação de Jogadores,,,,
"",,Bangu / RJ,,,,Oeste / SP,,,
No,Apelido,Nome Completo,T/R,P/A,CBF No Apelido,Nome Completo T/R,,P/A,CBF
12,Matheus,Matheus Francisco Inacio,T(g),P,324710 1 Felipe,Felipe da Silva Lacerda T(g),,P,328899
2,Raul,Raul Jose Cardoso,T,P,350529 2 Eder,Eder Sciola Santana T,,P,175135
3,Michel,Michel Pereira Santos,T,P,370576 3 Lidio,Lidio Ferreira Carmo ... T,,P,346815
4,Rodrigo,Rodrigo da Conceicao ...,T,P,340298 4 Joao Roberto,Joao Roberto Custodio T,,P,294996
5,Felipe,Felipe dos Santos Dias,T,P,343511 5 Guilherme  ...,Guilherme Mantuan T,,P,339259
6,Dieyson,Dieyson Anjos da Silva,T,P,370703 6 Alyson,Alyson Vinicius Alme ... T,,P,336531
8,Josiel,Josiel Raymundo de Paula,T,P,358405 7 Roberto,Roberto Cesar Zardin ... T,,P,159419
9,Rhainer,Rhainer Ferreira Silva,T,P,395630 8 Matheus,Matheus Isaias dos Santos T,,P,376217
10,Rodrigo,Rodrigo Yuri Pires F ...,T,P,320431 9 Joao Paulo,Joao Paulo Queiroz d ... T,,P,337178
11,Jairo,Jairo Santos de Oliv ...,T,P,333564 10 Fabricio,Fabricio Keiske Rodr ... T,,P,391568
19,Juliano Si ...,Juliano Silva Almeida,T,P,313158 11 Marlon,Marlon Douglas de Sa ... T,,P,411070
1,Luciano,Luciano Faria Alves,R(g),P,307801 12 Caique,Caique Franca Godoy R(g),,P,313131
13,Andrey,Andrey Gradici de Ol ...,R,P,320746 13 Bonilha,Wallace Bonilha Felix R,,P,308548
14,Wanderson,Wanderson Ferreira d ...,R,P,460164 14 Bruno,Bruno Bispo dos Anjos R,,P,367372
15,Lucas,Lucas Moreira Sampai ...,R,P,380843 15 Diogo,Diogo Costa Freitas R,,P,581191
16,Alex,Alex Chander da Cost ...,R,P,440522 16 Gustavo,Gustavo Salomao Miguel R,,P,406111
17,Leonardo,Leonardo Andre Pimen ...,R,P,150372 17 Lucas,Lucas Goncalves de Paula R,,P,437900
18,Ribeiro,Juan Felipe Alves Ribeiro,R,P,186615 18 Bruno,Bruno Pereira de Alb ... R,,P,406706
20,Octavio,Octavio Cruz Manhaes,R,P,320077 19 Matheus,Matheus Matias Ferreira R,,P,589108
21,Uallace,Uallace de Souza Pereira,R,P,298481 20 Mazinho,Anderson Soares da Silva R,,P,181254
22,Sidney,Sidney de Freitas Pages,R,P,316364 21 Matheus,Matheus Oliveira Santos R,,P,352481
23,Gato Garcia,Francisco Javier Gar ...,R,P,691690 23 Welliton,Welliton Silva de Az ... R,,P,512737
25,Jose Anton ...,Jose Antonio Canto Rocha,R,P,512497,,,,
"",,Comissão Técnica,
"",Bangu / RJ,,Oeste / SP
Técnico:,Eduardo Allax Scherpel,Técnico:,Renan Roberto De Freitas
Auxiliar Técnico:,Wagner Duarte Mariano,Auxiliar Técnico:,Sergio Alexsandro De Freitas
Médico:,Romulo Capello Teixeira,Médico:,Eduardo Martinez Rodriguez Hanke
Treinador De Goleiros:,Ricardo Barros,Treinador De Goleiros:,Carlos Eduardo Fernandes Gregorio
Preparador Físico:,Fabricio Jose Inverno De Abreu,Preparador Físico:,Marcio Dos Santos Faria Correa
Fisioterapeuta:,Gabriel Peres Oliveira Da Silva,Massagista:,Dirceu Ferreirade Lima
"",,,,,Gols,
Tempo,1T/2T,No,Tipo,Nome do Jogador,,Equipe
11:00,1T,4,NR,Rodrigo da Conceicao Santos,,Bangu/RJ
06:00,2T,6,NR,Alyson Vinicius Almeida Neves,,Oeste/SP
"",,,,Substituições,
Tempo,1T/2T,,Equipe,Entrou,Saiu
45:00,INT,Oeste/SP,,18 - Bruno Pereira de Albuquerque,9 - Joao Paulo Queiroz de Moraes
45:00,INT,Oeste/SP,,20 - Anderson Soares da Silva,10 - Fabricio Keiske Rodrigues Oya
07:00,2T,Bangu/RJ,,25 - Jose Antonio Canto Rocha,19 - Juliano Silva Almeida
17:00,2T,Bangu/RJ,,20 - Octavio Cruz Manhaes,2 - Raul Jose Cardoso
31:00,2T,Oeste/SP,,16 - Gustavo Salomao Miguel,6 - Alyson Vinicius Almeida Neves
35:00,2T,Bangu/RJ,,18 - Juan Felipe Alves Ribeiro,11 - Jairo Santos de Oliveira Filho
