Campeonato:,Campeonato Brasileiro - Série A/2018,,Rodada:,18
Jogo:,Flamengo / RJ X Cruzeiro / MG,,,
Data:,12/08/2018 Horário: 16:00 Estádio:,Jornalista Mário Filho / Rio de Janeiro,,
"",Arbitragem
Arbitro:,Dewson Fernando Freitas da Silva (FIFA / PA)
Arbitro Assistente 1:,Helcio Araujo Neves (AB / PA)
Arbitro Assistente 2:,Heronildo S Freitas da Silva (AB / PA)
Quarto Arbitro:,Luis Diego Nascimento Lopes (AB / PA)
Arbitro Assist Adic 1:,Djonaltan Costa de Araujo (CD / PA)
Arbitro Assist Adic 2:,Wasley do Couto Leao (CD / PA)
Inspetor:,Ednilson Corona (CBF / SP)
Delegado Local:,Marcelo Carlos Nascimento Viana (CBF / )
"",,,Cronologia,,,
"",1o Tempo,,2o Tempo,,,
Entrada do mandante:,15:51Atraso:,,Não Houve Entrada do mandante: 17:00,,Atraso:,Não Houve
Entrada do visitante:,15:51Atraso:,,Não Houve Entrada do visitante: 17:00,,Atraso:,Não Houve
Início 1o Tempo:,16:00Atraso:,,Não Houve Início do 2o Tempo: 17:02,,Atraso:,Não Houve
Término do 1o Tempo:,16:47Acréscimo:,,2 min Término do 2o Tempo: 17:50,Acréscimo:,,3 min
Resultado do 1o Tempo: 1 X 0,,,Resultado Final: 1 X 0,,,
"",,,,,Relação de Jogadores,,,,
"",,Flamengo / RJ,,,,Cruzeiro / MG,,,
No,Apelido,Nome Completo,T/R,P/A,CBF No Apelido,Nome Completo T/R,P/A,,CBF
1,Diego Alves,Diego Alves Carreira,T(g),P,159238 12 Rafael,Rafael Pires Monteiro T(g),P,,180213
2,Rodinei,Rodinei Marcelo de A ...,T,P,353568 2 Ezequiel,Ezequiel Jacinto de Biasi T,P,,302436
7,Everton Ri ...,Everton Augusto de B ...,T,P,177444 3 Leo,Leonardo Renan Simoe... T,P,,174360
10,Diego,Diego Ribas da Cunha,T,P,152138 5 Ariel Cabral,Alejandro Ariel Cabral T,P,,535421
11,Lucas Paqu ...,Lucas Tolentino Coel ...,T,P,319635 8 Henrique,Henrique Pacheco de Lima T,P,,170812
13,Trauco,Miguel Angel Trauco  ...,T,P,565356 11 David,David Correia da Fonseca T,P,,430588
14,Vitinho,Victor Vinicius Coel ...,T,P,307245 17 Raniel San ...,Raniel Santana de Va... T,P,,447783
15,Rever,Rever Humberto Alves ...,T,P,167509 18 RAFAEL,RAFAEL DA SILVA FRANCISTCOP,,,151708
19,Henrique D ...,Jose Henrique da Sil ...,T,P,189708 21 Mancuello,Federico Andres Mancuello T,P,,541197
25,Piris,Robert Ayrton Piris  ...,T,P,633626 25 M. Hermes,Marcelo Hermes T,P,,363926
43,Leonardo,Leonardo Campos Duar ...,T,P,355960 27 Manoel,Manoel Messias Silva... T,P,,182423
37,Cesar,Cesar Bernardo Dutra,R(g),P,307296 1 Fabio,Fabio Deivson Lopes ... R(g),P,,129292
5,Willian Arão,Willian Souza Arao d ...,R,P,293420 6 Egidio,Egidio de Araujo Per... R,P,,157280
17,Marlos Moreno,Marlos Moreno Duran,R,P,610239 10 De Arrascaeta,Giorgian Daniel de A... R,P,,521990
18,Jean,Jean Lucas de Souza  ...,R,P,318143 15 Patrick,Patrick de Carvalho Brey R,P,,395968
21,Pará,Marcos Rogerio Ricci ...,R,P,165065 16 Lucas Silva,Lucas Silva Borges R,P,,320111
23,Gigio,Geuvanio Santos Silva,R,P,311336 19 Robinho,Robson Michael Signorini R,P,,172189
26,Thuler,Matheus Soares Thuler,R,P,372902 22 Edilson,Edilson Mendes Guimaraes R,P,,161745
27,Romulo,Romulo Borges Monteiro,R,P,183094 26 Dede,Anderson Vital da Silva R,P,,177749
29,Lincoln,Lincoln Correa dos Santos,R,P,540186 28 Barcos,Hernan Barcos R,P,,402375
30,Thiaguinho,Thiago Rodrigues da Silva,R,P,307774 30 Thiago Neves,Thiago Neves Augusto R,P,,169888
44,Rhodolfo,Luiz Rhodolfo Dini Gaioto,R,P,169286 39 Vitor Eudes,Vitor Eudes de Souza... R,P,,444850
59,Michael Ra ...,Michael Rangel dos S ...,R,P,443360,,,,
"",,Comissão Técnica,
"",Flamengo / RJ,,Cruzeiro / MG
Técnico:,MAURICIO NOGUEIRA BARBIERI,Técnico:,LUIZ ANTONIO VENKER MENEZES
Auxiliar Técnico:,MAURICIO FERREIRA DE SOUZA,Auxiliar Técnico:,SIDNEI DE ESPIRITO
Médico:,MARCIO ALVES TANNURE,Médico:,SERGIO AUGUSTO CAMPOLINA DE AZEREDO
Treinador De Goleiros:,ROGERIO MAIA DE BRUM,Treinador De Goleiros:,ROBERTO BARBOSA DOS SANTOS
Preparador Físico:,DIOGO DE BORBA LINHARES,Preparador Físico:,EDUARDO LUIS DA SILVA
Fisioterapeuta:,FREDERICO DE SA MANHAES,Fisioterapeuta:,ANDRE MARLEY DA SILVA ROCHA
"",,,,,Gols,
Tempo,1T/2T,No,Tipo,Nome do Jogador,,Equipe
22:00,1T,19,NR,Jose Henrique da Silva Dourado,,Flamengo/RJ
"",,,,Cartões Amarelos
Tempo,1T/2T,No,Nome do Jogador,Equipe
08:00,1T,19,Jose Henrique da Silva Dourado,Flamengo/RJ
"",,,Motivo: A1.2.  Dar ou tentar dar uma rasteira ou um calço em um adversário de maneira temerária na disputa da bola  - Dar um calço,
"",,,em seu adversário de maneira temerária na disputa de bola.,
"",,,,Substituições,
Tempo,1T/2T,,Equipe,Entrou,Saiu
10:00,2T,Cruzeiro/MG,,10 - Giorgian Daniel de Arrascaet...,11 - David Correia da Fonseca
10:00,2T,Cruzeiro/MG,,30 - Thiago Neves Augusto,21 - Federico Andres Mancuello
26:00,2T,Cruzeiro/MG,,19 - Robson Michael Signorini,18 - RAFAEL DA SILVA FRANCISCO
29:00,2T,Flamengo/RJ,,5 - Willian Souza Arao da Silva,10 - Diego Ribas da Cunha
35:00,2T,Flamengo/RJ,,17 - Marlos Moreno Duran,14 - Victor Vinicius Coelho Santos
38:00,2T,Flamengo/RJ,,21 - Marcos Rogerio Ricci Lopes,19 - Jose Henrique da Silva Dourado
