Campeonato:,Campeonato Brasileiro - Série A/2018,Rodada:,38
Jogo:,Ceará / CE X Vasco da Gama / RJ,,
Data:,02/12/2018 Horário: 17:00 Estádio:,Governador Plácido Aderaldo Castelo / Fortaleza,
"",,Arbitragem
Arbitro:,Raphael Claus (FIFA / SP),
Arbitro Assistente 1:,Danilo Ricardo Simon Manis (FIFA / SP),
Arbitro Assistente 2:,Rogerio Pablos Zanardo (AB / SP),
Quarto Arbitro:,Fabricio Porfirio de Moura (AB / SP),
Arbitro Assist Adic 1:,Thiago Duarte Peixoto (AB / SP),
Arbitro Assist Adic 2:,Rodrigo Guarizo Ferreira do Amaral (AB / SP),
Inspetor:,Alicio Pena Junior (CBF / BRA),
Delegado Local:,Julio Cesar Andrade Manso ( / ),
"",,,Cronologia,,,
"",1o Tempo,,2o Tempo,,,
Entrada do mandante:,16:50Atraso:,,Não Houve Entrada do mandante: 18:03,,Atraso:,Não Houve
Entrada do visitante:,16:50Atraso:,,Não Houve Entrada do visitante: 18:04,,Atraso:,Não Houve
Início 1o Tempo:,17:04Atraso:,,4 min Início do 2o Tempo: 18:06,,Atraso:,Não Houve
Término do 1o Tempo:,17:51Acréscimo:,,2 min Término do 2o Tempo: 18:54,Acréscimo:,,3 min
Resultado do 1o Tempo: 0 X 0,,,Resultado Final: 0 X 0,,,
"",,,,,Relação de Jogadores,,,,
"",,Ceará / CE,,,,Vasco da Gama / RJ,,,
No,Apelido,Nome Completo T/R,P/A,,CBF No Apelido,Nome Completo T/R,,P/A,CBF
1,Everson,Everson Felipe Marqu ... T(g),P,,188398 33 Fernando M ...,Fernando Miguel KaufmannT(g),,P,159684
3,Valdo,Andrevaldo de Jesus  ... T,P,,326990 7 Kelvin,Kelvin Mateus de Oliveira T,,P,300791
6,Felipe,Felipe Jonatan Rocha ... T,P,,373768 8 Thiago,Thiago Galhardo do N... T,,P,189822
8,Ricardinho,Ricardo Dias Acosta T,P,,169114 11 Maxi Lopez,Maximiliano Gaston Lopez T,,P,308333
11,Felipe,Felipe Azevedo dos Santos T,P,,175557 13 Luiz,Luiz Gustavo Tavares... T,,P,300856
13,Luiz,Luiz Otavio Anacleto ... T,P,,291651 15 Andrey,Andrey Ramos do Nasc... T,,P,404816
20,Juninho,Paulo Roberto Valour ... T,P,,179395 21 Willian,Willian Marlon Ferre... T,,P,421180
22,Samuel,Samuel Xavier Brito T,P,,292428 23 Caio Monteiro,Caio Monteiro Costa T,,P,404815
25,Calyson,Calyson Rubens Santi ... T,P,,314842 25 Leandro,Leandro Castan da Silva T,,P,164170
26,Richardson,Richardson Fernandes ... T,P,,328312 31 Raul,Raul Lo Goncalves T,,P,446399
40,Arthur,Arthur Mendonça Cabral T,P,,518820 34 Werley,Werley Ananias da Silva T,,P,172411
86,Diogo Silva,Diogo Jose Goncalves ... R(g),P,,165094 44 Jordi,Jordi Martins Almeida R(g),,P,320196
4,Brock,Eduardo Schroeder Brock R,P,,291997 3 Henriquez,Oswaldo Jose Henriqu... R,,P,541170
5,Edinho,Edimo Ferreira Campos R,P,,143977 5 DESABATO,LEANDRO LUIS DESABATOR,,P,610066
7,Eder,Eder Luis de Oliveira R,P,,165075 6 Fabricio,Fabricio dos Santos Silva R,,P,172408
23,JOWN CARDONJAOWN ANDERSON CARDORN ...P,,,,631965 9 Andy,Andres Lorenzo Rios R,,P,595801
27,Wescley,Wescley Gomes dos Santos R,P,,297441 14 Ricardo,Ricardo Queiroz de A... R,,P,372370
77,Fabinho,Fabio Goncalves R,P,,175065 17 Rildo,Rildo de Andrade Fel... R,,P,318254
83,Fernando,Fernando Henrique do ... R,P,,156439 18 Lenon,Lenon Fernandes Ribeiro R,,P,184363
88,Pedro Ken,Pedro Ken Marimoto M ... R,P,,170095 20 Eduardo,Eduardo Feitoza Sampaio R,,P,434038
89,Arnaldo,Arnaldo Manoel de Almeida R,P,,322785 38 Marrony,Marrony da Silva Lib... R,,P,463599
91,Joao Lucas,Joao Lucas Cardoso R,P,,303237 43 Bruno,Bruno de Andrade Ritter R,,P,401028
99,Ricardo Bueno,Ricardo Bueno da Silva R,P,,179974 45 Luan,Luan de Figueiredo G... R,,P,319992
"",,Comissão Técnica,
"",Ceará / CE,,Vasco da Gama / RJ
Técnico:,LUIZ CARLOS CIRNE LIMA DE LORENZI,Técnico:,ALBERTO VALENTIM DO CARMO NETO
Auxiliar Técnico:,MARCIO HENRIQUE BORGES HAHN,Auxiliar Técnico:,FERNANDO MIRANDA RIBEIRO DE MORAES
Médico:,GUSTAVO MAURICIO DE AZEVEDO PIRES,Médico:,VICTOR LUIZ BAITELLI LEITE
Treinador De Goleiros:,EVERALDO GONCALVES SANTANA,Treinador De Goleiros:,DANILO JOSE PRANDO MINUTTI
Preparador Físico:,FLAVIO HENRIQUE DE OLIVEIRA,Preparador Físico:,RICARDO HENRIQUES PINTO
Fisioterapeuta:,WELLINGTON LIMA DE ALENCAR,Massagista:,MARCIO ALEXANDRE SILVA JACO
"",,,,Cartões Vermelhos
Tempo 1T/2T,No,,Nome do Jogador,
+1:00 2T,22,,Samuel Xavier Brito - Ceará/CE,
2o Cartão Amarelo,,,Motivo: V2.8.  Outro motivo (detalhar no campo expulsões) - Expulso  por agarrar seu adversário de no 38 sr. marrony da silva liberato,
"",,,,Substituições
Tempo,1T/2T,,Equipe,Entrou Saiu
45:00,INT,Ceará/CE,,7 - Eder Luis de Oliveira 25 - Calyson Rubens Santiago Rosa
18:00,2T,Ceará/CE,,27 - Wescley Gomes dos Santos 8 - Ricardo Dias Acosta
19:00,2T,Vasco da Gama/RJ,,38 - Marrony da Silva Liberato Si... 23 - Caio Monteiro Costa
27:00,2T,Vasco da Gama/RJ,,14 - Ricardo Queiroz de Alencastr... 21 - Willian Marlon Ferreira Moraes
27:00,2T,Ceará/CE,,23 - JOWN ANDERSON CARDONA AGUDE1L1O - Felipe Azevedo dos Santos
34:00,2T,Vasco da Gama/RJ,,5 - LEANDRO LUIS DESABATO 31 - Raul Lo Goncalves
