"",Arbitragem
Arbitro:,Antonio F de Carvalho Schneider (CBF-1 / RJ)
Arbitro Assistente 1:,Diogo Carvalho Silva (CBF-2 / RJ)
Arbitro Assistente 2:,Luiz Felippe Scofield Guerra Costa (CBF-2 / RJ)
Quarto Arbitro:,Rodrigo Carvalhaes de Miranda (CBF-2 / RJ)
Assessor:,João José da Silva Loureiro (ASS / RJ)
"",,,Cronologia,,,
"",1o Tempo,,2o Tempo,,,
Entrada do mandante:,15:50Atraso:,,Não Houve Entrada do mandante: 16:58,Atraso:,,Não Houve
Entrada do visitante:,15:50Atraso:,,Não Houve Entrada do visitante: 17:00,Atraso:,,Não Houve
Início 1o Tempo:,16:00 Atraso:,,Não Houve Início do 2o Tempo: 17:01,Atraso:,,Não Houve
Término do 1o Tempo:,16:46 Acréscimo:,,1 min Término do 2o Tempo: 17:49,Acréscimo:,,3 min
Resultado do 1o Tempo: 0 X 0,,,Resultado Final: 1 X 1,,,
"",,,,Relação de Jogadores,,,
"",,Duque de Caxias / RJ,,,Madureira / RJ,,
No,Apelido,Nome Completo T/R P/A,,CBF No Apelido,Nome Completo T/R P/A,,CBF
1,Rafael,Rafael Roballo Maciel T,P,187908 1 Jonathan,Jonathan Ribeiro Louredo T,P,299473
2,Michel,Michel Tiago Braga d ... T,P,340998 2 Felipe,Felipe Cordeiro de A... T,P,299823
3,Victor,Victor Mattos Cardozo T,P,332286 3 Aislan,Aislan Paulo Lotici Back T,P,180866
4,Perema,Auricélio Soares dos ... T,P,389790 4 Thiago,Thiago Cardoso T,P,190230
5,Jucemar,Jucemar Decio Ribeir ... T,P,178224 5 Café,Gilson de Jesus do N... T,P,296072
6,Diego,Diego Evangelista do ... T,P,181398 6 Ramon,Ramon dos Santos Pereira T,P,297093
7,Lucas,Lucas Hespanholeto T,P,293538 7 Evandro,Evandro Teixeira Mag... T,P,172020
8,Bruno,Bruno Arrabal Passamani T,P,298107 8 Victor,Victor Gomes Lemos T,P,307957
9,Washington,Washington Luiz Masc ... T,P,137418 9 Monga,Clebson Fontoura Souto T,P,166101
10,Harison,Harison da Silva Nery T,P,129465 10 Ryan,Ryan do Nascimento RamosT,P,306693
11,Matheus,Matheus Cardoso de Souza T,P,333800 11 Felipe,Felipe Augusto Ferre... T,P,323819
12,Bernardo,Bernardo Casanova Franco R,P,317373 12 George,George Vinicius de O... R,P,185139
13,Felipe Tav ...,Felipe Pereira Tavares R,P,374487 13 Sidimar,Sidimar Fernando Cig... R,P,299156
14,Bruno,Bruno de Moura Froes ... R,P,319365 14 Euzebio,Osvaldir Araujo Euzebio R,P,177876
15,Lucas,Lucas da Silva Santos R,P,316346 15 Luiz Paulo,Luiz Paulo França do... R,P,306706
16,Sampson,Sampson Nunes da Silva R,P,336844 16 Heitor,Heitor Espinato Oliv... R,P,184525
17,Tiago,Tiago Barreiros Martins R,P,306358 17 Carlos Alb ...,Carlos Alberto Rogge... R,P,184989
18,Jorginho,Jorgel Edson da Silv ... R,A,439240 18 Wendel,Wendel Alex dos Santos R,P,291319
"",,,,19 Dairo,Dairo Pinheiro Santana R,P,188164
"",,,,20 Rodrigo,Rodrigo Cunha Pereir... R,P,327384
"",,,,21 Romario,Romario Barbosa de O... R,P,336786
"",,,,22 Joazinho,João Pedro Alves da ... R,P,309651
"",,Comissão Técnica,
"",Duque de Caxias / RJ,,Madureira / RJ
Tecnico:,Bruno Ewerton Quadros - 076697447-23,Tecnico:,Leston Izaias Do Nascimento Jr - 8482644
Auxiliar Tecnico:,Jean Francisco Rodrigues - 270642018-95,Auxiliar Tecnico:,Alessandro Fahel Matos - 7211762
Medico:,Edmon Garcia Silva - 5280126-7,Medico:,Sandro Mansur Fernandes - 5296141-8
Preparador Fisico:,Marcio Ferreira Camacho - 2687,Preparador Fisico:,Rodrigo Melo Da Silva - 09668618-3
Massagista:,Luiz Claudio Abreu Dos Santos - 036604267-09,Massagista:,Paulo Adriano Da Silva - 06252043-2
"",,,,,Gols,
Tempo,1T/2T,No,Tipo,Nome do Jogador,,Equipe
03:00,2T,11,NR,Matheus Cardoso de Souza,,Duque de Caxias/RJ
33:00,2T,17,NR,Carlos Alberto Rogger Dias,,Madureira/RJ
"",,,Substituições,
Tempo,1T/2T,Equipe,Entrou,Saiu
45:00,INT,Duque de Caxias/RJ,16 - Sampson Nunes da Silva,7 - Lucas Hespanholeto
34:00,1T,Duque de Caxias/RJ,17 - Tiago Barreiros Martins,10 - Harison da Silva Nery
13:00,2T,Madureira/RJ,17 - Carlos Alberto Rogger Dia ...,10 - Ryan do Nascimento Ramos
21:00,2T,Madureira/RJ,18 - Wendel Alex dos Santos,7 - Evandro Teixeira Magalhae ...
34:00,2T,Duque de Caxias/RJ,15 - Lucas da Silva Santos,8 - Bruno Arrabal Passamani
39:00,2T,Madureira/RJ,19 - Dairo Pinheiro Santana,9 - Clebson Fontoura Souto
