"",,Arbitragem
Arbitro:,Antonio Santos Nunes (CBF-2 / PI),
Arbitro Assistente 1:,Rogério de Oliveira Braga (CBF-2 / PI),
Arbitro Assistente 2:,Thyago Costa Leitao (CBF-1 / PI),
Quarto Arbitro:,Glauco Nunes Feitosa (CBF-2 / CE),
Assessor:,Manoel Sidney Beviláqua de Aguiar (ASS / CE),
"",,,Cronologia,,,
"",1o Tempo,,2o Tempo,,,
Entrada do mandante:,18:50Atraso:,,Não Houve Entrada do mandante: 20:00,Atraso:,,Não Houve
Entrada do visitante:,18:50Atraso:,,Não Houve Entrada do visitante: 19:59,Atraso:,,Não Houve
Início 1o Tempo:,19:00 Atraso:,,Não Houve Início do 2o Tempo: 20:02,Atraso:,,Não Houve
Término do 1o Tempo:,19:47 Acréscimo:,,2 min Término do 2o Tempo: 20:51,Acréscimo:,,4 min
Resultado do 1o Tempo: 1 X 0,,,Resultado Final: 1 X 1,,,
"",,,,Relação de Jogadores,,,
"",,Fortaleza / CE,,,C.r.a.c. / GO,,
No,Apelido,Nome Completo T/R P/A,,CBF No Apelido,Nome Completo T/R P/A,,CBF
1,Ricardo,Ricardo Ernesto Ahlf T,P,174338 1 Donizeti,Luciano Donizeti Nun...,T P,133033
2,Cametá,Tiago Coelho Andrade T,P,392058 2 Tiago Sala,Tiago Sala,T P,154309
3,Genilson,Genilson Ventura Men ... T,P,190137 3 Luciano,Luciano da Costa Fer...,T P,138389
4,Adalberto,Adalberto dos Santos ... T,P,184704 4 Fabio,Fabio Carleandro da ...,T P,132391
5,Guto,Jonathan Medeiros de ... T,P,175215 5 Luiz,Luiz Oliveira dos Sa...,T P,146792
6,Fernandinho,Fernando Alves Santa ... T,P,138800 6 Karlos,Karlos Wagner da Sil...,T P,295241
7,Wal,Walfrido Lourenço Al ... T,P,366043 7 Wallace,Wallace Barbosa de Sousa,T P,377797
8,Edinho,Francisco Edson More ... T,P,377355 8 Neto,Jose Neto Costa Reis,T P,160876
9,Robert,Robert de Pinho de Souza T,P,140778 9 Romulo,Romulo Marques Antoneli,T P,142190
10,M Paraiba,Marcelo dos Santos T,P,118442 10 Diego,Diogo Justino Medeiros,T P,177612
11,Wal,Waldison Rodrigues d ... T,P,161325 11 Rafael,Rafael Sayao Rodrigu...,T P,370076
12,Andre,Andre Renato Antoniassi R,P,168929 12 Joao Pedro,Joao Pedro Ferreira Luiz,R P,324895
13,Eduardo,Eduardo Luiz Dallagnol R,P,155359 13 Tiago,Tiago de Araujo Silva,R P,315003
14,Lima,Willian Lanes de Lima R,P,160789 14 Paulo Edua ...,Paulo Eduardo Mira Q...,R P,185719
15,Hudson,Hudson Fernando Tobi ... R,P,169792 15 Gustavo,Gustavo Henrique Cun...,R P,316755
16,Radar,Radamezio Goncalves Lima R,P,178985 16 Araujo,Antonio Araujo Silva,R P,179696
17,Leandro Pe ...,Leandro Pereira dos  ... R,P,177455 17 Everton,Everton da Silva Furtado,R P,403978
18,Zulu,Carlos Eduardo Alves ... R,P,159089 18 Washington,Washington Luiz Gome...,R P,187183
19,Uilliam,Uilliam Barros Pereira R,P,427379,,,
20,Davidson,Davidson da Luz Pereira R,P,298514,,,
21,Erick,Erick Flores Bonfim R,P,177076,,,
22,Adriano,Adriano Ferreira Ardaia R,P,181715,,,
"",,Comissão Técnica,
"",Fortaleza / CE,,C.r.a.c. / GO
Tecnico:,Marcelo Augusto Oliveira Chamusca - 301987475 SSP,Tecnico:,Valdenir Rodrigues Da Silva - 98002395275 CE
Auxiliar Tecnico:,Carlos Andre Gonçalves Cunha - 362130267 SSP,Auxiliar Tecnico:,Vacil Batista De Souza  - 051634442 RJ
Medico:,Marcos Dias Costa Xerez - 11273,Medico:,Xxxxxxxxxxxxxxxxxxxxxxxxxxxxxxxxxx - xxxxxxxxxxx
Preparador Fisico:,Roger Gouveia E Silva - 004589 G/CE,Preparador Fisico:,Sander Mendes Ramos - 006309-G/CE
Massagista:,Manoel Rodigues De Almeida - 94012001480 SSP,Massagista:,Heiltor Fleury Castro Junior - crefito 136584
"",,,,,Gols,
Tempo,1T/2T,No,Tipo,Nome do Jogador,,Equipe
42:00,1T,6,NR,Fernando Alves Santa Clara,,Fortaleza/CE
39:00,2T,18,NR,Washington Luiz Gomes da Silva,,C.r.a.c./GO
"",,,,Substituições,
Tempo,1T/2T,,Equipe,Entrou,Saiu
40:00,1T,C.r.a.c./GO,,17 - Everton da Silva Furtado,7 - Wallace Barbosa de Sousa
16:00,2T,Fortaleza/CE,,21 - Erick Flores Bonfim,8 - Francisco Edson Moreira d ...
18:00,2T,C.r.a.c./GO,,18 - Washington Luiz Gomes da  ...,9 - Romulo Marques Antoneli
29:00,2T,C.r.a.c./GO,,16 - Antonio Araujo Silva,11 - Rafael Sayao Rodrigues de ...
30:00,2T,Fortaleza/CE,,19 - Uilliam Barros Pereira,11 - Waldison Rodrigues de Sou ...
36:00,2T,Fortaleza/CE,,16 - Radamezio Goncalves Lima,10 - Marcelo dos Santos
