"",Arbitragem
Arbitro:,Paulo Henrique de Melo Salmazio (CBF-1 / MS)
Arbitro Assistente 1:,Fabio Rodrigo Rubinho (CBF-1 / MT)
Arbitro Assistente 2:,Jackson Timoteo Lopes (CBF-3 / MT)
Quarto Arbitro:,Aurelio Santana Martins (CBF-2 / SP)
Assessor:,Dionisio Roberto Domingos (000 / SP)
Delegado Local:,Carlos Roberto Fernandes Silva (000 / )
"",,,Cronologia,,,
"",1o Tempo,,2o Tempo,,,
Entrada do mandante:,10:50Atraso:,,Não Houve Entrada do mandante: 12:03,Atraso:,,Não Houve
Entrada do visitante:,10:50Atraso:,,Não Houve Entrada do visitante: 12:02,Atraso:,,Não Houve
Início 1o Tempo:,11:00 Atraso:,,Não Houve Início do 2o Tempo: 12:05,Atraso:,,Não Houve
Término do 1o Tempo:,11:50 Acréscimo:,,5 min Término do 2o Tempo: 12:55,Acréscimo:,,5 min
Resultado do 1o Tempo: 1 X 0,,,Resultado Final: 5 X 0,,,
"",,,,Relação de Jogadores,,,
"",,Guaratinguetá / SP,,,Madureira / RJ,,
No,Apelido,Nome Completo,T/R P/A,CBF No Apelido,Nome Completo T/R P/A,,CBF
1,Lucas,Lucas Macanhan Ferreira,T P,294365 1 Marcio Cez ...,Marcio Cezilo Arantes T,P,156843
2,Wesley,Wesley Lima da Silva,T P,500951 2 Iago,Iago Soares Costa T,P,309446
3,Rafael,Rafael Henrique Zuchi,T P,309772 3 Leandro,Leandro dos Santos C... T,P,293530
4,Leonardo,Leonardo Pereira,T P,310373 4 Luis,Luis Felipe Gava Bento T,P,333996
5,Matteus,Matteus Oliveira Santos,T P,380626 5 Café,Gilson de Jesus do N... T,P,296072
6,Renan,Renan Luis Neves dos ...,T P,333459 6 Wallace,Wallace Santos Marinho T,P,179413
7,Felipe,Felipe Adalberto Ang ...,T P,330967 7 Ramon,Ramon dos Santos Pereira T,P,297093
8,Joao,Joao Pedro Heinen Silva,T P,380762 8 Ives,Ives Antero de Souza T,P,167882
9,Guilherme,Guilherme Schettine  ...,T P,343107 9 Joao Carlos,Joao Carlos de Castr... T,P,187979
10,Marcos,Marcos do Nascimento ...,T P,374835 10 Leo,Leandro Chaves Rodrigues T,P,157749
11,Caique,Caique da Silva Santos,T P,383618 11 Arthur,Arthur Faria Machado T,P,336477
12,Alexandre,Alexandre Rosa Pasch ...,R P,297982 12 Jonathan,Jonathan Ribeiro Louredo R,P,299473
13,Dodo,Douglas Caetano de A ...,R P,328924 13 Arlen,Arlen Cleyton Ribeir... R,P,437714
14,Gabriel,Gabriel do Carmo Ass ...,R P,436537 14 Ramon,Ramon Rafael do Nasc... R,P,368183
15,Wellinton,Wellinton Gustavo Fe ...,R P,461832 15 Alex,Alex Augusto Martins... R,P,402945
16,Lucas,Lucas de Lima Ferreira,R P,446068 16 Bruno,Bruno Goncalves Kisc... R,P,377818
17,Andre Luis,Andre Luis da Costa  ...,R P,321636 17 Julio Cesa ...,Julio Cesar de Rezen... R,P,315696
18,Alex,Alex Santos Araujo,R P,310403 18 Boiadeiro,Thiago Xavier da Rosa R,P,155011
"",,,,19 Maranhao,Geovane Diniz Silva R,P,293986
"",,,,20 Gustavo,Gustavo Lucas de Onofre R,P,317933
"",,,,,Gols,
Tempo,1T/2T,No,Tipo,Nome do Jogador,,Equipe
18:00,1T,11,NR,Caique da Silva Santos,,Guaratinguetá/SP
13:00,2T,8,PN,Joao Pedro Heinen Silva,,Guaratinguetá/SP
20:00,2T,9,NR,Guilherme Schettine Guimaraes,,Guaratinguetá/SP
23:00,2T,4,CT,Luis Felipe Gava Bento,,Madureira/RJ
33:00,2T,16,NR,Lucas de Lima Ferreira,,Guaratinguetá/SP
"",,,,Cartões Vermelhos
Tempo 1T/2T,No,,Nome do Jogador,
45:00,10,,Leandro Chaves Rodrigues - Madureira/RJ,
Cartão Vermelho Direto,,,"Descrição: Expulsei diretamente, após ao termino da partida, o sr leandro chaves rodrigues n° 10 da equipe do madureira e. c. por:",
"",,,"deslocar ate a equipe de arbitragem, direcionando a palavra ao assistente 2 sr. jackson timoteo lopes para reclamar  e xingar",
"",,,"acintosamente dizendo as seguintes palavras ""assistente você muito fraco, seu vagabundo e safado"". informo que tal atitude foi",
"",,,presenciado por toda equipe de arbitragem.,
"",,,,Substituições,
Tempo,1T/2T,,Equipe,Entrou,Saiu
45:00,INT,Madureira/RJ,,16 - Bruno Goncalves Kischinhe ...,8 - Ives Antero de Souza
32:00,1T,Madureira/RJ,,19 - Geovane Diniz Silva,11 - Arthur Faria Machado
14:00,2T,Madureira/RJ,,20 - Gustavo Lucas de Onofre,6 - Wallace Santos Marinho
18:00,2T,Guaratinguetá/SP,,17 - Andre Luis da Costa Alfre ...,8 - Joao Pedro Heinen Silva
23:00,2T,Guaratinguetá/SP,,16 - Lucas de Lima Ferreira,7 - Felipe Adalberto Angiolet ...
28:00,2T,Guaratinguetá/SP,,18 - Alex Santos Araujo,9 - Guilherme Schettine Guima ...
