"",,Arbitragem
Arbitro:,Leonardo Sígari Zanon (CBF-2 / PR),
Arbitro Assistente 1:,Ivan Carlos Bohn (CBF-1 / PR),
Arbitro Assistente 2:,Daniel Cotrim de Carvalho (CBF-1 / PR),
Quarto Arbitro:,Vinicius Furlan (CBF-1 / SP),
Assessor:,Almir Alves de Mello (ASS / SP),
"",,,Cronologia,,,
"",1o Tempo,,2o Tempo,,,
Entrada do mandante:,21:50Atraso:,,Não Houve Entrada do mandante: 23:00,Atraso:,,Não Houve
Entrada do visitante:,21:50Atraso:,,Não Houve Entrada do visitante: 23:01,Atraso:,,Não Houve
Início 1o Tempo:,22:00 Atraso:,,Não Houve Início do 2o Tempo: 23:02,Atraso:,,Não Houve
Término do 1o Tempo:,22:47 Acréscimo:,,2 min Término do 2o Tempo: 23:51,Acréscimo:,,4 min
Resultado do 1o Tempo: 0 X 1,,,Resultado Final: 1 X 2,,,
"",,,,Relação de Jogadores,,,
"",,Capivariano / SP,,,Botafogo / RJ,,
No,Apelido,Nome Completo,T/R P/A,CBF No Apelido,Nome Completo T/R P/A,,CBF
1,Douglas,Douglas Alan Schuck  ...,T P,182717 1 Renan,Renan dos Santos T,P,188424
2,Jheckson,Jheckson Silva Oliveira,T P,306314 2 Emerson,Emerson Raymundo Santos T,P,348257
3,Marllon,Marllon Goncalves Je ...,T P,299840 3 Alisson,Alisson Christhian Brand T,P,303987
4,Fernando,Fernando Lombardi,T P,140899 4 Diego,Diego Ferreira Matheus T,P,318082
5,Amaral,Alexandre da Silva M ...,T P,117599 5 Airton,Airton Ribeiro Santos T,P,186870
6,Pedro,Pedro Henrique de So ...,T P,182801 6 Jean,Jean Victor Barros T,P,387314
7,Wigor,Wigor Alan do Nascimento,T P,377492 7 Luiz,Luiz Ricardo Alves T,P,337172
8,Everton,Everton Macedo Dias,T P,320318 8 Mauricio,Mauricio Andreazzi P... T,P,316470
9,Romao,Luiz Fernando Borges ...,T P,190258 9 Henrique,Henrique Almeida Cai... T,P,178303
10,Kleiton,Kleiton Domingues Ba ...,T P,172259 10 Diego,Diego Jardel Koester T,P,296863
11,Rodolfo,Rodolfo Jose da Silv ...,T P,423003 11 Geirton,Geirton Marques Aires T,P,310627
12,Andre,Andre Luis Santos do ...,R P,130171 12 Helton,Helton Brant Aleixo ... R,P,303187
13,Helio,Helio Monteiro Batista,R P,180215 13 Erick,Erick Brendon Pinhei... R,P,337169
14,Wilian,Wilian Favoni Leite,R P,187931 14 Igor,Igor Rabello da Costa R,P,307840
15,Samuel,Samuel de Oliveira Souza,R P,322891 15 Gabriel,Gabriel Arruda de Li... R,P,318098
16,Talles,Talles Garcia de Cas ...,R P,354674 16 Dierson Ju ...,Dierson Junior Kuhn R,P,454221
17,George,George Minatto Paulino,R P,304401 17 Alcides,Alcides de Souza Far... R,P,307183
18,Valmir,Valmir Aparecido Fra ...,R P,305892 18 Tassio,Tassio Maia dos Santos R,P,155122
19,Alexsander ...,Alexsander Ranielle  ...,R P,378668 19 Daniel,Daniel da Silva Carvalho R,P,137972
22,Moises,Moises Francisco Nun ...,R P,292981 20 Vinicius,Vinicius Rodolfo de ... R,P,387150
"",,Comissão Técnica,
"",Capivariano / SP,,Botafogo / RJ
Tecnico:,Evendro Benedito Lourenço De Souza - 271294462,Tecnico:,Alfredo Jose Traino Montesso  - 158724598
Auxiliar Tecnico:,Rodney Roz - 8632726,Auxiliar Tecnico:,Francisco Jorge Dos Santos Oliveira - 038781373
Medico:,Hugo Alexandre Alves Rodrigues - 64463,Medico:,Gustavo De Albuquerque Dutra - 52814253
Preparador Fisico:,Cesar Alberto De Cillo - 35221,Preparador Fisico:,Alex Ambrosio Rites - 115605305
Massagista:,Jungliano Dos Santos Lelis - 290915715,Massagista:,Atila Cordeiro Doria - 056743610
"",,,,,Gols,
Tempo,1T/2T,No,Tipo,Nome do Jogador,,Equipe
09:00,1T,7,NR,Luiz Ricardo Alves,,Botafogo/RJ
30:00,2T,3,NR,Marllon Goncalves Jeronimo Borges,,Capivariano/SP
39:00,2T,19,NR,Daniel da Silva Carvalho,,Botafogo/RJ
"",,,Substituições,
Tempo,1T/2T,Equipe,Entrou,Saiu
18:00,2T,Capivariano/SP,18 - Valmir Aparecido Franci d ...,8 - Everton Macedo Dias
20:00,2T,Botafogo/RJ,19 - Daniel da Silva Carvalho,10 - Diego Jardel Koester
28:00,2T,Botafogo/RJ,18 - Tassio Maia dos Santos,9 - Henrique Almeida Caixeta  ...
33:00,2T,Capivariano/SP,14 - Wilian Favoni Leite,9 - Luiz Fernando Borges Roma ...
34:00,2T,Botafogo/RJ,16 - Dierson Junior Kuhn,5 - Airton Ribeiro Santos
44:00,2T,Capivariano/SP,17 - George Minatto Paulino,10 - Kleiton Domingues Barbosa ...
