"",Arbitragem
Arbitro:,Eduardo de Santana Nunes (CBF-2 / SE)
Arbitro Assistente 1:,Vaneide Vieira de Gois (ASP-FIFA / SE)
Arbitro Assistente 2:,Wendel Augusto Lino de Jesus Melo (CBF-2 / SE)
Quarto Arbitro:,José Ricardo Vasconcellos Laranjeira (CBF-2 / AL)
Assessor:,Alton Olimpio da Silva (ASS / AL)
"",,,Cronologia,,,
"",1o Tempo,,2o Tempo,,,
Entrada do mandante:,19:19Atraso:,,Não Houve Entrada do mandante: 20:30,Atraso:,,Não Houve
Entrada do visitante:,19:20Atraso:,,Não Houve Entrada do visitante: 20:32,Atraso:,,Não Houve
Início 1o Tempo:,19:30 Atraso:,,Não Houve Início do 2o Tempo: 20:33,Atraso:,,Não Houve
Término do 1o Tempo:,20:18 Acréscimo:,,3 min Término do 2o Tempo: 21:21,Acréscimo:,,3 min
Resultado do 1o Tempo: 0 X 1,,,Resultado Final: 1 X 1,,,
"",,,,Relação de Jogadores,,,
"",,Asa / AL,,,Vitória / BA,,
No,Apelido,Nome Completo,T/R P/A,CBF No Apelido,Nome Completo T/R P/A,,CBF
1,Eder,Eder Donizete Duarte ...,T P,153275 1 Kaufmann,Fernando Miguel Kaufmann T,P,159684
2,Gabriel,Gabriel Paulino Silva,T P,181802 2 Luiz,Luiz Gustavo Tavares... T,P,300856
3,André,André Bezerra Nunes,T P,351833 3 Ednei,Ednei Barbosa de Souza T,P,293385
4,Lucas,Alberto Lucas Nascim ...,T P,182289 4 Ramon,Ramon Menezes Roma T,P,402095
5,Jorge,Jorge Nascimento Capela,T P,369596 5 Mauricio,Mauricio Azevedo Alves T,P,189046
6,Rayro,Rayro da Silva Danin,T P,292579 6 Mansur,Joeliton Lima Santos T,P,325020
7,Valdívia,Caique Ferreira da S ...,T P,370426 7 Vander,Vander Luiz Silva Souza T,P,293180
8,Marcos,Marcos Glaybson Mart ...,T P,184257 8 Flavio Med ...,Flavio Medeiros da Silva T,P,337826
10,Alex,Alex Henrique Jose,T P,181845 9 Elton,Elton Rodrigues Brandao T,P,162905
11,Euderson,Uederson Ferreira Pa ...,T P,174233 10 Jorge Wagn ...,Jorge Wagner Goes Co... T,P,137073
19,Didira,Cicero dos Santos,T P,184798 11 Escudero,Damian Ariel Escudero T,P,371689
12,Diogo,Diogo da Silva,R P,403275 12 Junior,Wilson Rodrigues de ... R,P,155508
13,Angelo,Jose Angelo do Carmo,R P,158858 13 Romario,Romario da Silva Santos R,P,341562
14,Edson,Edson Moreira dos Santos,R P,154090 14 Jobson,Jobson de Brito Gonzaga R,P,371018
15,Fabio,Fabio Alves da Silva,R P,187325 15 Diego,Diego Renan de Lima ... R,P,184273
16,Cal,Jose Carlos de Magal ...,R P,173362 16 Marcelo,Marcelo Machado dos ... R,P,355752
17,Jean,Jean Ferreira de Souza,R P,398098 17 Dakson,Dakson Soares da Silva R,P,175011
18,Filipe,Filipe Andre Silva Leite,R P,303988 18 Gabriel,Gabriel Pereira da Silva R,P,352160
20,Valdanes,Valdanes Pinheiro da ...,R P,292804 19 David,David Correia da Fonseca R,P,430588
"",,,,20 Leonardo,Leonardo de Sousa Pe... R,P,367343
"",,Comissão Técnica,
"",Asa / AL,,Vitória / BA
Tecnico:,Jose Luiz Mauro - 127170819-PA,Tecnico:,Claudinei Dos Santos Oliveira - 029361-P-SP
Auxiliar Tecnico:,Ruben Alfredo Furtebach - 526913-RS,Auxiliar Tecnico:,Bruno Baquete - 412122947-SSP-S
Medico:,Helly Carlos De Albuquerque Santos - 5225/AL,Medico:,Jose Olimpio Neves Azevedo - 10351-BA
Preparador Fisico:,Sergio Valdemir Vasconcellos Picanço - 447724-AP,Preparador Fisico:,Angelo Alves Oliveira - 002396-G-BA
Massagista:,Adalberto De Oliveira Silva - 831782-AL,Massagista:,Michel Aguiar Dos Santos - 136606-F
"",,,,,Gols,
Tempo,1T/2T,No,Tipo,Nome do Jogador,,Equipe
34:00,1T,9,NR,Elton Rodrigues Brandao,,Vitória/BA
15:00,2T,10,NR,Alex Henrique Jose,,Asa/AL
"",,,,Substituições,
Tempo,1T/2T,,Equipe,Entrou,Saiu
14:00,2T,Asa/AL,,20 - Valdanes Pinheiro da Cost ...,8 - Marcos Glaybson Martins S ...
16:00,2T,Vitória/BA,,15 - Diego Renan de Lima Ferre ...,6 - Joeliton Lima Santos
21:00,2T,Vitória/BA,,16 - Marcelo Machado dos Santo ...,8 - Flavio Medeiros da Silva
40:00,2T,Asa/AL,,18 - Filipe Andre Silva Leite,11 - Uederson Ferreira Paulino ...
42:00,2T,Vitória/BA,,20 - Leonardo de Sousa Pereira ...,9 - Elton Rodrigues Brandao
