Campeonato:,Campeonato Brasileiro - Série A/2019,Rodada:,32
Jogo:,Fortaleza / CE X Ceará / CE,,
Data:,10/11/2019 Horário: 19:00 Estádio:,Governador Plácido Aderaldo Castelo / Fortaleza,
"",,Arbitragem
Arbitro:,Flavio Rodrigues de Souza (AB / SP),
Arbitro Assistente 1:,Alex Ang Ribeiro (AB / SP),
Arbitro Assistente 2:,Neuza Ines Back (FIFA / SP),
Quarto Arbitro:,Glauco Nunes Feitosa (CD / CE),
Delegado Local:,Claudemiro Silva Soares (CBF / CE),
Analista de Campo:,Francisco de Assis Almeida Filho (CBF / CE),
VAR:,Marcio Henrique de Gois (CD / SP),
AVAR1:,Christiano Gayo Nascimento (AB / DF),
AVAR2:,Daniel Paulo Ziolli (AB / SP),
"",,,Cronologia,,,
"",1o Tempo,,2o Tempo,,,
Entrada do mandante:,18:50Atraso:,,Não Houve Entrada do mandante: 20:04,,Atraso:,3 min
Entrada do visitante:,18:50Atraso:,,Não Houve Entrada do visitante: 20:01,,Atraso:,Não Houve
Início 1o Tempo:,19:00Atraso:,,Não Houve Início do 2o Tempo: 20:05,,Atraso:,2 min
Término do 1o Tempo:,19:48Acréscimo:,,3 min Término do 2o Tempo: 20:54,Acréscimo:,,4 min
Resultado do 1o Tempo: 1 X 0,,,Resultado Final: 1 X 0,,,
"",,,,,Relação de Jogadores,,,,
"",,Fortaleza / CE,,,,Ceará / CE,,,
No,Apelido,Nome Completo,T/R,P/A,CBF No Apelido,Nome Completo T/R,,P/A,CBF
12,Felipe,Felipe Alves Raymundo T(g),,P,177931 12 Diogo Silva,Diogo Jose Goncalves ... T(g),,P,165094
3,Juan Quintero,Juan Sebastian Quint ...,T,P,646848 3 Valdo,Andrevaldo de Jesus  ... T,,P,326990
9,Wellington ...,Wellington Pereira d ...,T,P,152788 4 Brock,Eduardo Schroeder Brock T,,P,291997
11,Osvaldo,Osvaldo Lourenco Filho,T,P,177411 6 Joao Lucas,Joao Lucas Cardoso T,,P,303237
13,Gabriel,Gabriel Dias de Oliveira,T,P,317697 8 Ricardinho,Ricardo Dias Acosta T,,P,169114
15,Luis,Luis Antonio Ferreir ...,T,P,420080 10 Felipe,Felipe de Oliveira Silva T,,P,189538
20,Romarinho,Jose Romario Silva d ...,T,P,413857 13 Luiz,Luiz Otavio Anacleto ... T,,P,291651
26,Jackson,Jackson de Souza,T,P,299142 19 Fabinho,Fabio Goncalves T,,P,175065
30,Bruno,Bruno Ferreira Melo,T,P,329952 22 Samuel,Samuel Xavier Brito T,,P,292428
55,Juninho,Paulo Roberto Valour ...,T,P,179395 89 Thiago,Thiago Galhardo do N ... T,,P,189822
97,Andre Luis,Andre Luis da Costa  ...,T,P,321636 98 Felippe Ca ...,Wanderson Felippe Ca ... T,,P,536862
1,Marcelo Boeck,Marcelo Boeck R(g),,P,154969 1 Lucas França,Lucas Oliveira de França R(g),,P,357971
2,Guilherme,Guilherme de Jesus d ...,R,P,348138 2 Cristovam,Cristovam Roberto Ri ... R,,P,188472
6,Carlinho,Carlos Emiliano Pereira,R,P,186140 7 Mateus Gon ...,Mateus Goncalves Martins R,,P,316729
7,Edinho,Francisco Edson More ...,R,P,377355 11 Fernando,Fernando Pereira do  ... R,,P,399713
8,Derley,Wanderley de Jesus Sousa,R,P,166491 18 Auremir,Auremir Evangelista  ... R,,P,341763
22,Felipe,Felipe Araruna Hoffmann,R,P,356726 27 Wescley,Wescley Gomes dos Santos R,,P,297441
25,Paulão,Paulo Marcos de Jesu ...,R,P,293393 30 Chico,Francisco Hyun Sol Kim R,,P,326622
27,Luis Otavio,Luis Otavio Bonilha  ...,R,P,292740 36 Tiago,Tiago dos Santos Alves R,,P,167723
32,Mariano,Mariano Vazquez,R,P,674254 37 Rick,Rick Jhonatan Lima Morais R,,P,538942
86,Kieza,Welker Marcal Almeida,R,P,185126 45 Lima,Vinicius Moreira de Lima R,,P,403112
95,Felipe,Felipe Augusto Rodri ...,R,P,353107 82 Leandro,Leandro Carvalho da Silva R,,P,417861
96,Matheus Al ...,Matheus Alessandro d ...,R,P,413284 94 Willian Popp,Willian Popp R,,P,332817
No,Apelido,Nome Completo,T/R,P/A,CBF,No,Apelido,Nome Completo T/R,,P/A,CBF
12,Felipe,Felipe Alves Raymundo T(g),,P,177931,12,Diogo Silva,Diogo Jose Goncalves ... T(g),,P,165094
3,Juan Quintero,Juan Sebastian Quint ...,T,P,646848,3,Valdo,Andrevaldo de Jesus  ... T,,P,326990
9,Wellington ...,Wellington Pereira d ...,T,P,152788,4,Brock,Eduardo Schroeder Brock T,,P,291997
11,Osvaldo,Osvaldo Lourenco Filho,T,P,177411,6,Joao Lucas,Joao Lucas Cardoso T,,P,303237
13,Gabriel,Gabriel Dias de Oliveira,T,P,317697,8,Ricardinho,Ricardo Dias Acosta T,,P,169114
15,Luis,Luis Antonio Ferreir ...,T,P,420080,10,Felipe,Felipe de Oliveira Silva T,,P,189538
20,Romarinho,Jose Romario Silva d ...,T,P,413857,13,Luiz,Luiz Otavio Anacleto ... T,,P,291651
26,Jackson,Jackson de Souza,T,P,299142,19,Fabinho,Fabio Goncalves T,,P,175065
30,Bruno,Bruno Ferreira Melo,T,P,329952,22,Samuel,Samuel Xavier Brito T,,P,292428
55,Juninho,Paulo Roberto Valour ...,T,P,179395,89,Thiago,Thiago Galhardo do N ... T,,P,189822
97,Andre Luis,Andre Luis da Costa  ...,T,P,321636,98,Felippe Ca ...,Wanderson Felippe Ca ... T,,P,536862
1,Marcelo Boeck,Marcelo Boeck R(g),,P,154969,1,Lucas França,Lucas Oliveira de França R(g),,P,357971
2,Guilherme,Guilherme de Jesus d ...,R,P,348138,2,Cristovam,Cristovam Roberto Ri ... R,,P,188472
6,Carlinho,Carlos Emiliano Pereira,R,P,186140,7,Mateus Gon ...,Mateus Goncalves Martins R,,P,316729
7,Edinho,Francisco Edson More ...,R,P,377355,11,Fernando,Fernando Pereira do  ... R,,P,399713
8,Derley,Wanderley de Jesus Sousa,R,P,166491,18,Auremir,Auremir Evangelista  ... R,,P,341763
22,Felipe,Felipe Araruna Hoffmann,R,P,356726,27,Wescley,Wescley Gomes dos Santos R,,P,297441
25,Paulão,Paulo Marcos de Jesu ...,R,P,293393,30,Chico,Francisco Hyun Sol Kim R,,P,326622
27,Luis Otavio,Luis Otavio Bonilha  ...,R,P,292740,36,Tiago,Tiago dos Santos Alves R,,P,167723
32,Mariano,Mariano Vazquez,R,P,674254,37,Rick,Rick Jhonatan Lima Morais R,,P,538942
86,Kieza,Welker Marcal Almeida,R,P,185126,45,Lima,Vinicius Moreira de Lima R,,P,403112
95,Felipe,Felipe Augusto Rodri ...,R,P,353107,82,Leandro,Leandro Carvalho da Silva R,,P,417861
96,Matheus Al ...,Matheus Alessandro d ...,R,P,413284,94,Willian Popp,Willian Popp R,,P,332817
"",,Comissão Técnica,
"",Fortaleza / CE,,Ceará / CE
Técnico:,Rogerio Ceni,Técnico:,Adilson Dias Batista
Auxiliar Técnico:,Nelson Simoes Junior,Auxiliar Técnico:,Cyro Garcia Soares Leaes
Médico:,Rafael Luis Cavalcanti Veras Ribeiro,Médico:,Joaquim Sampaio Garcia Filho
Treinador De Goleiros:,Jose Augusto Da Cruz Albuquerque,Treinador De Goleiros:,Everaldo Goncalves Santana
Preparador Físico:,Danilo Augusto Da Silva,Preparador Físico:,Flavio Henrique De Oliveira
Massagista:,Francisco De Assis Dos Santos,Fisioterapeuta:,Rodrigo Ribeiro De Oliveira
"",,,,,Gols,
Tempo,1T/2T,No,Tipo,Nome do Jogador,,Equipe
12:00,1T,9,NR,Wellington Pereira do Nascimento,,Fortaleza/CE
"",,,,Substituições,
Tempo,1T/2T,,Equipe,Entrou,Saiu
45:00,INT,Ceará/CE,,27 - Wescley Gomes dos Santos,3 - Andrevaldo de Jesus Santos
09:00,2T,Fortaleza/CE,,25 - Paulo Marcos de Jesus Ribeiro,26 - Jackson de Souza
10:00,2T,Fortaleza/CE,,86 - Welker Marcal Almeida,97 - Andre Luis da Costa Alfredo
20:00,2T,Ceará/CE,,82 - Leandro Carvalho da Silva,10 - Felipe de Oliveira Silva
28:00,2T,Fortaleza/CE,,27 - Luis Otavio Bonilha de Olive...,11 - Osvaldo Lourenco Filho
31:00,2T,Ceará/CE,,7 - Mateus Goncalves Martins,89 - Thiago Galhardo do Nasciment...
