Campeonato:,Campeonato Brasileiro - Série A/2019,,Rodada:,29
Jogo:,Internacional / RS X Athletico Paranaense / PR,,,
Data:,31/10/2019 Horário: 21:30 Estádio:,José Pinheiro Borda / Porto Alegre,,
"",Arbitragem
Arbitro:,Andre Luiz de Freitas Castro (MTR / GO)
Arbitro Assistente 1:,Cristhian Passos Sorence (AB / GO)
Arbitro Assistente 2:,Leone Carvalho Rocha (AB / GO)
Quarto Arbitro:,Anderson da Silveira Farias (CD / RS)
Delegado Local:,Paulo Ricardo Machado Santos (CBF / )
Analista de Campo:,Paulo Ricardo Silva Conceição (CBF / RS)
VAR:,Elmo Alves Resende Cunha (MTR / GO)
AVAR1:,Jefferson Ferreira de Moraes (AB / GO)
AVAR2:,Henrique Neu Ribeiro (AB / SC)
"",,,Cronologia,,,
"",1o Tempo,,2o Tempo,,,
Entrada do mandante:,21:20Atraso:,,Não Houve Entrada do mandante: 22:34,,Atraso:,1 min
Entrada do visitante:,21:20Atraso:,,Não Houve Entrada do visitante: 22:34,,Atraso:,1 min
Início 1o Tempo:,21:30Atraso:,,Não Houve Início do 2o Tempo: 22:36,,Atraso:,1 min
Término do 1o Tempo:,22:20Acréscimo:,,5 min Término do 2o Tempo: 23:30,Acréscimo:,,9 min
Resultado do 1o Tempo: 1 X 1,,,Resultado Final: 1 X 1,,,
"",,,,,Relação de Jogadores,,,
"",,Internacional / RS,,,Athletico Paranaense / PR,,,
No,Apelido,Nome Completo T/R,,P/A,CBF No Apelido Nome Completo,T/R,P/A,CBF
12,Marcelo,Marcelo Lomba do Nas ... T(g),,P,157264 1 Santos Aderbar Melo dos San ...,T(g),P,293428
4,Moledo,Rodrigo Modesto da S ... T,,P,173551 4 Leo Pereira Leonardo Pereira,T,P,310373
8,Edenilson,Edenilson Andrade do ... T,,P,306270 5 Wellington Wellington Aparecido ...,T,P,184600
9,Guerrero,Jose Paolo Guerrero  ... T,,P,420184 7 Rony Ronielson da Silva B ...,T,P,427806
10,Dalessandro,Andres Nicolas Dales ... T,,P,299481 9 Marco Ruben Marco Gaston Ruben,T,P,646884
15,Victor Cuesta,Victor Leandro Cuesta T,,P,567555 11 Nikao Maycon Vinicius Ferr ...,T,P,306616
19,Rodrigo,Rodrigo Oliveira Lindoso T,,P,184455 21 Adriano Adriano Correia Claro,T,P,155516
31,Heitor Rod ...,Heitor Rodrigues da  ... T,,P,464051 23 Madson Madson Ferreira dos  ...,T,P,321829
37,Zeca,Jose Carlos Cracco Neto T,,P,294382 39 Bruno Guim ... Bruno Guimaraes Rodr ...,T,P,319832
77,G. Parede,Guilherme Parede Pinheiro T,,P,411198 44 Thiago Heleno Thiago Heleno Henriq ...,T,P,171788
88,Patrick,Patrick Bezerra do N ... T,,P,315585 77 Bruno Nazario Bruno dos Santos Nazario,T,P,314287
1,Danilo Fer ...,Danilo Fernandes Batista R(g),,P,165830 22 Leo Vieira Leonardo da Silva Vieira,R(g),P,177092
2,Bruno,Bruno Vieira do Nasc ... R,,P,172996 3 Lucho Gonz ... Luis Oscar Gonzalez,R,P,559270
6,Uendel,Uendel Pereira Goncalves R,,P,175320 6 Marcio Aze ... Marcio Gonzaga de AzevedoR,,P,167769
7,Nico Lopez,Nicolas Federico Lop ... R,,P,554821 8 Tomas AndradeTomas Gustavo Andrade,R,P,610318
11,Wellington ...,Wellington Alves da Silva R,,P,306146 10 Marcelo Ci ... Marcelo Cirino da Silva,R,P,293440
17,Neilton,Neilton Meira Mestzk R,,P,316754 13 Khellven Khellven Douglas Sil ...,R,P,557878
21,Bruno Silva,Bruno Cesar Pereira Silva R,,P,169938 15 Camacho Guilherme de Aguiar  ...,R,P,183873
23,Rafael Sobis,Rafael Augusto Sobis R,,P,150549 17 Braian Romero Braian Ezequiel Romero,R,P,647839
29,Sarrafiore,Martin Nicolas Sarrafiore R,,P,632758 26 Erick Erick Luis Conrado C ...,R,P,376073
40,Roberto,Roberto Pinheiro da Rosa R,,P,364092 28 Vitinho Vitor Hugo Naum dos  ...,R,P,388084
99,William,William de Oliveira  ... R,,P,301087 29 Pedrinho Pedro Gabriel Pereir ...,R,P,542491
"",,,,,34 Pedro Henr ... Pedro Henrique Ribei ...,R,P,352037
No,Apelido,Nome Completo T/R,,P/A,CBF,No,Apelido Nome Completo,T/R,,P/A,CBF
12,Marcelo,Marcelo Lomba do Nas ... T(g),,P,157264,1,Santos Aderbar Melo dos San ...,T(g),,P,293428
4,Moledo,Rodrigo Modesto da S ... T,,P,173551,4,Leo Pereira Leonardo Pereira,T,,P,310373
8,Edenilson,Edenilson Andrade do ... T,,P,306270,5,Wellington Wellington Aparecido ...,T,,P,184600
9,Guerrero,Jose Paolo Guerrero  ... T,,P,420184,7,Rony Ronielson da Silva B ...,T,,P,427806
10,Dalessandro,Andres Nicolas Dales ... T,,P,299481,9,Marco Ruben Marco Gaston Ruben,T,,P,646884
15,Victor Cuesta,Victor Leandro Cuesta T,,P,567555,11,Nikao Maycon Vinicius Ferr ...,T,,P,306616
19,Rodrigo,Rodrigo Oliveira Lindoso T,,P,184455,21,Adriano Adriano Correia Claro,T,,P,155516
31,Heitor Rod ...,Heitor Rodrigues da  ... T,,P,464051,23,Madson Madson Ferreira dos  ...,T,,P,321829
37,Zeca,Jose Carlos Cracco Neto T,,P,294382,39,Bruno Guim ... Bruno Guimaraes Rodr ...,T,,P,319832
77,G. Parede,Guilherme Parede Pinheiro T,,P,411198,44,Thiago Heleno Thiago Heleno Henriq ...,T,,P,171788
88,Patrick,Patrick Bezerra do N ... T,,P,315585,77,Bruno Nazario Bruno dos Santos Nazario,T,,P,314287
1,Danilo Fer ...,Danilo Fernandes Batista R(g),,P,165830,22,Leo Vieira Leonardo da Silva Vieira,R(g),,P,177092
2,Bruno,Bruno Vieira do Nasc ... R,,P,172996,3,Lucho Gonz ... Luis Oscar Gonzalez,R,,P,559270
6,Uendel,Uendel Pereira Goncalves R,,P,175320,6,Marcio Aze ... Marcio Gonzaga de AzevedoR,,,P,167769
7,Nico Lopez,Nicolas Federico Lop ... R,,P,554821,8,Tomas AndradeTomas Gustavo Andrade,R,,P,610318
11,Wellington ...,Wellington Alves da Silva R,,P,306146,10,Marcelo Ci ... Marcelo Cirino da Silva,R,,P,293440
17,Neilton,Neilton Meira Mestzk R,,P,316754,13,Khellven Khellven Douglas Sil ...,R,,P,557878
21,Bruno Silva,Bruno Cesar Pereira Silva R,,P,169938,15,Camacho Guilherme de Aguiar  ...,R,,P,183873
23,Rafael Sobis,Rafael Augusto Sobis R,,P,150549,17,Braian Romero Braian Ezequiel Romero,R,,P,647839
29,Sarrafiore,Martin Nicolas Sarrafiore R,,P,632758,26,Erick Erick Luis Conrado C ...,R,,P,376073
40,Roberto,Roberto Pinheiro da Rosa R,,P,364092,28,Vitinho Vitor Hugo Naum dos  ...,R,,P,388084
99,William,William de Oliveira  ... R,,P,301087,29,Pedrinho Pedro Gabriel Pereir ...,R,,P,542491
"",,,,,,34,Pedro Henr ... Pedro Henrique Ribei ...,R,,P,352037
"",,Comissão Técnica,
"",Internacional / RS,,Athletico Paranaense / PR
Técnico:,Jose Ricardo Mannarino,Técnico:,Tiago Retzlaff Nunes
Auxiliar Técnico:,Cleber Dos Santos Almeida Junior,Auxiliar Técnico:,Evandro Luis Fornari
Médico:,Guilherme Velho Caputo,Médico:,Murilo Marcondes Ribas
Treinador De Goleiros:,Daniel Da Fonseca Pavan,Treinador De Goleiros:,Felipe Faria De Souza
Preparador Físico:,Cristiano Garcia Nunes,Preparador Físico:,Tulio Flores Dos Santos
Massagista:,Paulo Juarez Quintanilha Da Silva,Massagista:,Juan Pablo Fiorenza
"",,,,,Gols,
Tempo,1T/2T,No,Tipo,Nome do Jogador,,Equipe
12:00,1T,19,NR,Rodrigo Oliveira Lindoso,,Internacional/RS
22:00,1T,7,NR,Ronielson da Silva Barbosa,,Athletico Paranaense/PR
"",,,,Cartões Amarelos
Tempo,1T/2T,No,Nome do Jogador,Equipe
30:00,1T,10,Andres Nicolas Dalessandro,Internacional/RS
"",,,"Motivo: A1.24.  Outro motivo (somente neste caso, abriria um campo livre para o árbitro digitar o que quiser) - Empurrou seu",
"",,,"adversário, quando o jogo estava paralisado para a cobrança de um falta.",
"",,,Substituições,
Tempo,1T/2T,Equipe,Entrou,Saiu
45:00,INT,Athletico Paranaense/PR,6 - Marcio Gonzaga de Azevedo,21 - Adriano Correia Claro
16:00,2T,Internacional/RS,11 - Wellington Alves da Silva,88 - Patrick Bezerra do Nascimento
29:00,2T,Athletico Paranaense/PR,10 - Marcelo Cirino da Silva,9 - Marco Gaston Ruben
31:00,2T,Internacional/RS,7 - Nicolas Federico Lopez Alonso,77 - Guilherme Parede Pinheiro
44:00,2T,Athletico Paranaense/PR,15 - Guilherme de Aguiar Camacho,77 - Bruno dos Santos Nazario
