Campeonato:,Campeonato Brasileiro - Série A/2019,,Rodada:,14
Jogo:,Goiás / GO X Vasco da Gama / RJ,,,
Data:,11/08/2019 Horário: 19:00 Estádio:,Serra Dourada / Goiania,,
"",Arbitragem
Arbitro:,Jean Pierre Goncalves Lima (AB / RS)
Arbitro Assistente 1:,Jorge Eduardo Bernardi (AB / RS)
Arbitro Assistente 2:,Lucio Beiersdorf Flor (AB / RS)
Quarto Arbitro:,Jefferson Ferreira de Moraes (AB / GO)
Delegado Local:,Adalberto Grecco (CBF / GO)
Analista de Campo:,Júlio César Mota Fernandes (CBF / GO)
VAR:,Daniel Nobre Bins (AB / RS)
AVAR1:,Jonathan Benkenstein Pinheiro (CD / RS)
AVAR2:,Jose Eduardo Calza (AB / RS)
"",,,Cronologia,,,
"",1o Tempo,,2o Tempo,,,
Entrada do mandante:,18:50Atraso:,,Não Houve Entrada do mandante: 20:03,,Atraso:,Não Houve
Entrada do visitante:,18:50Atraso:,,Não Houve Entrada do visitante: 20:03,,Atraso:,Não Houve
Início 1o Tempo:,19:00Atraso:,,Não Houve Início do 2o Tempo: 20:05,,Atraso:,Não Houve
Término do 1o Tempo:,19:50Acréscimo:,,5 min Término do 2o Tempo: 20:58,Acréscimo:,,8 min
Resultado do 1o Tempo: 0 X 1,,,Resultado Final: 0 X 1,,,
"",,,,,Relação de Jogadores,,,,
"",,Goiás / GO,,,,Vasco da Gama / RJ,,,
No,Apelido,Nome Completo,T/R,P/A,CBF No Apelido,Nome Completo T/R,,P/A,CBF
23,Tadeu,Tadeu Antonio Ferreira,T(g),P,308316 1 Fernando M ...,Fernando Miguel KaufmannT(g),,P,159684
5,Geovane,Geovane Batista de Faria,T,P,175223 2 Raul Caceres,Raul Alejandro Cacer ... T,,P,646420
11,Michael,Michael Richard Delg ...,T,P,534667 3 Henriquez,Oswaldo Jose Henriqu ... T,,P,541170
13,Jefferson  ...,Jefferson Junio Anto ...,T,P,400906 5 Leandro,Leandro Castan da Silva T,,P,164170
15,Daniel Guedes,Daniel Guedes da Silva,T,P,317780 19 Marcos Junior,Marcos Antonio Candi ... T,,P,420566
20,Leo Sena,Leonardo de Souza Sena,T,P,352625 22 Yago,Glaybson Yago Souza  ... T,,P,364829
27,Fabio Sanches Fabio Pizarro Sanches,,T,P,186135 25 Richard,Richard Candido Coelho T,,P,376786
30,Leandro Ba ...,Leandro Barcia Montero,T,P,647148 31 Raul,Raul Lo Goncalves T,,P,446399
33,Yago,Yago Fernando da Silva,T,P,317022 37 Henrique,Henrique Silva Milagres T,,P,308965
77,Kayke,Kayke Moreno de Andr ...,T,P,177071 38 Marrony,Marrony da Silva Lib ... T,,P,463599
89,Giovanni A ...,Giovanni Augusto Oli ...,T,P,292205 43 Talles Magno,Talles Magno Bacelar ... T,,P,563898
88,Rangel,Marcelo Rangel Rosa,R(g),P,186722 55 Alexander  ...,Alexander Silva de Lucena R(g),,P,444827
2,Kevin,Kevin Peterson dos S ...,R,P,502001 6 Fellipe,Fellipe Ramos Ignez  ... R,,P,357424
7,Renatinho,Renato Vieira Rodrigues,R,P,301503 8 Marquinho,Marco Antonio de Mat ... R,,P,159716
8,Rafael Moura,Rafael Martiniano de ...,R,P,151437 10 Bruno,Bruno Cesar Zanaki R,,P,171936
10,Marlone,Johnath Marlone Azev ...,R,P,307366 14 Danilo,Danilo Carvalho Barcelos R,,P,313755
14,Iago Mendo ...,Iago Pereira Mendonça,R,P,463995 15 Andrey,Andrey Ramos do Nasc ... R,,P,404816
16,Alisson,Alisson Fabricio dos ...,R,P,463114 18 Lucas,Lucas da Silva Izidoro R,,P,389361
25,Rafinha,Rafael Diniz Alves E ...,R,P,321556 27 Tiago Rodr ...,Tiago Rodrigues dos Reis R,,P,518160
26,Jean,Jean Carlos Guimarae ...,R,P,358496 32 Lucas Santos,Lucas Santos da Silva R,,P,440391
86,Marcelo He ...,Marcelo Hermes,R,P,363926 34 Werley,Werley Ananias da Silva R,,P,172411
90,Ricardo Verza,Ricardo Verza de Souza,R,P,551655 36 Ricardo,Ricardo Queiroz de A ... R,,P,372370
97,Giovanny,Giovanny Bariani Marques,R,P,436545 39 Vinicius,Vinicius dos Santos  ... R,,P,543481
No,Apelido Nome Completo,,T/R,P/A,CBF,No,Apelido,Nome Completo T/R,,P/A,CBF
23,Tadeu Tadeu Antonio Ferreira,,T(g),P,308316,1,Fernando M ...,Fernando Miguel KaufmannT(g),,P,159684
5,Geovane Geovane Batista de Faria,,T,P,175223,2,Raul Caceres,Raul Alejandro Cacer ... T,,P,646420
11,Michael Michael Richard Delg ...,,T,P,534667,3,Henriquez,Oswaldo Jose Henriqu ... T,,P,541170
13,Jefferson  ... Jefferson Junio Anto ...,,T,P,400906,5,Leandro,Leandro Castan da Silva T,,P,164170
15,Daniel Guedes Daniel Guedes da Silva,,T,P,317780,19,Marcos Junior,Marcos Antonio Candi ... T,,P,420566
20,Leo Sena Leonardo de Souza Sena,,T,P,352625,22,Yago,Glaybson Yago Souza  ... T,,P,364829
27,Fabio Sanches Fabio Pizarro Sanches,,T,P,186135,25,Richard,Richard Candido Coelho T,,P,376786
30,Leandro Ba ... Leandro Barcia Montero,,T,P,647148,31,Raul,Raul Lo Goncalves T,,P,446399
33,Yago Yago Fernando da Silva,,T,P,317022,37,Henrique,Henrique Silva Milagres T,,P,308965
77,Kayke Kayke Moreno de Andr ...,,T,P,177071,38,Marrony,Marrony da Silva Lib ... T,,P,463599
89,Giovanni A ... Giovanni Augusto Oli ...,,T,P,292205,43,Talles Magno,Talles Magno Bacelar ... T,,P,563898
88,Rangel Marcelo Rangel Rosa,,R(g),P,186722,55,Alexander  ...,Alexander Silva de Lucena R(g),,P,444827
2,Kevin Kevin Peterson dos S ...,,R,P,502001,6,Fellipe,Fellipe Ramos Ignez  ... R,,P,357424
7,Renatinho Renato Vieira Rodrigues,,R,P,301503,8,Marquinho,Marco Antonio de Mat ... R,,P,159716
8,Rafael Moura Rafael Martiniano de ...,,R,P,151437,10,Bruno,Bruno Cesar Zanaki R,,P,171936
10,Marlone Johnath Marlone Azev ...,,R,P,307366,14,Danilo,Danilo Carvalho Barcelos R,,P,313755
14,Iago Mendo ... Iago Pereira Mendonça,,R,P,463995,15,Andrey,Andrey Ramos do Nasc ... R,,P,404816
16,Alisson Alisson Fabricio dos ...,,R,P,463114,18,Lucas,Lucas da Silva Izidoro R,,P,389361
25,Rafinha Rafael Diniz Alves E ...,,R,P,321556,27,Tiago Rodr ...,Tiago Rodrigues dos Reis R,,P,518160
26,Jean Jean Carlos Guimarae ...,,R,P,358496,32,Lucas Santos,Lucas Santos da Silva R,,P,440391
86,Marcelo He ... Marcelo Hermes,,R,P,363926,34,Werley,Werley Ananias da Silva R,,P,172411
90,Ricardo Verza Ricardo Verza de Souza,,R,P,551655,36,Ricardo,Ricardo Queiroz de A ... R,,P,372370
97,Giovanny Giovanny Bariani Marques,,R,P,436545,39,Vinicius,Vinicius dos Santos  ... R,,P,543481
"",,Comissão Técnica,
"",Goiás / GO,,Vasco da Gama / RJ
Técnico:,Ney Franco Da Silveira Junior,Técnico:,Wanderley Luxenburgo Da Silva
Auxiliar Técnico:,Rodney Borges Goncalves,Auxiliar Técnico:,Mauricio Almeida Copertino
Médico:,Bruno Rafael Silva Favaron,Médico:,Victor Luiz Baitelli Leite
Treinador De Goleiros:,Marlos Gomes Santos,Treinador De Goleiros:,Danilo Jose Prando Minutti
Preparador Físico:,Robson Luiz Martins Gomes,Preparador Físico:,Antonio Carlos Da Silva Mello
Massagista:,Jeova Francisco Do Nascimento Bibiano,Fisioterapeuta:,Amil Henrique Ferreira Marques Lopes
"",,,,,Gols,
Tempo,1T/2T,No,Tipo,Nome do Jogador,,Equipe
21:00,1T,19,NR,Marcos Antonio Candido Ferreira Junior,,Vasco da Gama/RJ
"",,,,Substituições,
Tempo,1T/2T,,Equipe,Entrou,Saiu
03:00,2T,Goiás/GO,,2 - Kevin Peterson dos Santos Si...,15 - Daniel Guedes da Silva
13:00,2T,Goiás/GO,,25 - Rafael Diniz Alves E Silva,30 - Leandro Barcia Montero
21:00,2T,Vasco da Gama/RJ,,18 - Lucas da Silva Izidoro,19 - Marcos Antonio Candido Ferre...
32:00,2T,Goiás/GO,,8 - Rafael Martiniano de Miranda...,5 - Geovane Batista de Faria
34:00,2T,Vasco da Gama/RJ,,32 - Lucas Santos da Silva,43 - Talles Magno Bacelar Martins
38:00,2T,Vasco da Gama/RJ,,6 - Fellipe Ramos Ignez Bastos,25 - Richard Candido Coelho
