Campeonato:,Campeonato Brasileiro - Série A/2019,,Rodada:,19
Jogo:,Atlético / MG X Internacional / RS,,,
Data:,15/09/2019 Horário: 11:00 Estádio:,Raimundo Sampaio / Belo Horizonte,,
"",,Arbitragem
Arbitro:,Bruno Arleu de Araujo (AB / RJ),
Arbitro Assistente 1:,Silbert Faria Sisquim (AB / RJ),
Arbitro Assistente 2:,Thiago Henrique Neto Correa Farinha (AB / RJ),
Quarto Arbitro:,Paulo Cesar Zanovelli (CD / MG),
Delegado Local:,Daniel Mendes de Las Casas (CBF / ),
Analista de Campo:,Marcio Eustaquio Sousa Santiago (CBF / MG),
VAR:,Grazianni Maciel Rocha (AB / RJ),
AVAR1:,Carlos Eduardo Nunes Braga (AB / RJ),
AVAR2:,Carlos Henrique Cardoso de Souza (AB / RJ),
"",,,Cronologia,,,
"",1o Tempo,,2o Tempo,,,
Entrada do mandante:,10:50Atraso:,,Não Houve Entrada do mandante: 12:00,,Atraso:,Não Houve
Entrada do visitante:,10:50Atraso:,,Não Houve Entrada do visitante: 12:01,,Atraso:,Não Houve
Início 1o Tempo:,11:00Atraso:,,Não Houve Início do 2o Tempo: 12:03,,Atraso:,Não Houve
Término do 1o Tempo:,11:48Acréscimo:,,03 min Término do 2o Tempo: 12:53,Acréscimo:,,05 min
Resultado do 1o Tempo: 0 X 1,,,Resultado Final: 1 X 3,,,
"",,,,,Relação de Jogadores,,,,
"",,Atlético / MG,,,,Internacional / RS,,,
No Apelido,,Nome Completo T/R,,P/A,CBF No Apelido,Nome Completo T/R,,P/A,CBF
188 Cleiton,,Cleiton Schwengber T(g),,P,384823 1 Danilo Fer ...,Danilo Fernandes Batista T(g),,P,165830
2 Patric,,Patric Cabral Lalau T,,P,178620 16 Rithely,Francisco Rithely da ... T,,P,184833
3 Leo Silva,,Leonardo Fabiano da  ... T,,P,137705 17 Neilton,Neilton Meira Mestzk T,,P,316754
4 Rever,,Rever Humberto Alves ... T,,P,167509 20 Emerson,Emerson Raymundo Santos T,,P,348257
5 Ramon Mart ...,,Ramon Martinez Lopez T,,P,671013 23 Rafael Sobis,Rafael Augusto Sobis T,,P,150549
6 Fabio Santos,,Fabio Santos Romeu T,,P,162248 31 Heitor Rod ...,Heitor Rodrigues da  ... T,,P,464051
7 Elias,,Elias Mendes Trindade T,,P,159607 33 Nonato,Gustavo Nonato Santana T,,P,337363
8 Chará,,Yimmi Javier Chara Zamora T,,P,630172 37 Zeca,Jose Carlos Cracco Neto T,,P,294382
9 Ricardo Ol ...,,Ricardo de Oliveira T,,P,150151 44 Klaus,William Klaus T,,P,360293
29 Vinicius,,Vinicius Goes Barbos ... T,,P,294769 77 G. Parede,Guilherme Parede Pinheiro T,,P,411198
43 Bruno,,Bruno Roberto Pereir ... T,,P,527028 99 William,William de Oliveira  ... T,,P,301087
84 Wilson,,Wilson Rodrigues de  ... R(g),,P,155508 42 Daniel,Daniel de Sousa Brito R(g),,P,331033
10 Cazares,,Juan Ramon Cazares S ... R,,P,540839 27 Luis,Luis Eduardo Marques ... R,,P,405061
14 Welison,,José Welison da Silva R,,P,313780 29 Sarrafiore,Martin Nicolas Sarrafiore R,,P,632758
22 Carlos Gab ...,,Carlos Gabriel Morei ... R,,P,447798 32 Keiller,Keiller da Silva Nunes R,,P,363886
23 Nathan,,Nathan Allan de Souza R,,P,344314 34 Erik,Erik Jorgens de Menezes R,,P,535946
26 Di Santo,,Franco Matias Di Santo R,,P,675498 35 Gabriel,Jose Gabriel dos San ... R,,P,372403
27 Luan,,Luan Madson Gedeao d ... R,,P,298595 38 Jose Aldo,Jose Aldo Soares de  ... R,,P,422022
34 Vitor Mendes,,Vitor Mendes Alves R,,P,525042 39 Joao Lucas,Joao Lucas de Souza  ... R,,P,516798
44 Alerrandro,,Alerrandro Barra Man ... R,,P,441844 40 Roberto,Roberto Pinheiro da Rosa R,,P,364092
49 Gigio,,Geuvanio Santos Silva R,,P,311336 41 Pedro Lucas,Pedro Lucas Schwaizer R,,P,365355
80 Otero,,Romulo Otero Vasquez R,,P,554728 45 Bruno Fuchs,Bruno de Lara Fuchs R,,P,401025
98 Claudio,,Claudio Rodrigues Gomes R,,P,317445,,,,
"",,Comissão Técnica,
"",Atlético / MG,,Internacional / RS
Técnico:,Rodrigo Marques De Santana,Técnico:,Odair Hellmann
Auxiliar Técnico:,Lucas Gonçalves Da Silva,Auxiliar Técnico:,Mauricio Correa Dulac
Médico:,Otaviano De Oliveira Junior,Médico:,Carlos Henrique Poisl Junior
Treinador De Goleiros:,Francisco Carlos Cersosimo,Treinador De Goleiros:,Daniel Da Fonseca Pavan
Preparador Físico:,Daniel Guimaraes Felix Da Silva,Preparador Físico:,Andre Tadeo Gomes Volpe
Massagista:,Alexandre William Pinto Coelho,Massagista:,Paulo Renato Aviz Da Silva
"",,,,,Gols,
Tempo,1T/2T,No,Tipo,Nome do Jogador,,Equipe
23:00,1T,99,NR,William de Oliveira Pottker,,Internacional/RS
07:00,2T,17,NR,Neilton Meira Mestzk,,Internacional/RS
18:00,2T,99,NR,William de Oliveira Pottker,,Internacional/RS
42:00,2T,43,NR,Bruno Roberto Pereira da Silva,,Atlético/MG
"",,,,Cartões Amarelos
Tempo,1T/2T,No,Nome do Jogador,Equipe
+02:00,2T,77,Guilherme Parede Pinheiro,Internacional/RS
"",,,Motivo: A1.2.  Dar ou tentar dar uma rasteira ou um calço em um adversário de maneira temerária na disputa da bola  - Calçar as,
"",,,pernas do seu adversário de maneira temerária na disputa da bola.,
"",,,,Substituições,
Tempo,1T/2T,,Equipe,Entrou,Saiu
45:00,INT,Atlético/MG,,26 - Franco Matias Di Santo,9 - Ricardo de Oliveira
45:00,INT,Atlético/MG,,10 - Juan Ramon Cazares Sevillano,5 - Ramon Martinez Lopez
21:00,2T,Atlético/MG,,23 - Nathan Allan de Souza,29 - Vinicius Goes Barbosa de Souza
23:00,2T,Internacional/RS,,29 - Martin Nicolas Sarrafiore,99 - William de Oliveira Pottker
29:00,2T,Internacional/RS,,39 - Joao Lucas de Souza Cardoso,23 - Rafael Augusto Sobis
37:00,2T,Internacional/RS,,38 - Jose Aldo Soares de Oliveira...,17 - Neilton Meira Mestzk
