Campeonato:,Campeonato Brasileiro - Série A/2019,,Rodada:,17
Jogo:,São Paulo / SP X Grêmio / RS,,,
Data:,31/08/2019 Horário: 11:00 Estádio:,Cícero Pompeu de Toledo / Sao Paulo,,
"",,Arbitragem
Arbitro:,Caio Max Augusto Vieira (AB / RN),
Arbitro Assistente 1:,Fabricio Vilarinho da Silva (FIFA / GO),
Arbitro Assistente 2:,Fabiano da Silva Ramires (AB / ES),
Quarto Arbitro:,Lucas Canetto Bellote (AB / SP),
Delegado Local:,Osni Dantas Silva (CBF / SP),
Analista de Campo:,Marcelo Rogério (CBF / SP),
VAR:,Emerson de Almeida Ferreira (AB / MG),
AVAR1:,Pablo Ramon Goncalves Pinheiro (AB / RN),
AVAR2:,Flavio Gomes Barroca (AB / RN),
"",,,Cronologia,,,
"",1o Tempo,,2o Tempo,,,
Entrada do mandante:,10:50Atraso:,,Não Houve Entrada do mandante: 12:03,,Atraso:,Não Houve
Entrada do visitante:,10:51Atraso:,,Não Houve Entrada do visitante: 12:03,,Atraso:,Não Houve
Início 1o Tempo:,11:00Atraso:,,Não Houve Início do 2o Tempo: 12:06,,Atraso:,Não Houve
Término do 1o Tempo:,11:51Acréscimo:,,6 min Término do 2o Tempo: 12:59,Acréscimo:,,8 min
Resultado do 1o Tempo: 0 X 0,,,Resultado Final: 0 X 0,,,
"",,,,,Relação de Jogadores,,,,
"",,São Paulo / SP,,,,Grêmio / RS,,,
No,Apelido,Nome Completo T/R,,P/A,CBF No Apelido,Nome Completo T/R,,P/A,CBF
23,Tiago Volpi,Tiago Luis Volpi T(g),,P,291584 22 Julio Cesar,Julio Cesar Jacobi T(g),,P,169978
4,Anderson,Anderson Vieira Martins T,,P,166258 5 Michel,Michel Ferreira dos  ... T,,P,298485
5,Arboleda,Robert Abel Arboleda ... T,,P,595193 7 Luan,Luan Guilherme de Je ... T,,P,409960
6,Reinaldo,Reinaldo Manoel da Silva T,,P,332318 9 Diego Tard ...,Diego Tardelli Martins T,,P,150201
10,Dani Alves,Daniel Alves da Silva T,,P,144094 11 Everton,Everton Sousa Soares T,,P,379065
12,Vitor Bueno,Vitor Frezarin Bueno T,,P,322748 16 Thaciano,Thaciano Mickael da Silva T,,P,391953
14,Igor,Igor Matheus Liziero ... T,,P,344934 18 Luciano,Luciano da Rocha Neves T,,P,346745
20,Juanfran,Juan Francisco Torre ... T,,P,677535 28 P. Miranda,Jonathan Doin T,,P,291380
22,Everton,Everton Cardoso da Silva T,,P,178361 29 J. Capixaba,Luis Antonio da Roch ... T,,P,402681
28,Tche Tche,Danilo das Neves Pinheiro T,,P,308348 33 David Braz,David Braz de Olivei ... T,,P,168008
39,Antony,Antony Matheus dos Santos T,,P,442146 42 Galhardo,Rafael Galhardo de Souza T,,P,291542
1,Jean,Jean Paulo Fernandes ... R(g),,P,420409 40 Phelipe,Phelipe Megiolaro Alves R(g),,P,337483
2,Igor,Igor Vinicius de Souza R,,P,355675 3 Geromel,Pedro Tonon Geromel R,,P,165322
3,Bruno Alves,Bruno Fabiano Alves R,,P,312015 4 Kannemann,Walter Kannemann R,,P,554626
11,Hélio Junio,Helio Junio Nunes de ... R,,P,464258 6 Leonardo,Leonardo Gomes da Co ... R,,P,303436
13,Luan Silva,Luan Vinicius da Sil ... R,,P,432222 12 Cortez,Bruno Cortes Barbosa R,,P,180546
16,Léo,Leonardo Pinheiro da ... R,,P,346294 14 M. Henrique,Matheus Henrique de SouzaR,,P,407776
17,Willian,Willian Roberto de Farias R,,P,180083 23 Alisson,Alisson Euler de Fre ... R,,P,317751
19,Marcos Cal ...,Marcos Vinicius Silv ... R,,P,408877 25 Pepe,Eduardo Gabriel Aqui ... R,,P,428672
25,Hudson,Hudson Rodrigues dos ... R,,P,176729 30 Patrick,Patrick Machado Ferreira R,,P,423224
26,Igor,Igor Silveira Gomes R,,P,337713 37 Darlan,Darlan Pereira Mendes R,,P,422352
41,Denis de O ...,Denis de Oliveira Ag ... R,,P,451683 38 Rodrigues,Antonio Josenildo Ro ... R,,P,434738
43,Walce,Walce da Silva Costa ... R,,P,432206 41 Da Silva,Rondinelli da Silva  ... R,,P,373518
No,Apelido,Nome Completo T/R,,P/A,CBF,No,Apelido,Nome Completo T/R,,P/A,CBF
23,Tiago Volpi,Tiago Luis Volpi T(g),,P,291584,22,Julio Cesar,Julio Cesar Jacobi T(g),,P,169978
4,Anderson,Anderson Vieira Martins T,,P,166258,5,Michel,Michel Ferreira dos  ... T,,P,298485
5,Arboleda,Robert Abel Arboleda ... T,,P,595193,7,Luan,Luan Guilherme de Je ... T,,P,409960
6,Reinaldo,Reinaldo Manoel da Silva T,,P,332318,9,Diego Tard ...,Diego Tardelli Martins T,,P,150201
10,Dani Alves,Daniel Alves da Silva T,,P,144094,11,Everton,Everton Sousa Soares T,,P,379065
12,Vitor Bueno,Vitor Frezarin Bueno T,,P,322748,16,Thaciano,Thaciano Mickael da Silva T,,P,391953
14,Igor,Igor Matheus Liziero ... T,,P,344934,18,Luciano,Luciano da Rocha Neves T,,P,346745
20,Juanfran,Juan Francisco Torre ... T,,P,677535,28,P. Miranda,Jonathan Doin T,,P,291380
22,Everton,Everton Cardoso da Silva T,,P,178361,29,J. Capixaba,Luis Antonio da Roch ... T,,P,402681
28,Tche Tche,Danilo das Neves Pinheiro T,,P,308348,33,David Braz,David Braz de Olivei ... T,,P,168008
39,Antony,Antony Matheus dos Santos T,,P,442146,42,Galhardo,Rafael Galhardo de Souza T,,P,291542
1,Jean,Jean Paulo Fernandes ... R(g),,P,420409,40,Phelipe,Phelipe Megiolaro Alves R(g),,P,337483
2,Igor,Igor Vinicius de Souza R,,P,355675,3,Geromel,Pedro Tonon Geromel R,,P,165322
3,Bruno Alves,Bruno Fabiano Alves R,,P,312015,4,Kannemann,Walter Kannemann R,,P,554626
11,Hélio Junio,Helio Junio Nunes de ... R,,P,464258,6,Leonardo,Leonardo Gomes da Co ... R,,P,303436
13,Luan Silva,Luan Vinicius da Sil ... R,,P,432222,12,Cortez,Bruno Cortes Barbosa R,,P,180546
16,Léo,Leonardo Pinheiro da ... R,,P,346294,14,M. Henrique,Matheus Henrique de SouzaR,,P,407776
17,Willian,Willian Roberto de Farias R,,P,180083,23,Alisson,Alisson Euler de Fre ... R,,P,317751
19,Marcos Cal ...,Marcos Vinicius Silv ... R,,P,408877,25,Pepe,Eduardo Gabriel Aqui ... R,,P,428672
25,Hudson,Hudson Rodrigues dos ... R,,P,176729,30,Patrick,Patrick Machado Ferreira R,,P,423224
26,Igor,Igor Silveira Gomes R,,P,337713,37,Darlan,Darlan Pereira Mendes R,,P,422352
41,Denis de O ...,Denis de Oliveira Ag ... R,,P,451683,38,Rodrigues,Antonio Josenildo Ro ... R,,P,434738
43,Walce,Walce da Silva Costa ... R,,P,432206,41,Da Silva,Rondinelli da Silva  ... R,,P,373518
"",,Comissão Técnica,
"",São Paulo / SP,,Grêmio / RS
Técnico:,Alexi Stival,Técnico:,Renato Portaluppi
Auxiliar Técnico:,Avlamir Dirceo Stival,Auxiliar Técnico:,Alexandre Pereira Mendes
Médico:,Jose Sanchez De Aquino,Médico:,Paulo Augusto Da Silva Rabaldo
Treinador De Goleiros:,Marco Antonio Trocourt,Treinador De Goleiros:,Rogerio Augusto Godoy Da Silva
Preparador Físico:,Pedro Augusto Biccari Franco De Campos,Preparador Físico:,Rogerio Dias Luiz
Massagista:,Ailton Rodrigues,Massagista:,Lucas Silva Da Cruz
"",,,,Cartões Amarelos
Tempo,1T/2T,No,Nome do Jogador,Equipe
18:00,1T,39,Antony Matheus dos Santos,São Paulo/SP
"",,,Motivo: A1.2.  Dar ou tentar dar uma rasteira ou um calço em um adversário de maneira temerária na disputa da bola  - Calçar seu,
"",,,adversário de maneira temerária na disputa da bola.,
"",,,,Cartões Vermelhos
Tempo 1T/2T,No,,Nome do Jogador,
41:00 2T,39,,Antony Matheus dos Santos - São Paulo/SP,
2o Cartão Amarelo,,,Motivo: V2.8.  Outro motivo (detalhar no campo expulsões) - Expulso pela segunda advertência (cartão amarelo) por calçar seu,
"",,,"adversário número 29 sr luis antonio da rocha junior impedindo um ataque promissor, na disputa da bola. o jogador recebeu",
"",,,atendimento médico e continuou na partida.,
"",,,Substituições,
Tempo,1T/2T,Equipe,Entrou,Saiu
19:00,2T,São Paulo/SP,2 - Igor Vinicius de Souza,20 - Juan Francisco Torres Belen
21:00,2T,Grêmio/RS,37 - Darlan Pereira Mendes,7 - Luan Guilherme de Jesus Vieira
22:00,2T,Grêmio/RS,25 - Eduardo Gabriel Aquino Cossa,18 - Luciano da Rocha Neves
25:00,2T,São Paulo/SP,11 - Helio Junio Nunes de Castro,12 - Vitor Frezarin Bueno
33:00,2T,São Paulo/SP,26 - Igor Silveira Gomes,14 - Igor Matheus Liziero Pereira
40:00,2T,Grêmio/RS,30 - Patrick Machado Ferreira,9 - Diego Tardelli Martins
