Campeonato:,Campeonato Brasileiro - Série A/2019,,Rodada:,12
Jogo:,Csa / AL X Grêmio / RS,,,
Data:,29/07/2019 Horário: 20:00 Estádio:,Rei Pelé / Maceio,,
"",,Arbitragem
Arbitro:,Caio Max Augusto Vieira (AB / RN),
Arbitro Assistente 1:,Fabricio Vilarinho da Silva (FIFA / GO),
Arbitro Assistente 2:,Kleber Lucio Gil (FIFA / SC),
Quarto Arbitro:,José Ricardo Vasconcellos Laranjeira (CD / AL),
Delegado Local:,Osvaldo Lourenco da Silva Junior (CBF / AL),
Analista de Campo:,George Alves Feitoza (CBF / AL),
VAR:,Marcio Henrique de Gois (CD / SP),
AVAR1:,Pablo Ramon Goncalves Pinheiro (AB / RN),
AVAR2:,Flavio Gomes Barroca (AB / RN),
"",,,Cronologia,,,
"",1o Tempo,,2o Tempo,,,
Entrada do mandante:,19:50Atraso:,,Não Houve Entrada do mandante: 21:01,,Atraso:,Não Houve
Entrada do visitante:,19:50Atraso:,,Não Houve Entrada do visitante: 21:01,,Atraso:,Não Houve
Início 1o Tempo:,20:00Atraso:,,Não Houve Início do 2o Tempo: 21:03,,Atraso:,Não Houve
Término do 1o Tempo:,20:48Acréscimo:,,3 min Término do 2o Tempo: 21:53,Acréscimo:,,5 min
Resultado do 1o Tempo: 0 X 0,,,Resultado Final: 0 X 0,,,
"",,,,,Relação de Jogadores,,,,
"",,Csa / AL,,,,Grêmio / RS,,,
No,Apelido,Nome Completo T/R,,P/A,CBF No Apelido,Nome Completo T/R,,P/A,CBF
12,Jordi,Jordi Martins Almeida T(g),,P,320196 22 Julio Cesar,Julio Cesar Jacobi T(g),,P,169978
3,Alan Costa,Alan Henrique Costa T,,P,188990 2 Leo Moura,Leonardo da Silva Moura T,,P,137644
4,Luciano Ca ...,Luciano Castan da Silva T,,P,292282 3 Geromel,Pedro Tonon Geromel T,,P,165322
6,Carlinhos,Carlos Andrade Souza T,,P,173760 7 Luan,Luan Guilherme de Je ... T,,P,409960
7,Joao Vitor,Joao Vitor Lima Gomes T,,P,164019 9 Diego Tard ...,Diego Tardelli Martins T,,P,150201
8,Fran,Dawhan Fran Urano da ... T,,P,340115 13 Romulo,Romulo Borges Monteiro T,,P,183094
9,Ricardo Bueno,Ricardo Bueno da Silva T,,P,179974 25 Pepe,Eduardo Gabriel Aqui ... T,,P,428672
10,Nilton,Nilton Ferreira Junior T,,P,163518 28 P. Miranda,Jonathan Doin T,,P,291380
19,Didira,Cicero dos Santos T,,P,184798 29 J. Capixaba,Luis Antonio da Roch ... T,,P,402681
25,Maranhão,Francinilson Santos  ... T,,P,303766 37 Darlan,Darlan Pereira Mendes T,,P,422352
29,Jonatan GomezJonatan David Gomez,T,,P,593809 42 Galhardo,Rafael Galhardo de Souza T,,P,291542
1,Joao Carlos,Joao Carlos Heidemann R(g),,P,174755 24 Brenno,Brenno Oliveira Frag ... R(g),,P,433923
5,Naldo,Marinaldo dos Santos ... R,,P,336832 8 Maicon,Maicon Thiago Pereir ... R,,P,166603
11,Madson,Madson Formagini CaridadeR,,P,165096 11 Everton,Everton Sousa Soares R,,P,379065
13,Gerson,Gerson Guimaraes Junior R,,P,307185 12 Cortez,Bruno Cortes Barbosa R,,P,180546
15,JEAN CLEBER Jean Cleber Santos d ...,R,,P,291982 14 M. Henrique,Matheus Henrique de SouzaR,,P,407776
16,Victor Silva,Victor Wesley dos Sa ... R,,P,441575 15 Vico,Vinicius Duarte R,,P,384617
17,Ronaldo,Ronaldo Luiz Alves R,,P,174941 21 Jean Pyerre,Jean Pyerre Casagran ... R,,P,422351
26,Rafinha,Rafael Chagas Machado R,,P,177606 30 Patrick,Patrick Machado Ferreira R,,P,423224
28,Gamarra,Rodolfo Vicente Gama ... R,,P,672088 33 David Braz,David Braz de Olivei ... R,,P,168008
31,Fabricio,Fabricio Barros Santana R,,P,178321 38 Rodrigues,Antonio Josenildo Ro ... R,,P,434738
99,Alecsandro,Alecsandro Barbosa F ... R,,P,143465 41 Da Silva,Rondinelli da Silva  ... R,,P,373518
"",,,,,90 Andre Felipe,Andre Felipe Ribeiro ... R,,P,292942
No,Apelido Nome Completo,T/R,,P/A,CBF,No,Apelido,Nome Completo T/R,,P/A,CBF
12,Jordi Jordi Martins Almeida,T(g),,P,320196,22,Julio Cesar,Julio Cesar Jacobi T(g),,P,169978
3,Alan Costa Alan Henrique Costa,T,,P,188990,2,Leo Moura,Leonardo da Silva Moura T,,P,137644
4,Luciano Ca ... Luciano Castan da Silva,T,,P,292282,3,Geromel,Pedro Tonon Geromel T,,P,165322
6,Carlinhos Carlos Andrade Souza,T,,P,173760,7,Luan,Luan Guilherme de Je ... T,,P,409960
7,Joao Vitor Joao Vitor Lima Gomes,T,,P,164019,9,Diego Tard ...,Diego Tardelli Martins T,,P,150201
8,Fran Dawhan Fran Urano da ...,T,,P,340115,13,Romulo,Romulo Borges Monteiro T,,P,183094
9,Ricardo Bueno Ricardo Bueno da Silva,T,,P,179974,25,Pepe,Eduardo Gabriel Aqui ... T,,P,428672
10,Nilton Nilton Ferreira Junior,T,,P,163518,28,P. Miranda,Jonathan Doin T,,P,291380
19,Didira Cicero dos Santos,T,,P,184798,29,J. Capixaba,Luis Antonio da Roch ... T,,P,402681
25,Maranhão Francinilson Santos  ...,T,,P,303766,37,Darlan,Darlan Pereira Mendes T,,P,422352
29,Jonatan GomezJonatan David Gomez,T,,P,593809,42,Galhardo,Rafael Galhardo de Souza T,,P,291542
1,Joao Carlos Joao Carlos Heidemann,R(g),,P,174755,24,Brenno,Brenno Oliveira Frag ... R(g),,P,433923
5,Naldo Marinaldo dos Santos ...,R,,P,336832,8,Maicon,Maicon Thiago Pereir ... R,,P,166603
11,Madson Madson Formagini CaridadeR,,,P,165096,11,Everton,Everton Sousa Soares R,,P,379065
13,Gerson Gerson Guimaraes Junior,R,,P,307185,12,Cortez,Bruno Cortes Barbosa R,,P,180546
15,JEAN CLEBER Jean Cleber Santos d ...,R,,P,291982,14,M. Henrique,Matheus Henrique de SouzaR,,P,407776
16,Victor Silva Victor Wesley dos Sa ...,R,,P,441575,15,Vico,Vinicius Duarte R,,P,384617
17,Ronaldo Ronaldo Luiz Alves,R,,P,174941,21,Jean Pyerre,Jean Pyerre Casagran ... R,,P,422351
26,Rafinha Rafael Chagas Machado,R,,P,177606,30,Patrick,Patrick Machado Ferreira R,,P,423224
28,Gamarra Rodolfo Vicente Gama ...,R,,P,672088,33,David Braz,David Braz de Olivei ... R,,P,168008
31,Fabricio Fabricio Barros Santana,R,,P,178321,38,Rodrigues,Antonio Josenildo Ro ... R,,P,434738
99,Alecsandro Alecsandro Barbosa F ...,R,,P,143465,41,Da Silva,Rondinelli da Silva  ... R,,P,373518
"",,,,,,90,Andre Felipe,Andre Felipe Ribeiro ... R,,P,292942
"",,Comissão Técnica,
"",Csa / AL,,Grêmio / RS
Técnico:,Argelico Fucks,Técnico:,Renato Portaluppi
Auxiliar Técnico:,Glebson Robson Barroso De Lira,Auxiliar Técnico:,Alexandre Pereira Mendes
Médico:,Igor De Castro Teixeira,Médico:,Paulo Augusto Da Silva Rabaldo
Treinador De Goleiros:,Rodolfo Andrade De Oliveira,Treinador De Goleiros:,Rogerio Augusto Godoy Da Silva
Preparador Físico:,Daniel Sampaio De Azambuja,Preparador Físico:,Rogerio Dias Luiz
Fisioterapeuta:,Afonso Celso Brasileiro Borges Junior,Massagista:,Anderson Machado Meurer
"",,,,Cartões Amarelos
Tempo,1T/2T,No,Nome do Jogador,Equipe
13:00,2T,29,Luis Antonio da Rocha Junior,Grêmio/RS
"",,,"Motivo: A1.4.  Segurar um adversário por motivo tático para afastá-lo da bola - Por segurar seu adversário, impedindo um ataque",
"",,,promissor.,
"",,,,Substituições,
Tempo,1T/2T,,Equipe,Entrou,Saiu
20:00,2T,Csa/AL,,15 - Jean Cleber Santos da Silva,7 - Joao Vitor Lima Gomes
24:00,2T,Csa/AL,,28 - Rodolfo Vicente Gamarra Varela,25 - Francinilson Santos Meireles
25:00,2T,Grêmio/RS,,11 - Everton Sousa Soares,42 - Rafael Galhardo de Souza
30:00,2T,Csa/AL,,5 - Marinaldo dos Santos Oliveira,10 - Nilton Ferreira Junior
38:00,2T,Grêmio/RS,,30 - Patrick Machado Ferreira,9 - Diego Tardelli Martins
38:00,2T,Grêmio/RS,,41 - Rondinelli da Silva Vieira,7 - Luan Guilherme de Jesus Vieira
