Campeonato:,Campeonato Brasileiro - Série A/2019,,Rodada:,36
Jogo:,Avaí / SC X Fluminense / RJ,,,
Data:,01/12/2019 Horário: 16:00 Estádio:,Aderbal Ramos da Silva / Florianopolis,,
"",,Arbitragem
Arbitro:,Daniel Nobre Bins (AB / RS),
Arbitro Assistente 1:,Lucio Beiersdorf Flor (AB / RS),
Arbitro Assistente 2:,Andre da Silva Bitencourt (AB / RS),
Quarto Arbitro:,Fernando Henrique de Medeiros Miranda (CD / SC),
Inspetor:,Antonio Pereira da Silva (CBF / GO),
Delegado Local:,Weliton Brasil Ribeiro ( / ),
VAR:,Rodrigo Guarizo Ferreira do Amaral (AB / SP),
AVAR1:,Lucas Canetto Bellote (AB / SP),
AVAR2:,Fabricio Porfirio de Moura (AB / SP),
"",,,Cronologia,,,
"",1o Tempo,,2o Tempo,,,
Entrada do mandante:,15:50Atraso:,,Não Houve Entrada do mandante: 17:01,,Atraso:,Não Houve
Entrada do visitante:,15:50Atraso:,,Não Houve Entrada do visitante: 17:01,,Atraso:,Não Houve
Início 1o Tempo:,16:00Atraso:,,Não Houve Início do 2o Tempo: 17:03,,Atraso:,Não Houve
Término do 1o Tempo:,16:48Acréscimo:,,3 min Término do 2o Tempo: 17:54,Acréscimo:,,6 min
Resultado do 1o Tempo: 0 X 1,,,Resultado Final: 1 X 1,,,
"",,,,,Relação de Jogadores,,,,
"",,Avaí / SC,,,Fluminense / RJ,,,,
No,Apelido,Nome Completo T/R,,P/A,CBF No Apelido Nome Completo,T/R,,P/A,CBF
89,Vladimir,Vladimir Orlando Car ... T(g),,P,180622 1 Marcos Felipe Marcos Felipe de Fre ...,T(g),,P,318563
19,João Paulo,Joao Paulo da Silva Alves T,,P,371170 2 Gilberto Gilberto Moraes Junior,T,,P,307134
27,Richard,Richard Dario Franco ... T,,P,672682 4 Luccas Claro Luccas Claro dos Santos,T,,P,291708
32,Léo,Leonardo Moreira Morais T,,P,303922 6 Yuri Yuri Oliveira Lima,T,,P,307979
33,Marquinhos ...,Marcos Roberto da Si ... T,,P,137982 11 Yony Gonzalez Yony Alexander Gonza ...,T,,P,646477
36,Ramon dos  ...,Ramon dos Santos Pereira T,,P,502779 15 Dodi Douglas Moreira Fagundes,T,,P,354201
39,Jonathan,Jonathan Luiz Moreir ... T,,P,401045 19 Caio Henrique Caio Henrique Olivei ...,T,,P,337823
55,Marcinho,Marcio Rodrigues Velasco T,,P,443362 29 Allan Allan Rodrigues de Souza,T,,P,339266
63,Kunde,Eduardo Kunde T,,P,364057 32 Marcos Paulo Marcos Paulo Costa d ...,T,,P,526048
70,Caio Paulista,Caio Fernando de Oliveira T,,P,460683 33 NINO Marcilio Florencio M ...,T,,P,379386
98,Wesley,Wesley Soares Xavier T,,P,336401 77 Nenê Anderson Luis de Carvalho,T,,P,150986
83,Gledson,Gledson Ribeiro dos  ... R(g),,P,159483 25 Agenor Agenor Detofol,R(g),,P,182631
1,Lucas Frigeri,Lucas Henrique Frigeri R,,P,292237 7 Pablo Dyego Pablo Dyego da Silva Rosa,R,,P,315834
4,Ze Marcos,Jose Marcos Alves Luis R,,P,406610 12 Lucão Lucas Vinicius Gonca ...,R,,P,304035
16,Luanderson,Luanderson Johnala M ... R,,P,177083 13 Frazan Wesley Frazan Bernardo,R,,P,381926
17,Nuno,Acacio Nuno Boing R,,P,523004 17 Evanilson Francisco Evanilson  ...,R,,P,416790
21,Luan Pereira,Luan Martins Pereira R,,P,526236 18 Wellington ... Wellington Silva San ...,R,,P,293170
23,Igor,Igor Fernandes da Si ... R,,P,320984 21 Igor Julião Igor de Carvalho Juliao,R,,P,307616
30,Vinicius A ...,Vinicius Vasconcelos ... R,,P,320857 23 Joao Pedro Joao Pedro Junqueira ...,R,,P,540090
75,Falcão,Lucas de Oliveira Te ... R,,P,398807 28 Guilherme Guilherme Milhomem GusmaRo,,,P,171975
77,Gabriel Lima,Gabriel Farias de Lima R,,P,539022 35 Ewandro Ewandro Felipe de Li ...,R,,P,344841
97,Lourenço,Joao Paulo Ferreira  ... R,,P,533963 37 Miguel Miguel Silveira dos  ...,R,,P,582161
No,Apelido,Nome Completo T/R,,P/A,CBF,No,Apelido Nome Completo,T/R,,P/A,CBF
89,Vladimir,Vladimir Orlando Car ... T(g),,P,180622,1,Marcos Felipe Marcos Felipe de Fre ...,T(g),,P,318563
19,João Paulo,Joao Paulo da Silva Alves T,,P,371170,2,Gilberto Gilberto Moraes Junior,T,,P,307134
27,Richard,Richard Dario Franco ... T,,P,672682,4,Luccas Claro Luccas Claro dos Santos,T,,P,291708
32,Léo,Leonardo Moreira Morais T,,P,303922,6,Yuri Yuri Oliveira Lima,T,,P,307979
33,Marquinhos ...,Marcos Roberto da Si ... T,,P,137982,11,Yony Gonzalez Yony Alexander Gonza ...,T,,P,646477
36,Ramon dos  ...,Ramon dos Santos Pereira T,,P,502779,15,Dodi Douglas Moreira Fagundes,T,,P,354201
39,Jonathan,Jonathan Luiz Moreir ... T,,P,401045,19,Caio Henrique Caio Henrique Olivei ...,T,,P,337823
55,Marcinho,Marcio Rodrigues Velasco T,,P,443362,29,Allan Allan Rodrigues de Souza,T,,P,339266
63,Kunde,Eduardo Kunde T,,P,364057,32,Marcos Paulo Marcos Paulo Costa d ...,T,,P,526048
70,Caio Paulista,Caio Fernando de Oliveira T,,P,460683,33,NINO Marcilio Florencio M ...,T,,P,379386
98,Wesley,Wesley Soares Xavier T,,P,336401,77,Nenê Anderson Luis de Carvalho,T,,P,150986
83,Gledson,Gledson Ribeiro dos  ... R(g),,P,159483,25,Agenor Agenor Detofol,R(g),,P,182631
1,Lucas Frigeri,Lucas Henrique Frigeri R,,P,292237,7,Pablo Dyego Pablo Dyego da Silva Rosa,R,,P,315834
4,Ze Marcos,Jose Marcos Alves Luis R,,P,406610,12,Lucão Lucas Vinicius Gonca ...,R,,P,304035
16,Luanderson,Luanderson Johnala M ... R,,P,177083,13,Frazan Wesley Frazan Bernardo,R,,P,381926
17,Nuno,Acacio Nuno Boing R,,P,523004,17,Evanilson Francisco Evanilson  ...,R,,P,416790
21,Luan Pereira,Luan Martins Pereira R,,P,526236,18,Wellington ... Wellington Silva San ...,R,,P,293170
23,Igor,Igor Fernandes da Si ... R,,P,320984,21,Igor Julião Igor de Carvalho Juliao,R,,P,307616
30,Vinicius A ...,Vinicius Vasconcelos ... R,,P,320857,23,Joao Pedro Joao Pedro Junqueira ...,R,,P,540090
75,Falcão,Lucas de Oliveira Te ... R,,P,398807,28,Guilherme Guilherme Milhomem GusmaRo,,,P,171975
77,Gabriel Lima,Gabriel Farias de Lima R,,P,539022,35,Ewandro Ewandro Felipe de Li ...,R,,P,344841
97,Lourenço,Joao Paulo Ferreira  ... R,,P,533963,37,Miguel Miguel Silveira dos  ...,R,,P,582161
"",,Comissão Técnica,
"",Avaí / SC,,Fluminense / RJ
Técnico:,Evando Spinasse Camillato,Técnico:,Marco Aurelio De Oliveira
Auxiliar Técnico:,Bruno Gonçalo Pereira,Auxiliar Técnico:,Daniel Dos Santos Cerqueira
Médico:,Luis Fernando Zukanovich Funchal,Médico:,Ricardo Reiniger Olivero
Treinador De Goleiros:,Wlamir Ney Machado,Treinador De Goleiros:,Andre Carvalho Da Silva
Preparador Físico:,Jaelson Goncalves Ortiz,Preparador Físico:,Marcos De Seixas Correa
Massagista:,Delmar Da Rosa Pereira,Massagista:,Walter Velloso Dias
"",,,,,Gols,
Tempo,1T/2T,No,Tipo,Nome do Jogador,,Equipe
35:00,1T,32,NR,Marcos Paulo Costa do Nascimento,,Fluminense/RJ
+2,2T,19,PN,Joao Paulo da Silva Alves,,Avaí/SC
"",,,,Cartões Amarelos
Tempo,1T/2T,No,Nome do Jogador,Equipe
15:00,2T,4,Luccas Claro dos Santos,Fluminense/RJ
"",,,Motivo: A1.2.  Dar ou tentar dar uma rasteira ou um calço em um adversário de maneira temerária na disputa da bola  - Por calçar o,
"",,,seu adversário de maneira temerária na disputa de bola.,
"",,,,Substituições,
Tempo,1T/2T,,Equipe,Entrou,Saiu
45:00,INT,Avaí/SC,,30 - Vinicius Vasconcelos Araujo,55 - Marcio Rodrigues Velasco
04:00,2T,Avaí/SC,,97 - Joao Paulo Ferreira Lourenco,70 - Caio Fernando de Oliveira
21:00,2T,Avaí/SC,,77 - Gabriel Farias de Lima,32 - Leonardo Moreira Morais
30:00,2T,Fluminense/RJ,,7 - Pablo Dyego da Silva Rosa,32 - Marcos Paulo Costa do Nascim...
30:00,2T,Fluminense/RJ,,28 - Guilherme Milhomem Gusmao,77 - Anderson Luis de Carvalho
40:00,2T,Fluminense/RJ,,21 - Igor de Carvalho Juliao,29 - Allan Rodrigues de Souza
