Campeonato:,Campeonato Brasileiro - Série A/2019,,Rodada:,24
Jogo:,Cruzeiro / MG X Fluminense / RJ,,,
Data:,09/10/2019 Horário: 21:30 Estádio:,Magalhães Pinto / Belo Horizonte,,
"",Arbitragem
Arbitro:,Jean Pierre Goncalves Lima (AB / RS)
Arbitro Assistente 1:,Leirson Peng Martins (AB / RS)
Arbitro Assistente 2:,Michael Stanislau (AB / RS)
Quarto Arbitro:,Wanderson Alves de Sousa (AB / MG)
Delegado Local:,Daniel Mendes de Las Casas (CBF / )
Analista de Campo:,Sandoval Franco Ferreira (CBF / MG)
VAR:,Jonathan Benkenstein Pinheiro (CD / RS)
AVAR1:,Leandro Pedro Vuaden (MTR / RS)
AVAR2:,Jorge Eduardo Bernardi (AB / RS)
"",,,Cronologia,,,
"",1o Tempo,,2o Tempo,,,
Entrada do mandante:,21:20Atraso:,,Não Houve Entrada do mandante: 22:37,,Atraso:,Não Houve
Entrada do visitante:,21:20Atraso:,,Não Houve Entrada do visitante: 22:37,,Atraso:,Não Houve
Início 1o Tempo:,21:30Atraso:,,Não Houve Início do 2o Tempo: 22:39,,Atraso:,Não Houve
Término do 1o Tempo:,22:24Acréscimo:,,9 min Término do 2o Tempo: 23:31,Acréscimo:,,7 min
Resultado do 1o Tempo: 0 X 0,,,Resultado Final: 0 X 0,,,
"",,,,,Relação de Jogadores,,,,
"",,Cruzeiro / MG,,,Fluminense / RJ,,,,
No,Apelido,Nome Completo T/R,,P/A,CBF No Apelido Nome Completo,T/R,,P/A,CBF
1,Fabio,Fabio Deivson Lopes  ... T(g),,P,129292 27 Muriel Muriel Gustavo Becker,T(g),,P,165925
2,Edilson,Edilson Mendes Guimaraes T,,P,161745 2 Gilberto Gilberto Moraes Junior,T,,P,307134
6,Egidio,Egidio de Araujo Per ... T,,P,157280 6 Yuri Yuri Oliveira Lima,T,,P,307979
8,Henrique,Henrique Pacheco de Lima T,,P,170812 10 GANSO Paulo Henrique Chaga ...,T,,P,184364
9,Fred,Frederico Chaves Guedes T,,P,148994 11 Yony Gonzalez Yony Alexander Gonza ...,T,,P,646477
11,David,David Correia da Fonseca T,,P,430588 13 Frazan Wesley Frazan Bernardo,T,,P,381926
19,Robinho,Robson Michael Signorini T,,P,172189 20 Daniel Daniel Sampaio Simoes,T,,P,308495
25,Fabricio B ...,Fabricio Bruno Soare ... T,,P,389228 22 Orinho Edilsom Borba de Aquino,T,,P,398393
26,Dedé,Anderson Vital da Silva T,,P,177749 23 Joao Pedro Joao Pedro Junqueira ...,T,,P,540090
27,Jadson,Jadson Alves dos Santos T,,P,302192 33 NINO Marcilio Florencio M ...,T,,P,379386
99,Sassá,Luiz Ricardo Alves T,,P,337172 77 Nenê Anderson Luis de Carvalho,T,,P,150986
12,Rafael,Rafael Pires Monteiro R(g),,P,180213 25 Agenor Agenor Detofol,R(g),,P,182631
5,Ariel Cabral,Alejandro Ariel Cabral R,,P,535421 4 Luccas Claro Luccas Claro dos Santos,R,,P,291708
17,Ezequiel,Ezequiel Santos da Silva R,,P,418697 5 Airton Airton Ribeiro Santos,R,,P,186870
20,Marquinhos ...,Marcos Gabriel do Na ... R,,P,190389 12 Lucão Lucas Vinicius Gonca ...,R,,P,304035
30,Vinicius P ...,Vinicius Santana da Silva R,,P,515750 15 Dodi Douglas Moreira Fagundes,R,,P,354201
35,Adriano,Adriano Firmino dos  ... R,,P,459574 17 Evanilson Francisco Evanilson  ...,R,,P,416790
36,Rafael,Rafael Lucas Cardoso ... R,,P,444618 21 Igor Julião Igor de Carvalho Juliao,R,,P,307616
37,Joel,Diederrick Joel Tagu ... R,,P,402984 28 Guilherme Guilherme Milhomem GusmaRo,,,P,171975
39,Vitor Eudes,Vitor Eudes de Souza ... R,,P,444850 31 Lucas Lucas Barcelos Damacena,R,,P,442637
41,Mauricio,Mauricio Magalhaes Prado R,,P,542337 35 Ewandro Ewandro Felipe de Li ...,R,,P,344841
42,Weverton,Weverton Guilherme d ... R,,P,537549 37 Miguel Miguel Silveira dos  ...,R,,P,582161
43,Edu,Lucas Eduardo Ribeir ... R,,P,509619,,,,
No,Apelido,Nome Completo T/R,,P/A,CBF,No,Apelido Nome Completo,T/R,,P/A,CBF
1,Fabio,Fabio Deivson Lopes  ... T(g),,P,129292,27,Muriel Muriel Gustavo Becker,T(g),,P,165925
2,Edilson,Edilson Mendes Guimaraes T,,P,161745,2,Gilberto Gilberto Moraes Junior,T,,P,307134
6,Egidio,Egidio de Araujo Per ... T,,P,157280,6,Yuri Yuri Oliveira Lima,T,,P,307979
8,Henrique,Henrique Pacheco de Lima T,,P,170812,10,GANSO Paulo Henrique Chaga ...,T,,P,184364
9,Fred,Frederico Chaves Guedes T,,P,148994,11,Yony Gonzalez Yony Alexander Gonza ...,T,,P,646477
11,David,David Correia da Fonseca T,,P,430588,13,Frazan Wesley Frazan Bernardo,T,,P,381926
19,Robinho,Robson Michael Signorini T,,P,172189,20,Daniel Daniel Sampaio Simoes,T,,P,308495
25,Fabricio B ...,Fabricio Bruno Soare ... T,,P,389228,22,Orinho Edilsom Borba de Aquino,T,,P,398393
26,Dedé,Anderson Vital da Silva T,,P,177749,23,Joao Pedro Joao Pedro Junqueira ...,T,,P,540090
27,Jadson,Jadson Alves dos Santos T,,P,302192,33,NINO Marcilio Florencio M ...,T,,P,379386
99,Sassá,Luiz Ricardo Alves T,,P,337172,77,Nenê Anderson Luis de Carvalho,T,,P,150986
12,Rafael,Rafael Pires Monteiro R(g),,P,180213,25,Agenor Agenor Detofol,R(g),,P,182631
5,Ariel Cabral,Alejandro Ariel Cabral R,,P,535421,4,Luccas Claro Luccas Claro dos Santos,R,,P,291708
17,Ezequiel,Ezequiel Santos da Silva R,,P,418697,5,Airton Airton Ribeiro Santos,R,,P,186870
20,Marquinhos ...,Marcos Gabriel do Na ... R,,P,190389,12,Lucão Lucas Vinicius Gonca ...,R,,P,304035
30,Vinicius P ...,Vinicius Santana da Silva R,,P,515750,15,Dodi Douglas Moreira Fagundes,R,,P,354201
35,Adriano,Adriano Firmino dos  ... R,,P,459574,17,Evanilson Francisco Evanilson  ...,R,,P,416790
36,Rafael,Rafael Lucas Cardoso ... R,,P,444618,21,Igor Julião Igor de Carvalho Juliao,R,,P,307616
37,Joel,Diederrick Joel Tagu ... R,,P,402984,28,Guilherme Guilherme Milhomem GusmaRo,,,P,171975
39,Vitor Eudes,Vitor Eudes de Souza ... R,,P,444850,31,Lucas Lucas Barcelos Damacena,R,,P,442637
41,Mauricio,Mauricio Magalhaes Prado R,,P,542337,35,Ewandro Ewandro Felipe de Li ...,R,,P,344841
42,Weverton,Weverton Guilherme d ... R,,P,537549,37,Miguel Miguel Silveira dos  ...,R,,P,582161
43,Edu,Lucas Eduardo Ribeir ... R,,P,509619,,,,,,
"",,Comissão Técnica,
"",Cruzeiro / MG,,Fluminense / RJ
Técnico:,Abel Carlos Da Silva Braga,Técnico:,Marco Aurelio De Oliveira
Auxiliar Técnico:,Leomir De Souza,Auxiliar Técnico:,Ailton Dos Santos Ferraz
Médico:,Sergio Augusto Campolina De Azeredo,Médico:,Arthur Da Rocha Nogueira Neto
Treinador De Goleiros:,Roberto Barbosa Dos Santos,Treinador De Goleiros:,Andre Carvalho Da Silva
Preparador Físico:,Anderson Goncalves Nicolau,Preparador Físico:,Marcelo Barbosa Leite Chirol
Fisioterapeuta:,Ronner Fabiano Bolognani De Barros,Massagista:,Pedro Carlos Antunes
"",,,,Cartões Amarelos
Tempo,1T/2T,No,Nome do Jogador,Equipe
33:00,2T,10,Paulo Henrique Chagas de Lima,Fluminense/RJ
"",,,Motivo: A1.3.  Cometer uma falta tática para impedir um ataque promissor - Por puxar seu adversário impedindo um ataque promissor.,
"",,,,Cartões Vermelhos
Tempo 1T/2T,No,,Nome do Jogador,
+9:00 1T,TG,,Andre Carvalho da Silva - Fluminense/RJ,
Cartão Vermelho Direto,,,Motivo: V2.8.  Outro motivo (detalhar no campo expulsões) - Por persistir em contestar as decisões da arbitragem de forma continuada,
"",,,"e ostensiva, se recusando a voltar para o banco de suplentes e dirigindo as seguintes palavras ao quarto árbitro da partida sr.",
"",,,"wanderson alves de sousa, ""ele errou mesmo, não vou me calar, tem que admitir, vou gritar pra ele saber que errou"". após ser expulso",
"",,,deixou o banco de suplentes normalmente.,
"",,,,Substituições,
Tempo,1T/2T,,Equipe,Entrou,Saiu
45:00,INT,Cruzeiro/MG,,20 - Marcos Gabriel do Nascimento,11 - David Correia da Fonseca
15:00,2T,Fluminense/RJ,,15 - Douglas Moreira Fagundes,20 - Daniel Sampaio Simoes
21:00,2T,Cruzeiro/MG,,30 - Vinicius Santana da Silva,99 - Luiz Ricardo Alves
28:00,2T,Fluminense/RJ,,21 - Igor de Carvalho Juliao,22 - Edilsom Borba de Aquino
30:00,2T,Cruzeiro/MG,,41 - Mauricio Magalhaes Prado,19 - Robson Michael Signorini
41:00,2T,Fluminense/RJ,,35 - Ewandro Felipe de Lima Costa,10 - Paulo Henrique Chagas de Lima
