Campeonato:,Campeonato Brasileiro - Série A/2019,,Rodada:,26
Jogo:,Grêmio / RS X Bahia / BA,,,
Data:,16/10/2019 Horário: 19:15 Estádio:,Arena do Grêmio / Porto Alegre,,
"",,Arbitragem
Arbitro:,Rodolpho Toski Marques (FIFA / PR),
Arbitro Assistente 1:,Bruno Boschilia (FIFA / PR),
Arbitro Assistente 2:,Victor Hugo Imazu dos Santos (AB / PR),
Quarto Arbitro:,Lucas Guimarães Rechatiko Horn (CD / RS),
Delegado Local:,Marcos Roberto Caduri de Almeida (CBF / ),
Analista de Campo:,Jose Antônio Chaves Franco Filho (CBF / RS),
VAR:,Adriano Milczvski (AB / PR),
AVAR1:,Emerson de Almeida Ferreira (AB / MG),
AVAR2:,Celso Luiz da Silva (AB / MG),
"",,,Cronologia,,,
"",1o Tempo,,2o Tempo,,,
Entrada do mandante:,19:05Atraso:,,Não Houve Entrada do mandante: 20:14,,Atraso:,Não Houve
Entrada do visitante:,19:05Atraso:,,Não Houve Entrada do visitante: 20:15,,Atraso:,Não Houve
Início 1o Tempo:,19:15Atraso:,,Não Houve Início do 2o Tempo: 20:17,,Atraso:,Não Houve
Término do 1o Tempo:,20:02Acréscimo:,,2 min Término do 2o Tempo: 21:09,Acréscimo:,,7 min
Resultado do 1o Tempo: 0 X 0,,,Resultado Final: 0 X 1,,,
"",,,,,Relação de Jogadores,,,,
"",,Grêmio / RS,,,Bahia / BA,,,,
No,Apelido,Nome Completo T/R,,P/A,CBF No Apelido Nome Completo,,T/R,P/A,CBF
1,Paulo Victor,Paulo Victor Mileo V ... T(g),,P,175411 1 Douglas Douglas Alan Schuck  ...,,T(g),P,182717
2,Leo Moura,Leonardo da Silva Moura T,,P,137644 5 Flavio Flavio Medeiros da Silva,,T,P,337826
3,Geromel,Pedro Tonon Geromel T,,P,165322 7 Elber Jose Elber Pimentel  ...,,T,P,298642
4,Kannemann,Walter Kannemann T,,P,554626 9 Gilberto Gilberto Oliveira So ...,,T,P,185444
7,Luan,Luan Guilherme de Je ... T,,P,409960 18 Guerra Alejandro Abraham Gu ...,,T,P,565572
8,Maicon,Maicon Thiago Pereir ... T,,P,166603 23 Joao Pedro Joao Pedro Maturano  ...,,T,P,376586
9,Diego Tard ...,Diego Tardelli Martins T,,P,150201 25 Giovanni Giovanni Palmieri do ...,,T,P,175878
11,Everton,Everton Sousa Soares T,,P,379065 26 Gregore Gregore de Magalhaes ...,,T,P,314357
12,Cortez,Bruno Cortes Barbosa T,,P,180546 28 Lucas Fonseca Lucas Silva Fonseca,,T,P,309265
14,Matheus He ...,Matheus Henrique de SouzaT,,P,407776 40 Juninho Jose Carlos Ferreira ...,,T,P,378851
23,Alisson,Alisson Euler de Fre ... T,,P,317751 98 Artur Artur Victor Guimaraes,,T,P,419646
22,Julio Cesar,Julio Cesar Jacobi R(g),,P,169978 33 Anderson Anderson Pedro da Si ...,R(g),,P,155955
5,Michel,Michel Ferreira dos  ... R,,P,298485 3 Wanderson Wanderson Santos Pereira,,R,P,300394
13,Romulo,Romulo Borges Monteiro R,,P,183094 11 Lucca Lucca Borges de Brito,,R,P,292592
16,Thaciano,Thaciano Mickael da Silva R,,P,391953 16 Ronaldo Ronaldo da Silva Souza,,R,P,405698
18,Luciano,Luciano da Rocha Neves R,,P,346745 20 Fernandao Jose Fernando Viana  ...,,R,P,188453
25,Pepe,Eduardo Gabriel Aqui ... R,,P,428672 22 Ezequiel Ezequiel Jacinto de Biasi,,R,P,302436
28,P. Miranda,Jonathan Doin R,,P,291380 27 Shaylon Shaylon Kallyson Cardozo,,R,P,421138
29,J. Capixaba,Luis Antonio da Roch ... R,,P,402681 30 Marco Antonio Marco Antonio Rosa F ...,,R,P,518590
30,Patrick,Patrick Machado Ferreira R,,P,423224 34 Ignacio Ignacio da Silva Oliveira,,R,P,530656
33,David Braz,David Braz de Olivei ... R,,P,168008 44 Xandao Alexandre Rodrigues  ...,,R,P,333824
42,Galhardo,Rafael Galhardo de Souza R,,P,291542 77 Arthur Arthur Caike do Nasc ...,,R,P,292833
90,Andre Felipe,Andre Felipe Ribeiro ... R,,P,292942 90 Rogerio Jose Rogerio de Oliv ...,,R,P,291780
No,Apelido,Nome Completo T/R,,P/A,CBF,No,Apelido Nome Completo,,T/R,P/A,CBF
1,Paulo Victor,Paulo Victor Mileo V ... T(g),,P,175411,1,Douglas Douglas Alan Schuck  ...,,T(g),P,182717
2,Leo Moura,Leonardo da Silva Moura T,,P,137644,5,Flavio Flavio Medeiros da Silva,,T,P,337826
3,Geromel,Pedro Tonon Geromel T,,P,165322,7,Elber Jose Elber Pimentel  ...,,T,P,298642
4,Kannemann,Walter Kannemann T,,P,554626,9,Gilberto Gilberto Oliveira So ...,,T,P,185444
7,Luan,Luan Guilherme de Je ... T,,P,409960,18,Guerra Alejandro Abraham Gu ...,,T,P,565572
8,Maicon,Maicon Thiago Pereir ... T,,P,166603,23,Joao Pedro Joao Pedro Maturano  ...,,T,P,376586
9,Diego Tard ...,Diego Tardelli Martins T,,P,150201,25,Giovanni Giovanni Palmieri do ...,,T,P,175878
11,Everton,Everton Sousa Soares T,,P,379065,26,Gregore Gregore de Magalhaes ...,,T,P,314357
12,Cortez,Bruno Cortes Barbosa T,,P,180546,28,Lucas Fonseca Lucas Silva Fonseca,,T,P,309265
14,Matheus He ...,Matheus Henrique de SouzaT,,P,407776,40,Juninho Jose Carlos Ferreira ...,,T,P,378851
23,Alisson,Alisson Euler de Fre ... T,,P,317751,98,Artur Artur Victor Guimaraes,,T,P,419646
22,Julio Cesar,Julio Cesar Jacobi R(g),,P,169978,33,Anderson Anderson Pedro da Si ...,R(g),,P,155955
5,Michel,Michel Ferreira dos  ... R,,P,298485,3,Wanderson Wanderson Santos Pereira,,R,P,300394
13,Romulo,Romulo Borges Monteiro R,,P,183094,11,Lucca Lucca Borges de Brito,,R,P,292592
16,Thaciano,Thaciano Mickael da Silva R,,P,391953,16,Ronaldo Ronaldo da Silva Souza,,R,P,405698
18,Luciano,Luciano da Rocha Neves R,,P,346745,20,Fernandao Jose Fernando Viana  ...,,R,P,188453
25,Pepe,Eduardo Gabriel Aqui ... R,,P,428672,22,Ezequiel Ezequiel Jacinto de Biasi,,R,P,302436
28,P. Miranda,Jonathan Doin R,,P,291380,27,Shaylon Shaylon Kallyson Cardozo,,R,P,421138
29,J. Capixaba,Luis Antonio da Roch ... R,,P,402681,30,Marco Antonio Marco Antonio Rosa F ...,,R,P,518590
30,Patrick,Patrick Machado Ferreira R,,P,423224,34,Ignacio Ignacio da Silva Oliveira,,R,P,530656
33,David Braz,David Braz de Olivei ... R,,P,168008,44,Xandao Alexandre Rodrigues  ...,,R,P,333824
42,Galhardo,Rafael Galhardo de Souza R,,P,291542,77,Arthur Arthur Caike do Nasc ...,,R,P,292833
90,Andre Felipe,Andre Felipe Ribeiro ... R,,P,292942,90,Rogerio Jose Rogerio de Oliv ...,,R,P,291780
"",,Comissão Técnica,
"",Grêmio / RS,,Bahia / BA
Técnico:,Renato Portaluppi,Técnico:,Roger Machado Marques
Auxiliar Técnico:,Alexandre Pereira Mendes,Auxiliar Técnico:,Roberto Lampert Ribas
Médico:,Marcio Marques Dornelles,Médico:,Daniel Jose De Araujo Silva
Treinador De Goleiros:,Rogerio Augusto Godoy Da Silva,Treinador De Goleiros:,Rogerio Alves De Lima
Preparador Físico:,Rogerio Dias Luiz,Preparador Físico:,Paulo Cesar Paixao De Araujo
Massagista:,Jose Fernandes Flores,Massagista:,Fabio Lima Fontes
"",,,,,Gols,
Tempo,1T/2T,No,Tipo,Nome do Jogador,,Equipe
45:00,2T,77,PN,Arthur Caike do Nascimento Cruz,,Bahia/BA
"",,,,Substituições,
Tempo,1T/2T,,Equipe,Entrou,Saiu
+1:00,2T,Bahia/BA,,16 - Ronaldo da Silva Souza,7 - Jose Elber Pimentel da Silva
45:00,INT,Grêmio/RS,,16 - Thaciano Mickael da Silva,8 - Maicon Thiago Pereira de Souza
16:00,2T,Grêmio/RS,,25 - Eduardo Gabriel Aquino Cossa,23 - Alisson Euler de Freitas Cas...
21:00,2T,Bahia/BA,,30 - Marco Antonio Rosa Furtado J...,18 - Alejandro Abraham Guerra Mor...
26:00,2T,Grêmio/RS,,30 - Patrick Machado Ferreira,7 - Luan Guilherme de Jesus Vieira
26:00,2T,Bahia/BA,,77 - Arthur Caike do Nascimento C...,9 - Gilberto Oliveira Souza Junior
