Campeonato:,Campeonato Brasileiro - Série A/2019,,Rodada:,26
Jogo:,Cruzeiro / MG X São Paulo / SP,,,
Data:,16/10/2019 Horário: 21:00 Estádio:,Magalhães Pinto / Belo Horizonte,,
"",,Arbitragem
Arbitro:,Wilton Pereira Sampaio (FIFA / GO),
Arbitro Assistente 1:,Fabricio Vilarinho da Silva (FIFA / GO),
Arbitro Assistente 2:,Bruno Raphael Pires (FIFA / GO),
Quarto Arbitro:,Ronei Candido Alves (AB / MG),
Delegado Local:,Daniel Mendes de Las Casas (CBF / ),
Analista de Campo:,Joel Tolentino da Mata Junior (CBF / MG),
VAR:,Elmo Alves Resende Cunha (MTR / GO),
AVAR1:,Andre Luiz de Freitas Castro (MTR / GO),
AVAR2:,Leone Carvalho Rocha (AB / GO),
"",,,Cronologia,,,
"",1o Tempo,,2o Tempo,,,
Entrada do mandante:,20:50Atraso:,,Não Houve Entrada do mandante: 22:01,,Atraso:,Não Houve
Entrada do visitante:,20:50Atraso:,,Não Houve Entrada do visitante: 22:01,,Atraso:,Não Houve
Início 1o Tempo:,21:00Atraso:,,Não Houve Início do 2o Tempo: 22:03,,Atraso:,Não Houve
Término do 1o Tempo:,21:48Acréscimo:,,3 min Término do 2o Tempo: 22:52,Acréscimo:,,4 min
Resultado do 1o Tempo: 0 X 0,,,Resultado Final: 1 X 0,,,
"",,,,,Relação de Jogadores,,,,
"",,Cruzeiro / MG,,,,São Paulo / SP,,,
No,Apelido,Nome Completo T/R,,P/A,CBF No Apelido,Nome Completo T/R,,P/A,CBF
1,Fabio,Fabio Deivson Lopes  ... T(g),,P,129292 23 Tiago Volpi,Tiago Luis Volpi T(g),,P,291584
2,Edilson,Edilson Mendes Guimaraes T,,P,161745 3 Bruno Alves,Bruno Fabiano Alves T,,P,312015
6,Egidio,Egidio de Araujo Per ... T,,P,157280 5 Arboleda,Robert Abel Arboleda ... T,,P,595193
8,Henrique,Henrique Pacheco de Lima T,,P,170812 6 Reinaldo,Reinaldo Manoel da Silva T,,P,332318
9,Fred,Frederico Chaves Guedes T,,P,148994 7 Alexandre  ...,Alexandre Rodrigues  ... T,,P,177588
10,Thiago Neves,Thiago Neves Augusto T,,P,169888 10 Dani Alves,Daniel Alves da Silva T,,P,144094
11,David,David Correia da Fonseca T,,P,430588 13 Luan Silva,Luan Vinicius da Sil ... T,,P,432222
15,Ederson,Ederson Jose dos San ... T,,P,441979 15 Hernanes,Anderson Hernanes de ... T,,P,173861
19,Robinho,Robson Michael Signorini T,,P,172189 20 Juanfran,Juan Francisco Torre ... T,,P,677535
25,Fabricio B ...,Fabricio Bruno Soare ... T,,P,389228 28 Tche Tche,Danilo das Neves Pinheiro T,,P,308348
26,Dedé,Anderson Vital da Silva T,,P,177749 39 Antony,Antony Matheus dos Santos T,,P,442146
12,Rafael,Rafael Pires Monteiro R(g),,P,180213 1 Jean,Jean Paulo Fernandes ... R(g),,P,420409
5,Ariel Cabral,Alejandro Ariel Cabral R,,P,535421 2 Igor,Igor Vinicius de Souza R,,P,355675
14,Cacá,Carlos de Menezes Junior R,,P,510110 11 Hélio Junio,Helio Junio Nunes de ... R,,P,464258
17,Ezequiel,Ezequiel Santos da Silva R,,P,418697 12 Vitor Bueno,Vitor Frezarin Bueno R,,P,322748
18,Dodo,Jose Rodolfo Pires R ... R,,P,187787 14 Igor,Igor Matheus Liziero ... R,,P,344934
20,Marquinhos ...,Marcos Gabriel do Na ... R,,P,190389 16 Léo,Leonardo Pinheiro da ... R,,P,346294
27,Jadson,Jadson Alves dos Santos R,,P,302192 19 Marcos Cal ...,Marcos Vinicius Silv ... R,,P,408877
37,Joel,Diederrick Joel Tagu ... R,,P,402984 21 Raniel,Raniel Santana de Va ... R,,P,447783
41,Mauricio,Mauricio Magalhaes Prado R,,P,542337 25 Hudson,Hudson Rodrigues dos ... R,,P,176729
42,Weverton,Weverton Guilherme d ... R,,P,537549 26 Igor,Igor Silveira Gomes R,,P,337713
43,Edu,Lucas Eduardo Ribeir ... R,,P,509619 42 Gabriel,Gabriel Davi Gomes Sara R,,P,432218
99,Sassá,Luiz Ricardo Alves R,,P,337172 43 Walce,Walce da Silva Costa ... R,,P,432206
No,Apelido,Nome Completo T/R,,P/A,CBF,No,Apelido,Nome Completo T/R,,P/A,CBF
1,Fabio,Fabio Deivson Lopes  ... T(g),,P,129292,23,Tiago Volpi,Tiago Luis Volpi T(g),,P,291584
2,Edilson,Edilson Mendes Guimaraes T,,P,161745,3,Bruno Alves,Bruno Fabiano Alves T,,P,312015
6,Egidio,Egidio de Araujo Per ... T,,P,157280,5,Arboleda,Robert Abel Arboleda ... T,,P,595193
8,Henrique,Henrique Pacheco de Lima T,,P,170812,6,Reinaldo,Reinaldo Manoel da Silva T,,P,332318
9,Fred,Frederico Chaves Guedes T,,P,148994,7,Alexandre  ...,Alexandre Rodrigues  ... T,,P,177588
10,Thiago Neves,Thiago Neves Augusto T,,P,169888,10,Dani Alves,Daniel Alves da Silva T,,P,144094
11,David,David Correia da Fonseca T,,P,430588,13,Luan Silva,Luan Vinicius da Sil ... T,,P,432222
15,Ederson,Ederson Jose dos San ... T,,P,441979,15,Hernanes,Anderson Hernanes de ... T,,P,173861
19,Robinho,Robson Michael Signorini T,,P,172189,20,Juanfran,Juan Francisco Torre ... T,,P,677535
25,Fabricio B ...,Fabricio Bruno Soare ... T,,P,389228,28,Tche Tche,Danilo das Neves Pinheiro T,,P,308348
26,Dedé,Anderson Vital da Silva T,,P,177749,39,Antony,Antony Matheus dos Santos T,,P,442146
12,Rafael,Rafael Pires Monteiro R(g),,P,180213,1,Jean,Jean Paulo Fernandes ... R(g),,P,420409
5,Ariel Cabral,Alejandro Ariel Cabral R,,P,535421,2,Igor,Igor Vinicius de Souza R,,P,355675
14,Cacá,Carlos de Menezes Junior R,,P,510110,11,Hélio Junio,Helio Junio Nunes de ... R,,P,464258
17,Ezequiel,Ezequiel Santos da Silva R,,P,418697,12,Vitor Bueno,Vitor Frezarin Bueno R,,P,322748
18,Dodo,Jose Rodolfo Pires R ... R,,P,187787,14,Igor,Igor Matheus Liziero ... R,,P,344934
20,Marquinhos ...,Marcos Gabriel do Na ... R,,P,190389,16,Léo,Leonardo Pinheiro da ... R,,P,346294
27,Jadson,Jadson Alves dos Santos R,,P,302192,19,Marcos Cal ...,Marcos Vinicius Silv ... R,,P,408877
37,Joel,Diederrick Joel Tagu ... R,,P,402984,21,Raniel,Raniel Santana de Va ... R,,P,447783
41,Mauricio,Mauricio Magalhaes Prado R,,P,542337,25,Hudson,Hudson Rodrigues dos ... R,,P,176729
42,Weverton,Weverton Guilherme d ... R,,P,537549,26,Igor,Igor Silveira Gomes R,,P,337713
43,Edu,Lucas Eduardo Ribeir ... R,,P,509619,42,Gabriel,Gabriel Davi Gomes Sara R,,P,432218
99,Sassá,Luiz Ricardo Alves R,,P,337172,43,Walce,Walce da Silva Costa ... R,,P,432206
"",,Comissão Técnica,
"",Cruzeiro / MG,,São Paulo / SP
Técnico:,Abel Carlos Da Silva Braga,Técnico:,Fernando Diniz Silva
Auxiliar Técnico:,Leomir De Souza,Auxiliar Técnico:,Marcio Longo De Araujo
Médico:,Sergio Augusto Campolina De Azeredo,Médico:,Carlos Tadeu Moreno
Treinador De Goleiros:,Roberto Barbosa Dos Santos,Treinador De Goleiros:,Marco Antonio Trocourt
Preparador Físico:,Anderson Goncalves Nicolau,Preparador Físico:,Wagner Bertelli
Fisioterapeuta:,Ronner Fabiano Bolognani De Barros,Massagista:,Ailton Rodrigues
"",,,,,Gols,
Tempo,1T/2T,No,Tipo,Nome do Jogador,,Equipe
13:00,2T,10,NR,Thiago Neves Augusto,,Cruzeiro/MG
"",,,,Substituições,
Tempo,1T/2T,,Equipe,Entrou,Saiu
45:00,INT,Cruzeiro/MG,,20 - Marcos Gabriel do Nascimento,19 - Robson Michael Signorini
45:00,INT,São Paulo/SP,,12 - Vitor Frezarin Bueno,20 - Juan Francisco Torres Belen
18:00,2T,São Paulo/SP,,26 - Igor Silveira Gomes,15 - Anderson Hernanes de Carvalh...
28:00,2T,Cruzeiro/MG,,27 - Jadson Alves dos Santos,15 - Ederson Jose dos Santos Lour...
31:00,2T,Cruzeiro/MG,,5 - Alejandro Ariel Cabral,11 - David Correia da Fonseca
31:00,2T,São Paulo/SP,,14 - Igor Matheus Liziero Pereira,13 - Luan Vinicius da Silva Santos
