Campeonato:,Campeonato Brasileiro - Série A/2019,,Rodada:,23
Jogo:,São Paulo / SP X Fortaleza / CE,,,
Data:,05/10/2019 Horário: 17:00 Estádio:,Paulo Machado de Carvalho / Sao Paulo,,
"",,Arbitragem
Arbitro:,Diego Pombo Lopez (AB / BA),
Arbitro Assistente 1:,Alessandro Alvaro Rocha de Matos (FIFA / BA),
Arbitro Assistente 2:,Elicarlos Franco de Oliveira (AB / BA),
Quarto Arbitro:,Leandro Bizzio Marinho (AB / SP),
Delegado Local:,Flaubert Dias Machado (CBF / SP),
Analista de Campo:,Luiz Vanderlei Martinucho (CBF / SP),
VAR:,Rodrigo D'alonso Ferreira (AB / SC),
AVAR1:,Rodrigo Batista Raposo (AB / DF),
AVAR2:,Ciro Chaban Junqueira (AB / DF),
"",,,,Cronologia,,,
"",1o Tempo,,,2o Tempo,,,
Entrada do mandante:,16:53Atraso:,,2 min,Entrada do mandante: 18:07,,Atraso:,2 min
Entrada do visitante:,16:51Atraso:,,Não Houve,Entrada do visitante: 18:08,,Atraso:,3 min
Início 1o Tempo:,17:02Atraso:,,2 min,Início do 2o Tempo: 18:09,,Atraso:,2 min
Término do 1o Tempo:,17:52Acréscimo:,,5 min,Término do 2o Tempo: 18:58,Acréscimo:,,4 min
Resultado do 1o Tempo: 1 X 1,,,,Resultado Final: 2 X 1,,,
"",,,,,Relação de Jogadores,,,,
"",,São Paulo / SP,,,,Fortaleza / CE,,,
No,Apelido,Nome Completo T/R,,P/A,CBF No Apelido,Nome Completo T/R,,P/A,CBF
23,Tiago Volpi,Tiago Luis Volpi T(g),,P,291584 1 Marcelo Boeck,Marcelo Boeck T(g),,P,154969
3,Bruno Alves,Bruno Fabiano Alves T,,P,312015 3 Juan Quintero,Juan Sebastian Quint ... T,,P,646848
5,Arboleda,Robert Abel Arboleda ... T,,P,595193 6 Carlinho,Carlos Emiliano Pereira T,,P,186140
6,Reinaldo,Reinaldo Manoel da Silva T,,P,332318 7 Edinho,Francisco Edson More ... T,,P,377355
9,Pablo,Pablo Felipe Teixeira T,,P,307317 9 Wellington ...,Wellington Pereira d ... T,,P,152788
10,Dani Alves,Daniel Alves da Silva T,,P,144094 11 Osvaldo,Osvaldo Lourenco Filho T,,P,177411
13,Luan Silva,Luan Vinicius da Sil ... T,,P,432222 13 Gabriel,Gabriel Dias de Oliveira T,,P,317697
15,Hernanes,Anderson Hernanes de ... T,,P,173861 15 Luis,Luis Antonio Ferreir ... T,,P,420080
20,Juanfran,Juan Francisco Torre ... T,,P,677535 26 Jackson,Jackson de Souza T,,P,299142
28,Tche Tche,Danilo das Neves Pinheiro T,,P,308348 55 Juninho,Paulo Roberto Valour ... T,,P,179395
39,Antony,Antony Matheus dos Santos T,,P,442146 97 Andre Luis,Andre Luis da Costa  ... T,,P,321636
1,Jean,Jean Paulo Fernandes ... R(g),,P,420409 23 Max,Max Walef Araujo da Silva R(g),,P,337210
2,Igor,Igor Vinicius de Souza R,,P,355675 2 Guilherme,Guilherme de Jesus d ... R,,P,348138
4,Anderson,Anderson Vieira Martins R,,P,166258 8 Derley,Wanderley de Jesus Sousa R,,P,166491
11,Hélio Junio,Helio Junio Nunes de ... R,,P,464258 22 Felipe,Felipe Araruna Hoffmann R,,P,356726
12,Vitor Bueno,Vitor Frezarin Bueno R,,P,322748 25 Paulão,Paulo Marcos de Jesu ... R,,P,293393
14,Igor,Igor Matheus Liziero ... R,,P,344934 27 Luis Otavio,Luis Otavio Bonilha  ... R,,P,292740
16,Léo,Leonardo Pinheiro da ... R,,P,346294 28 Marlon,Marlon Adriano Prezotti R,,P,294484
19,Marcos Cal ...,Marcos Vinicius Silv ... R,,P,408877 30 Bruno,Bruno Ferreira Melo R,,P,329952
25,Hudson,Hudson Rodrigues dos ... R,,P,176729 32 Mariano,Mariano Vazquez R,,P,674254
26,Igor,Igor Silveira Gomes R,,P,337713 86 Kieza,Welker Marcal Almeida R,,P,185126
41,Denis de O ...,Denis de Oliveira Ag ... R,,P,451683 95 Felipe,Felipe Augusto Rodri ... R,,P,353107
43,Walce,Walce da Silva Costa ... R,,P,432206 96 Matheus Al ...,Matheus Alessandro d ... R,,P,413284
No,Apelido,Nome Completo T/R,,P/A,CBF,No,Apelido,Nome Completo T/R,,P/A,CBF
23,Tiago Volpi,Tiago Luis Volpi T(g),,P,291584,1,Marcelo Boeck,Marcelo Boeck T(g),,P,154969
3,Bruno Alves,Bruno Fabiano Alves T,,P,312015,3,Juan Quintero,Juan Sebastian Quint ... T,,P,646848
5,Arboleda,Robert Abel Arboleda ... T,,P,595193,6,Carlinho,Carlos Emiliano Pereira T,,P,186140
6,Reinaldo,Reinaldo Manoel da Silva T,,P,332318,7,Edinho,Francisco Edson More ... T,,P,377355
9,Pablo,Pablo Felipe Teixeira T,,P,307317,9,Wellington ...,Wellington Pereira d ... T,,P,152788
10,Dani Alves,Daniel Alves da Silva T,,P,144094,11,Osvaldo,Osvaldo Lourenco Filho T,,P,177411
13,Luan Silva,Luan Vinicius da Sil ... T,,P,432222,13,Gabriel,Gabriel Dias de Oliveira T,,P,317697
15,Hernanes,Anderson Hernanes de ... T,,P,173861,15,Luis,Luis Antonio Ferreir ... T,,P,420080
20,Juanfran,Juan Francisco Torre ... T,,P,677535,26,Jackson,Jackson de Souza T,,P,299142
28,Tche Tche,Danilo das Neves Pinheiro T,,P,308348,55,Juninho,Paulo Roberto Valour ... T,,P,179395
39,Antony,Antony Matheus dos Santos T,,P,442146,97,Andre Luis,Andre Luis da Costa  ... T,,P,321636
1,Jean,Jean Paulo Fernandes ... R(g),,P,420409,23,Max,Max Walef Araujo da Silva R(g),,P,337210
2,Igor,Igor Vinicius de Souza R,,P,355675,2,Guilherme,Guilherme de Jesus d ... R,,P,348138
4,Anderson,Anderson Vieira Martins R,,P,166258,8,Derley,Wanderley de Jesus Sousa R,,P,166491
11,Hélio Junio,Helio Junio Nunes de ... R,,P,464258,22,Felipe,Felipe Araruna Hoffmann R,,P,356726
12,Vitor Bueno,Vitor Frezarin Bueno R,,P,322748,25,Paulão,Paulo Marcos de Jesu ... R,,P,293393
14,Igor,Igor Matheus Liziero ... R,,P,344934,27,Luis Otavio,Luis Otavio Bonilha  ... R,,P,292740
16,Léo,Leonardo Pinheiro da ... R,,P,346294,28,Marlon,Marlon Adriano Prezotti R,,P,294484
19,Marcos Cal ...,Marcos Vinicius Silv ... R,,P,408877,30,Bruno,Bruno Ferreira Melo R,,P,329952
25,Hudson,Hudson Rodrigues dos ... R,,P,176729,32,Mariano,Mariano Vazquez R,,P,674254
26,Igor,Igor Silveira Gomes R,,P,337713,86,Kieza,Welker Marcal Almeida R,,P,185126
41,Denis de O ...,Denis de Oliveira Ag ... R,,P,451683,95,Felipe,Felipe Augusto Rodri ... R,,P,353107
43,Walce,Walce da Silva Costa ... R,,P,432206,96,Matheus Al ...,Matheus Alessandro d ... R,,P,413284
"",,Comissão Técnica,
"",São Paulo / SP,,Fortaleza / CE
Técnico:,Fernando Diniz Silva,Técnico:,Rogerio Ceni
Auxiliar Técnico:,Marcio Longo De Araujo,Auxiliar Técnico:,Nelson Simoes Junior
Médico:,Carlos Tadeu Moreno,Médico:,Claudio Mauricio Muniz Rodrigues
Treinador De Goleiros:,Marco Antonio Trocourt,Treinador De Goleiros:,Jose Augusto Da Cruz Albuquerque
Preparador Físico:,Wagner Bertelli,Preparador Físico:,Danilo Augusto Da Silva
Massagista:,Ailton Rodrigues,Massagista:,Jose Wellington Nunes De Moura
"",,,,,Gols,
Tempo,1T/2T,No,Tipo,Nome do Jogador,,Equipe
15:00,1T,9,NR,Pablo Felipe Teixeira,,São Paulo/SP
38:00,1T,9,PN,Wellington Pereira do Nascimento,,Fortaleza/CE
33:00,2T,26,NR,Igor Silveira Gomes,,São Paulo/SP
"",,,,Substituições,
Tempo,1T/2T,,Equipe,Entrou,Saiu
03:00,2T,Fortaleza/CE,,32 - Mariano Vazquez,97 - Andre Luis da Costa Alfredo
14:00,2T,São Paulo/SP,,12 - Vitor Frezarin Bueno,15 - Anderson Hernanes de Carvalh...
27:00,2T,São Paulo/SP,,26 - Igor Silveira Gomes,20 - Juan Francisco Torres Belen
31:00,2T,Fortaleza/CE,,95 - Felipe Augusto Rodrigues Pires,11 - Osvaldo Lourenco Filho
35:00,2T,Fortaleza/CE,,96 - Matheus Alessandro dos Santo...,7 - Francisco Edson Moreira da S...
