Campeonato:,Campeonato Brasileiro - Série A/2019,,Rodada:,24
Jogo:,Csa / AL X Internacional / RS,,,
Data:,09/10/2019 Horário: 19:15 Estádio:,Rei Pelé / Maceio,,
"",,Arbitragem
Arbitro:,Vinicius Furlan (AB / SP),
Arbitro Assistente 1:,Emerson Augusto de Carvalho (FIFA / SP),
Arbitro Assistente 2:,Enderson Emanoel Turbiani da Silva (AB / SP),
Quarto Arbitro:,Rafael Carlos Salgueiro Lima (CD / AL),
Delegado Local:,Gaspar Lins Feijó ( / AL),
Analista de Campo:,Lydia Pollyana Gomes de Oliveira Castela (CBF / AL),
VAR:,Rodrigo Guarizo Ferreira do Amaral (AB / SP),
AVAR1:,Marcelo de Lima Henrique (MTR / RJ),
AVAR2:,Carlos Henrique Cardoso de Souza (AB / RJ),
"",,,Cronologia,,,
"",1o Tempo,,2o Tempo,,,
Entrada do mandante:,19:05Atraso:,,Não Houve Entrada do mandante: 20:15,,Atraso:,Não Houve
Entrada do visitante:,19:05Atraso:,,Não Houve Entrada do visitante: 20:16,,Atraso:,Não Houve
Início 1o Tempo:,19:15Atraso:,,Não Houve Início do 2o Tempo: 20:18,,Atraso:,Não Houve
Término do 1o Tempo:,20:03Acréscimo:,,3 min Término do 2o Tempo: 21:08,Acréscimo:,,5 min
Resultado do 1o Tempo: 0 X 0,,,Resultado Final: 1 X 0,,,
"",,,,,Relação de Jogadores,,,,
"",,Csa / AL,,,,Internacional / RS,,,
No,Apelido,Nome Completo T/R,,P/A,CBF No Apelido,Nome Completo T/R,,P/A,CBF
12,Jordi,Jordi Martins Almeida T(g),,P,320196 12 Marcelo,Marcelo Lomba do Nas ... T(g),,P,157264
4,Luciano Ca ...,Luciano Castan da Silva T,,P,292282 6 Uendel,Uendel Pereira Goncalves T,,P,175320
5,Naldo,Marinaldo dos Santos ... T,,P,336832 7 Nico Lopez,Nicolas Federico Lop ... T,,P,554821
6,Carlinhos,Carlos Andrade Souza T,,P,173760 8 Edenilson,Edenilson Andrade do ... T,,P,306270
8,Fran,Dawhan Fran Urano da ... T,,P,340115 15 Victor Cuesta,Victor Leandro Cuesta T,,P,567555
9,Ricardo Bueno,Ricardo Bueno da Silva T,,P,179974 17 Neilton,Neilton Meira Mestzk T,,P,316754
15,JEAN CLEBER Jean Cleber Santos d ...,T,,P,291982 19 Rodrigo,Rodrigo Oliveira Lindoso T,,P,184455
17,Ronaldo,Ronaldo Luiz Alves T,,P,174941 20 Emerson,Emerson Raymundo Santos T,,P,348257
18,HECTOR,Hector Ariel Bustama ... T,,P,646505 31 Heitor Rod ...,Heitor Rodrigues da  ... T,,P,464051
20,Apodi,Luiz Diallisson de S ... T,,P,172576 77 G. Parede,Guilherme Parede Pinheiro T,,P,411198
29,Jonatan GomezJonatan David Gomez,T,,P,593809 88 Patrick,Patrick Bezerra do N ... T,,P,315585
1,Joao Carlos,Joao Carlos Heidemann R(g),,P,174755 1 Danilo Fer ...,Danilo Fernandes Batista R(g),,P,165830
10,Nilton,Nilton Ferreira Junior R,,P,163518 2 Bruno,Bruno Vieira do Nasc ... R,,P,172996
11,Jarro,Emilton Pedroso DominguesR,,P,377856 10 Dalessandro,Andres Nicolas Dales ... R,,P,299481
13,Warley,Warley Leandro da Silva R,,P,581767 11 Wellington ...,Wellington Alves da Silva R,,P,306146
14,Lucas,Lucas Vinicius Dias Costa R,,P,427213 16 Rithely,Francisco Rithely da ... R,,P,184833
21,Alisson,Alisson Pelegrini Safira R,,P,351040 21 Bruno Silva,Bruno Cesar Pereira Silva R,,P,169938
22,Celsinho,Celsonil Santos de M ... R,,P,175018 22 Santiago,Santiago Trellez Vivero R,,P,293087
23,Bruno Alves,Bruno Alves de Souza R,,P,360598 29 Sarrafiore,Martin Nicolas Sarrafiore R,,P,632758
26,Rafinha,Rafael Chagas Machado R,,P,177606 37 Zeca,Jose Carlos Cracco Neto R,,P,294382
28,Gerson Jos ...,Gerson Jose Laurenti ... R,,P,503120 41 Pedro Lucas,Pedro Lucas Schwaizer R,,P,365355
31,Fabricio,Fabricio Barros Santana R,,P,178321 42 Daniel,Daniel de Sousa Brito R,,P,331033
99,Alecsandro,Alecsandro Barbosa F ... R,,P,143465 44 Klaus,William Klaus R,,P,360293
No,Apelido Nome Completo,T/R,,P/A,CBF,No,Apelido,Nome Completo T/R,,P/A,CBF
12,Jordi Jordi Martins Almeida,T(g),,P,320196,12,Marcelo,Marcelo Lomba do Nas ... T(g),,P,157264
4,Luciano Ca ... Luciano Castan da Silva,T,,P,292282,6,Uendel,Uendel Pereira Goncalves T,,P,175320
5,Naldo Marinaldo dos Santos ...,T,,P,336832,7,Nico Lopez,Nicolas Federico Lop ... T,,P,554821
6,Carlinhos Carlos Andrade Souza,T,,P,173760,8,Edenilson,Edenilson Andrade do ... T,,P,306270
8,Fran Dawhan Fran Urano da ...,T,,P,340115,15,Victor Cuesta,Victor Leandro Cuesta T,,P,567555
9,Ricardo Bueno Ricardo Bueno da Silva,T,,P,179974,17,Neilton,Neilton Meira Mestzk T,,P,316754
15,JEAN CLEBER Jean Cleber Santos d ...,T,,P,291982,19,Rodrigo,Rodrigo Oliveira Lindoso T,,P,184455
17,Ronaldo Ronaldo Luiz Alves,T,,P,174941,20,Emerson,Emerson Raymundo Santos T,,P,348257
18,HECTOR Hector Ariel Bustama ...,T,,P,646505,31,Heitor Rod ...,Heitor Rodrigues da  ... T,,P,464051
20,Apodi Luiz Diallisson de S ...,T,,P,172576,77,G. Parede,Guilherme Parede Pinheiro T,,P,411198
29,Jonatan GomezJonatan David Gomez,T,,P,593809,88,Patrick,Patrick Bezerra do N ... T,,P,315585
1,Joao Carlos Joao Carlos Heidemann,R(g),,P,174755,1,Danilo Fer ...,Danilo Fernandes Batista R(g),,P,165830
10,Nilton Nilton Ferreira Junior,R,,P,163518,2,Bruno,Bruno Vieira do Nasc ... R,,P,172996
11,Jarro Emilton Pedroso DominguesR,,,P,377856,10,Dalessandro,Andres Nicolas Dales ... R,,P,299481
13,Warley Warley Leandro da Silva,R,,P,581767,11,Wellington ...,Wellington Alves da Silva R,,P,306146
14,Lucas Lucas Vinicius Dias Costa,R,,P,427213,16,Rithely,Francisco Rithely da ... R,,P,184833
21,Alisson Alisson Pelegrini Safira,R,,P,351040,21,Bruno Silva,Bruno Cesar Pereira Silva R,,P,169938
22,Celsinho Celsonil Santos de M ...,R,,P,175018,22,Santiago,Santiago Trellez Vivero R,,P,293087
23,Bruno Alves Bruno Alves de Souza,R,,P,360598,29,Sarrafiore,Martin Nicolas Sarrafiore R,,P,632758
26,Rafinha Rafael Chagas Machado,R,,P,177606,37,Zeca,Jose Carlos Cracco Neto R,,P,294382
28,Gerson Jos ... Gerson Jose Laurenti ...,R,,P,503120,41,Pedro Lucas,Pedro Lucas Schwaizer R,,P,365355
31,Fabricio Fabricio Barros Santana,R,,P,178321,42,Daniel,Daniel de Sousa Brito R,,P,331033
99,Alecsandro Alecsandro Barbosa F ...,R,,P,143465,44,Klaus,William Klaus R,,P,360293
"",,Comissão Técnica,
"",Csa / AL,,Internacional / RS
Técnico:,Argelico Fucks,Técnico:,Odair Hellmann
Auxiliar Técnico:,Glebson Robson Barroso De Lira,Auxiliar Técnico:,Mauricio Correa Dulac
Médico:,Igor De Castro Teixeira,Médico:,Rodrigo Hoffmeister Silva
Treinador De Goleiros:,Gustavo Neppi Scalese,Treinador De Goleiros:,Daniel Da Fonseca Pavan
Preparador Físico:,Daniel Sampaio De Azambuja,Preparador Físico:,Cristiano Garcia Nunes
Fisioterapeuta:,Afonso Celso Brasileiro Borges Junior,Massagista:,Paulo Renato Aviz Da Silva
"",,,,,Gols,
Tempo,1T/2T,No,Tipo,Nome do Jogador,,Equipe
20:00,2T,29,PN,Jonatan David Gomez,,Csa/AL
"",,,,Substituições,
Tempo,1T/2T,,Equipe,Entrou,Saiu
22:00,1T,Csa/AL,,99 - Alecsandro Barbosa Felisbino,9 - Ricardo Bueno da Silva
32:00,1T,Internacional/RS,,44 - William Klaus,20 - Emerson Raymundo Santos
07:00,2T,Internacional/RS,,10 - Andres Nicolas Dalessandro,17 - Neilton Meira Mestzk
24:00,2T,Csa/AL,,23 - Bruno Alves de Souza,20 - Luiz Diallisson de Souza Alves
24:00,2T,Internacional/RS,,11 - Wellington Alves da Silva,6 - Uendel Pereira Goncalves
43:00,2T,Csa/AL,,11 - Emilton Pedroso Domingues,18 - Hector Ariel Bustamante Lopez
