Campeonato:,Campeonato Brasileiro - Série A/2019,,Rodada:,15
Jogo:,São Paulo / SP X Ceará / CE,,,
Data:,18/08/2019 Horário: 16:00 Estádio:,Cícero Pompeu de Toledo / Sao Paulo,,
"",Arbitragem
Arbitro:,Gilberto Rodrigues Castro Junior (AB / PE)
Arbitro Assistente 1:,Cleriston Clay Barreto Rios (MTR / SE)
Arbitro Assistente 2:,Clovis Amaral da Silva (AB / PE)
Quarto Arbitro:,Thiago Luis Scarascati (CD / SP)
Delegado Local:,Walter Lima Coelho Junior (CBF / SP)
Analista de Campo:,Roberto Perassi (CBF / SP)
VAR:,Rodrigo Nunes de Sa (AB / RJ)
AVAR1:,Joao Batista de Arruda (AB / RJ)
AVAR2:,Michael Correia (AB / RJ)
"",,,,Cronologia,,,
"",1o Tempo,,,2o Tempo,,,
Entrada do mandante:,15:53Atraso:,,2 min,Entrada do mandante: 17:04,,Atraso:,1 min
Entrada do visitante:,15:50Atraso:,,Não Houve,Entrada do visitante: 17:04,,Atraso:,1 min
Início 1o Tempo:,16:02Atraso:,,2 min,Início do 2o Tempo: 17:06,,Atraso:,1 min
Término do 1o Tempo:,16:50Acréscimo:,,3 min,Término do 2o Tempo: 17:57,Acréscimo:,,6 min
Resultado do 1o Tempo: 1 X 0,,,,Resultado Final: 1 X 0,,,
"",,,,,Relação de Jogadores,,,,
"",,São Paulo / SP,,,,Ceará / CE,,,
No,Apelido,Nome Completo T/R,,P/A,CBF No Apelido,Nome Completo T/R,,P/A,CBF
23,Tiago Volpi,Tiago Luis Volpi T(g),,P,291584 12 Diogo Silva,Diogo Jose Goncalves ... T(g),,P,165094
3,Bruno Alves,Bruno Fabiano Alves T,,P,312015 3 Valdo,Andrevaldo de Jesus  ... T,,P,326990
4,Anderson,Anderson Vieira Martins T,,P,166258 6 Joao Lucas,Joao Lucas Cardoso T,,P,303237
6,Reinaldo,Reinaldo Manoel da Silva T,,P,332318 8 Ricardinho,Ricardo Dias Acosta T,,P,169114
10,Dani Alves,Daniel Alves da Silva T,,P,144094 13 Luiz,Luiz Otavio Anacleto ... T,,P,291651
14,Igor,Igor Matheus Liziero ... T,,P,344934 19 Fabinho,Fabio Goncalves T,,P,175065
20,Juanfran,Juan Francisco Torre ... T,,P,677535 22 Samuel,Samuel Xavier Brito T,,P,292428
21,Raniel,Raniel Santana de Va ... T,,P,447783 45 Lima,Vinicius Moreira de Lima T,,P,403112
22,Everton,Everton Cardoso da Silva T,,P,178361 82 Leandro,Leandro Carvalho da Silva T,,P,417861
28,Tche Tche,Danilo das Neves Pinheiro T,,P,308348 89 Thiago,Thiago Galhardo do N ... T,,P,189822
39,Antony,Antony Matheus dos Santos T,,P,442146 98 Felippe Ca ...,Wanderson Felippe Ca ... T,,P,536862
1,Jean,Jean Paulo Fernandes ... R(g),,P,420409 1 Lucas França,Lucas Oliveira de França R(g),,P,357971
2,Igor,Igor Vinicius de Souza R,,P,355675 2 Cristovam,Cristovam Roberto Ri ... R,,P,188472
11,Hélio Junio,Helio Junio Nunes de ... R,,P,464258 7 Mateus Gon ...,Mateus Goncalves Martins R,,P,316729
12,Vitor Bueno,Vitor Frezarin Bueno R,,P,322748 10 Felipe,Felipe de Oliveira Silva R,,P,189538
13,Luan Silva,Luan Vinicius da Sil ... R,,P,432222 11 Fernando,Fernando Pereira do  ... R,,P,399713
16,Léo,Leonardo Pinheiro da ... R,,P,346294 27 Wescley,Wescley Gomes dos Santos R,,P,297441
17,Willian,Willian Roberto de Farias R,,P,180083 36 Tiago,Tiago dos Santos Alves R,,P,167723
18,Everton Fe ...,Everton Felipe de Ol ... R,,P,381047 55 Willian,Willian Oliveira dos ... R,,P,430883
19,Marcos Cal ...,Marcos Vinicius Silv ... R,,P,408877 77 Bergson,Bergson Gustavo Silv ... R,,P,191433
25,Hudson,Hudson Rodrigues dos ... R,,P,176729,,,,
26,Igor,Igor Silveira Gomes R,,P,337713,,,,
43,Walce,Walce da Silva Costa ... R,,P,432206,,,,
No,Apelido,Nome Completo T/R,,P/A,CBF,No,Apelido,Nome Completo T/R,,P/A,CBF
23,Tiago Volpi,Tiago Luis Volpi T(g),,P,291584,12,Diogo Silva,Diogo Jose Goncalves ... T(g),,P,165094
3,Bruno Alves,Bruno Fabiano Alves T,,P,312015,3,Valdo,Andrevaldo de Jesus  ... T,,P,326990
4,Anderson,Anderson Vieira Martins T,,P,166258,6,Joao Lucas,Joao Lucas Cardoso T,,P,303237
6,Reinaldo,Reinaldo Manoel da Silva T,,P,332318,8,Ricardinho,Ricardo Dias Acosta T,,P,169114
10,Dani Alves,Daniel Alves da Silva T,,P,144094,13,Luiz,Luiz Otavio Anacleto ... T,,P,291651
14,Igor,Igor Matheus Liziero ... T,,P,344934,19,Fabinho,Fabio Goncalves T,,P,175065
20,Juanfran,Juan Francisco Torre ... T,,P,677535,22,Samuel,Samuel Xavier Brito T,,P,292428
21,Raniel,Raniel Santana de Va ... T,,P,447783,45,Lima,Vinicius Moreira de Lima T,,P,403112
22,Everton,Everton Cardoso da Silva T,,P,178361,82,Leandro,Leandro Carvalho da Silva T,,P,417861
28,Tche Tche,Danilo das Neves Pinheiro T,,P,308348,89,Thiago,Thiago Galhardo do N ... T,,P,189822
39,Antony,Antony Matheus dos Santos T,,P,442146,98,Felippe Ca ...,Wanderson Felippe Ca ... T,,P,536862
1,Jean,Jean Paulo Fernandes ... R(g),,P,420409,1,Lucas França,Lucas Oliveira de França R(g),,P,357971
2,Igor,Igor Vinicius de Souza R,,P,355675,2,Cristovam,Cristovam Roberto Ri ... R,,P,188472
11,Hélio Junio,Helio Junio Nunes de ... R,,P,464258,7,Mateus Gon ...,Mateus Goncalves Martins R,,P,316729
12,Vitor Bueno,Vitor Frezarin Bueno R,,P,322748,10,Felipe,Felipe de Oliveira Silva R,,P,189538
13,Luan Silva,Luan Vinicius da Sil ... R,,P,432222,11,Fernando,Fernando Pereira do  ... R,,P,399713
16,Léo,Leonardo Pinheiro da ... R,,P,346294,27,Wescley,Wescley Gomes dos Santos R,,P,297441
17,Willian,Willian Roberto de Farias R,,P,180083,36,Tiago,Tiago dos Santos Alves R,,P,167723
18,Everton Fe ...,Everton Felipe de Ol ... R,,P,381047,55,Willian,Willian Oliveira dos ... R,,P,430883
19,Marcos Cal ...,Marcos Vinicius Silv ... R,,P,408877,77,Bergson,Bergson Gustavo Silv ... R,,P,191433
25,Hudson,Hudson Rodrigues dos ... R,,P,176729,,,,,,
26,Igor,Igor Silveira Gomes R,,P,337713,,,,,,
43,Walce,Walce da Silva Costa ... R,,P,432206,,,,,,
"",,Comissão Técnica,
"",São Paulo / SP,,Ceará / CE
Técnico:,Alexi Stival,Técnico:,Enderson Alves Moreira
Auxiliar Técnico:,Avlamir Dirceo Stival,Auxiliar Técnico:,Luis Fernando Rosa Flores
Médico:,Carlos Tadeu Moreno,Médico:,Joaquim Sampaio Garcia Filho
Treinador De Goleiros:,Marco Antonio Trocourt,Treinador De Goleiros:,Everaldo Goncalves Santana
Preparador Físico:,Pedro Augusto Biccari Franco De Campos,Preparador Físico:,Edy Carlos Toporowicz
Massagista:,Ailton Rodrigues,Fisioterapeuta:,Wellington Lima De Alencar
"",,,,,Gols,
Tempo,1T/2T,No,Tipo,Nome do Jogador,,Equipe
39:00,1T,10,NR,Daniel Alves da Silva,,São Paulo/SP
"",,,,Substituições,
Tempo,1T/2T,,Equipe,Entrou,Saiu
07:00,2T,Ceará/CE,,36 - Tiago dos Santos Alves,13 - Luiz Otavio Anacleto Leandro
17:00,2T,São Paulo/SP,,13 - Luan Vinicius da Silva Santos,14 - Igor Matheus Liziero Pereira
26:00,2T,Ceará/CE,,7 - Mateus Goncalves Martins,82 - Leandro Carvalho da Silva
26:00,2T,São Paulo/SP,,12 - Vitor Frezarin Bueno,39 - Antony Matheus dos Santos
34:00,2T,Ceará/CE,,27 - Wescley Gomes dos Santos,45 - Vinicius Moreira de Lima
36:00,2T,São Paulo/SP,,11 - Helio Junio Nunes de Castro,22 - Everton Cardoso da Silva
