Campeonato:,Campeonato Brasileiro - Série A/2019,,Rodada:,21
Jogo:,Chapecoense / SC X Corinthians / SP,,,
Data:,02/10/2019 Horário: 19:15 Estádio:,Índio Condá / Chapeco,,
"",,Arbitragem
Arbitro:,Daniel Nobre Bins (AB / RS),
Arbitro Assistente 1:,Lucio Beiersdorf Flor (AB / RS),
Arbitro Assistente 2:,Andre da Silva Bitencourt (AB / RS),
Quarto Arbitro:,Fernando Henrique de Medeiros Miranda (CD / SC),
Delegado Local:,Weliton Brasil Ribeiro ( / ),
Analista de Campo:,Fernando Lopes (CBF / SC),
VAR:,Rodrigo Nunes de Sa (AB / RJ),
AVAR1:,Grazianni Maciel Rocha (AB / RJ),
AVAR2:,Michael Stanislau (AB / RS),
"",,,Cronologia,,,
"",1o Tempo,,2o Tempo,,,
Entrada do mandante:,19:05Atraso:,,Não Houve Entrada do mandante: 20:14,,Atraso:,Não Houve
Entrada do visitante:,19:05Atraso:,,Não Houve Entrada do visitante: 20:13,,Atraso:,Não Houve
Início 1o Tempo:,19:15Atraso:,,Não Houve Início do 2o Tempo: 20:16,,Atraso:,Não Houve
Término do 1o Tempo:,20:01Acréscimo:,,1 min Término do 2o Tempo: 21:05,Acréscimo:,,4 min
Resultado do 1o Tempo: 0 X 0,,,Resultado Final: 0 X 1,,,
"",,,,,Relação de Jogadores,,,,
"",,Chapecoense / SC,,,,Corinthians / SP,,,
No,Apelido,Nome Completo,T/R,P/A,CBF No Apelido,Nome Completo T/R,,P/A,CBF
98,Tiepo,Giovanni Silva Tiepo,T(g),P,365361 12 Cássio,Cassio Ramos T(g),,P,166276
2,Eduardo,Carlos Eduardo Santo ...,T,P,170077 4 Manoel,Manoel Messias Silva ... T,,P,182423
6,Bruno Pacheco Bruno de Jesus Pacheco,,T,P,333975 9 Vagner Love,Vagner Silva de Souza T,,P,153924
8,Marcio Araujo,Marcio Rodrigues Araujo,T,P,162907 11 Junior Urso,Ocimar de Almeida Junior T,,P,292357
23,Douglas,Douglas Silva Bacelar,T,P,295957 15 Ralf,Ralf de Souza Teles T,,P,168387
27,Arthur,Arthur Gomes Lourenco,T,P,387808 22 Mateus,Mateus da Silva Vita ... T,,P,405246
33,Rafael,Rafael Pereira dos Santos,T,P,170563 23 Fagner,Fagner Conserva Lemos T,,P,177050
55,Amaral,William Jose de Souza,T,P,169939 25 Clayson,Clayson Henrique da  ... T,,P,376734
77,Everaldo,Everaldo Stum,T,P,306852 26 Gil,Carlos Gilberto do N ... T,,P,178854
88,Camilo,Fernando Camilo Farias,T,P,161437 35 Danilo,Danilo Fernando Avelar T,,P,183755
90,Roberto,Roberto Heuchayer Sa ...,T,P,188110 38 Pedro,Pedro Victor Delmino ... T,,P,429638
95,Elias,Elias Martello Curzel,R(g),P,360921 1 Caique,Caique Franca Godoy R(g),,P,313131
1,João Ricardo,Joao Ricardo Riedi,R,P,298660 2 Michel,Michel Macedo Rocha  ... R,,P,179288
3,Gum,Welington Pereira Ro ...,R,P,167958 5 Gabriel,Gabriel Girotto Franco R,,P,320839
9,Renato Kayzer,Renato Kayzer de Souza,R,P,337840 6 Carlos,Carlos Augusto Zopol ... R,,P,410804
12,Diego Torres,Diego Fabian Torres,R,P,633725 7 Sornoza,Junior Nazareno Sorn ... R,,P,565315
18,Aylon,Aylon Darwin Tavella,R,P,355362 14 Bruno Mendez,Bruno Mendez Cittadini R,,P,648335
19,Renato,Jose Renato da Silva ...,R,P,306019 17 Boselli,Mauro Boselli R,,P,646471
20,Augusto Cesar,Augusto Cesar dos Sa ...,R,P,295119 18 Matheus So ...,Matheus Sousa de Jesus R,,P,457323
44,Mauricio,Mauricio Donizeti Ra ...,R,P,169728 19 Gustavo,Gustavo Henrique da  ... R,,P,453172
63,Vinicius,Vinicius Farias Locatelli,R,P,465659 27 Walter,Walter Leandro Capel ... R,,P,177853
83,Regis,Regis Tosatti Giacomin,R,P,365346 28 Ramiro,Ramiro Moschen Benetti R,,P,295418
85,Tharlis,Tharlis Sartori,R,P,365352 31 Janderson,Janderson Santos de Souza R,,P,523883
No,Apelido Nome Completo,,T/R,P/A,CBF,No,Apelido,Nome Completo T/R,,P/A,CBF
98,Tiepo Giovanni Silva Tiepo,,T(g),P,365361,12,Cássio,Cassio Ramos T(g),,P,166276
2,Eduardo Carlos Eduardo Santo ...,,T,P,170077,4,Manoel,Manoel Messias Silva ... T,,P,182423
6,Bruno Pacheco Bruno de Jesus Pacheco,,T,P,333975,9,Vagner Love,Vagner Silva de Souza T,,P,153924
8,Marcio Araujo Marcio Rodrigues Araujo,,T,P,162907,11,Junior Urso,Ocimar de Almeida Junior T,,P,292357
23,Douglas Douglas Silva Bacelar,,T,P,295957,15,Ralf,Ralf de Souza Teles T,,P,168387
27,Arthur Arthur Gomes Lourenco,,T,P,387808,22,Mateus,Mateus da Silva Vita ... T,,P,405246
33,Rafael Rafael Pereira dos Santos,,T,P,170563,23,Fagner,Fagner Conserva Lemos T,,P,177050
55,Amaral William Jose de Souza,,T,P,169939,25,Clayson,Clayson Henrique da  ... T,,P,376734
77,Everaldo Everaldo Stum,,T,P,306852,26,Gil,Carlos Gilberto do N ... T,,P,178854
88,Camilo Fernando Camilo Farias,,T,P,161437,35,Danilo,Danilo Fernando Avelar T,,P,183755
90,Roberto Roberto Heuchayer Sa ...,,T,P,188110,38,Pedro,Pedro Victor Delmino ... T,,P,429638
95,Elias Elias Martello Curzel,,R(g),P,360921,1,Caique,Caique Franca Godoy R(g),,P,313131
1,João Ricardo Joao Ricardo Riedi,,R,P,298660,2,Michel,Michel Macedo Rocha  ... R,,P,179288
3,Gum Welington Pereira Ro ...,,R,P,167958,5,Gabriel,Gabriel Girotto Franco R,,P,320839
9,Renato Kayzer Renato Kayzer de Souza,,R,P,337840,6,Carlos,Carlos Augusto Zopol ... R,,P,410804
12,Diego Torres Diego Fabian Torres,,R,P,633725,7,Sornoza,Junior Nazareno Sorn ... R,,P,565315
18,Aylon Aylon Darwin Tavella,,R,P,355362,14,Bruno Mendez,Bruno Mendez Cittadini R,,P,648335
19,Renato Jose Renato da Silva ...,,R,P,306019,17,Boselli,Mauro Boselli R,,P,646471
20,Augusto Cesar Augusto Cesar dos Sa ...,,R,P,295119,18,Matheus So ...,Matheus Sousa de Jesus R,,P,457323
44,Mauricio Mauricio Donizeti Ra ...,,R,P,169728,19,Gustavo,Gustavo Henrique da  ... R,,P,453172
63,Vinicius Vinicius Farias Locatelli,,R,P,465659,27,Walter,Walter Leandro Capel ... R,,P,177853
83,Regis Regis Tosatti Giacomin,,R,P,365346,28,Ramiro,Ramiro Moschen Benetti R,,P,295418
85,Tharlis Tharlis Sartori,,R,P,365352,31,Janderson,Janderson Santos de Souza R,,P,523883
"",,Comissão Técnica,
"",Chapecoense / SC,,Corinthians / SP
Técnico:,Marcos Vinicius Santos Goncalves,Técnico:,Fabio Luiz Carille De Araujo
Auxiliar Técnico:,Edison Luiz Ferreira Borges,Auxiliar Técnico:,Fabio Alves Felix
Médico:,Carlos Henrique Mendonca Silva,Médico:,Julio Stancati Filho
Treinador De Goleiros:,Andre Croda Borges,Treinador De Goleiros:,Leandro Idalino Alves Porfirio
Preparador Físico:,Alexandre Lopes,Preparador Físico:,Walmir Da Cruz
Massagista:,Adriano Antonio Ferreira De Jesus,Massagista:,Cleber Costa De Souza
"",,,,,Gols,
Tempo,1T/2T,No,Tipo,Nome do Jogador,,Equipe
18:00,1T,35,NR,Danilo Fernando Avelar,,Corinthians/SP
"",,,Substituições,
Tempo,1T/2T,Equipe,Entrou,Saiu
45:00,INT,Corinthians/SP,7 - Junior Nazareno Sornoza More...,11 - Ocimar de Almeida Junior
15:00,2T,Corinthians/SP,19 - Gustavo Henrique da Silva So...,38 - Pedro Victor Delmino da Silva
23:00,2T,Chapecoense/SC,83 - Regis Tosatti Giacomin,55 - William Jose de Souza
23:00,2T,Chapecoense/SC,9 - Renato Kayzer de Souza,27 - Arthur Gomes Lourenco
33:00,2T,Chapecoense/SC,63 - Vinicius Farias Locatelli,88 - Fernando Camilo Farias
41:00,2T,Corinthians/SP,31 - Janderson Santos de Souza,9 - Vagner Silva de Souza
