Campeonato:,Campeonato Brasileiro - Série B/2018,,Rodada:,10
Jogo:,Londrina / PR X Juventude / RS,,,
Data:,08/06/2018 Horário: 19:15 Estádio:,Jacy Scaff / Londrina,,
"",,Arbitragem
Arbitro:,Alinor Silva da Paixao (AB / MT),
Arbitro Assistente 1:,Fabio Rodrigo Rubinho (AB / MT),
Arbitro Assistente 2:,Renan Antonio Angelim Rodrigues (AB / MT),
Quarto Arbitro:,Anderson Iraci Guimarães (INT / PR),
Analista de Campo:,Afonso Vitor de Oliveira (CBF / PR),
"",,,Cronologia,,,
"",1o Tempo,,2o Tempo,,,
Entrada do mandante:,19:05Atraso:,,Não Houve Entrada do mandante: 20:12,,Atraso:,Não Houve
Entrada do visitante:,19:05Atraso:,,Não Houve Entrada do visitante: 20:13,,Atraso:,Não Houve
Início 1o Tempo:,19:15Atraso:,,Não Houve Início do 2o Tempo: 20:16,,Atraso:,Não Houve
Término do 1o Tempo:,20:01Acréscimo:,,01 min Término do 2o Tempo: NaN:NaN,Acréscimo:,,04 min
Resultado do 1o Tempo: 0 X 1,,,Resultado Final: 0 X 1,,,
"",,,,,Relação de Jogadores,,,,
"",,Londrina / PR,,,,Juventude / RS,,,
No,Apelido,Nome Completo T/R,,P/A,CBF No Apelido,Nome Completo T/R,,P/A,CBF
1,Vagner,Vagner Antonio Brandalise T(g),,P,191609 1 Matheus,Matheus Fernando Cav... T(g),,P,168926
2,Reginaldo,Reginaldo Lopes de Jesus T,,P,353336 2 Vidal,Cristiano da Silva Vidal T,,P,329349
3,Dirceu,Dirceu Wiggers de Ol ... T,,P,174541 3 Rafael Bonfim,Rafael de Jesus Bonfim T,,P,312847
4,Lucas,Lucas Rodrigues Costa T,,P,345098 4 Micael,Micael Jordane Modinger T,,P,177261
5,Moises,Moises Wolschick T,,P,346833 5 Bertotto,Matheus Hanauer Bertotto T,,P,346588
6,Roberto,Roberto Heuchayer Sa ... T,,P,188110 6 Neuton,Neuton Sergio Piccoli T,,P,183914
7,Alisson,Alisson Pelegrini Safira T,,P,351040 7 Tony,Antonio de Moura Carvalho T,,P,176981
8,Jardel,Jardel Lauermann T,,P,167975 8 Diones,Diones Coelho da Costa T,,P,172714
9,Paulo Henr ...,Paulo Henrique Ribei ... T,,P,331859 9 Ricardo,Ricardo Jesus da Silva T,,P,164172
10,Thomas,Thomas Jaguaribe Bed ... T,,P,307432 10 Leandro Lima,George Leandro Abreu... T,,P,335303
11,Felipe Mar ...,Felipe Marques da Silva T,,P,363480 11 Choco,Guilherme de Souza T,,P,303465
12,Alan,Alan Jose Bernardon R(g),,P,326968 12 Douglas,Douglas da Silva Ferreira R(g),,P,308580
13,Leandro Al ...,Leandro Almeida da Silva R,,P,174348 13 Mauricio,Mauricio da Silva Di... R,,P,333809
14,Luizao,Walter Luiz Silva de ... R,,P,301156 14 Rodrigo,Rodrigo Vasconcelos ... R,,P,302774
15,Lucas Ramon,Lucas Ramon Batista Silva R,,P,376828 15 Bruno Ribeiro,Bruno de Paula Ribei... R,,P,160939
16,Fernando J ...,Fernando Antonio da  ... R,,P,405888 16 Amaral,Anderson Omar Lima d... R,,P,292274
17,Diego,Diego Fernando Lorensi R,,P,183626 17 Jair,Jair Rodrigues Junior R,,P,347809
18,Matheus,Matheus do Amaral Olavo R,,P,313743 18 Maicon,Maicon Joao Veiga da... R,,P,331239
19,Marcelo,Marcelo Antonio de O ... R,,P,508210 19 Douglas Ke ...,Douglas Wilson Kemmer R,,P,501227
20,Dudu,Luiz Eduardo Figueiredo R,,P,188494 20 Bruno,Bruno Henrique Camil... R,,P,402360
21,Thiago Rib ...,Thiago Ribeiro Cardoso R,,P,164974 21 Arthur Taufer,Arthur Felipe Taufer... R,,P,457972
22,Anderson,Anderson de Oliveira ... R,,P,521065,,,,
23,Luccas,Luccas do Brasil Ces ... R,,P,383668,,,,
"",,Comissão Técnica,
"",Londrina / PR,,Juventude / RS
Técnico:,MARCOS VINICIUS SANTOS GONCALVES,Técnico:,JULIO CESAR VALDUGA CAMARGO
Auxiliar Técnico:,EDISON LUIZ FERREIRA BORGES,Auxiliar Técnico:,VALDEMAR FERNANDES JUNIOR
Médico:,CIRO VERONESE DOS SANTOS,Médico:,MARCIO SERIKAWA DE MEDEIROS
Treinador De Goleiros:,EDSON LUIZ DA SILVA,Treinador De Goleiros:,MARCIO RODRIGO ANGONESE
Preparador Físico:,JOAO CARLOS MARTINS RUIZ,Preparador Físico:,RODRIGO POLETTO
Fisioterapeuta:,MARCELO FELIPE BARBOSA ROCKENBACH,Massagista:,ELTON VIEIRA DE VARGAS
"",,,,,Gols,
Tempo,1T/2T,No,Tipo,Nome do Jogador,,Equipe
+1,1T,3,NR,Rafael de Jesus Bonfim,,Juventude/RS
"",,,,Substituições,
Tempo,1T/2T,,Equipe,Entrou,Saiu
15:00,2T,Londrina/PR,,20 - Luiz Eduardo Figueiredo,7 - Alisson Pelegrini Safira
23:00,2T,Juventude/RS,,19 - Douglas Wilson Kemmer,9 - Ricardo Jesus da Silva
27:00,2T,Londrina/PR,,22 - Anderson de Oliveira da Silva,8 - Jardel Lauermann
35:00,2T,Juventude/RS,,15 - Bruno de Paula Ribeiro Ingra...,10 - George Leandro Abreu de Lima
37:00,2T,Juventude/RS,,17 - Jair Rodrigues Junior,8 - Diones Coelho da Costa
40:00,2T,Londrina/PR,,21 - Thiago Ribeiro Cardoso,10 - Thomas Jaguaribe Bedinelli
