Campeonato:,Campeonato Brasileiro - Série B/2018,,Rodada:,10
Jogo:,Guarani / SP X Vila Nova / GO,,,
Data:,09/06/2018 Horário: 16:30 Estádio:,Brinco de Ouro da Princesa / Campinas,,
"",Arbitragem
Arbitro:,Alexandre Vargas Tavares de Jesus (AB / RJ)
Arbitro Assistente 1:,Silbert Faria Sisquim (AB / RJ)
Arbitro Assistente 2:,Carlos Henrique Cardoso de Souza (CD / RJ)
Quarto Arbitro:,Lucas Canetto Bellote (INT / SP)
Delegado Local:,Alessio Gamberini Junior ( / )
Analista de Campo:,Eduardo Cesar Coronado Coelho (CBF / SP)
"",,,Cronologia,,,
"",1o Tempo,,2o Tempo,,,
Entrada do mandante:,16:20Atraso:,,Não Houve Entrada do mandante: 17:30,,Atraso:,Não Houve
Entrada do visitante:,16:20Atraso:,,Não Houve Entrada do visitante: 17:30,,Atraso:,Não Houve
Início 1o Tempo:,16:30Atraso:,,Não Houve Início do 2o Tempo: 17:33,,Atraso:,Não Houve
Término do 1o Tempo:,17:18Acréscimo:,,3 min Término do 2o Tempo: 18:23,Acréscimo:,,5 min
Resultado do 1o Tempo: 0 X 0,,,Resultado Final: 1 X 1,,,
"",,,,,Relação de Jogadores,,,,
"",,Guarani / SP,,,,Vila Nova / GO,,,
No,Apelido,Nome Completo T/R,,P/A,CBF No Apelido,Nome Completo T/R,,P/A,CBF
1,Bruno,Bruno Brigido de Oliveira T(g),,P,305735 1 Mateus,Mateus Pasinato T(g),,P,331915
2,Lenon,Lenon Fernandes Ribeiro T,,P,184363 2 Magno Jose,Magno Jose da Silva T,,P,328949
3,Philipe Ma ...,Philipe Maia de Freitas T,,P,400192 3 Wesley,Wesley Ladeira Matos T,,P,306551
4,Edson,Edson Jose da Silva T,,P,166943 4 Diego,Diego da Silva Giaretta T,,P,158675
5,Andres,Andres Fernandes Gon ... T,,P,180842 5 Geovane,Geovane Batista de Faria T,,P,175223
6,Para,Anderson Ferreira da ... T,,P,393868 6 Helder,Helder Silva Santos T,,P,185482
7,Ricardo,Ricardo Ribeiro de Lima T,,P,179100 7 Mateus,Mateus Anderson Velo... T,,P,385571
8,Denner,Denner Nascimento da Luz T,,P,313937 8 Wellington,Wellington Rodrigues... T,,P,325913
9,Bruno Mendes,Bruno Pereira Mendes T,,P,374375 9 Felipe,Felipe de Sousa Silva T,,P,369768
10,Rafael Lon ...,Rafael Vinicius Carv ... T,,P,183844 10 Alan,Alan Cassio da Cruz T,,P,177957
11,Guilherme,Guilherme Nascimento ... T,,P,398332 11 Vinicius,Vinicius Leite Silva T,,P,303018
12,Lucas,Lucas Passarelli R(g),,P,354637 12 Rafael Santos,Rafael de Carvalho Santos R(g),,P,177436
13,Kevin,Kevin Peterson dos S ... R,,P,502001 13 Anderson,Anderson Luis Ribeir... R,,P,174145
14,Everton,Everton Paulo Strieder R,,P,302881 14 Naylhor,Naylhor Bispo de Sou... R,,P,186873
15,Anderson,Anderson de Jesus Santos R,,P,366405 15 Moacir,Moacir Costa da Silva R,,P,177354
16,Marcilio,Marcilio da Silva Miguel R,,P,379805 16 Dener,Dener Gonçalves Pinheiro R,,P,380325
17,Willian,Willian Osmar de Oli ... R,,P,334881 17 Reis,Isnairo Reis Silva Morais R,,P,370113
18,Rondinelly,Rondinelly de Andrad ... R,,P,300562 18 Eduardo,Eduardo Jose Barbosa... R,,P,321012
19,Erik,Erik Roberto Silva d ... R,,P,359496 19 Ramon,Ramon Machado de MacedoR,,P,295017
20,Anselmo RamonAnselmo Ramon Alves  ...,R,,P,182466 20 Alex Henrique,Alex Henrique Jose R,,P,181845
21,Caique,Caique Venancio Lemes R,,P,312438,,,,
22,Matheus,Matheus Oliveira Santos R,,P,352481,,,,
"",,Comissão Técnica,
"",Guarani / SP,,Vila Nova / GO
Técnico:,UMBERTO LOURENCO LOUZER FILHO,Técnico:,Hemerson Jose Maria
Auxiliar Técnico:,CAIO MAURICIO FALCAO DE MELLO,Auxiliar Técnico:,EMERSON PEREIRA NUNES
Médico:,MARCOS AMSTALDEN BARROS,Médico:,CAIRO ALBERTO DE FREITAS
Treinador De Goleiros:,NARCISO FRANCISCO MORA MARSILLI,Treinador De Goleiros:,JONAS SAMPAIO DE ALMEIDA FILHO
Preparador Físico:,FELIPE GARCIA CELIA,Preparador Físico:,RENAN DE LIMA PINTO
Massagista:,HENRIQUE ANDELIERI DA SILVA,Massagista:,ALMIR CARLOS DE SOUSA
"",,,,,Gols,
Tempo,1T/2T,No,Tipo,Nome do Jogador,,Equipe
30:00,2T,7,NR,Ricardo Ribeiro de Lima,,Guarani/SP
+5,2T,20,PN,Alex Henrique Jose,,Vila Nova/GO
"",,,,Substituições,
Tempo,1T/2T,,Equipe,Entrou,Saiu
45:00,INT,Guarani/SP,,21 - Caique Venancio Lemes,8 - Denner Nascimento da Luz
23:00,1T,Vila Nova/GO,,18 - Eduardo Jose Barbosa da Silv...,11 - Vinicius Leite Silva
14:00,2T,Guarani/SP,,20 - Anselmo Ramon Alves Herculano,11 - Guilherme Nascimento de Castro
22:00,2T,Vila Nova/GO,,20 - Alex Henrique Jose,10 - Alan Cassio da Cruz
36:00,2T,Vila Nova/GO,,19 - Ramon Machado de Macedo,8 - Wellington Rodrigues dos Reis
38:00,2T,Guarani/SP,,17 - Willian Osmar de Oliveira Si...,10 - Rafael Vinicius Carvalho Lon...
