Campeonato:,Campeonato Brasileiro - Série B/2018,,Rodada:,30
Jogo:,Avaí / SC X Boa / MG,,,
Data:,05/10/2018 Horário: 20:30 Estádio:,Aderbal Ramos da Silva / Florianopolis,,
"",,Arbitragem
Arbitro:,Marielson Alves Silva (AB / BA),
Arbitro Assistente 1:,Jose Carlos Oliveira dos Santos (AB / BA),
Arbitro Assistente 2:,Marcos Welb Rocha de Amorim (AB / BA),
Quarto Arbitro:,Diego da Costa Cidral (INT / SC),
Delegado Local:,Manoel de Paula Machado (CBF / ),
Analista de Campo:,Marco Antônio Martins (CBF / SC),
"",,,Cronologia,,,
"",1o Tempo,,2o Tempo,,,
Entrada do mandante:,20:21Atraso:,,Não Houve Entrada do mandante: 21:30,,Atraso:,Não Houve
Entrada do visitante:,20:19Atraso:,,Não Houve Entrada do visitante: 21:30,,Atraso:,Não Houve
Início 1o Tempo:,20:30Atraso:,,Não Houve Início do 2o Tempo: 21:32,,Atraso:,Não Houve
Término do 1o Tempo:,21:17Acréscimo:,,2 min Término do 2o Tempo: 22:20,Acréscimo:,,3 min
Resultado do 1o Tempo: 1 X 0,,,Resultado Final: 2 X 0,,,
"",,,,,Relação de Jogadores,,,,
"",,Avaí / SC,,,,Boa / MG,,,
No,Apelido,Nome Completo T/R,,P/A,CBF No Apelido,Nome Completo T/R,,P/A,CBF
1,Mauricio,Mauricio Kozlinski T(g),,P,296645 1 Fabricio,Fabricio Barros Santana T(g),,P,178321
3,Ebert Will ...,Ebert Willian Amancio T,,P,144059 2 Helder,Helder Maurilio da S... T,,P,179928
10,Marcos,Marcos Vicente dos Santos T,,P,156079 3 Rodrigo,Rodrigo de Souza Prado T,,P,301089
19,Renato,Jose Renato da Silva ... T,,P,306019 4 Rafael,Rafael da Cunha Jensen T,,P,391581
27,Rodrigão,Rodrigo Gomes dos Santos T,,P,398368 5 Djavan,Djavan Aulim Candido... T,,P,358911
66,Edson,Edson Carlos Santos  ... T,,P,339594 6 Jadson,Wender Jadson Silva ... T,,P,378939
80,Airton,Airton Tirabassi T,,P,306156 7 Maycon,Maycon Lucas Azevedo... T,,P,354866
93,Judson,Judson Silva Tavares T,,P,313767 8 Philippe,Philippe Guimarães T,,P,306605
94,Matheus,Matheus Barbosa Teixeira T,,P,344228 9 Douglas Ba ...,Douglas Baggio de Ol... T,,P,363149
98,Claudio,Claudio Rodrigues Gomes T,,P,317445 10 Wiliam Barbio,Wiliam Silva Gomes Barbio T,,P,307680
99,Getulio,Getulio Wandelly Sil ... T,,P,350899 11 Alyson,Alyson Santos Silva T,,P,432166
13,Leonardo,Leonardo Thomas Lopes R(g),,P,442577 12 Darley,Darley Ramon Torres R(g),,P,178158
2,Igor Ferna ...,Igor Fernandes da Si ... R,,P,320984 14 Thallyson,Thallyson Gabriel Lo... R,,P,465539
6,Pedro Henr ...,Pedro Henrique de Ca ... R,,P,297781 15 Gabriel,Gabriel Arantes de Souza R,,P,392668
8,Jones da S ...,Jones da Silva Lopes R,,P,189999 16 Bruno,Bruno Nunes de Barros R,,P,308190
20,Carlos,Carlos Alberto da Si ... R,,P,305404 17 DANIEL CRUZ,Daniel Paulo da Cruz R,,P,316173
21,Luan Pereira,Luan Martins Pereira R,,P,526236 18 Cloves,Cloves Conceicao de Souza R,,P,293682
22,Iury,Iury de Oliveira Nas ... R,,P,399087 19 Manoel Cri ...,Manoel Cristiano Rib... R,,P,187984
26,Edu,Eduardo Kunde R,,P,364057 20 Kaio Cristian,Kaio Cristian Gomes ... R,,P,453528
28,Daniel,Daniel Amorim Dias d ... R,,P,325581 21 Gabriel Du ...,Gabriel Duarte Lustosa R,,P,500562
44,Marcão,Marcos Eduardo Costa R,,P,184860,,,,
77,Gabriel,Gabriel Farias de Lima R,,P,539022,,,,
"",,Comissão Técnica,
"",Avaí / SC,,Boa / MG
Técnico:,EUGENIO MACHADO SOUTO,Técnico:,RONEIVALDO DA MATA SOARES
Auxiliar Técnico:,EVANDO SPINASSE CAMILLATO,Auxiliar Técnico:,CARLOS CESAR FELIX BARBOSA
Médico:,LUIS FERNANDO ZUKANOVICH FUNCHAL,Médico:,EDUARDO DARUGE NETO
Treinador De Goleiros:,ANDRE CRODA BORGES,Treinador De Goleiros:,JULIO JOSE CARDOSO DA SILVA
Preparador Físico:,JAELSON GONCALVES ORTIZ,Preparador Físico:,ALTAMIR VICENTE FERREIRA JUNIOR
Massagista:,DELMAR DA ROSA PEREIRA,Massagista:,ANTONIO MARCOS DE PAULA
"",,,,,Gols,
Tempo,1T/2T,No,Tipo,Nome do Jogador,,Equipe
34:00,1T,99,NR,Getulio Wandelly Silva Timoteo,,Avaí/SC
42:00,2T,21,NR,Luan Martins Pereira,,Avaí/SC
"",,,,Substituições,
Tempo,1T/2T,,Equipe,Entrou,Saiu
45:00,INT,Boa/MG,,16 - Bruno Nunes de Barros,8 - Philippe Guimarães
14:00,2T,Boa/MG,,17 - Daniel Paulo da Cruz,10 - Wiliam Silva Gomes Barbio
20:00,2T,Avaí/SC,,21 - Luan Martins Pereira,10 - Marcos Vicente dos Santos
22:00,2T,Boa/MG,,19 - Manoel Cristiano Ribeiro Lemes,11 - Alyson Santos Silva
37:00,2T,Avaí/SC,,8 - Jones da Silva Lopes,99 - Getulio Wandelly Silva Timoteo
42:00,2T,Avaí/SC,,6 - Pedro Henrique de Castro Silva,19 - Jose Renato da Silva Junior
